Article Title,Article Link,Article Text,Article Summary,Article Image
Budget 2024 adopts multifaceted approach to bolstering manufacturing sector,https://timesofindia.indiatimes.com/business/india-business/budget-2024-adopts-multifaceted-approach-to-bolstering-manufacturing-sector/articleshow/112216383.cms,"While the overall outlook is positive, the extension of tax benefits under Section 115BAB for manufacturing entities and the absence of new PLI schemes are notable omissions. (AI image)

By Saurabh Agarwal and Mohit Sharma

inter alia

(Saurabh Agarwal is Partner, EY India and Mohit Sharma is Director, EY India)

Budget 2024 for manufacturing sector : The recent Union Budget has struck a balance between fiscal consolidation and stimulating economic growth. While the middle class has been offered tax relief, the government's primary focus remains on judicious spending to maximize economic impact. The budget's core themes are employment, skilling, MSME development, and support for the middle class.Largely focus has remained intact on spending money judiciously to ensure that each penny spent creates a ripple effect in the entire economic landscape.Although at first glance, manufacturing might appear to have taken a backseat, a deeper analysis reveals a multifaceted approach to bolstering the sector. Initiatives like employment-linked benefits and internship programs, while primarily aimed at job creation and skill development, indirectly benefit manufacturing companies by expanding the talent pool.Extensive focus on the MSME manufacturing units by way of extending term loan facility for purchase of machinery and equipment without collateral or third-party guarantee, would help companies in augmenting their capital base/ capacity and strengthen the very foundation of the manufacturing ecosystem in the country. Development of a new credit-assessment model by Public Sector Banks to assess MSME credit shall provide much needed regulatory relief to the units.With respect to the large manufacturing entities, while there is no direct fiscal/ tax incentive introduced in this budget, some support has been provided with an extensive focus on development of ‘industrial parks’ in nearly 100 cities under the ‘plug and play’ model. Reforms proposed with respect to land administration, planning and management, shall also ease out acquisition related difficulties often faced by entrepreneurs/ business houses in acquiring lands for manufacturing set-ups.Targeted Customs duty interventions like, rationalization of Customs duty provisions in Mobile phone manufacturing setups, extension of Customs duty exemption on import of capital goods for manufacturing of solar cells and panels, full Customs duty exemption on import of 25 critical minerals,, shall provide the required impetus for enhancing domestic manufacturing environment.Governments’ focus on formulating an Economic Policy Framework to set the scope for next-gen reforms in the country, has a target to improve the productivity of factors of production, namely, land, labour, capital, entrepreneurship and technology. This shall pave the way for enabling achievement of a target of 25% manufacturing sector contribution to the nation’s GDP over the course of next 7-10 years.While the overall outlook is positive, the extension of tax benefits under Section 115BAB for manufacturing entities and the absence of new PLI schemes are notable omissions.The country’s manufacturing base is expanding as is reflective from the continuously increasing tax collections and expanding Purchasing Manager’s Index. It would be pertinent to see how the ground realities evolve vis-à-vis the vision envisaged, in the upcoming Financial Year.","While the overall outlook is positive, the extension of tax benefits under Section 115BAB for manufacturing entities and the absence of new PLI schemes are notable omissions. Initiatives like employment-linked benefits and internship programs, while primarily aimed at job creation and skill development, indirectly benefit manufacturing companies.","https://static.toiimg.com/thumb/msid-112217166,imgsize-155104,width-400,resizemode-4/112217166.jpg"
How Budget 2024 aims to ignite the Viksit Bharat engine,https://timesofindia.indiatimes.com/business/india-business/how-budget-2024-aims-to-ignite-the-viksit-bharat-engine/articleshow/112220308.cms,"Union Budget 2024 aims to focus largely towards strengthening the Make in India initiative. (AI image)

By Bipin Sapra and Smritikona Dutta

(Bipin Sapra and Smritikona Dutta are Tax Partners at EY India)

Budget 2024: Armed with the vision to propel India to become a developed country by 2047, the Union Budget 2024 aims to focus largely towards strengthening the Make in India initiative and ease of doing business thereby providing the required stimulus to the manufacturing sector and enabling large scale job creation.On the Indirect tax front, the industry welcomes the much-needed announcement for a comprehensive review of the rate structure under Customs enabling ease in product classification and dispute reduction.The proposal of lowering of Customs duty on a plethora of raw materials and products including solar cells, critical minerals and bullion are encouraging measures. The rationale behind such reduction clearly indicates support towards domestic manufacturing, deepening value addition and supporting targets in reducing carbon footprint.Relevant amendments under the Customs law have been made to provide increased time limits for re-imports and re-exports to enhance competitiveness of the fledgling MRO sector. The government has extended significant duty reduction and exemption benefits to the healthcare and electronics sectors, continuing the impetus of incentives provided under the Production Linked Incentive (PLI) scheme.Since their introduction in March 2020, the PLI schemes have indeed supported in revitalizing the manufacturing sector and strengthening the necessary supply chains. The success achieved in the mobile manufacturing sector has now enabled the Government to reduce customs duties on mobile phones and components, signalling a mature environment. The Budget proposals aim at reproducing similar outcomes for semiconductor and pharmaceutical industry by increasing the budgetary allocation.Buoyed by the increasing revenue collection under GST signalling a shift towards a mature tax regime, this Budget has harmonized the timeframes for the issuance of demand notices and adjudication orders for cases involving fraud, suppression or otherwise. Significant amendments to the GST legislations have been introduced reflecting the recommendations proposed by the GST Council such as regularizing non-levy of GST due to general practice which may turn out to be a breather for certain impacted industries reeling under huge tax demands.The Insurance sector has been provided much relief through the GST council recommendations which have been cemented in the present budget thereby ending long standing disputes on their business practices.The Government's efforts to push forward with its reform agenda are evident as plans to incentivize states for their business reform actions plans and digitalization through the Jan Vishwas Bill 2.0 is proposed. Further, setting up of e-commerce export hubs is envisaged to facilitate easier access to international markets for domestic players.The recent implementation of Budget proposals allows the government to maintain momentum in its reform agenda. These policy measures implicitly reaffirm the significance of India Inc as a crucial element in the development of infrastructure. However, there are still some expectations required to be met to march towards a Viksit Bharat 2047.",Union Budget 2024 aims to focus largely towards strengthening the Make in India initiative and ease of doing business. The industry welcomes the much-needed announcement for a comprehensive review of the rate structure under Customs enabling ease in product classification and dispute reduction. The government has extended significant duty reduction and exemption benefits to the healthcare and electronics sectors.,"https://static.toiimg.com/thumb/msid-112220331,imgsize-83318,width-400,resizemode-4/112220331.jpg"
How Budget 2024 announcements will spur balanced growth of real estate sector,https://timesofindia.indiatimes.com/business/india-business/how-budget-2024-announcements-will-spur-balanced-growth-of-real-estate-sector/articleshow/112211761.cms,"By Binaifer Jehani and Abbas Master

A look at the five key focus areas of this budget reveals the good augury.

Affordable housing

through

(PMAY)

Digitalisation and transparency: Stamp duty rationalisation and land-related reforms

Boost to urban and industrial development with focus on industrial workers

Reduction of capital gains tax, with removal of indexation benefits

Rural connectivity and development

Binaifer Jehani is Business Head - MI&A Assessments, CRISIL Ltd and Abbas Master is Associate Director - MI&A Assessments, CRISIL Ltd.

Budget 2024 : Real estate, a significant contributor to employment generation, has received a fair bit of attention in Budget 2024-25. Recent years have seen the sector transform rapidly, driven by factors such as favourable government policies, Real Estate (Regulation and Development) Act, 2016, strong economic growth and changing consumer preferences.Added to that, the budgetary focus on job creation, skilling and employment-linked incentives, infrastructure, urban development, rural connectivity, digitalisation and land-related norms, all dovetail to promote growth of the sector.Launched in June 2015, the PMAY aims to provide affordable housing to all eligible beneficiaries. The budget unveiled PMAY Urban 2.0, under which the housing needs of 1 crore urban poor and middle class will be addressed with an investment of Rs 10 lakh crore.The central government’s additional Rs 2.2 lakh crore injection in the next 5 years to make housing more affordable has the potential to revitalise the affordable housing market.Such an approach can play an important role in realising the government's vision of Housing for All and push growth and development. Hence, the significant investment under PMAY Urban 2.0 is expected to alleviate urban housing deficits, spurring construction and economic growth.Steps to introduce technological reforms within the regulatory framework for land, such as digitalisation or GIS mapping of land records, will improve transparency.Rationalisation of stamp duty across states will also be critical to bring in uniformity and initiate land-related reforms such as urban planning, usage and building bylaws.These are steps in the right direction and will boost growth. Moreover, they will improve the ease of property transactions and strengthen municipal finances through increased property taxes. Rationalization of stamp duty with an emphasis on women homebuyers may boost home-buyer sentiment in major cities, too.The budget has also given ample attention to urban and rural development, with rental housing for industrial workers through the public private partnership model, interest subsidies for rental housing, and transit-oriented developments.The proposal to develop investment-ready plug-and-play industrial parks in 100 cities may attract industrial investment, leading to increased demand for industrial real estate and support the growth of ancillary services and residential developments in these regions.Initiatives for industrial parks and rental housing for industrial workers align with the country’s manufacturing goals and addresses worker accommodation needs.These steps are expected to promote industrial growth and stability in labour-intensive sectors, while also creating new opportunities for real estate developers specialising in rental and affordable housing.The changes in long-term capital gains (LTCG) tax, however, have evoked a mixed reaction. The government lowered the long-term capital gains tax from 20% to 12.5%, which is a welcome step. However, this came with the removal of the indexation benefit.The changes could encourage more liquidity in property transactions and potentially increase the effective tax burden depending on the property’s acquisition date.The launch of Phase IV of the PM Gram Sadak Yojana in 25,000 rural habitations will improve connectivity in rural areas, promoting rural development and making these regions more accessible for investment. The primary objective of PMGSY is to build robust, all-weather roads in rural habitations. This initiative focuses on enhancing connectivity and supporting economic development in rural areas.In essence, the budget is geared towards stimulating growth and investment in the real estate sector , fostering a more transparent and investor-friendly environment, and contributing to overall development. It aims to create a balanced and inclusive growth environment by addressing the needs of various segments, including affordable housing, industrial workers and urban infrastructure.The effectiveness of the initiatives, however, hinges on their implementation and continued support of complementary reforms.","The budget unveiled PMAY Urban 2.0, under which the housing needs of 1 crore urban poor and middle class will be addressed with an investment of Rs 10 lakh crore. The budget has also given ample attention to urban and rural development, with rental housing for industrial workers through the public private partnership model.","https://static.toiimg.com/thumb/msid-112211854,imgsize-23260,width-400,resizemode-4/112211854.jpg"
New Budget 2024 rule: Why Income Tax Department is likely to issue a huge number of tax notices this month,https://timesofindia.indiatimes.com/business/india-business/new-budget-2024-rule-why-income-tax-department-is-likely-to-issue-a-huge-number-of-tax-notices-this-month/articleshow/112186079.cms,"Taxing Times

Income Tax Notice on the way? The Income Tax Department is gearing up to send out a large number of notices in the coming month, as there are concerns that many taxpayers might escape the tax net due to the impending implementation of the new reassessment law on September 1, 2024.According to the amended regulation announced in Budget 2024 , the tax authorities can only go back a maximum of five years to reassess a taxpayer's records if the escaped income is at least Rs 50 lakh, and three years for an amount less than Rs 50 lakh.Previously, they could reassess cases up to 10 years old.According to an ET report, tax officials are now faced with the challenge of compiling and corroborating data on tax and income mismatches for the financial years 2013-14 to 2017-18 within the next few weeks, as these years will become time-barred for reassessment from September 1, 2024.The I-T department relies on information from various sources, such as banks, property registrars, and search findings from the investigation wing, to build reassessment cases.A tax officers' body has raised concerns about the feasibility of issuing notices under Section 148 (or 148A) in a large number of cases within a single month, given the overburdened nature of the jurisdictional assessing officers and the time-consuming process of obtaining sanction from the chief commissioner, who is the specified authority for such notices.Moreover, the law provides taxpayers with the right to explain their position before reassessment orders are finalized, a process that most believe cannot be completed by the end of August.Also Read | ITR refund status for FY 2023-24: How to check income tax refund status online - here’s a step-by-step guide for incometax.gov.in & NSDL websites The Central Board of Direct Taxes ( CBDT ) has been urged by its officers to postpone the effective date of the proposed amendment. However, this suggestion is unlikely to be well-received by corporations and high net worth individuals.""Capping the reassessment period at five years was a great decision as it would reduce hassles and litigation. But if the department fears there could be a genuine loss of revenue as it may not be possible to wrap up several matters by August 31, the government can think of strict parameters where time-bound cases can be selectively reopened - based on trails of steps taken in identifying escaped income,"" said Mitil Chokshi, partner at CA firm Chokshi & Chokshi.""Taxpayers may expect a rush of reassessment notices in August 2024. These notices are likely to be for the AYs 2018-19 and prior to that. It is pertinent to note that the Bombay High Court in a recent ruling in a case of Hexaware Technologies has taken a view on a proviso introduced in 2021, which can be interpreted to mean that AY 2017-18 (and prior years) got time barred on March 31, 2024. These reassessment notices (for AYs 2017-18 and prior) are likely to rake up new interpretation issues in the already muddled reassessment provisions,"" said Ashish Mehta, partner at law firm Khaitan & Co.The current situation is similar to the conflict between the Income Tax office and taxpayers in 2021. The reassessment law was amended in April 2021, allowing the tax office to reopen 10-year-old tax returns if the total undisclosed income exceeded Rs 50 lakh and reassess 4-year-old matters if the amount was less than Rs 50 lakh.Also Read | Latest NPS rules 2024: How much tax will you save with new NPS contribution benefit under new regime after Budget 2024? However, this change led to over 10,000 writ petitions being filed by companies, arguing that they were not given sufficient time to explain and that the notices were issued without considering the carve-out that cases which couldn't be reopened earlier couldn't be reassessed under the new law.The Supreme Court invoked its extraordinary powers under Article 142 of the Constitution on May 4, 2022, to uphold all reassessment notices issued after March 31, 2021. However, the court left room for judicial proceedings based on the merits of each case, and several such matters are currently pending before the court.","The Income Tax Department is gearing up to send out a large number of notices in the coming month. There are concerns that many taxpayers might escape the tax net due to the impending implementation of the new reassessment law on September 1, 2024. The tax authorities can only go back a maximum of five years to reassess a taxpayer's records if the escaped income is at least Rs 50 lakh.","https://static.toiimg.com/thumb/msid-112186146,imgsize-55630,width-400,resizemode-4/112186146.jpg"
Budget 2024 three times UPA's last Budget in 2014: PM Narendra Modi at CII post-Budget conference,https://timesofindia.indiatimes.com/business/india-business/budget-2024-prime-minister-narendra-modi-address-at-cii-post-budget-conference-top-takeaways-highlights/articleshow/112129118.cms,"Budget 2024: PM Modi said that the capital expenditure allocation under his governments has grown manifold.

Budget 2024: Prime Minister Narendra Modi on Tuesday addressed a CII post- Budget 2024 conference, stating that in 10 years, his government has tripled India’s Budget. The last Budget presented by the Manmohan Singh government in 2014 was of Rs 16 lakh crore. Ten years later, the Union Budget 2024 presented by us a few days ago is Rs 48 lakh crore, which is three times, Modi said.Modi also said that the capital expenditure allocation under his governments has grown manifold.""Capital expenditure is called the biggest productive medium of resource investment,"" he said at the ‘Journey Towards Viksit Bharat: A Post Union Budget 2024-25' conference. In 2004, the capex allocation of UPA’s first Budget was Rs 90,000 crore. This increased to only Rs 2 lakh crore in the last UPA budget in 2014, Modi said. At present the capex allocation is over Rs 11 lakh crore, Modi added. Modi pointed out that the capex allocation of railways and highways has become 8 times under his government. PM Modi said that India, which is currently the world’s fifth largest economy, will soon become the third largest. He also noted the time when India had been ranked among the ‘Fragile Five’ economies in the world. Modi said that his governments have progressively helped India move from a state of vulnerability to a place of strength.PM Modi also said that in a world where most economies are struggling with low growth and high inflation, India stands out as an economy which is seeing high economic growth and low inflation. He also said that India's fiscal prudence has become an example for the world to see.Modi spoke of the government's initiatives to transform the manufacturing sector of the economy with steps like 'Make in India', Production Linked Incentive (PLI) schemes, liberalisation of FDI norms, setting up of multi-modal logistics hubs.Finance Minister Nirmala Sitharaman presented the first Union Budget of the newly elected NDA government on July 23, 2024.","PM Narendra Modi said that in 10 years, his government has tripled India’s Budget. The last Budget presented by the Manmohan Singh government in 2014 was of Rs 16 lakh crore. The Union Budget 2024 presented by us a few days ago is Rs 48 lakh crore, which is three times.","https://static.toiimg.com/thumb/msid-112129130,imgsize-28096,width-400,resizemode-4/112129130.jpg"
