Article Title,Article Link,Article Text,Article Summary,Article Image
Retail investors should avoid F&O trading: NSE chief,https://timesofindia.indiatimes.com/business/india-business/retail-investors-should-avoid-fo-trading-nse-chief/articleshow/111010085.cms,"New Delhi: NSE chief Ashishkumar Chauhan on Friday cautioned retail investors against trading in derivatives and suggested them to invest in equities through mutual fund route.

He emphasized that trading in futures & options (F&O) derivatives should be limited to informed investors who can manage risk and comprehend the market. Recently, finance minister Nirmala Sitharaman and chief economic advisor V Anantha Nageswaran flagged the growing risk of F&O trading for retail investors. In November 2023, Sebi chief Madhabi Puri Buch also cautioned investors against heavy bets on F&O.

""Retail investors should not participate in F&O trading. They should invest in equities through mutual fund route,"" Chauhan, MD and CEO of NSE, said at an event here. He cautioned that while derivatives have their utility, it should only be traded by those who fully understand the risks and have the capacity to manage them. Those lacking this understanding or risk appetite should avoid derivatives trading. Despite this, F&O trading continues to grow in popularity, driven by the potential for profit and the rising trading volumes. agencies

",NSE chief Ashishkumar Chauhan on Friday cautioned retail investors against trading in derivatives. He suggested them to invest in equities through mutual fund route. He emphasized that trading in futures & options (F&O) derivatives should be limited to informed investors who can manage risk and comprehend market.,"https://static.toiimg.com/thumb/msid-111010127,imgsize-5920,width-400,resizemode-4/111010127.jpg"
"TCS blames skill gap for 80,000 vacancies",https://timesofindia.indiatimes.com/business/india-business/tcs-blames-skill-gap-for-80000-vacancies/articleshow/111009987.cms,"Bengaluru: In a recent town hall , Amar Shetye, the global operations head of TCS 's resource management group (RMG), revealed that the company has 80,000 open positions and they're yet to fill those roles due to a yawning skills gap.

Shetye mentioned that there is a mismatch between the skills possessed by employees and the roles in demand. RMG is responsible for allocating resources to projects, and in the event of a shortfall, they fill those requirement through contractors.

An employee who attended the townhall anonymously shared with TOI that, ""We were told that either skillsets or employee aspirations are not matching project requirements."" TCS did not respond to TOI's email seeking comment till the time of going to press.

","TCS has 80,000 open positions and they're yet to fill those roles due to a yawning skills gap. RMG is responsible for allocating resources to projects, and in the event of a shortfall, they fill those requirement through contractors. TCS did not respond to TOI's email seeking comment.","https://static.toiimg.com/thumb/msid-111010026,imgsize-23552,width-400,resizemode-4/111010026.jpg"
"Budget 2024: All eyes on FM Sitharaman for next-generation reforms to sustain growth, create jobs",https://timesofindia.indiatimes.com/business/budget/budget-2024-all-eyes-on-fm-sitharaman-for-next-generation-reforms-to-sustain-growth-create-jobs/articleshow/110896660.cms,"Budget 2024: The Union Budget 2024 , likely to be presented by Finance Minister Nirmala Sitharaman in early July, is expected to outline the Narendra Modi government 's vision for the next five years. It will also be closely monitored for the next-generation reforms that the finance minister announced in the interim budget in February.As Sitharaman returns to North Block, the NDA government is placing a strong emphasis on continuity. Her immediate priority is to prepare the comprehensive budget for FY25, states an ET report.Sitharaman's primary objectives will be to maintain high growth rates, make growth more inclusive, and generate employment opportunities. Streamlining the Goods and Services Tax (GST) is expected to be a top priority, along with simplifying tax compliance procedures.Also Read | Budget 2024: Modi 3.0 government to focus on job creation and private investment growth - details here In FY24, India achieved an impressive growth rate of 8.2%, reinforcing its position as the fastest-growing major economy in the world. The focus will now shift to propelling the country to even higher levels of growth, in accordance with the Viksit Bharat (developed India) vision, while placing greater emphasis on job creation and boosting private investment.In February, Sitharaman presented a vote on account without any pre-election giveaways, aiming for a fiscal deficit of 5.1% of GDP in FY25. She will face the challenge of managing fiscal pressures within the new coalition government while addressing the growing demand for cash transfers to alleviate rural distress, which has been advocated by opposition parties.The BJP-led NDA secured 293 seats in the 543-seat lower house of Parliament, with the BJP alone winning 240 seats, falling short of the majority mark of 272.On Monday, Nirmala Sitharaman, who is serving her second term as finance minister, wasted no time in getting started. She released two tax devolution instalments, amounting to Rs 1,39,751 crore, to 28 states to support their development and capital expenditure, instead of the usual single instalment.Also Read | Why did RBI bring 100 tonnes of gold reserves back to India? RBI governor Shaktikanta Das explains Shortly after the first meeting of the newly appointed Cabinet on Monday evening, the minister met with finance secretary TV Somanathan and economic affairs secretary Ajay Seth to assess the economic and fiscal condition of the states.The interim budget for FY25 allocated Rs 12.20 lakh crore for tax devolution. With this release, the total amount devolved in this fiscal year has reached Rs 2,79,500 crore.Sitharaman, a Rajya Sabha member from Karnataka, has held significant portfolios in the Modi governments, including serving as the defence minister and the minister for commerce and industry with independent charge. According to a statement from the President's office on Monday, she will also be responsible for the corporate affairs ministry.During her previous tenure at the finance ministry, Sitharaman, aged 64, navigated the economy through the Covid-19 pandemic by implementing the ""Aatmanirbhar (self-reliant) Bharat"" package and introducing measures such as production-linked incentive schemes for various sectors while maintaining fiscal prudence. Increasing capital expenditure to support the economy until private investment gained momentum contributed to the strong economic recovery.","Nirmala Sitharaman, who is serving her second term as finance minister, wasted no time in getting started. She released two tax devolution instalments, amounting to Rs 1,39,751 crore, to 28 states to support their development and capital expenditure.","https://static.toiimg.com/thumb/msid-110897713,imgsize-101290,width-400,resizemode-4/110897713.jpg"
Budget 2024: Modi 3.0 government to focus on job creation and private investment growth,https://timesofindia.indiatimes.com/business/budget/budget-2024-modi-3-0-government-to-focus-on-job-creation-and-private-investment-growth-details-here/articleshow/110866520.cms,"Bharat Blueprint

Union Budget 2024 : The Narendra Modi-led NDA government is set to prioritize India's economic growth momentum while implementing targeted policies to generate employment opportunities and bolster private investment , according to individuals familiar with early discussions on reforms.According to an ET report by Deepshikha Sikarwar, the Modi government's long-term strategy will incorporate elements from the five-year plans and the vision document aimed at transforming India into a developed nation by 2047, while the immediate plan will build upon the agenda prepared for the first 100 days before the elections.The Union Budget 2024, expected to be unveiled in early July, will outline specific measures to achieve these objectives.""The focus would be to promote labour-intensive growth that will create jobs , with continued emphasis on macroeconomic stability,"" a top government official aware of the details told the financial daily.The government is considering various initiatives related to startups and taxation, including the correction of inverted duty structures and the rationalization of GST rates.The expansion of production-linked incentive (PLI) schemes to encompass more sectors that generate substantial employment, such as the leather industry, is under consideration. Another individual privy to the discussions said that the government's ongoing support for capital expenditure will continue to encourage private investment.The newly elected government is likely to maintain its focus on emerging sectors like green energy, mobility, and technology, which have the potential to generate employment opportunities for the country's youth. Job creation was a significant issue during the recent elections.Following the targeted recruitment drive to hire 1 million individuals in FY24, the government is expected to reveal plans to expedite the filling of vacant positions within its ranks.Also Read | ‘Vande Bharat Bullet Train’ soon? Indian Railways looks to roll out ‘Make in India’ bullet trains with 250 kmph speed this year Additionally, a significant initiative aimed at improving the ease of doing business in areas that directly impact the common man is likely to be introduced, according to a second source.India's economy expanded by 8.2% in FY24, supported by a 7.8% growth in the March quarter, as per recently released official data.A third official said that the government would also prioritize strengthening the domestic economy to mitigate risks posed by geopolitical factors.Aditi Raman, an associate economist at Moody's Analytics, was quoted as saying ""The Union budget, due in the September quarter, will be an early indicator of policy priorities, including short- and long-term responses to some of those key economic challenges.""Also Read | India big gainer from China plus one strategy! 'Exports to almost double to $835 billion'; here’s why Due to time constraints, the new government may refrain from introducing substantial tax reforms, reserving them for the next budget in February 2025. However, various adjustments are being considered to create a more taxpayer-friendly regime.Over the past two months, the finance ministry has conducted extensive stakeholder consultations to enhance the ease of doing business. ""Internal discussions have been undertaken to identify thrust areas for both the short- and long-term,"" said one of the officials, adding that some manifesto promises, such as the expansion of Ayushman Bharat, could be announced immediately.","The Union Budget 2024, expected to be unveiled in early July, will outline specific measures to achieve these objectives. The focus would be to promote labour-intensive growth that will create jobs, with continued emphasis on macroeconomic stability. The government is considering various initiatives related to startups and taxation.","https://static.toiimg.com/thumb/msid-110868030,imgsize-117250,width-400,resizemode-4/110868030.jpg"
"Interim Budget 2024: A trailer of the visionary roadmap for ""Viksit Bharat""",https://timesofindia.indiatimes.com/business/budget/interim-budget-2024-a-trailer-of-the-visionary-roadmap-for-viksit-bharat-key-tax-proposals-to-know/articleshow/107449222.cms,"By Ravi Jain

Key tax proposals in Budget 2024:

Retained tax rates:

Waiver of old tax demands:

Extension of sunset clauses:

Tax collection at source:

Extension of Faceless Scheme time limit:

(Ravi Jain is Partner, Vialto Partners. Vikas Narang, Director and Pawan Digga, Manager at Vialto Partners contributed to the article. Views are personal)

The finance minister set the stage for a ""Viksit Bharat by 2047"", on the core principles of ‘Sabka Saath’, ‘Sabka Vikas’, ‘Sabka Vishwas’, with ‘Sabka Prayas’ being added as a new theme in the interim Budget.This Budget's four core strategic areas came as GYAN: G for Garib Kalyan, Y for Youth empowerment, A for Anna-data i.e., farmer welfare and N for Nari utthan i.e., support for women entrepreneurs. These form the pillars of a comprehensive inclusive development. The Government's commitment to sustainable development under the strategy for Amrit Kaal includes achieving 'Net Zero' by 2070, rooftop solarization for one crore households and robust health initiatives.The Indian economy's resilience takes center stage amidst positive indicators of declining current account deficit as a percentage of GDP, falling unemployment rates, and a notable rise in digital transactions. These statistics affirm the robustness of the economy, showcasing a trajectory of growth and stability.The achievements in taxation reforms are nothing short of remarkable, with direct tax collections more than trebling in the last decade, the number of tax return filers increasing by 2.4 times, average processing time of tax returns plummeting from 93 days in FY 2013-14 to an impressive 10 days in FY 2023-24, resulting in issuance of quick refunds. These are the results of consistent progressive measures thus obviating the need for, and rightly avoiding, any last-minute populist measures.No change in existing tax rates, both for direct and indirect taxes, is a good indicator of stability and predictability for investors and taxpayers.A welcome move to waive outstanding tax demands that are minor, disputed, and unreconciled. This involves the withdrawal of outstanding direct tax demands up to Rs. 25,000 pertaining to the period up to FY 2009-10 and up to Rs.10,000 for FY 2010-11 to 2014-15.The Government's commitment to fostering a business-friendly environment is evident in its intent to extend specific tax benefits for start-ups, investments by sovereign wealth funds/ pension funds, and certain IFSC units. The extension has been made now until March 31, 2025. This might help in creating a conducive landscape for business.To align with the CBDT notification issued earlier, the provisions relating to tax collection at source concerning remittances under the Liberalized Remittance Scheme have now been formally incorporated in the Finance Bill, 2024, setting the rate at 20% for amounts exceeding Rs. 7 lakhs in a financial year.The Finance Bill, 2024 proposes an extension of the time limit for introducing the faceless scheme by the Central Government for transfer pricing proceedings, DRP Proceedings, and ITAT Proceedings, up to March 31, 2025.The interim Budget 2024 may not have proposed significant tax announcements, but it very well positioned the prelude to the full budget post the upcoming elections. Considering the potential impact on the population across the four pillars of GYAN, a sizable portion of India stands to be covered. The interim Budget’s focus on the tax front resembles a report card, highlighting the maturity achieved by our tax system. The enhancement of taxpayer services was emphasized as a key priority.","This Budget's four core strategic areas came as GYAN: G for Garib Kalyan, Y for Youth empowerment, A for Anna-data and N for Nari utthan. These form the pillars of a comprehensive inclusive development. The Government's commitment to sustainable development under the strategy for Amrit Kaal includes achieving 'Net Zero' by 2070.","https://static.toiimg.com/thumb/msid-107449351,imgsize-22516,width-400,resizemode-4/107449351.jpg"
Interim Budget for a Viksit Bharat: It’s for everyone and all,https://timesofindia.indiatimes.com/business/budget/interim-budget-for-a-viksit-bharat-its-for-everyone-and-all/articleshow/107497439.cms,"By Akhilesh Tuteja

(The author is Partner and Head, Clients and Markets, KPMG in India)

The Finance Minister on February 01, 2024, delivered a truly innovative interim budget. At first glance, it did not seem like an interim budget but looked more like the budget to drive further growth and a continuum of inclusive growth-oriented investments.At the outset, this budget brings a wonderful balance between fiscal prudence and continued investment for growth. It's not easy to continue the glide path of reducing the fiscal deficit and continuing to make significant investments in all areas including infrastructure, R&D, energy transition, technology, skilling, and social welfare. The surprising reduction in fiscal deficit of 5.8% as against the budgeted 5.9% for FY24 and the projection of 5.1% in FY25 with a clear focus on increasing investments was a huge positive.This was a budget for everyone and all because it caters to every part of the Indian economy and society. The FM has carefully catered to the investment needs of various sectors. The continued focus on youth, impoverished, women and farmers to increase their involvement and contribution to economic growth is evident. By committing an 11.1% increase in capital expenditure to 11,11,111 lakh crore, the FM has clearly brought every single 1 in this growth journey.What was very impressive was the inclusion strategy of the government. The focus on women's empowerment for the past few years is unprecedented, which is reflected in the inclusion of women in the workforce moving from 23.3% to 37% in the last five years. The thirty crore Mudra Yojna loans to women entrepreneurs were a great boost to the Nari Shakti initiative. We already have over 10 million Lakhpati Didis and what is truly evident is like a corporate CFO, the FM has revised the earlier target of 20 million Lakhpati Didis to 30 million. The government also plans to invest in initiatives to encourage young girls between the ages of 9 and 14 to undertake the vaccination for cervical cancer which is again a great boost to Nari Shakti.A lot needs to be done to bring more women into all parts of economic growth but the journey so far and the vision of the future is truly inspiring.While India continues on its technological prowess and makes its mark in new technologies like Artificial Intelligence, we need a multi-pronged strategy to harness the power of AI. We need a clear focus on building AI systems in India so that we not only emerge as a global leader in this new era but can build models, which are specific to India that will benefit Indians. At the same time, we need a very wide coverage program to build skills to leverage AI to its fullest potential. The biggest contribution we can make to the inclusion of youth in the economic development of the country is by skilling them in new skill areas. In the last few years, the Skill India Mission has trained 14 million youth, reskilled over 5 million youth and established a staggering 3,000 new ITIs. The future of any country will depend as much on capital investments as on skill investments.The focus on agricultural development and support to the farmer continues through direct financial assistance to farmers. The farmers have benefited by getting crop insurance through PM Fasal Bima Yojana. It's not just the farmers, the PM-SVANidhi provides credit assistance to a large number of street vendors.The last few years have seen the journey of affordable housing through Pradhan Mantri Awas Yojana (PMAY). There is a slight increase in allocation to launch a scheme for encouraging the middle class to build or buy new homes. This investment will likely propel a wider economic development and increase employment.India has seen a tremendous rise in entrepreneurship in the last few years. In order to continue the journey and promote new startups, the government proposes to extend certain tax benefits, which are expiring from March 2024 to March 2025. The MSMEs have not been left behind. With a proposal to provide timely finances to such enterprises, the government has paved the way for their growth, so they can look to compete globally.All in all, it’s a truly inclusive budget with a clear focus on development not just by giving away freebies but enabling the people to participate in the economic development activity. While the FM calls the comprehensive GDP - Governance, Development & Performance – to me, this budget is inclusive of another GDP – gender, demography, and professions.","Akhilesh Tuteja is Partner and Head, Clients and Markets, KPMG in India. He says the budget brings a wonderful balance between fiscal prudence and continued investment for growth. The focus on women's empowerment for the past few years is unprecedented, he says.","https://static.toiimg.com/thumb/msid-107497505,imgsize-51586,width-400,resizemode-4/107497505.jpg"
Gender Budget Estimates Increase by 38.6% in 2024-25,https://timesofindia.indiatimes.com/business/budget/gender-budget-estimates-increase-by-386-in-202425/articleshow/107372175.cms,"NEW DELHI: The quantum of ‘gender budget’ estimates involving schemes for welfare and empowerment of women and children in 2024-25 has shown an increase of 38.6% when compared to Budget estimates of 2023-24.Moreover, 87% of this increase is owing to increased allocations for women and girls by seven ministries .The ministry of women and child development, drawing from the Interim Budget, said that “on the whole the share of gender Budget in total Union Budget increased to 6.5% in 2024-25 from 5% in 2023-24.”The Budget statement shows that 43 ministries, departments and Union Territories have reported a total of Rs 3.1 lakh crore in the gender Budget statement 2024-25 (Budget Estimates), as compared to over Rs 2.2 lakh crore in 2023-24. This is an increase of over 38% compared to last year.The majority of this increase is owing to increased allocations for women and girls by the ministries of — home affairs; electronics and information technology; new and renewable energy; micro, small and medium enterprises; petroleum and natural gas; department of drinking water and sanitation, and department of rural development.Minister for women and child development Smriti Irani said on X, “This strategic allocation aligns seamlessly with our vision of women-led development, setting the foundation for a truly Viksit Bharat by 2047.”",The quantum of ‘gender budget’ estimates involving schemes for welfare and empowerment of women and children in 2024-25 has shown an increase of 38.6% when compared to Budget estimates of 2023-24. 87% of this increase is owing to increased allocations for women and girls by seven ministries.,"https://static.toiimg.com/thumb/msid-107372266,imgsize-903167,width-400,resizemode-4/107372266.jpg"
