Article Title,Article Link,Article Text,Article Summary,Article Image
"Stock market today: BSE Sensex opens over 350 points down; Nifty50 below 24,650",https://timesofindia.indiatimes.com/business/india-business/stock-market-today-bse-sensex-nifty50-october-18-2024-dalal-street-indian-equities-global-markets/articleshow/114333524.cms,"The market sentiment has been negatively impacted by the release of rising CPI inflation data this week and the persistent selling by FIIs. (AI image)

Stock market today : Indian equity benchmark indices, BSE Sensex and Nifty50, opened in red on Friday. While BSE Sensex went below 80,700 level, Nifty50 was below 24,650. At 9:16 AM, BSE Sensex was trading at 80,638.17, down 368 points or 0.45%. Nifty50 was at 24,636.55, down 113 points or 0.46%.The market sentiment was negatively impacted by the release of rising CPI inflation data this week and the persistent selling by foreign institutional investors (FIIs).Siddhartha Khemka, Head - Research, Wealth Management, Motilal Oswal, said, ""This along with disappointing Q2 earnings from major companies added to the pressure. Looking forward, the market is expected to remain range-bound due to mixed global cues and a lack of domestic triggers.""In the US, the Dow Jones Industrial Average advanced to its fourth record close in the last five sessions, supported by stronger-than-expected monthly retail sales and TSMC's upbeat forecast, which boosted chipmakers' stocks. The Dow gained 0.37%, while the S&P 500 and Nasdaq were down 0.02% and up 0.04%, respectively.Asian shares were mixed, with gains in Japan aided by a weaker yen, while equities in Australia and South Korea declined. US futures were flat after the S&P 500 retreated from an intraday record on Thursday. Crude oil futures inched higher, supported by a surprise drop in US oil inventories and simmering Middle East tensions, but prices were headed for their biggest weekly loss in more than a month due to concerns over lower demand.The dollar is on track for a third consecutive weekly gain, benefiting from a dovish European Central Bank and strong US data that is pushing out expectations for how quickly US rates can fall, especially if Donald Trump wins the presidency.Several stocks are in the F&O ban period today, including Chambal Fertilisers, SAIL, Hindustan Copper, RBL Bank, Granules, Manappuram, PNB, GNFC, IDFC First Bank, Tata Chemicals, IEX, Nalco, LTF, and Bandhan Bank. These securities have crossed 95% of the market-wide position limit.FIIs turned net sellers, offloading shares worth Rs 7,421 crore on Thursday, while DIIs bought shares worth Rs 4,980 crore.The net short position of FIIs increased from Rs 1.68 lakh crore on Wednesday to Rs 1.69 lakh crore on Thursday.","BSE Sensex and Nifty50 opened in red on Friday. Market sentiment negatively impacted by the release of rising CPI inflation data. Disappointing Q2 earnings from major companies added to the pressure. Looking forward, the market is expected to remain range-bound due to mixed global cues.","https://static.toiimg.com/thumb/msid-114333618,imgsize-135888,width-400,resizemode-4/114333618.jpg"
"China's economy grows 4.6% in Q3, keeping stimulus calls alive",https://timesofindia.indiatimes.com/business/international-business/chinas-economy-grows-4-6-in-q3-keeping-stimulus-calls-alive/articleshow/114332969.cms,"A woman walks through an overhead pedestrian bridge near a building construction site in Shanghai.

Industrial production rose 5.4% from a year earlier, versus economists’ forecast of 4.6% growth

Retail sales climbed 3.2%, beating a projected 2.5% gain

Fixed-asset investment expanded 3.4% in the first nine months, compared with a 3.3% increase expected by economists. The property sector continued shrinking, with investment plunging 10.1% in the first nine months

The urban jobless rate dropped to 5.1% from 5.3% in August

China’s economic expansion slowed in the third quarter, underscoring the need for additional stimulus to help the world’s second-largest economy reach its annual growth target.Gross domestic product increased 4.6% in the July-to-September period from a year prior, data released by the National Bureau of Statistics showed Friday, the slowest pace since March 2023 and down from a growth of 4.7% in the second quarter.The figure was higher than the median estimate of 4.5% in a Bloomberg survey of economists, bringing growth for the first nine months to 4.8%.China unleashed a swath of stimulus measures in late September including interest rate cuts and support for the property and equity markets to draw a line under a slowing economy. Investors now expect Chinese lawmakers to approve additional budget or debt sales to fund public spending in an upcoming meeting after authorities promised fiscal support.The slate of measures prompted a historic stock rally and led banks including Goldman Sachs Group Inc. to upgrade their forecasts for China’s growth. But skepticism has grown over whether authorities are willing to deploy greater fiscal firepower to turn around the economy and markets.The stock market has been on a roller-coaster ride, with the benchmark CSI 300 Index soaring to its highest level since July 2022 in early October, before falling about 10% since then.The other key indicators show a broad improvement in different parts of the economy in September:Data released before Friday painted a dismal picture for growth in September. Exports slowed sharply, curbing a trade rebound that has been a bright spot for the economy. Deflationary pressures continued to build, with consumer prices still weak and factory gate prices falling for 24 straight months.President Xi Jinping called on government officials to “make every effort” in the fourth quarter to help the economy meet its annual growth target of around 5%, state media reported on Wednesday. That’s the second time in about a month Xi has urged officials to pursue economic growth.Economists have urged Beijing to boost consumer spending to avoid a spiral of falling prices, which could risk a self-reinforcing cycle of declining spending, shrinking business revenues and job losses. But authorities have shown little urgency to ramp up consumption with any direct stimulus or large-scale handouts, which Xi has long resisted due to concerns over what he calls “welfarism.”A real estate slump in its fourth year has hurt a pillar of growth and weighed on sentiment. Beijing is seeking to stop the property decline with a basket of policies including a Thursday pledge to nearly double the loan quota for unfinished residential projects. The measures fell short of market expectations, causing property shares to retreat as investors looked for more forceful response to pull the sector out of the doldrums.","Gross domestic product increased 4.6% in the July-to-September period from a year prior. The figure was higher than the median estimate of 4.5% in a Bloomberg survey of economists, bringing growth for the first nine months to 4.8%. China unleashed a swath of stimulus measures in late September including interest rate cuts and support for the property and equity markets.","https://static.toiimg.com/thumb/msid-114332965,imgsize-152042,width-400,resizemode-4/114332965.jpg"
"After row, Cerelac comes without refined sugar",https://timesofindia.indiatimes.com/business/india-business/after-row-cerelac-comes-without-refined-sugar/articleshow/114332322.cms,"NEW DELHI: Six months after facing a controversy over high sugar levels in Cerelac, Nestle India announced the launch of its baby food with no refined sugar. ""We have achieved our ambition of introducing 'Cerelac' variants with no refined sugar ,"" chairman and managing director Suresh Narayanan said. This was initiated three years ago and has culminated this year with the introduction of new Cerelac variants with no refined sugar, he added.The expanded Cerelac range in India will now consist of 21 variants, of which 14 variants will have no refined sugar. Of these 14 variants, seven will be available by Nov-end and the balance will be introduced in the coming weeks.In April, the FMCG biggie found itself in eye of the storm after a report by Public Eye , a Swiss investigative organisation and the International Baby Food Action Network ( IBFAN ) charged that Cerelac baby cereal products sold in India contained added sugar. As against this, in Europe, the report claimed, the company does not add any sugar to its infant nutrition products.Elaborating on results, Narayanan said ""Despite a challenging external environment with muted consumer demand and high commodity prices especially for coffee and cocoa, we remained resilient in our pursuit to deliver growth. This quarter, five of our top 12 brands grew at double-digit,"" he added.The company reported a consolidated net profit of Rs 899 crore for the second quarter ended September 30, 2024, slightly down from Rs 908 crore reported in the corresponding period last year. Its sales increased over 1% to Rs 5,075 crore. Some key brands witnessed pressure due to softer consumer demand and we focus on them and have put in place robust action plans. ...In the last nine months, 65% of our top 12 brands, including Maggi noodles, showed positive volume growth, he stated.The beverages business continued to do well and has posted high double-digit growth.","The expanded Cerelac range in India will now consist of 21 variants, of which 14 variants will have no refined sugar. Of these 14 variants, seven will be available by Nov-end and the balance will be introduced in the coming weeks. The company reported a consolidated net profit of Rs 899 crore for the second quarter ended September 30, 2024.","https://static.toiimg.com/thumb/msid-114332335,imgsize-81720,width-400,resizemode-4/114332335.jpg"
"India, emerging markets in Asia to drive growth: S&P",https://timesofindia.indiatimes.com/business/india-business/india-emerging-markets-in-asia-to-drive-growth-sp/articleshow/114332158.cms,"NEW DELHI: India will be cemented as the world's third-largest economy by 2035 and along with China, Vietnam, and the Philippines, emerging markets in Asia-Pacific will contribute about 65% of global economic growth , a report said on Thursday. ""Emerging markets will play a crucial role in shaping the global economy over next decade, averaging 4.06% GDP growth through 2035 compared with 1.59% for advanced economies,"" S&P Global said in its report ""Emerging Markets: A Decisive Decade.""According to Jose Perez-Gorozpe, head of emerging markets credit research for S&P Global Ratings, emerging markets will play a crucial role in shaping the global economy, with nine key such markets ranking among the 20 largest economies.It said India is poised to be the fastest-growing major economy over next three years and third largest globally by 2030. The report said India's 2024 entry into JP Morgan's govt emerging market bond index could provide additional govt funding and unlock significant resources in domestic capital markets.""This is only a first step - investors will continue looking for improved market access and settlement procedures,"" according to the report. The report said that India also took measures to improve its weak fiscal flexibility by boosting its capital expenditure, further supporting long-term growth.""But population challenges are meaningful, with the country expected to have the world's largest population by 2035,"" the report cautioned.","India will be cemented as the world's third-largest economy by 2035. Along with China, Vietnam, and the Philippines, emerging markets in Asia-Pacific will contribute about 65% of global economic growth. India is poised to be the fastest-growing major economy over next three years and third largest globally by 2030.","https://static.toiimg.com/thumb/msid-114332179,imgsize-645863,width-400,resizemode-4/114332179.jpg"
Why it’s time to explore bold & path-breaking alternatives that put Indian Railways on a smooth track,https://timesofindia.indiatimes.com/business/india-business/why-its-time-to-explore-bold-path-breaking-alternatives-that-put-indian-railways-on-a-smooth-track/articleshow/112317406.cms,"The focus has shifted to modernisation—of rolling stock and safety systems, among other aspects. (AI image)

By Ashutosh Bhandari

(Ashutosh Bhandari is Director, Consulting at

CRISIL

Market Intelligence & Analytics)

Railway Budget 2024 : The government has wavered little in its efforts to spur a modernisation of railways in the country, pivoting on technology, to support the country’s economic ambitions. In line with expectations, Union Budget 2024-25 set the capex for railways at a record Rs 2.65 lakh crore, marking yet another year of successive increase in outlay.That takes forward the past policies and the government’s vision, which have paved the way for modernisation of the transport behemoth.In earlier decades, the government had focused on laying tracks on new routes, electrification and incremental rolling stock capacity addition. That was the need of the hour back then and has helped set up the base for a larger transformation.For instance, the massive Dedicated Freight Corridor ( DFC ) as well as locomotive factories at Marhaura and Madhepura in Bihar were conceptualised over a decade ago and we are seeing their completion now.More recently, the focus has shifted to modernisation—of rolling stock and safety systems, among other aspects.This year, emphasis has also been laid on the railways’ crucial role in industrial development. Commodity-specific corridors have been planned in eastern India and impetus given to port connectivity. Vande Bharat and technology-led upgrades in rolling stock remain in focus. Safety has been prioritised through budgetary allocations for the anti-collision systemKavach . That said, there are other cogs in the wheel that demand attention from a long-term perspective.First, the target for the Operating Ratio, the crucial efficiency gauge, has been set at 98.22% for 2024-25, compared with 98.65% in 2023-24. This reflects an imminent need for operational transformation. An effective overhaul of the world’s fourth-largest rail network will take many years and thus we need to start focusing on improving efficiency and reducing costs now.DFC is almost entirely operational and will be complete over the next few months. To ensure the project achieves its twin goals of reducing logistics costs and enhancing freight efficiency, railways need to attract more cargo on the corridor. This will help increase the rail coefficient and make the railways’ approach more market-oriented, which will in turn aid future corridors.A revamp of railway stations is on track, with sufficient funds dedicated to this end. But even though new coaches and wagons are increasingly being added to meet footfalls, the stations and passenger trains themselves remain synonymous with chaos.Just as safety, comfort and convenience have been prioritised, there is a need for solutions to address the capacity and demand challenges. As a first step, the government could target development of new stations and setting up of new coach production units.As a leading freight mover, Indian Railways carried a record 1,588 MT cargo in fiscal 2024, up from 1,095 MT in fiscal 2015. It accounts for 26% of the cargo moved in the country—by no means an easy feat. The railways aims to take this volume to 3,000 MT by 2030, which would require a 11% CAGR against the around 4.2% witnessed over the last 10 years. As per a report by TERI and Shakti Foundation, from carrying about 62% of freight traffic in 1990-91, Indian Railways’ share has declined to ~27% in 2014-15. This has been due to the expanding road network, cost competitiveness over railways, and door-to-door service. Thus, commencing the cycle of increasing the rail share again is commendable.DFCs, a high-capacity track network, high-power locomotives and improvement in wagon designs have set the ball rolling for larger capacity, faster freight trains that deliver better efficiency.Yet, achieving exponential growth is a tall ask given the current dynamics. Possibly, similar challenges might apply to other goals the railways might have for 2047.To be fair, despite its scale and complexity, Indian Railways has been able to achieve diverse developments at commendable speed.But the track ahead is long and it is time to start discussing the reinvention of the institutional set-up.Indian Railways sees substantial private sector involvement in the form of vendors and contractors. Policymakers could start mulling extreme options such as parallel privately-owned and operated railway infrastructure, coupled with centralised planning and an evolved role for the railways. This will need a robust policy framework from the Government of India.The time is perhaps also ripe to bring user charge and asset monetisation-driven segments for passengers as well as cargo to the discussion table. Globally, the separation of infrastructure and operations in railways has delivered mixed results, for example in the United Kingdom. The model should be analysed and revisited to understand its potential relevance in the Indian context.The key would be to retrace our steps and align our long-term goals to identify not just incremental changes but also ways to explore bold and path-breaking alternatives that put Indian Railways on a smooth track and bring it up to speed.","Union Budget 2024-25 set the capex for railways at a record Rs 2.65 lakh crore. In earlier decades, the government had focused on laying tracks on new routes, electrification and incremental rolling stock capacity addition. The focus has shifted to modernisation of rolling stock and safety systems, among other aspects.","https://static.toiimg.com/thumb/msid-112317825,imgsize-144990,width-400,resizemode-4/112317825.jpg"
"Changes in LTCG tax post Budget 2024: Higher tax rate with indexation benefits, grandfathering for ancestral properties being considered?",https://timesofindia.indiatimes.com/business/india-business/changes-in-ltcg-tax-post-budget-2024-higher-tax-rate-with-indexation-benefits-grandfathering-for-ancestral-properties-being-considered/articleshow/112214106.cms,"The industry is suggesting alternatives such as a higher tax rate with indexation or a lower rate of 12.5% without indexation, as well as some form of grandfathering for ancestral properties.

Gradual Change in LTCG Regime?

Budget 2024 capital gains tax changes: The Narendra Modi government is considering suggestions for tweaks in the new long term capital gains tax regime that was announced by FM Nirmala Sitharaman in Union Budget 2024.The July 23 budget reduced the LTCG tax on property from 20% to 12.5%. The indexation benefit, which allowed taxpayers to adjust the acquisition cost for inflation before calculating capital gains and thus reduce their tax liability, is proposed to be eliminated for properties purchased on or after April 1, 2001.The government publishes the Cost Inflation Index (CII) annually for this calculation.India Inc is appealing to the government for a gradual shift to the long-term capital gains tax regime proposed in the FY25 budget, which aims to eliminate indexation benefits for property, gold, and other unlisted assets.According to an ET report by Deepshikha Sikarwar, the industry is suggesting alternatives such as a higher tax rate with indexation or a lower rate of 12.5% without indexation, as well as some form of grandfathering for ancestral properties.The finance ministry is currently reviewing these proposals and will discuss them with the Prime Minister's Office. The final decision will be made closer to the date when the Finance Bill reply is to be presented in Parliament, the reports said.Industry groups are expected to submit formal proposals to the finance ministry in the near future. ""We are proposing that some time be given to taxpayers for transition,"" said an official with a leading industry lobby group.Also Read | New Budget 2024 rule: Why Income Tax Department is likely to issue a huge number of tax notices this month The finance ministry has already conducted one round of discussions regarding the concerns raised by various stakeholders about the move, including the potential increase in black money transactions.""Since the sudden transition to a new capital gains regime impacts existing properties held by taxpayers, the amendment has a retroactive impact for such taxpayers,"" said an official with another industry body supporting a transition regime.The proposed suggestions include giving the seller of a property the option of either a 20% LTCG rate with indexation or a 12.5% LTCG rate without that benefit.""As per tax policy diligently followed by the current government, any drastic change in regime has been made in a gradual manner, by providing options to taxpayers to choose between the old regime and new regime,"" said Sudhir Kapadia, senior advisor at EY, supporting the suggestion.Also Read | How Budget 2024 announcements will spur balanced growth of real estate sector He cited examples such as domestic companies having the choice between a concessional 22% tax rate under Section 115 BAA without incentives and deductions, or the normal 30% tax rate after claiming permitted tax incentives and deductions, as well as individual taxpayers having the choice between two separate tax regimes—one with deductions and the other without. ""Such an option existed in Income Tax Section 112 since AY (assessment year) 2000-1 for listed securities (other than units),"" he pointed out.","The Narendra Modi government is considering suggestions for tweaks in the new long term capital gains tax regime. The July 23 budget reduced the LTCG tax on property from 20% to 12.5%. The indexation benefit, which allowed taxpayers to adjust the acquisition cost for inflation before calculating capital gains, is proposed to be eliminated for properties purchased after April 1, 2001.","https://static.toiimg.com/thumb/msid-112216314,imgsize-42384,width-400,resizemode-4/112216314.jpg"
