Article Title,Article Link,Article Text,Article Summary,Article Image
‘Enough domestic sources of demand to counter drag from external sector’,https://timesofindia.indiatimes.com/business/budget/enough-domestic-sources-of-demand-to-counter-drag-from-external-sector/articleshow/107372012.cms,"Do you think the

creates room for lower interest rates?

One of the issues that the Budget has flagged is the demographic challenge and opportunity and the societal change that is taking place. How do you view this?

Niti Aayog is working on the Viksit Bharat roadmap. What will be the focus areas?

You are as much a representative of the Centre as well as the states. Is it time to revisit the entire formula for transfers to states particularly on the issue of cesses and surcharges?

Suman Bery , who heads Niti Aayog , the govt think tank, is bullish on India’s growth prospects against the backdrop of risks, including a slowing China, which he says is also an opportunity for India. The economist is confident that Indian states remain resilient. Excerpts of the interview with TOI.The finance ministry expects the economy to grow 7% next year. Given the global situation, how do you see the prospects?The belief in the finance ministry is that we have a possible drag coming from the external sector but that we have other sources. We have enough domestic sources of demand. One has to applaud the political and economic judgment of FM in deciding that it was appropriate to pursue the path of fiscal consolidation. There is transparency. What this actually reflects is responsible economic management, which is one reason we are where we are. Second, it also creates a buffer so that there is policy space if we do encounter headwinds.That’s the hope and expectation. We have an independent central bank and an inflation targeting central bank, so it is up to the monetary policy committee to take a call through the monetary policy committee on the repo rate .The PM has said that when India grows its states grow. India is a composite of 37 states and UTs. They are each at very different points in their demographic transition. There are some states where the net replacement rate is down to 1%, like Kerala . There are others, particularly UP and Bihar, which are in their earliest stage of demographic transition and each one of these states is the size of a large European country. There are two implications of that — one is internal labour mobility and it will become an even larger part of our growth model. The govt has taken several steps to create a unified market. Our main endowment is our human capital and that has to be equipped to participate in global exchange in many ways. We know from China, Japan that the demographic dividend partly depends on markets and on human capital. But the golden period is fairly short lived, about 15 years, when the so called dependency ratio declines. The other big opportunity the PM has been highlighting is bringing women much more into the active labour force.When Niti was set up there was the idea of a three-year vision and a seven-year strategy paper. The reality is that schemes of govt tend to be aligned with the award of the Finance Commission . There are various established building blocks or hand holds which are already a matter of govt policy. The PM is much more interested in a national debate on what it means to be a Viksit Bharat or modern society. We have a collective goal and it is for the democratic polity to define what that goal should be. Its emphatically not for a super mandarin bureaucracy. It is not going to be Lee Kwan Yew’s Singapore led from the top.It’s entirely a finance ministry matter but I would be lying if I didn’t say when I visit certain states there is this complaint. A big frontier would be resource mobilisation at the state level. Second is going to be rationalisation of subsidies not only at the Union level, but also at the state level. All chief ministers sit on my governing council. When they convene as the governing council, I see them in their role as development practitioners. The world is beginning to appreciate quite how much institutional and political maturity India attained in our 75 years and the most fundamental dimension of a democracy, we have orderly transfers of power. There are enough buffers to ensure that what happens in state finances is unlikely to create macro instability. Those risks are well contained by our Constitution. The chief ministers know that they are going to be judged by development outcomes and so you can have the sugar rush of changing of pension plans or various handouts but if the cupboard is bare you are not going to be able to deliver.","Suman Bery is bullish on India’s growth prospects against the backdrop of risks, including a slowing China. The economist is confident that Indian states remain resilient. The world is beginning to appreciate quite how much institutional and political maturity India has attained in its 75 years.","https://static.toiimg.com/thumb/msid-107372016,imgsize-783694,width-400,resizemode-4/107372016.jpg"
Government's Marathon to 2047: Emphasis on Fiscal Prudence,https://timesofindia.indiatimes.com/business/budget/governments-marathon-to-2047-emphasis-on-fiscal-prudence/articleshow/107371788.cms,"What was the thinking behind keeping the vote on account absolutely straight?

So is it the idea to keep the Budget completely transparent?

The capex has risen 11.1% and there is an emphasis on infrastructure spending. But there is also the hope that the private sector will now take over and start capital spending. Given the geopolitical situation, how confident is the govt that it will pan out as planned?

Finance secretary T V Somanathan, in an interview with TOI, says the Interim Budget has laid the roadmap for the country to emerge as a developed country by 2047 . Excerpts:If you see the Budget speech you will see the emphasis on 2047. The govt has set its sight on running that marathon. Running to 2047 is a marathon , it’s not a sprint. If you are going to run a marathon, you need to be in good shape and you can’t have short-term stimulants or something that will get you some yards and then it’s done.The whole focus is on making India a developed country by 2047, for which a healthy present and a strong fiscal position is an important concomitant. Some purely short term measures don’t really fit into that picture. It’s a consistent picture: focus on the long term for which you need to build strength in the short term and that needs to be done by prudence in fiscal policy and by not doing things which can detract you from that path. Not doing the wrong thing is more important than appearing to do things.The idea is that govt finances may be good, bad or indifferent depending on the times, depending on the circumstances, depending on the policies. But what is the position should be reflected as reasonably and accurately as possible. That is an emphasis. As regards the Finance Commission, again the terms of reference that have been given to them are the terms in the Constitution.What is the means by which the devolution should be done is a matter they have full discretion. They can actually take all kinds of factors into account and in a sense we felt this time based on my review of the previous commissions that the right expression would be less is more. The shorter, less prescriptive terms of reference gives full scope for all stakeholders including state govts to express their viewpoints and for the commission to take a balanced view of the different perspectives and then come to its award. Ultimately the award of the Finance Commission is about devolution and grant for which full scope has now been given to them.n There are incipient signs of private capital expenditure accelerating. There are some surveys I have seen done by some of the chambers industry, which show high levels of investment. The PMI, which is a sort of leading indicator, is also looking pretty healthy. Capacity utilisation is one reason that private sector capital expenditure doesn’t immediately pick up when the economy starts accelerating because there is surplus capacity.But increasingly I get the sense that many industries are beginning to reach levels where they have to add capacity. When that happens capital investment will happen. Another pointer also mentioned in the Budget speech you may notice that our airlines have placed large orders for planes — that is capital expenditure.When you import 1,000 aircraft, it’s just not 1,000 aircraft, there are concomitant additions to ground handling facilities, you need airports to expand, you need to employ people to do that. That means a lot of jobs. The aircraft is capital but then look at the effect it is going to have on skilled jobs. So capital expenditure is happening. I am fairly confident that we will have decent capital expenditure in the year to come and that will become a new source of acceleration.",Finance secretary T V Somanathan says the Interim Budget has laid the roadmap for the country to emerge as a developed country by 2047. The capex has risen 11.1% and there is an emphasis on infrastructure spending. There are incipient signs of private capital expenditure accelerating.,"https://static.toiimg.com/thumb/msid-107371891,imgsize-720422,width-400,resizemode-4/107371891.jpg"
What is the Section 80C limit for tax deduction for FY 2024-25 after Interim Budget 2024?,https://timesofindia.indiatimes.com/business/budget/income-tax-budget-2024-2024-2025-section-80c-limit-epf-ppf-elss-nsc/articleshow/107353021.cms,"ALSO READ |

ALSO READ |

Income Tax Changes Budget 2024 : In the recent Budget 2024 speech, the Finance Minister kept the Section 80C tax deduction limit unchanged. The maximum limit for claiming tax benefits under Section 80C remains at Rs 1.5 lakh for the current fiscal year 2023-24 and will stay the same for individuals looking to save on taxes through Section 80C investments in the upcoming fiscal year 2024-25.Section 80C of the Income-tax Act lists different investments and expenses eligible for tax deductions. Individuals can reduce their gross taxable income by up to Rs 1.5 lakh per financial year by engaging in these specific investments or expenditures.You can save on taxes through Section 80C by investing in things like Employees' Provident Fund (EPF), Public Provident Fund (PPF), Equity Linked Saving Scheme (ELSS) mutual funds, National Savings Certificate (NSC), and 5-year tax-saving fixed deposits with banks or post offices. Additionally, paying life insurance policy premiums also qualifies for tax benefits under Section 80C.It is important to note that each eligible investment comes with its specific maximum limit, rate of return, liquidity, and taxation rules for the earned returns, states ET in a report. For instance, the most you can invest in PPF in a financial year is Rs 1.5 lakh. Meanwhile, there's no limit on the amount you can invest in ELSS mutual funds, but the Section 80C deduction is capped at Rs 1.5 lakh.If individuals can't make specific investments, they can still get deductions under Section 80C from their gross taxable income through certain expenses. These expenses include repaying the principal amount of a home loan, tuition fees for children, payment of stamp duty, registration fees, and other costs related to buying a house.Since the financial year 2020-21, individuals without any business income must annually choose between the old and new tax regimes. As of the fiscal year 2023-24, the new tax regime is the default option. Consequently, individuals seeking tax deductions under Section 80C must opt for the old tax regime since this deduction isn't available in the new tax regime. It's crucial for taxpayers to be aware of these rules to make informed decisions about their tax planning and investment strategies.","Section 80C of the Income-tax Act lists different investments and expenses eligible for tax deductions. Individuals can reduce their gross taxable income by up to Rs 1.5 lakh per financial year by engaging in these specific investments or expenditures. You can save on taxes by investing in things like Employees' Provident Fund (EPF), Public Provident fund (PPF), Equity Linked Saving Scheme (ELSS) mutual funds, National Savings Certificate (NSC)","https://static.toiimg.com/thumb/msid-107352991,imgsize-1609512,width-400,resizemode-4/107352991.jpg"
Budget 2024 focuses on youth and women entrepreneurship,https://timesofindia.indiatimes.com/business/budget/budget-2024-focuses-on-youth-and-women-entrepreneurship/articleshow/107357923.cms,"By

Naina Lal Kidwai

(Naina Lal Kidwai is Chair India Sanitation Coalition and Chair Rothschild & Co Indía)

Finance Minister Nirmala Sitharaman ’s sixth Budget which is an interim budget promises to be responsible despite this being an election year. The budget talks about inclusive development both, social and geographical, especially for youth, women, farmers, and the poor. Continued focus on improving logistics through infrastructure spend on roads, rail, airports, ports increases productivity for companies and citizens alike.To make ‘Viksit Bharat’ by 2047, the government’s focus is on improving and empowering people’s capabilities through various skilling initiatives. It is encouraging to see that Skill India Mission has succeeded in training more than 1.4 crore youth and upskilling and reskilling 54 lakh youth. I am particularly happy to see the continued focus on youth and women entrepreneurship and the announcement of a new fund which will give interest free 50 year loans for startups will provide a domestic fillip to startups supplementing venture capital we have traditionally relied on from abroad.PM Mudra Yojana has sanctioned 43 crore loans aggregating to 22.5 lakh crore to youth entrepreneurs and thirty crore Mudra Yojana loans to women entrepreneurs. There are several other schemes like Fund of Funds, Start-Up India, and Start-Up Credit Guarantee schemes that are assisting our youth. Further, the extension of tax benefits to Start-ups and investments made by sovereign wealth funds/pension funds, till 31st March 2025 depicts the government’s effort to support the startup eco- system.This aligns quite well with India Sanitation Coalition’s efforts to give impetus to the start-up world. Over the past 7 editions of our ISC-FICCI Sanitation Awards, we have recognized and promoted several start-ups in the sanitation space, many of whom are successful businesses now!While the finance minister did not provide detailed information on Water, Sanitation, and Hygiene (WASH), the budget allocation sees a slight increase in spend demonstrating continued focus on this highly successful program. The acknowledgement that the private sector has increasingly played a substantial role in addressing WASH issues in both urban and rural areas, with numerous projects underway through Public-Private Partnerships (PPPs), highlights the government's commitment to addressing challenges in this sector.A perfect example is the LightHouse Initiative initiated by the Department of Drinking Water along with the India Sanitation Coalition (ISC) by partnering with major corporates across India to develop model villages in Solid and Liquid Waste Management (SLWM) under SBM-Grameen. From this budget, there is an expectation that the government will persist in prioritizing Public-Private Partnerships (PPP) as the path toward achieving the country's Sustainable Development Goal 6 (SDG 6). Additionally, it is hoped that the government will uphold its commitment to making necessary infrastructural investments for SLWM.The budget speech rightly celebrates the fact that we have 83 lakh SHGs and 9 crore women beneficiaries. The microfinance movement in the country and the possibility of empowering women members of SHGs through livelihood skilling is a key to bringing women into mainstream economic advancement.The focus on green growth, rooftop solar, wind, biomass, e-vehicles all help with our green energy thrust. The tourism sector was mentioned and could be a huge job provider for youth and women.Guided by the principle ‘Reform, Perform, and Transform’, the budget emphasizes efficient implementation of various policies by improving coordination with states and relevant stakeholders. This is critical both for infra spend and social programsIt is noteworthy that ISC’s Climate Resilient Coastal Cities project which is being implemented in PPP (Public-Private Partnership) mode in four coastal states of Karnataka, Gujarat, Goa and Maharashtra is congruent with the government’s priority of promoting climate-resilient activities for the blue economy 2.0, a scheme for restoration and adaptation measures, and coastal aquaculture.The budget also focuses on the Aspirational districts program where assistance will be given to the states for faster development of aspirational districts and blocks, including the generation of ample economic opportunities. This is again very crucial as it has a huge potential to transform the landscape of our country while making sure no -one is left behind.Overall, this budget has embraced economic strategies and develops the building blocks that nurture and uphold growth, promote inclusive and sustainable development, and enhance productivity.","Finance Minister Nirmala Sitharaman ’s sixth Budget promises to be responsible despite this being an election year. Continued focus on improving logistics through infrastructure spend on roads, rail, airports, ports increases productivity for companies and citizens alike.","https://static.toiimg.com/thumb/msid-107357973,imgsize-300646,width-400,resizemode-4/107357973.jpg"
"Goods exports increase 9%, imports 8% in May",https://timesofindia.indiatimes.com/business/india-business/goods-exports-increase-9-imports-8-in-may/articleshow/111010080.cms,"New Delhi: Goods exports rose 9% to $38 billion in May, while imports were 7.7% higher at nearly $62 billion, pushing up India's trade deficit to $23.8 billion, highest in seven months.Exports growth has been uneven and the latest numbers pegged the growth at the highest in three months, with govt hopeful of the trend continuing. ""I feel that this positive trend will continue. Things are looking better and optimistic for the trade sector,"" commerce secretary Sunil Barthwal told reporters. He said that inflation in advanced economies is slowing and it would help further push purchasing power that will raise demand for imports.Asked about the higher trade deficit, he said: ""I do not consider trade deficit per se as bad as long as you have FDI flowing in, foreign exchange coming in and if you are balancing it through other means. Second, we should also look at the growing services exports...then we should not unnecessarily be worried about the trade deficit in merchandise.""Petroleum products, electronics, largely mobile phones, pharmaceuticals and plastics were among sectors that saw the highest growth. On the import front, pulses imports surged 2.8 times to $371 million in May as the govt shipped large quantities of dal to cool down domestic prices and rein in inflation","Exports growth has been uneven and the latest numbers pegged the growth at the highest in three months. ""I feel that this positive trend will continue. Things are looking better and optimistic for the trade sector,"" commerce secretary Sunil Barthwal said.","https://static.toiimg.com/thumb/msid-111010240,imgsize-48420,width-400,resizemode-4/111010240.jpg"
Life insurers' stocks rally on 'low impact' of new norms,https://timesofindia.indiatimes.com/business/india-business/life-insurers-stocks-rally-on-low-impact-of-new-norms/articleshow/111009979.cms,"Mumbai: Shares of life insurance companies rallied after the regulator announced new norms requiring them to provide higher surrender value than what they have been paying out. The relief rally was triggered by realization that the impact on margins would be far less than estimated because insurers front-end most of their costs into the first year which has been excluded from surrender value norms.

Shares of HDFC Life, SBI Life, ICICI Pru Life, Max Financial and Life Insurance Corporation have all rallied in the last two days after the new norms.

The shares of life insurance companies have been under pressure since December 2023, when the insurance regulator first proposed increasing surrender charges. The product regulations in March 2024, however, did not alter the guaranteed surrender values. The situation changed again on May 30, when the regulator introduced a fresh draft that included the regulation of special surrender value. This new development was perceived to have an impact on new business margins of up to 3-4%.

On June 12, the regulations were officially announced by Irdai. The first year was excluded from SSV norms, a move that could have hurt margins. Additionally, insurers were granted the flexibility to discount returns at a higher rate of 50 basis points over the government securities yield, as opposed to the previous benchmark of the 10-year G-sec yield. According to a report by JM Financial, insurers can mitigate the pressure on margins by passing on the potential loss to intermediaries or the customer.

The second option is to offer a slightly lower return on non-participating products where insurers have no competition on providing guaranteed returns.

","HDFC Life, SBI Life, ICICI Pru Life, Max Financial and Life Insurance Corporation have all rallied. The relief rally was triggered by realization that the impact on margins would be far less than estimated. The shares of life insurance companies have been under pressure since December 2023.","https://static.toiimg.com/thumb/msid-111010018,imgsize-1039143,width-400,resizemode-4/111010018.jpg"
Trai asks fin cos to use new prefix for service calls,https://timesofindia.indiatimes.com/business/india-business/trai-asks-fin-cos-to-use-new-prefix-for-service-calls/articleshow/111009974.cms,"Mumbai: To check the menace of impersonation frauds , telecom regulator Trai on Friday met financial sector regulators , 25 banks and financial institutions, and other industry representatives to ensure that official calls are made from numbers prefixed with a dedicated number series that can be identified by the receiver.Trai suggested allocating the 160 series prefix exclusively for transactional and service voice calls. Initially, it will be for entities regulated by RBI, Sebi, Irdai, and PFRDA, making it easier to identify callers and prevent fraud.The meeting discussed how to effectively use this series, migrate the 140 series (for sales) to a new platform, and implement digital consent scrubbing to reduce spam calls.The telecom service providers and members of the Association of National Exchange Members were also present in the meeting.The Digital Consent Facility, which allows banks and other entities to send promotional messages, was also discussed. The meeting emphasized the obligations of senders under Trai regulations and agreed to whitelist URLs, use minimum headers and content templates, and take immediate action against misuse. While prefixing the series to numbers will help to identify genuine calls from institutions, whitelisting of headers can help check fraud messages.Meanwhile Irdai, in a circular, became the first to bar companies from using 10-digit mobile numbers to make calls to existing or prospective customers and use the 140/160 series allotted by the telecom regulator. Irdai's circular to all regulated entities follows the telecom regulator's new guidelines aimed at curbing unsolicited voice calls or messages.Most of the frauds that are undertaken by criminals impersonating bankers, insurance or other government officials is being perpetuated through private mobile numbers.Insurance companies have also been asked to take steps to spread awareness among customers, in local language as well, about the remedial actions/ steps to be taken in various scenarios such as ONO Registration, Registration of Complaints.","Trai suggested allocating the 160 series prefix exclusively for transactional and service voice calls. Initially, it will be for entities regulated by RBI, Sebi, Irdai, and PFRDA. Most of the frauds that are undertaken by criminals impersonating bankers, insurance or other government officials is being perpetuated through private mobile numbers.","https://static.toiimg.com/thumb/msid-111010052,imgsize-117342,width-400,resizemode-4/111010052.jpg"
