Article Title,Article Link,Article Text,Article Summary,Article Image
ECB cuts interest rate to 3.25% as inflation declines below target,https://timesofindia.indiatimes.com/business/international-business/ecb-cuts-interest-rates-to-3-25-as-inflation-declines-below-target/articleshow/114319132.cms,"The European Central Bank (ECB) on Thursday reduced the benchmark interest rate from 3.5% to 3.25% following data indicating that inflation across the region had dropped to its lowest point in over three years. In September, inflation fell to 1.8%, dipping below the ECB 's 2% target for the first time in three years.This is the third rate cut announced by the ECB since July after its governing council meeting in Slovenia's Llubljana instead of its usual location in Frankfurt, Germany.Inflation has been declining faster than expected, and analysts anticipate that the bank will further reduce rates in December. The eurozone's meager growth of just 0.3% in the second quarter has only reinforced the belief that ECB President Christine Lagarde will not attempt to alter this expectation.""The trends in the real economy and inflation support the case for lower rates,"" said Holger Schmieding, chief economist at Berenberg Bank.One factor contributing to the global decrease in inflation is that central banks significantly raised borrowing costs from near-zero levels during the COVID-19 pandemic when prices began to surge, initially due to supply chain issues and later as a result of Russia's full-scale invasion of Ukraine, which drove up energy prices.The ECB, established in 1999 with the introduction of the euro currency, started increasing interest rates in the summer of 2021, reaching a record high of 4% in September 2023 to control inflation by making borrowing more expensive for businesses and consumers. However, this has come at the expense of weighing on economic growth.","The European Central Bank (ECB) reduced the benchmark interest rate from 3.5% to 3.25%. In September, inflation fell to 1.8%, dipping below the ECB's 2% target for the first time in three years. This is the third rate cut announced by the ECB since July.","https://static.toiimg.com/thumb/msid-114321594,imgsize-933236,width-400,resizemode-4/114321594.jpg"
Need climate finance goal that truly meets needs of developing countries: UN climate chief,https://timesofindia.indiatimes.com/business/international-business/need-climate-finance-goal-that-truly-meets-needs-of-developing-countries-un-climate-chief/articleshow/114318502.cms,"Representative photo

At the UN climate conference in Baku, countries must agree on a new goal for international climate finance that truly meets the needs of developing nations, with public finance at its core, UN Climate Change Executive Secretary Simon Stiell said on Thursday. He said COP29 must be the ""stand-and-deliver"" COP, recognising that climate finance is critical to saving the global economy and billions of lives and livelihoods from the devastating impacts of climate change.Addressing a virtual event hosted by the Brookings Institution, Stiell said, ""At COP29 in Baku, all governments must agree on a new goal for international climate finance that truly responds to the needs of developing countries ... It is not my job to prejudge what the new goal will look like. But it is clear public finance must be at the core.""He added that as much of this finance as possible should be in the form of grants or concessional funding and made more accessible to those who need it most.""And we must make climate cash count, wherever possible, leveraging more private finance and sending signals to financial markets that green is where the gains are,"" he said.At this year's UN climate conference (COP29), countries are expected to agree on the New Collective Quantified Goal (NCQG), the new amount developed nations must mobilise every year starting in 2025 to support climate action in developing countries.Under the United Nations Framework Convention on Climate Change (UNFCCC), adopted in 1992, high-income industrialised countries are responsible for providing finance and technology to help developing nations combat and adapt to climate change.These developed countries, including the US, Canada, Japan, Australia, New Zealand, the UK and EU member states such as Germany and France have historically benefited from industrialisation and contributed significantly to greenhouse gas emissions.At COP15 in Copenhagen in 2009, these nations pledged to provide USD 100 billion annually by 2020 to support developing countries.However, this target has not been fully met, creating a significant financial gap that has eroded trust and hindered climate action in developing nations.In May, the Organization for Economic Cooperation and Development (OECD) reported that developed countries had surpassed the USD 100 billion-a-year target by providing nearly USD 116 billion in climate finance to developing countries in 2022, with nearly 70 per cent of the money provided in the form of loans.Stiell noted that the countries could decide ""who pays and how much"" at COP29 in Baku but cautioned, ""We are not going there to renegotiate the Paris Agreement"", referring to efforts by some developed nations to broaden the list of countries contributing to climate finance, with Switzerland and Canada proposing criteria to expand the donor base.Developing countries argue that discussions on expanding the contributor base go beyond the mandate for the NCQG and could derail negotiations on the new climate finance goal.Some developed nations, led by the EU and the US, argue that the global economic landscape has changed significantly since the adoption of the UNFCCC in 1992. They suggest that wealthier nations that have emerged during this period, such as China and some Gulf states, should also contribute to the new climate finance target.Developing countries view this as an attempt to shift responsibility away from those who have historically benefited from industrialization and contributed the most to greenhouse gas emissions.They argue that expecting them to contribute, especially when many are still grappling with poverty and inadequate infrastructure amid worsening climate impacts, undermines the principle of equity.Stiell also stressed the importance of implementing mechanisms to track and ensure that promised funds are delivered.""More work also has to be done to rapidly ramp up funding for adaptation and get international carbon markets working for everyone. We must fund a new generation of national climate plans.""To protect the progress we made at COP28 and convert the pledges in the UAE Consensus -- to triple renewable energy, double energy efficiency, boost adaptation, and transition away from fossil fuels -- into real-world, real-economy results,"" he said.The UN climate change chief warned that the world is at a moment of profound fracture between and within nations.""In times like these, there is a temptation to turn inward. A delusional belief that what happens in my neighbour's backyard is not my problem or concern. If we go down this path, it will soon be game over in the world's climate fight.""","UN Climate Change Executive Secretary Simon Stiell said COP29 must be the ""stand-and-deliver"" COP. He said climate finance is critical to saving the global economy and billions of lives and livelihoods from the devastating impacts of climate change. At COP15 in Copenhagen in 2009, these nations pledged to provide USD 100 billion annually by 2020.","https://static.toiimg.com/thumb/msid-114318513,imgsize-7868,width-400,resizemode-4/114318513.jpg"
Nokia reports 22% increase in Q3 net profit despite 8% sales decline,https://timesofindia.indiatimes.com/business/international-business/nokia-reports-22-increase-in-q3-net-profit-despite-8-sales-decline/articleshow/114313672.cms,"Nokia reported a 22% rise in third-quarter net profit to 358 million euros despite an 8% decline in sales due to a weaker market in India. CEO Pekka Lundmark remains optimistic about the future, citing improved gross margins and effective cost-cutting measures amid ongoing market challenges.","Nokia reported a 22% rise in third-quarter net profit to 358 million euros. Sales were down 8% due to a weaker market in India. CEO Pekka Lundmark remains optimistic about the future, citing improved gross margins and effective cost- cutting measures.","https://static.toiimg.com/thumb/msid-114313952,imgsize-681163,width-400,resizemode-4/114313952.jpg"
Crypto Presale: Flockerz begins crypto presale: Next new memecoin to watch out for?,https://timesofindia.indiatimes.com/business/international-business/flockerz-begins-crypto-presale-next-new-memecoin-to-watch-out-for/articleshow/114305087.cms,"Flockerz begins crypto presale

Flockerz: An introduction to the

vote-to-earn

crypto

From mere spectators to active decision-makers

The FLOCK tokenomics

FLOCK presale: The price increases in each stage

Name: Flockerz

Email: help@flockerz.com

Disclaimer: Crypto products and NFTs are unregulated and can be highly risky. There may be no regulatory recourse for any loss from such transactions. The above content is non-editorial, and TIL hereby disclaims any and all warranties, expressed or implied, relating to the same. TIL does not guarantee, vouch for or necessarily endorse any of the above content, nor is it responsible for them in any manner whatsoever. The article does not constitute investment advice. Please take all steps necessary to ascertain that any information and content provided is correct, updated and verified.

The fourth quarter of 2024 is here, igniting anticipations of an end-of-year market surge. memecoins, as always, are making their way into crypto watchlists. These highly volatile assets are a favourite among degens, despite their silly themes and lack of utility.A top new memecoin to emerge into the spotlight is Flockerz (FLOCK). With a decentralised governance model and a passive staking system, the project has been drawing traction to its token presale.FLOCK has raised over $500,000 already.Play-to-earn is one of the most popular crypto earning and engagement mechanisms. The wide popularity of the niche is rooted in the video gaming sector. As the name implies, play-to-earn platforms reward users for playing.The growth of the play-to-earn sector catalysed more trends, like move-to-earn and stake-to-earn . These earning mechanisms integrate utility into crypto ecosystems and can potentially drive demand for the native tokens. Flockerz (FLOCK) is a memecoin. Themed around a growing flock of birds, the narrative is quirky. However, the project has bigger ambitions.Most memecoins fall prey to the whims of degens, which can send them into the dark depths of the market within days. In an effort to avoid being a statistic, Flockerz has integrated two earning mechanisms into its ecosystem.The first is vote-to-earn. It encourages investors to vote on crucial decisions concerning the future of the project in exchange for token rewards. The next is stake-to-earn, which encourages investors to hold on to their tokens and help stabilise the token economy.The project has garnered attention from crypto influencers like ClayBro who has a community of over 130,000 subscribers on YouTube.Flockerz is a memecoin that aims for, potentially, high standards of decentralisation. Although crypto projects are generally called decentralised, the principle is often limited to the protocol level. Most projects fail to fully embrace the decentralised spirit of blockchain technology.The governance and development are left to a few. While key decisions—like upgrades and management—need the guidance of industry experts, the concentration of power erodes the community ethos of the crypto market.A balance of power is desired in community-centric niches like memecoins. Flockerz seeks to achieve this through its vote-to-earn model. The goal is to give control back to the community, also called the Flock.This will be made possible through the FlockTopia DAO. It plans to implement decentralised governance with a unique vote-to-earn model, rewarding participants for their active role in decision-making.The vision is conveyed through an engaging narrative centred around the fictional King Birb, who became one with his degens and discovered the true power of the people.“Flockerz story is a testament that no single leader can dictate the future—here, it’s the community that rules,” claims the white paper The memecoin market is a highly slippery landscape where tokens can fly high and come crashing down within minutes. It is important to analyse tokenomics to understand its credibility.Flockerz has designated 25% of the FLOCK supply for staking rewards. The earning mechanism comes in addition to the vote-to-earn model. While vote-to-earn requires active participation, stake-to-earn is a more passive source of rewards. It incentivizes long-term holding to strengthen the token economy.It is popular in the memecoin market, as it can theoretically aid in mitigating early sell-offs. The staking rewards are structured dynamically. The earlier an investor joins, the higher the potential staking Annual Percentage Yield (APY) they can earn.The DAO Vault (Flock Vault) pools resources for the community. The liquidity allocation, on the other hand, is dedicated to facilitating trading across both centralised and decentralised exchanges post-launch.To win the confidence of early investors, Flockerz has undergone security audits by Solidproof and Coinsult. The audit reports are available on the official website.20% of the FLOCK supply is designated for the presale. Currently, during the presale stage, investors can buy $FLOCK tokens for $0.0056785. The price increases at each subsequent stage.The vote-to-earn model will go live after the presale in the third phase of the roadmap. But stake-to-earn is live. Over 34 million FLOCK tokens have already been staked.","Flockerz is a memecoin that aims for, potentially, high standards of decentralisation. It plans to implement decentralised governance with a unique vote-to-earn model, rewarding participants for their active role in decision- making. The project has garnered attention from crypto influencers like ClayBro.","https://static.toiimg.com/thumb/msid-114305369,imgsize-110964,width-838,resizemode-4/114305369.jpg"
"Airbus to slash up to 2,500 jobs in struggling space division",https://timesofindia.indiatimes.com/business/international-business/airbus-to-slash-up-to-2500-jobs-in-struggling-space-division/articleshow/114282664.cms,"File photo

Airbus is set to cut up to 2,500 jobs in its satellite division , signaling further turbulence for the European aerospace sector, a source revealed Wednesday. The aviation giant has begun notifying worker representatives, though specific details of the job cuts remain unclear.As per the report, the layoffs are expected to hit the company’s defense and space division , which employs 35,000 people and accounted for €2 billion of Airbus’s €65.4 billion revenue last year.The division, once a leader in telecommunications satellites , has been struggling amid falling demand and heightened competition from the likes of SpaceX and its Starlink satellite constellation.Airbus's net profit plunged by 46% in the first half of 2024, largely due to a €989-million writedown in the space business. CEO Guillaume Faury acknowledged the division’s troubles during the company's financial report in July, noting, ""We are addressing the root causes of these issues.""This latest round of job cuts follows a €600-million charge taken by the division earlier in 2023. France's Thales, another major player in the industry, also restructured its space division earlier this year, reassigning 1,300 positions.Despite being the world leader in telecommunications satellites, Airbus is facing increased pressure as the market for custom-built telecommunication and navigation satellites contracts.","Airbus is set to cut up to 2,500 jobs in its satellite division, a source revealed Wednesday. The layoffs are expected to hit the company’s defense and space division. The division, once a leader in telecommunications satellites, has been struggling amid falling demand and heightened competition.","https://static.toiimg.com/thumb/msid-114282956,imgsize-94272,width-400,resizemode-4/114282956.jpg"
LVMH: LVMH sales fall 3% as China demand for luxury goods worsens,https://timesofindia.indiatimes.com/business/international-business/lvmh-sales-fall-3-as-china-demand-for-luxury-goods-worsens/articleshow/114280779.cms,"Representative image

Fashion, leather goods sales undershoot forecasts

French luxury giant LVMH reported a 3% fall in third-quarter sales on Tuesday, undershooting estimates in its first decline in quarterly sales since the pandemic as demand in China and Japan weakened, likely exacerbating investor worries.The world's biggest luxury group generated 19.08 billion euros ($20.8 billion) in revenue for the three months ending in September, a 3% fall on an organic basis, stripping out the effect of currencies, acquisitions and divestitures.The figure missed a consensus estimate of 2% organic growth cited by Barclays.The group ""badly"" undershot expectations, with ""misses across the board,"" said Luca Solca, an analyst at Bernstein.The sales report, the first of the quarter from the large luxury companies, comes after a rollercoaster for luxury stocks in recent weeks, as stimulus measures in China briefly fueled hopes of a recovery.Chinese consumer confidence has slumped to the all-time lows of the COVID-19 era, LVMH Chief Financial Officer Jean-Jacques Guiony said on an analyst call, though he added that the company still believed in the future of the market.The LVMH sales, and a bigger decline at smaller Italian firm Ferragamo, will do little to steady the market.""LVMH being the sector proxy for many, this print will inevitably cause more short-term volatility,"" said Flavio Cereda, co-manager of GAM's Luxury Brands investment strategy, a fund that owns shares in luxury stocks.The fashion and leather goods division, home to Louis Vuitton and Dior labels, reported a sales decline of 5%, well below consensus expectations for 4% growth, and the first fall for the business since 2020.""The fashion division saw slight improvement with Europeans and Americans but worse performance with Chinese and Japanese,"" Guiony said.Fashion and leather goods comprise almost half of LVMH revenue and nearly three-quarters of its recurring profit.In Asia - excluding Japan - of which the Chinese market is a dominant share, the sales decline worsened to a 16% slide from a 14% drop in the prior quarter.A post-pandemic spending spree lost momentum last year, and China's property crisis has weighed on shoppers' confidence. Hopes that government stimulus measures could quickly reignite enthusiasm for high-end merchandise have yet to be fulfilled.In Japan, LVMH said growth sharply slowed to 20% from the previous quarter's 57% jump due to a stronger yen.The results will likely be viewed negatively by the market, said Piral Dadhania, an analyst with RBC, noting they indicated a ""more pronounced slowdown than expected.""UBS has predicted that the third quarter will be the worst for the sector in four years, with a 1% decline in organic sales year-on-year.","World's biggest luxury group generated 19.08 billion euros ($20.8 billion) in revenue for the three months ending in September. The figure missed a consensus estimate of 2% organic growth cited by Barclays. The fashion and leather goods division, home to Louis Vuitton and Dior labels, reported a sales decline of 5%.","https://static.toiimg.com/thumb/msid-114284342,imgsize-47264,width-400,resizemode-4/114284342.jpg"
Which crypto will offer you the highest ROI before year-end? Bitcoin (BTC) and 3 Altcoin–contenders to watch,https://timesofindia.indiatimes.com/business/international-business/which-crypto-will-offer-you-the-highest-roi-before-year-end-bitcoin-btc-and-3-altcoincontenders-to-watch/articleshow/114276551.cms,"ROI Before Year End Image

1. Bitcoin - The digital gold

2.

DogWifHat

- Ready to break out

3.

Sui

- Native

USDC

brings more users to this important blockchain

4.

Cutoshi

- A Defi coin in a meme coin’s clothing

For more information on the Cutoshi (CUTO) Presale:

Join and become a community member:

Disclaimer: Crypto products and NFTs are unregulated and can be highly risky. There may be no regulatory recourse for any loss from such transactions. The above content is non-editorial, and TIL hereby disclaims any and all warranties, expressed or implied, relating to the same. TIL does not guarantee, vouch for or necessarily endorse any of the above content, nor is it responsible for them in any manner whatsoever. The article does not constitute investment advice. Please take all steps necessary to ascertain that any information and content provided is correct, updated and verified.

In 2024, we have witnessed a crypto bull run, in line with historical 4-year bitcoin cycles. And, in line with history, many feel that the altcoin market is about to pop. So, which cryptos should you consider adding to your portfolio before the year ends?Read more to find out!Bitcoin, as the first and most decentralised crypto, continues to lead the market.Its supremacy in the crypto world has been confirmed by the SEC’s approval of spot ETFs , which could potentially attract institutional investors to try Bitcoin.Despite global conflict and many large holders (such as the German Government) making a profit, Bitcoin is still sitting above $60,000, proving that the BTC price always ends up higher over time.While smaller cap coins have the potential to exceed Bitcoin’s ROI this year, one thing is sure - no crypto portfolio is complete without the ever-ascending Bitcoin.It’s called digital gold for a reason - bringing potential short-term gains but also long-term stability to crypto investors.Only in crypto could an (admittedly adorable) picture of a dog with a hat become an investment vehicle with a market cap of $2.2 billion. Dogwifhat is one of Solana’s most popular meme coins, and so offers exposure to Solana as well as WIF.Given that WIF has partnered with many trading platforms and is rumoured to have a listing on Coinbase, experts believe that WIF has the potential for a resurgence by the end of the year, potentially reaching $3 or more. That’s a 50% gain from today’s prices and a good ROI for any portfolio.Sui is one of many Layer 1 blockchains. But it’s currently undergoing many important technological advancements.Stablecoin USDC is now available directly on-chain (instead of needing to use the bridged version wUSDC). Since only USDC is fully backed by the dollar, this brings safety, liquidity, and increased interoperability to SUI.Stablecoins are a vital part of a healthy DeFi ecosystem, and so this move should increase SUI’s on-chain activity and TVL (Total Value Locked), therefore increasing the price of $SUI.The effects are already being seen, with SUI’s on-chain activity doubling on October 2nd and the price of SUI being up by 95% on the monthly charts.Furthermore, SUI is fast, scalable, and easy to develop.Although SUI has experienced a slight correction in the past few days, this could represent a great buying opportunity for the coin, which is up by 329% on the yearly charts. Cutoshi (CUTO) is a brand-new coin that is in presale. Based on the Chinese Lucky Cat, at first glance, Cutoshi seems like a memecoin. And it certainly has memecoin appeal.But the Cutoshi team has a mission - to bring DeFi to the masses while offering the fun and big potential gains of a viral memecoin.Cutoshi aims to position itself as the memecoin that stays true to Satoshi Nakamoto's vision. It is decentralised and anonymous and aims to provide financial freedom for its community.The team are building a decentralised exchange, a gamified yield farming platform and a learning academy to introduce new users to DeFi.Cutoshi has raised over $300,000 and is in the first stage of its presale at $0.15.While new coins present a higher risk than established coins like Bitcoin, they also bring the potential for the highest gains. Some predict that the coin could rise to around $1.25, which would represent a 700% gain for investors.","In 2024, we have witnessed a crypto bull run, in line with historical 4-year bitcoin cycles. Many feel that the altcoin market is about to pop. So, which cryptos should you consider adding to your portfolio before the year ends? Read more to find out!","https://static.toiimg.com/thumb/msid-114276774,imgsize-77958,width-838,resizemode-4/114276774.jpg"
