Article Title,Article Link,Article Text,Article Summary,Article Image
‘Negligence of railway…’: Why Indian Railways has been asked to pay Rs 4.7 lakh to a passenger for bag theft,https://timesofindia.indiatimes.com/business/india-business/negligence-of-railway-why-indian-railways-has-been-asked-to-pay-rs-4-7-lakh-to-a-passenger-for-bag-theft/articleshow/114307017.cms,"NCDRC dismissed Indian Railways' argument that under Section 100 of the Railway Act, they are not responsible for loss. (AI image)

The National Consumer Disputes Redressal Commission ( NCDRC ) has ordered Indian Railways to compensate a passenger whose belongings were stolen on the Amarkantak Express in May 2017.The passenger, Dilip Kumar Chaturvedi, had taken ""reasonable precautions"" to secure his luggage, but the Travelling Ticket Examiner (TTE) failed to prevent ""outsiders"" from entering the reserved coach. According to a TOI report , the NCDRC dismissed Indian Railways' argument that under Section 100 of the Railway Act, they are not responsible for loss, destruction, or deterioration of luggage unless it has been booked and a receipt has been given.The bench imposed a cost of Rs 20,000 on Indian Railways for causing mental agony to the passenger and said, ""...it is concluded that Railways is liable for the theft, and there was deficiency in service provided to the petitioner (passenger) owing to negligence of railway officials concerned.""Also Read | India’s first high-speed 280 kmph trains soon! ICF awards contract for new trainsets to BEML The incident occurred on May 9, 2017, when Chaturvedi and his family were travelling from Katni to Durg in a sleeper coach. He filed an FIR with the railway police , saying that his luggage, containing cash and articles worth around Rs 9.3 lakh, had been stolen around 2.30 AM.Chaturvedi initially filed a case in the Durg district consumer commission, which directed the South East Central Railway GM, Durg station master, and Bilaspur GRP thana in-charge to pay the claimed amount. However, the respondents challenged the order in the state commission, which quashed the district commission's order.Also Read | ‘One of the biggest…’: New Indian Railways rail-road bridge over river Ganga in Varanasi approved by Cabinet Chaturvedi then filed a revision petition before the NCDRC, arguing that the TTE and railway police staff were grossly negligent in allowing unauthorized persons to enter the reserved coach.His counsel submitted that the stolen luggage was properly secured and that the defense of Section 100 cannot be applied in cases of negligence.The NCDRC ultimately ruled in favor of Chaturvedi, ordering Indian Railways to pay nearly Rs 4.7 lakh in compensation for the theft and the deficiency in service provided due to the negligence of railway officials.","Dilip Kumar Chaturvedi's belongings were stolen on the Amarkantak Express in May 2017. The Travelling Ticket Examiner (TTE) failed to prevent ""outsiders"" from entering the reserved coach. NCDRC dismissed Indian Railways' argument that under Section 100 of the Railway Act, they are not responsible for loss.","https://static.toiimg.com/thumb/msid-114307346,imgsize-63698,width-400,resizemode-4/114307346.jpg"
'Where will the dogs go...': Tata Sons Chairman N Chandrasekaran recalls his memorable moments with Ratan Tata in heartfelt post,https://timesofindia.indiatimes.com/business/india-business/where-will-the-dogs-go-tata-sons-chairman-n-chandrasekaran-recalls-his-memorable-moments-with-ratan-tata-in-heartfelt-post/articleshow/114206597.cms,"N Chandrasekaran, Chairman of Tata Sons has shared heartfelt reflections on the life and legacy of Ratan Tata. (Image source: N Chandrasekaran LinkedIn)

Below is the full text of N Chandrasekaran’s LinkedIn post:

Anybody who met Mr. Tata came away with a story about his humanity, warmth, and dreams for India. There really was no one like him.

Our relationship grew over the years, first focusing on business and eventually evolving into a more personal connection. We discussed interests ranging from cars to hotels, but when our conversations turned to other matters—those of daily life—he would show how much he noticed and felt. He was someone to be discovered, over time and through experience.

I remember several such instances.

Just after I became Chairman, I was introduced to a situation within Tata Motors which involved a dispute between the company and the employees’ union over wages for two years. In March ‘17, Mr. Tata and I met the union leaders together. During the meeting, Mr. Tata relayed three messages: he regretted the delay in finding a resolution. He explained that the company was passing through hardship. And both of us committed that this dispute would be concluded within a fortnight.

Mr. Tata’s direction squarely focused on making sure employees were well taken care of—not just to resolve the dispute, but to ensure their and their families’ well-being. Across other Group companies, his perspective on employees was uniform. It is something that has shaped a number of our leaders across the Group.

Around that same time, I expressed a desire to renovate our headquarters, Bombay House. Bombay House had not been touched since 1924, and more important (as many people told me) Mr. Tata would not like it. “Bombay House is a temple,” I was told, emphasising its sanctity.

When I finally mentioned to Mr. Tata about Bombay House, he said, “May I ask you something? When you say ‘renovate’, do you mean ‘vacate’?”

I explained that we planned to move everyone to a nearby office.

He gently clarified: “Where will the dogs go?”

The dogs were an integral part of Bombay House, often seen at the reception.

“We will build a kennel.”

“Really?” he said, considering it.

When the renovation of Bombay House was complete, Mr. Tata wanted to see the kennel first.

He was very happy to see how thoughtful the kennel’s design was, and how well the dogs would be cared for.

Seeing his happiness with the kennel and his priorities was a reminder that while big projects are important, it’s the details that reveal how we think, what we prioritise, and how we are perceived. His joy was confirmation that we had done the right thing.

If Mr. Tata ever visited a place, he could recall everything—from the placement of smallest piece of furniture, the lighting, colours, and so on. His memory was photographic. He remembered the covers and content of books and magazines and referred to them even years later. He was always observing and processing, from large ideas to minute detail.

There is so much else to say about who he was, but for now, as I process his absence, this will have to do: His eye received everything clearly, as his mind perceived everything clearly.","N Chandrasekaran, Chairman of Tata Sons has shared heartfelt reflections on the life and legacy of Ratan Tata. He said: “There really was no one like him.” He added that Tata’s direction squarely focused on making sure employees were well taken care of.","https://static.toiimg.com/thumb/msid-114206780,imgsize-142118,width-400,resizemode-4/114206780.jpg"
DA: Dearness allowance hiked! Diwali comes early for central government employees as Cabinet approves 3% DA hike,https://timesofindia.indiatimes.com/business/india-business/dearness-allowance-hiked-diwali-comes-early-for-central-government-employees-as-cabinet-approves-3-da-hike/articleshow/114275453.cms,"DA for central government employees is determined using the most recent Consumer Price Index for Industrial Workers.

Dearness Allowance/Dearness Relief is paid to central government employees/pensioners to adjust the cost of living and to protect their basic pay/pension from erosion in the real value.

DA/DR for employees/pensioners increased by 3% from 1.07.2024

The financial implication for the hike will be Rs 9,448 crore.

DA hike and DR for central government employees : Diwali 2024 came early for central government employees/pensioners with PM Narendra Modi-led Union Cabinet approving the much awaited dearness allowance and dearness relief hike. The dearness allowance/dearness relief has been hiked by 3%.Generally, the central government assesses and adjusts the DA twice yearly, in January and July, with official announcements made subsequently.While serving employees receive DA, pensioners are entitled to Dearness Relief.The last DA adjustment, a 4% hike, was announced in March, with effect from January 2024. After that central government employees were eligible for DA of 50% of their basic salary, while pensioners receive a DR of 50% of their basic pension.The increase in DA and DR would provide financial relief to approximately 1.15 crore central government employees and pensioners, offering a substantial monetary support amidst the rising cost of living.DA serves as a component of the salary intended to mitigate the effects of inflation. A hike in DA periodically adjusts the effective salary of government employees to maintain their purchasing power.Dearness Allowance or DA for central government employees is determined using the most recent Consumer Price Index for Industrial Workers (CPI-IW) data. This index is released on a monthly basis by the Labour Bureau, which operates under the Ministry of Labour. To calculate the DA percentage under the 7th Pay Commission, the following formula is used:7th CPC DA% = [{12 month average of AICPI-IW (Base Year 2001=100) for the last 12 months – 261.42}/261.42x100]It is worth noting that when a DA or DR increase is announced, it is typically applied retroactively from January 1 and July 1 of the current year. Traditionally, the central government declares the July DA increase prior to the onset of the festive season.","DA/DR for employees/pensioners increased by 3% from 1.07.2024. The financial implication for the hike will be Rs 9,448 crore. DA for central government employees is determined using the most recent Consumer Price Index for Industrial Workers.","https://static.toiimg.com/thumb/msid-114276052,imgsize-62214,width-400,resizemode-4/114276052.jpg"
"RTGS transactions in dollar, pound and euros soon? Here’s what RBI is planning",https://timesofindia.indiatimes.com/business/india-business/rtgs-transactions-in-dollar-pound-and-euros-soon-heres-what-rbi-is-planning/articleshow/114239071.cms,"RTGS, which is used for real-time fund transfers between banks, is operated by the RBI. (AI image)

RTGS in dollars soon? Real Time Gross Settlement System or RTGS could possibly be expanded to include the settlement of transactions in major trade currencies such as the US dollar, euro, and pound sterling. The RTGS, which is used for real-time fund transfers between banks, is operated by the RBI RBI governor Shaktikanta Das has said that the central bank is considering widening the scope of RTGS.This expansion would be achieved through bilateral or multilateral arrangements. Expanding RTGS to include major trade currencies would speed up access to more affordable cross-border payments and remittances.The RBI has consistently advocated for more affordable cross-border payment systems. In September 2023, deputy governor T Rabi Sankar described the current high costs associated with cross-border remittances as ""simply unconscionable."" An expanded RTGS using major trade currencies would facilitate faster access to less expensive cross-border payments and remittances.According to an ET report, Das, speaking at the RBI@90 conference in New Delhi, mentioned that ""India and a few other economies have already commenced efforts to expand linkage of cross-border fast payment systems both in the bilateral and multilateral modes.""In addition to the potential expansion of RTGS, Das emphasized the role of central bank digital currencies (CBDCs) in enabling efficient cross-border payments.However, he noted that harmonization of standards and interoperability would be necessary to facilitate this process. While countries may prefer to design their own systems based on domestic considerations, Das suggested that this challenge could be overcome by developing a plug-and-play system that allows replicability of India's experience while maintaining the sovereignty of respective countries.","Real Time Gross Settlement System or RTGS could possibly be expanded to include the settlement of transactions in major trade currencies such as the US dollar, euro, and pound sterling. The expansion would be achieved through bilateral or multilateral arrangements. An expanded RTGS would facilitate faster access to less expensive cross-border payments and remittances.","https://static.toiimg.com/thumb/msid-114240083,imgsize-81484,width-400,resizemode-4/114240083.jpg"
RIL bonus share: Mukesh Ambani-led Reliance Industries sets record date for 1:1 bonus share,https://timesofindia.indiatimes.com/business/india-business/ril-bonus-share-mukesh-ambani-led-reliance-industries-sets-record-date-for-11-bonus-share-details-here/articleshow/114290660.cms,"RIL bonus shares: The issuance of bonus shares in a 1:1 ratio was initially announced by Mukesh Ambani during the 28th AGM.

RIL bonus share issue: What does it mean for investors?

RIL bonus share record date : Mukesh Ambani-led Reliance Industries (RIL), a diversified conglomerate spanning from oil to retail, has announced that the record date for determining shareholders eligible for the 1:1 bonus share issue will be Monday, October 28, 2024.The issuance of bonus shares in a 1:1 ratio was initially announced by Mukesh Ambani , the company's chairman, during the 28th annual general meeting (AGM).""We are in the business of creating wealth for India and enhancing the quality of life of every Indian, every single day,"" Ambani had said, emphasizing that when Reliance grows, shareholders are rewarded handsomely.The company has received shareholder approval for both the bonus share issue and the increase in its authorised share capital, as per a filing with the stock exchanges.According to an ET report, the resolution for the bonus share issue received overwhelming support, with 99.92% of the votes cast in favor and only 0.07% against it.Similarly, the resolution for increasing the authorised share capital and amending the Capital Clause of the Memorandum of Association garnered 98.96% votes in favor, while 1.04% were against it.Following the changes, RIL's authorised share capital now stands at Rs 50,000 crore, comprising 4,900 crore equity shares of Rs 10 each and 100 crore preference shares of Rs 10 each.According to a regulatory filing by RIL, ""The bonus shares will be issued out of securities premium account received in cash and/or general reserve and/or retained earnings available as of March 31, 2024."" The corporate action will result in the company's authorised share capital increasing from Rs 15,000 crore to Rs 50,000 crore, as previously reported by ET.RIL has announced a 1:1 bonus issue, which means that for every existing share held by its 35 lakh shareholders, they will receive one additional share at no cost. As a result, if an investor currently owns 1,000 RIL shares, their holding will increase to 2,000 shares after the bonus issue.It is important to note that while the number of shares held by each shareholder will double, the total value of their investment will remain unchanged. This is because the share price will be adjusted proportionately to reflect the increased number of outstanding shares.One of the primary benefits of bonus issues is the improvement in stock liquidity. With a larger number of shares available in the market, a wider range of investors can access and trade the stock more easily.Throughout its history, RIL has issued bonus shares on five occasions. The first bonus issue was in 1980 at a ratio of 3:5, followed by a 6:10 bonus issue in 1983. The most recent three bonus issues, in 1997, 2009, and 2017, have all been in the ratio of 1:1.","RIL has announced a 1:1 bonus issue, which means that for every existing share held by its 35 lakh shareholders, they will receive one additional share at no cost. The company has received shareholder approval for both the bonus share issue and the increase in its authorised share capital. If an investor currently owns 1,000 RIL shares, their holding will increase to 2,000 after the bonus issue.","https://static.toiimg.com/thumb/msid-114290788,imgsize-15334,width-400,resizemode-4/114290788.jpg"
"here’s how much extra salary, pension central government staff & pensioners will get",https://timesofindia.indiatimes.com/business/india-business/da-hike-calculator-dearness-allowance-relief-hiked-by-3-heres-how-much-extra-salary-pension-central-government-staff-pensioners-will-get/articleshow/114304663.cms,"Dearness allowance, a component of the salary for government employees, has been increased to 53%. (AI image)

DA Hike Calculator: How much will the take home salary increase?

To understand the impact of this 3% DA hike, let's consider an example:

Assuming a central government employee has a basic pay of Rs 46,200, their previous dearness allowance at 50% was Rs 23,100. With the DA now at 53%, their dearness allowance will increase to Rs 24,486.

This means they will receive an additional Rs 1,386 (Rs 24,486 - Rs 23,100) in DA from October. As the DA hike is effective from July 1, 2024, they will also receive arrears for the last three months.

DR Hike Calculator: How much will the pension increase?

If a central government pensioner receives a basic pension of Rs 50,400 per month, at the previous 50% DR, they were getting Rs 25,200.

With the DR now at 53%, they will receive Rs 26,712 monthly as dearness relief. This means their pension will increase by Rs 1,512 per month.

DA hike calculator : PM Narendra Modi-led Union Cabinet has approved a 3% increase in the dearness allowance (DA) for central government employees on October 16, 2024. Additionally, the dearness relief (DR) for central government pensioners has also been raised by 3%. As a result of this latest hike, the DA and DR now stand at 53% for both central government employees and pensioners respectively.This decision is set to benefit over 1 crore individuals.The dearness allowance, a component of the salary for government employees and pensioners, has been increased to 53%. This rise in DA will lead to an increase in the take-home salary of central government employees starting from October 2024.The effective date for the increased DA and DR is July 1, 2024. The central government typically revises these allowances twice a year, in January and July, with official announcements being made at a later date. Consequently, the DA/DR hike is implemented retrospectively from the cut-off date of July 1, 2024.Also Read | Dearness allowance hiked! Diwali comes early for central government employees & pensioners Central government employees can expect to receive the increased DA starting with their October salary, following the announcement of the hike on October 16, 2024. Moreover, they will be entitled to arrears for the previous three months, covering July, August, and September, according to an ET report.Similarly, the dearness relief for central government pensioners has been raised by 3%, bringing it to 53%. This increase will result in a higher monthly pension for these pensioners starting from October 2024. Let's consider an example to understand the impact:","Dearness allowance, a component of the salary for government employees, has been increased to 53%. PM Narendra Modi-led Union Cabinet has approved a 3% increase in the dearness allowance (DA) for central government employees on October 16, 2024. The dearness relief (DR) for government pensioners has also been raised by 3%. As a result of this latest hike, the DA and DR now stand at 53% for both government employees and pensioners.","https://static.toiimg.com/thumb/msid-114305765,imgsize-60934,width-400,resizemode-4/114305765.jpg"
‘Will do the best to serve…’: Starlink owner Elon Musk reacts to Jyotiraditya Scindia’s comments,https://timesofindia.indiatimes.com/business/india-business/will-do-the-best-to-serve-starlink-owner-elon-musk-reacts-to-jyotiraditya-scindias-comments/articleshow/114274303.cms,"Elon Musk commits to serving India through Starlink, following the government's decision to allocate satellite spectrum administratively. This move sets up competition with Reliance Jio and Bharti Airtel, with Starlink expected to receive a GMPCS license soon.","The move sets up competition with Reliance Jio and Bharti Airtel, with Starlink expected to receive a GMPCS license soon. Elon Musk commits to serving India through Starlink, following the government's decision to allocate satellite spectrum administratively.","https://static.toiimg.com/thumb/msid-114274889,imgsize-18694,width-400,resizemode-4/114274889.jpg"
Reliance Retail to buy 51% in Mothercare's India ops,https://timesofindia.indiatimes.com/business/india-business/reliance-retail-to-buy-51-in-mothercares-india-ops/articleshow/114332292.cms,"MUMBAI: Reliance Retail Ventures has agreed to acquire a 51% stake in Mothercare's India operations for 16 million pounds (about Rs 175 crore). The deal follows Reliance's previous purchase of British toy retailer Hamleys in 2019. Mothercare, a London-listed retailer specialising in baby products , will retain a 49% stake in its India unit. This unit also holds the brand rights for several South Asian countries including Nepal, Sri Lanka, Bhutan, and Bangladesh.The deal will provide Mothercare a solution to its financial difficulties .Despite once being one of the UK's most valuable listed retailers, the company has experienced a steady decline in market capitalisation over the past two decades, resulting in a current market capitalisation of only 20 million pounds.In 2018, Reliance initially acquired the franchisee rights to the Mothercare brand for the India region. Currently, Reliance operates 87 Mothercare stores across 25 cities and maintains a presence on e-commerce platforms. With this new development, all activities related to Mothercare, including brand ownership, intellectual property assets and franchisee rights, will be consolidated under the India unit, which will be a 51:49 joint venture between Reliance and Mothercare.","Reliance Retail Ventures has agreed to acquire a 51% stake in Mothercare's India operations. The deal follows Reliance's previous purchase of British toy retailer Hamleys in 2019. Mothercare, a London-listed retailer specialising in baby products, will retain a 49% stake.","https://static.toiimg.com/thumb/msid-114332303,imgsize-54418,width-400,resizemode-4/114332303.jpg"
"Infosys Q2 revenue up 3.3%, Wipro's drops 2.3% YoY",https://timesofindia.indiatimes.com/business/india-business/infosys-q2-revenue-up-3-3-wipros-drops-2-3-yoy/articleshow/114332230.cms,"BENGALURU: The Sept quarter results of IT majors Infosys and Wipro revealed signs of promising growth in their mainstay BFSI businesses. Clients, however, remain prudent when it comes to discretionary spending, suggesting that overall market sentiment is still guarded.Infosys saw a 3% year-on-year growth in revenue in constant currency in the Sept quarter, showing some revival in its BFSI business.Quarter-on-quarter, revenue rose 3.1%. The company revised its guidance upwards to a range of 3.75% to 4.5%, marking the third quarter in a row when it has adjusted its guidance. This is an improvement from the June quarter's guidance of 3% to 4%, which it had raised from the 1% to 3% called out in the March quarter.peer Wipro's revenue dropped 2.3% in constant currency in the Sept quarter compared to the year-ago period, but rose 0.6% sequentially. Wipro had forecast a revenue growth of -1% to 1% for the period. Wipro CEO Srini Pallia said that with strong account mining and traction in the Capco business, BFSI continued to accelerate, delivering 2.7% sequential growth. ""This growth was led by the Americas. Additionally, we are seeing momentum in both APMEA and Europe. This marks the third consecutive quarter of growth in BFSI.""Wipro's operating margin came in at 16.8% - a 35 basis point rise sequentially and 71 basis point rise year-on-year. In the Americas 2 region, a sequential growth of 0.8% was recorded, largely supported by strong demand and execution within the BFSI sector. Europe, however, faced challenges, resulting in a sequential decline of 0.1%. The decline can be attributed to overall weak demand and client-specific issues in a few accounts.Infosys and Wipro's shares dropped 2% and 1.6% respectively in early trades on the NYSE.",Infosys saw a 3% year-on-year growth in revenue in constant currency in the Sept quarter. The company revised its guidance upwards to a range of 3.75% to 4.5%. Wipro had forecast a revenue growth of -1% to 1% for the period.,"https://static.toiimg.com/thumb/msid-114332267,imgsize-915785,width-400,resizemode-4/114332267.jpg"
