Article Title,Article Link,Article Text,Article Summary,Article Image
Rajnath admits Centre initiated talks in 2016 'but Hurriyat shut their doors',https://timesofindia.indiatimes.com/india/rajnath-admits-centre-initiated-talks-in-2016-but-hurriyat-shut-their-doors/articleshow/113177606.cms,"NEW DELHI: Defence minister Rajnath Singh revealed on Sunday that in September 2016, four Opposition MPs had attempted to engage with Hurriyat Conference leaders as part of the central government 's efforts to initiate peace talks in Kashmir . However separatist leaders refused to meet with the delegation, Singh said while addressing an election rally in the Ramban assembly constituency in Jammu.Singh, who was serving as the home minister then, recounted his discussions with the then-chief minister of Jammu & Kashmir Mehbooba Mufti, assuring her that the situation in Kashmir would normalize. He also mentioned that a delegation of MPs, led by Singh himself, had visited the state during that period.The delegation included senior leaders such as Sharad Yadav from the JDU and representatives from Left parties. Singh had suggested that these leaders engage with the Hurriyat Conference, as the BJP was not well-received by the separatists. However, when Sharad Yadav and some Left leaders approached the Hurriyat leaders, they were met with closed doors and a refusal to engage in dialogue with the country's senior MPs.""There were senior leaders like Sharad Yadav (of the JDU) and from the Left parties (in the delegation). I told them that we are from the BJP and the Hurriyat people do not like us and they get irritated on seeing us. You talk to them and tell them that we are ready to talk, but there shall be peace in Kashmir. After asking me, Sharad Yadav and some Left leaders visited the Hurriyat Conference leaders, but they shut their doors on them, saying they will not talk with senior MPs of our country,"" the defence minister said.In his speech on Sunday, Singh also mentioned the filing of FIRs against Kashmiri youth who were involved in stone-pelting incidents that occurred after the death of Burhan Wani.Singh said, ""There were cases against young and innocent children and there were repeated demands from the people to withdraw the cases. People were demanding withdrawal of cases against innocent and minor children and I talked to Mehbooba and asked her to release them. We did everything but the way they (Hurriyat leaders) should have responded, they did not,"" Rajnath said.This marks the first time the central government has acknowledged its attempts to reach out to separatists in 2016, a period marked by widespread protests in Kashmir following the killing of militant commander Burhan Wani. The admission comes despite the Narendra Modi government's consistent portrayal in public of its tough stance against separatists.During the all-party delegation's visit to the state in September 2016, amidst violence that claimed 72 lives, four Opposition MPs broke away from the 26-member group and visited the Srinagar residence of hardline Hurriyat leader Syed Ali Shah Geelani, who was under house arrest. Geelani, however, snubbed the MPs and refused to open his doors.Hardline Hurriyat leader Syed Ali Shah Geelani didn’t let the MPs in as then-JDU leader Sharad Yadav and Communist leaders Sitaram Yechury and D Raja kept waiting at the door of his upscale Hyderpora residence for about ten minutes before returning.At the time, Singh had said that the MPs visited on their own, saying, ""I want to clarify that some members of the all-party delegation went to meet Hurriyat leaders. We had neither said no nor yes to their meetings (with separatists). You know what happened. I do not wish to go into the details.""He had further said, ""But whatever information those friends gave us upon their return, it can be said it was not Kashmiriyat (Kashmiri value system). It cannot be called insaniyat (humanity). When someone goes for talks and they reject it, it is not jamhooriyat (democracy) as well.""",Four Opposition MPs had attempted to engage with Hurriyat Conference leaders in September 2016. However separatist leaders refused to meet with the delegation. This marks the first time the central government has acknowledged its attempts to reach out to separatists. The admission comes despite the Narendra Modi government's consistent portrayal in public of its tough stance against separatists.,"https://static.toiimg.com/thumb/msid-113178477,imgsize-1673775,width-400,resizemode-4/113178477.jpg"
'He is no Pappu': What Sam Pitroda said about Rahul Gandhi in US,https://timesofindia.indiatimes.com/india/he-is-no-pappu-what-sam-pitroda-said-about-rahul-gandhi-in-us/articleshow/113178357.cms,"NEW DELHI: Congress leader Sam Pitroda on Monday responded to the opponents' ' Pappu ' jibe against Rahul Gandhi and claimed that he has a vision contrary to what BJP promotes.While addressing the Indian diaspora in Texas, Pitroda said, ""He (Rahul Gandhi) has a vision contrary to what BJP promotes by spending crores of rupees. I must tell you, he is no Pappu.""""He is highly educated, well-read, a strategist with deep thinking on any subject and sometimes it is not very easy to understand him,"" he added.Pitroda further praised Rahul and said that his agenda is to celebrate diversity.""Rahul Gandhi has a different agenda which is more focused on something that we have been trying to address for a long time but have not been able to quite address well and that is inclusion, celebration of diversity..,"" he said.""When Rahul Gandhi was here last time visiting us at a major meeting in New York, there was a demand for him to come to Dallas and he promised them that during my next trip I will come to Dallas and he is keeping his promise. He walks the talk and I am delighted that from his busy schedule he could take three days off to come visit us where he is spending a day here and two days in Washington DC,"" he added.Pitroda's past statements have often provided the BJP with opportunities to criticize the Congress. In one instance, he remarked that temples would not solve India's problems related to unemployment, inflation, education, and health, emphasizing the need to focus on these pressing issues rather than solely on religious matters.Additionally, Pitroda's controversial comments on the 1984 anti-Sikh riots and the Balakot air strikes following the Pulwama attacks have drawn significant criticism. In May 2019, he responded with ""hua to hua"" (so what) when questioned about the 1984 riots, while in February 2019, he raised doubts about the effectiveness of the air strikes, suggesting that reacting with military action may not be the most appropriate approach to dealing with the world.",Congress leader Sam Pitroda responded to the opponents''Pappu'jibe against Rahul Gandhi. He claimed that he has a vision contrary to what BJP promotes. PitroDA's past statements have often provided the BJP with opportunities to criticize the Congress.,"https://static.toiimg.com/thumb/msid-113178410,imgsize-1193056,width-400,resizemode-4/113178410.jpg"
Thousands take to streets in 25 countries: Protests over Kolkata rape-murder erupt across 130 cities,https://timesofindia.indiatimes.com/india/thousands-take-to-streets-in-25-countries-protests-over-kolkata-rape-murder-erupt-across-130-cities/articleshow/113177913.cms,"Thousands on Sunday protested across more than 130 cities in 25 countries to demand justice for the trainee doctor who was raped and murdered last month at RG Kar Medical College and Hospital in Kolkata on August 9.The demonstrations began in various groups throughout Japan, Australia, Taiwan, and Singapore before expanding to cities in several European countries, with sixty planned in the United States.In Sweden's Stockholm, a large group of women assembled in Sergels Torg square to sing Bengali songs and hold signs demanding accountability for the crime and safety for Indian women.Dipti Jain, a British citizen and alumni of the Calcutta National Medical College and Hospital who organized the global protests told news agency Reuters, ""The news of this heinous crime committed on a young trainee doctor while on duty numbed and shocked each of us at the sheer ruthlessness, brutality and disregard of human life."" Last month, Jain had organized a protest for female doctors in the UK.The Supreme Court will be hearing the case on Monday.","Trainee doctor was raped and murdered last month at RG Kar Medical College and Hospital in Kolkata. Demonstrations began in Japan, Australia, Taiwan, and Singapore before expanding to cities in several European countries. In Sweden's Stockholm, a large group of women assembled in Sergels Torg square to sing Bengali songs and hold signs demanding accountability.","https://static.toiimg.com/thumb/msid-113178217,imgsize-152386,width-400,resizemode-4/113178217.jpg"
"A tiny flower nearly killed a tiger habitat, until a snip in time saved it",https://timesofindia.indiatimes.com/india/a-tiny-flower-nearly-killed-a-tiger-habitat-until-a-snip-in-time-saved-it/articleshow/113177559.cms,"TN forest department’s Lantana weed eradication drive helped restore the dying Mudumalai reserve and while doing so reduced human-wildlife conflicts

It’s hard to believe that one of the biggest threats to a tiger’s survival could come from a small, beautiful flower. Yet, Lantana camara , a tropical American shrub, has invaded over 40% of India’s tiger range, with the Shivalik hills, Central India, and the Southern Western Ghats being the worst affected.Introduced by the British in the 1800s as an ornamental plant from Latin America, the weed quickly spread across the country.By 2020, it was estimated to occupy more than 40% of India’s tiger habitats.Mudumalai Tiger Reserve (MTR) in the Nilgiris, home to more than 100 tigers, has also suffered from Lantana invasion, which has led to a decline in vegetation and green patches in its core and buffer zones. That’s when the question arose: Is MTR a dying forest?But then, in the last year, there has been a sudden transformation. Shoots of indigenous species began sprouting across the reserve, and the forest seems to be experiencing a complete regeneration of vegetation. Wildlife officials say the recovery is due to concerted efforts to remove the invasive weeds, which helped restore the ecosystem.The MTR comprises 32,100 hectares of core zone across six ranges, with an additional 36,700 hectares in the buffer zone spread over four ranges. Faced with a threat to the ecosystem, invasive and exotic species such as Lantana camara, Senna spectabilis, Prosopis juliflora and wattle are being removed. While the buffer zone— a shrub forest—is infested with various invasives, the core zone, a dense forest, is overrun by Lantana. The process of removing these invasives began in early 2022.In the buffer zone of MTR, about 20% of the area is en croached by invasive species , while the core zone sees at least 50% occupied mainly by Lantana. “Continuous removal of invasives has led to regeneration of natural grass and other indigenous species,” says D Venkatesh, conservator of forests and field director of MTR. “We maintain the cleared areas, but this process needs to continue for five years for the forest to be free from invasives.” He adds that while the invasives are initially fully uprooted, seeds or small roots left behind pose a threat as their dormancy period can last up to 50 years, potentially allowing them to sprout again even decades later.Lantana camara is a perennial shrub that grows about 2m-5m tall and forms dense thickets in various environments. “Lantana is the primary invasive species in MTR, suppressing the natural regeneration of grasses and indigenous species. Once it’s cleared, removing secondary invasives becomes easier,” says Venkatesh.MTR is home to 25 species of grasses and legumes, including a protein-rich variety of grass. “Wild animals help spread the seeds of these species across the forest, maintaining a natural cycle facilitated by wildlife in any forest land,” says Venkatesh.“Even after uprooting invasives, the forest will witness subsequent resprouting,” says Arun Kumar, deputy director of MTR-buffer zone. “This makes maintenance important. Without it, the initial efforts would be utterly wasted. The health of the habitat is important as regenerated grasslands attract herbivores, both small and large.”The forest department has identified key passages in the reserve for invasive removal. Arun Kumar says in the expansive 50-hectare area of the Singara range, where invasive removal has been done and second-year maintenance is underway, herds of elephants are frequently attracted by the fresh grasses. “The health of a forest triggers a chain reaction in the ecosystem. The natural regeneration of grasses and legumes can help reduce conflicts in fringe areas, as a healthy habitat tends to keep animals within their boundaries.”Tamil Nadu Newsprint & Paper Limited is involved in removing Senna spectabilis species, which is found in the buffer zone of MTR. “The bark of Senna is so resilient that even a small piece left behind can quickly resprout. Therefore, extra care is needed during the removal process,” he adds.C Vidhya, deputy director of the MTR-core zone, says the Senna species has only a scattered presence in MTR’s core area. “The real issue is Lantana. But we can’t say Lantana is all bad. It also provides ambush cover for carnivores and fruits for birds and monkeys. In some ways, it plays an eco-friendly role too. If we focus solely on tigers and herbivores, Lantana appears to be a threat.”Vidhya says 50% of the core area is infested with Lantana. “Our fight against Lantana focuses on crucial animal passages and riverines, ensuring removal does not open up the forest too fully. Riverines and water bodies are lifelines for animals during summer, and must be preserved.”The forest department has conducted individual assessments of every grid-compartment in the core zone. Officials say since herbivores don’t consume much Lantana, they don’t contribute to its propagation. Instead, Lantana fruits are primarily dispersed by birds and monkeys. After passing through their digestive systems, the seeds become even more viable, with a stronger tendency to sprout than through natural spread.Vidhya confirms the flourishing of grass and indigenous species is a direct result of Lantana removal. “When you remove invasive species, the ecosystem undergoes modifications, increasing the carrying capacity and utility index of the grasslands,” says Gajannan D Muratkar, advisor to 39 tiger reserves, including MTR and environmental science professor at Amaravathi University in Maharashtra. “An interconnected ecosystem forms between grasslands, modifying the diversity index of the ground flora. It helps contain small and large herbivores within these pockets.”Uprooting invasive species also corrects soil features such as moisture, colour and texture. The natural regeneration of grasses reflects the improved quality of the soil, he says.For Lantana removal, the forest department relies on local tribal communities, skilled in the techniques needed for this task. However, the department struggles with limited funds for the removal efforts, often using money generated from selling Senna species to support the work.In the core zone, 1,221 hectares have been identified as critical for Lantana removal, with about 355 hectares—29%—cleared. In the buffer zone, 1,615 hectares have been cleared and maintained into the second year. The process progresses stage by stage in other areas as well. “We’re seeing amazing results. Once fully completed, the forest ecosystem will sustain itself and support the wildlife,” says Venkatesh.","Lantana camara, a tropical American shrub, has invaded over 40% of India’s tiger range, with the Shivalik hills, Central India, and the Southern Western Ghats being the worst affected. Lantana is the primary invasive species in MTR, suppressing the natural regeneration of grasses and indigenous species.","https://static.toiimg.com/thumb/msid-113177618,imgsize-1460010,width-400,resizemode-4/113177618.jpg"
Two terrorists neutralised by Army in J&K's Nowshera,https://timesofindia.indiatimes.com/india/two-terrorists-neutralised-by-army-in-jks-nowshera/articleshow/113177556.cms,"NEW DELHI: Indian Army eliminated two terrorists during early hours of Monday after inputs from intelligence agencies and the Jammu and Kashmir Police about a potential infiltration attempt in Rajouri district's Nowshera area.The Army further revealed the recovery of large quantity of weapons as search 'operation Kanchi' continued.""Based on inputs from intelligence agencies and J&K Police regarding a likely infiltration bid, an anti-infiltration Operation was launched by Indian Army on the intervening night of 08-09 Sep 24 in general area Lam, Nowshera.Two terrorists have been neutralised and a large quantity of war like stores including two AK-47s and one pistol thus far recovered. Search operation is in progress,"" said the White Knight Corps unit of the army in a post on X.This comes just days before J&K is set to hold assembly election for the first time since 2014 and after the abrogation of Article 370 of the constitution. The polls will be held in J&K in three phase starting from September followed by the second phase on September 25 and concluding phase on October 1. The counting of votes will be on October 8. Rajouri will have voting during the second phase on September 25.Rajouri district has been a terrorist target in the past as well. Last month, the security forces busted an underground terrorist hideout in the district. The forces had said that a large amount of daily use items including cooking gas, blankets and utensils were recovered.",Indian Army eliminated two terrorists during early hours of Monday. The Army further revealed the recovery of large quantity of weapons as search 'operation Kanchi' continued. This comes just days before J&K is set to hold assembly election for the first time since 2014 and after the abrogation of Article 370.,"https://static.toiimg.com/thumb/msid-113177586,imgsize-923308,width-400,resizemode-4/113177586.jpg"
Nix Omar nomination over NC threats: BJP,https://timesofindia.indiatimes.com/india/nix-omar-nomination-over-nc-threats-bjp/articleshow/113177500.cms,The BJP is set to urge the Election Commission of India to cancel the nomination papers of National Conference vice president Omar Abdullah. This action follows accusations that he threatened people with death if they did not support his party. An additional deputy commissioner has lodged a complaint against him.,The BJP is set to urge the Election Commission of India to cancel the nomination papers of National Conference vice president Omar Abdullah. This follows accusations that he threatened people with death if they did not support his party. An additional deputy commissioner has lodged a complaint against him.,"https://static.toiimg.com/thumb/msid-113177518,imgsize-362060,width-400,resizemode-4/113177518.jpg"
"52% of rape, Pocso cases cleared but pendency at FTCs already 2L",https://timesofindia.indiatimes.com/india/52-of-rape-pocso-cases-cleared-but-pendency-at-ftcs-already-2l/articleshow/113177486.cms,"NEW DELHI: Even though the fast-track special courts set up by govt on the Supreme Court 's directions for expediting trial have disposed of 52% (2,14,463) out of 4,16,638 rape and Pocso cases since the initiation of the FTSC scheme in Oct 2019 till the end of last year, a backlog of over two lakh cases remains.The existing FTSCs will need to dispose of nearly 554 cases every day - that's one case every three minutes - to clear the backlog as of Dec 2023 within one year.As of Aug 2024, 755 FTSCs including 410 exclusive Pocso courts, are functional out of the 1,023 earmarked courts under the scheme.The findings are part of the ' Fast Tracking Justice ' report that looks at the role of FTSCs in reducing case backlogs.The report states that at the current disposal rate of 76,319 cases in FTSCs per year, India would need approximately three years to clear the existing backlog if no new cases are added. ""These estimated years can go on an infinity if new rape and Pocso cases are added to the existing fast-track courts and no new courts of this category are set up,"" the report brought out by non-profit ' India Child Protection ' says. It calls for making the remaining 268 FTSCs functional under the scheme and setting up at least 1,000 more to deliver within the timelines wherein trial in rape cases need to be completed within two months after filing of chargesheet and within one year in Pocso cases.The report says the number of cases for trial before FTSCs each year has also risen - from 1,95,991 in 2020 to 2,78,494 in 2023 - reflecting both addition of new cases and continuing challenge of managing pending caseloads. ""Correspondingly, the number of cases disposed by FTSCs each year has seen significant improvement, with 37,148 cases disposed in 2020, rising to 76,319 in 2023. Also the percentage of cases disposed during the year out of the total cases for trial (pending and new) has also shown an increase, rising from 19% in 2020 to 27% in 2023,"" the report says.Asserting the need to deal with pending cases, the report also assesses year-wise data of the number of new cases instituted and cases disposed in that year to compare what would be the status of disposal if there were no pending cases and the data represented only disposal for that year itself. For instance in 2023, 81,471 new rape and Pocso cases were instituted, while 76,319 cases were disposed by FTSCs, which comes to a disposal rate of 94%.""While all of the number of disposed cases may not be the same that came to FTSCs that year itself, this data indicates that India is close to reaching the tipping point to justice, a point when the number of cases disposed in a given year is equal to or greater than the number of new cases instituted during the same year. In this backdrop this report calls for expediting disposal of pending cases by creating 1,000 new FTSCs so that India is able to build on the momentum seen in terms of disposal rate,"" said Bhuwan Ribhu, child rights activist and founder of India Child Protection.Stating that there is no real-time data available on acquittal and conviction in rape and Pocso cases, the report calls for provided this data on the FTSC dashboard to enable assessment of the success of the courts.","Fast-track special courts set up by govt on Supreme Court's directions for expediting trial have disposed of 52% (2,14,463) out of 4,16,638 rape and Pocso cases since the initiation of the FTSC scheme in Oct 2019. A backlog of over two lakh cases remains.","https://static.toiimg.com/thumb/msid-113177492,imgsize-1304420,width-400,resizemode-4/113177492.jpg"
