Article Title,Article Link,Article Text,Article Summary,Article Image
"On wife’s suggestion, CJI Chandrachud arranges screening of 'Laapataa Ladies' to promote gender sensitisation",https://timesofindia.indiatimes.com/india/on-wifes-suggestion-cji-chandrachud-arranges-screening-of-laapataa-ladies-to-promote-gender-sensitisation/articleshow/112417045.cms,"NEW DELHI: On wife Kalpana Das ’s suggestion, CJI D Y Chandrachud on Friday arranged for an exclusive screening of acclaimed Hindi film ‘Laapata Ladies’ for the Supreme Court judges and staff but prior to that producer Aamir Khan and director Kiran Rao had a privileged preview of CJI’s Courtroom proceedings.It was Kalpana, who after watching the film, suggested to CJI Chandrachud for the screening of the film for the entire staff of the apex court as she felt that the movie conveyed a moving message on gender sensitisation.Coincidentally, in the 75th year of its establishment, the SC is observing a year-long gender sensitisation programme.It was a spectacle in the CJI’s courtroom, the largest and most ornate among all SC courtrooms. With a dozen seats separated with a barricade tape from areas crowded by lawyers, Khan dressed in a printed kurta and Rao in a blue saree over a white top, along with half a dozen their associates were seen keenly watching proceedings before the CJI and his colleague judges - J B Pardiwala and Manoj Misra.Security too was deployed to avoid any lawyer fan mobbing the celebrated actor. None did, as for them the court proceedings were more important. But, courtroom cameras, which usually focus on lawyers representing petitioners and respondents, were glued to Khan and Rao. So much so that, when the petitioner’s counsel was arguing, many a time he/she was not visible, though audible.After an hour or so, Khan either lost interest in the proceeding or to prepare for smooth screening or for some pressing engagement, left the courtroom, leaving Rao and two three others to continue sitting in the courtroom till 4 pm. The screening was scheduled from 4.15 pm till 6.20 pm.The SC registry informed that the judges interacted with Khan and Rao after the screening for about 15-20 minutes. Some judges did not attend. Few among them felt that close interaction with the actor and producer would not be ethical as there may be a case in future where a film involving Khan and Rao may get challenged in the SC.",CJI D Y Chandrachud arranged for an exclusive screening of acclaimed Hindi film ‘Laapata Ladies’ for the Supreme Court judges and staff. Producer Aamir Khan and director Kiran Rao had a privileged preview of CJI’s Courtroom proceedings.,"https://static.toiimg.com/thumb/msid-112417302,imgsize-59710,width-400,resizemode-4/112417302.jpg"
'Aazaadi ki subah ki pehli chai': Manish Sisodia shares selfie with wife a day after walking out of jail,https://timesofindia.indiatimes.com/india/aazaadi-ki-subah-ki-pehli-chai-manish-sisodia-shares-selfie-with-wife-a-day-after-walking-out-of-jail/articleshow/112416599.cms,"NEW DELHI: Aam Aadmi Party leader and former Delhi deputy chief minister Manish Sisodia on Saturday shared a heartwarming selfie on X, capturing a moment of him enjoying a cup of tea with his wife.This comes a day after Supreme court granted him bail in the Delhi liquor policy case. He had been lodged in Tihar jail for 17 months."" Aazaadi ki subah ki pehli chai ...17 mahine baad! (First tea on the morning of independence ... after 17 months!""), Sisodia wrote on X.""The freedom that the Constitution has given to all of us Indians as a guarantee of the right to life. The freedom that God has given us to breathe in the open air with everyone,"" he added.Upon his release from Tihar jail on Friday, Sisodia was greeted with a warm reception by AAP leaders and family members, amidst resounding chants of 'Bharat Mata ki Jai.' Thanking BR Ambedkar, Sisodia said it was only because of the power of the Constitution that he was out of jail today.""Ever since this order came in the morning, every inch of my skin has been feeling indebted to Babasaheb. I don't understand how we will pay off this debt to Babasaheb,"" he said.The top court granted bail to former Delhi deputy chief minister and pulled up the lower courts and saying his long incarceration without trial had deprived him of the right to speedy justice.The SC ruled that the delay in trial and long incarnation is valid ground to grant bail in money laundering cases despite stringent twin condition mentioned in the PMLA.Sisodia was taken into custody by the CBI on February 26, 2023, for his alleged role in the irregularities surrounding the creation and execution of the Delhi excise policy for 2021-22. The Enforcement Directorate arrested him on March 9, 2023, as part of the money laundering investigation related to the CBI's FIR. He resigned from the Delhi cabinet on February 28, 2023","Aam Aadmi Party leader Manish Sisodia shared a heartwarming selfie on X, capturing a moment of him enjoying a cup of tea with his wife. This comes a day after Supreme court granted him bail in the Delhi liquor policy case. He had been lodged in Tihar jail for 17 months.","https://static.toiimg.com/thumb/msid-112416600,imgsize-1044252,width-400,resizemode-4/112416600.jpg"
MHA sets up panel to monitor Indo-Bangla border situation,https://timesofindia.indiatimes.com/india/mha-sets-up-panel-to-monitor-indo-bangla-border-situation/articleshow/112415640.cms,"NEW DELHI: Centre on Friday constituted a committee to monitor the situation on the eastern frontier arising out of the political events in Bangladesh and to maintain a line of communication with the authorities in the neighbouring country to ensure the safety of Indian citizens and minority communities there.“In the wake of the ongoing situation in Bangladesh, the Modi govt has constituted a committee to monitor the current situation on the Indo-Bangladesh border .The committee will maintain communication channels with their counterparts in Bangladesh to ensure the safety and security of Indian nationals, Hindus and other minority communities living there,” home minister Amit Shah said.He added that the committee will be led by additional director general, BSF of Eastern Command and comprise BSF inspectors general in charge of south Bengal and Tripura frontier headquarters. Others in the committee include the secretary of Land Ports Authority and member (planning and development), LPAI.The days after the fall of the Sheikh Hasina govt have witnessed some activity along the Indo-Bangladesh border, including Indian students arriving at landports to return home and Nepalese citizens seeking to transit via India.The policy, as per a senior BSF officer, is clear that only those with valid documentation will be allowed to enter India, that too through designated land crossings.","The committee will maintain communication channels with their counterparts in Bangladesh to ensure the safety and security of Indian nationals, Hindus and other minority communities. The days after the fall of the Sheikh Hasina govt have witnessed some activity along the Indo-Bangladesh border, including Indian students arriving at landports to return home.","https://static.toiimg.com/thumb/msid-112415634,imgsize-22780,width-400,resizemode-4/112415634.jpg"
"SC grants Sisodia bail, says trial yet to even commence",https://timesofindia.indiatimes.com/india/sc-grants-sisodia-bail-says-trial-yet-to-even-commence/articleshow/112414716.cms,"Travesty of justice if Sisodia sent back to trial court: SC

In a big relief to Aam Aadmi Party leader and former deputy CM of Delhi Manish Sisodia , Supreme Court on Friday granted him bail in the corruption and money laundering cases related to changes in Delhi’s excise policy, and paved the way for him to come out of jail 17 months after he was arrested.“If the govt tries to forcibly put a common individual in jail who speaks against dictatorship, then the Constitution will protect them,” Sisodia told AAP supporters who waited for him outside Tihar jail gate.Noting that far from being concluded in 6-8 months, trial is yet to even commence, a bench of Justices B R Gavai and K V Viswanathan said it was a fit case to grant bail as prolonged incarceration would amount to violation of his fundamental right to life and liberty which is one of the most sacrosanct rights guaranteed by the Constitution. Sisodia was arrested by CBI on Feb 6, 2023, and was subsequently taken into custody by ED on March 9.“In the present case, in the ED matter as well as the CBI matter, 493 witnesses have been named. The case involves thousands of pages of documents and over a lakh pages of digitised documents. It is thus clear that there is not even the remotest possibility of the trial being concluded in the near future. In our view, keeping the appellant behind bars for an unlimited period of time in the hope of speedy completion of trial would deprive [him of] his fundamental right to liberty under Article 21 of the Constitution. As observed time and again, prolonged incarceration before being pronounced guilty of an offence should not be permitted to become punishment without trial,” the court said.Though CBI/ED insisted that Sisodia be subjected to the same conditions which were imposed while granting bail to Delhi CM Arvind Kejriwal who was asked not to visit his office and Delhi secretariat, the bench turned down the plea. Sisodia, in any case, resigned as minister and does not have an office.The court directed Sisodia to surrender his passport and report to the IO Mondays and Thursdays. He has to furnish bail bonds for Rs 10 lakh with two sureties of like amount and the court also allowed the probe agency to seek cancellation of bail in case of violation of any condition, including not making any attempts to influence witnesses or to tamper with the evidence.We find that, on account of a long period of incarceration running for around 17 months and the trial not even having commenced, the appellant has been deprived of his right to speedy trial. As observed by this court, the right to speedy trial and the right to liberty are sacrosanct rights. On denial of these rights, the trial court as well as the high court ought to have given due weightage to this factor,” the court said, setting aside the orders of the trial court and the HC.This was the third round of litigation on Sisodia’s bail in SC which had in Oct last year rejected his plea. He made a fresh plea before the apex court after being rejected by the trial court and Delhi HC and the court disposed of his plea in June and granted him liberty to revive the petition after filing of chargesheet. Seeking rejection of the third petition for revival of his plea, CBI/ED told the bench that he must first approach the trial court and then HC and finally SC.The bench, however, rejected the plea and said it would be “travesty of justice” if he was sent back to the trial court for bail. “Relegating the appellant to again approach the trial court and thereafter the high court and only thereafter this court, in our view, would be making him play a game of snake and ladder. The trial court and the HC have already taken a view and in our view, relegating him again to the trial court and the HC would be an empty formality. In a matter pertaining to the life and liberty of a citizen which is one of the most sacrosanct rights guaranteed by the Constitution, a citizen cannot be made to run from pillar to post,” it said.The court also found that there was no substance in CBI/ED allegations, upheld by the trial court, that the trial was getting delayed because of Sisodia who filed multiple applications.It noted that none of the applications filed by him was frivolous and the judicial record of the case belied the trial court’s finding that delay was caused by him.“It could further be seen that, though it has been submitted on behalf of the ED that hundreds of applications have been filed for supply of un-relied upon documents, the record would not substantiate the said position. Though various applications have been filed by different accused persons, insofar as the present appellant is concerned, he has filed only 13 applications in the CBI matter and 14 in the ED matter. It would reveal that some of the applications are for seeking permission to meet his wife or permission to file vakalatnama, to put signature on the documents, seeking permission to sign a cheque etc,” the court said.","Sisodia was arrested by CBI on Feb 6, 2023, and was subsequently taken into custody by ED on March 9. He has to furnish bail bonds for Rs 10 lakh with two sureties of like amount. The court also allowed the probe agency to seek cancellation of bail in case of violation of any condition.","https://static.toiimg.com/thumb/msid-112414772,imgsize-100298,width-400,resizemode-4/112414772.jpg"
LS records 136% productivity in Budget session,https://timesofindia.indiatimes.com/india/ls-records-136-productivity-in-budget-session/articleshow/112414105.cms,"NEW DELHI: The Parliament was adjourned sine die on Friday, one sitting ahead of the scheduled end of the session, with the two Houses passing several key pieces of legislation , including the Finance Bill , 2024, and the Appropriation Bill , 2024 — both crucial for the Union Budget.The session gained significance after the introduction of the contentious Waqf Board Bill , which was referred to the Joint Parliamentary Committee in the wake of opposition parties’ strong resistance.“As many as 15 sittings were held during the Session lasting for 115 hours and the productivity of the House during the Session was 136%,” said LS Speaker Om Birla in his valedictory address.Lok Sabha functioned for 123% of its scheduled time and Rajya Sabha for 110%. As many as 12 govt bills were introduced and four bills were passed, during the session. Besides the Finance Bill and Appropriation Bill, the other bills which were passed included the Jammu and Kashmir Appropriation Bill and Bharatiya Vayuyan Vidheyak, 2024.Speaker Om Birla said 86 starred questions were answered orally during the session.A total of 400 matters of urgent public importance were raised by members during the Zero Hour and 358 matters were taken up under Rule 377.Birla said during the session, 25 statements were made under Direction 73A and a total number of 30 statements including two statements given by the minister of parliamentary affairs in connection with parliamentary business and three suo moto statements by ministers were given. As many as 1,345 papers were laid on the table of the House.Rajya Sabha was adjourned sine die amidst opposition walkouts that disrupted the House proceedings.Parliamentary affairs and minority affairs minister, Kiren Rijiju on Friday thanked the presiding officers of both Houses and said that the Parliament saw very good business transactions in both Houses along with active participation from the members.“After many years, neither the Budget session nor the entire Parliament session was washed out for a single day, and we saw good business transactions in both Houses along with active participation from the members. On behalf of all the members of the Lok Sabha and Rajya Sabha, and the govt, I want to thank the Chairman of both Houses for their great help in running the Houses,” Rijiju said at a pres conference.","Lok Sabha functioned for 123% of its scheduled time and Rajya Sabha for 110%. As many as 12 govt bills were introduced and four bills were passed, during the session. Besides the Finance Bill and Appropriation Bill, the other bills which were passed included the Jammu and Kashmir Appropriated Bill and Bharatiya Vayuyan Vidheyak, 2024.","https://static.toiimg.com/thumb/msid-112414047,imgsize-272684,width-400,resizemode-4/112414047.jpg"
Babbar Khalsa terrorist in NIA net after extradition from UAE,https://timesofindia.indiatimes.com/india/babbar-khalsa-terrorist-in-nia-net-after-extradition-from-uae/articleshow/112414067.cms,"NEW DELHI: National Investigation Agency ( NIA ) on Friday arrested Babbar Khalsa International (BKI) terrorist Tarsem Singh , an accused in the case relating to the terror attack on the intelligence headquarters of Punjab Police in Mohali , upon his extradition from the United Arab Emirates.Tarsem, who hails from Punjab’s Tarn Taran, is a key aide of foreign-based pro-Khalistan terrorists Harwinder Sandhu alias Rinda and Lakhbir Singh alias Landa.He is also Landa’s brother.Tarsem had a non-bailable arrest warrant issued against him in June 2023. He was initially picked up in Abu Dhabi in Nov 2023 based on the NBW issued by an NIA court, and the subsequent red corner notice by Interpol. On Friday, an NIA team brought him to Delhi from Abu Dhabi following his extradition in line with Interpol’s due processes.Tarsem is an important terror node of designated terrorists Rinda and Landa in UAE , officials said. Among other cases, he was wanted in the RPG attack on Punjab Police in Mohali in May 2022.Tarsem was involved in arranging and providing terror funds to India-based associates of Rinda and Landa. It is alleged that he also helped in channeling terror funds through multiple routes.NIA had booked him on Aug 20, 2022, in connection with terror activities of chiefs/members of proscribed terrorist organisations, such as Khalistan Liberation Force (KLF), BKI and International Sikh Youth Federation (ISYF), among others, who have established a large network of terror operators across India.“These outfits are working through operatives/members of terror outfits and organised criminal gangs to smuggle arms, ammunition, explosives, IEDs from across the border,” an official said. “They have been using narcotics trafficking, extortions, hawala trading to generate funds for carrying out terrorist activities on Indian soil, NIA investigations so far have revealed,” he added.",Tarsem is a key aide of foreign-based pro-Khalistan terrorists Harwinder Sandhu alias Rinda and Lakhbir Singh alias Landa. Tarsem had a non-bailable arrest warrant issued against him in June 2023. He was initially picked up in Abu Dhabi in Nov 2023 based on the NBW issued by an NIA court.,"https://static.toiimg.com/thumb/msid-112413988,imgsize-504764,width-400,resizemode-4/112413988.jpg"
Will junk NH projects in Punjab if law & order remains poor: Gadkari,https://timesofindia.indiatimes.com/india/will-junk-nh-projects-in-punjab-if-law-order-remains-poor-gadkari/articleshow/112413778.cms,"NEW DELHI: The NHAI will have “no option but to cancel/ terminate” eight more “severely affected” highway projects in Punjab costing Rs 14,288 crore, if the law and order situation doesn’t improve, road transport minister Nitin Gadkari wrote to Punjab CM Bhawant Mann on Friday.The minister’s ultimatum comes amid reports of untoward incidents on the under construction Delhi-Amritsar-Katra Expressway, including engineers and employees of contractors being beaten up in Jalandhar and miscreants threatening to burn the project camp and staff alive in Ludhiana.The minister said that since these are greenfield corridors, even cancelling one package will render the entire stretch “useless”.Gadkari, in his letter, highlighted serious safety concerns for NHAI officers, contractors and their staff as well as issues related to pending land acquisition . He attached photos of assaults in his communication to Mann.Referring to a recent review meeting of NH projects on July 15 that he chaired, Gadkari said he was assured pending issues related to land acquisition and law and order would be resolved on priority.Gadkari said, “However, it has been brought to my notice that no progress has been made and the situation has further worsened.” He added that due to pending issues related to land acquisition and prevailing law and order conditions, “a number of concessionaires” have requested to foreclose contracts and raised claims against NHAI. NHAI has already terminated three projects costing Rs 3,263 crore citing non-availability of land.",Road transport minister Nitin Gadkari wrote to Punjab CM Bhawant Mann on Friday. The minister’s ultimatum comes amid reports of untoward incidents on the under construction Delhi-Amritsar-Katra Expressway. He attached photos of assaults in his communication to Mann.,"https://static.toiimg.com/thumb/msid-112413860,imgsize-1435708,width-400,resizemode-4/112413860.jpg"
"Paris Olympics Today Schedule: Paris Olympics 2024 Day 14, August 9 India's Full Schedule",https://timesofindia.indiatimes.com/sports/paris-olympics-2024/indiaparis/paris-olympics-2024-day-14-august-9-indias-full-schedule/articleshow/112385124.cms,"Following is India's Day 14 schedule at the Paris Olympics on Friday (All timings in IST)

Golf

12:30 PM:

Aditi Ashok

and

Diksha Dagar

finish Round 3 at Tied 40th and Tied 42nd positions respectively

Athletics

2:10 PM:

Indian quartet of Vithya, Jyothika, Poovamma and Subha fail to qualify for final

2:35 PM:

India's Muhammed Anas, Muhammed Ajmal, Amoj Jacob, Rajesh Ramesh finish 5th with a timing of 3:00.58, fail to qualify for final

Wrestling

10:45 PM:

Aman Sehrawat wins Freestyle 57kg bronze with 13-5 victory over Toi Cruz of Puerto Rico

NEW DELHI: Aman Sehrawat clinched India's first wrestling medal at the Paris Olympics as he registered a 13-5 victory over Puerto Rico's Darian Toi Cruz in the bronze medal match on Friday.Women's 4x400m Relay Round 1 - Heat 2:Men's 4x400m Relay Round 1 - Heat 2:",Aman Sehrawat clinched India's first wrestling medal at the Paris Olympics as he registered a 13-5 victory over Puerto Rico's Darian Toi Cruz in the bronze medal match on Friday. Following is India's Day 14 schedule at theParis Olympics on Friday (All timings in IST),"https://static.toiimg.com/thumb/msid-112385122,imgsize-30068,width-400,resizemode-4/112385122.jpg"
'Arshad Nadeem ka din tha ... ': Neeraj Chopra after winning silver at Paris Olympics - Watch,https://timesofindia.indiatimes.com/sports/paris-olympics-2024/indiaparis/arshad-nadeem-ka-din-tha-neeraj-chopra-after-winning-silver-at-paris-olympics-watch/articleshow/112389747.cms,"NEW DELHI: India's star javelin thrower Neeraj Chopra clinched a silver medal at the Paris Olympics , performing in front of an enthusiastic crowd at Stade de France.Neeraj's throw of 89.45m earned him second place on the podium. Although it was his best performance of the season, it wasn't enough to secure gold, which went to Pakistan's Arshad Nadeem with a throw of 92.97m, setting a new Olympic record.The previous Olympic record of 90.57m was held by Andreas Thorkildsen of Norway, set during the 2008 Beijing Games. Thorkildsen was present in the stands, along with three-time Olympic champion and world record holder Jan Zelezny of the Czech Republic.Neeraj became only the third Indian athlete, and the first in track and field, to win back-to-back individual Olympic medals. Wrestler Sushil Kumar (2008 and 2012) and shuttler PV Sindhu (2016 and 2021) are the others who have achieved this feat.After winning the silver medal, Neeraj, who had previously won gold at the Tokyo Olympics, said:""We all feel happy whenever we win a medal for the country. It’s time to improve the game now. We will sit, discuss, and enhance our performance. India performed well at the Paris Olympics, and the competition was strong. Aaj Arshad ka din tha (Today was Arshad's day). I gave my best, but there are areas that need improvement.""""Our national anthem may not have been played today, but it will definitely be played somewhere in the future. If not in Paris, then elsewhere,"" he added.“(Acha hai ander. Ander throw to hai. Wo niklegi jab sab tarike se fit ho jayenge aur mentally tayyar ho jayenge) It’s all good inside. My best throw is yet to come out. It will come when I’m completely fit and mentally prepared,” he concluded.",Neeraj Chopra wins silver medal in javelin throw at Paris Olympics. His throw of 89.45m earned him second place on the podium. Pakistan's Arshad Nadeem won gold with a throw of 92.97m.,"https://static.toiimg.com/thumb/msid-112389772,imgsize-75980,width-400,resizemode-4/112389772.jpg"
