Article Title,Article Link,Article Text,Article Summary,Article Image
"3 held, FIR against 150 after crowd pelts stones at cops in Ratlam over Ganesh procession row",https://timesofindia.indiatimes.com/city/indore/3-held-fir-against-150-after-crowd-pelts-stones-at-cops-in-ratlam-over-ganesh-procession-row/articleshow/113174407.cms,"This is a representative image

INDORE: Ratlam police have filed an FIR against 150 people and arrested three of them after a crowd pelted stones at cops and damaged vehicles on Saturday night after stubbornly trailing the cops to a spot where a stone had allegedly been thrown at a Ganesh procession earlier that evening.Police resorted to a mild lathicharge and lobbed tear gas shells to disperse the crowd.Police forces from adjoining districts had to be called in. There is heavy police deployment in Ratlam, 140km from Indore.The ruckus started on Saturday evening when a transgender named Kajal alleged that someone had thrown a stone that hit a man in the Ganesh procession when it was passing through Mochipura area.SP Rahu Lodha said that there was nothing to corroborate this allegation. ""All CCTV footage from the area has been reviewed, and no evidence of stone pelting was found. The idol was also not damaged,"" the SP said, assuring that if any evidence emerges during the investigation, appropriate action will be taken against the culprits.Police filed an FIR against unidentified persons on Saturday night but a crowd of 500 gathered at Station Road police station and refused to relent. SP Lodha led a team to the spot but a large crowd followed closely behind. The SP asked them to disperse, and that is when stone pelting began.As the situation deteriorated, police had to use force. The unrest started around 8:30 pm and stretched till midnight. Police teams from Jaora town in Ratlam and Dhar district were also called in.On Sunday morning, SP Lodha said the investigation has not confirmed any stone pelting on the Ganesh idol. Police questioned three persons who filed the complaint - including transgender Kajal and Lakhan Rajwaniya. SP Lodha said the trio provided inconsistent accounts of the incident.Police have registered a case against 13 named individuals and 150 others for rioting and sloganeering during the night.Those named in the FIR include Kajal, Lakhan, Ravi Sharma, Mahendra Solanki, Jalaj Sankhla, Ravi Sen, Vijay Prajapati, Nitesh, Mukesh Banjara, Manthan Bhonsle, Aman Jain, Jaydeep Gurjar, and Aju Bargunda. They have been accused of inciting the crowd, creating a ruckus, and vandalising vehicles.Sankhla is the district vice-president of Bharatiya Janata Yuva Morcha (BJYM). Lakhan, Kajal and Solanki were arrested late Saturday night, and two others, Mukesh Banjara and Ajju Bargunda, were detained on Sunday.",Ratlam police have filed an FIR against 150 people and arrested three of them after a crowd pelted stones at cops and damaged vehicles on Saturday night. Police resorted to a mild lathicharge and lobbed tear gas shells to disperse the crowd. A transgender named Kajal alleged that someone had thrown a stone that hit a man in the Ganesh procession.,"https://static.toiimg.com/thumb/msid-113174408,imgsize-775241,width-400,height-225,resizemode-72/113174408.jpg"
Malicious post on CJI’s wife prompts Bengal police to issue warning,https://timesofindia.indiatimes.com/city/kolkata/malicious-post-on-cjis-wife-triggers-wb-police-warning/articleshow/113174038.cms,"This is a representational image

KOLKATA: A widely circulated WhatsApp message attempting to link CJI DY Chandrachud's wife with alleged "" north Bengal lobby "" head Shyamapada Das has prompted Bengal police to issue a stern warning against the spread of malicious disinformation .The ""north Bengal lobby"" refers to a group of doctors, said to be alumni of North Bengal Medical College near Siliguri, who allegedly influence the Bengal health department.The timing of the message's circulation coincided with a Supreme Court hearing on the Aug 9 rape-murder of a postgraduate resident doctor in Kolkata's RG Kar Medical College, which was scheduled for Thursday but postponed to Monday. The SC bench includes CJI Chandrachud.In response to the viral message, Bengal police took to their 'X' handle Saturday: ""...Exploiting freedom of speech to indulge in wild falsehood, that too against the apex court, is illegal and punishable. Sternest possible legal action will be initiated against those trying to malign the judiciary.""","A widely circulated WhatsApp message attempting to link CJI DY Chandrachud's wife with alleged "" north Bengal lobby "" head Shyamapada Das has prompted Bengal police to issue a stern warning against the spread of malicious disinformation. The ""north Bengal lobby"" refers to a group of doctors, said to be alumni of North Bengal Medical College near Siliguri, who allegedly influence the Bengal health department.","https://static.toiimg.com/thumb/msid-113174040,imgsize-813633,width-400,height-225,resizemode-72/113174040.jpg"
Owner 'forced' to change name of vegetarian dhaba in UP after threats,https://timesofindia.indiatimes.com/city/agra/owner-forced-to-change-name-of-vegetarian-dhaba-in-up-after-threats/articleshow/113173969.cms,"Mohd Saleem, a 60-year-old dhaba owner in Muzaffarnagar, renamed his vegetarian eatery from 'Sangam Shudh Shakahari Bhojnalaya' to 'Saleem Dhaba' after receiving threats from a local seer. Authorities are working to prevent the situation from escalating and are ensuring compliance with Supreme Court guidelines on such matters.","Mohd Saleem, a 60-year-old dhaba owner in Muzaffarnagar, renamed his vegetarian eatery from 'Sangam Shudh Shakahari Bhojnalaya' to 'Saleem Dhaba' Authorities are working to prevent the situation from escalating.","https://static.toiimg.com/thumb/msid-113173976,imgsize-1088411,width-400,height-225,resizemode-72/113173976.jpg"
Party footsoldiers will fight battle from within: TMC on Sircar exit,https://timesofindia.indiatimes.com/city/kolkata/party-footsoldiers-will-fight-battle-from-within-tmc-on-sircar-exit/articleshow/113174507.cms,"This is a representational image (Pic credit: ANI)

KOLKATA: A cautious Trinamool Congress on Sunday tried to rein in discordant voices within the party and said resignation was Jawhar Sircar 's personal prerogative, to which it had nothing to add.But the party also agreed with Sircar's ""anxieties"" and observations"", saying while ""course correction"" was the need of the hour, foot soldiers would fight the battle from within the Trinamool fold.The reaction to the Rajya Sabha MP's resignation came from former Rajya Sabha MP Kunal Ghosh . ""He (Sircar) is highly respected and accomplished,"" Ghosh said. ""Any step he takes is his personal decision, nothing to comment on that. That is his freedom. He has worked at the topmost echelons of govt as a bureaucrat, he is a sensitive person. He has made a decision, I will not add a single word to it.""""The anxieties which Sircar has spoken about and his observations... we have no second views on some of it. But people like us, who are the party's foot soldiers, will fight this battle from the party fold,"" Ghosh added.Ghosh's reactions came in the backdrop of multiple young party functionaries hitting out at Sircar for ""running away from the battlefield"".The party's youngest Lok Sabha candidate, Debangshu Bhattacharya, alluding to Sircar, said: ""A water hyacinth floats with the tide. It takes a man to swim against the tide."" Several young leaders also took to their X handles to question the party leadership's strategy in bringing in lateral entrants for Rajya Sabha, overlooking loyal party veterans.Ghosh did not wade into this. ""It is his (Sircar's) freedom to do whatever he does, and we respect that. It is our freedom to stay in the party and fight back. That we will do,"" he said.Ghosh, in fact, seemed to back Sircar's demand for a course-correction. ""His anxieties and observations (in the letter) also reflect questions being asked by the people. On some issues, I and some of my party colleagues, also agree with him. Political parties are using this to poison people's minds. But we will raise this within the party. We also believe visible, positive steps are necessary. We will fight for it, staying within the party fold. Only meetings and rallies will not suffice, we are hopeful that all necessary decisive actions will be taken by the party,"" Ghosh said.Ghosh said Sircar had pointed out that course-correction was necessary to fight back communal forces who were eyeing Bengal: ""He says in his letter that he is grateful to CM Mamata Banerjee and he also speaks of the need to fight back communal forces."""," Trinamool Congress tries to rein in discordant voices within the party. But the party also agreed with Jawhar Sircar's ""anxieties"" and observations. The reaction to the Rajya Sabha MP's resignation came from Kunal Ghosh. Several young leaders also took to their X handles to question the party leadership's strategy.","https://static.toiimg.com/thumb/msid-113174603,imgsize-1168291,width-400,height-225,resizemode-72/113174603.jpg"
Highway linking Indo-China border opens after 3 days,https://timesofindia.indiatimes.com/city/dehradun/highway-linking-indo-china-border-opens-after-3-days/articleshow/113174396.cms,"NH linking Indo-China border opens after 3 days

DEHRADUN : The Joshimath-Malari-Niti national highway (NH107-B), which connects to the Indo-China border , opened late on Sunday after remaining blocked for vehicular movement since Friday due to recurring landslides near Lata village , about 26 km from Joshimath.As a result of the landslides, traffic on the strategic route was severely impacted, particularly restricting the movement of defence vehicles belonging to the Indian Army and Indo-Tibetan Border Police (ITBP).Chamoli district 's disaster management officer, Nand Kishore Joshi, said, ""The road, which was blocked since Friday, was marginally opened for pedestrians and small vehicles on Sunday afternoon and subsequently opened for heavy vehicles, too, late evening.""Defence vehicles from Army and ITBP had been waiting for the road to clear for the past three days, and supplies to nearly a dozen villages on the China border had been affected, officials said.Malari village is about 60 km from Joshimath, with Niti located an additional 28 km beyond. The villages that had been cut off included Dronagiri, Garpak, Malari and Gamshali in the Niti Valley.The Border Roads Organisation (BRO) personnel worked almost round the clock to clear the debris from the road in order to restore traffic, as per officials.A video which captured the moments when the landslide took place had been widely circulated on social media. In the clip, huge rocks and debris could be seen crashing onto the highway.Local resident Ram Singh said that they had been facing severe problems as all supplies were cut off due to recurring landslides near Lata village. ""Road widening work in this particular stretch has been leading to more landslides in the area,"" he alleged.","The Joshimath-Malari-Niti national highway (NH107-B), which connects to the Indo-China border, opened late on Sunday. The road had remained blocked for vehicular movement since Friday due to recurring landslides near Lata village.","https://static.toiimg.com/thumb/msid-113174399,imgsize-1879550,width-400,height-225,resizemode-72/113174399.jpg"
30k villagers toil for 10 months to bring UP river back on course,https://timesofindia.indiatimes.com/city/allahabad/30k-villagers-toil-for-10-months-to-bring-up-river-back-on-course/articleshow/113174033.cms,"30k villagers toil for 10 months to bring UP river back on course

PRAYAGRAJ: In an inspiring effort, over 30,000 people belonging to 20 villages in three blocks of Uttar Pradesh 's Pratapgarh district toiled for over 10 months to revive the earlier course of a seasonal river .Over the last decade, the Sakarni (Sanskrit for one who listens), a rivulet that feeds the Sai, a tributary of the Ganga, saw large-scale encroachment by farmers on its banks.Consequently, the rivulet changed its course and became shallow in stretches.A local green activist, Ajay Krantikari, who heads an NGO called "" Paryavaran Sena "", led a campaign to bring back the river to its natural course and first raised the issue before the district environment committee, which is headed by the district magistrate.On Oct 13, 2023, following Krantikari's efforts, the district authorities included the Sakarni river under the small rivers' rejuvenation list under MGNREGS .Old revenue records were scanned to ascertain the natural course of the river, which was almost lost to the local residents.Over the next 10 months, nearly 30,000 people worked under MGNREGS to bring the river back to its natural 27.7km-long course. Besides, they also found employment in their respective blocks during the rejuvenation work on the rivulet.The district administration spent Rs 1.35 crore to make this happen.Shri Krishna, Pratapgarh district development officer, said : ""The rejuvenation work of the small river Sakarni has been done with the help of villagers . Now, the river is flowing along its natural course. After conducting a detailed survey and analysis, we removed all the encroachments upon the natural course of the river.""He said the seasonal river is now providing livelihood to people of Laxmanpur and adjoining blocks.","The Sakarni, a rivulet that feeds the Sai, a tributary of the Ganga, saw large- scale encroachment by farmers on its banks. A local green activist, Ajay Krantikari, led a campaign to bring back the river to its natural course. The district administration spent Rs 1.35 crore to make this happen.","https://static.toiimg.com/thumb/msid-113174036,imgsize-1371328,width-400,height-225,resizemode-72/113174036.jpg"
Malayalam actor detained at Hyderabad airport for ‘creating ruckus’,https://timesofindia.indiatimes.com/city/hyderabad/malayalam-actor-detained-at-hyderabad-airport-for-creating-ruckus/articleshow/113174401.cms,"This is a representational image

HYDERABAD: A criminal case was registered against Malayalam character actor Vinayakan , who was allegedly drunk, for creating a ruckus at the Rajiv Gandhi International Airport on Saturday evening.The award-winning actor was on his way from Kochi to Goa and had a connecting flight from the city. He was detained by the RGIA police for a few hours and later allowed to take another flight.""By the time Vinayakan landed at Hyderabad airport, he was under the influence of alcohol. At the airport lounge, he again consumed liquor. After that he picked up an argument with the airport staff,"" RGIA inspector K Balaraju told TOI.Cops said that as he continued to argue, the airport staff called in the Central Industrial Security Force (CISF). The airline staff also refused to allow him to board the aircraft.The CISF personnel then alerted local RGIA police who took the actor into their custody and brought him to the police station. tnnWhen he was made to undergo a breathalyzer test, his blood alcohol count was 172 mg/100 ml, cops said.After making him sit in the police station for nearly three hours, police let him off after registering a case for violation of the City Police Act. The actor later took another flight, reportedly to reach Goa.Vinayakan had won the Kerala State Film Award for best actor for 'Kammatipaadam' and recently he was seen in the Rajinikanth-starrer 'Jailer'.",Vinayakan was on his way from Kochi to Goa and had a connecting flight from the city. He was detained by the RGIA police for a few hours and later allowed to take another flight. The actor had won the Kerala State Film Award for best actor for 'Kammatipaadam',"https://static.toiimg.com/thumb/msid-113174402,imgsize-488956,width-400,height-225,resizemode-72/113174402.jpg"
FIR filed against 3 doctors close to Sandip Ghosh,https://timesofindia.indiatimes.com/city/kolkata/fir-filed-against-3-doctors-close-to-sandip-ghosh/articleshow/113174043.cms,"This is a representational image (Pic credit: IANS)

KOLKATA: Bengal police Sunday lodged FIR against three doctors,, Birupaksha Biswas, Aveek De and Ranjit Saha - all linked to ' North Bengal lobby ' and close aides of former RG Kar principal Sandip Ghosh following physical and email complaints of intimation by 31 junior doctors of Calcutta Medical College and Hospital . Police compiled all complaints into one FIR and registered a case under BNS section 351 (assault as making a gesture or preparation that causes someone to believe that they are about to be subjected to criminal force).Investigation has started, police said.Last week, the state health department had suspended De and Biswas. Their names appeared in 'health syndicate' posters. The suspension is result of allegations including misconduct and unauthorized presence at RG Kar Medical College. Anjan Mandal and 30 junior doctors alleged the accused doctors had been threatening and intimidating them, police said. ""The junior doctors were coming to the station to file complaints for the past few days. All complaints name the three doctors as accused. They alleged the doctors issued threats, though the nature and manner of the threats are unclear,"" said an officer.De is the man in red-T shirt at the RG Kar crime scene who Kolkata Police touted as a fingerprint expert, which IMA-Bengal challenged. He used to work as RMO in Burdwan Medical College and is now a first-year surgery PGT at IPGMER. Biswas, a senior resident doctor of pathology, was also present at RG Kar on Aug 9, and had no locus standi to be present there. Audio clips where he is heard threatening other students and junior doctors have gone viral even as Biswas had dismissed those as AI-generated.","Bengal police Sunday lodged FIR against three doctors. They are Birupaksha Biswas, Aveek De and Ranjit Saha - all linked to'North Bengal lobby'Police compiled all complaints into one FIR and registered a case under BNS section 351.","https://static.toiimg.com/thumb/msid-113174046,imgsize-775241,width-400,height-225,resizemode-72/113174046.jpg"
Can India help resolve Russia-Ukraine conflict? What Italian PM Giorgia Meloni said,https://timesofindia.indiatimes.com/india/russia-ukraine-conflict-what-did-italian-pm-meloni-say-on-potential-mediators/articleshow/113160217.cms,"Italian Prime Minister Giorgia Meloni, after meeting with Ukrainian President Volodymyr Zelenskyy in Italy's Cernobbio on Saturday, said that India and China have the potential to find a resolution to the ongoing conflict between Russia and Ukraine.""China and India have a role to play in resolving the conflict,"" said Meloni. She also cautioned against the notion of abandoning Ukraine to its fate.""The decision to support Kyiv is in line with Italy's national interest and will never change,"" she added.Earlier, Russian President Vladimir Putin said that India, Brazil, and China can be potential intermediaries in resolving the conflict.During a panel discussion at the Eastern Economic Forum in Vladivostok on Thursday, Putin mentioned that he was in contact with India, Brazil, and China regarding the Ukraine conflict. He expressed confidence in the leaders of these countries, stating, ""First of all, it is Chinese People's Republic, Brazil and India -- I am in contact with my partners and I have no doubt that the leaders of these countries -- and we have relations of trust and confidence with one another -- will be really interested and provide a helping hand.""During his trip to Kyiv last month, Prime Minister Narendra Modi engaged in discussions with President Zelenskyy, highlighting the urgent need for Ukraine and Russia to engage in dialogue without further delay to bring an end to the ongoing conflict. Modi expressed India's willingness to actively contribute to the restoration of peace in the region.PM Modi reiterated India's consistent stance in favor of peace since the outbreak of the conflict. He went a step further, expressing his personal readiness to play a role in facilitating a peaceful resolution to the crisis.",Italian Prime Minister Giorgia Meloni met with Ukrainian President Volodymyr Zelenskyy in Italy's Cernobbio. Meloni said that India and China have the potential to find a resolution to the ongoing conflict between Russia and Ukraine. She also cautioned against the notion of abandoning Ukraine to its fate.,"https://static.toiimg.com/thumb/msid-113163485,imgsize-62920,width-400,resizemode-4/113163485.jpg"
"Clip viral: Officer removes shoes, fixes clothes of Union minister",https://timesofindia.indiatimes.com/india/clip-viral-officer-removes-shoes-fixes-clothes-of-union-minister/articleshow/113177480.cms,"A viral video shows a BCCL official assisting Union minister Satish Chandra Dubey by removing his shoes and adjusting his pajamas before entering an underground mine in Munidhi, sparking controversy. Dhanbad district Congress president Santosh Singh criticized the incident, demanding an apology from the minister for demeaning the officer.","A viral video shows a BCCL official assisting Union minister Satish Chandra Dubey by removing his shoes and adjusting his pajamas. Dhanbad district Congress president Santosh Singh criticized the incident, demanding an apology from the minister for demeaning the officer.","https://static.toiimg.com/thumb/msid-47529300,imgsize-110164,width-400,resizemode-4/47529300.jpg"
"2 Magadh Exp coaches detach, split train into two; none hurt",https://timesofindia.indiatimes.com/india/2-magadh-exp-coaches-detach-split-train-into-two-none-hurt/articleshow/113177464.cms,"PATNA: Passengers of New Delhi-Islampur Magadh Express had a close shave Sunday in Bihar's Buxar district when its two coaches suddenly detached splitting the train into two. No one was injured, said Danapur divisional railway manager Jayant Kumar Choudhary.The mishap occurred at 11.07am between Tunninganj and Raghunathpur stations on DDU-Patna mainline.It was caused by a coupling system fault between S-6 and S-7 coaches. Choudhary said the two coaches, 13th from the locomotive, disconnected midway. ""The coaches were carefully reattached and brought to Raghunathpur,"" he said.Saraswati Chandra, chief public relations officer, East Central Railway, said an accident relief train was dispatched immediately from Danapur with a rescue team. ""The faulty S-6 coach was detached and repaired while passengers were moved to other coaches,"" Chandra said. The train resumed its journey around 2.25pm after a three-hour delay, he added.The mishap left the passengers in shock with many stepping off the train and gathering on the tracks. Sources said the railways has ordered a departmental inquiry.","Passengers of New Delhi-Islampur Magadh Express had a close shave Sunday in Bihar's Buxar district. Two coaches suddenly detached splitting the train into two. No one was injured, said Danapur divisional railway manager Jayant Kumar Choudhary.","https://static.toiimg.com/thumb/msid-113177470,imgsize-1523439,width-400,resizemode-4/113177470.jpg"
