Article Title,Article Link,Article Text,Article Summary,Article Image
CDS: India's nuclear trajectory based on 'no first-use' principle,https://timesofindia.indiatimes.com/india/cds-indias-nuclear-trajectory-based-on-no-first-use-principle/articleshow/111295897.cms,"(ANI file photo)

NEW DELHI: Noting that the threat from nuclear weapons has once again occupied centerstage in the geopolitical landscape , chief of defence staff General Anil Chauhan on Wednesday said that the ""uniqueness"" of India's nuclear trajectory is premised on the principle of ""no first-use and massive retaliation"".

There is an urgent need for ""a deeper thought, development of new doctrines, reimagining deterrence and safeguarding nuclear C4I2SR (command, control, communications, computers, intelligence, information, surveillance and reconnaissance) infrastructure"", he said while addressing a seminar here on 'Nuclear Strategy: Contemporary Developments and Future Possibilities'.

Delivering the keynote address on 'Nuclear Strategy: Contemporary Developments and Future Possibilities' at a seminar here, Gen Chauhan also highlighted the changing nature and characteristics of conventional warfare.

The speech comes soon after the latest assessment by the Stockholm International Peace Institute (SIPRI) on June 17 held that China was boosting its nuclear arsenal faster than any other country around the globe. China now has 500 warheads, up from 410 in January 2023, while India has 172 and Pakistan 170, as per SIPRI.

India even retains the option to retaliate with nuclear weapons if its forces ""anywhere"" are attacked with biological or chemical weapons, as per the doctrine.

","India's nuclear trajectory is premised on the principle of ""no first-use and massive retaliation"", says chief of defence staff General Anil Chauhan. Chauhan was addressing a seminar on 'Nuclear Strategy: Contemporary Developments and Future Possibilities' He also highlighted the changing nature of conventional warfare.","https://static.toiimg.com/thumb/msid-111295898,imgsize-28124,width-400,resizemode-4/111295898.jpg"
Om Birla elected Speaker for second time on voice vote,https://timesofindia.indiatimes.com/india/om-birla-elected-speaker-for-second-time-on-voice-vote/articleshow/111295594.cms,"Birla 5th Lok Sabha Speaker to be elected for 2nd term

NEW DELHI: Om Birla , three-time BJP MP from Kota, was re-elected Lok Sabha Speaker for a second consecutive term in a contest that was not to be as the opposition flinched from seeking a vote despite Congress fielding its candidate K Suresh. Birla, 62, was elected by voice vote .There were 13 sets of proposals in favour of Birla, the first moved by PM Modi and seconded by defence minister Rajnath Singh. Other proposers were drawn from among NDA partners and BJP's own, representing various castes.With Congress and its allies Shiv Sena (UBT), DMK, NCP and RSP proposing the candidature of Suresh amid strong indications of their desire to make it a play on his Dalit background, a contest - the first in almost five decades - seemed imminent.Trinamool Congress's decision not to propose Suresh in protest against Congress unilaterally declaring him a contender appeared to be the main reason for the latter not to seek a division of votes.An effort involving Congress’s K C Venugopal and DMK’s T R Baalu from the opposition side and Union ministers Rajnath Singh, Amit Shah and J P Nadda on Tuesday to evolve a consensus had failed with govt again turning down the demand that the deputy speaker be from the opposition.But Congress did not press for a vote, despite an attempt by Union minister for animal husbandry Rajiv Ranjan Singh ‘Lalan’ to bait them into seeking one, leading to the 62-year-old Birla being elected by voice vote.Modi congratulated Birla on his re-election and expressed confidence that he would guide parliamentarians and play a big role in the House to fulfil people’s expectations.After his election, Birla told members that there should be a new vision and resolve for the 18th Lok Sabha. He called for Lok Sabha to be a centre of creative thinking and new ideas, which would establish high levels of parliamentary traditions and dignity. Modi and parliamentary affairs minister Kiren Rijiju were joined by leader of opposition Rahul Gandhi in escorting Birla to the Speaker’s chair after his election, marking a moment of harmony.Birla got a second consecutive term, the fifth time that a Speaker will serve beyond the tenure of one Lok Sabha.It is also among the few occasions that an election became necessary for a post conventionally decided by consensus.Birla, who has risen through the ranks in BJP, is also a three-term former Rajasthan MLA.",Om Birla was re-elected Lok Sabha Speaker for a second consecutive term. Opposition flinched from seeking a vote despite Congress fielding its candidate K Suresh. The 62-year-old was elected by voice vote.,"https://static.toiimg.com/thumb/msid-111295605,imgsize-50654,width-400,resizemode-4/111295605.jpg"
"Government mulls monthly, annual national highway toll passes for private cars",https://timesofindia.indiatimes.com/india/government-mulls-monthly-annual-national-highway-toll-passes-for-private-cars/articleshow/111295537.cms,"NEW DELHI: Union road transport minister Nitin Gadkari has urged top officials to find ways to make highway travel hassle-free for commuters, suggesting the implementation of a system for issuing monthly or annual passes for cars to use the NH network.

He made this suggestion noting that collection from cars and private vehicles accounts for less than 25% of NHAI's toll revenues. ""Around 75% of the toll revenue comes from trucks and commercial vehicles. The remaining 25% comes from cars. There is a thought, which the secretary and NHAI officials can look at... whether we can give monthly or annual passes for cars. The income from this category of vehicles is not much,"" he said at a conference on next-generation toll collection system.

NHAI issues monthly passes with a cap on the number of trips a vehicle can make, on a particular stretch. IHMCL that deals with all toll related matters, will soon carry out a study to assess the financial impact of exempting private vehicles - car, jeep and van - from paying toll at NH toll plazas as part of a bigger exercise to find the impact of electronic toll collection.

Sources said IHMCL has received bids for this study, to show the impact of the exemption. ""The findings will help us plan better,"" said an official.

","Road transport minister Nitin Gadkari has urged top officials to find ways to make highway travel hassle-free for commuters. He suggested the implementation of a system for issuing monthly or annual passes for cars to use the NH network. NHAI issues monthly passes with a cap on the number of trips a vehicle can make, on a particular stretch.","https://static.toiimg.com/thumb/msid-111295557,imgsize-1058481,width-400,resizemode-4/111295557.jpg"
"Months after exit, Sam Pitroda back in key Congress post",https://timesofindia.indiatimes.com/india/months-after-exit-sam-pitroda-back-in-key-congress-post/articleshow/111295486.cms,"File photo

NEW DELHI: Congress Wednesday reappointed Sam Pitroda as chairman of Indian Overseas Congress over a month and half after he resigned following a major controversy over his remarks at the peak of elections on ""inheritance tax"" and analogies on India's diversity ascribed as ""racist"" by opponents. Congress had dissociated itself from both statements and his reappointment comes after an assurance to leadership that in future he will leave no room for such controversies to arise.Congress general secretary K C Venugopal in a press statement announced that Pitroda has been reappointed to the post with ""immediate effect"".

Congress general secretary in-charge of communications Jairam Ramesh said on X, ""During the recent election campaign Sam Pitroda had made some statements that were totally unacceptable to Congress. By mutual consent he stepped down as chairman of Overseas Indian Congress. Subsequently he clarified the context in which statements were made and how they were later distorted by Modi campaign."" Ramesh added that "" Congress president has reappointed him on the assurance he will not in future leave room for such controversies to arise.""

Pitroda's proximity to the Gandhi family is well known and it is now assumed that he will be careful with his words.Meanwhile, BJP's national spokesperson C R Kesavan lashed out at Congress saying the ""reappointment is an egregious insult to all the good citizens of our country.""

","Congress reappoints Sam Pitroda as chairman of Indian Overseas Congress. He resigned over his remarks on ""inheritance tax"" and analogies on India's diversity ascribed as ""racist"" by opponents. Congress had dissociated itself from both statements and his reappointment comes after an assurance that in future he will leave no room for such controversies to arise.","https://static.toiimg.com/thumb/msid-111295492,imgsize-25032,width-400,resizemode-4/111295492.jpg"
"Emergency was an era of injustice, exposed Congress's dictatorial mentality: Amit Shah",https://timesofindia.indiatimes.com/india/emergency-was-an-era-of-injustice-exposed-congresss-dictatorial-mentality-amit-shah/articleshow/111295449.cms,"NEW DELHI: Home minister Amit Shah on Wednesday hailed Speaker Om Birla for moving a resolution in Lok Sabha condemning the imposition of Emergency by former PM Indira Gandhi even as BJP took a swipe at Congress over members of the INDIA bloc not joining the party's protest in the House against the move.Shah said Lok Sabha remembered Emergency, which was an ""era of injustice"", and expressed its sympathy for the poor, Dalits and backward people who had to suffer exploitation and atrocities of the then Indira Gandhi govt, when rights of citizens were destroyed and freedoms snatched away.Shah said many sensitive amendments made in the Constitution during Emergency exposed the dictatorial mentality of Congress which centralised all powers in one person.""It (resolution) has exposed the anti-democratic thinking of Congress which has harmed major pillars like judiciary, bureaucracy and media, has condemned the cruelty of Congress in imprisoning lakhs of opposition leaders for more than one-and-a-half years without any reason,"" Shah said on X with #EmergencyHorrors.He said Lok Sabha also expressed regret at how the country was turned into a prison during Emergency and how the Indira Gandhi govt worked to crush the spirit of the Constitution.""By moving a resolution in Lok Sabha against the Emergency of 1975, Speaker Om Birla has honoured the struggle of satyagrahis who raised their voices against the repression and exploitation of the Congress govt that insulted Babasaheb Ambedkar's Constitution. I wholeheartedly support the resolution,"" Shah said.At a press conference, Puri MP and BJP spokesperson Sambit Patra said, ""As soon as the Speaker brought the resolution, Congress members began shouting and rushed to the well of the House while members of SP, DMK and TMC were standing peacefully. Seeing them, Rahul Gandhi also had to eventually rise from his seat.""",Home minister Amit Shah hailed Speaker Om Birla for moving a resolution in Lok Sabha condemning the imposition of Emergency by former PM Indira Gandhi. BJP took a swipe at Congress over members of the INDIA bloc not joining the party's protest in the House against the move.,"https://static.toiimg.com/thumb/msid-111295453,imgsize-664320,width-400,resizemode-4/111295453.jpg"
"PM Modi hails Speaker OM Birla, says he presided over golden era in history of Lok Sabha",https://timesofindia.indiatimes.com/india/pm-modi-hails-speaker-om-birla-says-he-presided-over-golden-era-in-history-of-lok-sabha/articleshow/111295431.cms,"NEW DELHI: PM Narendra Modi on Wednesday lauded newly-elected Lok Sabha Speaker Om Birla for his conduct as presiding officer in the previous House and also as a parliamentarian. He said Birla presided over a golden era in Lok Sabha's history as a number of historic decisions were taken during its previous term.Noting that he was the first Speaker after Balram Jakhar to get another term after serving a full tenure, the PM expressed confidence that he would continue to create new benchmarks. Jakhar served between 1980 and 1989.Modi pointed to a 20-year period when those elected Speakers either did not contest elections or did not win an election after their appointment, and said Birla had scripted history by returning as Speaker after emerging victorious again.The PM noted that the previous Lok Sabha notched around 97% productivity, the highest in 25 years, and said Birla ensured the House functioned even during the Covid pandemic and maintained its dignity and decorum, at times by taking difficult decisions.He said Birla's polite and humble personality and his winning smile helped him in conducting the House. He also mentioned the Speaker's personal touch and concern for members during the pandemic.The PM praised the Kota MP's welfare work for his constituency, saying it would inspire young parliamentarians. He also expressed confidence that the speaker would continue to achieve new success.Remembering the transformative decisions taken during the 17th Lok Sabha, Modi mentioned several ""landmark"" legislations, including 'Nari Shakti Vandan Adhiniyam', Jammu & Kashmir Reorganisation Bill and the three new criminal laws.He said the long journey of democracy witnessed various stopovers that provided an opportunity to create new records and expressed confidence that people would continue to cherish the 17th Lok Sabha for its achievements.Modi recalled the inauguration of the new Parliament building under the chairmanship of Birla and also praised the steps taken for strengthening the foundations of democracy.The PM lauded the paperless workflow and the systematic briefing process initiated by Birla to boost discussions in the House and praised him for a very successful conference of presiding officers of legislative bodies of G20 nations which was attended by a record number of countries.He said Parliament House was not just walls but was the centre of aspirations of 140 crore citizens, emphasising that functioning of the House deepened the foundation of democracy.",PM Narendra Modi lauded newly-elected Lok Sabha Speaker Om Birla for his conduct as presiding officer in the previous House and also as a parliamentarian. He said BirlA presided over a golden era in Lok Sabha's history as a number of historic decisions were taken during its previous term.,"https://static.toiimg.com/thumb/msid-111295443,imgsize-661643,width-400,resizemode-4/111295443.jpg"
"BJP sought ‘400 paar’ to change Constitution, but failed: Congress",https://timesofindia.indiatimes.com/india/bjp-sought-400-paar-to-change-constitution-but-failed-congress/articleshow/111295364.cms,"NEW DELHI: None of the INDIA bloc parties protested when the govt brought in the proposal to condemn the Emergency , leaving Congress members to fight the battle alone in Lok Sabha .The Congress group led by K C Venugopal, Gaurav Gogoi, Manickam Tagore, K Suresh and Hibi Eden stood up and raised slogans for the duration that Speaker Om Birla read the resolution. A senior leader said the allies did not protest because of the history of Emergency, and that most of them were against Congress at that time.Later, SP chief Akhilesh Yadav told reporters that Samajwadis were victims of Emergency and BJP alone did not face the state action.""But what BJP has done today is just a pretence. How much do we look behind, look at the past? The future is ahead. We brought an Act to provide wages to 'Loktantra Rakshak Sainani'. If BJP is serious about the issue, let them bring this Act everywhere. Let BJP increase their honorarium, make it 1 lakh,"" he said. Responding to the govt charge that the Constitution was ""finished"" during the mergency, Congress spokesperson Jairam Ramesh said, ""Between 2014-24, all constitutional values and principles were assaulted and the independence of all constitutional bodies eroded. During the election campaign, PM Narendra Modi asked for '400 paar' to change the Constitution and he was rebuffed by the people resoundingly.""Mainpuri MP Dimple Yadav said the country should talk about the present situation like inflation, unemployment, and not about the past.","The Congress group led by K C Venugopal, Gaurav Gogoi, Manickam Tagore, K Suresh and Hibi Eden stood up and raised slogans for the duration that Speaker Om Birla read the resolution. A senior leader said the allies did not protest because of the history of Emergency.","https://static.toiimg.com/thumb/msid-111295399,imgsize-865016,width-400,resizemode-4/111295399.jpg"
"6 months, 6.2 lakh trained: Centre eyes smooth switch to new crime laws",https://timesofindia.indiatimes.com/india/6-months-6-2-lakh-trained-centre-eyes-smooth-switch-to-new-crime-laws/articleshow/111295392.cms,"NEW DELHI: Centre's efforts to prepare the states for a smooth transition to the new criminal laws - set to take effect on July 1 - had started soon after they were notified on Dec 25, with the past six months seeing the National Crime Records Bureau make 23 functional modifications in the Crime and Criminal Tracking & Network Systems (CCTNS) to enhance the use of technology in criminal justice delivery.Additionally, Bureau of Police Research and Development has facilitated training of more than 6.2 lakh personnel in various aspects of the new laws.Not just NCRB and BPRD, but Union ministries and departments like legal affairs, higher education, personnel, women & child development, rural development, panchayati raj and I&B have been working with various stakeholders like govt employees, state police, judiciary, prison, prosecution, law students and general public to ensure technology upgrade, capacity building and awareness generation regarding provisions of the new laws prior to their enforcement, as per home ministry sources.""MHA has held regular meetings with states/UTs. States and UTs are geared up in terms of technology, capacity building and awareness generation to implement the Bharatiya Nyaya Sanhita (BNS), Bharatiya Nagarik Suraksha Sangita (BNSS) and Bharatiya Sakshya Adhiniyam (BSA) from July 1,"" an MHA official informed TOI.Given the new laws' emphasis on leveraging technology for investigation, trial and court proceedings in criminal cases, NCRB has been providing technical assistance to states/UTs and set up 36 support teams and a call centre to enable review and hand-holding of states/UTs for their smooth implementation. NIC has developed apps like eSakshya, NyayShruti and eSummon Apps, for facilitating videography and photography of crime scene, judicial hearings and delivering court summons electronically, in accordance with BNSS provisions. For capacity building, BPRD had developed training modules and shared them with all the stakeholders. BPRD on its own conducted 250 training courses/webinars/seminars in which 40,317 officers/personnel were trained. BPRD is also offering three training courses on the new criminal laws, for which 2.2 lakh officials have enrolled thus far.To educate citizens on the transformative reforms and positive impact of BNS, BNSS and BSA, WCD and other central ministries have undertaken webinars in which nearly 40 lakh grassroots functionaries participated. Public awareness regarding the new criminal laws is being created by the I&B ministry through the Press Information Bureau, which has has conducted 17 nationwide 'vartalap', (conversations), a media workshop primarily for the regional media, in the states.","National Crime Records Bureau has made 23 functional modifications in the Crime and Criminal Tracking & Network Systems. Bureau of Police Research and Development has facilitated training of more than 6.2 lakh personnel in various aspects of the new laws. Union ministries and departments like legal affairs, higher education, personnel, women & child development, rural development, panchayati raj and I&B have been working.","https://static.toiimg.com/thumb/msid-111295396,imgsize-1008320,width-400,resizemode-4/111295396.jpg"
India steps up training of foreign military personnel to boost ties,https://timesofindia.indiatimes.com/india/india-steps-up-training-of-foreign-military-personnel-to-boost-ties/articleshow/111295351.cms,"NEW DELHI: From basic infantry skills and seamanship to operating advanced weapon systems and platforms like diesel-electric submarines and supersonic fighter jets, India is further cranking up training of foreign military personnel to strengthen defence partnerships with different countries.The focus is on training cadets and personnel from ""friendly foreign countries"" in the Gulf , the ASEAN and Africa, apart of course from the neighbourhood, in the various Indian military establishments and academies.As part of the ongoing military outreach to Gulf countries like UAE, Saudi Arabia, Oman, Qatar and Bahrain, for instance, as many as 76 Saudi cadets have now begun sea training at the Southern Naval Command (SNC) at Kochi.The trainees from the King Fahad Naval Academy of the Royal Saudi Naval Forces (RSNF) have joined the Indian Navy's First Training Squadron for the four-week programme, which comes after Saudi Navy chief Admiral Fahad Abdullah S Al-Ghofaily's visit here in Jan this year.""The curriculum ranges from basic seamanship activities to simulator-based training during the harbour phase. The sea phase will focus on practical exposure to nuances of life at sea,"" an officer said. This is the second such RSNF batch after the first included 55 cadets in May-June last year. Similarly, military personnel from 26 countries in Africa, where China has made huge strategic inroads, regularly attend courses in Indian Army's establishments and pre-commissioning training academies.""The Army trains around 3,100 foreign personnel from over 100 countries every year, which includes about 450 from African countries,"" another officer said. The Army even offers special training packages in its establishments like the counterinsurgency and jungle warfare school at Vairengte in Mizoram.The Navy, in turn, provides training to at least 300 foreign trainees at its various training establishments or on-board warships at any given time. India has also been steadily deepening military ties with Asean countries."," focus is on training cadets and personnel from ""friendly foreign countries"" in the Gulf, the ASEAN and Africa. As many as 76 Saudi cadets have now begun sea training at the Southern Naval Command (SNC) at Kochi. India has also been steadily deepening military ties with Asean countries.","https://static.toiimg.com/thumb/msid-111295369,imgsize-819689,width-400,resizemode-4/111295369.jpg"
