Article Title,Article Link,Article Text,Article Summary,Article Image
"Nab Prajwal promptly, file report in 3 days: NCW to Karnataka",https://timesofindia.indiatimes.com/india/nab-prajwal-promptly-file-report-in-3-days-ncw-to-karnataka/articleshow/109738804.cms,"NEW DELHI: National Commission for Women termed allegations of sexual abuse against Hassan MP Prajwal Revanna “distressing” and wrote to the Karnataka police chief asking him to “promptly apprehend the accused” and submit a report within three days.Condemning the “reprehensible acts”, NCW said, “Incidents of this nature not only pose a grave threat to the safety and dignity of women but also contribute to the perpetuation of a culture of disrespect and violence against them.”On Monday, Congress had questioned the silence of Centre and NCW.All India Mahila Congress chairperson Alka Lamba wrote to NCW seeking immediate action and protection to women who filed complaints against Revanna.NCW chairperson Rekha Sharma said, “...We urge prompt and decisive action from the concerned police authority to swiftly apprehend the accused, who has fled the country.",NCW wrote to the Karnataka police chief asking him to “promptly apprehend the accused’ and submit a report within three days. Congress had questioned the silence of Centre and NCW. All India Mahila Congress chairperson Alka Lamba wrote to NCW seeking immediate action and protection to women who filed complaints.,"https://static.toiimg.com/thumb/msid-109738822,imgsize-32920,width-400,resizemode-4/109738822.jpg"
Patanjali told to pay 27.5cr for GST infraction,https://timesofindia.indiatimes.com/india/patanjali-told-to-pay-27-5cr-for-gst-infraction/articleshow/109738788.cms,"DEHRADUN/HARIDWAR: In a double blow to Patanjali, the Directorate General of GST Intelligence ( DGGI ) in Chandigarh has imposed a hefty penalty of Rs 27.5 crore on Patanjali Foods for an irregularity in Input Tax Credit ( ITC ). The notice comes a day after the Uttarakhand govt suspended the licences for 14 products sold by Patanjali Ayurved and Divya Pharmacy, including popular offerings Swasari Gold, Mukta Vati Extra Power, and BP Grit.The penalty by DGGI Chandigarh stems from the detection of a Rs 20-crore irregularity in ITC, as GST officials revealed. According to GST officials, in case of a fake ITC claim, a penalty can be imposed up to the amount of the ITC claim along with interest. They said that in this case, the wrong ITC claim was Rs 20 crore, and the penalty amount is Rs 27.5 crore – inclusive of interest — hence, the total amount stands at Rs 47.5 crore. Despite attempts by TOI, Patanjali officials remained unresponsive for comment.Meanwhile, legal tussle escalated as Uttarakhand suspended licences for 14 Patanjali products, including those mentioned above. The state government also demanded the formula for these drugs from Patanjali. Speaking to TOI, Patanjali Ayurved media in-charge S K Tijarawala stated, “We will reply to the notice served by state govt and take legal recourse regarding the action taken against us.”This action follows a case filed by the Indian Medical Association (IMA) in the Supreme Court after Patanjali published an advertisement claiming to cure various diseases, which the IMA deemed misleading. The apex court scrutinised govt's response to Patanjali Ayurved’s activities, criticising their passivity. Responding to the court’s queries, the state Ayurvedic and Unani Services department suspended the licences of the mentioned drugs under provisions of the Drug and Cosmetic Act 1945. Dr Mithlesh Kumar, the drug controller, stated, “Manufacturing permission for the mentioned drugs is suspended with immediate effect.”The legal confrontation deepened as the Ayurvedic and Unani services department of the Ayush ministry filed affidavits regarding the action taken against Patanjali. The department sought the apex court’s permission to file revised affidavits, and the case is scheduled for a hearing on May 14.","The penalty stems from the detection of a Rs 20-crore irregularity in ITC, as GST officials revealed. The notice comes a day after the Uttarakhand govt suspended the licences for 14 products sold by Patanjali Ayurved and Divya Pharmacy, including popular offerings Swasari Gold, Mukta Vati Extra Power and BP Grit.","https://static.toiimg.com/thumb/msid-109738789,imgsize-41596,width-400,resizemode-4/109738789.jpg"
SC allows Patanjali to file contempt plea against IMA chief,https://timesofindia.indiatimes.com/india/sc-allows-patanjali-to-file-contempt-plea-against-ima-chief/articleshow/109738571.cms,"NEW DELHI: After Patanjali Ayurved founders Baba Ramdev and Acharya Balkrishna , who had to face contempt proceedings on a plea by the Indian Medical Association (IMA), it now seems to be the turn of the IMA chief to face the music with Supreme Court on Tuesday allowing filing of a contempt application against him for allegedly making disparaging remarks against the court.Appearing before a bench of Justices Hima Kohli and Ahsanuddin Amanullah, senior advocate Mukul Rohatgi said he had come across a “very disturbing” interview of IMA president R V Asokan in a newspaper and it must be considered by the court. “The IMA president says why is the court pointing fingers at us. This is direct interference with the court. He says these are unfortunate, vague comments by Supreme Court,” Rohatgi said.“Bring it on record. This will be more serious than what has been happening till now. Be prepared for more serious consequences,” the bench said. Rohatgi, appearing for Patanjali, told the court that he would file a contempt application against the IMA president.In the previous hearing, the bench had told IMA to put its “house in order” and address “unethical practices by doctors and hospitals like prescribing unnecessary and expensive medicines”. “Misuse of position by the petitioner association to prescribe expensive medicines and the line of treatment needs closer examination,” the court had said.In his interview, the IMA president had termed the SC’s observation as “unfortunate”. The court also slammed the Uttarakhand State Licensing Authority for its failure to take inaction against Patanjali Ayurved for years together.Appearing before a bench of Justices Hima Kohli and Ahsanuddin Amanullah, senior advocate Mukul Rohatgi said he had come across a “very disturbing” interview of IMA president R V Asokan in a newspaper and it must be considered by the court.",Supreme Court on Tuesday allowed filing of a contempt application against IMA chief. Patanjali Ayurved founders Baba Ramdev and Acharya Balkrishna had to face contempt proceedings on a plea by the Indian Medical Association (IMA),"https://static.toiimg.com/thumb/msid-109738577,imgsize-48196,width-400,resizemode-4/109738577.jpg"
‘Juvenile’ to suggest national wealth redistribution: SG,https://timesofindia.indiatimes.com/india/juvenile-to-suggest-national-wealth-redistribution-sg/articleshow/109738521.cms,"NEW DELHI: Amid a growing debate on redistribution of wealth, solicitor general Tushar Mehta told Supreme Court on Tuesday that these were “rustic and juvenile” methods to achieve egalitarianism.Outlining that Article 39(b) of the Constitution envisaged distribution of material resources of the community to subserve the common good, Mehta told a nine-judge bench led by CJI D Y Chandrachud, “It would be a rustic and juvenile method to propose computing the nation’s wealth by totalling the wealth of every citizen and then distributing it equally among a particular section.Such ideas reflect a lack of understanding of economic development , governance, social welfare and the nation.”Mehta said if a plot of land belonged to an individual and it was needed for construction of a road to subserve the common good of residents of a large area, then that privately-owned land would be classified as material resource to be utilised for greater good of the community. “Article 39(b) based legislation is not meant to take away properties owned by people of a particular community, race or caste for distribution among another class of citizens,” he said.The bench comprising CJI Chandrachud and Justices Hrishikesh Roy, B V Nagarathna, S Dhulia, J B Pardiwala, Manoj Misra, R Bindal, S C Sharma and A G Masih seemed to concur. “It would be rather extreme to interpret Article 39(b) to include privately-owned property as material resources of the community,"" the bench said.“The dynamics of economic development have changed from socialist pattern to a free market economy since the 1990s and now private investments hold the key. If we want to have a productive economy, then private investment must be encouraged. In the 1950s, no one had envisaged that electricity would be distributed by private parties. In the present scenario, it would be extremely unfair to argue that community resources include all private properties,” it added.CJI Chandrachud said when the constitutional court interprets a key provision like Article 39(b) in Directive Principles of State Policy of the Constitution, it must ensure that the interpretation “sends a clear message of what India is and what it aspires to be”.“It is difficult to outrightly categorise all private properties as material resources of the community. But at the same time, we cannot say that material resources can never include any private property,” he said, indicating that a balance needs to be struck between the two extreme views — socialist and capitalist — in the context of India's development.Mehta said Article 39(b) was a measure for developing a welfare state with the goal of achieving common good, where material resources of the community need legislative intervention to be either taken over or controlled for distribution. He said the govt did not advocate either extremes — that all assets of the country vested in the nation or community, or that no private property could ever be categorised as community resources. “It depends on the context of time and purpose,” he said.After hearing Mehta, the bench said, “Your arguments appear to contradict that of attorney general R Venkataramani who had argued that community resources would include private properties.” Mehta said he had nuanced the legal proposition differently. Arguments will conclude on Wednesday.",Solicitor general Tushar Mehta told Supreme Court on Tuesday that these were “rustic and juvenile’ methods to achieve egalitarianism. Article 39(b) of the Constitution envisaged distribution of material resources of the community to subserve the common good.,"https://static.toiimg.com/thumb/msid-109738523,imgsize-48196,width-400,resizemode-4/109738523.jpg"
PM Modi condoles passing away of Sarada Math head in Kolkata,https://timesofindia.indiatimes.com/india/pm-modi-condoles-passing-away-of-sarada-math-head-in-kolkata/articleshow/109738494.cms,"NEW DELHI: Prime Minister Narendra Modi paid tribute to the fifth president of Sri Sarada Math and Ramakrishna Sarada Mission on her demise on Tuesday and said she will be remembered for her monumental service to society.“Pravrajika Anandaprana Mataji, the Most Revered President of Sri Sarada Math and Ramakrishna Sarada Mission will be remembered for her monumental service to society and inculcating values of spirituality among people,” he posted on X.“Her efforts in healthcare, education and empowering Nari Shakti will also be remembered. My thoughts are with the countless devotees in this sad hour. Om Shanti,” he added.Born in Kolkata in 1927, Pravrajika Anandaprana Mataji received spiritual initiation from Swami Shankarananda, the seventh president of Belur Math. She is known for her service to society, promoting spirituality, and her efforts in healthcare, education, and empowering women.","PM Narendra Modi paid tribute to the fifth president of Sri Sarada Math and Ramakrishna Sarada Mission. He said she will be remembered for her monumental service to society and inculcating values of spirituality among people.Born in Kolkata in 1927, Pravrajika Anandaprana Mataji received spiritual initiation.","https://static.toiimg.com/thumb/msid-109738492,imgsize-40360,width-400,resizemode-4/109738492.jpg"
"2nd hottest April ever in South, East India mean temp at 51-yr high",https://timesofindia.indiatimes.com/india/2nd-hottest-april-ever-in-south-east-india-mean-temp-at-51-yr-high/articleshow/109738371.cms,"— With inputs from Niranjan Kaggere in Bengaluru, Sumati Yengkhom in Kolkata

NEW DELHI: South India experienced its second hottest April on record in terms of maximum temperatures while the average mean temperature in east and northeast India was the highest for the month in 51 years, IMD data reveals, attesting to the torridly hot conditions that these regions have been witnessing over the past few weeks.The last few days have seen heat records fall in three of India’s biggest cities — Bengaluru, Kolkata and Mumbai.The South as a whole recorded an average maximum temperature of nearly 37.2 degrees Celsius during the month — surpassed only by 37.6 degrees C logged in April 2016 in records going back to 1901 — IMD’s monthly temperature data reveals. Bengaluru witnessed its hottest ever April. The metro, once famous as the Garden City, recorded 13 extremely hot days, including six in a row, during the month.Eastern India has been baking in April heat during a prolonged spell of extreme weather. As per IMD’s data, the average mean temperature in the region (east and NE, as per IMD classification) during the month was the highest since 1973, with the average night temperatures the highest ever in April. Bengal, Jharkhand and Bihar have been reeling under extreme heat. On Tuesday, Kolkata (Dum Dum) logged 43 degrees C, its highest temperature in April and fourth highest for any month. It was 43 degrees C at Kolkata’s Alipore as well, less than a degree from the all-time high of 43.9 recorded almost a century ago and only the second time ever that Kolkata’s April temperature had touched the 43-degree mark.Meanwhile, for the first time in the country this season, the mercury crossed the 47-degree mark on Tuesday — Kalaikunda in (Bengal) logged 47.2 degrees C, a whopping 10.4 degrees above normal, and Baharagora in East Singhbhum district of Jharkhand touched 47.1 degrees C. At least three spots in the region — Kalaikunda, Panagarh (Bengal) and Balasore (Odisha) — reported temperatures 10 degrees higher than normal.Odisha, which falls under central India in IMD’s classification, has been reeling under a heat wave for 16 straight days. “This is the highest number of consecutive days of heat wave in Odisha in 10 years. The record for the longest heat wave spell in the state is 26 days, reported in 1998,” said Mrutyunjay Mohapatra, chief of IMD.“The heat waves in several parts of the country weren’t entirely unexpected. El Nino continues to persist in the Pacific and under this condition, south India and adjoining areas are known to witness above normal temperatures in April. A more immediate reason for the heat in eastern India is the presence of an anti-cyclonic circulation in central Bay of Bengal, which is preventing sea breeze from entering the region. As a result, the land has become dry and hot,” Mohapatra said.Another wind circulation, an anti-cyclone over western Arabian Sea, has been pumping up heat along the western coast, particularly the Konkan belt, over the past few days. On Monday, the temperature at Mumbai’s Santa Cruz crossed 39 degrees for the second time this month, making it the second hottest April day in the city in 10 years.IMD expects the heat wave to continue in eastern India till May 2 and for at least another five days in the South.","South India experienced its second hottest April on record in terms of maximum temperatures. Average mean temperature in east and northeast India was the highest for the month in 51 years. Bengal, Jharkhand and Bihar have been reeling under extreme heat. IMD expects the heat wave to continue in eastern India till May 2 and for at least another five days in the South.","https://static.toiimg.com/thumb/msid-109738399,imgsize-80368,width-400,resizemode-4/109738399.jpg"
Art 39(b) was left vague to help make appropriate future laws: SG,https://timesofindia.indiatimes.com/india/art-39b-was-left-vague-to-help-make-appropriate-future-laws-sg/articleshow/109738302.cms,"NEW DELHI: Solicitor General Tushar Mehta on Tuesday extensively quoted B R Ambedkar while trying to find an answer to the 50-year-old question — whether material resources of the community included private property?Arguing for acceptance of Ambedkar’s views before a bench of CJI D Y Chandrachud and Justices Hrishikesh Roy, B V Nagarathna, S Dhulia, J B Pardiwala, Manoj Misra, R Bindal, S C Sharma and A G Masih, the SG said the main architect of the Constitution was aware of the intricacies that future govts and Parliament would face in providing social, economic and political justice to citizens and, hence, left the wording of Article 39(b) deliberately vague to allow them to devise appropriate legislations.Mehta quoted extensively from the Nov 1948 Constituent Assembly debate on finalisation of the draft of Article 39(b) in the Directive Principles of State Policy .Ambedkar was faced with the question of how to bring about economic democracy. He answered it by saying, “There are various ways in which people believe that economic democracy can be brought about; there are those who believe in individualism as the best form of economic democracy, there are those who believe in having a socialist state as the best form of economic democracy, there are those who believe in the communistic idea as the most perfect form of economic democracy.“Having regard to the fact that there are various ways by which economic democracy may be brought about... we have left enough room for people of different ways of thinking... to strive in their own way, to persuade the electorate that it is the best way of reaching economic democracy...”“India is a social democracy that aligns closely with the principles of a social welfare state . Social and economic justice is not to be understood in crude terms of ‘distributive justice’ aimed at wholesale allocation of material resources of the community to the public at large in one go,” he said.","Solicitor General Tushar Mehta quoted extensively from the Nov 1948 Constituent Assembly debate on finalisation of the draft of Article 39(b) in the Directive Principles of State Policy. He said the main architect of the Constitution was aware of the intricacies that future govts and Parliament would face in providing social, economic and political justice to citizens.","https://static.toiimg.com/thumb/msid-109738320,imgsize-20380,width-400,resizemode-4/109738320.jpg"
‘Unwarranted’: MEA slams Washington Post report on plot to kill Pannun,https://timesofindia.indiatimes.com/india/unwarranted-mea-slams-washington-post-report-on-plot-to-kill-pannun/articleshow/109738281.cms,"Expect accountability from India on Pannun case: US

NEW DELHI: The Washington Post report which alleged involvement of top Indian officials, including former RAW chief Samant Goel , in the Pannun murder-for-hire plot makes unwarranted and unsubstantiated imputations on a serious matter, govt said on Tuesday in its first reaction to the story that also identified the Indian official who allegedly ordered the foiled attempt on Khalistan leader Gurpatwant Singh Pannun’s life.In a statement, govt said there is an ongoing investigation by the ‘high-level committee’ set up by India to look into the security concerns shared by US govt on “networks of organised criminals, terrorists and others”. “Speculative and irresponsible comments on it are not helpful,” said Randhir Jaiswal, spokesperson, ministry of external affairs .India had formed the committee in Nov, but has so far not revealed anything about the outcome of the probe. The foreign ministry had earlier said India is probing the information shared by US authorities on the plot because it has a bearing on India’s security as well.The US had last year indicted an Indian national, Nikhil Gupta, for his role in the Pannun murder plot and said in the indictment he was working for an Indian official it then identified as ‘CC-1’. The Washington Post report has now named the official who allegedly ordered the hit as Vikram Yadav. Indian govt is yet to confirm the identity of this official. While Gupta is currently awaiting extradition in Prague, the report said Yadav had been transferred to CISF after the Pannun plot unravelled.Following the report, the White House said India is taking the allegations regarding the assassination plot seriously and that the US expects accountability.Indian govt is yet to confirm the identity of this official. While Gupta is currently awaiting extradition in Prague, the report said Yadav had been transferred to CISF after the Pannun plot unravelled.Pannun, wanted in India on terror charges, holds dual citizenship of US and Canada. He has been designated as a terrorist by Union home ministry under anti-terror law — UAPA.Following the report, White House said India is taking the allegations regarding the assassination plot of the Sikh separatist seriously and that US exp-ects accountability.Asked about the investigative report, press secretary Karine Jean-Pierre said, “We’ve been really consistent about that and have laid that out multiple times, whether it’s a meeting here with the prime minister or a meeting abroad.”“This is a serious matter and we’re taking that very very seriously. Govt of India has been very clear with us that they are taking this seriously and will investigate,” Jean-Pierre said.“We expect accountability from the govt based on that. But we are going to continue to raise our concerns. That’s not going to stop. We’re going to continue to raise our concerns directly, with the Indian govt,” the press secretary added.","The Washington Post report alleged involvement of top Indian officials in the Pannun murder-for-hire plot. Indian govt said there is an ongoing investigation by the ‘high-level committee’ set up by India to look into the security concerns shared by US govt on “networks of organised criminals, terrorists and others”","https://static.toiimg.com/thumb/msid-109738286,imgsize-817453,width-400,resizemode-4/109738286.jpg"
Russian crude imports cut India’s oil bill by $8bn in FY24,https://timesofindia.indiatimes.com/india/russian-crude-imports-cut-indias-oil-bill-by-8bn-in-fy24/articleshow/109738272.cms,"NEW DELHI: India saved an estimated $7.9 billion in oil import in the 11 months of 2023-24 financial year ended March 31, compared to $5.1 billion over the whole of 2022-23, by purchasing higher volumes of Russian crude at deep discounts, ICRA Research said on Tuesday.The savings leads to a “compression” of 15-22 basis points in India’s current account deficit-to-GDP ratio in 2023-24, it said.However, it added that if the low levels of discounts prevail, India’s net oil import bill could widen to $101-104 billion in 2024-25 from $96 billion in 2023-24, assuming an average crude price of $85 per barrel.Based on commerce ministry data, the note pegs the share of Russian crude in India’s oil import basket rising to about 36% during the April 2023-February 2023 period, marking a jump of 1700% from about 2% in 2021-22.","India saved an estimated $7.9 billion in oil import in the 11 months of 2023-24 financial year ended March 31, compared to $5.1 billion over the whole of 2022-23. The savings leads to a “compression” of 15-22 basis points in India’s current account deficit-to-GDP ratio.","https://static.toiimg.com/thumb/msid-109738278,imgsize-86186,width-400,resizemode-4/109738278.jpg"
