Article Title,Article Link,Article Text,Article Summary,Article Image
"No reservation based on religion to Muslims as long as I am alive, says PM Modi in Telangana",https://timesofindia.indiatimes.com/india/no-reservation-based-on-religion-to-muslims-as-long-as-i-am-alive-says-pm-modi-in-telangana/articleshow/109732653.cms,"(With inputs from agencies)

NEW DELHI: Prime Minister Narendra Modi on Tuesday criticised the Congress , stating he will not permit reservation for Muslims based on religion if it comes at the expense of SC, ST, and OBCs.""They (Congress) want to insult the Constitution for their vote bank. But I want them to know, till the time I am alive, I will not let them give the reservation meant for Dalits, SCs, STs, and OBCs to the Muslims in the name of religion,"" said PM Modi during a campaign event in Telangana's Medak district.He also expressed confidence that he would commemorate 75 years of the Constitution in a grand manner during his third term.The PM further launched a veiled attack at Telangana chief minister Revanth Reddy, claiming that the funds gathered in the state through the 'double R (RR) tax' are being diverted to Delhi. He mentioned this while talking about the popular Telugu film named 'RRR', which garnered international recognition.Accusing the Congress party in the Amit Shah fake video case, he stated that it was intended to deceive people and stir up tension in society.PM Modi claimed the Congress would introduce a 55% inheritance tax if they come into power, highlighting that while the global economy was advancing, India faced policy stagnation during the previous UPA government.""If Congress comes to power, they will bring inheritance tax. Congress is planning to collect more than half- 55% as tax on inheritance (received from parents),"" he claimed.Mocking the Congress, he mentioned that whenever the long-standing party holds power, it embodies five political characteristics - false promises, vote bank politics, support for mafia and criminals, dynastic politics, and corruption.The PM further accused that initially it was BRS that plundered Telangana, and now it is the Congress.","PM Narendra Modi said he will not permit reservation for Muslims based on religion if it comes at the expense of SC, ST, and OBCs. He also expressed confidence that he would commemorate 75 years of the Constitution in a grand manner during his third term.","https://static.toiimg.com/thumb/msid-109732791,imgsize-1319402,width-400,resizemode-4/109732791.jpg"
"TMC leader Abhishek Banerjee challenges Amit Shah to contest against him, says will quit politics if defeated",https://timesofindia.indiatimes.com/india/tmc-leader-abhishek-banerjee-challenges-amit-shah-to-contest-against-him-says-will-quit-politics-if-defeated/articleshow/109735333.cms,"NEW DELHI: Senior Trinamool Congress (TMC) leader Abhishek Banerjee has thrown down the gauntlet to Union home minister Amit Shah, daring him to contest against him from the Diamond Harbour Lok Sabha constituency .In a bold move, Banerjee declared that if the BJP leader won, he would retire from active politics .Speaking at an election rally in support of TMC's Mathurapur candidate Bapi Halder , Banerjee, often regarded as the number two in the TMC, outlined three options for Shah to fulfill if he wishes to see Banerjee exit the political arena.""If you want Abhishek Banerjee to leave active politics, then I would like you to fulfil any of the three options I am providing you today,"" Banerjee said. ""Release the state's due of Rs 1,64,000 crore, and I will retire within 24 hours. Alternatively, release the funds of the PM Awas Yojana. Or, the third option: you contest from here and defeat me. I will leave politics forever.""Banerjee's challenge comes in response to Shah's earlier statement in Memari, where he claimed that TMC supremo Mamata Banerjee desires him to be the next chief minister of West Bengal.In a pointed rebuttal, Abhishek Banerjee dismissed Shah's aspirations for his son, Jay Shah , in cricket administration, emphasizing their divergent priorities. ""You wish to make your son the BCCI president. Not all are like you,"" Banerjee said. ""You have never been part of any agitation. You are a person who was jailed. We do not need to learn any moral values and ideology from you.""Banerjee underscored the TMC's commitment to serving the people's interests, contrasting it with Shah's alleged pursuit of self-interest in politics.(With inputs from agencies)","Senior Trinamool Congress (TMC) leader Abhishek Banerjee has thrown down the gauntlet to Union home minister Amit Shah, daring him to contest against him from the Diamond Harbour Lok Sabha constituency. In a bold move, Banerzee declared that if the BJP leader won, he would retire from active politics.","https://static.toiimg.com/thumb/msid-109735397,imgsize-1014469,width-400,resizemode-4/109735397.jpg"
"Arvind Kejriwal plea against arrest: Supreme Court questions timing of arrest, Enforcement Directorate told to reply by May 3",https://timesofindia.indiatimes.com/india/arvind-kejriwal-plea-against-arrest-supreme-court-questions-timing-of-arrest-enforcement-directorate-told-to-reply-by-may-3/articleshow/109728190.cms,"(This is a developing story)

NEW DELHI: The Supreme Court on Tuesday posed some tough questions to the Enforcement Directorate (ED) during the second day of hearing Delhi chief minister Arvind Kejriwal's petition challenging his arrest by the central probe agency.A bench of Justices Sanjiv Khanna and Dipankar Datta questioned the probe agency over the timing of the arrest of Kejriwal.""Liberty is very exceedingly important, you can't deny that. The question is with regard to the timing of the arrest, which they have pointed out, the timing of the arrest, soon before the general elections,"" Justice Sanjiv Khanna told Additional Solicitor General SV Raju, who is appearing on behalf of the ED.According to LiveLaw, Justice Khanna also asked the ASG: ""Another question is whether there being any adjudicatory proceedings, can you have criminal proceedings being initiated? In terms of what has been held in VMC or otherwise. In this case, there has been no proceeding for attachment. You have to show how petitioner was ... what they believe is threshold of Section 19 is fairly high ... they will be confronted with Section 45 ... that is why they are repeatedly coming against arrest.""The Supreme Court further noted that in the matter linked to former Delhi deputy CM Manish Sisodia, the investigators have claimed they have found material, but in Kejriwal's case nothing has been brought up.Justice Khanna also questioned the time gap between initiation of the probe and arrest. ""The time gap which is taking place between initiation of proceedings and repeated complaints being filed after some time ... this all has consequences. 365 days ... is upper limit,"" he noted.The Bench reiterated that ""liberty is exceedingly important"" and asked the agency to be ""prepared"" with answers.The ED has been asked to respond by Friday.Kejriwal is currently lodged in the Tihar jail here under judicial custody after his arrest on March 21 in the case.The top court issued ED a notice on April 15 and sought its response to Kejriwal's plea.On April 9, the high court upheld Kejriwal's arrest, saying there was no illegality and the ED was left with ""little option"" after he skipped repeated summonses and refused to join the investigation.The matter pertains to alleged corruption and money laundering in the formulation and execution of the Delhi government's now scrapped excise policy for 2021-22.","Justices Sanjiv Khanna and Dipankar Datta questioned the probe agency over the timing of the arrest of Kejriwal. The Bench reiterated that ""liberty is exceedingly important"" and asked the agency to be ""prepared"" with answers. The ED has been asked to respond by Friday.","https://static.toiimg.com/thumb/msid-109729027,imgsize-938890,width-400,resizemode-4/109729027.jpg"
"Congress LS list: Raj Babbar to fight from Gurgaon; no name yet for Amethi, Rae Bareli",https://timesofindia.indiatimes.com/india/congress-ls-list-raj-babbar-to-fight-from-gurgaon-no-name-yet-for-amethi-rae-bareli/articleshow/109734273.cms,"Amethi maange Rahul Gandhi. Amethi maange Priyanka Gandhi

NEW DELHI: The Congress party on Tuesday evening announced actor-turned politician Raj Babbar as its candidate for the Gurgaon constituency in the Lok Sabha elections . Raj Babbar, a seasoned Congress leader, has previously served as a Member of Parliament from Firozabad and Agra in Uttar Pradesh.The grand old party has unveiled four candidates in its latest election list.Former Union minister Anand Sharma will contest from Kangra in Himachal Pradesh, while Satpal Raizada has been nominated for Hamirpur. Additionally, Bhushan Patil has been named as the candidate for Mumbai North.With only three days left until the deadline for filing nominations, the Congress has maintained suspense regarding the prestigious Amethi and Raebareli constituencies. Candidates for these seats have not been named in the latest list released for the Lok Sabha polls.In Uttar Pradesh, Congress workers staged a sit-in on Tuesday, demanding the party to nominate a member of the Gandhi family as its candidate from the Amethi Lok Sabha seat.The constituency is scheduled for polls on May 20 in the fifth phase of the seven-phase general elections. Despite only three days remaining for the filing of nomination papers, the Congress has not yet announced a candidate for the seat, according to the party's district spokesperson, Anil Singh.Leaders and workers, including Congress district president Pradeep Singhal and former district president Yogendra Mishra, convened at the party office with posters stating ""(Amethi wants Rahul Gandhi or Priyanka Gandhi Vadra).""""People of the constituency and Congress workers want a member of the Gandhi family as their candidate. We want Rahul Gandhi to contest from Amethi to bring back its lost honour,"" Singh said.The demonstrators demanded that the Congress immediately announce a candidate in Amethi, emphasising that the nominee should be from the Gandhi family. The seat was secured by Congress leader Rahul Gandhi in 2014. However, in 2019, Gandhi contested the general elections from both Wayanad in Kerala and Amethi. He lost Amethi to BJP's Smriti Irani.(With inputs from agencies)","Raj Babbar, a seasoned Congress leader, has previously served as a Member of Parliament from Firozabad and Agra in Uttar Pradesh. Congress workers staged a sit-in on Tuesday, demanding the party to nominate a member of the Gandhi family as its candidate from the Amethi seat.","https://static.toiimg.com/thumb/msid-109734520,imgsize-718929,width-400,resizemode-4/109734520.jpg"
Raghav Chadha 'might have lost eyesight': Saurabh Bharadwaj on continued absence of AAP MP,https://timesofindia.indiatimes.com/india/raghav-chadha-might-have-lost-eyesight-saurabh-bharadwaj-on-continued-absence-of-aap-mp/articleshow/109717001.cms,"NEW DELHI: Aam Aadmi Party ( AAP ) leader Saurabh Bharadwaj on Tuesday provided an update on the whereabouts of Raghav Chadha , stating that the MP faced potential blindness following a complication in his eyes. Chadha has been in London , United Kingdom for a major eye surgery for almost two months.Speaking at a press conference, Bharadwaj said, ""He is in the UK; there was a complication in his eyes and I was told that it was quite critical that he might have lost his eyesight as well.Further addressing the concerns about his absence during election campaigning season, Bharadwaj added, "" He has gone there to get treatment. I have my best wishes with him. He will be back soon in good health and will join the campaign.""Raghav Chadha's UK visit had landed itself in controversy last month when he met British Labour MP Preet K Gill, who is known for her “advocacy of Khalistan separatism” and anti-India sentiments on social media.Several questions have been raised by opposition parties regarding the “prolonged absence” of AAP leaders including Rajya Sabha MPs Raghav Chadha and Swati Maliwal who are said to be abroad amid the arrest of Delhi CM Arvind Kejriwal and election campaigning.Last month, BJP claimed very few AAP leaders are standing by the chief minister when he is in jail. “After Arvind Kejriwal’s remand was extended, the support for him within his own party, seems to be dwindling. Except Atishi and Saurabh Bharadwaj, who fancy themselves as CM of Delhi if Kejriwal continues to be in jail, none of his other acolytes seem to be here, when he needs them the most,” BJP IT cell head Amit Malviya claimed in a post on X.(With agency inputs)",Aam Aadmi Party (AAP) leader Saurabh Bharadwaj on Tuesday provided an update on the whereabouts of Raghav Chadha. He said the MP faced potential blindness following a complication in his eyes. Chadha has been in London for a major eye surgery for almost two months.,"https://static.toiimg.com/thumb/msid-109717491,imgsize-692367,width-400,resizemode-4/109717491.jpg"
FIR filed against Congress leader Salman Khurshid and SP leader Maria Alam Khan for alleged 'vote jihad' remarks,https://timesofindia.indiatimes.com/india/vote-bank-politics-fir-filed-against-congress-leader-salman-khurshid-and-sp-leader-maria-alam-khan-for-alleged-vote-jihad-remarks/articleshow/109732211.cms,"NEW DELHI: An FIR has been lodged against senior Congress leader Salman Khurshid and Samajwadi Party (SP) leader Maria Alam Khan under sections 188 and 295A of the Indian Penal Code (IPC) in Kayamganj Police Station, Fatehgarh district. The FIR alleges that the leaders made an appeal for ""vote jihad"", terming it as necessary in the current situation for the minority community to drive away the BJP government.The incident occurred during an election rally where Maria Alam Khan, while advocating for the INDIA bloc candidate from Farrukhabad Lok Sabha seat, urged for ""vote jihad,"" saying ""in the current situation, 'vote jihad' is necessary for the minority community"".Maria Alam, who also happens to be the niece of Salman Khurshid, said, ""Together do vote jihad -- with intelligence, without being sentimental and with silence. As we can only do vote jihad to drive away this Sanghi government.""She warned against the perceived threat to humanity and urged voters to protect the country's diverse culture and ethos. ""People say that Constitution and democracy are under threat. But I say that insaniyat (humanity) is under threat.""""Now there is an attack on 'insaniyat'. If you want to save the country, its beauty and 'ganga-jamuni' (composite) culture, then vote very intelligently without getting influenced by anyone,"" she stressed.Salman Khurshid, who attended the meeting as the chief guest, defended the use of the term 'jihad,' interpreting it as a metaphorical struggle against adverse circumstances.He refrained from endorsing such language but justified its intent to safeguard constitutional values. ""Jihad means to fight against a situation. Her intention must have been to carry out vote jihad to protect the Constitution,"" he said.The video of Maria Alam's statement went viral on social media, prompting public outcry and legal action.On his candidature from INDIA bloc from the Farrukhabad seat, Khurshid said he was offered Congress ticket from Aligarh from the Congress. But he politely declined clearly saying that ""I am Salman Khurshid from Farrukhabad and I stay that only"".This was the first public meeting of the INDIA bloc in Farrukhabad with most of the senior leaders of the Congress and the SP present together on the dias.(With inputs from agencies)","FIR has been lodged against senior Congress leader Salman Khurshid and Samajwadi Party (SP) leader Maria Alam Khan. The incident occurred during an election rally in Farrukhabad, Haryana. The video of Maria Alam's statement went viral on social media, prompting public outcry and legal action.","https://static.toiimg.com/thumb/msid-109732322,imgsize-825000,width-400,resizemode-4/109732322.jpg"
Some people want to have PM in instalments; they have decided to have a PM each year: PM Modi,https://timesofindia.indiatimes.com/india/some-people-want-to-have-pm-in-instalments-they-have-decided-to-have-a-pm-each-year-pm-modi-at-rally-in-latur-maharashtra/articleshow/109724710.cms,"'

Fake videos

being sold in

mohabbat ki dukaan

'

mohabbat ki dukaan

NEW DELHI: PM Narendra Modi on Tuesday took a jibe at the opposition INDIA bloc which is yet to announce its prime ministerial face for the upcoming Lok Sabha elections .""The people who want to make a Prime Minister in instalments, can they achieve big targets? They have decided to make a different Prime Minister every year"", he said at a rally in Latur, Maharashtra.""Those who want to see India in parts are trying to distribute the post of Prime Minister also in parts. Their plan of five Prime Ministers in five years means, looting the country turn by turn,"" he added.Questioning the security situation under Congress regime, PM Modi said, ""Before 2014 there would be announcements warning of unattended objects... In the whole country, 24 hours a day, such warnings were issued in important places.""""Where did these unattended objects disappear after Modi became Prime Minister?"", he said rhetorically.Addressing a rally in Dharashiv district of Maharashtra earlier today, PM Modi slammed Congress for spreading fake videos on social media.""Now their condition is such that as their lies aren't working, they are using my face and with the help of artificial intelligence, selling fake videos in their"", he said.""Opponents are using artificial intelligence to distort quotes of leaders like me,"" he added.This came after Amit Shah too slammed Congress leader for forwarding doctored videos of him on social media.","PM Narendra Modi took a jibe at the opposition INDIA bloc which is yet to announce its prime ministerial face for the upcoming Lok Sabha elections. ""Those who want to see India in parts are trying to distribute the post of Prime Minister also in parts,"" he said.","https://static.toiimg.com/thumb/msid-109726105,imgsize-661643,width-400,resizemode-4/109726105.jpg"
US report names RAW man involved in alleged plot to take out Pannun,https://timesofindia.indiatimes.com/india/us-report-names-raw-man-involved-in-alleged-plot-to-take-out-pannun/articleshow/109708372.cms,"US Pannun plot probe involves CIA, FBI, others

A report in Washington Post, a US newspaper, has claimed that a Research and Analysis Wing officer, Vikram Yadav , instructed a hired hit team to kill US-based Khalistani separatist Gurpatwant Singh Pannun .According to the report, “US intelligence agencies have assessed that the operation targeting Pannun was approved by the RAW chief at the time, Samant Goel .” It adds that Yadav was transferred back to CRPF after the Pannun plot unravelled last year.There was no response by the Indian govt to the assertions made in the report till late Monday night.US authorities had last year indicted an Indian national, Nikhil Gupta, for the plot, alleging that he was acting at the behest of an Indian official they referred to in the indictment as CC-1.Gupta is currently in a jail in Prague, where he was detained last year by Czech and US agencies. While India had formed a high-level committee in Nov to probe the information shared by the US about the role of the Indian official, saying it had a bearing on India’s security too, the govt has so far not revealed any of its findings.RAW officer Vikram Yadav, who was on deputation from CRPF, allegedly forwarded details of Gurpatwant Singh Pannun, including his address in New York, said a Washington Post report, citing sources and a US indictment. The official is now back with the central paramilitary force.Given his background, Yadav “lacked training and skills” needed for an operation that meant going up against sophisticated US counter-intelligence capabilities, the Post said. According to the report, senior officials at the US justice department and FBI had pushed to prosecute Yadav, a step that would have implicated RAW in a murder-for-hire conspiracy. “But while a US indictment unsealed in November contained the bombshell allegation that the plot was directed by an Indian official, it referred to Yadav as only an unnamed co-conspirator, CC-1, and made no mention of the Indian spy agency,” it said.“Higher-ranking RAW officials have also been implicated, according to current and former Western security officials, as part of a sprawling investigation by the CIA, FBI and other agencies that has mapped potential links to Modi’s inner circle,” the report said.","US authorities had last year indicted an Indian national, Nikhil Gupta, for the plot, alleging that he was acting at the behest of an Indian official. Yadav was transferred back to CRPF after the Pannun plot unravelled last year.","https://static.toiimg.com/thumb/msid-109708373,imgsize-817453,width-400,resizemode-4/109708373.jpg"
Excise policy case: Delhi court dismisses bail pleas of AAP leader Manish Sisodia,https://timesofindia.indiatimes.com/india/excise-policy-case-delhi-court-dismisses-bail-pleas-of-aap-leader-manish-sisodia/articleshow/109728428.cms,"(With inputs from agencies)

NEW DELHI: Delhi Rouse Avenue court on Tuesday dismissed the bail applications of AAP leader Manish Sisodia in money laundering cases lodged by the Central Bureau of Investigation (CBI)and the Enforcement Directorate (ED) in the alleged liquor policy case.Special judge Kaveri Baweja , who presides over cases for the Central Bureau of Investigation CBI and the Enforcement Directorate ED, refused to grant bail, saying the stage was not right to grant the bail.The former Delhi deputy chief minister will file an appeal in the high court against the city court's order, that denied him bail in the case related to the excise policy scam, as stated by AAP.The party mentioned in a statement that Sisodia's request for bail was turned down by the Rouse Avenue Court.Sisodia was arrested by the CBI on February 26, 2023, for his purported involvement in the scam and the ED arrested him in a money-laundering case stemming from the CBI's FIR on March 9, 2023.Following his arrest, Sisodia resigned from the Delhi cabinet on February 28, 2023.","Sisodia was arrested by the CBI on February 26, 2023, for his purported involvement in the scam. The former Delhi deputy chief minister will file an appeal in the high court against the city court's order, that denied him bail.","https://static.toiimg.com/thumb/msid-109728682,imgsize-665222,width-400,resizemode-4/109728682.jpg"
Calcutta high court sets aside Ganguly order in Suvendu kin case,https://timesofindia.indiatimes.com/india/calcutta-high-court-sets-aside-ganguly-order-in-suvendu-kin-case/articleshow/109704292.cms,"KOLKATA: Calcutta high court on Monday set aside an order by former judge Abhijit Ganguly that fined Egra sub-divisional police officer Rs 5 lakh for allegedly “harassing” Krishnendu Adhikari , the elder brother of BJP’s Suvendu Adhikari, Bengal’s leader of opposition.Ganguly joined BJP in March. He is the party candidate in Tamluk, one of the LS constituencies in East Midnapore, the Adhikaris’ home district.A division bench of Chief Justice TS Sivagnanam and Justice Hiranmay Bhattacharyya held that Ganguly’s order was passed without giving the state “appropriate opportunity” to present its case.The bench observed that such a situation was “uncalled for”.The bench directed the registry to list Krishnendu’s petition in an appropriate court to be heard “afresh” in June and stayed a notice sent to him by cops.Egra cops had sent the notice asking Krishnendu to attend a questioning session as a “witness” in a case over poor lighting on the Mecheda-Digha Bypass in East Midnapore. Krishnendu moved the former HC judge’s court in Nov 2023, praying for quashing the notice as the cops went beyond their remit and asked him to attend the session with 10 years’ income-tax returns.Ganguly admitted Krishnendu’s petition and passed an order the same day imposing Rs 5 lakh as cost on the Egra SDPO for “harassment”. “This is nothing but harassment. The police force was not created to harass a citizen,” the former judge had observed.On Monday, state advocate-general Kishore Datta moved an appeal. “No submission was made by the lawyer. Nothing was recorded in the order. The order was passed the day the petition reached the court,” Datta contended.Datta, pointing to the “chequered history” of the case, also referred to orders of a number of single-judge benches of HC. The CJ-led division bench did not go into the merits of the case but set aside the order saying the state was not heard. “Contesting respondents should have the opportunity to file affidavits. Let them file the affidavits,” CJ Sivagnanam observed.","Former judge Abhijit Ganguly fined Egra sub-divisional police officer Rs 5 lakh for allegedly “harassing’ Krishnendu Adhikari. Ganguly joined BJP in March. He is the party candidate in Tamluk, one of the LS constituencies in East Midnapore.","https://static.toiimg.com/thumb/msid-109704314,imgsize-699181,width-400,resizemode-4/109704314.jpg"
