Article Title,Article Link,Article Text,Article Summary,Article Image
"Dubey, Surya, Owaisi among 31 MPs in panel on waqf bill",https://timesofindia.indiatimes.com/india/dubey-surya-owaisi-among-31-mps-in-panel-on-waqf-bill/articleshow/112413601.cms,"NEW DELHI: A day after the contentious Waqf (Amendment) Bill, 2024 was referred to joint parliamentary committee ( JPC ), a 31-member panel including 21 Lok Sabha MPs and 10 Rajya Sabha MPs was constituted on Friday to look into the legislation.Union parliamentary affairs minister Kiren Rijiju Friday proposed the names of 21 Lok Sabha MPs and 10 Rajya Sabha MPs for the JPC.The 21 MPs from Lok Sabha who will be members of the JPC are Jagdambika Pal, Nishikant Dubey, Tejasvi Surya, Aparajita Sarangi, Sanjay Jaiswal, Dilip Saikia, Abhijit Gangopadhyay, DK Aruna, Gaurav Gogoi, Imran Masood, Mohammad Jawed, Maulana Mohibullah Nadvi, Kalyan Banerjee, A Raja, Lavu Sri Krishna Devarayalu, Dileshwar Kamait, Arvind Sawant , Suresh Gopinath, Naresh Ganpat Mhaske, Arun Bharti and Asaduddin Owaisi.In Rajya Sabha, Kiren Rijiju proposed the names of 10 Rajya Sabha MPs — Brij Lal, Dr Medha Vishram Kulkarni, Gulam Ali, Radha Mohan Das Agrawal, Syed Naseer Hussain, Mohammed Nadeem Ul Haq, V Vijayasai Reddy, M. Mohamed Abdulla, Sanjay Singh and Dharmasthala Veerendra Heggade.Opposition parties including Congress, DMK, NCP, Trinamool Congress and AIMIM have strongly opposed the bill saying its provisions were against federalism and constitutional provisions. While some members demanded the withdrawal of the bill, many suggested that it should be sent to a standing committee.The Waqf (Amendment) Bill, 2024, Waqf Act provides for the renaming of the Waqf Act, 1995, as the Unified Waqf Management, Empowerment, Efficiency and Development Act, 1995.","A 31-member panel including 21 Lok Sabha MPs and 10 Rajya Sabha MPs was constituted on Friday to look into the legislation. Opposition parties including Congress, DMK, NCP, Trinamool Congress and AIMIM strongly opposed the bill saying its provisions were against federalism and constitutional provisions.","https://static.toiimg.com/thumb/msid-112413579,imgsize-46002,width-400,resizemode-4/112413579.jpg"
No alternative plans for political funding: Govt on electoral bonds,https://timesofindia.indiatimes.com/india/no-alternative-plans-for-political-funding-govt-on-electoral-bonds/articleshow/112413413.cms,"The govt on Friday told the Lok Sabha that it had no plans to bring any law regarding electoral bonds for the funding of political parties , while replying to questions on electoral bonds. The govt added it had no plans for an alternative funding proposal to the electoral bonds either, for the political parties.Trinamool Congress MP Mala Roy, in written questions on the contentious electoral bonds, asked “whether the govt has any plan to bring any law regarding electoral bonds for political party funding; if so, the details thereof; and if not, the alternative/substitute being considered for funding of political parties to contest Lok Sabha/Assembly Elections.”Union law and justice minister Arjun Ram Meghwal said, govt does not have any plan to bring in any law regarding the bonds and that “no such proposal is under consideration of the government .”","The govt on Friday told the Lok Sabha that it had no plans to bring any law regarding electoral bonds for the funding of political parties. The govt added it hadno plans for an alternative funding proposal to the electoral bonds either, for thePolitical parties.","https://static.toiimg.com/thumb/msid-112413455,imgsize-101348,width-400,resizemode-4/112413455.jpg"
J&K poll dates to be announced after final security review: CEC,https://timesofindia.indiatimes.com/india/jk-poll-dates-to-be-announced-after-final-security-review-cec/articleshow/112413347.cms,"SRINAGAR: Chief Election Commissioner (CEC) Rajiv Kumar Friday said Election Commission was committed to holding assembly elections in Jammu & Kashmir at the earliest, but the suspense over poll dates continued as he underscored that the timeline would be finalised only after a final security assessment in New Delhi.Addressing a presser in Jammu on the concluding day of the EC team’s visit to J&K to assess ground situation for conducting polls, the CEC, flanked by commissioners Gyanesh Kumar and S S Sandhu, asserted that no external or internal forces would be allowed to disrupt the democratic process .Referring to the recent attacks in Jammu, Kumar said: “Our forces are well-equipped to deal with the situation. We will not allow these small attempts to derail the poll process in J&K.”The CEC stressed that the attacks could not be allowed to create a “chicken and egg situation” with regard to polls. Such attacks were likely to see an uptick whenever there were talks of holding polls. If the poll process was halted because of that — hoping to go ahead after an improvement in the situation — it would be like conceding defeat, he added.“The feedback we got from security heads, officers of administration and police chiefs is that though there are a few challenges, they are ready for ensuring peaceful elections,” he said.J&K has been under central rule since June 2018, Elections were due in 2019, but in Aug that year, Centre abrogated Article 370 of the Constitution, stripping J&K of its special status, and bifurcated it into two UTs. In Dec 2023, SC fixed a Sept 30 deadline for the poll panel to hold assembly polls in J&K.",Chief Election Commissioner (CEC) Rajiv Kumar Friday said Election Commission was committed to holding assembly elections in Jammu & Kashmir at the earliest. Kumar underscored that the timeline would be finalised only after a final security assessment in New Delhi. J&K has been under central rule since June 2018.,"https://static.toiimg.com/thumb/msid-112413371,imgsize-25498,width-400,resizemode-4/112413371.jpg"
Congress notice against Pradhan for misleading Rajya Sabha on Preamble,https://timesofindia.indiatimes.com/india/congress-notice-against-pradhan-for-misleading-rajya-sabha-on-preamble/articleshow/112413314.cms,"NEW DELHI: Congress functionary and Rajya Sabha member Jairam Ramesh submitted a notice to initiate privilege proceedings against Union education minister Dharmendra Pradhan , on Thursday, for “misleading” the House regarding the removal of the Preamble to the Constitution from NCERT textbooks for classes III and VI students.In his letter to Rajya Sabha Chairman Jagdeep Dhankhar, Ramesh said that on August 7, 2024, leader of the opposition Mallikarjun Kharge raised the issue of ommission of the Preamble.Pradhan responded by stating that “recently also the new books of Class VI have the Preamble.”However, Ramesh asserted that Pradhan’s statement was factually incorrect and misleading . He even provided copies of textbooks for classes III and VI, published in November and December 2022, which included the Preamble. In contrast, textbooks for the same classes, published in June 2024, had the Preamble omitted. Ramesh said omission of the Preamble is a serious affront to the idea of raising awareness about the spirit of the Constitution.","Congress functionary and Rajya Sabha member Jairam Ramesh submitted a notice to initiate privilege proceedings against Union education minister Dharmendra Pradhan. He said that on August 7, 2024, leader of the opposition Mallikarjun Kharge raised the issue of ommission of the Preamble.","https://static.toiimg.com/thumb/msid-112413297,imgsize-33978,width-400,resizemode-4/112413297.jpg"
2nd phase of PMAY approved by Cabinet,https://timesofindia.indiatimes.com/india/2nd-phase-of-pmay-approved-by-cabinet/articleshow/112413063.cms,"Cabinet on Friday approved the second phase of the PM Awas Yojna (PMAY) in rural and urban areas to provide financial assistance for 3 crore houses for the poor living in villages, cities and towns.The central govt will provide nearly Rs 5.4 lakh crore assistance to the poor and middle income category in the next five years.",The central govt will provide nearly Rs 5.4 lakh crore assistance to the poor and middle income category in the next five years. Cabinet on Friday approved the second phase of the PM Awas Yojna (PMAY) in rural and urban areas.,"https://static.toiimg.com/thumb/msid-47529300,imgsize-110164,width-400,resizemode-4/47529300.jpg"
Rs 1.8k crore plan to boost horticulture gets nod,https://timesofindia.indiatimes.com/india/rs-1-8k-crore-plan-to-boost-horticulture-gets-nod/articleshow/112412910.cms,"The Cabinet on Friday approved the Clean Plant Programme , providing access to virus-free and high-quality planting materials to farmers, with an investment of over Rs 1,765 crore. The initiative will lead to increased crop yields and improved income opportunities. The move will also ensure that consumers benefit from superior produce that is free from viruses, enhancing the taste, appearance, and nutritional value of fruits.It is expected to further increase the export potential of horticulture produce.","The initiative will lead to increased crop yields and improved income opportunities. The move will also ensure that consumers benefit from superior produce that is free from viruses, enhancing the taste, appearance, and nutritional value of fruits. It is expected to further increase the export potential of horticulture produce.","https://static.toiimg.com/thumb/msid-112412946,imgsize-26106,width-400,resizemode-4/112412946.jpg"
Make ‘Har Ghar Tiranga’ mass movement: PM,https://timesofindia.indiatimes.com/india/make-har-ghar-tiranga-mass-movement-pm/articleshow/112412875.cms,"Prime Minister Narendra Modi on Friday urged people to make the “Har Ghar Tiranga” campaign a memorable mass movement even as he changed his profile picture on social media to the tricolour ahead of Independence Day. “As this year’s Independence Day approaches, let’s again make #HarGharTiranga a memorable mass movement. I am changing my profile picture and I urge you all to join me in celebrating our Tricolour by doing the same.And yes, do share your selfies on harghartiranga.com,” the Prime Minister said in a post on X.Home minister Amit Shah also asked people to actively disseminate the message of independence across the country as part of the ‘ Har Ghar Tiranga ’ campaign. “PM @narendramodi Ji’s call, I’m changing my profile picture and appealing to everyone to do the same and participate in disseminating message of independence to every nook and corner of the nation . Also, please remember to upload your selfies on harghartiranga.com,” Shah wrote on X.",Prime Minister Narendra Modi changed his profile picture on social media to the tricolour ahead of Independence Day. Home minister Amit Shah also asked people to actively disseminate the message of independence across the country as part of the ‘ Har Ghar Tiranga ’ campaign.,"https://static.toiimg.com/thumb/msid-112412852,imgsize-52358,width-400,resizemode-4/112412852.jpg"
Cabinet clears 8 rail projects in 7 states worth Rs 24.6k crore,https://timesofindia.indiatimes.com/india/cabinet-clears-8-rail-projects-in-7-states-worth-rs-24-6k-crore/articleshow/112412750.cms,"NEW DELHI: Cabinet committee on economic affairs Friday approved eight new rail line projects across seven states, including Odisha, Maharashtra, Jharkhand, Bihar and Andhra, with an estimated cost of Rs 24,657 crore to provide connectivity, facilitate ease of travelling, minimise logistical costs , reduce oil imports and cut carbon footprint . One of the projects will provide rail connectivity to Ajanta Caves, a Unesco World Heritage site and is expected to boost tourism .Railway minister Ashwini Vaishnaw said the projects will improve logistical efficiency by connecting unconnected areas and enhancing transportation networks, resulting in streamlined supply chains and accelerated economic growth . The projects will be completed by 2030-31. Four of the approved projects fall only in Odisha.The projects will cover 14 districts in Odisha, Maharashtra, Andhra Pradesh, Jharkhand, Bihar, Telangana and Bengal, and will increase existing network of Indian Railways by 900 km. “A total of 64 new stations will be constructed, providing enhanced connectivity to six districts of East Singhbum, Bhadadri, Kothagudem, Malkangiri, Kalahandi, Nabarangpur and Rayagada, approximately 510 villages and about 40 lakh population,” the govt stated.The projects will cover essential routes for transportation of commodities such as agriculture products, fertiliser, coal, iron ore, steel, cement, bauxite, limestone, aluminium powder, granite, ballast and containers.Vaishnaw said after the completion of the projects, railways will get additional freight traffic of more than 140 million tonne per year. Over 767 crore kg of CO2 savings will take place as mineral loading switches over to railways from existing systems.The minister said a new rail corridor parallel to the eastern coast, which was initially proposed under Dedicated Freight Corridor, will cover Warangal, Bhadrachalam, Titagarh, Sambalpur, Jharsuguda, Rourkela, Tata & Asansol. This corridor will cover seven states of the East.“Tribal areas of Odisha will benefit majorly through the projects,” Vaishnaw said.","The projects will cover 14 districts in Odisha, Maharashtra, Andhra Pradesh, Jharkhand, Bihar, Telangana and Bengal. One of the projects will provide rail connectivity to Ajanta Caves, a Unesco World Heritage site. The projects will be completed by 2030-31.","https://static.toiimg.com/thumb/msid-112412754,imgsize-18190,width-400,resizemode-4/112412754.jpg"
"Intimidation case against Puja’s father, mom’s arms licence revoked",https://timesofindia.indiatimes.com/india/intimidation-case-against-pujas-father-moms-arms-licence-revoked/articleshow/112412737.cms,"The Bund Garden police registered a case of obstructing public servants , intentional insult and criminal intimidation against probationary IAS officer Puja Khedkar ’s father, Dilip Khedkar, based on a complaint lodged by a tehsildar at the Pune district collector’s office. Dilip Khedkar retired in 2023 as a regional officer with MPCB.On June 12 and 13, he accompanied Puja to the collector’s office and resorted to “objectionable conduct” with staffers for not arranging her a cabin after she was appointed an assistant collector on June 3.Though TOI tried to contact Dilip Khedkar, his phone was found switched off while text messages remained unanswered till the time of going to press.Meanwhile, the city police revoked the firearm licence issued to Puja’s mother, Manorama Khedkar, top cop Amitesh Kumar said.","Dilip Khedkar retired in 2023 as a regional officer with MPCB. On June 12 and 13, he accompanied Puja to the collector’s office and resorted to ‘objectionable conduct’ with staffers for not arranging her a cabin.","https://static.toiimg.com/thumb/msid-112412740,imgsize-1846543,width-400,resizemode-4/112412740.jpg"
Attack on minorities in Bangladesh intolerable: RSS; VHP team meets Shah,https://timesofindia.indiatimes.com/india/attack-on-minorities-in-bdesh-intolerable-rss-vhp-team-meets-shah/articleshow/112412416.cms,"NEW DELHI/NAGPUR: RSS on Friday expressed “serious concern” over the unrest in Bangladesh and said attacks on minority communities were “intolerable”. It called on the interim govt in Bangladesh to take swift and decisive action to stop violence against Hindus and said it must make arrangements to protect the lives, property and honour of victims.Meanwhile, top Vishva Hindu Parishad ( VHP ) functionaries met home minister Amit Shah and urged him to take “immediate indispensable action” for the safety of Hindus and other minority communities in Bangladesh.“RSS expresses serious concern over the incidents of violence against Hindus, Buddhists and other minority communities in Bangladesh during the movement for regime change in the last few days,” RSS general secretary Dattatreya Hosabale said in a statement.“Cruelty like targeted killings, looting, arson and heinous crimes against women belonging to Hindu and other religious minorities and attacks on Hindu mandirs in Bangladesh are intolerable. RSS strongly condemns this,” he added.“We request the world community and all political parties in Bharat to stand in solidarity with persecuted communities like Hindu, Buddhist etc in this critical time. As a friendly neighbour, the govt of Bharat is trying to play an able role in this situation in Bangladesh. RSS urges the govt to make every effort to ensure the safety of Hindus, Buddhists etc in Bangladesh,” Hosabale said.",RSS calls on interim govt in Bangladesh to take swift and decisive action to stop violence against Hindus. Top Vishva Hindu Parishad functionaries met home minister Amit Shah and urged him to take “immediate indispensable action” for the safety of Hindus and other minority communities in Bangladesh.,"https://static.toiimg.com/thumb/msid-112412415,imgsize-54698,width-400,resizemode-4/112412415.jpg"
Ensure no one enters NE from Bangladesh: Aasu,https://timesofindia.indiatimes.com/india/ensure-no-one-enters-ne-from-bangladesh-aasu/articleshow/112412403.cms,"All Assam Students’ Union ( Aasu ) advisor Samujjal Bhattacharjya on Friday requested the Centre to ensure that no person enters India illegally from Bangladesh and that no one is granted asylum or rehabilitated in the North-East .“We are concerned about the situation in Bangladesh, given that four states in the North-East share a 1,885-km border with the neighboring country.We want to ensure that the identity of the indigenous population is not further threatened,” Bhattacharjya told reporters.The North-East Students’ Organisation (NESO) has written to Prime Minister Narendra Modi and Union home minister Amit Shah expressing concern as the region has borne the brunt of illegal infiltration from across the border in the past.","All Assam Students’ Union ( Aasu ) advisor Samujjal Bhattacharjya on Friday requested the Centre to ensure that no person enters India illegally from Bangladesh. Four states in the North-East share a 1,885-km border with the neighboring country.","https://static.toiimg.com/thumb/msid-112412401,imgsize-53514,width-400,resizemode-4/112412401.jpg"
"Will give blood again but won’t leave country, say Bangladesh Hindus",https://timesofindia.indiatimes.com/india/will-give-blood-again-but-wont-leave-country-say-bangladesh-hindus/articleshow/112412402.cms,"DHAKA: Hundreds of Bangladeshi Hindus protested in Dhaka on Friday against violence targeted at the community since Sheikh Hasina quit as prime minister and fled the country on Aug 5.Asserting that the country “belongs to all”, the protesters, who had gathered from various parts of the country, demanded measures for the safety and security of the community.“This country does not belong to anyone’s father. We have given blood. If necessary, we will give blood again. We won’t leave Bangladesh,” they chanted. They also expressed their displeasure with “civil society” members for remaining mute spectators while Hindus faced violence. Kanu Kumar, who participated in the rally, said the community wanted security of their homes and religious establishments.The protesters demanded a ministry for minority communities and a minority protection commission, apart from formulating and implementing strict laws to prevent attacks against minorities.They also sought reservation of 10% of seats in Parliament for minorities.The Bangladesh Hindu Buddhist Christian Oikya Parishad on Friday reported 205 incidents of persecution of members of minority communities across 52 of the country’s 64 districts since Sheikh Hasina’s ouster. The organisation, in an open letter to interim leader Nobel laureate Muhammad Yunus , said “there is deep apprehension, anxiety and uncertainty among minorities across the country”.",Hundreds of Bangladeshi Hindus protested in Dhaka on Friday against violence targeted at the community since Sheikh Hasina quit as prime minister and fled the country on Aug 5. The protesters demanded a ministry for minority communities and a minority protection commission. They also sought reservation of 10% of seats in Parliament for minorities.,"https://static.toiimg.com/thumb/msid-112412385,imgsize-18882,width-400,resizemode-4/112412385.jpg"
Extend cutoff date of CAA: East Pakistan refugees’ group,https://timesofindia.indiatimes.com/india/extend-cutoff-date-of-caa-east-pakistan-refugees-group/articleshow/112412373.cms,"NAGPUR: An association of refugees from erstwhile East Pakistan, now Bangladesh, have appealed to PM Narendra Modi to extend the Citizenship Amendment Act (CAA) cut-off date from December 31, 2014, till 2024.The memorandum was sent to the Prime Minister’s Office (PMO) in light of the Bangladesh crisis . The organisation, Nikhil Bharat Bangali Samanwaya Samiti , hoped that extending the date would help Hindus escape persecution in Bangladesh.Samiti’s chief Subhodh Biswas said, currently CAA provides a faster procedure for obtaining citizenship for those who arrived in India before December 31, 2014. Given the current crisis in Bangladesh, minorities are seeking to enter India for safety. In such circumstances, govt should simplify citizenship norms and eliminate requirements for submitting documents and extend the date. A simple affidavit should suffice, he said.","Nikhil Bharat Bangali Samanwaya Samiti hoped that extending the date would help Hindus escape persecution in Bangladesh. Samiti’s chief Subhodh Biswas said, currently CAA provides a faster procedure for obtaining citizenship for those who arrived in India before December 31, 2014.","https://static.toiimg.com/thumb/msid-112412379,imgsize-98976,width-400,resizemode-4/112412379.jpg"
"BJP slams Cong: ‘Vocal about Gaza, mum on Bangladesh Hindus’",https://timesofindia.indiatimes.com/india/bjp-slams-cong-vocal-about-gaza-mum-on-bangladesh-hindus/articleshow/112412343.cms,"NEW DELHI: BJP on Friday targeted Congress for avoiding mention of attacks on Hindus in Bangladesh saying that the evasion contrasts starkly with the lengthy statements Rahul Gandhi and Priyanka Gandhi Vadra had issued on Gaza .“Congress and Rahul Gandhi are concerned about Gaza. But their lips are sealed when it comes to speaking about the atrocities against Hindus in Bangladesh.What is this compulsion after all?” former Union minister Anurag Thakur said in Lok Sabha triggering protests from Congress benches.Raising the matter during Zero Hour, Thakur emphasised that in his congratulatory message to Muhammad Yunus, PM Modi had specifically spoken of the need to ensure the safety of Hindus and other religious minorities while both leader of opposition Rahul Gandhi and Congress chief Mallikarjun Kharge avoided any such mention.Congress general secretary Priyanka Gandhi had recently written on X about the siuation in Gaza following Israel’s retaliation to the October 7 terror attack by Hamas. “It is no longer enough to speak up for the civilians and thousands of innocent children who are being wiped out day after day by the horrific genocide taking place in Gaza. It is the moral responsibility of every govt in the world to condemn the Israeli govt’s genocidal actions and force them to stop. Their actions are unacceptable in a world that professes civility and morality,” she had posted.Sharing Priyanka’s post, BJP spokesperson Shehzad Poonawala also attacked Rahul and his sister for “hypocrisy of Congress”.","Former Union minister Anurag Thakur said in Lok Sabha triggering protests from Congress benches. He emphasised that in his congratulatory message to Muhammad Yunus, PM Modi had specifically spoken of the need to ensure the safety of Hindus and other religious minorities.","https://static.toiimg.com/thumb/msid-112412376,imgsize-16090,width-400,resizemode-4/112412376.jpg"
