Article Title,Article Link,Article Text,Article Summary,Article Image
Relief for Bengal govt: SC stays Calcutta HC order directing CBI probe in teacher recruitment scam,https://timesofindia.indiatimes.com/india/sc-refuses-to-stay-calcutta-high-courts-order-invalidating-appointment-of-over-25k-teachers-west-bengal-teacher-recruitment-scam/articleshow/109693362.cms,"NEW DELHI: The Supreme Court on Monday refused to stay the Calcutta high court's order terminating the appointment of 25,000 teachers recruited ""illegally"" in West Bengal. However, assuaging the state government's fear that the entire cabinet may be arrested over the case, the SC stayed a part of the HC's order that had asked the CBI to probe all officials involved in the recruitment of the teachers.The SC expressed serious concern about agency which conducted the recruitment test, destruction of OMR answer sheets, erasing of software about results and inclusion of people who were not part of the selection panel. ""You have to satisfy us how the high court went wrong,"" the CJI said.SC posted the next hearing for May 6.In an order passed last week, the Calcutta high court nullified the appointment of all the 25,753 teachers empanelled in 2016 for various categories of jobs at secondary and higher secondary schools in the state.A division bench of Justices Debangsu Basak and Shabbar Rashidi of the high court ordered that the candidates selected will have to return the entire salary drawn by them, along with an annualised interest of 12 per cent, within the next four weeks.Besides directing the West Bengal School Service Commission (WBSSC) to start the recruitment process afresh, it also directed the Central Bureau of Investigation (CBI) to carry on with its investigation into the matter.Taking cognisance of the state cabinet's decision for the creation of super-numeric posts, the Calcutta high court said that the CBI, if necessary, can question the masterminds behind the creation of the seats in excess of the vacant posts. These super-numeric posts, which have remained under the cloud since the beginning, are perceived to provide room for ineligible candidates recruited illegally.","The Supreme Court on Monday refused to stay the Calcutta high court's order terminating the appointment of 25,000 teachers recruited ""illegally"" in West Bengal. However, the SC stayed a part of the HC's order that had asked the CBI to probe all officials involved in the recruitment.","https://static.toiimg.com/thumb/msid-109693454,imgsize-1666354,width-400,resizemode-4/109693454.jpg"
Over 1k vehicles stranded in HP return to safety,https://timesofindia.indiatimes.com/india/over-1k-vehicles-stranded-in-hp-return-to-safety/articleshow/109742168.cms,"KULLU: Teams of state disaster response force ( SDRF ) and local police safely guided back to Manali over 1,000 vehicles stranded near north portal of Atal Tunnel after heavy snowfall on Monday.Tourists remained stranded for more than six hours.A police officer said that the operation continued till 1am as all vehicles were guided to safety.Eight tourists, who were stranded at Pangmo village in Spiti , were also rescued by a team of police from Lahaul-Spiti.Tourists hailing from Rajasthan and Bilaspur in Himachal Pradesh were taken back to Spiti.","Over 1,000 vehicles stranded near north portal of Atal Tunnel after heavy snowfall on Monday. Eight tourists stranded at Pangmo village in Spiti also rescued by a team of police from Lahaul-Spiti. Tourists hailing from Rajasthan and Bilaspur in Himachal Pradesh were taken back to Spiti.","https://static.toiimg.com/thumb/msid-47529300,imgsize-110164,width-400,resizemode-4/47529300.jpg"
Navy will remain op-ready to deter adversaries: New chief,https://timesofindia.indiatimes.com/india/navy-will-remain-op-ready-to-deter-adversaries-new-chief/articleshow/109741461.cms,"Admiral Dinesh K Tripathi

NEW DELHI: In view of the existing and emerging challenges in the maritime domain , Navy will remain operationally ready at all times to deter adversaries, saidon Tuesday.Taking over as the 26th chief of the 140-warship Navy from Admiral R Hari Kumar, Admiral Tripathi said the maritime force’s primary mandate is to deter potential adversities at sea in peace and “to win the war at sea when asked to do so”.“This will remain my singular focus and endeavour,” he said, emphasising that Indian Navy has evolved into “a combat-ready, cohesive, credible and future-proof force” over the years.“I will strengthen ongoing efforts of Navy towards ‘ atmanirbharta (self-reliance)’, towards new technologies and becoming an important pillar of nation’s development towards our collective quest for ‘Viksit Bharat (developed India)’,” he said.A communication and electronic warfare specialist who was commissioned in July 1985, Admiral Tripathi has experience in naval operations while commanding frontline warships as well as in his earlier stints as Eastern Fleet commander, DGNO and Western Naval Command chief. Significantly, he has also handled the force’s entire modernisation plans as the assistant chief of naval staff (policy and plans) and then as the vice chief since January.",Admiral Dinesh K Tripathi takes over as the 26th chief of the 140-warship Navy. He replaces Admiral R Hari Kumar. Tripathi has experience in naval operations while commanding frontline warships. He has also handled the force’s entire modernisation plans.,"https://static.toiimg.com/thumb/msid-109742124,imgsize-65092,width-400,resizemode-4/109742124.jpg"
"Put your house in order or face consequences, Delhi HC warns Meta",https://timesofindia.indiatimes.com/india/put-your-house-in-order-or-face-consequences-delhi-hc-warns-meta/articleshow/109742083.cms,"NEW DELHI: Delhi high court on Tuesday took a dim view of Meta ’s complaints redressal mechanism and said its functioning was “far worse than a govt department.”It was hearing a plea by a media house against blocking of its Instagram page by Meta, the parent company of Facebook, WhatsApp and Instagram, for alleged copyright violations.“Please be careful.You have to be alive to the situation. Your system is not working. Your officials need to pull up their socks... can’t have people going around in circles. Your grievance officer in India registers a complaint but says ‘can’t take any action’,” an irked bench told advocate Tejas Karia, representing Meta.A Delhi HC bench of acting Chief Justice Manmohan and Justice Manmeet PS Arora warned Meta that it should “put its house in order” or else the court might pass an order castigating it. It also pulled up the tech giant for its insistence that the media house should file a complaint through a proper channel.The media house also challenged the constitutionality of Rule 3(1)(c) of the Information Technology (Intermediary Guidelines and Digital Media Ethics Code) Rules, 2021.Advocate Hrishikesh Barua, representing the media house, highlighted that despite writing to Meta several times and further contacting its grievance redressal officer, the only response he could get was the media house had not “written to the correct channel”.However, Karia informed the bench that the Instagram page was blocked following three copyright complaints and the email response to the media group was not a decision to reject the complaint, but an automatic reply.During the hearing, the court asked the petitioner ’s counsel to register a fresh complaint by filling in the required form that Meta insisted was the proper channel. After a while, Baruah returned to court and said the complaint had been rejected again.An annoyed bench then told Meta’s counsel, “You may be having billions of users but your house is not in order. He (Baruah) is giving you a grievance complaint number, but you say it is not a complaint. You can’t be stubborn with us and say you are not able to understand what we are saying. We have been more than liberal with you.” HC asked Karia to ensure the complaint of the media house was addressed and listed the matter for further hearing on Wednesday.",The Delhi high court took a dim view of Meta ’s complaints redressal mechanism. It said its functioning was “far worse than a govt department’ It was hearing a plea by a media house against blocking of its Instagram page by Meta.,"https://static.toiimg.com/thumb/msid-109742113,imgsize-25254,width-400,resizemode-4/109742113.jpg"
"Now, Indian spices under Aus scanner",https://timesofindia.indiatimes.com/india/now-indian-spices-under-aus-scanner/articleshow/109741588.cms,"NEW DELHI: Australia ’s food safety agency is collecting information on possible contamination of spice mixes sold by Indian companies MDH and Everest to decide if a food recall is required, it said on Tuesday.Earlier this month, Hong Kong had suspended sale of three MDH spice blends and an Everest mix. Singapore , too, ordered a recall of the same Everest mix, flagging high levels of ethylene oxide, which is unfit for human consumption and a cancer risk over long exposure.“We are working with international counterparts to understand the issue and with federal, state and territory food enforcement agencies to determine if further action is required,” Food Standards Australia New Zealand said.","Food safety agency collecting information on possible contamination of spice mixes sold by Indian companies MDH and Everest. Hong Kong had suspended sale of three MDH spice blends and an Everest mix. Singapore, too, ordered a recall of the same Everest mix, flagging high levels of ethylene oxide.","https://static.toiimg.com/thumb/msid-109742088,imgsize-2852045,width-400,resizemode-4/109742088.jpg"
"Labourer’s son cracks NDA, set to join Navy",https://timesofindia.indiatimes.com/india/labourers-son-cracks-nda-set-to-join-navy/articleshow/109741311.cms,"Shubham Narwal , the son of a woman farm labourer , is set to become the first Navy officer from his village in Rajasthan , reports Surendra Singh. The journey to NDA was not easy for Shubham, who lost his father to cancer in 2015. His mother worked as a MGNREGA farm labourer.Highlighting the case of Shubham Narwal, Major General Yash Mor (Retd) said the boy set an example for other poor children who want to clear NDA.“I hail from a village in Jhunjhunu district of Rajasthan. Jhunjhunu is considered the land of soldiers as many youths from this city have joined armed forces. But I will become the first Navy officer from my village,” Shubham told Major General Mor in an interview posted on social media.Shubham, who hasn’t seen a sea in his lifetime, will be headed to the sea and will have to sail against the tide as a Navy officer.","Shubham Narwal is set to become the first Navy officer from his village in Rajasthan. The journey to NDA was not easy for Shubham, who lost his father to cancer in 2015. His mother worked as a MGNREGA farm labourer.","https://static.toiimg.com/thumb/msid-47529300,imgsize-110164,width-400,resizemode-4/47529300.jpg"
Rs 1 crore seized from Mumbai builder’s car,https://timesofindia.indiatimes.com/india/rs-1-crore-seized-from-mumbai-builders-car/articleshow/109740936.cms,"Police confiscated Rs 1.1 crore from developer and investor Vipul Nagda during a nakabandi in Lalbaug on Tuesday. During a routine check, cops, along with Election Commission’s flying squad, stopped a car and found the cash packed into 4 jute bags. Nagda claimed the money was related to his business dealings. The builder and his driver were taken to Bhoiwada police station with the seized cash and EC officers notified the income tax department about the seizure, submitting a receipt for it.","Vipul Nagda claimed the money was related to his business dealings. The builder and his driver were taken to Bhoiwada police station with the seized cash. EC officers notified the income tax department about the seizure, submitting a receipt for it.","https://static.toiimg.com/thumb/msid-109741107,imgsize-19560,width-400,resizemode-4/109741107.jpg"
"327 judge posts in 25 HCs, or 29% of total, are lying vacant",https://timesofindia.indiatimes.com/india/327-judge-posts-in-25-hcs-or-29-of-total-are-lying-vacant/articleshow/109740138.cms,"NEW DELHI: Appointment of judges remains a problem area with five high courts of Allahabad, Punjab and Haryana, Gujarat, Bombay and Calcutta alone having 171 vacancies as on April 1, accounting for over 52% of the total vacancy of 327 posts across the 25 HCs in the country. The total sanctioned strength of judges across all HCs is 1,114, which means 29.4% posts are lying vacant.Large number of vacancies in high courts also means increasing pendency of cases, which has reached almost 62 lakh as on April 30.The total pendency in all courts has crossed 5.1 crore, including 4.5 crore in subordinate and district courts and over 80,000 in Supreme Court.Interestingly, for half of these vacancies, Centre had claimed earlier that no recommendations were made by HC collegiums when the laid down procedure demands initiating proposals well in advance, at least six months before the vacancy arises.Allahabad HC, country’s largest HC, has 69 vacancies against a strength of 160 judges, which means 43% posts are vacant. Gujarat HC has a higher vacancy percentage at 44%, followed by Patna and Rajasthan with 36% each.Punjab & Haryana HC has 30 posts vacant against a sanctioned strength of 85, followed by 26 in Bombay HC where the approved strength is 94. There are 23 vacancies each in Calcutta and Gujarat HCs.In Dec last year, while responding to MPs’ concerns against the large number of vacancies in high courts, Union law minister Arjun Ram Meghwal had pointed to the slow pace of recommendations reaching the Centre.He had said that HC collegiums were not adhering to timeline on initiation of recommendations against vacancies, adding that for 198 vacancies across HCs, collegiums of these HCs had not made any recommendations till then, leading to a huge backlog.According to the memorandum of procedure (MoP) that guides the appointment of judges to the higher judiciary, a proposal for appointment is initiated by the chief justice of the HC concerned in consultation with two senior-most judges of the HC at least six months before a vacancy occurs. “This timeline is often not adhered to by the high courts,” Meghwal had said.Once these HC collegiums recommend candidates for judgeship, the govt seeks Intelligence Bureau’s inputs and refers them to Supreme Court collegium, which finally selects and recommends names to Centre for notification. In cases where the SC collegium has reservations, those are referred back to the HCs for reconsideration.","Allahabad, Punjab and Haryana, Gujarat, Bombay and Calcutta alone have 171 vacancies. Total sanctioned strength of judges across all HCs is 1,114, which means 29.4% posts are lying vacant. Large number of vacancies in high courts also means increasing pendency of cases.","https://static.toiimg.com/thumb/msid-109740105,imgsize-20380,width-400,resizemode-4/109740105.jpg"
President Droupadi Murmu was invited: Temple trust chief trashes Rahul claim,https://timesofindia.indiatimes.com/india/president-droupadi-murmu-was-invited-temple-trust-chief-trashes-rahul-claim/articleshow/109739554.cms,"NEW DELHI: General secretary of Shri Ram Janmabhoomi Teerth Kshetra Trust, Champat Rai on Tuesday rebutted Congress leader Rahul Gandhi ’s allegation that President Droupadi Murmu was not invited to the consecration of Ram Lalla ’s idol at the Ayodhya temple as she is a tribal.Referring to Rahul’s allegation reported in this daily from Gandhinagar, Rai said they are “completely false, baseless and misleading”.“I would like to remind Shri Rahul Gandhi-ji that the great President of India, Honourable Droupadi Murmu-ji and former President Shri Ramnath Kovind ji were both invited on the auspicious occasion of the consecration of the new idol of Ram Lalla in Shri Ram Janmabhoomi temple ,” he said.“On the occasion of pranpratistha at Shri Ram Janmabhoomi Temple, saints, great men belonging to SC , ST and OBC communities, householders and gentlemen who have achieved fame in different spheres of life and made India proud, were invited. The workers serving in the temple participated in the programme,” he added. “Not only this, at the time of pranpratishtha puja, people belonging to scheduled castes, tribes and extremely backward classes got the opportunity to worship in the pavilion of the temple,” Rai said.He said Rahul ’s baseless charge about the event that took place three months ago could create divisions in the society. “These parts of the speech are seriously objectionable for us,” he added.","Congress leader Rahul Gandhi said President Droupadi Murmu was not invited to the consecration of Ram Lalla ’s idol at the Ayodhya temple as she is a tribal. General secretary of Shri Ram Janmabhoomi Teerth Kshetra Trust, Champat Rai said Rahul’s allegation are “completely false, baseless and misleading”","https://static.toiimg.com/thumb/msid-109739532,imgsize-811499,width-400,resizemode-4/109739532.jpg"
Delhi court dismisses Manish Sisodia’s bail plea,https://timesofindia.indiatimes.com/india/delhi-court-dismisses-manish-sisodias-bail-plea/articleshow/109738851.cms,"NEW DELHI: A Delhi court on Tuesday dismissed the second regular bail plea filed by former deputy chief minister Manish Sisodia in the money laundering and corruption cases pertaining to the now scrapped liquor policy of 2021-22.The court of special judge Kaveri Baweja dismissed the bail pleas in the CBI and ED cases stating that the stage was not right for it.The court had reserved the verdict in the applications on April 20. Sisodia is in judicial custody in both the cases.The ED, while opposing the plea, told the court that the liquid policy was framed in such a way that it would have been an evergreen vehicle for generating illegal gains. It alleged that Sisodia was involved in the destruction of evidence. The ED submitted that Sisodia changed his mobile phone the very day Delhi lieutenant governor VK Saxena filed a complaint with CBI about the alleged scam.The CBI, which also opposed the bail plea, told the court that Sisodia was the main architect of the conspiracy. It said the excise policy was for the benefit of the south group.The agency also told the court that there were intentional tactics on Sisodia’s part to delay the trial.",The court of special judge Kaveri Baweja dismissed the bail pleas in the CBI and ED cases. The court had reserved the verdict in the applications on April 20. Sisodia is in judicial custody in both the cases.,"https://static.toiimg.com/thumb/msid-109738858,imgsize-1499572,width-400,resizemode-4/109738858.jpg"
"BJP won’t tolerate insult to ‘nari shakti’, says Shah, targets Congress",https://timesofindia.indiatimes.com/india/bjp-wont-tolerate-insult-to-nari-shakti-says-shah-targets-congress/articleshow/109738834.cms,"GUWAHATI/NEW DELHI: Home minister Amit Shah on Tuesday condemned the alleged sexual abuse of women involving JD(S) MP Prajwal Revanna and said BJP would not tolerate any insult or abuse of women.Addressing a press conference in Guwahati, Shah said, “The issue regarding Revanna that has been reported in the media is very hurtful and cannot be tolerated in any way.BJP’s stand is very clear, we will not tolerate any insult to matri aur nari shakti .”Targeting the Congress govt in Karnataka , he said, “Congress has been alleging that an NDA partner’s candidate is involved in the incident, but I just want to ask a small question — whose govt is there in that state? Congress is in power in Karnataka, and this matter must have come to their attention. Why has it not taken any action on it so far? We cannot take any action as law and order is a state issue.”Speaking to reporters in New Delhi, Union minister Rajeev Chandrasekhar said BJP had “zero tolerance” for crimes against women and hailed the JD(S) leadership for suspending Prajwal.“Many questions arise on this incident. If the Karnataka govt had this evidence with them for so many months, why were they not doing anything? Why is Congress demonstrating double standards when it comes to crimes against women? Why is Sandeshkhali not an issue to be condemned? Why is that Congress selectively and politically chooses crimes and criminals to either support or condemn?” he asked.Chandrasekhar said BJP “will push for the full might of law against the accused”.Why Congree has not taken any action on the case so far? We can’t take any action as law and order is a state issue, said Shah",Home minister Amit Shah condemned the alleged sexual abuse of women involving JD(S) MP Prajwal Revanna. Shah said BJP would not tolerate any insult or abuse ofWomen. Union minister Rajeev Chandrasekhar said BJP had “zero tolerance” for crimes against women.,"https://static.toiimg.com/thumb/msid-109738831,imgsize-22056,width-400,resizemode-4/109738831.jpg"
"Why arrest Kejriwal right before Lok Sabha polls, SC asks ED",https://timesofindia.indiatimes.com/india/why-arrest-kejriwal-right-before-lok-sabha-polls-sc-asks-ed/articleshow/109738814.cms,"The five questions put to the ED by the bench are:

“Without initiating adjudicatory proceedings (attachment action), can you initiate criminal proceedings?” The court noted that there were no attachment proceedings in the case so far.

“As far as the judgment in Manish Sisodia case is concerned, there are findings in his favour and against him also. Tell us which side this case (Kejriwal’s) lies.”

“How is Section 19 of PMLA to be interpreted, as he (Kejriwal) is coming against his arrest...instead of applying for bail, because he will have to face the higher threshold under Section 45 of PMLA if he takes the latter course? So how do we interpret it? Do we make the threshold much higher and ensure the standard is same to find the person who is guilty?”

CM arrested 18 months after case was filed, says counsel

NEW DELHI: Supreme Court on Tuesday said Enforcement Directorate would have to give an explanation on the timing of Delhi CM Arvind Kejriwal’s arrest, which was carried out just before general elections , and observed that the gap between initiation of proceedings in the alleged Delhi excise scam case and his arrest was “bothering” the court.At the conclusion of Kejriwal’s submission by senior advocate Abhishek Manu Singhvi, a bench of Justices Sanjiv Khanna and Dipankar Datta asked additional solicitor general S V Raju to be ready with answers on Friday to five questions it raised on the basis of Singhvi’s arguments, including on the timing of arrest and the time-gap in proceedings against the CM.What is bothering us is the time gap between the initiation of proceedings and repeated complaints being filed after some time. If you see Section 8, there is a limit of 365 days. Other option is to not arrest... life and liberty are exceedingly important.”“Why was the arrest made right before Lok Sabha polls?”The agency will respond to the court’s queries on Friday. Singhvi, appearing for the CM, concluded his submission and contended that Kejriwal was arrested 18 months after the case was filed and that too on the basis of “hearsay evidence”. He gave a detailed timeline on how relief was granted to accused-turned-approvers soon after they named Kejriwal and were “forced by the agency to make statements against him”.In his affidavit, the CM has accused ED of working on behalf of the Centre to crush its political opponents ahead of general elections and said his arrest was “illegal, arbitrary and an unprecedented assault on the tenets of democracy based on free and fair elections and federalism”.“It is very sad and some kind of farce is going on. The agency is relying upon the statement of co-accused who were made to give statements prior to grant of pardon,” Singhvi said while referring to statements of Magunta Srinivasulu Reddy on the basis of which the chief minister was arrested.He said Reddy gave the statement five months after his son Raghav Reddy was arrested, and once the latter turned approver, ED on the very next day did not object to his bail plea.“The mode, manner and timing of the arrest of the petitioner just before Lok Sabha elections speaks volumes about the arbitrariness of the ED. This timeline establishes the fact that the petitioner has been arrested intentionally with a malafide intent without any necessity to arrest,” Kejriwal said in his affidavit.",Justices Sanjiv Khanna and Dipankar Datta asked ED to be ready with answers on Friday. The court noted that there were no attachment proceedings in the case so far. “Why was the arrest made right before Lok Sabha polls?” the court asked.,"https://static.toiimg.com/thumb/msid-109738829,imgsize-930331,width-400,resizemode-4/109738829.jpg"
