Article Title,Article Link,Article Text,Article Summary,Article Image
GST on grants: Taxing blow to research?,https://timesofindia.indiatimes.com/india/gst-on-grants-taxing-blow-to-research/articleshow/113177449.cms,"It’s tax terrorism say academicians and could derail projects and curtail innovation

There’s a storm brewing in India’s academic circles , and it’s not about a new discovery or theory, but an unexpected tax on research grants .Seven Indian institutions – including the govt-run IIT Delhi, and Anna University in Chennai – recently got showcause notices from the directorate general of GST intelligence (DGGI) for unpaid taxes on research grants they received since 2017.While IIT Delhi faces a demand for ₹120 crore, including penalties over the past seven years, other universities have been asked to pay between ₹5 crore and ₹60 crore.“Tax terrorism” is what entrepreneur and Infosys co-founder T V Mohandas Pai called it on social media handle X, tagging GST India and PM Modi. While the DGGI says research and develop ment grants received by educational institutions are not exempt from tax, many academicians, scientists, and funding agencies disagree. They say grants, especially for educational institutions, are difficult to secure, and tax relief on these funds is a common practice in several countries.“GST on research grants will reduce money allocated for research. So, the govt must remove GST,” says Infosys co-founder Kris Gopalakrishnan, a strong advocate for education, who funds research projects in institutions such as IIT and Indian Institute of Science (IISc). Experts say research is inherently a risky endeavour. Without the burden of taxes, institutions are more likely to invest in innovative and potentially high-risk projects that could lead to significant breakthroughs. “Some large and reputable research studies go on for several years.The Framingham Heart Study, for instance, is a long-term, ongoing cardiovascular co hort study of residents of Massachusetts that began in 1948,” says orthopaedic surgeon Dr George Thomas, former editor of the Journal of Indian Medical Ethics. “The National Institutes of Health invested USD 14 million in the Lower Extremities Assessment Project (LEAP), a comprehensive research initiative des igned to evaluate and improve outcomes in patients with severe injuries of the legs. Without large investments, breakthrough research is difficult. Taxing research grants reduces the already low investments.”Researchers also say funds for research have remained the same for years, though the scope of research has expanded. “It has not kept pace with inflation ,” says scientist Ashok Jhunjhunwala, who has chaired govt committees and boards of institutions such as IIT. He says GST on research could be covered by the grantee. “When researchers receive grant money from the ministry, the govt should pay the GST. Researchers would welcome it because they currently pay GST on equipment or components bought with grant funds. If grants were given with GST already paid, they could offset the GST costs they currently bear,” he says.Research grants are fully itemised with amounts allocated for equipment, components, travel, salaries and overheads. “Where is the GST money supposed to come from within this? Placing a GST demand on research institutions is just harassment.” While several universities are gearing up for litigation against the demand, legal experts say Centre should reconsider this issue before it reaches the courts.“GST is levied on the supply of goods and services,” says advocate K Vaitheeswaran, an expert on taxes and head of the taxation committee of the Madras Chamber of Commerce and I ndustry. “For example, at a shop there is a tax on sold goods. GST is on the supply of goods or services for consideration. When a university receives a research grant, there is no quid pro quo to provide any goods or services. A grant is not a consideration; it is akin to a donation.”Legal experts say there is no certainty in research outcomes, which may or may not result in saleable goods or services, and so, research grants and donations received from govt or private agencies should not be taxed based on anticipated outcomes but on monetised results. “When income tax provides an accelerated tax shield for research institutions notified under section 35(1)(ii), GST too should extend the same reasoning and logic for research grants,” they say.Academicians hope this issue will be discussed at the GST council meeting on Sept 9, chaired by Union finance minister Nirmala Sitharaman. “Research grants to universities must be considered a subsidy as funds are used solely for delivering public good without any profit motive, making it a quasi-government endeavour by the university,” says an academician. Pai recommends setting up an expert co mmittee within GST India like the one at the Institute of Chartered Accountants of India.“Questions should be referred to this committee, position paper prepared, put out for publ ic comments and after that issued as the official view,” says the public policy advocate. “This will ensure uniform policy throughout the industry and eliminate arbitrary action by GST officers which harm the country and business as well as reduce tax terrorism. Officials must raise contestable questions and debate it out before they issue such notices. Tax on resear ch grants given to universities can have a chilling effect on research outputs. I hope it’s axed.”","Seven Indian institutions – including the govt-run IIT Delhi, and Anna University in Chennai – recently got showcause notices from the directorate general of GST intelligence (DGGI) for unpaid taxes on research grants they received since 2017. While the DGGI says research and develop ment grants received by educational institutions are not exempt from tax, many academicians, scientists, and funding agencies disagree.","https://static.toiimg.com/thumb/msid-113177448,imgsize-576546,width-400,resizemode-4/113177448.jpg"
CBI arrests CGST official seeking Rs 60L bribe after dramatic chase,https://timesofindia.indiatimes.com/india/cbi-arrests-cgst-official-seeking-rs-60l-bribe-after-dramatic-chase/articleshow/113177341.cms,"CGST officials coerced bizman into arranging Rs 30L for release

MUMBAI: A central GST (CGST) superintendent, accused of detaining a businessman for 18 hours and demanding a bribe of Rs 60 lakh, was nabbed by CBI last week after a dramatic chase in the middle of the night near Oshiwara police station.In his bid to escape, the official, Sachin Gokulka, dumped one of his aides - a consultant who had allegedly accepted the bribe on his behalf - on the road but was soon caught by the CBI team in pursuit.The consultant and a chartered accountant (CA) were also arrested, and an FIR was filed against two IRS officers - additional commissioner, CSGST, Deepak Kumar Sharma, and joint commissioner Rahul Kumar -as well as three other CGST superintendents.Rahul Kumar, currently posted in another state but who previously worked in Mumbai, is accused of facilitating the deal by contacting Sharma. CBI has searched the premises of Sharma, the four superintendents and the other two aides.As per a complaint, Gokulka and the other three GST superintendents - Nitin Kumar Gupta, Nikhil Agrawal and Bijender Janawa - detained a Goregaon businessman for 18 hours on Sept 4 and threatened to arrest him if he failed to pay a bribe of 60 lakh - reduced from the original demand of 80 lakh - to settle a pharmaceutical company 's issue. The businessman was allegedly abused and slapped multiple times, and coerced into calling a relative to arrange 30 lakh, which was to be delivered to a middleman, chartered accountant (CA) Raj Aggarwal, throughhawala .After receiving the initial amount, the CGST officials released the businessman the following day, instructing him to arrange the remaining 30 lakh by that evening, which he was asked to deliver to Aggarwal.The businessman approached CBI. He could only arrange for 20 lakh, which he handed over to Aggarwal, who was supposed to pass on the money to a consultant, Abhisekh Mehta. CBI caught Mehta when he arrived to collect the money from the CA. He revealed that he was to hand over the bribe directly to Gokulka.In the presence of CBI officials, Mehta spoke to Gokulka over the phone, who asked him to turn up near Oshiwara police station for the bribe handover. CBI then set a trap.Gokulka, accompanied by two women, arrived in a car at the spot around 2.30am on Sept 6. He asked Mehta, who was waiting in another vehicle, to join him. When Mehta got into his vehicle with the amount, the official sensed something amiss and sped away. After a while, he asked Mehta to get out of the car with the money and drove away. The CBI team, which was in pursuit, managed to nab Mehta and subsequently traced Gokulka.CBI produced Gokulka, Aggarwal and Mehta in court on Sept 6. They were remanded in the agency's custody till Tuesday.", CGST superintendent Sachin Gokulka accused of detaining businessman for 18 hours and demanding a bribe of Rs 60 lakh. He was caught by CBI after a dramatic chase in the middle of the night near Oshiwara police station. CGST officials coerced bizman into arranging Rs 30L for release of him.,"https://static.toiimg.com/thumb/msid-113177348,imgsize-948652,width-400,resizemode-4/113177348.jpg"
"18 months to go for Naxal-free vow, CRPF rushes 4k troops to Chhattisgarh",https://timesofindia.indiatimes.com/india/18-months-to-go-for-naxal-free-vow-crpf-rushes-4k-troops-to-chhattisgarh/articleshow/113176958.cms,"Shah had set March ’26 date to ‘end

Naxalism

’

NEW DELHI: As counter-Naxal forces brace to meet the March 2026 deadline set by home minister Amit Shah for ending Left-wing extremist (LWE) violence, the CRPF has augmented its strength in the Maoist bastions of south Bastar ( Chhattisgarh ) by deploying an additional 4,000 personnel.The force's four battalions, comprising 4,000 troops, were recently ordered to leave their stations in Jharkhand and Bihar - where LWE violence has been largely tackled with sustained, intelligence-based counter-operations over the past few years - and join the large number of battalions already fighting Maoists in south Bastar.While three battalions have been brought in from Jharkhand, one battalion is reaching from Bihar.The CRPF has set up over 100 forward operating bases (FOBs) in what once were Maoist strongholds inaccessible to governance and local administration. A CRPF source told TOI 10 FOBs have been established so far this year in south Bastar.Once FOBs are set up, administration moves in to reach benefits of government schemes to villages in the vicinity.The strategy has paid off by exposing local people to development and social sector benefits, while weaning them off the influence of Left-wing extremists. Shah had, during a recent visit to Raipur, declared March 2026 as the outer limit for ending Naxalism in the country.For this, he had emphasised on the need for a ""strong and ruthless"" plan of action.As per a reply given by the ministry of home affairs to a question in the Lok Sabha in Aug this year, incidents of LWE violence in the country have dipped 73% from the high level witnessed in 2010. The resultant fatalities among civilians and security forces too reduced by 86% in 2023 as compared to 2010.","The CRPF has augmented its strength in the Maoist bastions of south Bastar. The force's four battalions, comprising 4,000 troops, were recently ordered to leave their stations in Jharkhand and Bihar. Shah had, during a recent visit to Raipur, declared March 2026 as the outer limit for ending Naxalism.","https://static.toiimg.com/thumb/msid-113176966,imgsize-1359073,width-400,resizemode-4/113176966.jpg"
Rarely used Act slapped on duo,https://timesofindia.indiatimes.com/india/rarely-used-act-slapped-on-duo/articleshow/113176948.cms,"Customs officials have invoked the rarely used Conservation of Foreign Exchange and Prevention of Smuggling Activities Act against two prime accused, a YouTuber and his Lankan aide, arrested for allegedly smuggling 267 kg gold through Chennai airport.",Customs officials have invoked the rarely used Conservation of Foreign Exchange and Prevention of Smuggling Activities Act against two prime accused. The YouTuber and his Lankan aide were arrested for allegedly smuggling 267 kg gold through Chennai airport. They have been charged with smuggling gold.,"https://static.toiimg.com/thumb/msid-47529300,imgsize-110164,width-400,resizemode-4/47529300.jpg"
AAP likely to take Cong’s 4-6 seats ‘take it or leave it’ offer,https://timesofindia.indiatimes.com/india/4-6-haryana-seats-congs-take-it-or-leave-it-offer-to-aap-likely-to-be-accepted/articleshow/113176578.cms,"Congress may also spare 3 seats for SP in Haryana

NEW DELHI: After a week marked by flip-flops over forging an alliance in Haryana, Sunday was marked by a 'take it or leave it' offer from Congress to AAP. A likelihood of a tie-up in Haryana between the two parties is hinged on AAP accepting Congress's twin conditions on number of seats and specific constituencies.Congress added a twist to the tail by releasing a list of nine candidates for Haryana elections .Though a small number after the initial list of 32, that does not seem to impact the alliance talks , but at the same time, added a sense of urgency for going ahead in the Congress camp and not be held hostage by negotiations with AAP, in a clear nudge to Kejriwal's party to make up its mind fast. A decision on a tie-up is likely to be sealed by tonight. AAP sources conceded that Congress had not responded to its offer till late.With AAP putting off its plan of announcing its first list of candidates on Sunday, it appears Kejriwal's party may be willing to climb down on its demand for 10 seats to move closer to agreeing to 4-6 seats that Congress is likely to cede, sources said.If the alliance works out, AAP sources said an announcement will follow on Monday. The last date to file nominations is Sept 12.Congress's Haryana in-charge Deepak Babaria and AAP's Raghav Chadha along with others were engaged in hectic negotiations till late. According to sources, AAP is likely to be offered seats where Congress does not think winnability will be a factor for its candidates or where it performed poorly in the past.""An alliance seems possible on 4-6 seats if AAP agrees to the nature of constituencies that Congress is offering,"" a Congress source said. The development comes amid strong opposition from the Haryana unit of the party.Meanwhile, sources said Congress may spare three seats for Samajwadi Party in Haryana. SP chief Akhilesh Yadav has asked Congress for Hathin constituency in Palwal, Dadri in Charkhi Dadri and Sohna in Gurgaon district.Earlier in the day, Chadha said Congress and AAP were trying to forge an alliance by keeping aside their individual aspirations. He also said AAP will not proceed with the alliance ""if there is no win-win situation"".AAP's three-time MLA from Malviya Nagar in Delhi Somnath Bharti cautioned his party against an alliance with Congress by citing how the Congress leadership never campaigned for him when he was the candidate while AAP leaders went all out to campaign and garner support for Congress candidates.","AAP may be willing to climb down on its demand for 10 seats to move closer to agreeing to 4-6 seats that Congress is likely to cede, sources said. Congress may also spare 3 seats for Samajwadi Party in Haryana.","https://static.toiimg.com/thumb/msid-113176642,imgsize-1246704,width-400,resizemode-4/113176642.jpg"
21 cities achieve target of 40% PM10 cut 2 years before deadline,https://timesofindia.indiatimes.com/india/21-cities-achieve-target-of-40-pm10-cut-2-years-before-deadline/articleshow/113175463.cms,"NEW DELHI: Twenty-one cities including Greater Mumbai, Varanasi, Agra, Lucknow, Kanpur, Dehradun, Dhanbad, Trichy and Tuticorin have reduced the concentration of critical air pollutant PM10 by more than 40% in 2023-24 compared to 2017-18 levels, according to the latest compilation of data from 131 cities made by the environment ministry.Though these 21 cities have met the target of National Clean Air Programme (NCAP) two years in advance, most of them including Greater Mumbai, Varanasi, Agra, Kanpur, Lucknow, Dehradun and others have still not met the acceptable limit (national standards) of keeping PM10 concentration within the annual average levels of 60 micrograms per cubic metre (µg/m3).For example, Greater Mumbai reduced PM10 levels by nearly 42% (from 161 µg/m3 in 2017-18 to 94 µg/m3 in 2023-24) but city continues to be in polluting category due to not meeting the national ambient air quality standards (NAAQS). On the other hand, the reduction of over 40% in the pollutant levels put Trichy, Tuticorin (both in Tamil Nadu) and Kadapa (Andhra Pradesh) in the list of 18 cities which meet those standards of being clean cities.Under NCAP launched in 2019, the ministry had planned to reduce PM10 levels by 40% by 2025-26 from the baseline year 2017-18. Overall, 95 out of 131 polluting cities have shown improvement by reducing levels of PM10 in varying percentages where 18 of them have, so far, reached the acceptable limit of this critical air pollutant. PM10 (particulate matters that do not exceed 10 micrograms in diameter) is small enough to enter the lungs through breathing causing serious health hazards.Data on improvement in air quality in these cities was shared by the ministry at a function to observe ‘International Day of Clean Air for Blue Skies’ in Jaipur on Sept 7 where Union environment minister Bhupender Yadav awarded nine cities in three different categories for better implementation of different actions for mitigating air pollution under NCAP.Surat, Jabalpur and Agra were awarded for being the top three cities in the million-pluspopulation category, whereas Firozabad, Amravati and Jhansi received the award in the category of 3-10 lakh of population, and Raebareli, Nalgonda and Nalagarh in the category of less than three lakh of population. Except for Nalgonda in Telangana, none of these cities, however, figured in the list of 18 which met the national standards for clean air. The cities were awarded under the ‘Swachh Vayu Survekshan’ 2024 on the basis of different mitigation measures where the weightage of improving PM10 levels is merely 2.5% in this annual survey.High-polluting cities such as Delhi, Ghaziabad, Noida, Kolkata, Ahmedabad, Jaipur, Nasik and Kota too recorded improvement in terms of reducing PM10 to an extent, but the levels of pollutant there are still quite far away from the acceptable limit. Delhi reduced the level of PM10 from 241 µg/m3 in 2017-18 to 208 µg/m3 in 2023-24 (nearly 14% decline) but the city continues to be highly polluting by recording pollutant levels by more than three times of the national standards.Under NCAP, city action plans (CAPs) have been prepared by all 131 ‘non-attainment’ cities and are being implemented by urban local bodies. The non-attainment cities are those which did not conform to the NAAQS during 2011-15.The Centre has earmarked nearly Rs 20,000 crore for these cities during 2019-20 to 2025-26, out of which 49 million plus population cities are funded under the 15th Finance Commission air quality grant and remaining 82 cities by the environment ministry. So far, over Rs 11,211 crore has been released to these cities to implement CAPs.","Greater Mumbai, Varanasi, Agra, Lucknow, Kanpur, Dehradun, Dhanbad, Trichy and Tuticorin have reduced the concentration of critical air pollutant PM10 by more than 40% in 2023-24 compared to 2017-18 levels. Most of them including Greater Mumbai have still not met the acceptable limit (national standards) of keeping PM10 concentration within 60 micrograms per cubic metre.","https://static.toiimg.com/thumb/msid-113175582,imgsize-254832,width-400,resizemode-4/113175582.jpg"
"Father-son held for raping kin in Kalyan; juvenile, victim's husband detained",https://timesofindia.indiatimes.com/india/father-son-held-for-raping-kin-in-kalyan-juvenile-victims-husband-detained/articleshow/113175297.cms,"THANE: A man and his son were arrested on Sunday for allegedly raping a 27-year-old woman working in a brick kiln in Kalyan in Thane district, a police official said.The father-son duo and a minor entered the hut of the woman and raped her in turns on September 6, the Murbad Sub Divisional Police Officer Jagdish Shinde said.""The accused are father-in-law (50) and brother-in-law (22) of the victim.The juvenile has been detained . The victim's husband has also been detained. The victim is severely injured following the gangrape and is admitted in Thane civil hospital,"" he said.""She was hit and also attacked with a sickle. The victim's husband beat her up when she reported the incident to him. A case of gangrape and grievous assault under Bharatiya Nyaya Sanhita was registered. Thane Rural SP DS Swamy is personally supervising the probe,"" the official said.Chairperson of the government-appointed committee on tribal welfare Vivek Pandit also visited her in the hospital, a Kalyan taluka police station official said.",A man and his son were arrested on Sunday for allegedly raping a 27-year-old woman. The father-son duo and a minor entered the hut of the woman and raped her in turns. The victim's husband beat her up when she reported the incident to him.,"https://static.toiimg.com/thumb/msid-47529300,imgsize-110164,width-400,resizemode-4/47529300.jpg"
"India, West gave up on idea of production, handed it to China: Top quotes from Rahul Gandhi's address in Dallas",https://timesofindia.indiatimes.com/india/india-west-have-given-up-on-idea-of-production-handed-it-to-china-top-quotes-from-rahul-gandhis-address-at-university-of-texas-us-visit/articleshow/113174426.cms,"'

changed the way I think about politics'

'India does not have respect for ... '

Rahul on AI

NEW DELHI: Leader of the Opposition in the Lok Sabha and Congress MP Rahul Gandhi , on his three-day visit to the United States, addressed pressing issues such as unemployment , education , and technology. He remarked that both the West and India are grappling with job crises and advocated for India to ""boost its own production "" to combat unemployment.Rahul said that while many countries are grappling with unemployment, some, such as China and Vietnam, are not facing such difficulties.Gandhi traced the roots of this issue to historical shifts in global production. “The West, including the United States and Europe, once led global production in the mid-20th century,” he said.He noted a significant change over the decades, with production gradually relocating from the US to South Korea, Japan, and eventually China. Today, China dominates global production, a shift Gandhi attributes to Western and Indian retreat from manufacturing.“The West, including America and Europe, has largely abandoned the manufacturing sector, leaving it to countries like China and Vietnam,” the LoP in Lok Sabha explained.The Congress MP added that India needs to reimagine its approach to production. “India cannot simply accept that manufacturing will be the domain of other countries,” he said. “We need to develop our own manufacturing capabilities in a way that aligns with democratic principles.”Reflecting on his recent Bharat Jodo Yatra, Gandhi shared how it reshaped his political outlook. “The Bharat Jodo Yatra fundamentally changed the way I think about my work,” he said. He discussed how the Yatra introduced the concept of love into political discourse, which is rare globally. “The most powerful thing that happened organically was the introduction of the idea of love in politics,” Gandhi mentioned.Talking about education and skills in India, Rahul suggested that the real issue is not a lack of skills but a lack of respect for skilled individuals. “India does not have respect for people who possess skills,” he remarked. He criticised the disconnect between the education system and the business sector, advocating for better integration through vocational training. “Our education system doesn’t connect with the business system. Bridging that gap through vocational training is fundamental,” Rahul said.Regarding Artificial Intelligence (AI), Gandhi acknowledged both its challenges and opportunities. “Every time you get a new technology, the argument is made that it’s going to take jobs away,” the Congress MP said. However, he also pointed out that while AI might displace some jobs, it will create new ones as well. “It’s going to hit different people differently. If you position it properly, it’s an opportunity; if not, you’re in trouble,” Gandhi explained.Rahul Gandhi made his remarks during a live interaction with students at the University of Texas in Dallas, USA.Gandhi arrived in Dallas on Sunday and was welcomed by Sam Pitroda, Chairman of the Indian Overseas Congress, and members of the Indian diaspora.","Congress MP Rahul Gandhi is on a three-day visit to the United States. He addressed pressing issues such as unemployment, education, and technology. Gandhi said both the West and India are grappling with job crises. He advocated for India to ""boost its own production "" to combat unemployment.","https://static.toiimg.com/thumb/msid-113174929,imgsize-815291,width-400,resizemode-4/113174929.jpg"
