Article Title,Article Link,Article Text,Article Summary,Article Image
"Telugu speakers jump 4-fold in US, touch 12.3 lakh this year from 3.2 lakh in 2016",https://timesofindia.indiatimes.com/city/hyderabad/telugu-speakers-jump-4-fold-in-us-touch-12-3-lakh-this-year-from-3-2-lakh-in-2016/articleshow/111295654.cms,"Out of 350, Telugu is now America's 11th most-spoken language

HYDERABAD: Telugu students packing their bags for the US this fall are more likely to feel at home than before. There has been an explosion in the Telugu-speaking population across America , from 3.2 lakh in 2016 to 12.3 lakh in 2024.According to a Statistical Atlas of the US report based on US Census Bureau data this population ranges from fourth-generation immigrants to recently-arrived students. California hosts the largest Telugu-speaking population - of close to 2 lakh - closely followed by Texas (1.5 lakh) and New Jersey (1.1 lakh). States like Illinois (83,000), Virginia (78,000), and Georgia (52,000) too have a significant pool of people from the two Telugu states. Data shows each of these states have seen an almost four-fold rise in numbers. Local Telugu associations say these numbers are in line with their own estimates.Between 60,000 and 70,000 students arrive in the US each year, along with close to 10,000 H1B visa holders. About 80% of them are registered with us, said Ashok Kolla, former secretary of the Telugu Association of North America. ""Over 75% of them settle here in the US, mostly in Dallas, the Bay Area, North Carolina, New Jersey, Atlanta, Florida, and Nashville.""The older generations are largely entrepreneurs, whereas over 80% of the younger lot are in IT and finance. Telugu influence has seen such a rise that it is now the 11th most spoken foreign language - out of 350 languages - in the US, and the third most spoken Indian language, preceded by Hindi and Gujarati.""When I moved to Dallas last year, I felt right at home,"" said Vinay K, who moved to Texas for a data analyst's job. ""From my PG to my office, from streets to malls, I was surrounded by Telugus. Most of my colleagues from India are from AP and Telangana, which helped me settle down and not feel homesick,"" the young professional said.Old-timers recount how communities around them have seen a shift in the ethnic composition over the years. ""I don't remember knowing more than four or five Telugu families when I first moved. But over the years the community has grown significantly. It's like we have a third state after AP and Telangana in the US. There are more footfalls in temples and community spaces now,"" said T Raghavendra Rao, a 63-year-old businessman who's lived in NJ for over five decades.According to the Indian Mobility Report 2024, AP and Telangana form the largest cohort of Indian students in the US - accounting for 12.5% of the total student crowd. So much so that Kent State University has started receiving their new batches with signs that read ""Vidhyardhulaku Swagatham (Welcome Students)"". ""I was moved by this gesture,"" said Indra Varsini, pursuing a master's in IT in NJ. ""I feel I am not too far from my own people,"" she added.","There has been an explosion in the Telugu-speaking population across America. Telugu is now America's 11th most-spoken language. Between 60,000 and 70,000 students arrive in the US each year, along with close to 10,000 H1B visa holders.","https://static.toiimg.com/thumb/msid-111295727,imgsize-1594399,width-400,height-225,resizemode-72/111295727.jpg"
Probe: NEET leak Bihar kingpin colluded with paper-solving gang of UP,https://timesofindia.indiatimes.com/city/patna/probe-neet-leak-bihar-kingpin-colluded-with-paper-solving-gang-of-up/articleshow/111295902.cms,"Suspected mastermind Mukhiya didn't report for duty on day of NEET-UG test

PATNA: Sanjiv Mukhiya, the Nalanda horticulture college employee identified as one of the absconding perpetrators of the NEET-UG paper leak in Bihar , is a repeat offender with a network of collaborators that includes the arrested kingpin of a UP ""solver gang"", investigators revealed Wednesday.Mukhiya, it transpired, unofficially took time off from his job as a technical assistant at the state-run Noorsarai Horticulture College in Nalanda from May 6 to 14 and got himself admitted to a hospital. He went missing after word got out about his alleged role in the paper leak ahead of the May 5 test. Sources in the Economic Offences Unit said Mukhiya had links with Ravi Atri, who was jailed in Meerut after being arrested in April for the police constable recruitment exam paper leak.Officials at Noorsarai Horticulture College said Mukhiya didn't report for duty on the day of the NEET-UG test and has been marked as absent without authorised leave since.In his response to a notice from the college on May 18, he claimed to have been hospitalised on May 6 due to a sudden illness. He requested leave until June 5, totalling 31 days. The college wrote back with queries to which he was supposed to respond within three days.The institute's office superintendent Pranay Kumar Pankaj said, ""Mukhiya has been posted in the college for seven years. When we heard he was a suspect in the NEET-UG paper leak, we summoned him through another letter on June 20, but received no response."" Pankaj mentioned that an EOU team visited the campus for questioning.A senior EOU official said Mukhiya previously collaborated with Ranjit Don, the alleged mastermind of several paper leaks from the 1990s till early 2000. Mukhiya allegedly branched out after Ranjit joined politics. ""Mukhiya operated as a link between candidates' parents, middlemen, handlers and the solver gang. The NEET-UG question papers are suspected to have been leaked from a centre in Hazaribagh. The principal of a school, the centre observer, superintendent and others are under the scanner,"" an official said. The absconding franchise of a courier company in Hazaribagh is also under scrutiny.A special CBI court in Patna Wednesday remanded two of the arrested accused in the agency's custody for three days. Baldev Kumar, alias Chintu, and Mukesh Kumar, have been linked to the Lutan Mukhia gang.The CBI registered an FIR in the case on June 23, based on a directive from the Union education ministry.","Mukhiya unofficially took time off from his job as a technical assistant at the state-run Noorsarai Horticulture College in Nalanda. Mukhiya had links with Ravi Atri, who was jailed in Meerut after being arrested in April for the police constable recruitment exam paper leak.","https://static.toiimg.com/thumb/msid-111295906,imgsize-93216,width-400,height-225,resizemode-72/111295906.jpg"
"Business as usual? Modi 3.0 starts on winning note in Lok Sabha, but opposition makes its presence felt",https://timesofindia.indiatimes.com/india/business-as-usual-modi-3-0-starts-on-winning-note-in-lok-sabha-but-opposition-makes-its-presence-felt/articleshow/111293306.cms,"Election of Speaker

The Emergency attack

BJP stamp on government

Continuity vs Change

Balance on policy issues

Working with the 'Shehzada'

NEW DELHI: PM Modi-led NDA government on Wednesday won the first battle of numbers on the floor of 18th Lok Sabha as ruling NDA candidate Om Birla was re-elected Speaker with a voice vote. Opposition's INDIA bloc, despite all its posturing, did not press for division of votes - a candid admission of lack of numbers on their side.Ever since the results were declared on June 4, there have been talks of change in the character of the 18th Lok Sabha.AIMIM MP Asaduddin Owaisi reflected the opinion of many in the opposition camp when he said today that the ruing BJP will not be able to ""steamroll"" the opposition as the character of the House has changed in new Lok Sabha. With the BJP failing to secure a majority on its own, the number dynamics in the Lower House has indeed changed. Prime Minister Modi is now dependent on allies for the survival of his government. But has that made any perceptible change in the way Modi 3.0 has functioned since it took oath on June 9? Well, the answer is both ""yes"" and ""no.""The election of Om Birla as Speaker of Lok Sabha had the stamp of authority which was trademark of both Modi 1.0 and Modi 2.0. With the firm support of allies, the government did not let opposition dictate terms on Speaker's election and refused to enter into any negotiations over the choice of deputy speaker. While the opposition wanted a commitment on deputy speaker's post, the government sent out a clear message: ""First, you support Speaker's election, and after that, we can discuss about the Deputy Speaker."" The stalemate ensured an election for Lok Sabha Speaker - something that had happened only three times till now - in 1952, 1967, and 1976.The invoking of ""dark days of Emergency"" by Prime Minister Modi and other top NDA leaders ahead of Parliament session was another signature BJP strategy - seen several times in the last 10 years of NDA rule - to not just put the opposition under pressure but also to isolate Congress within the INDIA bloc. With the Congress and INDIA bloc leaders carrying forward their poll campaign of ""Save Constitution"" to put the BJP on the backfoot, saffron party's ""Emergency"" counter attack was a well-planned move to keep the narrative around Constitution but with a different take. With Speaker Om Birla joining the government in attacking Emergency, the opposition's hopes of any perceptible change in government's functioning due to reduced numbers - may remain just that.When PM Modi took oath for a record third term in office, the belief was that allies, especially Chandrababu Naidu's TDP and Nitish Kumar's JD(U) would walk away with plum portfolios in bargain for their crucial support to run Modi 3.0. There were also reports that TDP wanted the Speaker's post. However, that did not happen. The BJP has not yielded too much of space to allies and has kept almost all the important portfolios with itself.Modi 3.0 has been marked by continuity, unlike Modi 2.0 when change was perhaps the only constant. Prime Minister Modi has retained most of his top ministers and even his top officers. He has also not changed the portfolios of key ministers. The choice of Speaker also signalled this spirit of continuity. This is in contrast to 2019, when Prime Minister Modi had returned to power with an overwhelming majority of 303 seats, and his Cabinet and council of ministers saw several changes. In 2019, the BJP selected Om Birla as Speaker replacing Sumitra Mahajan who presided over Lok Sabha during Modi 1.0.And while the BJP imprint has been strong till now, the saffron party will have to tread a cautious path when it will come to policies of Modi 3.0. Even before the countours of government was finalised, allies went public with their reservations on the Agniveer scheme, which was a flagship policy of Modi 2.0. The caste census is another issue on which the allies would have a different perspective. During campaigning, the BJP had teared into the Congress over reservations given to Muslims in Karnataka. However, in TDP, the BJP has an ally which openly supports the idea and is all set to implement it in Andhra Pradesh.Prime Minister Modi may have avoided taking the name of Rahul Gandhi in the last 10 years and referred to the Congress leader as Shehzada. However, the changed number dynamics has now made the former Congress chief an integral part of government's functioning for the first time. We saw the first glimpse of this today when Rahul accompanied PM Modi to escort Om Birla to the Speaker's chair. Also, as leader of the opposition, Rahul Gandhi will be part of several parliamentary bodies and panels for key appointments that are headed by Prime Minister. Rahul may still not have a say in their functioning, but he will be privy to all the discussions.While the BJP wants to drive home the point that Modi 3.0 is firmly in the saddle and it is business as usual, just like the first two terms of the Prime Minister, the opposition knows that Modi government is now completely dependent on crucial support provided by two key allies. The upcoming Budget may see some incentives, extra grants or even a special category status for Chandrababu Naidu's Andhra Pradesh and Nitish Kumar's Bihar. For Naidu and Nitish, these perks would be of far greater importance than any possible leverage at Centre. As long as the BJP manages to keep the NDA intact, it can afford to ride roughshod over opposition and provide glimpses of the authority it wielded in the last 10 years.","PM Modi-led NDA government on Wednesday won the first battle of numbers on the floor of 18th Lok Sabha. Opposition's INDIA bloc did not press for division of votes - a candid admission of lack of numbers. With the BJP failing to secure a majority on its own, the number dynamics in the Lower House has changed.","https://static.toiimg.com/thumb/msid-111293979,imgsize-1714139,width-400,resizemode-4/111293979.jpg"
Shame that local train users carried worse than cattle: HC,https://timesofindia.indiatimes.com/city/mumbai/shame-that-local-train-users-carried-worse-than-cattle-hc/articleshow/111295622.cms,"MUMBAI: Observing that passengers in local trains are carried worse than cattle, Bombay high court on Wednesday asked Railways whether it has been able to stop train-fall and track-trespassing deaths ""It is your responsibility and duty. You must not depend on the court's direction to save the lives of people,"" said Chief Justice Devendra Kumar Upadhyaya and Justice Amit Borkar, hearing a PIL that highlighted the possible causes for high fatalities on suburban railways and gave suggestions to salvage the situation.""I feel ashamed. The manner in which the passengers in local trains are made to commute,"" said the CJ.The petition said Mumbai suburban railway, which is the second busiest globally after Tokyo, sees over 2,000 deaths annually, with a high 33.8 fatality rate. It also stated that while there is phenomenal growth in the number of passengers, infrastructure at railway stations is old and crumbling.Advocates Rohan Shah and Surabhi Prabhudesai, for petitioner Yatin Jadhav, argued that Railways disowns deaths due to crossing tracks, falling from train or slipping between platform-train gaps and terms them ""untoward incidents"".Shah said: ""Going out to pursue your vocation or to college is like going to war."" He also submitted news reports, including of a stampede-like situation to board a train at Kalyan station.Western Railway's advocate Suresh Kumar said that since 2008, it has complied with directions in an earlier PIL in which guidelines for Railways, including fixing platform-train gaps, and HC was satisfied with the steps taken. The judges then asked if Railways have been able to stop train-fall and trespassing deaths. They said WR cannot take a refuge by saying it carries 33 lakh passengers daily. ""You have to change your attitude and mind,"" the chief justice said. ""This time we are going to make the officials accountable... You are carrying human passengers like cattle. Perhaps even worse.""In the order, the judges said the issue raised in the petition ""needs urgent attention"" of all concerned, specially higher-ups, including a Railway Board member and zonal safety commissioners. HC directed WR and Central Railway general managers to file an affidavit in reply to the PIL, and list measures to check mishaps. After receiving the replies, ""HC may consider setting up a committee of commissioners/body of experts to conduct a study to suggest measures for meeting the challenge of daily train passenger deaths in Mumbai"".","Bombay high court asks Railways whether it has been able to stop train-fall and track-trespassing deaths. Mumbai suburban railway sees over 2,000 deaths annually, with a high 33.8 fatality rate. PIL highlighted possible causes for high fatalities on suburban railways and gave suggestions to salvage situation.","https://static.toiimg.com/thumb/msid-111295624,imgsize-1741183,width-400,height-225,resizemode-72/111295624.jpg"
"After Amritpal's LS win, his aide plans to contest Punjab bypoll",https://timesofindia.indiatimes.com/city/chandigarh/after-amritpals-ls-win-his-aide-plans-to-contest-punjab-bypoll/articleshow/111295592.cms,"Top Picks For You Punjab extends MP Amritpal Singh’s detention under NSA till 2025

BATHINDA: Byelections to four assembly seats in Punjab - vacated by legislators who were elected to Parliament - are turning out to be interesting, and potentially controversial, with yet another Khalistan sympathiser jailed under NSA pitching his candidature for one of the seats.After Amritpal Singh won Khadoor Sahib LS seat by highest margin in Punjab while locked up in Dibrugarh jail, his fellow NSA-detainee Bhagwant Singh 'Pradhan Mantri' Bajeke has indicated that he is keen to contest Gidderbaha assembly bypoll in Punjab's Muktsar as claimed in a 32-second video posted by a youth who claims to be Bajeke's son.Gidderbaha is part of Faridkot parliamentary constituency, from where Sarabjit Singh Khalsa, son of Beant Singh, one of the assassins of former PM Indira Gandhi, was elected as an MP.Bajeke, who belongs to Moga district's Bajeke village, was the most outspoken out of Amritpal's supporters. He had come to limelight on March 19, 2023, when an unverified video hit social media when he failed to escape a police cordon laid in a field in his village. Bajeke ran Amritpal's radicalisation mission on multiple social media platforms.",Amritpal Singh won Khadoor Sahib LS seat by highest margin in Punjab while locked up in Dibrugarh jail. Fellow NSA-detainee Bhagwant Singh 'Pradhan Mantri' Bajeke indicated that he is keen to contest Gidderbaha assembly bypoll in Punjab's Muktsar.,"https://static.toiimg.com/thumb/msid-111295593,imgsize-1903249,width-400,height-225,resizemode-72/111295593.jpg"
"BJP leader L K Advani admitted to AIIMS Delhi, condition stable",https://timesofindia.indiatimes.com/india/bjp-leader-l-k-advani-admitted-to-hospital-condition-stable/articleshow/111295057.cms,"NEW DELHI: Bhartiya Janta Party leader L K Advani was admitted to hospital late on Wednesday night due to age related health issues. Doctors informed that his condition was stable.The 96-year-old has been taken to AIIMS Delhi.The ex-deputy prime minister has been hospitalized in the aged private section, where he is reportedly receiving treatment under the care of urology specialists.",Bhartiya Janta Party leader L K Advani was admitted to hospital late on Wednesday night due to age related health issues. Doctors informed that his condition was stable. The 96-year-old has been taken to AIIMS Delhi. He is reportedly receiving treatment under the care of urology specialists.,"https://static.toiimg.com/thumb/msid-111295037,imgsize-733290,width-400,resizemode-4/111295037.jpg"
"Speaker moves resolution condemning Emergency, Congress finds itself isolated",https://timesofindia.indiatimes.com/india/speaker-moves-resolution-condemning-emergency-congress-finds-itself-isolated/articleshow/111295278.cms,"NEW DELHI: Proceedings of the new Lok Sabha got off on an interesting note with the resurgent Congress finding itself isolated over a motion moved by the newly-elected Speaker to condemn the Emergency clamped by the Indira Gandhi govt to silence protests.The resolution , marking the ""post-facto ratification"" by the Indira Gandhi Cabinet of the presidential proclamation issued late night to suspend democracy and civil rights, was supported by Congress's allies like SP, DMK and TMC, besides, of course, BJP and its allies.""Dictatorship was imposed on India by Indira Gandhi, India's democratic values were crushed and freedom of expression was strangled. During that dark period of Emergency, several people lost their lives at the hands of the dictatorial Congress government. Let's observe two minutes of silence in the memory of those dutiful and patriotic citizens of India,"" the resolution read by Speaker Om Birla in Lok Sabha, a few minutes after his re-election, said.""This House strongly condemns the decision to impose Emergency in the country in 1975. Along with this, we appreciate the determination of all those people who strongly opposed the Emergency, fought an unprecedented struggle and took the responsibility of protecting the democracy of India,"" he further said.The motion, mirroring PM Narendra Modi's condemnation of the Emergency on the inaugural day of the session, caught Congress unawares, splitting it not just from allies like SP and DMK whose leaders were victims of Emergency's excesses but also, surprisingly, TMC, a breakaway unit.When Birla started reading out the resolution that specifically named Indira Gandhi and Congress for the assault on ""Babasaheb Ambedkar's Constitution, illegal arrests, press censorship and other excesses"", only Congress MPs protested from the aisle while the rest of the opposition, including SP and TMC, remained seated. Congress's allies also joined in the two-minute silence urged by the speaker to express solidarity with the victims of Emergency and to ""remind the younger generation"" of what happened in the 21 months of the Emergency.Besides the embarrassment to Congress, the swift move was significant also in that it again indicated BJP's resolve to pay Congress back in the ""Constitution-in-danger"" coin that Rahul Gandhi effectively used during the election campaign, as well as its willingness to pick and widen gaps in the INDIA bloc.""This is the 50th anniversary of the Emergency. It is our collective duty to create awareness about all historic events. Awareness towards the Constitution will only strengthen when the young generation knows about democracy,"" Birla said, adding that post-facto ratification of Emergency was done by the cabinet on June 26 fifty years ago.Endorsing Birla for his resolution on the Emergency, Modi said on X, ""I am glad that the speaker strongly condemned the Emergency, highlighted the excesses committed during that time and also mentioned the manner in which democracy was strangled. It was also a wonderful gesture to stand in silence in honour of all those who suffered during those days.""The PM said Emergency was imposed 50 years ago but it was important for today's youth to know about it because it remained a fitting example of what happened when the Constitution was trampled, public opinion was stifled and institutions were destroyed.""The happenings during the Emergency exemplified what a dictatorship looks like,"" Modi said, a reassertion of what Birla said in the resolution and seen as a bid to deflate Congress's ""save democracy"" campaign.Later, parliamentary affairs minister Kiren Rijiju framed the issue as one between those who supported the atrocities during Emergency on the one hand and those who sympathised with those who resisted the ""imposition of dictatorship"".","Lok Sabha condemned the Emergency clamped by the Indira Gandhi govt to silence protests. The resolution was supported by Congress's allies like SP, DMK and TMC, besides, of course, BJP and its allies. Only Congress MPs protested from the aisle while the rest of the opposition, including SP and T MC, remained seated.","https://static.toiimg.com/thumb/msid-111295296,imgsize-1212800,width-400,resizemode-4/111295296.jpg"
Replace sengol with replica of Constitution: SP,https://timesofindia.indiatimes.com/india/replace-sengol-with-replica-of-constitution-sp/articleshow/111295408.cms,"Demanding the removal of sengol in the Lok Sabha, I, an MP from Mohanlalganj, Uttar Pradesh, urge replacing it with a Constitution replica to honor democracy's principles. Chaudhary, who has won from the reserved seat of Mohanlalganj in Uttar Pradesh , is a known Dalit activist, and was among the early members of BSP. He also wanted to read the letter in the House, but was urged by the opposition members, who were unaware of its content, not to do so in respect of the process of oath.

File photo

NEW DELHI: Samajwadi Party member R K Chaudhary demanded the removal of ""sengol"" from the Lok Sabha, calling it an anachronistic symbol of monarchy in a democratic India. He said the sengol should be replaced by a replica of the Constitution .

Lodging a protest after taking oath as MP, Chaudhary submitted a letter to pro-tem Speaker Bhartruhari Mahtab questioning the presence of ""sengol"" next to the Speaker's chair.""Today, I took oath in this honourable chamber that 'I will bear true faith and allegiance to the Constitution of India as by law established'. But I was shocked to see the sengol on the right side of the Chair of the House. Sir, our Constitution is a sacred document of India's democracy, while sengol is a symbol of monarchy. Our Parliament is a temple of democracy, not a palace of some king or royal,"" he said, urging, ""I request you that Sengol be removed from the House and replaced by a large replica of the Constitution.""

Chaudhary, who has won from the reserved seat of Mohanlalganj in Uttar Pradesh , is a known Dalit activist, and was among the early members of BSP.

He also wanted to read the letter in the House, but was urged by the opposition members, who were unaware of its content, not to do so in respect of the process of oath.

","Samajwadi Party member R K Chaudhary demanded the removal of ""sengol"" from the Lok Sabha. He said the sengol should be replaced by a replica of the Constitution. He also wanted to read the letter in the House, but was urged by the opposition members.","https://static.toiimg.com/thumb/msid-111295416,imgsize-19148,width-400,resizemode-4/111295416.jpg"
