Article Title,Article Link,Article Text,Article Summary,Article Image
Who is Dr Dinshaw Pardiwala? The surgeon behind Vinesh Phogat’s Paris Olympic recovery and Rishabh Pant’s comeback,https://timesofindia.indiatimes.com/sports/paris-olympics-2024/indiaparis/who-is-dr-dinshaw-pardiwala-the-surgeon-behind-vinesh-phogats-paris-olympic-recovery-and-rishabh-pants-comeback/articleshow/112394151.cms,"Who is Dr. Dinshaw Pardiwala?

NEW DELHI: In a surprising development, India's star wrestler Vinesh Phogat , who was a strong favourite for a gold medal, was disqualified from the Paris 2024 Olympics finals on Wednesday morning.The disqualification was due to a sudden increase in her weight, which prevented her from competing against the United States' Ann Hildebrandt in the women's 50 kg wrestling final.Phogat had successfully weighed in at 49.90 kg on Tuesday morning, allowing her to compete in her first match of the day. She went on to win three bouts, including the semi-final. However, her weight unexpectedly increased to approximately 52.7 kg, resulting in her disqualification.In response, the Indian wrestling team , determined to resolve the issue, enlisted the help of Dr. Dinshaw Pardiwala , a renowned sports orthopedic surgeon . Chef de Mission Gagan Narang, along with Dr. Pardiwala, Phogat's husband, physiotherapist, medical staff, and officials from the Indian Olympic Association, worked tirelessly through the night to help Phogat meet the weight requirements.Despite their best efforts, they were unable to reduce her weight in time. Reports indicate that Dr. Pardiwala emphasized that Phogat's health was paramount and that compromising her well-being was not an option.Dr. Dinshaw Pardiwala is a highly esteemed expert in sports medicine. He recently performed surgery on wicketkeeper Rishabh Pant and has treated many notable cricketers, including Sachin Tendulkar, Yuvraj Singh, Jasprit Bumrah, and Ravindra Jadeja.With over two decades of experience, he currently serves as the Director of Arthroscopy and Shoulder Service at Kokilaben Hospital in Mumbai. In recognition of his contributions to arthroscopic surgery, he received the prestigious ICOS John Joyce Award in 2009.Despite this setback, Phogat's accomplishment of becoming the first Indian female wrestler to reach the Olympic finals remains a significant milestone for Indian wrestling.","Vinesh Phogat was disqualified from the Paris 2024 Olympics finals on Wednesday morning. The disqualification was due to a sudden increase in her weight, which prevented her from competing against the United States' Ann Hildebrandt in the women's 50 kg wrestling final. The Indian wrestling team enlisted the help of Dr. Dinshaw Pardiwala, a renowned sports orthopedic surgeon.","https://static.toiimg.com/thumb/msid-112394801,imgsize-40940,width-400,resizemode-4/112394801.jpg"
"Explained: What is 'bail is rule, jail an exception' Supreme Court cited in Manish Sisodia case",https://timesofindia.indiatimes.com/india/explained-what-is-bail-is-rule-jail-an-exception-supreme-court-cited-in-manish-sisodia-case/articleshow/112410167.cms,"But what is this principle?

Why 'twin test' of PMLA make it difficult?



Why SC quoted 'bail is rule' in Sisodia's case

When the court called for 'bail is rule' principle

NEW DELHI: After 17 months in jail, former Delhi deputy chief minister and Aam Aadmi Party leader Manish Sisodia finally walked free on a regular bail . In tears, as he got a rousing welcome outside Tihar jail by party leaders Atishi, Sanjay Singh and supporters, in a cracking voice he thanked Ambedkar and the Constitution because of which, he said, he was free.Sisodia, who got multiple setbacks by lower courts during the last 17 months, finally got bail as the Supreme Court reiterated the principle of 'bail is the rule , and jail is an exception'.Sharply criticising the lower courts, the top court said, ""As observed time and again, prolonged incarceration before being pronounced guilty of an offence should not be permitted to become punishment without trial."" The bench of Justices BR Gavai and KV Viswanathan said, ""It is high time trial courts, high courts recognise principle of bail is the rule and jail is an exception.""The 'bail is the rule, and jail is the exception' principle was first used in the 1977 landmark judgment of the 'State of Rajasthan vs Balchand alias Baliya' case.The ruling underscored that bail should be denied only in circumstances where there is a risk of the accused fleeing from justice, obstructing justice, repeating offenses, or intimidating witnesses. This concept has been cited in numerous cases since, reinforcing its importance in upholding personal liberty.""The basic rule is bail, not jail, except where there are circumstances suggestive of fleeing from justice or thwarting the course of justice or creating other troubles in the shape of repeating offenses or intimidating witnesses and the like by the petitioner who seeks enlargement on bail from the court. When considering the question of bail, the gravity of the offense involved and the heinousness of the crime which are likely to induce the petitioner to avoid the course of justice must weigh with the court,"" the 1977 bench said.The discussion around bail becomes more complex in cases involving the Prevention of Money Laundering Act (PMLA), especially after the March 2018 amendment. This amendment revived the 'twin conditions' under Section 45(1) of the PMLA, making it significantly harder to secure bail in money laundering cases. These conditions stipulate that when an accused in a money laundering case applies for bail, the court must first provide an opportunity for the public prosecutor to be heard.According to Section 45, no person accused of an offense under the PMLA can be released on bail unless the public prosecutor is given a chance to oppose the bail application, and the court is satisfied that there are reasonable grounds to believe that the accused is not guilty of the offense and is unlikely to commit any offense while on bail. This effectively places the burden of proving innocence on the accused, complicating the bail process.Before the 2019 amendments of PMLA, if someone was accused of a crime related to money laundering, the law automatically assumed they were guilty of the original crime (called the ""scheduled offence""). The accused had to prove they were not involved in that crime to get bail.The Supreme Court emphasised that delay in trial and prolonged imprisonment are valid grounds for granting bail, even in cases under stringent laws like the PMLA. ""Manish Sisodia is in custody for 17 months and trial has not yet commenced; this deprives his right to a speedy trial,"" the top court said. ""Right to speedy trial is a sacrosanct right... Bail cannot be opposed saying that the crime is serious. In matters of liberty, every day counts,"" it added.The CBI and ED had requested the Supreme Court to impose bail conditions similar to those applied to Delhi chief minister Arvind Kejriwal. However, the court rejected this plea, stating that each case needs to be treated on its own merits rather than applying uniform conditions across the board.The Supreme Court has consistently reiterated this principle in various judgments. In 2011, the court granted bail to five accused in the 2G spectrum case, including Sanjay Chandra, while underscoring that bail is the rule. Similarly, in 2019, the court granted bail to P Chidambaram in the INX Media case, despite the seriousness of economic offenses, affirming that the fundamental jurisprudence of bail remained unchanged.In November 2020, the Supreme Court extended interim bail to journalist Arnab Goswami, highlighting the critical nature of personal liberty and the principle of bail as the norm.CJI DY Chandrachud, in his address at the All India District Judges Conference in March, voiced concerns about the declining adherence to this principle in lower courts. He emphasized the need for judges to prioritize personal liberty and adhere to the established legal standard.","The 'bail is the rule, and jail is the exception' principle was first used in the 1977 landmark judgment of the 'State of Rajasthan vs Balchand alias Baliya' Case underscored that bail should be denied only in circumstances where there is a risk of the accused fleeing from justice, obstructing justice, repeating offenses, or intimidating witnesses.","https://static.toiimg.com/thumb/msid-112410190,imgsize-1682715,width-400,resizemode-4/112410190.jpg"
"But for my recurring groin injury, I could’ve thrown 4m further: Neeraj Chopra",https://timesofindia.indiatimes.com/sports/paris-olympics-2024/indiaparis/but-for-my-recurring-groin-injury-i-couldve-thrown-4m-further-neeraj/articleshow/112415339.cms,"‘I still have many good throws left in me’

PARIS: When Pakistan’s Arshad Nadeem cleared 92.97 metres with his effortless second throw in the javelin final Thursday night, the pressure was on Neeraj Chopra to better it.The Indian believed he could do it, but in his desperation to go past his Pakistani rival’s mark, he ended up with four foul throws. Trying to come to terms with his first loss to Nadeem since 2016, Neeraj, who threw 89.45m and bagged silver, said a nagging groin injury has been bothering him.“When I get ready for my throws, 70-80% of my focus is on my injury as I don’t want to aggravate it. My speed drops and so I start pushing myself. Before the last World Championships , the doctor had advised me to go for surgery . But I didn’t have the time. I couldn’t do it before Olympics either. But (now) I will have to make a big decision,” the current world champion said here after the event, adding that the same throw could have been four metres further had he been in perfect shape.Despite the disappointment of not winning back-to-back Olympic gold, many consider Neeraj the greatest-ever Indian athlete. He, though, remains humble. “It’s been a great journey after starting from a small village,” he said.Starting off, Neeraj never believed he would be on the Olympic podium one day. “I didn’t have the physique or the background. I don’t know how I reached this far,” Neeraj said.Talking about his injury, “It was in 2017 that I felt the groin pain for the first time and after that I had a lot of treatment. At the beginning of this year, everything was perfect. Maybe (I have to undergo) surgery… I will speak to my team and make a decision,” Neeraj said. The champion athlete had tried to play down the injury in the build-up to the Olympics, but now that it’s all down, he was ready to explain how difficult it was. “I was not able to throw using my full runway for the last couple of years.Normally, we make 40-50 throws in each session. But in my case the session itself was happening once every two or three weeks because of the injury scare. Till you throw, you are not working with the javelin and then it is very difficult to lift it. But now I’m throwing because I have the belief in my hand,” Neeraj said. The champion said he won’t rest till he manages the big throws.“I still have many good throws left in me. Until I achieve that, I won’t get peace. I now realise that mindset is very important going into an Olympics. I will surely do it if my body is willing to come along as my mind will be ready. If you can stay away from injury, then your throw gets bigger and bigger,” the 26-year-old said. Neeraj’s first throw on Thursday was a foul, but that didn’t affect his confidence.“After the foul in the first throw, I had confidence ahead of the second throw that I could do it. I was pushing myself a lot but the throw was good and I can tell you that I still have a lot of big throws left in me. For that I have to keep myself fit.” Asked what changed between the qualification when he appeared in great form and the final, the 26-year-old said: “In the qualification round it’s all easy and relaxed. But finals are different. I tried to keep my mind the same but it was hard. I tried to go really fast on the runway but it didn’t work.Even in qualification I was really close to the line but I stopped within one step.” The pulls and pressures of commercial commitments become part and parcel of a top athlete’s life, but Neeraj has learnt to take that in his stride.“After Tokyo, I gave priority to sports. With great difficulty we get a chance to endorse a brand. So if you get a chance then who will leave it? But I don’t want to overdo it, because if my body breaks, nothing will be left.” Neeraj was tired but his sense of humour was intact. “Motivating myself to talk in English is almost like being in competition with the best in the business,” he said as everyone burst into laughter.","Arshad Nadeem cleared 92.97 metres with his effortless second throw in the javelin final. Neeraj Chopra believed he could do it, but in his desperation to go past his Pakistani rival’s mark, he ended up with four foul throws. He said a nagging groin injury has been bothering him.","https://static.toiimg.com/thumb/msid-112416861,imgsize-38106,width-400,resizemode-4/112416861.jpg"
"Cabinet counters SC, rejects creamy layer in Dalit quota",https://timesofindia.indiatimes.com/india/cabinet-counters-sc-rejects-creamy-layer-in-dalit-quota/articleshow/112412751.cms,"Don’t implement SC/ST creamy layer ruling of top court, 100 MPs urge PM

NEW DELHI: Modi govt has rejected the recent Supreme Court ruling asking for exclusion of ‘ creamy layer ’ among Dalits from the purview of quotas, saying that doing so would be unconstitutional.“Recently, the Supreme Court gave a judgment on the issue of reservation. The SC has made some suggestions about SC/ST reservation in it. Today, under the leadership of PM Narendra Modi, wide discussions were held on this issue.And the well-thought-through opinion of the cabinet is that NDA govt is committed and dedicated towards the provisions of the Constitution of Babasaheb Ambedkar And as per provisions of Babasaheb Ambedkar, there is no provision of creamy layer in SC/ST reservation. Cabinet’s decision is that SC/ST reservation should be according to Babasaheb’s Constitution,” I&B minister Ashwini Vaishnaw said in what marked a swift rebuttal of the SC's landmark verdict.Significantly, Modi had signalled his govt's intent hours before the cabinet got down to discuss the issue by telling SC/ST MPs belonging to BJP that the apex court's verdict was only recommendatory and that govt was alive to their “genuine” concerns about it.The top court had held that exclusion of creamy layer, a reference to those whose previous generation had benefited from the SC quota, would help reservation benefits reach the truly disadvantaged instead of being monopolised by better-off sections among Dalits.The Cabinet on Friday asserted that there was no provision for a creamy layer in reservation for SCs and STs in the Constitution given by B R Ambedkar. The decision came in the wake of the recent SC ruling.The Aug 1 SC ruling on creamy layer came from the sole Dalit judge on the bench, Justice B R Gavai, with others — CJI D Y Chandrachud and Justices Vikram Nath, Pankaj Mithal, Manoj Misra and S C Sharma, concurring.However, the idea that the concept of ‘creamy layer’, so far limited to OBCs, needed to be extended to Dalits as well ran afoul of the dominant opinion. Dalit politicians, intellectuals & activists argued that likening OBCs to Dalits was a folly because of differences between the two categories and, also, that advancement in economic status of SCs did not erase the stigma or reduce the discrimination — the principal reason for bringing them under the cover of protective discrimination.“Met a delegation of SC/ST MPs today. Reiterated our commitment and resolve for welfare and empowerment of SC/ST communities,” Modi wrote on X. His remarks also reflected that the govt was looking into concerns expressed by community leaders regarding the apex court ruling.The delegation of more than 100 MPs, including ministers Kiren Rijiju, Sarbananda Sonowal, Arjun Ram Meghwal, Kamlesh Paswan, Birendra Kumar and senior functionaries like Faggan Singh Kulaste called on PM Modi and handed him a memorandum, expressing concern over the SC ruling. They urged that this decision should not be enforced.BJP MP Sikander Kumar said the PM had promised the govt would take MPs’ concerns into account. Kulaste said the PM supported their stance.","PM Narendra Modi had signalled his govt's intent hours before the cabinet got down to discuss the issue. Modi had told SC/ST MPs belonging to BJP that the apex court's verdict was only recommendatory and that govt was alive to their ""genuine"" concerns about it.","https://static.toiimg.com/thumb/msid-112412752,imgsize-1299483,width-400,resizemode-4/112412752.jpg"
"SC stays ban on hijab by Mumbai college, but says no burqa or niqab",https://timesofindia.indiatimes.com/india/sc-stays-ban-on-hijab-by-mumbai-college-but-says-no-burqa-or-niqab/articleshow/112412079.cms,"Should it not be left to girls to decide what they want to wear? asks SC

NEW DELHI: Supreme Court on Friday stayed till Nov 18 a Mumbai college ’s circular banning students from wearing hijab, cap or badge but allowed the educational institution to continue enforcing its circular banning wearing of burqa , niqab or stole in its premises.A bench of Justices Sanjiv Khanna and Sanjay Kumar issued notice to the college on a petition jointly filed by three students — Zainab Abdul Qayyum Choudhary, Nasreen Bano Mohd Tanzim Shaikh and Nazneen Mazhar Ansari — appealing against a Bombay HC order upholding the college circular.It said, “In the meanwhile, we stay clause 2 of the circular to the extent that it directs that no hijab, cap or badge will be permitted.”Clause 2 of the Mumbai college circular reads, “You (students) shall follow the dress code of college of formal and decent dress which shall not reveal anyone’s religion such as ‘no burkha, no niqab, no hijab, no cap, no badge, no stole, etc. Only full or half-shirt and normal trousers for boys and any Indian/western non-revealing dress for girls on the college campus. Changing rooms available for girls.”The Justice Sanjiv Khanna-led bench, however, orally clarified that no burqa can be worn by anyone inside the college or classrooms. The interim stay was confined to the ban on wearing hijab, cap or badge.Appearing for ‘ Chembur Trombay Educational Society ’, under which the college in question functioned, senior advocate Madhavi Divan said there were 441 Muslim women students pursuing various courses in the college and none of them, except the three petitioners, had any objection to the circular.She apprehended that allowing hijab, which is a barrier to female students getting educated and interacting with others, inside an education institution would be exploited by vested groups. “How will we stop anyone from wearing saffron shawls to the college?” she asked.Justice Khanna asked, “Will you stop a student wearing tilak from entering the college?” Going a step further, Justice Kumar asked, “Will you stop a student’s entry if she wears a bindi? Should it not be left to the girl to decide what she wants to wear? Where is your initiative to empower women by providing for no dress code? The less said the better.”The bench, while keeping its interim order in force till Nov 18, took note of Divan’s apprehensions about the interim order being exploited by vested elements and said, “If the interim order is misused, the college will be at liberty to move SC for appropriate orders.”The bench agreed with the circular that students must be dressed decently inside the college. Divan said the circular was religion neutral and intended not to reveal the religion of students. She said when the matter was being adjudicated by the Bombay HC, the college had resisted a Hindu outfit’s plea to intervene in the proceedings.Justice Kumar said, “You do not want the students’ religion to be revealed? Won’t their names reveal their religion? Will you give them numbers at the gate so that they are not addressed by their names but by numbers? What is all this?”Justice Khanna said a statutory appeal against the hijab ban was pending adjudication of a larger bench of the SC. A two-judge bench of the SC had on Oct 13, 2022, given a split verdict on the hijab ban in Karnataka govt educational institutions. That issue was referred to a larger bench and it has not been listed for hearing yet.Divan further added, “These (burqa, hijab and niqab) are barriers for students from getting education. We have created lockers. We told them if you like you can come wearing hijabs and keep these in lockers provided by the college. Change rooms are also provided.”Justice Khanna saw merit in Divan’s argument and said, “You may be somewhat right because the background they belong to, the family may be insisting that they must wear hijab and go to college and insist in not taking off the hijab.”Divan said, “Tomorrow how do we prevent students from coming to college wearing saffron shawls when some are permitted to wear niqabs? We cannot be a playground for religion or politics.”Justice Kumar continued in the same vein and asked, “When was the college established? How come suddenly you realised that there are different religions in the country? It is unfortunate that you come up with these kinds of instructions. After so many years of independence, you realise that there are different religions in this country? The college was established in 2008 and till now you had no difficulty and suddenly you have woken up?” When the bench said it was going to stay the circular, Divan pleaded for a detailed hearing. But the bench said it would hear her in Nov.When Divan complained that the college’s autonomy was being taken away, the bench said, “Your autonomy is not taken away but don’t insist that A or B should be coming dressed in a particular manner. The solution to a lot of things, as you said, is proper and good education. I certainly know that burqas can’t be permitted in a college. You can’t sit in a class wearing a burqa.”","Supreme Court stays Mumbai college’s circular banning students from wearing hijab, cap or badge. Justices Sanjiv Khanna and Sanjay Kumar issued notice to the college on a petition jointly filed by three students. The bench agreed with the circular that students must be dressed decently inside the college.","https://static.toiimg.com/thumb/msid-112412098,imgsize-1350397,width-400,resizemode-4/112412098.jpg"
"To prove a point, opposition plans to seek Vice-President’s ouster",https://timesofindia.indiatimes.com/india/to-prove-a-point-opposition-plans-to-seek-vice-presidents-ouster/articleshow/112411929.cms,"NEW DELHI: The antagonism between opposition parties and Rajya Sabha chairman Jagdeep Dhankhar has reached a point where the opposition is considering bringing a resolution for the removal of the vice-president, who also serves as chairman of the upper House , sources said.With the monsoon session ending on Friday, opposition parties are now planning to work on the modalities for this unprecedented move.Sources said 87 members have signed on the proposal to initiate action against Dhankhar.The parties have started collating documentary material of instances in the House where Dhankhar has been “partisan in his actions”. “He has also overruled norms and procedures to the advantage of the treasury benches, when the chair should be seen as a neutral umpire who must uphold the dignity of the constitutional post ,” a senior opposition member told TOI.A source said that about two days ago, leader of the House J P Nadda was informally informed that the opposition may submit a motion for Dhankhar’s removal.Asked about the plan, Congress’s Rajya Sabha MP Ajay Maken said, “All options are open, whatever is legal and in the rule book, whatever is in the Constitution, within the procedure of conduct, whatever provisions are there in the law, all options are open for us.”Sources said opposition parties were concerned that the microphone of the leader of opposition was allegedly being turned off repeatedly. “The opposition wants the House to be run by rules and conventions, and personal remarks against members are unacceptable,” a source said.The procedure for removal of the chairman has to begin with a resolution moved in the upper House to remove the vice-president, who acts in his dual role as chairman of Rajya Sabha. The resolution must be passed by 50% of the members present, plus one member, of those present in the House on that day. If the resolution gets passed, it has to go to Lok Sabha to be passed by a simple majority for it to get accepted, explained a senior RS MP. This procedure follows from Articles 67 (b), 92 and 100 of the Constitution.Going by this process, the resolution is certain to be defeated in the House, yet opposition members are contemplating moving on it “to prove the point that the chair has deviated from his role as a neutral umpire and hence disrespected the chair”.","The parties have started collating documentary material of instances in the House where Dhankhar has been “partisan in his actions’ The opposition parties are concerned that the microphone of the leader of opposition was allegedly being turned off repeatedly. “The opposition wants the House to be run by rules and conventions, and personal remarks against members are unacceptable,” a source said.","https://static.toiimg.com/thumb/msid-112411933,imgsize-1577950,width-400,resizemode-4/112411933.jpg"
