Article Title,Article Link,Article Text,Article Summary,Article Image
"'Suffered patiently ...': TMC MP Jawhar Sircar to resign over Kolkata doctor’s rape-murder, writes to Mamata",https://timesofindia.indiatimes.com/india/suffered-patiently-tmc-mp-jawhar-sircar-to-resign-over-kolkata-doctors-rape-murder-writes-to-mamata/articleshow/113164402.cms,"NEW DELHI: TMC MP Jawhar Sircar on Sunday wrote a letter to West Bengal chief minister Mamata Banerjee and expressed his intention to resign from the Rajya Sabha and quit politics altogether over Kolkata doctor's rape and murder that sparked nationwide outrage.Urging Mamata to do ""something"" to save the state, Sircar wrote, ""While thanking you sincerely for giving me such a great opportunity to represent the problems of West Bengal as an MP in the Rajya Sabha, I must inform you that I have decided to resign from parliament and also from politics altogether.""""I have suffered patiently for a month since the terrible incident at RG Kar Hospital, & was hoping for your direct intervention with the agitating junior doctors, in the old style of Mamata Banerjee.It has not happened & whatever punitive steps that the government is taking now are too little & quite late. I think normalcy may have been restored in this state much earlier if the caucus of the corrupt doctors was smashed & those guilty of taking improper administrative actions punished immediately after the scandalous incident happened,"" he added.Jawhar Sircar, who joined the Trinamool Congress (TMC) in 2021, expressed his shock at the open evidence of corruption involving former education minister Partha Chatterjee, which was widely reported on television and in print media. Sircar stated that he had made a public statement urging the party and government to address the issue of corruption, but he was met with heckling from senior party leaders.""But, in 2022, a year after I joined, I was quite shocked to see on TV and print the open evidence of corruption that the former education minister had indulged in. I made A public statement that corruption must be tackled by the party and government, but I was heckled by senior leaders in the party. I did not resign then as I had hoped that you would carry on your public campaign against 'cut money' and corruption that you had started a year earlier. Besides, everyone knows that there is no party anywhere that does not have a corrupt section. I was also persuaded by well-wishers to remain as MP in order to carry on the battle against a regime that is the greatest ever threat to Indian democracy and civil liberties,"" he said.""Though I carried on my task in parliament with fervour, I became increasingly disillusioned as the state government seemed quite unconcerned about corruption and the increasing strong-arm tactics of a section of leaders. As you know. I was the only prominent officer who was not given any plot in Salt Lake or anywhere by the previous regime - for speaking out too critically. I have grown up in a middle-class family in Kolkata and in my youth, I have travelled in suffocating public transport, hanging on to the footboards of buses. So,, after 41 years in the IAS, I can live without embarrassment in a small middle class flat, next to a big slum and drive a very ordinary 9 year old car. But I get amazed to see that several elected,"" he added.Reacting to Sircar's letter, TMC leader Kunal Ghosh said that the decision to quit was a personal one. While refraining from commenting directly on the contents of the letter, Ghosh expressed the party's alignment with the sentiments and questions raised by Sircar.""Jawahar Sarkar is a respected person... He is one of the best bureaucrats in the country. This is his personal decision, his personal letter, I cannot comment on it. He has full right to take any decision about himself,"" Ghosh said.We just want to say that we also agree with the spirit of his letter, the questions. We are with the sentiment of the society but whatever his stand is, it is his personal decision. We also demand justice. We stand with the society. We also demand justice,"" he added.The TMC government has faced intense criticism following the rape and murder of a trainee doctor at Kolkata's RG Kar Medical College and Hospital. The incident led to the arrest of a Kolkata Police civic volunteer and triggered widespread demonstrations by doctors and citizens alike, demanding justice and accountability.The Calcutta high court subsequently directed the CBI to investigate both the murder and the financial irregularities at the institution.",TMC MP Jawhar Sircar wrote a letter to West Bengal chief minister Mamata Banerjee. He expressed his intention to resign from the Rajya Sabha and quit politics altogether. The TMC government has faced intense criticism following the rape and murder of a trainee doctor.,"https://static.toiimg.com/thumb/msid-113164693,imgsize-927996,width-400,resizemode-4/113164693.jpg"
"Renukaswamy murder case: Damaged testicles, broken chest bone; court terms Darshan's girlfriend Pavithra ‘root cause’",https://timesofindia.indiatimes.com/city/bengaluru/renukaswamy-murder-case-damaged-testicles-broken-chest-bone-court-terms-darshans-girlfriend-pavithra-root-cause/articleshow/113141362.cms,"BENGALURU: The autopsy report of Chitradurga resident Renukaswamy , who was allegedly beaten to death by actor Darshan and his associates, revealed that he suffered 39 injuries, including a broken chest bone and damage to his testicles, leading to his death.The prosecution had submitted the autopsy report and the case diary with photographs to the 56th additional city civil and sessions court , which was hearing the bail petitions of four suspects, including Darshan 's girlfriend Pavithra Gowda, over the last fortnight.The court rejected all four petitions.According to the autopsy report, Renukaswamy also had a deep, bleeding head injury, a torn ear and suffered electric shocks. ""It can be seen from the photos that the deceased sustained injuries on almost all parts of the body. Some of the injuries appear to be severe. These facts show that the deceased had been tortured in an unimaginable manner... The blood/DNA of the deceased is alleged to have been found on the clothes and the slipper of the petitioner as per the FSL report,"" read the court's bail order.""If we peruse the allegations made against Pavithra Gowda, it can be seen that she is the root cause of the whole incident. There are allegations that she participated in the abduction and murder conspiracy. There are strong prima facie materials regarding her complicity in the alleged crime. The crime is so heinous and gruesome, and that itself is sufficient ground to reject the bail application,"" the judge opined.""Considering the gravity of the offence, I am of the opinion that if the petitioner is released on bail, it would give the wrong message to society,"" the judge stated while rejecting Pavithra's bail application. The court also rejected the bail pleas of Stonny Brook restaurant owner V Vinay, Girinagar resident Keshavamurthy and Chitradurga cab driver Anukumar.","Renukaswamy suffered 39 injuries, including a broken chest bone and damage to his testicles, leading to his death. The prosecution had submitted the autopsy report and the case diary with photographs to the 56th additional city civil and sessions court. Four suspects, including Darshan's girlfriend Pavithra Gowda, were denied bail.","https://static.toiimg.com/thumb/msid-113141449,imgsize-49056,width-400,height-225,resizemode-72/113141449.jpg"
"'Showing pistol asked free entry': Bouncers told to 'sit on their knees' in Delhi club, miscreants open fire",https://timesofindia.indiatimes.com/city/delhi/4-people-open-fire-after-entry-denied-into-pub-in-delhi/articleshow/113160095.cms,"NEW DELHI: Four miscreants opened fire after being denied free entry to Kanch Club , located in Jhilmil Industrial Area , on Thursday.The accused have been identified as Tanish and Shahrukh , while the other two remain unidentified, police said. The cops have recovered eight shells and two cartridges from the spot.A bouncer said in the complaint that on Thursday night, he was on duty at the gate of the club when a car stopped outside and a man got out.""Showing a pistol, he asked for free entry to the club. When the bouncers refused him free entry, the accused asked the bouncers to sit on their knees. When both the bouncers refused to do so, the miscreants got out of the car and opened fire, targeting the bouncer"", a police officer said.""Both the bouncers went inside the club. The criminals fled the crime scene,"" the officer added. A case has been registered at Seemapuri police station .",Four miscreants opened fire after being denied free entry to Kanch Club. The accused have been identified as Tanish and Shahrukh. The cops have recovered eight shells and two cartridges from the spot. A case has been registered at Seemapuri police station.,"https://static.toiimg.com/thumb/msid-113165223,imgsize-10162,width-400,height-225,resizemode-72/113165223.jpg"
Health department okayed demolition: Former RG Kar principal Sandip Ghosh,https://timesofindia.indiatimes.com/city/kolkata/health-department-okayed-demolition-sandip-ghosh/articleshow/113158167.cms,"Former RG Kar Medical College and Hospital's principal Sandip Ghosh (ANI)

Former R G Kar principal Sandip Ghosh , during interrogation, claimed that he secured approval of senior officials of health department before issuing the order on Aug 10 to demolish rooms near seminar hall where the PGT doctor's body was found on Aug 9.Ghosh told investigators that he had received a 10-point charter of demands from resident doctors on Aug 10 and that the order was to meet the demand for a duty room with proper toilet for departmental doctors.Ghosh told investigators that he had agreed to the demands and decided to go for the work. He has also claimed that he had to rush through the work as demands were urgent and the situation inside the hospital was sensitive.He said that he had also agreed to the demand of cop picketing on hospital premises, increasing number of CCTVs at the hospital and 24x7 monitoring through these CCTV cameras.",Former R G Kar principal Sandip Ghosh claimed that he secured approval of senior officials of health department before issuing the order. Ghosh told investigators that he had received a 10-point charter of demands from resident doctors on Aug 10 and that the order was to meet the demand for a duty room with proper toilet.,"https://static.toiimg.com/thumb/msid-113158200,imgsize-1497127,width-400,height-225,resizemode-72/113158200.jpg"
BJP releases 6th list of 10 candidates for upcoming J&K assembly polls,https://timesofindia.indiatimes.com/india/bjp-releases-6th-list-of-10-candidates-for-upcoming-jk-assembly-polls/articleshow/113165029.cms,"NEW DELHI: BJP on Sunday released the sixth list of ten candidates for the upcoming Jammu and Kashmir elections . According to the list, Bharat Bhushan will contest from the Kathua seat, while Abdul Rashid Khan, RS Pathania, and Naseer Ahmad Lone will contest from Sonawari, Udhampur East, and Bandipora, respectively.This comes after Union home minister Amit Shah unveiled the BJP's manifesto for the upcoming assembly elections during his two-day visit to Jammu and Kashmir.Shah highlighted that the party's primary objectives in the region would be to eliminate terrorism and separatism while promoting development, progress, and the empowerment of marginalized communities.In the 2014 Assembly elections, the People's Democratic Party (PDP) emerged as the largest party with 28 seats, followed by the BJP with 25 seats, the Jammu and Kashmir National Conference (NC) with 15 seats, and the Congress with 12 seats. However, the PDP-BJP coalition government collapsed in June 2018 when the BJP withdrew its support to the then-chief minister, Mehbooba Mufti.The upcoming elections will be the first in Kashmir since the abrogation of Article 370 and will take place after a decade-long gap. In December of last year, the Supreme Court directed the Centre to conclude the election process by September 30, 2024.Jammu and Kashmir is set to hold Assembly Elections on September 18, 25, and October 1, with the results scheduled to be announced on October 8.","Jammu and Kashmir is set to hold Assembly Elections on September 18, 25, and October 1, with the results scheduled to be announced on October 8. In December of last year, the Supreme Court directed the Centre to conclude the election process by September 30, 2024.","https://static.toiimg.com/thumb/msid-113165214,imgsize-1547093,width-400,resizemode-4/113165214.jpg"
"ED Seizes Rs 5,115 Crore Assets from Amtek Auto Group in Rs 27,000 Crore Bank Fraud Case",https://timesofindia.indiatimes.com/india/ed-seizes-gurugram-firms-rs-5k-cr-assets-in-rs-27k-cr-bank-fraud/articleshow/113159712.cms,"NEW DELHI: In a money laundering probe initiated at the direction of the Supreme Court , the ED on Saturday attached assets worth Rs 5,115 crore of Gurugram-based Amtek Auto Ltd . The company is accused of siphoning off Rs 27,000 crore from govt banks.The other group companies of the Amtek accused in the case of laundering bank funds are ARG Ltd, ACIL Ltd, Metalyst Forging Ltd and Castex Technologies Ltd, including promoter Arvind Dham .Earlier, the CBI had also registered an FIR in the case based on complaints from the IDBI Bank and Bank of Maharashtra . They had alleged that Dham and his group entities had diverted bank loans to shell companies. The Supreme Court had in Feb, while hearing a PIL against Amtek Auto, directed ED to investigate the case involving bank fraud by the company to the tune of Rs 27,000 crore.“The apex court had expressed concerns regarding the diversion of public money, emphasising the necessity of a comprehensive investigation by the ED, even if the banks concerned had settled the accounts,” the agency said in a statement.Dham was arrested on July 9 after ED probe revealed money trail where more than 500 shell companies were used to launder the bank funds of over Rs 5,000 crore after the accused had taken all his group entities to insolvency by manipulating financial statements and creating bogus assets. During the resolution of these companies, the banks had to take more than 80% haircut.Using his over 500 shell companies, Dham had invested in high value real estate and luxury properties, whose shareholdings were concealed in a “highly complex shareholding structure”, the ED said. These shell companies were holding assets, whose beneficial ownership has been revealed to be with Arvind Dham, the main promoter and beneficial owner of Amtek group, the agency said.The attached assets include 85 properties valued at Rs 2,675 crore, spread across 13 different states, including large commercial properties and farm houses in prime location in Delhi, 200 hectares of land in Maharashtra, hundreds of acres of land in Haryana and Punjab including Gurgaon, Chandigarh, Rewari and Panchkula, industrial lands, residential plotted colonies, flats, etc.“In addition, the attachment also includes shares worth Rs 2,353.46 crore in both listed and unlisted companies. Some of these companies include Alliance Integrated Metaliks Ltd, Newtime Infrastructure Ltd, etc,” ED said.All these assets are identified as direct proceeds of crime and are held through several companies beneficially owned by Arvind Dham.","The ED attached assets worth Rs 5,115 crore of Gurugram-based Amtek Auto Ltd. The company is accused of siphoning off Rs 27,000 crore from govt banks. The other group companies of the Amtek accused in the case are ARG Ltd, ACIL Ltd, Metalyst Forging Ltd and Castex Technologies Ltd.","https://static.toiimg.com/thumb/msid-113159719,imgsize-546850,width-400,resizemode-4/113159719.jpg"
Bangladesh plans Sheikh Hasina's extradition to put her on trial for 'mass killings',https://timesofindia.indiatimes.com/india/bangladesh-plans-sheikh-hasinas-extradition-to-put-her-on-trial-for-mass-killings/articleshow/113167561.cms,"NEW DELHI: The newly formed interim government in Bangladesh will be ramping up its effort to bring back ousted ex-PM Sheikh Hasina , who has taken refuge in India after a mass uprising that forced her to flee Dhaka on August 5.Muhammad Yunus-led interim government, under the extradition treaty with India, plans to bring Hasina back ""to try her for mass killings during the student-led protests in July and August"".Md Tajul Islam, the newly-appointed chief prosecutor of Bangladesh's International Crimes Tribunal (ICT), has said that Dhaka will file an application with ICT to issue an arrest warrant against Hasina.""We will file an application with the International Crimes Tribunal, when it resumes functions, to issue arrest warrants against all the absconding accused including Sheikh Hasina in connection with the cases filed for mass killing and crimes against humanity,"" Tajul Islam was quoted as saying by PTI at a press briefing on the ICT premises in Dhaka.He further said: ""Information, documents and evidence against the accused persons will have to be collected from across the country and those will have to be compiled, examined and placed properly before the tribunal, which is very much challenging and huge task.""According to Nurjahan Begum, the health adviser of the interim government, the protests against the Hasina-led government resulted in the deaths of over 1,000 individuals and left hundreds wounded.Last month, Bangladesh's ICT began a probe against Hasina and nine other individuals on allegations of genocide and crimes against humanity that occurred between July 15 and August 5, during the mass movement led by students.Earlier, Yunus's foreign affairs adviser Md Touhid Hossain had said the interim government will do whatever it takes to get deposed PM Sheikh Hasina back home to face justice.""If our legal system wants, we will definitely try to bring her back. There is an agreement (with India) and legal processes. It is better not to speculate,"" he had told reporters.","Muhammad Yunus-led interim government, under the extradition treaty with India, plans to bring Hasina back ""to try her for mass killings during the student-led protests in July and August"" Dhaka will file an application with ICT to issue an arrest warrant against Hasina.","https://static.toiimg.com/thumb/msid-113168095,imgsize-622450,width-400,resizemode-4/113168095.jpg"
"Director forced me to sit on lap, kissed me: Actor plans legal step",https://timesofindia.indiatimes.com/city/kolkata/director-forced-me-to-sit-on-lap-kissed-me-actor-plans-legal-step/articleshow/113174050.cms,"Was enraged to see Arindam Sil in ‘Reclaim the Night’ rally, says actor

KOLKATA: The actor who alleged that director Arindam Sil kissed her in public during a film shoot without her consent said she was appalled to see Sil taking part in a ' Reclaim the Night ' demonstration. The actress has decided to seek legal assistance. Leena Gangopadhyay , the chairperson West Bengal Commission of Women ( WBCW ), told TOI: ""The actor told us that since she was humiliated publicly, she wanted a public apology in writing.Sil had initially wanted to say that it was an unintentional act. But the actor protested since she said that the director had even asked if she had liked being kissed. Then he agreed to rephrase the letter. There is no question of us forcing him to delete any word.""Reacting to the incident, Sil told TOI: ""There is nothing on my mind right now. I am extremely clear in my conscience. I am sorry if she has felt bad for any unintentional act of mine. I am seeking expert advice. For the rest, I leave it to time. People have the right to say whatever they want to. But I guess they don't know the truth.""The incident at a resort occurred on April 3 on the sets of 'Ekti Khunir Sandhane Mitin'.""First, he demanded that I sit on his lap. I vehemently refused. But he commanded in an authoritative tone, 'I am saying - sit!' He was so intimidating I didn't know how to say no. After I sat, he kissed me on my cheek. I was shocked but didn't know what to do. I swiftly moved away, while he feigned innocence, as if nothing had occurred... . People were smiling as if it was some kind of a joke. I told the director about it when he went back in front of the monitor. His reply was: 'Didn't you like it?'"" she claimed.The actress said it is ""deplorable"" to witness Sil apologize to her in writing and subsequently deceive the media by claiming that he had kissed her accidentally. "" If a predator can go to this length after apologising to me, I will have to seek legal advice.""""The production house assured me that such an incident would not recur and that they would guarantee the presence of someone from their end on the floor to ensure my security. They entrusted me with the final decision regarding whether I desired to proceed with the shoot. With that assurance, I returned to shoot. It was a traumatic experience for me, but as a professional, I didn't halt the shooting since it would impact numerous others,"" she said.The actor lodged a complaint with the WBCW in July. The initial hearing took place on July 21. She got the courage to speak out to TOI after the Directors Association of Eastern India (DAEI) suspended Sil. ""The Reclaim the Night protests has also instilled confidence in me to speak out. There is an outpouring of messages from individuals who have supported me.""Subrata Sen, the president of DAEI, told TOI that Sil's suspension still implies that he can direct films. ""However, he shall not be a part of the guild. The Federation of Cine Technicians and Workers of Eastern India has a policy that prohibits technicians from collaborating with directors who do not hold membership in the guild.""","Actress claims Arindam Sil kissed her in public during a film shoot without her consent. She was appalled to see Sil taking part in a'Reclaim the Night'demonstration. The actress has decided to seek legal assistance. Sil says: ""There is nothing on my mind right now. I am extremely clear in my conscience""","https://static.toiimg.com/thumb/msid-113174055,imgsize-1039817,width-400,height-225,resizemode-72/113174055.jpg"
How mafia split a sacred river into two to carry on illicit trade,https://timesofindia.indiatimes.com/city/lucknow/how-mafia-split-a-sacred-river-into-two-to-carry-on-illicit-trade/articleshow/113174416.cms,"How mafia split a sacred river into two to carry on illicit trade

LUCKNOW: The bulldozer grunts on the shore of Ganga in UP's Unnao , baring its teeth. There are trucks and tractors waiting to be loaded with sand, and more almost certainly on the way.This is how it is here, where the sand mining mafia built a road that cuts through Ganga at Sumerpur Ghat. This unauthorised road has split the sacred river into two streams, creating a pathway for transporting their illicit cargo under cover of night.On another road of Unnao, shadows of a dark tragedy loom large over the Tripathi household.Shubham Mani Tripathi, a young journalist in his mid-20s, was gunned down in cold blood on June 19, 2020. His crime? Publishing a series of investigative articles exposing illegal activities of Kanhaiya Awasthi and his wife Divya Awasthi - known as ""bhu mafia"".""My brother was killed for speaking the truth,"" Shubham's elder brother Rishabh Mani said. ""In a town where silence once protected the corrupt, Shubham's voice - though silenced - was an example of courage and resistance. The least we can do is to ensure that his killers pay for their crimes."" Just three months before his murder, Shubham had married on Feb 26, 2020, marking what should have been the beginning of a new chapter in his life. Shubham's father died in March 2020, deeply affected by the threats his son received from the Awasthis.The family's home is now under round-the-clock security, with an armed policeman permanently stationed there - a grim reminder of the threats that still hang over them. But the administration provided no financial assistance or job offers.At 30, Rishabh runs a small cafe and online service centre. ""After my brother's death, I was responsible for managing everything for the family. My priority was seeking justice for Shubham and ensuring the killers were held accountable. I couldn't afford to spend time pursuing financial aid from govt offices.""The road to justice has been long and arduous. Of the 16 charged in connection with Shubham's murder, only five are currently behind bars. The incarcerated Awasthi couple's assets and properties, worth Rs 15 crore, have been seized. The Supreme Court 's recent rejection of Kanhaiya's bail application has brought some solace to the Tripathi family, but the pain of their loss remains ever-present.","Shubham Mani Tripathi, a young journalist in his mid-20s, was gunned down in cold blood on June 19, 2020. His crime? Publishing a series of investigative articles exposing illegal activities of Kanhaiya Awasthi and his wife Divya. Of the 16 charged in connection with Shubham's murder, only five are currently behind bars.","https://static.toiimg.com/thumb/msid-113174417,imgsize-1219556,width-400,height-225,resizemode-72/113174417.jpg"
