Article Title,Article Link,Article Text,Article Summary,Article Image
"Rohit Sharma: 'In T20, we don't need fifties and hundreds': Rohit Sharma reveals Team India's batting template at T20 World Cup",https://timesofindia.indiatimes.com/sports/cricket/icc-mens-t20-world-cup/in-t20-we-dont-need-fifties-and-hundreds-rohit-sharma-reveals-team-indias-batting-template-at-t20-world-cup/articleshow/111200449.cms,"NEW DELHI: Indian skipper Rohit Sharma emphasized the importance of exerting pressure on bowlers over individual milestones like centuries and fifties in T20 cricket .This statement followed India's dominant 50-run win against Bangladesh in their ICC T20 World Cup Super Eights clash on Saturday. Hardik Pandya 's all-round performance and Kuldeep Yadav 's three-wicket haul were pivotal in securing the victory.""I have been talking about this for a long time now (playing aggressively). It is about going there and putting that into work. Considering everything, we played really well, adapted to the conditions. There's a little bit of a wind factor here, overall we are very smart, overall we were good with bat and ball,"" Rohit was quoted as saying by ANI during the post-match presentation.Rohit elaborated on the role of all eight batters in the team and stressed the importance of their collective effort in achieving high totals.""All eight batters need to play their role, whatever it is. We saw one guy get 50 and we got 197, in T20 I do not believe we need to get fifties and hundreds, what matters is the pressure you put on the bowlers. All the batters from the word go played like that and that's how we want to play as well. There is a lot of experience in the squad and we back them,"" Rohit added.Speaking specifically about Hardik Pandya's contribution, Rohit highlighted his significance in the team's lineup.""I mentioned in the last game as well, him batting well puts us in a good stead. We want to finish well after the top 5, 6, Hardik being Hardik we know what he is capable of. He is a very important player for us, if he can keep doing that, it will put us in good positions.""Rohit's remarks come at a crucial time as Team India advances in their pursuit of a semifinal spot in the tournament. The squad's balanced performance with both bat and ball played a key role in their victory over Bangladesh.",India skipper Rohit Sharma emphasizes importance of exerting pressure on bowlers over individual milestones. India beat Bangladesh by 50 runs in their ICC T20 World Cup Super Eights clash on Saturday. Hardik Pandya's all-round performance and Kuldeep Yadav's three-wicket haul were pivotal in securing the victory.,"https://static.toiimg.com/thumb/msid-111200447,imgsize-49218,width-400,resizemode-4/111200447.jpg"
"'Abhi abhi aya hai, aada maarne de...': Rohit Sharma's hilarious reply to Kuldeep Yadav - Watch",https://timesofindia.indiatimes.com/sports/cricket/icc-mens-t20-world-cup/abhi-abhi-aya-hai-aada-maarne-de-rohit-sharmas-hilarious-reply-to-kuldeep-yadav-watch/articleshow/111199618.cms,"T20 WORLD CUP:

|

Kya hai, khelne de na yaar, abhi abhi aya hai aada maarne de na, ek out hua hai aada maarne de

NEW DELHI: India captain Rohit Sharma is famous for speaking in his typical Mumbaiya style on the field and more often than not his words are caught on the stump mic.It was in the Test series against England earlier this year that his hilarious ""Jo bhi garden mein ghoomega…"" had the internet rolling with laughter.Another of Rohit's 'precious gems' was caught on the stump mic during the India-Bangladesh Super 8 clash on Saturday.The incident occurred in the 14th over of the Bangladesh run chase when Kuldeep Yadav had just dismissed Shakib Al Hasan after being hit for a six.The new batsman Mahmudullah was foxed by a Kuldeep googly first ball that just missed the top of his off-stump.Kuldeep then seemed to have asked for a change in the fielding placements.To this, Rohit, who had walked upto wicket-keeper Rishabh Pant , replied, """" (What's it, let him play across the line, he has just come to the crease after a dismissal, let him play across the line).Rohit walked back to his fielding spot nonchalantly to his fielding spot and Mahmudullah then flicked the next ball to deep mid-wicket for a single.Kuldeep took 3/19 as India beat Bangladesh by 50 runs riding on Hardik Pandya 's all-round heroics.India next play Australia on Monday in their last Super Eights clash.",Rohit Sharma's words caught on the stump mic during India-Bangladesh Super 8 clash. Incident occurred in the 14th over of the Bangladesh run chase. India beat Bangladesh by 50 runs riding on Hardik Pandya's all-round heroics.,"https://static.toiimg.com/thumb/msid-111199611,imgsize-32002,width-400,resizemode-4/111199611.jpg"
'Sirf aapke sentiments hurt huye...?': Ahmad Shahzad slams Babar Azam - Watch,https://timesofindia.indiatimes.com/sports/cricket/icc-mens-t20-world-cup/sirf-aapke-sentiments-hurt-huye-ahmad-shahzad-slams-babar-azam-watch/articleshow/111200005.cms,"T20 WORLD CUP:

|

NEW DELHI: Amidst reports that Babar Azam is preparing to take legal action against YouTubers and former cricketers who have accused him of misconduct during the T20 World Cup , another video is doing the rounds where former cricketer Ahmad Shahzad is criticising the Pakistan cricket captain for the same.During a talk show in Pakistan Shahzad says, ""Former players that he (Babar) is talking about, they should also file a case on him asking when you had a team for 5 years, where have you brought the team, to the 7th spot. Then the 25 crore fans whose sentiments also got hurt, they should also ask what results have you produced.""Shahzad continues, ""The domestic cricketers whom you didn't select for the team, you went ahead with one group, kept on saying that this group will win you matches, but that didn't happen, and those domestic cricketers who didn't get a chance in the past 5 years, they should also file a case and ask questions. They should also ask Babar how you kept adjusting your friends in the team, who you turn into bowlers when they can't bat, turn into batsmen when they can't bowl, and when they do nothing, you adjust them by making them fielders.""Shahzad adds, ""Then you (Babar) should ask that the people who used to criticize you are now in the team, you are their captain, then your sentiments didn't get hurt? Then the selectors who 3 months ago used to say that you don't know captaincy, you are not captaincy material, now you are saying 'yes yes' to them, then your sentiments didn't get hurt? There also you should have filed a case.""Shahzad retorts, ""After losing 3 World Cups, 2 Asia Cups, you (Babar) were made captain again after 2 months, you should have asked the question how you were made the captain? Is it only you whose sentiments are getting hurt, not of the fans? We always tell the public the truth, we don't body shame anyone, we don't even take wrong names, we talk only about cricket,Pakistan cricket. What have you done? You always try to find an escape route.""""Even great players like Messi and Ronaldo , who have a huge fan following, are criticized. Even the effigies of Messi were burnt recently, shoes were hurled at their photos. But they are sportsmen, they take all this in their stride. You should also take the criticism positively, but instead you are saying you will file defamation cases against former cricketers. We were also criticized, so much that we didn't get the third match after two bad matches. We didn't say anything to anyone. You get paid to do well. Even the cameraman here has a job to do, even if he doesn't do it properly, he is also answerable,"" Shahzad concludes.Babar and the Pakistan team faced intense criticism following their disappointing performance in the tournament, which saw them exit during the group stage. This criticism, which targeted Babar in particular, has left the captain disheartened.A report had revealed that a coordinated social media campaign aimed at defaming Babar was launched during the World Cup. The PCB 's legal department is now investigating the defamatory statements made by several YouTubers and former cricketers.Pakistan, who were runners-up in the previous edition of the T20 World Cup, failed to advance beyond the group stage in this year's tournament, prompting a wave of scrutiny and criticism from fans and commentators alike.",Babar Azam is preparing to take legal action against YouTubers and former cricketers who have accused him of misconduct during the T20 World Cup. Former cricketer Ahmad Shahzad is criticising the Pakistan cricket captain for the same. Pakistan failed to advance beyond the group stage in this year's tournament.,"https://static.toiimg.com/thumb/msid-111199982,imgsize-62962,width-400,resizemode-4/111199982.jpg"
"T20 World Cup: Hardik Pandya, Kuldeep Yadav shine as India thrash Bangladesh in Super 8s, move closer to semis",https://timesofindia.indiatimes.com/sports/cricket/icc-mens-t20-world-cup/t20-world-cup-hardik-pandya-kuldeep-yadav-shine-as-india-thrash-bangladesh-in-super-8s-move-closer-to-semis/articleshow/111195440.cms,"NEW DELHI: Hardik Pandya 's stellar all-round performance and Kuldeep Yadav 's clever bowling helped India secure a convincing 50-run victory against Bangladesh in their second Super 8 match of the T20 World Cup on Saturday, positioning them favorably for a semifinals berth. India scored 196 for five, thanks to contributions from Virat Kohli , Shivam Dube, and Hardik Pandya. In response, Bangladesh struggled to 146/8 in their 20 overs.Virat Kohli (37 off 28) found some rhythm at the crease before Shivam Dube (34 off 24) and Hardik Pandya (50 not out off 27) pushed India to their highest total at the venue. Pandya provided the final flourish, completing his half-century off the last ball of the innings.India’s bowlers ensured that Bangladesh never posed a serious challenge in the steep run-chase. Kuldeep Yadav (3/19) made the Bangladesh batters look clueless with his mix of googlies and stock deliveries. Jasprit Bumrah (2/13 in four overs) also offered a frugal bowling effort.""Bangladesh skipper Najmul Shanto (40 off 32) played some attacking shots including two sixes over fine leg off Hardik but did not get support from others as the batters let the team down once again.""After Litton Das (13 off 10) pulled Hardik for a six over deep mid-wicket, he was caught at deep square leg the next ball. Litton’s premeditated walk across the stumps led to his dismissal.Kuldeep quickly made an impact by getting rid of opener Tanzid Hasan (29) with a wrong’un, trapping him leg before wicket. Towhid Hridoy, Bangladesh's standout batter so far, went for a sweep against Kuldeep but missed it completely to be adjudged LBW.Bangladesh, at 76 for three in the 12th over, could only delay the inevitable as wickets kept falling.India’s innings was buoyed by a strong start from skipper Rohit Sharma (23 off 11) and Virat Kohli. They allowed themselves to play freely unlike in previous games. Bangladesh's strategy of starting with spinners from both ends against the two right-handers was unusual.Rohit hit three fours and one six before mistiming a shot to be caught. Kohli’s shots included a notable 94m six off Mustafizur Rahman. Kohli also launched leg-spinner Rishad Hossain for a straight six but was later deceived by a slow off-cutter from pacer Tanzim Hasan.Suryakumar Yadav also fell in quick succession, caught after a delivery jumped off the length and kissed his gloves. This left India at 83 for three in 10 overs."" Rishabh Pant (36 off 24) then brought the momentum back in India's favour by collecting two fours and a six over deep midwicket off Mustafizur who had a rare off day.""Pant attacked Rishad Hossain in the next over but was dismissed by the reverse sweep for the second consecutive innings. Dube and Hardik then forged a 53-run stand to propel the innings forward.Hardik’s innings included four boundaries and three sixes. Dube targeted the deep midwicket boundary against spinners and hit Tanzim Hasan for a six down the ground.India's victory against Bangladesh marked their second straight win in the Super 8s. They will face Australia, the only other unbeaten team, in their final Super 8 fixture in St Lucia on Monday.Bangladesh's batting wobbles continued despite their captain’s efforts, making it difficult for them to chase down India’s substantial total. Their inability to support Shanto was evident throughout the innings. After Litton Das’s brief cameo, there was little resistance.Kuldeep Yadav and Hardik Pandya emerged as the heroes for India. Kuldeep’s introduction in the Caribbean leg of the competition has paid off well for the team. Hardik's all-round skills shined through, setting up a competitive total and then contributing with the ball.For India, this win edges them closer to a semifinals spot with a key challenge against Australia forthcoming. Their strategy to utilize both fast bowling and spin showcased a well-rounded and adaptable side.In summary, India’s overall strong performance led by key players secured a significant victory against Bangladesh, moving them a step closer to the semifinals in the T20 World Cup.","India beat Bangladesh by 50 runs in their second Super 8 match of the T20 World Cup. India scored 196 for five thanks to contributions from Virat Kohli, Shivam Dube, and Hardik Pandya. In response, Bangladesh struggled to 146/8 in their 20 overs.","https://static.toiimg.com/thumb/msid-111195578,imgsize-115246,width-400,resizemode-4/111195578.jpg"
"Mohammad Hafeez slams Jos Buttler's IPL remark. Michael Vaughan says, I actually…",https://timesofindia.indiatimes.com/sports/cricket/news/mohammad-hafeez-slams-jos-buttlers-ipl-remark-michael-vaughan-says-i-actually/articleshow/111189817.cms,"NEW DELHI: Former Pakistan captain Mohammad Hafeez criticized England skipper Jos Buttler for his recent comments suggesting that no international cricket should be scheduled during the IPL. Buttler, who had to leave IPL 2024 before the playoffs to represent England in a T20I series against Pakistan, expressed his opinion during a press conference ahead of the ICC Men's T20 World Cup 2024.Buttler stated, ""It's my personal opinion that there shouldn't be any international cricket that clashes with the IPL. These games have been in the calendar for a long time, and leading into a World Cup, your No. 1 priority is playing for England and performing for England. I feel like this is the best preparation.""The comments sparked a debate on the Club Prairie Fire podcast, where Hafeez asked Michael Vaughan and Adam Gilchrist for their views. Vaughan supported Buttler's stance, acknowledging the growing significance of the IPL. He remarked, ""I actually agree with him. IPL has become so big, and the players are so well rewarded for participating.""Hafeez interrupted Vaughan by questioning whether it was fair for players to prioritize IPL over national duties. Vaughan responded, ""It is the nature of the beast in 2024. Whether it is absolutely morally right is a very good question. But I think IPL is so big now that it is very hard for international boards to compete with it.""Vaughan also noted the potential impact on the County Championship , with many players likely to miss matches due to IPL commitments. ""Pakistan Super League (PSL) will compete with IPL next year, which will be interesting. It will affect the English summer more than any other country because so many players will be involved in both tournaments,"" the former England skipper added.Adam Gilchrist echoed Vaughan's sentiments, pointing out that domestic cricket will inevitably be compromised due to IPL. He mentioned, ""Domestic cricket is going to be compromised within the more established cricketing nations. For instance, the Sheffield Shield final overlaps with the IPL, so players will have to make a choice.""Hafeez found Buttler's remarks surprising and emphasized the importance of national pride. He commented, ""To me, that was a shocking statement from the captain of England because representing your country is the biggest prize you play for. If you are compromising and saying that national pride should not be there due to the IPL contract, I think that's not right.""","Former Pakistan captain Mohammad Hafeez criticized England skipper Jos Buttler for his recent comments. Buttler suggested that no international cricket should be scheduled during the IPL. The comments sparked a debate on the Club Prairie Fire podcast, where Hafeez asked Michael Vaughan and Adam Gilchrist for their views.","https://static.toiimg.com/thumb/msid-111190956,imgsize-92590,width-400,resizemode-4/111190956.jpg"
Historic! Bangladesh's Shakib Al Hasan becomes first bowler ever at T20 World Cups to...,https://timesofindia.indiatimes.com/sports/cricket/icc-mens-t20-world-cup/historic-bangladeshs-shakib-al-hasan-becomes-first-bowler-ever-at-t20-world-cups-to-/articleshow/111193885.cms,"NEW DELHI: Bangladesh's veteran Shakib Al Hasan on Saturday scripted history, becoming the first bowler ever to claim 50 wickets at T20 World Cups.Featuring in the 9th edition of the cricketing extravaganza, Shakib achieved the milestone in his 42nd game.Ending skipper Rohit Sharma 's 11-ball 23 cameo amid India's flying start, left-arm spinner Shakib got to the 50-wicket mark at the World Cup.As Rohit tried to slog a Shakib full delivery away on the on-side, he got a thick top-edge which as the ball shot straight up. Jaker Ali judged the skier really well to hand his teammate the landmark wicket.In the 42 T20 World Cup matches, Shakib has an average of 19.38 and a superb strike rate of 6.81 with the ball.The list of most wickets, leader Shakib is way ahead of others. The now retired Pakistan skipper Shahid Afridi sits second on the list with 39 World Cup wickets in 34 outings.Sri Lanka's Lasith Malinga is third on the list with 38 wickets in 31 matches followed by countrymate Wanindu Hasaranga (37 wickets in 19 matches).Pakistan's Saeed Ajmal occupies the fifth spot with 36 scalps in 23 games.Earlier, Bangladesh skipper Najmul Hossain Shanto won the toss and sent India in to bat in their second Super Eight clash.Victory for India would put them on the brink of the semi-finals while another loss for Bangladesh would effectively rule them out of contention for the last-four.India beat Afghanistan by 47 runs in their Super Eight opener in Bridgetown while Bangladesh lost to Australia by 28 runs in a rain-hit clash in Antigua.India, the 2007 champions, named the same team that defeated Afghanistan on Thursday. For Bangladesh, seamer Taskin Ahmed is replaced by Jaker Ali as the team look to shore up a struggling batting line-up.India have won all four T20 World Cup clashes against their Asian rival and boast an overall 12-1 head-to-head record.",Shakib Al Hasan becomes first bowler ever to claim 50 wickets at T20 World Cups. Shakib achieved the milestone in his 42nd game. India beat Afghanistan by 47 runs in their Super Eight opener. Bangladesh lost to Australia by 28 runs in a rain-hit clash in Antigua.,"https://static.toiimg.com/thumb/msid-111193876,imgsize-58654,width-400,resizemode-4/111193876.jpg"
"India vs Bangladesh, T20 World Cup: If India decide to drop Shivam Dube...",https://timesofindia.indiatimes.com/sports/cricket/icc-mens-t20-world-cup/india-vs-bangladesh-t20-world-cup-if-india-decide-to-drop-shivam-dube-/articleshow/111185787.cms,"T20 WORLD CUP:

|

WATCH VIDEO

Shivam Dube 's place in India's playing eleven at the ongoing T20 World Cup is facing immense scrutiny after the all-rounder's failure to impress with the bat and under-utilization as a bowler, with fans and experts drawing logical conclusions for him to be replaced with either Sanju Samson or Yashasvi Jaiswal .Dube earned a call-up for the T20 World Cup on the back of his fine batting form for the Chennai Super Kings (CSK) during IPL 2024; however, he hasn't yet succeeded in replicating that in this tournament.It was Dube's ability to hit spinners for sixes in the middle overs during the IPL that impressed Rohit Sharma and the BCCI selectors to include him in the 15-member squad, while keeping the likes of Shubman Gill and Rinku Singh among the reserves.But in four innings so far in this World Cup, Dube has scored just 44 runs, with a highest of 31 not out against USA. Add to that Rohit's reluctance in using him as a bowler, and it gives more reasons for him to be replaced.Dube has so far been asked by Rohit to bowl just one over, which he delivered in the match against USA and conceded 11 runs. Interestingly, in IPL 2024 as well he bowled just one over.If India decide to drop him, middle-order batsman Samson fits the bill more than Jaiswal unless Rohit and coach Rahul Dravid decide to bring Kohli back to No. 3 and draft Jaiswal in to open with the skipper.Both Samson and Jaiswal have so far warmed the bench in this T20 World Cup, while the team management decided to push Kohli up a spot to partner Rohit as opener. The move, however, hasn't worked, with Kohli's four innings in the tournament so far reading 1, 4, 0 and 24.""I would love to see Yashasvi Jaiswal getting a look in and opening with Rohit, with Virat at number three,"" said India pacer S Sreesanth on Star Sports.""The player who might miss out will be Shivam Dube. I have been telling this from day one of the World Cup, much before it started, if Dube is not bowling his one or two overs, then either it should be Samson in the middle, who can change the game, or it should be Jaiswal opening the batting and Virat at number three,"" he added.The other thought is that with Bangladesh inclined to us a spin-heavy bowling unit, India might give Dube one more game to show his batting skills; but that line of thought can also be debated because Samson too is a good player against spin.A lot to ponder for Rohit and Dravid.",Shivam Dube's place in India's playing eleven is facing immense scrutiny. The all-rounder has failed to impress with the bat and under-utilized as a bowler. Dube earned a call-up for the T20 World Cup on the back of his fine batting form.,"https://static.toiimg.com/thumb/msid-111185875,imgsize-44026,width-400,resizemode-4/111185875.jpg"
'Don't think of…': Ravi Shastri's million-dollar advice for Team India,https://timesofindia.indiatimes.com/sports/cricket/icc-mens-t20-world-cup/dont-think-of-ravi-shastris-million-dollar-advice-for-team-india/articleshow/111191413.cms,"NEW DELHI: Former coach Ravi Shastri has come up with a piece of advice for Team India to implement in their upcoming T20 World Cup matches. He emphasized the importance of focusing on each game individually and not getting carried away by thoughts of lifting the World Cup.Shastri also showered praise on Jasprit Bumrah , declaring him the best bowler across all formats in the world.Bumrah delivered his career-best performance in T20Is, taking three wickets and conceding only seven runs in his four overs during India's Super 8 clash against Afghanistan.""He is the most important bowler, because his ability to take wickets, to read situations, and the pitches don't matter to him. He's got the variety, he got the new ball for the first time (against Afghanistan), because Mohammed Siraj wasn't playing and immediately, second ball, a slower ball to get Gurbaz out. It shows that he thinks very quickly and adapts to conditions,"" Shastri said in a video shared by ICC.""He saw in the previous over fromArshdeep Singh , the batsman was giving the charge, and he immediately varied the pace and got his man, so he's a terrific competitor and that's why he's probably the best across all formats of the game, that's not easy. He's skilful, he has all the tools in the business, but the ability to read a batsman and adapt to the conditions,"" the former Indian coach stated on what separates Bumrah from others.Additionally, the former India all-rounder advised the Indian players to focus on playing one game at a time until they reach the final.""Not think of that trophy, play one match at a time and go out and play fearless cricket. If you reach the final, whatever happens there, happens there. One match at a time,"" he added.",Ravi Shastri has given his advice to Team India ahead of the T20 World Cup. The former coach said that the players should focus on each game individually. He also said that Jasprit Bumrah is the best bowler across all formats.,"https://static.toiimg.com/thumb/msid-111191276,imgsize-35462,width-400,resizemode-4/111191276.jpg"
