Article Title,Article Link,Article Text,Article Summary,Article Image
"UEFA Euro 2024 Points Table: Germany, Spain, England, Netherlands, Romania and Turkey top their groups as Austria win over Poland",https://timesofindia.indiatimes.com/sports/football/uefa-euro-2024/uefa-euro-2024-points-table-germany-spain-england-netherlands-romania-and-turkiye-top-their-groups-as-austria-win-over-poland/articleshow/111185905.cms,"Group A of EURO 2024

Group B of EURO 2024

Group C of EURO 2024

Group D of EURO 2024

Group E of EURO 2024

Group F of EURO 2024

NEW DELHI: Austria 's Euro 2024 knockout stage aspirations received a significant boost on Friday as they secured an impressive 3-1 victory over Poland. Despite Robert Lewandowski's ineffective substitute appearance, Poland struggled to make an impact. Ralf Rangnick's Austrian side is now in a strong position to qualify for the last 16, needing only to avoid defeat against the Netherlands in their final Group D encounter on Tuesday.Poland's chances of progressing have diminished, as they can no longer secure a top-two finish. Their only hope lies in defeating France and relying on other results to qualify as one of the four best third-placed teams. However, their fate may be sealed before that match if the Netherlands fail to overcome France later on Friday.Austria took a well-deserved early lead through Gernot Trauner's header, but Poland equalized in the 30th minute courtesy of Krzysztof Piatek, who had missed their opening defeat to the Netherlands. Despite Lewandowski's introduction with half an hour remaining, he had little impact as Poland edged closer to elimination. Christoph Baumgartner restored Austria's advantage following a well-worked team move, and Marko Arnautovic sealed the victory with a penalty in the 78th minute.Austria, who reached the knockout stage of a major tournament for the first time since 1954 at Euro 2020, will guarantee their progression with a win against the Netherlands. The Olympiastadion was filled with fans from both countries, with Polish supporters outnumbering their Austrian counterparts.However, it was the Austrian fans who celebrated early on as their team started strongly and took the lead through Trauner's header, aided by Phillipp Mwene's clever wing play. Although Poland grew into the game, they squandered a good chance to equalize when Nicola Zalewski shot over the bar.1. Germany : Played 2, Won 2, Drawn 0, Lost 0, Goals For 7, Goals Against 1, Goal Difference 6, Points 62. Switzerland: Played 2, Won 1, Drawn 1, Lost 0, Goals For 4, Goals Against 2, Goal Difference 2, Points 43. Scotland: Played 2, Won 0, Drawn 1, Lost 1, Goals For 2, Goals Against 6, Goal Difference -4, Points 14. Hungary: Played 2, Won 0, Drawn 0, Lost 2, Goals For 1, Goals Against 5, Goal Difference -4, Points 01. Spain : Played 2, Won 2, Drawn 0, Lost 0, Goals For 4, Goals Against 0, Goal Difference 4, Points 62. Italy: Played 2, Won 1, Drawn 0, Lost 1, Goals For 2, Goals Against 2, Goal Difference 0, Points 33. Albania: Played 2, Won 0, Drawn 1, Lost 1, Goals For 3, Goals Against 4, Goal Difference -1, Points 14. Croatia: Played 2, Won 0, Drawn 1, Lost 1, Goals For 2, Goals Against 5, Goal Difference -3, Points 11. England : Played 2, Won 1, Drawn 1, Lost 0, Goals For 2, Goals Against 1, Goal Difference 1, Points 42. Denmark: Played 2, Won 0, Drawn 2, Lost 0, Goals For 2, Goals Against 2, Goal Difference 0, Points 23. Slovenia: Played 2, Won 0, Drawn 2, Lost 0, Goals For 2, Goals Against 2, Goal Difference 0, Points 24. Serbia: Played 2, Won 0, Drawn 1, Lost 1, Goals For 1, Goals Against 2, Goal Difference -1, Points 11. Netherlands: Played 2, Won 1, Drawn 1, Lost 0, Goals For 2, Goals Against 1, Goal Difference 1, Points 42. France: Played 2, Won 1, Drawn 1, Lost 0, Goals For 1, Goals Against 0, Goal Difference 1, Points 43. Austria: Played 2, Won 1, Drawn 0, Lost 1, Goals For 3, Goals Against 2, Goal Difference 1, Points 34. Poland: Played 2, Won 0, Drawn 0, Lost 2, Goals For 2, Goals Against 5, Goal Difference -3, Points 01. Romania: Played 1, Won 1, Drawn 0, Lost 0, Goals For 3, Goals Against 0, Goal Difference 3, Points 32. Ukraine: Played 2, Won 1, Drawn 0, Lost 1, Goals For 2, Goals Against 4, Goal Difference -2, Points 33. Slovakia: Played 2, Won 1, Drawn 0, Lost 1, Goals For 2, Goals Against 2, Goal Difference 0, Points 34. Belgium: Played 1, Won 0, Drawn 0, Lost 1, Goals For 0, Goals Against 1, Goal Difference -1, Points 01. Türkiye: Played 1, Won 1, Drawn 0, Lost 0, Goals For 3, Goals Against 1, Goal Difference 2, Points 32. Portugal: Played 1, Won 1, Drawn 0, Lost 0, Goals For 2, Goals Against 1, Goal Difference 1, Points 33. Czechia: Played 1, Won 0, Drawn 0, Lost 1, Goals For 1, Goals Against 2, Goal Difference -1, Points 04. Georgia: Played 1, Won 0, Drawn 0, Lost 1, Goals For 1, Goals Against 3, Goal Difference -2, Points 0This format of standings is commonly used in football tournaments to summarise team performance and determine rankings for progression to the next stage of the competition.","Austria beat Poland 3-1 in their Euro 2024 Group D clash in New Delhi. Gernot Trauner, Christoph Baumgartner and Marko Arnautovic scored for Ralf Rangnick's side. Austria can qualify for the last 16 with a win against the Netherlands on Tuesday. Poland can only qualify as one of the four best third-placed teams.","https://static.toiimg.com/thumb/msid-111186674,imgsize-118400,width-400,resizemode-4/111186674.jpg"
France and Netherlands inch closer to last 16 in Euro 2024,https://timesofindia.indiatimes.com/sports/football/uefa-euro-2024/france-and-netherlands-inch-closer-to-last-16-in-euro-2024/articleshow/111181588.cms,"NEW DELHI: France and the Netherlands moved a step closer to the last 16 of Euro 2024 on Friday with a 0-0 draw in Leipzig, as Kylian Mbappe sat out the match due to a broken nose.Kylian Mbappe, who recently joined Real Madrid , was kept as an unused substitute by France’s coach Didier Deschamps. Mbappe wore a mask in training after sustaining a broken nose in the opening game. Didier Deschamps included him in the squad but chose not to risk further injury to his star striker, given that the knockout phase appeared largely assured.""Of course Kylian is one of the best players in the world, so a player like that who is not on the pitch is a loss for us. But other players performed really well,"" France midfielder Aurelien Tchouameni was quoted as saying by AFP after the match. ""We hope he comes back as soon as possible.""Dutch midfielder Xavi Simons had a goal controversially ruled out for offside in the second half. Antoine Griezmann, captaining the French team in Mbappe’s absence, missed two key opportunities to score.Simons thought he had put the Netherlands ahead with 20 minutes left, but Denzel Dumfries was ruled to be interfering with French goalkeeper Mike Maignan. The goal was disallowed after a lengthy VAR check.Poland became the first team to be eliminated from Euro 2024 after their 3-1 loss to Austria and the subsequent draw between France and the Netherlands. Poland will face France in their final group match on Tuesday. Both France and the Netherlands are tied with four points at the top of Group D and will seek to secure their places in the knockout round in their next matches.",France and the Netherlands draw 0-0 in Euro 2024 Group D match in Leipzig. France striker Kylian Mbappe sat out the match due to a broken nose. Poland became the first team to be eliminated from Euro 2024 after losing to Austria.,"https://static.toiimg.com/thumb/msid-111181675,imgsize-82534,width-400,resizemode-4/111181675.jpg"
Copa America: Canada contacts sport governing bodies after player receives racist abuse online,https://timesofindia.indiatimes.com/sports/football/top-stories/copa-america-canada-contacts-sport-governing-bodies-after-player-receives-racist-abuse-online/articleshow/111181391.cms,"NEW DELHI: Canada Soccer has contacted sport governing bodies after a player received racist abuse online following the team's 2-0 loss to Argentina in the Copa America opener on Thursday.The organization did not disclose the player's name, but center back Moise Bombito , who is Black, was targeted with online abuse after a tackle on Lionel Messi .""Canada Soccer is aware of and deeply disturbed by racist comments made online and directed at one of our men's national team players following tonight's match,"" the organization was quoted as saying by Reuters in its statement. ""We are in communication with CONCACAF and CONMEBOL about this matter,"" referring to the soccer governing bodies for the Americas.CONCACAF, the governing body for football in North, Central America, and the Caribbean, announced their support for Canada Soccer and stated they would investigate the accounts that posted the abusive material.""We stand with Canada Soccer in condemning the disgraceful media posts aimed at Moise Bombito. Racism has no place in our sport or in society,"" the organization said in a statement.CONMEBOL also issued a statement supporting the player and echoed CONCACAF's planned actions. ""Our organization works permanently in the evolution of a new culture that eradicates expressions of racism, offensive content on social networks, and any kind of violence or discrimination around our football,"" it said.After the match, Bombito posted on social media, saying, ""My beautiful Canada,"" and adding a heart emoji. He also commented, ""No room for that bs.""","Canada Soccer has contacted sport governing bodies after a player received racist abuse online. The organization did not disclose the player's name, but center back Moise Bombito, who is Black, was targeted with online abuse. Canada Soccer is aware of and deeply disturbed by racist comments made online and directed at one of our men's national team players following tonight's match.","https://static.toiimg.com/thumb/msid-111181461,imgsize-52162,width-400,resizemode-4/111181461.jpg"
Copa America: Chile and Peru play out 0-0 draw,https://timesofindia.indiatimes.com/sports/football/top-stories/copa-america-chile-and-peru-play-out-0-0-draw/articleshow/111181204.cms,"NEW DELHI: Chile and Peru played out a 0-0 draw in their Group A opener at the Copa America on Friday night in Arlington, Texas. The result also kept Canadian hopes alive in the group.Chile and Peru have both struggled in CONMEBOL World Cup Qualifying, with a combined total of just four goals in 12 matches. This lack of offensive prowess was evident in their scoreless draw, according to a report by Reuters.Alexis Sanchez of Chile missed the best chance of the game in the 16th minute. He failed to convert Victor Davila's low cross from the six-yard box, sending his shot over the crossbar.Chile displayed more attacking intent but struggled with the final pass in a first half disrupted by injuries. Peru's Luis Advincula left the field in the 35th minute, and Chilean midfielder Diego Valdes was substituted at halftime.Peru's Miguel Araujo almost scored in the 43rd minute. His well-placed header from Sergio Pena's free kick forced Chile's goalkeeper Claudio Bravo into an acrobatic save.Peru's striker Gianluca Lapadula created several dangerous moments in the second half but couldn’t significantly challenge Bravo. Lapadula had a promising chance in the 57th minute, but his slip resulted in a weak shot easily saved by Bravo.In the 79th minute, Lapadula's volley from Pena's corner forced Bravo into another save. The keeper quickly collected the rebound to prevent a second attempt.Bravo's performance in goal was noteworthy. At 41 years, 2 months, and 16 days, he became the oldest-ever Copa America player. His experience and skill were on full display throughout the match.The result reflected the offensive struggles faced by both teams and keeps the group stage competitive as the tournament progresses.","Chile and Peru played out a 0-0 draw in their Group A opener at the Copa America on Friday night. The result also kept Canadian hopes alive in the group. At 41 years, 2 months, and 16 days, Chilean goalkeeper Claudio Bravo became the oldest-ever CopaAmerica player.","https://static.toiimg.com/thumb/msid-111181294,imgsize-356090,width-400,resizemode-4/111181294.jpg"
'Your football is imprisoned': Outgoing coach Igor Stimac tells India,https://timesofindia.indiatimes.com/sports/football/top-stories/your-football-is-imprisoned-outgoing-coach-igor-stimac-tells-india/articleshow/111181274.cms,"PANAJI: Igor Stimac isn’t going down without a fight. Sacked earlier this week for a string of disappointing results that started with India finishing as the worst-performing among 24 teams at the AFC Asian Cup — no goals, no point — and missing out on qualification to the next stage of the FIFA World Cup qualifiers, Stimac said he was planning to resign, even if India had made it to the third round of the qualifiers for the first time.“I had informed some senior players that I have decided to leave, even if India qualified, since it was impossible to work without proper support, just listening to lies,” Stimac told reporters during an online media interaction that lasted for almost two hours on Friday.“Nobody was bothered about the players, everyone (at the All India Football Federation) is more worried about their own personal interests.”For most part, Stimac trained his guns at senior AIFF officials, starting with president Kalyan Chaubey .“Sooner he leaves, Indian football stands a chance,” he roared.Vice president NA Haris was always “entering airports, travelling, not serious enough (about football),” while secretary general M Satyanarayan, he said, astounded him by proposing an Inter-Continental Cup in July, a time when clubs start their preseason.Even the legendary IM Vijayan wasn’t spared. In his words, “a great footballer and legend but not the right person to be chairman of a technical committee.”Then there was the customary stick reserved for FSDL, the body that owns and runs the Indian Super League (ISL), India’s top-tier league.Stimac said the contract between AIFF and FSDL started in good faith but remains questionable.“The league and top tier cannot be run by corporate business,” he said.Handed an extension seven months ago, Stimac was sacked this week after a poor AFC Asian Cup campaign and an even poorer FIFA World Cup qualifying run. The sacking, Stimac suggested, came less than 24 hours after he had told the AIFF that he was negotiating with two potential employers and needed time to resign.“I told (AIFF secretary general) Satya I am negotiating with two parties for jobs in the future, so until the end of the month, I will accept one of the offers and you won’t have to pay more than one (month’s) salary. The next day I received the termination letter on email. I could not believe it. This happened only half a day after telling him to be patient and not get influenced with social media,” said Stimac.A bronze medal winner at the FIFA World Cup in 1998 with Croatia, Stimac got the India job in 2019 after convincing the technical committee that he could help Indian footballers punch above their weight. Five years later, while India are playing more attractive football and won a record three trophies last year, the Croat is leaving with a bitter taste in his mouth.“I came here with open arms, but your football is imprisoned. Without the law being changed and allowing PIO players to represent India, nothing will change. It’s a slow process. Will take another two decades or so to make progress,” said Stimac.The AIFF has started the process to look for Stimac’s successor. On the first day itself, there were 45 applications from coaches across the world. But given the negative publicity surrounding the sport here, Stimac felt the job wouldn’t attract bigger profiles.“The new coach will know immediately (what awaits him),” he said. “You cannot get a big-name coach. Everyone knows what kind of things we deal with in Indian football. How we operate, you might get someone who is desperate for a job. Don’t think there will be any success.”Asked what he would have done differently during his fiveyear tenure, Stimac said he should have resigned after the SAFF Championship in July last year, winning his third trophy of the year.“I shouldn’t have trusted these people,” said Stimac. “After winning three trophies in 2023, I had huge support among the media and fans. As much as they wanted me out, they could do nothing. The only way they knew of running was through social media. They don’t care about other things. It’s a wrong approach to run any serious institution.”","Igor Stimac says he was planning to resign even if India had made it to the third round of the FIFA World Cup qualifiers for the first time. Stimac trained his guns at senior AIFF officials, starting with president Kalyan Chaubey. “Sooner he leaves, Indian football stands a chance,” he roared.","https://static.toiimg.com/thumb/msid-111181279,imgsize-41714,width-400,resizemode-4/111181279.jpg"
Hubert Hurkacz downs Alexander Zverev to set up Halle final with Jannik Sinner,https://timesofindia.indiatimes.com/sports/tennis/top-stories/hubert-hurkacz-downs-alexander-zverev-to-set-up-halle-final-with-jannik-sinner/articleshow/111194182.cms,"NEW DELHI: Poland's Hubert Hurkacz advanced to the final of the Halle Open, defeating Germany's Alexander Zverev 7-6(2) 6-4 on Saturday to set up a showdown with his doubles partner and world number one Jannik Sinner .Hurkacz, known for his powerful serve, fired 17 aces in the match and saved four break points, overcoming Zverev who recently finished as the runner-up at the French Open.""It needed to be really good. He is such a good competitor and is playing good tennis , reaching the final at the French (Open) and playing at a really high level,"" Hurkacz said.""I am really confident on my serve, I'm serving really good. There were some moments but I managed to believe in my game and hit some good serves and good shots, so I stayed pretty calm.""I really love grass. The surface suits my game and the atmosphere here, having the full crowd is incredible.""World number four Zverev was aiming to win his first title in Halle after finishing as a finalist in 2016 and 2017. Despite his defeat, Zverev has shown strong form, particularly with his recent performance at the French Open.Meanwhile, Jannik Sinner reached the first grasscourt final of his career by defeating China's Zhang Zhizhen 6-4 7-6(3). Although Sinner initially struggled to adapt to the grass surface, requiring three consecutive three-set matches before his semi-final, he managed to secure his place in the final as the top seed.""It's going to be very even, he plays so well on this surface. He's won here, he knows this occasion really well,"" Sinner said on facing Hurkacz in Sunday's final, three days after the pair went out in the doubles quarter-finals in Halle.""I'm excited, I'm going to enjoy tomorrow. Every time you play a final it's a huge pleasure and honour. He's serving really well, it's very, very tough to break him.""Sinner will be looking to become the first man since Andy Murray in 2016 to win his first event after reaching the top of the rankings.",Poland's Hubert Hurkacz defeats Germany's Alexander Zverev in Halle Open semi- final. Jannik Sinner defeats China's Zhang Zhizhen to reach first grasscourt final of his career. Sinner will be looking to become the first man since Andy Murray in 2016 to win his first event after reaching the top of the rankings.,"https://static.toiimg.com/thumb/msid-111194202,imgsize-32222,width-400,resizemode-4/111194202.jpg"
Rohan Bopanna-Matthew Ebden pair loses in Cinch Championship quarters,https://timesofindia.indiatimes.com/sports/tennis/top-stories/rohan-bopanna-matthew-ebden-pair-loses-in-cinch-championship-quarters/articleshow/111174541.cms,"(Photo by Mike Hewitt/Getty Images)

NEW DELHI: Rohan Bopanna and Matthew Ebden , the top-seeded duo, displayed resilience but ultimately succumbed to the Russian-American pair of Karen Khachanov and Taylor Fritz in straight sets during the quarterfinals of the Cinch Championships in London on Friday, PTI reported.

The eighth-seeded team of Khachanov and Fritz emerged victorious with a score of 7-6 (1), 7-6 (3).

The powerful serves of Khachanov and Fritz proved to be a significant factor, as they maintained a 70% win percentage on their second serves. In contrast, Bopanna and Ebden struggled in this aspect of the game.

Earlier in the tournament, Bopanna and Ebden, who had an impressive run to the French Open semifinals, showcased their prowess by securing a comfortable 6-4, 6-4 victory against the Austrian pair of Alexander Erler and Lucas Miedler in the first round of the ATP 500 grass court event on Wednesday.

",Rohan Bopanna and Matthew Ebden lose in straight sets to Karen Khachanov and Taylor Fritz. Top-seeded duo had earlier defeated Alexander Erler and Lucas Miedler in the first round of the ATP 500 grass court event.,"https://static.toiimg.com/thumb/msid-111174539,imgsize-75930,width-400,resizemode-4/111174539.jpg"
Wimbledon champion Carlos Alcaraz knocked out of Queen's after defeat to Jack Draper,https://timesofindia.indiatimes.com/sports/tennis/top-stories/wimbledon-champion-carlos-alcaraz-knocked-out-of-queens-after-defeat-to-jack-draper/articleshow/111145413.cms,"NEW DELHI: The reigning Wimbledon and Queen's Club champion Carlos Alcaraz faced an unexpected setback in his grass-court campaign.The 21-year-old Spaniard, currently ranked world number two, suffered a surprising loss to Britain's Jack Draper in the round of 16 at the Queen's Club tournament in London. The final score of the match was 7-6 (7/3), 6-3 in favour of Draper, marking the biggest win of the British player's career so far.Alcaraz entered the tournament fresh off his triumph at the French Open, where he claimed the prestigious title on the clay courts of Roland Garros. However, his momentum was halted by the 22-year-old Draper, who showcased an impressive performance on the grass surface.Draper's victory holds significance as he aims to become the first British men's singles champion at Queen's Club since Andy Murray 's fifth title triumph in 2016. The 31st-ranked Draper acknowledged the challenge he faced against the defending champion and expressed his satisfaction with his exceptional performance.""It was a really tough match. I knew coming out here that Carlos is the defending champion, he won Wimbledon, he's an amazing talent. I knew I had to come out here and play really well, and luckily I did that,"" Draper stated (as quoted by AFP).Draper's recent form has been noteworthy, as he claimed his first ATP title in Stuttgart just a week prior to his triumph over Alcaraz at Queen's Club. This victory further solidifies his position as a rising star on the ATP Tour and a potential contender for the Queen's Club title.While Alcaraz's defeat may come as a surprise, it serves as a reminder of the unpredictable nature of professional tennis and the fierce competition on the grass courts.",Carlos Alcaraz loses to Jack Draper in the round of 16 at Queen's Club. The 21-year-old Spaniard is the reigning Wimbledon champion. Draper's victory marks the biggest win of the British player's career so far.,"https://static.toiimg.com/thumb/msid-111145509,imgsize-26896,width-400,resizemode-4/111145509.jpg"
