Article Title,Article Link,Article Text,Article Summary,Article Image
Indian players wear black armbands during the T20 World Cup game against Afghanistan. Here’s why,https://timesofindia.indiatimes.com/sports/cricket/icc-mens-t20-world-cup/indian-players-wear-black-armbands-during-the-t20-world-cup-game-against-afghanistan-heres-why/articleshow/111144876.cms,"NEW DELHI: Indian cricketers , in a poignant tribute, wore black armbands during their T20 World Cup Super 8 match against Afghanistan at the Kensington Oval, Bridgetown in Barbados.This gesture was in honour of former Indian fast bowler David Johnson , who tragically passed away in Bengaluru on Thursday at the age of 52.T20 WORLD CUP: SCHEDULE David Johnson, known for his brief but memorable stint with the Indian team, played two Test matches in 1996, securing three wickets.His untimely death has sent shockwaves through the cricketing community.According to a Karnataka State Cricket Association (KSCA) official, Johnson died after falling from the balcony of his fourth-floor apartment. Despite being rushed to the hospital, he was declared dead.Johnson is survived by his wife and two children. He had been managing a cricket academy but had not been in good health recently. ""We were informed that he had fallen from the fourth floor of his apartment building. He was taken to a hospital but the doctors declared him brought dead,"" the KSCA official told PTI.Johnson was a key member of Karnataka's formidable bowling lineup in the 1990s, which also featured legends like Anil Kumble, Javagal Srinath, Venkatesh Prasad, and Dodda Ganesh.In the match against Afghanistan, Indian captain Rohit Sharma won the toss and chose to bat first at the Sir Vivian Richards Stadium. In a strategic change, left-arm wrist spinner Kuldeep Yadav replaced right-arm seamer Mohammed Siraj in the playing XI.India entered the Super 8 stage with an impressive record, having won all three group stage matches against Ireland, Pakistan, and the USA in Group A. Their final group match against Canada was abandoned due to rain.","Indian cricketers wore black armbands during their T20 World Cup Super 8 match against Afghanistan. This gesture was in honour of former Indian fast bowler David Johnson who passed away in Bengaluru on Thursday at the age of 52. Johnson played two Test matches in 1996, securing three wickets.","https://static.toiimg.com/thumb/msid-111145118,imgsize-27820,width-400,resizemode-4/111145118.jpg"
Gautam Gambhir: 'It is not right': Gautam Gambhir calls on ICC to scrap this 'very unfair' rule in white-ball cricket,https://timesofindia.indiatimes.com/sports/cricket/news/it-is-not-right-gautam-gambhir-calls-on-icc-to-scrap-this-very-unfair-rule-in-white-ball-cricket/articleshow/111180855.cms,"NEW DELHI: Former India cricketer Gautam Gambhir has termed the two new-ball rule in One Day Internationals ‘unfair’ and accused it of altering the dynamics of the game.Gambhir called on the International Cricket Council to eliminate the rule, asserting it is detrimental to finger-spinners .The rule was adopted in October 2011 to help the ball retain its shine and minimize reverse swing, the rule has led to fewer opportunities for finger-spinners to effectively impact matches.Gambhir, during an event in Kolkata, emphasized that the rule unfairly disadvantages finger-spinners, thereby affecting their participation in white-ball cricket .""I don't know what the spirit of cricket is because everyone plays with the right spirit of the game. If there are rules, anyway, there is the spirit of the game. But one thing that I would definitely want to change is to get rid of two new balls,"" Gambhir was quoted as saying by ANI.""Especially in white-ball cricket because it is very, very unfair on a finger spinner. It is very unfair on a finger spinner to not be playing enough white-ball cricket because there is nothing for them. It is not right,"" he added.He urged the ICC to amend the rule to allow all players an equal chance to showcase their talents, irrespective of their bowling style.""The job of the ICC is to make sure that everyone with their skill should get an equal opportunity to showcase his talent. But when you take that talent from a certain section of players, it is very unfair. Today, you hardly see any finger spinner playing white ball cricket. Why? It's not them to be blamed; it's ICC that needs to be blamed for it. For me, one thing that I want to get rid of is two new balls because it makes the contest between bat and ball much much more even,"" Gambhir said.",Gautam Gambhir calls on the International Cricket Council to eliminate the rule. The rule was adopted in October 2011 to help the ball retain its shine and minimize reverse swing. The former India cricketer says the rule unfairly disadvantages finger-spinners.,"https://static.toiimg.com/thumb/msid-111180983,imgsize-22982,width-400,resizemode-4/111180983.jpg"
David Miller reprimanded for showing dissent at umpire's decision,https://timesofindia.indiatimes.com/sports/cricket/icc-mens-t20-world-cup/david-miller-reprimanded-for-showing-dissent-at-umpires-decision/articleshow/111195935.cms,"NEW DELHI: Explosive South African batter David Miller received a reprimand and one demerit point for violating Level 1 of the ICC Code of Conduct during the Super Eights Group 2 match against England in the T20 World Cup .The violation was related to Article 2.8 of the Code of Conduct for Players and Player Support Personnel, which states: ""showing dissent at an Umpire's decision during an International Match.""As it was Miller's first offence within a 24-month period, a single demerit point was added to his disciplinary record.The incident took place during the 19th over of South Africa's innings when Miller played a full toss from pacer Sam Curran, expecting it to be called a 'no ball' due to its height.When the umpire did not declare it a 'no ball', Miller expressed dissent by signalling for a review, which was not possible in this situation.Miller acknowledged the offence and accepted the sanction proposed by match referee Jeff Crowe, eliminating the need for a formal hearing.The charge was brought forth by on-field umpires Chris Brown and Sharfuddoula Ibne Shahid, third umpire Joel Wilson, and fourth umpire Chris Gaffaney .",David Miller received a reprimand and one demerit point for violating Level 1 of the ICC Code of Conduct during the Super Eights Group 2 match against England in the T20 World Cup. The incident took place during the 19th over of South Africa's innings when Miller played a full toss from pacer Sam Curran.,"https://static.toiimg.com/thumb/msid-111195933,imgsize-52536,width-400,resizemode-4/111195933.jpg"
'Gully cricket vibes': Virat Kohli evokes fans' childhood memories as he goes searching for ball. Watch,https://timesofindia.indiatimes.com/sports/cricket/icc-mens-t20-world-cup/gully-cricket-vibes-virat-kohli-evokes-fans-childhood-memories-as-he-goes-searching-for-ball-watch/articleshow/111195780.cms,"NEW DELHI: In a hilarious turn of events, star batter Virat Kohli evoked fans' childhood memories as he was seen looking for the ball beyond the boundary ropes during the India vs Bangladesh T20 World Cup Super 8 clash in Antigua on Saturday.In what looked like a platform being used for fireworks, Kohli was seen going under it during the match to get the ball after Rishad Hossain fired it for a maximum.The incident took place on the final ball of the 17th over when Hossain slammed the Arshdeep Singh ball over the deep mid-wicket fence. As the ball sailed over the boundary cushion and the LED advertising hoardings, it somehow managed to go under the platform.Kohli was then seen going over the hoardings and snuck under the platform to get the ball.On the match front, India inched closer to a semis berth in the T20 World Cup following their comprehensive 50-run victory against Bangladesh in a Super Eight contest.All-rounder Hardik Pandya smashed a 27-ball fifty as India posted 196 for 5 -- their highest score in what has been a low-scoring tournament so far -- at the Sir Vivian Richards Stadium.Bangladesh were never really in the chase and managed 146 for 8 in reply, succumbing to their second Group 1 defeat to be on the brink of elimination.","Virat Kohli evokes fans' childhood memories as he was seen looking for the ball beyond the boundary ropes during the India vs Bangladesh T20 World Cup Super 8 clash in Antigua. In what looked like a platform being used for fireworks, Kohli was seen going under it during the match.","https://static.toiimg.com/thumb/msid-111195766,imgsize-68262,width-400,resizemode-4/111195766.jpg"
"Hardik being Hardik, we know what he is capable of: Rohit Sharma",https://timesofindia.indiatimes.com/sports/cricket/icc-mens-t20-world-cup/hardik-being-hardik-we-know-what-he-is-capable-of-rohit-sharma/articleshow/111195787.cms,"NEW DELHI: Hardik Pandya 's all-round performance in the T20 World Cup match against Bangladesh significantly boosted India's chances of reaching the semi-finals.Campaigning in the Super 8s, Pandya played a crucial role by scoring a half-century and taking a wicket, leading India to a 50-run victory.Indian skipper Rohit Sharma praised Pandya's contributions, affirming that his batting consistently strengthens the team.Pandya became the first Indian No. 6 to score a half-century in a T20 World Cup game. In the tournament so far, he has scored 89 runs with a strike rate of 141 and taken eight wickets.“I mentioned in the last game as well, his batting well puts us in a good stead. We want to finish well and Hardik being Hardik we know what he is capable of,” Rohit said at the post-match presentation ceremony.“He is a very important player for us, if he can keep doing that, it will put us in good positions,” said the skipper.On the day of the match, other Indian batters also made significant contributions with Virat Kohliscoring 37, Rishabh Pant adding 36, and Shivam Dube hitting 34. Rohit Sharma himself set an aggressive tone with 23 runs off 11 balls.“I have been talking about this for a long time now. It's about going there and putting that into work. Considering everything we played really well, adapted to the conditions,” he said.“All eight batters need to play their role, whatever it is. We saw one guy get 50 and we got 197, in T20 I don't believe we need to get fifties and hundreds, what matters is the pressure you put on the bowlers.“All the batters from the word go played well and that's how we want to play as well. There is a lot of experience in the squad and we back them,” he said about the perfect execution of the game plan.Rohit also acknowledged that the breeze plays a role in many Caribbean islands.“There's a little bit of wind factor here, overall we are very smart, overall we were good with bat and ball.”Bangladesh skipper Najmul Hossain Shanto admitted that his team allowed at least 30 more runs than what should have been the par-score.“We were thinking about 160-170 when we put them into bat, but they batted well so credit to them.”He mentioned that the team lacked the required intent.“We did not show as much intent as we needed with the bat, when we were chasing 190, we needed to show more intent especially in the first six (overs).”","Hardik Pandya scored a half-century and took a wicket in India's 50-run victory over Bangladesh. Pandya became the first Indian No. 6 to score a half century in a T20 World Cup game. Indian skipper Rohit Sharma praised Pandya's contributions, affirming that his batting consistently strengthens the team.","https://static.toiimg.com/thumb/msid-111195785,imgsize-41310,width-400,resizemode-4/111195785.jpg"
"Hardik Pandya joins Shahid Afridi, Shakib Al Hasan in elite list, becomes first Indian player to...",https://timesofindia.indiatimes.com/sports/cricket/icc-mens-t20-world-cup/hardik-pandya-joins-shahid-afridi-shakib-al-hasan-in-elite-list-becomes-first-indian-player-to-/articleshow/111195511.cms,"NEW DELHI: Indian all-rounder Hardik Pandya etched his name in the history books during India's Super Eights clash against Bangladesh in the ICC T20 World Cup . Pandya became the first Indian cricketer to achieve the rare double of 300+ runs and 20+ wickets in the tournament's history.Pandya's achievement underscores his value as a genuine all-rounder, capable of influencing the game with both bat and ball.His performance against Bangladesh was a testament to his all-round prowess. Coming in at a crucial juncture, Pandya played a blistering knock of 50 runs off just 27 deliveries, smashing four boundaries and three sixes at a strike rate of 185.19. His innings propelled India to a formidable total of 196/5.T20 World Cup: Schedule Not content with his batting exploits, Pandya also made a significant contribution with the ball. He dismissed the dangerous Litton Das , who was threatening to take the game away from India. This wicket proved crucial in pegging back Bangladesh's chase.Pandya's overall T20 World Cup statistics highlight his consistency in the shortest format. In 21 matches, he has amassed 302 runs at an average of 27.45 and a strike rate of 137.89, including two half-centuries. With the ball, he has been equally impressive, claiming 21 wickets at an economy rate of 7.41.While Pandya is the first Indian to achieve this double, he joins an elite group of all-rounders who have accomplished this feat in T20 World Cup history. This illustrious list includes Pakistan's Shahid Afridi , Bangladesh's Shakib Al Hasan , West Indies' Dwayne Bravo , and Australia's Shane Watson .Pandya's achievement adds another feather to his cap and solidifies his status as one of the most valuable players in the Indian team. His ability to contribute significantly with both bat and ball makes him a vital asset in the shortest format, and his performance against Bangladesh served as a timely reminder of his match-winning capabilities.","Hardik Pandya became the first Indian cricketer to achieve the rare double of 300+ runs and 20+ wickets in the tournament's history. Pandya played a blistering knock of 50 runs off just 27 deliveries, smashing four boundaries and three sixes at a strike rate of 185.19. His innings propelled India to a formidable total of 196/5.","https://static.toiimg.com/thumb/msid-111195533,imgsize-39424,width-400,resizemode-4/111195533.jpg"
India register new high in six-hitting in T20 World Cup history,https://timesofindia.indiatimes.com/sports/cricket/icc-mens-t20-world-cup/india-register-new-high-in-six-hitting-in-t20-world-cup-history/articleshow/111195529.cms,"NEW DELHI: In their ICC T20 World Cup Super Eight match against Bangladesh on Saturday, Team India set a new personal record by hitting 13 sixes, the most they have ever hit in a single T20 World Cup game.India surpassed their previous record of 11 sixes, which they set against England in a match during the 2007 ICC T20 World Cup.That match also featured Yuvraj Singh 's historic achievement of hitting six sixes in an over off Stuart Broad, making him the first Indian to accomplish this feat in international cricket.The most number of sixes in a single T20 WC innings by a team is by the Netherlands, who smashed 19 sixes against Ireland in an inning back in the 2014 edition of the tournament to chase down 190 runs in just 13.5 overs.In terms of India's highest totals in T20 World Cup history, this match against Bangladesh ranks as their third-highest (196/5), with their highest score being 218/4, which they achieved against England in 2007.Virat Kohli , Shivam Dube, and Hardik Pandya each contributed three sixes to India's total of 13 sixes against Bangladesh, while Rishabh Pant added two more, and skipper Rohit Sharma and Suryakumar Yadav chipped in with one each.Talking about the match, India registered a comprehensive 50-run victory to inch closer to semi-final berth in the T20 World Cup.In reply, Bangladesh were all at sea against Kuldeep Yadav's (3/19 in 4 overs) left-arm wrist spin as they managed only 146 for 8 in the end.","India beat Bangladesh by 50 runs in their ICC T20 World Cup Super Eight match. Virat Kohli, Shivam Dube, and Hardik Pandya each contributed three sixes to India's total of 13. Rishabh Pant added two more, and skipper Rohit Sharma and Suryakumar Yadav chipped in with one each.","https://static.toiimg.com/thumb/msid-111195523,imgsize-42548,width-400,resizemode-4/111195523.jpg"
Smashers make semis of Bengal Pro T20 League,https://timesofindia.indiatimes.com/sports/cricket/news/smashers-make-semis-of-bengal-pro-t20-league/articleshow/111194994.cms,"KOLKATA: Sobisco Smashers Malda became the first team to book a place in the semifinals of the inaugural Bengal Pro T20 League after recording a two-run victory over Harbour Diamonds at the Eden Gardens on Saturday.On the other hand, it was a forgettable season for the Harbour Diamonds, who suffered their sixth straight defeat in the competition.Malda, with five wins from six games, are at the top of the points table with 10 points while Harbour Diamonds stayed at the bottom of the table yet to gather a point from the league.In spite of losing two openers early in the innings, Writtick Chatterjee and Writam Porel arrested the slide by putting together a 65-run third-wicket stand. Chatterjee continued to be the most consistent scorer of this tournament as he hit four fours and two sixes for his 37 off 21 balls. Porel also got going scoring 36 off 31 balls.Ayan Bhattacharjee helped Malda finish with a flourish as he scored a quickfire 31 off just 10 balls. The batter hit two fours and three sixes during his unbeaten knock that helped the side post 173 for seven in 20 overs.The Harbour Diamonds chase never got going as they were in a spot of bother losing half the side with just 47 runs on the board inside the first eight overs.But just when all looked lost for them, Poonish Mehta (42 off 20) played a fighting knock for Harbour Diamonds. However, Mehta’s 42 off 20 balls was not enough as they fell short in the end managing 171 for nine in 20 overs.","Sobisco Smashers Malda become the first team to book a place in the semifinals of the inaugural Bengal Pro T20 League. Harbour Diamonds suffered their sixth straight defeat in the competition. Malda, with five wins from six games, are at the top of the points table with 10 points.","https://static.toiimg.com/thumb/msid-111194991,imgsize-49888,width-400,resizemode-4/111194991.jpg"
180 was par on this track as it gets slower towards end: Hardik Pandya,https://timesofindia.indiatimes.com/sports/cricket/icc-mens-t20-world-cup/180-was-par-on-this-track-as-it-gets-slower-towards-end-hardik-pandya/articleshow/111194824.cms,"NEW DELHI: Indian vice-captain Hardik Pandya expressed satisfaction with the batting unit's performance in reaching a total of 196 runs against Bangladesh. He believed that on the given track, a score of 180 would have been considered par.India's innings was propelled by significant contributions from several players. Pandya himself played a blistering knock of 50 runs off just 27 balls.Virat Kohli chipped in with a solid 37 runs, while Rishabh Pant and Shivam Dube added 36 and 34 runs respectively. These efforts helped India post a formidable total of 196 for 5 after being asked to bat first by Bangladesh.""Wicket looked alright, par would've been 180, we got 196. That's a good score here,"" Pandya, as quoted by PTI, told broadcasters at the innings break.Dube, who has faced challenges in his performance, received commendation from Pandya for maintaining his composure and delivering a solid innings despite the pressure-filled circumstances.""At the point Shivam went (in), couple of wickets were lost. He had to take his time and we did well to recover. His strength is to take down spinners.""When the time came, when we could go hard, we went (after their bowling) after that,"" Pandya said.The star all-rounder believed that the pitch would slow down as the match progressed.""Definitely it tends to get slower in the end, some balls were sliding down when bowled at the right length, discipline and good bowling should do the job.""In recent times, the perception of valuable innings in cricket has undergone a significant shift, according to Ravichandran Ashwin , a seasoned off-spinner and one of the most insightful thinkers among current international players. Ashwin pointed out that the era of judging a batsman's performance solely based on reaching milestone scores of fifties or hundreds might be coming to an end.""We are not used to an approach where batsmen throw it away after making 30's 20's, but it is about time we embrace an approach like this especially while batting first.Top Intent from all the Indian batters so far,"" Ashwin wrote on X about India reaching nearly 200 with just a single half-century and three contributions upwards of 30.","Hardik Pandya believes that on the given track, a score of 180 would have been considered par. India's innings was propelled by significant contributions from several players. Pandya himself played a blistering knock of 50 runs off just 27 balls. Ravichandran Ashwin points out that the era of judging a batsman's performance solely based on milestone scores might be coming to an end.","https://static.toiimg.com/thumb/msid-111194822,imgsize-69196,width-400,resizemode-4/111194822.jpg"
T20 World Cup: Hardik Pandya fifty powers India to 196/5 against Bangladesh in Super 8 clash,https://timesofindia.indiatimes.com/sports/cricket/icc-mens-t20-world-cup/t20-world-cup-hardik-pandya-fifty-powers-india-to-196/5-against-bangladesh-in-super-8-clash/articleshow/111194551.cms,"NEW DELHI: Star batter Virat Kohli found much-needed rhythm before Shivam Dube and Hardik Pandya pushed India to 196 for five against Bangladesh in their T20 World Cup Super 8 match in Antigua on Saturday.Kohli scored 37 off 28 balls, while Dube and Pandya finished with 34 off 24 balls and a forceful unbeaten 50 off 27 balls, respectively.India's innings began effectively with skipper Rohit Sharma and Kohli playing aggressively from the beginning. Rohit's brief stint produced 23 runs off 11 balls before he was caught off Shakib Al Hasan's delivery.Despite Bangladesh's strategy of starting with spinners from both ends, Rohit managed three fours and a six. Kohli, showing confidence, smacked a 94-meter six off Mustafizur Rahman and followed it with another six against leg-spinner Rishad Hossain.However, Kohli's innings ended after he was deceived by a slow off-cutter from Tanzim Hasan. Two balls later, Tanzim struck again when he got Suryakumar Yadav out, leaving India at 83 for three in 10 overs. Rishabh Pant then steadied the innings collecting two fours and a six off Mustafizur Rahman, reversing the momentum back in India's favor.Pant combated Rishad Hossain's over aggressively but fell to a reverse sweep, similar to his dismissal in the previous match. His exit left India to rebuild yet again.Dube and Pandya shared a crucial 53-run stand. Dube, who initially appeared slow, ended with smashing three sixes, focusing on deep midwicket boundary against spinners and hitting Tanzim down the ground for a maximum. Pandya anchored the final overs, delivering four boundaries and three sixes, pushing India close to the 200-run mark.The all-rounder completed his 50 off the final ball of the innings.This collective effort ensured a competitive total for India against Bangladesh. The team's strategy in managing the spinners and recovering after quick dismissals laid the groundwork for the robust score.","Star batter Virat Kohli found much-needed rhythm before Shivam Dube and Hardik Pandya pushed India to 196 for five against Bangladesh in their T20 World Cup Super 8 match in Antigua.Kohli scored 37 off 28 balls, while Dube finished with 34 off 24 balls and a forceful unbeaten 50 off 27 balls.","https://static.toiimg.com/thumb/msid-111194550,imgsize-56680,width-400,resizemode-4/111194550.jpg"
