Article Title,Article Link,Article Text,Article Summary,Article Image
Babar Azam surpasses MS Dhoni to achieve this big record as captain in T20 World Cup history,https://timesofindia.indiatimes.com/sports/cricket/icc-mens-t20-world-cup/babar-azam-surpasses-ms-dhoni-to-achieve-this-big-record-as-captain-in-t20-world-cup-history/articleshow/111043085.cms,"Most runs as captain in T20 World Cups

549 - Babar Azam (17 inns)*

529 - MS Dhoni (29 inns)

527 - Kane Williamson (19 inns)

(19 inns) 360 - M Jayawardene (11 inns)

352 - Graeme Smith (16 inns)

NEW DELHI: Under-fire Pakistan skipper Babar Azam on Sunday achieved a remarkable feat as he surpassed legendary MS Dhoni in the list of most run-getters as a captain in the history of the T20 World Cup during their match against Ireland in Lauderhill, United States.Riding on Babar's fighting unbeaten knock, Pakistan somehow managed to eke out a narrow three-wicket win in a low-scoring thriller. Despite chasing a paltry target of 107, Pakistan once again slumped to 62 for six in 11 overs. But skipper Babar (32 not out) and Abbas Afridi (17) shared a crucial 33-run stand to take them home at 111 for 7 in 18.5 overs.Already-eliminated from the race of Super 8, Pakistan concluded their T20 World Cup campaign with a third-place finish in Group A while arch-rivals India and co-hosts USA advanced to the next round, finishing at first and second positions respectively.Leading from the front, these captains have demonstrated remarkable skill and composure under pressure, etching their names into the history of the tournament with substantial run tallies.Pakistan's Babar stands atop this illustrious list, amassing 549 runs in just 17 innings. Known for his elegant stroke play and impeccable timing, Babar has consistently anchored his team’s innings, providing stability and a reliable scoring option. His ability to handle high-pressure situations with a calm demeanor has been instrumental in his success, making him a standout performer in T20 World Cups.Dhoni, who scored 529 runs in 29 innings, is second on the list. Renowned for his finishing prowess and strategic acumen, Dhoni’s contributions with the bat were pivotal in numerous tight contests. His calm and calculated approach in the death overs made him one of the most feared finishers in the game, ensuring India’s competitive edge in many tournaments.New Zealand’s Kane Williamson, with 527 runs in 19 innings, holds the third spot and exemplifies consistency and grace under pressure. His tactical brilliance and ability to adapt to different match situations have been key to New Zealand’s success. Williamson’s composed and technically sound batting style has made him a reliable leader and a vital run-scorer for his team.Sri Lanka’s Mahela Jayawardene , accumulating 360 runs in just 11 innings, showcased his class and elegance and takes the fourth spot. Despite playing fewer matches, his impact was profound, often leading from the front and guiding his team through challenging phases with his experience and skill.South Africa’s Graeme Smith, with 352 runs in 16 innings, rounds off this elite group. Smith’s aggressive and fearless approach set the tone for his team, providing quick starts and building solid foundations for South Africa’s innings.",Babar Azam tops the list of most runs scored as a captain in T20 World Cup. India's MS Dhoni is second on the list with 529 runs in 29 innings. New Zealand's Kane Williamson is third with 527 runs in 19 innings. Sri Lanka's Mahela Jayawardene is fourth with 360 runs in 11 innings.,"https://static.toiimg.com/thumb/msid-111043084,imgsize-34372,width-400,resizemode-4/111043084.jpg"
Watch: Ziva wishes MS Dhoni Happy Father's Day with adorable video,https://timesofindia.indiatimes.com/sports/off-the-field/watch-ziva-wishes-ms-dhoni-happy-fathers-day-with-adorable-video/articleshow/111036722.cms,"NEW DELHI: Apart from being a bike and car lover, former Indian captain Mahendra Singh Dhoni also likes nature and dogs.Having retired from international cricket and playing only in the IPL Dhoni gets plenty of time to pursue his passion of riding superbikes and driving vintage cars.At his sprawling farmhouse in Ranchi, Dhoni has plenty of pets and has been seen in the past spending time with them.Last year Dhoni had even celebrated his birthday with his dogs at his farmhouse.On the occasion of Father's Day, Dhoni's daughter Ziva shared a video on her Instagram handle in which the former Chennai Super Kings CSK ) skipper can be seen petting and spending quality time with his dogs at his farmhouse.Dhoni's daughter Ziva and wife Sakshi can also be seen petting the dogs in the video.Dhoni's impact on Indian cricket and the IPL has been immense, and despite his retirement from international cricket on August 15, 2020, he remains a beloved and respected figure in the sport.","Mahendra Singh Dhoni enjoys spending time with his dogs at his farmhouse in Ranchi. Dhoni's daughter Ziva shared a video of him petting and playing with the dogs. The former Indian captain will retire from international cricket on August 15, 2020.","https://static.toiimg.com/thumb/msid-111036681,imgsize-56694,width-400,resizemode-4/111036681.jpg"
'We weren't good as a team': Babar Azam after Pakistan's early exit from T20 World Cup,https://timesofindia.indiatimes.com/sports/cricket/icc-mens-t20-world-cup/we-werent-good-as-a-team-babar-azam-after-pakistans-early-exit-from-t20-world-cup/articleshow/111046896.cms,"NEW DELHI: Pakistan 's captain Babar Azam outlined the future strategy after his team's early and surprising exit from the ongoing T20 World Cup .Pakistan faced consecutive defeats against co-hosts USA and their fierce rivals India in their first two group games, which sealed their fate in the tournament.Despite bouncing back with two consecutive wins, it wasn't enough to secure a spot in the Super 8.Pakistan concluded their campaign with a nervy three-wicket victory against Ireland on Sunday, Babar acknowledged the talent within the team but admitted they failed to perform collectively.""We have a good bunch of players. We've to go home, chat and see where we lack, and then come back. Couldn't finish off close games, as a team we weren't good as a team,"" Babar was quoted as saying by ANI at the post-match presentation.Evaluating the overall performance, Babar noted that the team's batting let them down while acknowledging their strong bowling performance.""We finished well. We took early wickets in the bowling. In the batting, we did not do well, but we took it home with the tailenders. Bowling was good as conditions suited our fast bowlers. Batting, we made a few mistakes, we had chances to win against USA and India. If the team needs me to open, I will, and if they need me to bat 3, I will. Whatever the team situation suits, I will do it,"" Babar emphasized.","Pakistan captain Babar Azam outlines future strategy after early exit from T20 World Cup. Pakistan lost to USA and India in their first two group games. Despite bouncing back with two consecutive wins, it wasn't enough to secure a spot in the Super 8.","https://static.toiimg.com/thumb/msid-111046978,imgsize-34074,width-400,resizemode-4/111046978.jpg"
"'We made mistakes in batting against India, USA', admits Babar Azam",https://timesofindia.indiatimes.com/sports/cricket/icc-mens-t20-world-cup/we-made-mistakes-in-batting-against-india-usa-admits-babar-azam/articleshow/111043124.cms,"T20 World Cup 2024:

|

NEW DELHI: Pakistan captain Babar Azam expressed his regret over the errors committed by his team in their previous Group A encounters against India and the United States. Despite securing a consolatory three-wicket victory over Ireland in Lauderhill, the former champions were eliminated from the T20 World Cup .Babar himself played a crucial role in Pakistan's successful chase of 107 runs against Ireland, remaining unbeaten on 32. However, the pursuit was far from smooth, with Pakistan nearly squandering the opportunity to secure the win.""I think with the bowling, conditions suited our bowlers. But in batting we made few mistakes in the matches against the USA and India. When you lose wickets, the pressure is on you,"" said Babar, as quoted by PTI, in the post-match presentation ceremony.""We couldn't finish off close games, and as a team we weren't good,"" he admitted.Pakistan had a rough start in Group A, suffering defeats against India and the USA in their first two matches. However, they managed to bounce back by securing wins against Canada and Ireland.Despite the early setbacks, Babar expressed satisfaction with his team's performance, particularly their ability to conclude the tournament on a positive note with a win.""Yes we finished well. We took early wickets with the ball. But with the bat, we didn't finish well. We lost back-to-back wickets, but got over the line in the end.""Babar acknowledged that Pakistan need to bounce back swiftly from this setback. However, he remained uncertain about his future as the team's skipper, providing no clear indication of his plans.""Let's see, what team needs, I'll be okay with it. We have a good bunch of players, we've to go home, chat and see where we lacked, and then come back,"" he added.Fast bowler Shaheen Shah Afridi , who received the player of the match award, admitted that throughout the tournament, the team failed to exhibit the appropriate style of cricket that was expected of them.""We haven't played the kind of cricket our country demands, have a few areas to improve on. It's tough (the result),"" said Afridi.Ireland captain Paul Stirling admitted that the team struggled to find the optimal combination of players throughout the tournament.""It's getting that balance right. T20...we probably haven't got that this time around. It's been a difficult couple of weeks. We'll go back, regroup and see if we can come back stronger,"" he noted.","Pakistan captain Babar Azam expresses regret over his team's performances. The former champions were eliminated from the T20 World Cup. Babar himself played a crucial role in Pakistan's successful chase of 107 runs against Ireland. Pakistan had a rough start in Group A, suffering defeats against India and the USA.","https://static.toiimg.com/thumb/msid-111043128,imgsize-36594,width-400,resizemode-4/111043128.jpg"
T20 World Cup: Pakistan salvage pride with nervy consolation win over Ireland in last game,https://timesofindia.indiatimes.com/sports/cricket/icc-mens-t20-world-cup/t20-world-cup-pakistan-salvage-pride-with-nervy-consolation-win-over-ireland-in-last-game/articleshow/111042991.cms,"|

NEW DELHI: Former champions Pakistan managed to restore some pride with a hard-fought three-wicket victory over Ireland in their final and inconsequential Group A game of the T20 World Cup in Lauderhill on Sunday.Pakistan, who were knocked out of the tournament after losses to India and the USA, restricted Ireland to 106 for 9 after opting to bowl first.Shaheen Shah Afridi led the bowling attack with impressive figures of 3 for 22.Chasing a modest total, Pakistan's batting vulnerabilities were once again on display. They struggled to 62 for six in just 11 overs, bringing fears of another collapse. However, skipper Babar Azam (32 not out) and Abbas Afridi (17) put together a crucial 33-run partnership, leading Pakistan to 111 for 7 in 18.5 overs.Shaheen sealed the win with two towering sixes, scoring 13 not out off just five balls.Ireland's pacers Barry McCarthy (3 for 15), Curtis Campher (2 for 24), and Mark Adair (1 for 24) gave it their all, but Pakistan held firm, leaving Ireland winless in their campaign.Pakistan's chase began well with opener Saim Ayub hitting a six and two fours before getting dismissed by keeper Lorcan Tucker off Mark Adair. Mohammad Rizwan added three boundaries but was sent packing by McCarthy as the score read 39 for 2.In quick succession, Pakistan lost four more wickets—Fakhar Zaman (5), Usman Khan (2), Shadab Khan (0), and Imad Wasim (4), plunging them into trouble.Babar stood resolute at one end while Abbas Afridi contributed a crucial 17 off 21 balls. Shaheen Afridi then finished the match with two powerful sixes.Earlier, Ireland had a disastrous start with Afridi and Amir wreaking havoc, reducing them to 4 for three in just the second over.Shaheen struck twice in his opening over, dismissing Andrew Balbirnie (0) and Tucker (2). Amir then had Ireland captain Paul Stirling (1) caught behind, putting the top order in shambles.Harry Tector survived a caught-behind appeal but was trapped LBW by Afridi with a fuller delivery that hit his back leg, leaving Ireland at 15 for 4 in three overs.George Dockrell hit two boundaries to ease some pressure but was soon out to a caught and bowled by Amir, who caught him off-guard with a slower ball. By the end of the powerplay, half of the Irish side had returned to the pavilion.Haris Rauf added to Ireland's woes by dismissing Campher, who attempted a pull shot but only managed a top-edge that was caught by Ayub.Ireland's Delany showed some resistance by hitting Rauf for a six in the 9th over. He then hammered spinner Shadab Khan for another six over long-on and followed it up with a boundary after Rauf missed a catch at the boundary line.Abbas Afridi also faced Delany's aggression, as Delany smashed him for a six over deep square leg.Imad Wasim was introduced into the attack and managed to get the dangerous Delany out with a spinning delivery. This broke the 44-run stand and reduced Ireland to 76 for 7.Joshua Little, batting at number 10, scored an unbeaten 22 to help Ireland cross the 100-run mark, but it was a case of too little, too late.",Former champions Pakistan beat Ireland by three wickets in Lauderhill. Pakistan restricted Ireland to 106 for 9 after opting to bowl first. Babar Azam (32) and Abbas Afridi (17) put together crucial 33-run partnership. Shaheen Shah Afidi sealed the win with two towering sixes.,"https://static.toiimg.com/thumb/msid-111043020,imgsize-71940,width-400,resizemode-4/111043020.jpg"
"Debutant spinner Asha Sobhana not concerned about missing five-wicket haul, happy to see India win",https://timesofindia.indiatimes.com/sports/cricket/news/debutant-spinner-asha-sobhana-not-concerned-about-missing-five-wicket-haul-happy-to-see-india-win/articleshow/111042566.cms,"NEW DELHI: Asha Sobhana , India's debutant spinner, expressed her satisfaction with the team's victory in the opening ODI against South Africa in Bengaluru, despite narrowly missing out on a five-wicket haul in her debut match.The young spinner played a pivotal role in India's commanding 143-run triumph at the M Chinnaswamy Stadium on Sunday. Her magical spell paved the way for the hosts' success.Sobhana's maiden international wicket came at a critical moment when she removed Marizanne Kapp , breaking a threatening partnership. She then made quick work of the lower order, finishing with four wickets as South Africa were skittled out for a mere 122 runs.""Not really, I'm happy that my nation won,"" Sobhana was quoted by ANI as saying when asked about missing out on a five-wicket haul.Sobhana capitalised on the spin-friendly conditions in Bengaluru, claiming four wickets in her maiden appearance. When discussing her strategy, the debutant disclosed her intention to maintain a straightforward approach.""I just kept it simple, I wanted to bowl in the right areas, I was in a good rhythm, I wanted to continue. I have been practising this [legspin] for years, I did not want to do anything extraordinary, I wanted to focus on the basics. There was a lot of turn on the wicket, I did not want to give space to the batters, wanted to vary the pace so that the batters didn't pick my variations. This stadium is very special for me, by the grace of god everything went well,"" Sobhana said after the game while talking about her approach.""Pitch is amazing and a little bit of my effort as well. I woke up in the morning today and prayed to god that everything should go well, glad that it went well. [on what the management told her earlier today] They just told me to enjoy, they had a lot of confidence in my skills, they wanted me to go out and explore,"" she added.After opting to bat, Team India faced some challenges in the early stages, but they persevered and ultimately accumulated a total of 265 runs for the loss of 8 wickets. Smriti Mandhana 's exceptional performance was the highlight of the innings, as she scored her sixth ODI century.In reply, South Africa encountered a formidable bowling attack led by Sobhana. The entire Indian bowling unit contributed effectively, with each bowler playing their part in restricting the South African team to a mere 122 runs.","India beat South Africa by 143 runs in opening ODI in Bengaluru. Debutant spinner Asha Sobhana claimed four wickets in her debut match. SobHana said she was happy with the win, despite missing out on a five-wicket haul.","https://static.toiimg.com/thumb/msid-111042562,imgsize-43602,width-400,resizemode-4/111042562.jpg"
"Pleased to score first ODI hundred at home, hope it keeps coming: Smriti Mandhana",https://timesofindia.indiatimes.com/sports/cricket/news/pleased-to-score-first-odi-hundred-at-home-hope-it-keeps-coming-smriti-mandhana/articleshow/111041943.cms,"NEW DELHI: Smriti Mandhana expressed her relief after scoring her maiden ODI century on home soil, having missed out on the opportunity several times before.The Indian vice-captain's knock of 117 was instrumental in India's dominant 143-run victory against South Africa in the opening match of the women's ODI series in Bengaluru on Sunday.Mandhana hopes to maintain her form throughout the remainder of the series. Her outstanding performance played a crucial role in setting up India's comprehensive win over the visiting South African team.""I was really mad with myself in the last 4-5 years. Whenever I played at home in ODIs, I ended up scoring 70-80 (runs) and throwing away my wicket.""Today, it wasn't an easy wicket. So, pleased to know that it (hundred at home) has happened. I hope that it keeps coming and it stays,"" Mandhana said, as quoted by PTI, in the post-match press meet.Mandhana acknowledged the crucial contributions of Deepti Sharma and Pooja Vastrakar , who batted alongside her for the sixth and seventh wickets. She praised their excellent support that helped her maintain the momentum of the innings.""I think the partnerships with Deepti and Pooja were really important. We know what Deepti can do with the bat. We had Pooja to come. She can strike a ball too. So, I wasn't really worried about what would happen.""We just spoke about spending some time (at the crease). They (SA) had spread the field. So, we were getting 4-5-6 runs (an over) without taking a risk. So, the whole conversation with Deepti was that let's just build a good partnership in the next 7-8 overs,"" said Mandhana.Mandhana and Deepti formed a crucial partnership, contributing 81 runs to India's total after the team found themselves in a precarious position at 99 for five.Following Deepti's departure, Mandhana joined forces with Pooja, and the duo put together a valuable half-century stand, propelling India to a formidable score that exceeded expectations.""When Pooja came in, she started off really good with the boundary. She took the load off me when she made that first boundary.""So, I don't think that in one-day cricket, you can just be like, okay, this is how I am going to play today. It's (game plan) just going to keep changing,"" she added.Pooja was forced to leave the field during the 18th over of South Africa's batting innings, appearing to have a slight issue with her knee.However, Mandhana put to rest any worries regarding the fast bowler's fitness, stating that she was recovering from an undisclosed injury before the start of this series.""I just passed over my cramps to her. I was struggling a bit with cramps. Nothing serious (for Pooja). I think she will be fine,"" she added.",Smriti Mandhana scores maiden ODI century on home soil. India beat South Africa by 143 runs in opening match of women's ODI series. Vice-captain thanks Deepti Sharma and Pooja Vastrakar for their support.,"https://static.toiimg.com/thumb/msid-111041961,imgsize-57992,width-400,resizemode-4/111041961.jpg"
Pakistan keep Ireland to 106-9 in T20 World Cup game,https://timesofindia.indiatimes.com/sports/cricket/icc-mens-t20-world-cup/pakistan-keep-ireland-to-106-9-in-t20-world-cup-game/articleshow/111041905.cms,"NEW DELHI: Pakistan 's pace attack, spearheaded by Shaheen Afridi , delivered a remarkable performance to limit Ireland to 106 for nine in the final T20 World Cup match in Lauderhill on Sunday.According to PTI, the seam and swing trio of Afridi (3/22), Mohammad Amir (2/11), and Haris Rauf (1/17) skillfully utilized the conditions to reduce Ireland to 32 for six in the powerplay, showcasing a sensational display of bowling prowess.Imad Wasim (3/8), a left-arm spinner, then employed his cunning to take three late wickets, contributing to Pakistan's dominant bowling performance.Gareth Delany , the top-scorer, hit three sixes and a four in his 19-ball 31, while Mark Adair (15) and George Dockrell (11) also reached double figures. Joshua Little (22 not out), batting at number 10, then swung his bat to help Ireland surpass the 100-run mark.Ireland had a disastrous start as Afridi and Amir left them reeling at 4 for three in the second over. Afridi struck twice in three balls, dismissing Andrew Balbirnie (0) and Lorcan Tucker (2) in the first over, while Amir had Ireland captain Paul Stirling (1) caught behind, leaving the top order in shambles.Tector survived a caught-behind appeal but was trapped by Afridi in the next ball with a fuller delivery that struck his back leg, reducing Ireland to 15 for 4 in 3 overs.Dockrell hit two fours to relieve some pressure, but he fell to a caught and bowled by Amir, who deceived him with a slower ball. Half of the Irish team had returned to the pavilion within the powerplay.Rauf then joined the action, dismissing Curtis Campher, who attempted a pull shot only to see the top-edge land safely in Saim Ayub's hands.Delany hit the first six of Ireland's innings off Rauf in the 9th over, before smashing spinner Shadab Khan for a six over long-on to bring up the team's fifty. Delany ended the over with a four after Rauf missed an overhead catch at the boundary.Abbas Afridi was Delany's next target, as he smoked a pitched-up delivery from the pacer over deep square leg for another maximum.Imad was then brought into the attack, and he dismissed the dangerous-looking Delany with a bouncing and spinning delivery, breaking the 44-run partnership with Ireland at 76 for 7. Imad then had Adair caught by Afridi.","Pakistan bowled Ireland out for 106 in final T20 World Cup match. Shaheen Afridi, Mohammad Amir and Haris Rauf took three wickets each. Gareth Delany hit three sixes and a four in his 19-ball 31. Joshua Little (22 not out), batting at number 10, then swung his bat to help Ireland surpass 100.","https://static.toiimg.com/thumb/msid-111041897,imgsize-28908,width-400,resizemode-4/111041897.jpg"
