Article Title,Article Link,Article Text,Article Summary,Article Image
Watch: Guard of honour for Dinesh Karthik after RCB bow out in Eliminator,https://timesofindia.indiatimes.com/sports/cricket/ipl/top-stories/watch-guard-of-honour-for-dinesh-karthik-after-rcb-bow-out-in-eliminator/articleshow/110347142.cms,"|

(With ANI inputs)

NEW DELHI: Dinesh Karthik , the top finisher for Royal Challengers Bengaluru , may have played his final cricket match in the Indian Premier League IPL ).The RCB walked away with their wings melted and scorched after soaring high with six straight victories. Their aspirations of a season straight out of a fairytale were dashed on Wednesday when the Bengaluru team bowed out from the competition in the Eliminator .In the Eliminator at the Narendra Modi Stadium, Rajasthan Royals defeated Bengaluru by four wickets in what was touted as a battle of the ""Royals.""Emotions ran high during the cricket action in the largest stadium in the world, with the cries of ""ee sala cup namde"" ceasing to exist and not reaching Chennai, the location of the title match.Removing his gloves, Karthik thanked the supporters who had stood to honor the veteran for his season-long efforts.Soon, an unforgettable moment for the supporters of the RCB occurred when contemporary cricket legend Virat Kohlihugged Karthik while he was fighting back tears.Karthik hasn't formally declared his retirement from the IPL yet, but he has made several indications during the competition that this year will be his final with his team.The RCB players presented Karthik with a guard of honour as he made his way back into the dressing room.The official X handle of the Indian Premier League shared a heart-warming video of the moment after the match.Karthik was an important player for RCB during a difficult season, particularly in the death overs. His significant late-game appearances encouraged the club to an unprecedented playoffs berth.Should this prove to be Karthik's final season, he will have finished his IPL career with 4,842 runs in 257 matches, including an incredible 22 fifty-score innings.Karthik played for six teams in the Indian Premier League during his remarkable 17-year career.Karthik debuted with the Delhi Daredevils (now the Delhi Capitals) in the 2008 inaugural season. After moving to Punjab in 2011, he then played for Mumbai Indians , Gujarat Lions, Kolkata Knight Riders and RCB.With an incredible strike rate of 187.36 and an average of 36.22, Karthik finished the current season with 326 runs in 15 games.","Dinesh Karthik may have played his final cricket match in the Indian Premier League IPL. Bengaluru team bowed out from the competition in the Eliminator. Rajasthan Royals defeated Bengaluru by four wickets in what was touted as a battle of the ""Royals""","https://static.toiimg.com/thumb/msid-110347152,imgsize-48186,width-400,resizemode-4/110347152.jpg"
Glenn Maxwell: 'What on earth was that?': Former cricketers slam Glenn Maxwell after his unwanted record in IPL Eliminator,https://timesofindia.indiatimes.com/sports/cricket/ipl/top-stories/what-on-earth-was-that-former-cricketers-slam-glenn-maxwell-after-his-unwanted-record-in-ipl-eliminator/articleshow/110347743.cms,"NEW DELHI: Glenn Maxwell 's performance proved to be the biggest disappointment for Royal Challengers Bengaluru in their IPL 2024 Eliminator clash against Rajasthan Royals on Wednesday. The star player, often hailed as the 'Big Show' for his explosive batting prowess, was dismissed for a golden duck, matching Dinesh Karthik's dubious record of 18 ducks in the Indian Premier League The critical over by veteran spinner Ravichandran Ashwin turned the game on its head.After removing the in-form Cameron Green for 27 off 21 balls, Ashwin outsmarted Maxwell with a deceptive delivery, resulting in Maxwell's golden duck. This key moment significantly contributed to RCB's downfall, leading to their eventual exit from the tournament.Former Indian all-rounder Irfan Pathan and ex-England skipper Kevin Pietersen did not hold back their criticism.Taking to X, Pathan questioned Maxwell's shot selection, posting, ""What was Maxwell doing?""His sentiment was echoed by Pietersen, who, while commentating, remarked, ""What on earth was that from Glenn Maxwell? This is a huge game, you need your biggest players to perform, you need to give yourself a chance. That from Glenn Maxwell isn't good enough.""The disappointment surrounding Maxwell's performance was palpable. Known for his aggressive and match-winning abilities, Maxwell's failure in such a critical game drew ire from fans and analysts alike. Pietersen's on-air critique underscored the gravity of Maxwell's failure to deliver when it mattered most.With this dismissal, Maxwell joined Dinesh Karthik at the top of an unwanted leaderboard for the most ducks in IPL history, each having 18 to their name. They are followed by Indian skipper Rohit Sharma with 17 ducks, and Piyush Chawla, Mandeep Singh, and Sunil Narine, each with 15 ducks.","Glenn Maxwell was dismissed for a golden duck in Royal Challengers Bengaluru's IPL 2024 Eliminator clash against Rajasthan Royals. The star player was often hailed as the 'Big Show' for his explosive batting prowess. The critical over by veteran spinner Ravichandran Ashwin turned the game on its head. This key moment significantly contributed to RCB's downfall, leading to their eventual exit.","https://static.toiimg.com/thumb/msid-110347814,imgsize-54346,width-400,resizemode-4/110347814.jpg"
IPL 2024: Rajasthan Royals tame Royal Challengers Bengaluru in Eliminator,https://timesofindia.indiatimes.com/sports/cricket/ipl/top-stories/ipl-2024-rajasthan-royals-tame-royal-challengers-bengaluru-in-eliminator/articleshow/110347967.cms,"Ashwin, Parag, Powell star as Rajasthan knock out RCB; set up second qualifier against SRH

AHMEDABAD: Rajasthan Royals batter Riyan Parag (36 off 26 balls; 2x4, 2x6) added another chapter to his evolution as a cricketer on Wednesday. Even when he lost his captain Sanju Samson to a reckless stroke and Dhruv Jurel was involved in a contentious run-out, Parag maintained his composure.Shimron Hetmyer and Rovman Powell too came to the party to take RR, who were chasing a 173-run target, past RCB by four wickets here on Wednesday.RCB's six-match winning streak ended in the Eliminator while RR will now play Sunrisers Hyderabad in the second qualifier in Chennai on Friday.The over that changed the tide in RR's favour was the 16th by Cameron Green, in which Parag hit him for a six inside out over extra cover before deftly placing him past short third man for a four. Hetmyer's maximum meant the over yielded 17 runs. This was followed by a Yash Dayal over, in which 11 runs were scored.Despite Siraj dismissing Parag with a yorker and Hetmyer being brilliantly caught by Faf Du Plessis in the 18th over, Powell, who grabbed four catches in the first innings, took them over the line with an over to spare.Chasing 173 set by RCB, RR had a sedate two overs in which they scored only six runs. Yashasvi Jaiswal (45 off 30b, 8x4) then got going, hitting 16 off a Yash Dayal over. Tom Kohler-Cadmore (20 off 15b; 4x4) then hit two boundaries off a Mohammed Siraj over. The introduction of Lockie Ferguson paid dividends as he castled the English opener with a slower yorker. Jaiswal was caught behind off Green in the 9th over.Samson was stumped in the next over and this brought Jurel and Parag together. The duo added 26 before the former was run out by some athletic piece of fielding by Virat Kohli. Parag and Hetmyer then added 45 in 25 balls to tilt the match in RR's favour.Earlier, RR bowlers stepped up, and aided by good catching, restricted RCB to 172/8. Opting to field, the Powerplay was a contest of two halves. If it was Australian left-arm pacer Mitchell Starc who shone with his swing bowling on Tuesday, it was the turn of New Zealand pacer Trent Boult to deliver the goods today.Boult didn't uproot the stumps like Starc, but delivered a dream opening spell (3-0-6-1). Denied scoring opportunities by Boult, Kohli and Du Plessis attacked the other bowlers. Kohli began with a flick off Sandeep Sharma, who was then belted down the ground for a six by Du Plessis.In a bid to break the shackles against Boult, the RCB captain danced down the wicket and slammed a short ball towards deep midwicket only to be spectacularly caught by a diving Rovman Powell.Kohli (33 off 24b; 3x4, 1x6) looked to target Yuzvendra Chahal in his first over. An attempt to slog sweep the leg spinner ended in the hands of substitute fielder Donovan Ferreira at deep mid-wicket.Cameron Green (27 off 21b; 2x4, 1x6) then smashed Chahal for a maximum over the leg side boundary and followed it up with a four over long off. Ashwin then dismissed Green and Maxwell off consecutive balls to peg back RCB.Rajat Patidar (34 off 22b; 2x4, 2x6) and Mahipal Lomror smashed sixes off Chahal before the former hit another maximum off Khan. Khan, though, had the last laugh, having Patidar caught at mid-off by Riyan Parag.Dinesh Karthik (11 off 12b; 1x4) survived a close LBW call off his first ball after DRS overturned an on field decision. However, he failed to inject momentum into the innings and was caught by Jaiswal at cover off Khan. Despite Mahipal Lomror's cameo (32 off 17b; 2x4, 2x6) , RCB never got the push towards the death overs and ended with 172.",RCB's six-match winning streak ended in the Eliminator. Rajasthan Royals will now play Sunrisers Hyderabad in the second qualifier in Chennai on Friday. The over that changed the tide in RR's favour was the 16th by Cameron Green.,"https://static.toiimg.com/thumb/msid-110347947,imgsize-80348,width-400,resizemode-4/110347947.jpg"
Watch: Sanju Samson and Ravichandran Ashwin celebrate Rajasthan Royals' victory against RCB in Eliminator,https://timesofindia.indiatimes.com/sports/cricket/ipl/top-stories/watch-sanju-samson-and-ravichandran-ashwin-celebrate-rajasthan-royals-victory-against-rcb-in-eliminator/articleshow/110346858.cms,"NEW DELHI: Rajasthan Royals ended their losing streak and Royal Challengers Bengaluru 's victory run with a four-wicket win in the Eliminator of IPL 2024 at Ahmedabad on Wednesday.The Royals will now face Sunrisers Hyderabad in Qualifier 2 at Chennai on Friday. The winner of that match will take on Kolkata Knight Riders in the final on Sunday.The official X handle of the Royals shared a short video of skipper Sanju Samson and spinner Ravichandran Ashwin celebrating the win by cutting a cake.The Royals, who won the inaugural edition of the IPL in 2008 under late Australian legend Shane Warne , bounced back from four losses in five matches including a washout. RCB 's dream run ended after they rose from the bottom of the table after eight matches to win six in a row and make the playoffs.Ashwin was adjudged the Man of the Match for two wickets that came off successive balls sending back Cameron Green, for 27, and Glenn Maxwell, for a duck.After the match, Ashwin said, ""We haven't done very well in the last few games. We didn't put par scores and we lost Buttler, and Hetmyer was injured. Today's win was important. We were a bit rusty chasing it, but this win will give us some confidence. In the first half, I felt my body wasn't moving too well for the first half of the season. I had an abdomen injury as well. I am aging as well. To come into the tournament from Test cricket was difficult, I needed some time to get that bowling rhythm. But once you have committed to your franchise, you want to go through with the season.""""I think we hit the right lengths, the way Boult was bowling, he got a bit of swing and seam movement. In the second innings, I don't think there was a lot of dew. I think there were some exceptional shots from our boys to get that chase. I think our greatest strength is the exuberance of youth and the experience we have got to support that. Now that Hettie (Shimron Hetmyer) is back in, and Rovman (Powell) got a few boundaries today as well. We've got Keshav sitting outside. We have the right momentum for this team going forward,"" Ashwin added.Sanju Samson equalled the record of Shane Warne for most victories as Rajasthan Royals skipper (31).",Rajasthan Royals beat Royal Challengers Bengaluru by four wickets in IPL 2024 Eliminator at Ahmedabad on Wednesday. Royals will now face Sunrisers Hyderabad in Qualifier 2 at Chennai on Friday. The winner of that match will take on Kolkata Knight Riders in the final on Sunday.,"https://static.toiimg.com/thumb/msid-110346852,imgsize-69570,width-400,resizemode-4/110346852.jpg"
IPL 2024: Scratchy Rajasthan Royals end RCB's sensational run with four-wicket win in Eliminator,https://timesofindia.indiatimes.com/sports/cricket/ipl/top-stories/ipl-2024-scratchy-rajasthan-royals-end-rcbs-sensational-run-with-four-wicket-win-in-eliminator/articleshow/110342360.cms,"(With inputs from PTI)

NEW DELHI: Rajasthan Royals managed to halt Royal Challengers Bengaluru 's juggernaut in the Indian Premier League , securing a hard-fought four-wicket victory in the Eliminator in Ahmedabad on Wednesday.The RR bowlers produced an all-round effort, stopping RCB to 172 for 8. However, the their batters encountered difficulties during the middle overs in chase, allowing RCB to claw back in the match, which remained evenly poised for a significant portion of the second half.Despite the challenges, the inaugural IPL champions ultimately reached the target with an over to spare, finishing at 174 for 6, thanks to Rovman Powell's composed unbeaten 16, which provided the necessary impetus in a tense conclusion.As he has done several times before this season, Riyan Parag (36 off 26) showcased deep resolve in an adverse situation to help Rajasthan stay alive in the tournament. It was Royals' first win after four losses and an abandoned game.2008 winners Royals face Sunrisers Hyderabad in Chennai on Friday for a place in the IPL final.The returning Shimron Hetmyer also played his part to perfection, scoring a crucial 26 off 14 balls.In a contest wherein fortunes swung from one side to another, RR remained ahead with impactful performances throughout even though Mohammed Siraj (2/33) raised late hopes for RCB with wickets of Parag and Hetmyer in the 18th over,With 13 needed off last two overs, Powell found two fours off Lockie Ferguson to seal the deal in favour of his side.Earlier, it was Yashasvi Jaiswal (45 off 30) who gave them the impetus at the top.Off to an unconvincing start with his initial runs coming off the outside edge, Jaiswal grew in confidence when Yash Dayal fed him a few deliveries to capitalise on and the RR opener cracked four fours in the third over to break the shackles.At the other end, Tom Kohler-Cadmore (20) also hit a couple of fours against Siraj and while getting a lifeline from Glenn Maxwell, who spilled a sitter at deep square leg off Dayal.With RR's acceleration rapidly shaving runs off the target, RCB needed a breakthrough and Lockie Ferguson provided the first success when he foxed Kohler-Cadmore with a slow yorker which crashed into the stumps.The gradual progression of Jaiswal's innings saw the batter finding his rhythm, but the extreme heat sapped him out completely having faced a mere 29 balls.In between the ninth and the 10th over, Jaiswal received on-field treatment and got back up only to play a loose shot — an attempted ramp off Cameron Green but only gloved it to the ‘keeper.Soon after, Karn Sharma dealt a body blow by having Sanju Samson (17) stumped.With their tails up, RCB continued making inroads with Dhruv Jurel (8) being run out after a brilliant effort from Virat Kohli and Cameron Green. Kohli fired a sharp throw from deep midwicket to the non-striker's end, where Jurel was found short of his crease.RR were firmly under pressure heading into the 15th over when they chose to go after Green, who had been all over them with three tidy overs and a wicket up until then.Hetmyer smacked the Australian for a six and Parag followed his partner in hitting another, while also finding a four to collect 17 runs.Earlier, Rajasthan Royals put forth a sharp bowling effort.Led by Trent Boult (4-0-16-1), who produced an opening spell of 3-0-6-1, RR bowlers kept taking wickets at crucial stages to control the game.The venerable Ravichandran Ashwin (4-0-19-2), having previously gone wicketless for a significant stretch, left an indelible mark with wickets Cameron Green (27) and Glenn Maxwell (0) on consecutive deliveries while Avesh Khan (3/44) also chipped in.Rajasthan's bowling was adequately backed up by their fielders, particularly Rovman Powell, who took two stunning catches that clipped RCB's progress.",Rajasthan Royals beat Royal Challengers Bengaluru in IPL Eliminator. Rajasthan reach 174-6 with an over to spare. Royals face Sunrisers Hyderabad in Chennai on Friday for a place in the IPL final. Yashasvi Jaiswal (45 off 30) gave RR the impetus.,"https://static.toiimg.com/thumb/msid-110342343,imgsize-79700,width-400,resizemode-4/110342343.jpg"
Virat Kohli's sensational IPL 2024 campaign ends on a bittersweet note,https://timesofindia.indiatimes.com/sports/cricket/ipl/top-stories/virat-kohlis-sensational-ipl-2024-campaign-ends-on-a-bittersweet-note/articleshow/110342197.cms,"NEW DELHI: Virat Kohli 's IPL 2024 journey concluded with a bittersweet ending, marked by outstanding individual performances yet an ultimate heartbreak.Orange Cap holder Kohli, the charismatic leader and prolific batsman, amassed an impressive 741 runs throughout the season. His remarkable consistency was reflected in an average of 61.75, showcasing his reliability and hunger for runs.ended Royal Challengers Bengaluru 's eventful campaign in the Indian Premier League with a four-wicket win in the Eliminator in Ahmedabad on Wednesday.Kohli's strike rate of 154.69 underscored his aggressive intent and ability to accelerate the scoring, keeping bowlers on their toes. His stellar season included five half-centuries and one magnificent century, proving his dominance at the crease. He lit up the tournament with 62 boundaries and 38 towering sixes, enthralling fans and driving his team forward.Throughout the season, Kohli, who became the first player to score 8000 runs in IPL, demonstrated his class and commitment, often being the backbone of his team's batting lineup. His century was a masterclass in pacing an innings, combining textbook shots with innovative stroke play. The half-centuries were crucial in building or consolidating the innings, often coming under pressure situations.Despite his extraordinary individual success, the season ended in heartbreak for Kohli and his team. The culmination of a long and grueling season saw them fall short of the ultimate prize.The disappointment was palpable, especially given Kohli's immense contributions. His eyes told the story of a warrior who had given his all, yet the elusive IPL trophy remained just out of reach.Kohli's 2024 IPL campaign will be remembered for his sheer brilliance with the bat. His performances were a testament to his skill, fitness, and mental toughness.The numbers he accumulated stand as a monument to one of the greatest batsmen in the game's history. Yet, the heartbreak of not securing the championship will undoubtedly spur him on for future campaigns.As fans reflect on the season, they will cherish Kohli's batting masterclasses while sharing in the disappointment of a title that narrowly escaped their grasp.","Orange Cap holder Kohli amassed an impressive 741 runs throughout the season. His remarkable consistency was reflected in an average of 61.75. He lit up the tournament with 62 boundaries and 38 towering sixes. Despite his extraordinary individual success, the season ended in heartbreak for Kohli and his team.","https://static.toiimg.com/thumb/msid-110342182,imgsize-50130,width-400,resizemode-4/110342182.jpg"
Heartbreaking! Virat Kohli dislodges bails in despair after RCB defeat in Eliminator,https://timesofindia.indiatimes.com/sports/cricket/ipl/top-stories/heartbreaking-virat-kohli-dislodges-bails-in-despair-after-rcb-defeat-in-eliminator/articleshow/110342536.cms,"NEW DELHI: Virat Kohli did all he could, finishing as the highest run-scorer with 741 runs in 15 matches. However, Royal Challengers Bengaluru 's dream of winning an IPL title remains elusive.After RCB suffered a four-wicket defeat against Rajasthan Royals in the Eliminator on Wednesday, Kohli was seen gently dislodging the bails that seemingly shows his disappointment of not progressing further in the tournament.Kohli amassed an impressive 741 runs at an average of 61.75, showcasing his reliability and hunger for runs. He lit up the tournament with 62 boundaries and 38 towering sixes, enthralling fans and driving his team forward.Earlier in the match, Kohli made history by becoming the first player in IPL to surpass 8000 runs. This monumental achievement underscores Kohli's consistency, skill, and dominance in the tournament since its inception.The former RCB captain achieved this milestone in his 252nd IPL match. He has 8 centuries and 55 fifties to his name so far.RCB's dream run ended after they rose from the bottom of the table after eight matches to win six in a row and make the play-offs.Talking about the match, Rajasthan restricted RCB to 172-8, successfully chasing the target with six balls to spare in the do-or-die playoff at the Narendra Modi Stadium.Rajasthan will now face Sunrisers Hyderabad in the Qualifier 2 on Friday in Chennai to determine Kolkata Knight Riders' opponent in the final on May 26.",Royal Challengers Bengaluru's dream of winning an IPL title remains elusive. Virat Kohli was seen gently dislodging the bails that seemingly shows his disappointment of not progressing further in the tournament. RCB suffered a four-wicket defeat against Rajasthan Royals in the Eliminator.,"https://static.toiimg.com/thumb/msid-110342546,imgsize-56750,width-400,resizemode-4/110342546.jpg"
'Let's fight it one more time': R Ashwin's text to Virat Kohli ahead of IPL Eliminator,https://timesofindia.indiatimes.com/sports/cricket/ipl/top-stories/lets-fight-it-one-more-time-r-ashwins-text-to-virat-kohli-ahead-of-ipl-eliminator/articleshow/110340948.cms,"NEW DELHI: Star Rajasthan Royals (RR) spinner Ravichandran Ashwin on Wednesday revealed that he challenged Royal Challengers Bengaluru (RCB) batter Virat Kohli ahead of IPL 2024 Eliminator in Ahmedabad.Led by Trent Boult (4-0-16-1), who produced an opening spell of 3-0-6-1, RR bowlers kept taking wickets at crucial stages to control the game as RR restricted RCB to 172/8 on Wednesday.The venerable Ravichandran Ashwin (4-0-19-2), who had previously endured a significant wicketless stretch, made a decisive impact by dismissing Cameron Green (27) and Glenn Maxwell (0) on consecutive deliveries.Ashwin texted Kohli saying 'let's fight it one more time' as both RR and RCB battle in a do-or-die match for a place in Qualifier 2.""It's been a tournament of two halves for me. First half into the tournament I was struggling coming from the Test series with injuries. Last few games I feel I am bowling really well. I texted Virat saying come on let's fight it one more time (smiles),"" Ashwin said at the mid-innings break.""The IPL committee has done well overall in the tournament to manage the dew. (On RR's recent poor batting efforts) Got to reset button. Also got to look at the pitches we played on in those games. Not hiding behind the fact that we didn't bat well in the last few games but it's just about hitting the reset button, go out and enjoy in the middle. (On the total) I think it's par-minus,"" Ashwin added.",Star Rajasthan Royals (RR) spinner Ravichandran Ashwin revealed that he challenged Royal Challengers Bengaluru (RCB) batter Virat Kohli ahead of IPL 2024 Eliminator in Ahmedabad. Ashwin texted Kohli saying 'let's fight it one more time' as both RR and RCB battle in a do-or-die match for a place in Qualifier 2.,"https://static.toiimg.com/thumb/msid-110340989,imgsize-71998,width-400,resizemode-4/110340989.jpg"
