Article Title,Article Link,Article Text,Article Summary,Article Image
'Hand of VAR': How technology breaks Dutch hearts in England vs Netherlands Euro 2024 semi-final - Explained,https://timesofindia.indiatimes.com/sports/football/uefa-euro-2024/hand-of-var-how-technology-breaks-dutch-hearts-in-england-vs-netherlands-euro-2024-semi-final-explained/articleshow/111691089.cms,"What happened during the

England vs Netherlands

Euro 2024 semi-final?

Was there a

Bukayo Saka

handball in the move leading up to the penalty?

What does the UEFA rule say?

What is VAR?

What incidents does the VAR check?

What incidents does the VAR not check?

What about off-the-ball incidents?

What will the VAR do when a penalty is being taken?

What about incidents not seen by the on-field officials?

NEW DELHI: Ollie Watkins scored a late winner as England defeated the Netherlands 2-1 to reach the Euro final against Spain. However, the excitement around the match was marred by controversy surrounding a penalty awarded to England after a VAR review, which Harry Kane converted to level the scores after Xavi Simons had given the Dutch the lead. The penalty decision was heavily criticized, with Gary Neville labelling it ""an absolute disgrace"".England forward Harry Kane was being well-defended near the scoring area by Netherlands' Denzel Dumfries and the ball sailed over the posts and a goal kick was awarded to the Dutch. However, Harry Kane sat on the ground clutching his leg which prompted VAR to urge Felix Zwayer to review the incident. After this, England were awarded a penalty and Harry Kane saw things through and put England back in the game.Watch:Controversy arose over a penalty awarded to England after Denzel Dumfries fouled Harry Kane, with some questioning an alleged handball by Bukayo Saka in the build-up. VAR did not identify the infringement. A supporter claimed VAR missed or ignored Saka’s handball, calling England lucky.According to UEFA's rule, it's a foul if a player prevents an opponent from playing the ball due to 'fear of getting injured.' Playing recklessly or dangerously, even without physical contact, is still punishable with a free kick or penalty.VAR (Video Assistant Referee) is a technology system conceived by the KNVB in 2010 to help reduce on-field errors in football. It assists referees by reviewing decisions related to goals, penalty decisions, direct red-card incidents, and mistaken identity. After extensive trials, VAR was first used in professional football in 2016 and has since been adopted by major leagues and international tournaments, including the FIFA World Cup and UEFA Champions League, to improve decision accuracy and fairness in the game.VAR only reviews four match-changing situations: goals, penalty decisions, direct red-card incidents, and mistaken identity.VAR won't review fouls or handballs in the middle of the pitch without a goal or penalty decision, or incorrect corner awards leading to goals, as it only checks the immediate attacking phase starting from the corner.VAR can intervene in direct red-card incidents and mistaken identity cases for clear and obvious errors or serious missed incidents, even when play is stopped. The VAR has a short window to act on unseen incidents. The FA's retrospective disciplinary process handles incidents missed by both match officials and VAR.VAR can intervene for clear and obvious errors by on-field officials regarding goalkeeper movement, double touches by the penalty taker, feigning at the kick, and encroachment with a direct impact. The 2020/21 protocol doesn't allow tolerance levels, so if a goalkeeper saves a penalty with a foot over the goalline, VAR advises a retake. If the goalkeeper is off the line and the ball misses, it’s only retaken if the goalkeeper materially impacted the miss. Encroachment is judged by any part of a player’s body on the ground at the kick, and the player must materially impact the outcome for it to be penalized.The VAR can intervene on unseen incidents until the next restart if the ball is in play, or until the second restart if the ball is out of play.","England defeated the Netherlands 2-1 in the Euro 2024 semi-final. Ollie Watkins scored a late winner to reach the final against Spain. Harry Kane converted a penalty awarded after a VAR review. The decision was heavily criticized, with Gary Neville labelling it ""an absolute disgrace""","https://static.toiimg.com/thumb/msid-111691647,imgsize-48732,width-400,resizemode-4/111691647.jpg"
Euro 2024: Who is Lamine Yamal? Spain's rising star makes history across Europe,https://timesofindia.indiatimes.com/sports/football/uefa-euro-2024/euro-2024-who-is-lamine-yamal-spains-rising-star-makes-history-across-europe/articleshow/111679599.cms,"Who is Lamine Yamal?

NEW DELHI: Barcelona enthusiasts worldwide are fervently tracking the emergence of yet another promising talent from the revered La Masia academy.Lamine Yamal , the latest sensation from Barcelona's youth ranks, etched his name into the club's storied history on April 29, 2023. Under the guidance of then-manager Xavi , Yamal , at just 15 years, nine months, and 16 days old, made his senior debut in a resounding 4-0 victory against Real Betis, becoming the youngest debutant in Barcelona's illustrious history.Throughout the 2023/24 season, Yamal continued to captivate, achieving further milestones. His meteoric rise reached unprecedented heights on September 8 during Spain 's Euro 2024 qualifying match against Georgia. Aged only 16 years and 57 days, Yamal not only became Spain's youngest-ever male international player but also their youngest goal scorer, surpassing records previously held by his Barcelona teammate, Gavi.On October 8, Yamal further solidified his place in football history by becoming the youngest scorer in Liga history. His pivotal goal for Barcelona secured a dramatic 2-2 draw against Granada, showcasing his prowess and maturity beyond his years.During Spain's Euro 2024 campaign, Yamal continued to rewrite the record books. At just 16 years and 338 days old, he became the youngest player ever to grace the European Championship, eclipsing previous records set by the likes of Kacper Kozlowski. His impactful debut in the opening Group B fixture on June 15 underscored his immense potential.In the semifinals, Yamal once again seized the spotlight, becoming the youngest goal scorer in the history of the European Championship, cementing his status as one of football's brightest prospects.As Barcelona and Spain eagerly anticipate Yamal's continued development, his early accomplishments serve as a testament to La Masia's enduring legacy of nurturing world-class talent.Lamine Yamal, born on July 13, 2007, in Esplugues de Llobregat, Spain, has swiftly become a name to watch in the football world. His multicultural background, with a Moroccan father and a mother from Equatorial Guinea, adds to the rich tapestry of his identity and has influenced his journey in the sport.Yamal's association with Barcelona began in 2014 when he joined the club's esteemed youth academy, La Masia. From an early age, he showcased exceptional talent, following the well-trodden path of young hopefuls who aspire to debut for one of the world's top football clubs.His standout performances at La Masia did not go unnoticed. The Moroccan Football Federation expressed interest in having him represent their national team at the youth level. However, Yamal chose to play for Spain, representing the country from Under-15s to Under-19s, consistently demonstrating his skill and promise on the international stage.In September 2023, Yamal's burgeoning talent earned him a call-up to the senior Spain squad for the international window. His contributions were pivotal in helping Spain secure qualification for Euro 2024. Recognizing his superb club form and international potential, Spain's coach Luis de la Fuente included Yamal in the final squad for the prestigious EURO 2024 in Germany.As Lamine Yamal continues to make waves in both club and international football, his journey serves as an inspiration to young players worldwide, exemplifying how talent, dedication, and cultural diversity can combine to create a football prodigy.","Lamine Yamal, 16, is the youngest goal scorer in La Liga history. He is also the youngest player ever to grace the European Championship. His multicultural background, with a Moroccan father and a mother from Equatorial Guinea, adds to the rich tapestry of his identity.","https://static.toiimg.com/thumb/msid-111679585,imgsize-38412,width-400,resizemode-4/111679585.jpg"
Colombia vs Uruguay Copa America brawl under investigation,https://timesofindia.indiatimes.com/sports/football/top-stories/colombia-vs-uruguay-copa-america-brawl-under-investigation/articleshow/111675866.cms,"Top Picks For You Watch: Uruguay players enter stands after Copa America semifinal defeat, throw punches at Colombian fans

CONMEBOL, the governing body of South American football , has initiated an inquiry following a physical altercation between Uruguayan players and Colombian supporters after the conclusion of their Copa America semifinal on Wednesday.Social media footage captured what seemed to be players from the Uruguayan team entering the stands and engaging in physical confrontations with fans of the opposing team, after Colombia secured a 1-0 win in Charlotte, North Carolina.Uruguay 's Darwin Nunez and Ronald Araujo were prominently involved in the brawl. According to captain Jose Maria Gimenez, the players were attempting to protect their families.Additionally, players and staff from both teams were involved in a separate confrontation on the field following the end of the match.""CONMEBOL has opened an investigation to understand the sequence of events and the responsibilities of those involved in the acts of violence that occurred at the end of the match,"" CONMEBOL said in a statement on Thursday, as reported by Reuters.""We want to reaffirm and warn that no action will be tolerated that tarnishes this global football celebration. It is unacceptable that an incident like this turns passion into violence. Therefore, no behavior that harms the sporting competition will be tolerated.""","Uruguay players enter stands after Copa America semifinal defeat, throw punches at Colombian fans. Social media footage captured what seemed to be players from the Uruguayan team entering the stands and engaging in physical confrontations with fans of the opposing team. According to captain Jose Maria Gimenez, the players were attempting to protect their families.","https://static.toiimg.com/thumb/msid-111675942,imgsize-92720,width-400,resizemode-4/111675942.jpg"
Mumbai City FC ropes in Greek striker Nikolaos Karelis,https://timesofindia.indiatimes.com/sports/football/indian-super-league/mumbai-city-fc-ropes-in-greek-striker-nikolaos-karelis/articleshow/111668663.cms,"NEW DELHI: Mumbai City FC on Thursday announced the signing of Greek striker Nikolaos Karelis for the upcoming Indian Super League season.The 32-year-old is set for his first stint in India, bringing in a wealth of experience from his career in Europe.Karelis began his youth career with Ergotelis and made his senior professional debut with them in 2007.He has since played for seven other clubs, with stints in Russia (Amkar Perm), Belgium (Genk), England (Brentford), and the Netherlands (ADO Den Haag).Mumbai City FC will be his eighth club.Throughout his career, Karelis has scored 103 goals in 361 professional matches and provided 29 assists. His best performance came with Panathinaikos, where he netted 36 goals in 114 competitive games.The 2014-15 season was especially notable for Karelis as he scored 19 goals in 50 contests.Karelis also has experience in winning titles. He won the Greek Cup with Panathinaikos during the 2013-14 season and later secured two titles with PAOK in the 2018-19 season, winning both the Super League Greece and the Greek Cup.Most recently, Karelis was with another Greek club, Panetolikos, where he was adjudged the player of the season for 2022-23.""The team has achieved significant success over the past few years, and I am eager to contribute to its continued success in the upcoming season,"" Karelis said in a release.MCFC head coach Petr Kratky said, ""Nikos is a highly talented player who perfectly matches the requirements we expect from our forwards. He has experience playing in various European countries and has consistently proven his calibre in different leagues.""","Greek striker Nikolaos Karelis signs for Mumbai City FC. The 32-year-old is set for his first stint in India. He has scored 103 goals in 361 professional matches and provided 29 assists. His best performance came with Panathinaikos, where he netted 36 goals.","https://static.toiimg.com/thumb/msid-111668836,imgsize-40862,width-400,resizemode-4/111668836.jpg"
Kombans to play at CSN Stadium,https://timesofindia.indiatimes.com/sports/football/top-stories/kombans-to-play-at-csn-stadium/articleshow/111667093.cms,"Kick off on Aug 31

Kochi franchise renames team as Kochi Pipers

KOCHI: Thiruvananthapuram Kombans FC , the capital city's representative in the newly established Super League Kerala (SLK), has secured the Chandrasekharan Nair Stadium (CSN) as their home ground for the upcoming season. The stadium, currently undergoing extensive renovation, is expected to host all of Kombans FC's home matches in the SLK. Initially, it was reported that Kombans and the Kochi franchise would share the Jawaharlal Nehru Stadium in Kaloor as their home venue.However, after discussions with SLK and the owners of the CSN Stadium , Kombans FC signed a three-year deal to use the stadium for 12 days each year. ""We are planning to construct our stadium within these three years,"" said TJ Mathew, co-owner of Kombans FC.The ongoing renovation works at the CSN Stadium, amounting to approximately Rs 1.5 crore, include resoling the football turf and installing a new set of floodlights. The cost of the turf resoling is being managed by the franchise, while SLK is responsible for the installation of floodlights.Mathew Joseph, CEO of SLK, said that the league will kick off on August 31 with the final on November 3. ""The fixtures will be finalized only after the confirmation of ISL fixtures. We need to ensure that the SLK matches do not clash with the ISL and I-League dates,"" said Joseph. He also said that the player draft would be finalized by this weekend and all the six teams have rounded off their support staff. ""All the six teams have foreign coaches hailing from Latin America and Europe,"" he said.The Kochi franchise, previously known as Kochi Pipers, has been renamed Forca Kochi FC. The new name was announced on Thursday via social media platforms. It is learned that the change in ownership, with actor Prithviraj acquiring the majority shares from Indian tennis legend Mahesh Bhupathi, necessitated the name change. The previous name, Kochi Pipers, was associated with Bhupathi’s table tennis franchise, Ahmedabad SG Pipers, in the Ultimate Table Tennis League.",Thiruvananthapuram Kombans FC signs three-year deal with Chandrasekharan Nair Stadium. Kochi franchise renames team as Kochi Pipers. Super League Kerala will kick off on August 31 with final on November 3.,"https://static.toiimg.com/thumb/msid-111667080,imgsize-55844,width-400,resizemode-4/111667080.jpg"
Watch: Spain's Carlos Alcaraz laughs off Wimbledon boos after Euros final joke,https://timesofindia.indiatimes.com/sports/tennis/wimbledon/watch-spains-carlos-alcaraz-laughs-off-wimbledon-boos-after-euros-final-joke/articleshow/111696501.cms,"NEW DELHI: Carlos Alcaraz remained unfazed by the disapproving reaction from the Centre Court crowd after making a playful remark about the upcoming Sunday being favorable for Spaniards, alluding to his presence in the Wimbledon final and Spain 's participation in the Euro 2024 final against England .The young tennis star, aged 21, finds himself on the cusp of securing back-to-back Wimbledon titles following his hard-fought 6-7 (1/7), 6-3, 6-4, 6-4 triumph over the fifth-seeded Daniil Medvedev in the semi-final match on Friday, reported AFP.However, Alcaraz's lighthearted comment about the potential for a Spanish double on Sunday during his post-match interview on court drew some ire from the spectators at the prestigious All England Club .""It will be a good day for Spanish people as well,"" defending champion -- and Real Madrid fan -- Alcaraz said when asked to look ahead to the weekend.The young tennis sensation found himself on the receiving end of playful boos from the crowd after the comment. However, he quickly responded with a charming smile, diffusing the situation and winning back the fans' affection.""I didn't say Spain is going to win but I say it will be a fun, fun day,"" he added.",Carlos Alcaraz receives playful boos from Wimbledon crowd. The 21-year-old Spaniard is on the cusp of winning back-to-back Wimbledon titles. He made a lighthearted comment about potential for a Spanish double on Sunday.,"https://static.toiimg.com/thumb/msid-111696448,imgsize-35076,width-400,resizemode-4/111696448.jpg"
Defending champion Carlos Alcaraz beats Daniil Medvedev to reach Wimbledon final,https://timesofindia.indiatimes.com/sports/tennis/wimbledon/defending-champion-carlos-alcaraz-beats-daniil-medvedev-to-reach-wimbledon-final/articleshow/111695354.cms,"NEW DELHI: The defending Wimbledon champion, Carlos Alcaraz secured his spot in the men's singles final after a hard-fought victory against Daniil Medvedev .The world No. 3 overcame a first-set loss to defeat Medvedev 6-7 (1/7), 6-3, 6-4, 6-4, setting the stage for a potential rematch of the 2023 final against Novak Djokovic .Alcaraz, displaying composure beyond his 20 years, acknowledged the pressure of the upcoming final but emphasized his growing experience.He admitted to initial nerves and praised Medvedev's strong start. However, Alcaraz showcased his resilience, breaking Medvedev's serve at crucial moments and dictating play with his powerful groundstrokes. He finished the match with an impressive 55 winners.""Obviously it will be a really difficult match. Let's see who I am going to play on Sunday. I feel like I am not new anymore. I know how I am going to feel before the final. I have been in this position before. I started really nervous today. Daniil was dominating the match, playing great tennis . It was difficult for me,"" said Alcaraz, as quoted by AFP.Medvedev, visibly frustrated throughout the match, received a code violation for unsportsmanlike conduct after disputing a line call. Despite claiming the first set tie-breaker, he struggled to maintain consistency against Alcaraz's relentless attack.Alcaraz now awaits the winner of the second semi-final between seven-time Wimbledon champion Novak Djokovic and rising Italian star Lorenzo Musetti.Djokovic, aiming for a record-equalling eighth Wimbledon title, is considered the favourite against Musetti. A victory would mark his 10th Wimbledon final appearance and 37th Grand Slam final overall.Despite undergoing knee surgery earlier this year, Djokovic has shown his trademark resilience and determination throughout the tournament.Musetti, making his Centre Court debut, faces a formidable challenge against Djokovic. While acknowledging Djokovic's legendary status, Musetti will draw confidence from pushing Djokovic to five sets in their previous encounter at the French Open.The potential for an all-Italian Grand Slam final is also on the line, with Jasmine Paolini set to compete in the women's singles final against Barbora Krejcikova.The stage is set for a captivating Wimbledon final weekend, with history on the line for both Alcaraz and his yet-to-be-determined opponent.","Defending champion Carlos Alcaraz beats Daniil Medvedev 6-7 (1/7), 6-3, 6-4,6-4. World No. 3 will now face Novak Djokovic or Lorenzo Musetti in Sunday's final.","https://static.toiimg.com/thumb/msid-111695474,imgsize-33312,width-400,resizemode-4/111695474.jpg"
'Welcome to Wimbledon’: Rohit Sharma makes rare appearance at ‘Big W’,https://timesofindia.indiatimes.com/sports/tennis/wimbledon/welcome-to-wimbledon-rohit-sharma-makes-rare-appearance-at-big-w/articleshow/111693232.cms,"NEW DELHI: The Indian T20 World Cup-winning captain Rohit Sharma made a surprising appearance at Wimbledon with the Friday fixtures lining up semi-final matches featuring Carlos Alcaraz against Daniil Medvedev , and Novak Djokovic against Lorenzo Musetti .Rohit's visit to the iconic Centre Court came during his vacation in London, following his recent triumph of leading the Indian team to their first T20 World Cup title in 17 years.Former Indian cricketer Dinesh Karthik was also spotted enjoying the Wimbledon action on Friday.Earlier, the Wimbledon Centre Court witnessed a special moment when the announcer acknowledged the presence of cricketing legend Sachin Tendulkar , hailing him as a World Cup winner and the highest run-scorer in the history of the sport.The semi-final matches at Wimbledon promise intense battles as players vie for a spot in the final and a chance to etch their names in tennis history.Defending champion Carlos Alcaraz, aged 21, aims to reach his fourth Grand Slam final and potentially join an elite group by winning both the French Open and Wimbledon consecutively.Despite facing challenges at Wimbledon this year, including tough matches against Frances Tiafoe and Ugo Humbert, Alcaraz holds a 4-2 advantage over his semi-final opponent, Daniil Medvedev, whom he defeated at last year's US Open. Medvedev, on the other hand, seeks his seventh Grand Slam final appearance after defeating top-seed Jannik Sinner.In the other semi-final, Novak Djokovic, the seven-time Wimbledon champion, is eyeing his 10th final at the prestigious tournament. At 37 years old, he has the potential to become the oldest modern-era champion, following recent knee surgery.Djokovic received a semi-final berth after Alex de Minaur's withdrawal and will face Lorenzo Musetti, against whom he holds a 5-1 record, including a dramatic five-set victory at the French Open last month. Musetti, 22, has shown promise and resilience, having pushed Djokovic to the limit in previous encounters.",Rohit Sharma makes surprise appearance at Wimbledon on Friday. Indian cricketing legend Sachin Tendulkar also in attendance. Carlos Alcaraz faces Daniil Medvedev in semi-final. Novak Djokovic takes on Lorenzo Musetti in other semi.,"https://static.toiimg.com/thumb/msid-111693740,imgsize-65282,width-400,resizemode-4/111693740.jpg"
