Article Title,Article Link,Article Text,Article Summary,Article Image
Senior ICC official resigns over T20 World Cup conduct: Report,https://timesofindia.indiatimes.com/sports/cricket/icc-mens-t20-world-cup/senior-icc-official-resigns-over-t20-world-cup-conduct-report/articleshow/111698597.cms,"Just a week ahead of the Annual Conference of the International Cricket Council ( ICC ), two senior officials of the apex body of the sport have resigned, as reported by Cricbuzz.Chris Tetley, ICC's Head of Events, and Claire Furlong, General Manager of Marketing and Communications, have reportely put in their papers to step down from their respective roles.The development is likely related to the scrutiny of the matches hosted by the US and in particular the games that were played at the Nassau County International Cricket stadium in New York . However, the exact reason is yet to be ascertained and ICC insiders have reportedly revealed that the resignations were tendered months ago.The Cricbuzz reports states: ""One particular source has claimed that both Tetley and Furlong decided to leave the world body at the end of the last commercial cycle itself but stayed on in view of the Twenty20 World Cup in the US. The source went on to add that the two quit quite some time back but will continue to be with the ICC for a few more months 'to ensure smooth transition of charge in a crowded event cycle.' They will also attend the Annual Conference in Colombo from July 19 to 22.""The pop-up stadium in New York, which was dismantled after the conclusion of the group stage of the T20 World Cup , was in the news because of the nature of the drop-in pitches used at the venue, which were difficult to bat on and were uneven in nature. Some of the ICC members were reportedly waiting for the upcoming Annual Conference to raise the issue.The venue, built by an entity called T20 World Cup Inc, also hosted the India vs Pakistan game, which saw India successfully defending a low score of 119.After the India vs Pakistan match, the ICC issued a statement on the nature of the tracks used at the Nassau County stadium, stating that ""the ICC recognise that the pitches used so far at the Nassau County International Cricket Stadium have not played as consistently as we would have all wanted. The world-class grounds team have been working hard since the conclusion of yesterday's game to remedy the situation and deliver the best possible surfaces for the remaining matches.""The T20 World Cup was held from June 1 to 29.","Chris Tetley, ICC's Head of Events, and Claire Furlong, General Manager of Marketing and Communications, have resigned. The development is likely related to the scrutiny of the matches hosted by the US and in particular the games that were played at the Nassau County International Cricket stadium in New York.","https://static.toiimg.com/thumb/msid-111698554,imgsize-69680,width-400,resizemode-4/111698554.jpg"
"Memories of another day: Revisiting James Anderson's battles with Virat Kohli, Sachin Tendulkar",https://timesofindia.indiatimes.com/sports/cricket/news/memories-of-another-day-revisiting-james-andersons-battles-with-virat-kohli-sachin-tendulkar/articleshow/111702940.cms,"The retiring England pace great had some memorable duels with India's star batters during his long career

CHENNAI: ""Let me know if you want to become a part of our support-staff."" As the curtain fell on the career of one of the greatest of all time, the unique job offer from James Anderson made six years ago came to mind.It was the summer of 2018 and Anderson was suddenly hit by a force that hadn't really bothered him till then.Virat Kohli had discovered a way to deal with the legendary English paceman and Anderson, then 35, was caught off-guard. After the immense struggles of 2014, when Anderson had got Kohli four times for virtually nothing, the Indian master had come to England with a plan.Kohli threw the age-old formula of playing late against English swing bowlers out of the window and decided to take guard outside the crease against Anderson and his pace partner Stuart Broad . The then Indian captain decided that he would play the Anderson delivery before it breaks for the swing, turning the duel into one of the most riveting contests that you can ever witness.In the first Test in Birmingham on a mighty difficult track, Kohli got a magnificent century in the first innings by taking on Anderson. Yes, he offered a couple of difficult chances which weren't grabbed, but that's par for the course. It was an innings of incredible quality and when Anderson was bombarded with questions on Kohli by the Indian journalists, the English pacer looked slightly annoyed. When TOI asked him whether he would look to bowl slightly short to counter Kohli's new method of taking guard outside the crease, the unique job offer (with a hint of irritation) mentioned above came about.After the complete one-sided nature of the 2014 series when Anderson ruled over Kohli, the Englishman couldn't get the Indian great out once in the 2018 series. England won the series 4-1, Anderson had his moments in the sun, but this became one of the most iconic battles ever. The English pacer, who bowled in international cricket for the last time in Lord's on Friday, had to wait for three more years to get Kohli's scalp twice in 2021, but by then the honours had been shared.Anderson had Kohli seven times in 25 Tests that they played against each other, but the Englishman has a far better record against Sachin Tendulkar . The king of swing got the Little Master nine times in the 14 games that they played, yet Anderson feels ""Sachin is the batter I have ever bowled to"".The statement seems slightly contradictory because of the success-rate, but it probably boils down to the fact that Anderson couldn't make Tendulkar change his game. The man with 51 Test hundreds remained the same player, going about his business in the classical way of playing it late, as he won and lost in equal measure against the best swing bowler of the 21st century.Sachin and Anderson had some fascinating battles over the years, but the one that probably stands out is one of their latter duels at Eden Gardens in 2012. The series was 1-1 at that stage and on a murky Kolkata day, Tendulkar batted brilliantly in the first two sessions, dealing with the swing of Anderson in his beautiful, old-fashioned way.It was in the third session that Anderson made one to swing as late as possible that kissed the outside edge of Sachin's bat and the catch was completed by the keeper. Our hearts broke, the match swung, the series turned, but over time we were left to cherish those memories that still makes cricket a beautiful game.","James Anderson bowled in international cricket for the last time in Lord's on Friday. The retiring England pace great had some memorable duels with India's star batters during his long career. Anderson had Kohli seven times in 25 Tests that they played against each other, but the Englishman has a far better record against Sachin Tendulkar.","https://static.toiimg.com/thumb/msid-111702887,imgsize-45276,width-400,resizemode-4/111702887.jpg"
Novak Djokovic goes past Lorenzo Musetti to set up Wimbledon final against Carlos Alcaraz,https://timesofindia.indiatimes.com/sports/tennis/wimbledon/novak-djokovic-goes-past-lorenzo-musetti-to-set-up-wimbledon-final-against-carlos-alcaraz/articleshow/111702298.cms,"Novak Djokovic , a seven-time Wimbledon champion, showcased his exceptional skills on the court, defeating Italy's Lorenzo Musetti , the 25th seed, in straight sets. The Serbian maestro secured a 6-4, 7-6(2), 6-4 victory, earning him a spot in his 10th Wimbledon final.In the championship match, Djokovic will face the defending champion, Carlos Alcaraz , setting the stage for an exciting rematch of their 2023 encounter.This marks the first time since 2014-15, when Djokovic and his longtime rival Roger Federer competed in consecutive finals, that the same two players will battle in the title match in back-to-back years.""I've said it many times, Wimbledon has been a childhood dream for me to play and to win... I was a seven-year-old boy watching bombs fly over my head and dreaming of being on the most important court in the world,"" Djokovic told the Centre Court crowd, as reported by Reuters.""I was constructing Wimbledon trophies out of any material in the room. It has been an incredible journey. I try not to take it for granted every time I find myself on this unique court.""Obviously, during the match, it's business time and... I try outplay my opponent. I'm satisfied and pleased, but I don't want to stop here. Hopefully I get my hands on the trophy.""Djokovic, the second seed, secured a break in the sixth game of the first set, following an intense 27-shot rally.This was shortly after Alcaraz's hard-fought 6-7(1), 6-3, 6-4, 6-4 triumph over fifth seed Daniil Medvedev, while spectators were still arriving at the Centre Court.Despite having expressed frustration with the crowd after his fourth-round victory against Holger Rune on Monday, the 37-year-old Djokovic encouraged more support from the audience, even though his actions elicited some boos.The fans rallied behind Musetti, who responded by breaking back to make it 4-5 with a powerful forehand. However, the 22-year-old Italian's shaky service game ultimately cost him the set.In the second set, Musetti quickly regained his composure and made progress, executing a stunning backhand pass to take a 3-1 lead. Djokovic, however, remained unfazed as he fought his way back into the set. The Serbian elevated his performance significantly towards the end, securing the tiebreak and further solidifying his position in the match.Djokovic showcased his versatility by employing serve-and-volley tactics, putting Musetti under immense pressure. Despite a late resurgence from the Italian, who managed to earn a break point, Djokovic held his nerve and clinched the match on his fourth match point when Musetti's shot sailed long.After securing the victory, he performed his signature celebration, pretending to play the violin with his racquet. This was for his daughter, who was watching from the stands and is currently learning to play the violin herself. However, his actions were met with increased jeers from the spectator.Djokovic remains undeterred by the crowd's reaction, as his focus lies on securing a record-equalling eighth Wimbledon title, a remarkable feat considering he underwent knee surgery just five weeks prior to the tournament.""I came to London eight days before the tournament started. I didn't know (if I would play). I was keeping everything open until the day of the draw,"" Djokovic said.""I played a couple of practice sets with top players and that proved to me I was in good enough state to not just be in Wimbledon, but to go deep into the tournament. That kind of mentality is there and is ever present. Thanks to the team members for helping me.""The win puts 24-times Grand Slam champion moved one step closer to his sixth consecutive Wimbledon final and his first of an inconsistent season.","Novak Djokovic defeated Italy's Lorenzo Musetti 6-4, 7-6(2), 6-3. The Serbian will now face defending champion Carlos Alcaraz in the final. It will be the first time since 2014-15 that DjOKovic and Roger Federer will meet in back-to- back finals.","https://static.toiimg.com/thumb/msid-111702303,imgsize-44850,width-400,resizemode-4/111702303.jpg"
Argentina seek 'triple crown' but Colombia aim for upset in Copa America final,https://timesofindia.indiatimes.com/sports/football/top-stories/argentina-seek-triple-crown-but-colombia-aim-for-upset-in-copa-america-final/articleshow/111703169.cms,"NEW DELHI: Argentina are on the brink of achieving an unprecedented feat in South American football by winning three consecutive major tournaments if they can defeat a strong Colombian side in the Copa America final on Sunday.Led by the talismanic Lionel Messi, Argentina secured the Copa America title in 2021 and followed it up with a World Cup victory the following year.They have progressed to the final this weekend against Colombia with relative ease.A victory would not only make Argentina the second team in international football history to win a World Cup sandwiched between two continental titles, after Spain's achievements in 2008, 2010, and 2012, but it would also give them a record-breaking 16th Copa America title, surpassing their current shared record of 15 with Uruguay.However, Colombia enters the highly anticipated match at the Hard Rock Stadium in Miami with an impressive unbeaten run of 28 games, a national record. They have arguably faced a more challenging path to the final, having overcome Uruguay 1-0 in the semi-finals despite being reduced to ten men for the entire second half.The final promises to be a perfect conclusion to the tournament, with the two best teams competing for the title in front of what is expected to be a passionate and lively crowd, given the significant presence of both Argentinian and Colombian communities in Miami.While Argentina, ranked number one in the world by FIFA and boasting a well-established team, are the favourites, the match is expected to be closely contested.""Scaloni knows them all by heart. Argentina today have a solidity that is foolproof and they have the added bonus of having the best player in the world, which is why they are the big favourites,"" said former Chile and Inter Milan striker Ivan Zamorano, who is covering the tournament is a television pundit.But former Colombia star midfielder Carlos Valderrama believes a surprise could be on the cards.""I see Colombia winning on Sunday,"" he told AFP, ""We have a great team to dream about.""I am optimistic about the national team, because of the process and the results they have been getting, and also because of the way they are playing.""The team is unbeaten, is playing well in the Copa, with James (Rodriguez) as the best player in the tournament, so we can dream of being champions because we have a great team,"" he added.Carlos Valderrama, a former Colombian midfield maestro, thinks an unexpected outcome might be in store.Despite never fully meeting expectations at the club level, Rodriguez, who captivated the world with his 2014 World Cup performances in Brazil, is now playing some of his best football for his country at the age of 34.Colombia's only Copa America victory was in 2001.For Argentina, there is a sentimental aspect to Sunday's match, as it will also serve as a farewell to the national team for Angel Di Maria, who is 36 years old.""I'm not ready for my last game with the national team, but it's time,"" he said this week.""A thousand things can happen, but I think that whatever happens I can go out on a high note. I've done everything to be able to leave through that door,"" added the Benfica midfielder.Nicolas Otamendi's future with the team is uncertain, as he may also leave. However, it is unclear if this will be Messi's final tournament, considering he will be 39 years old when the 2026 World Cup takes place.""I'm living it like everything else in recent times: enjoying it very much and being aware, like Fideo (Di Maria) and Ota (Otamendi), that these are the last battles,"" the eight-times Ballon d'Or winner said after the semi-final win.CONMEBOL, the tournament organizers, are hopeful that the conflicts will be limited to the football pitch, in contrast to the events that unfolded in Charlotte.The conclusion of the game between Colombia and Uruguay was marred by violent altercations among fans, with Uruguayan players entering the crowd and participating in the brawls.""We want to reaffirm and warn that no action will be tolerated that tarnishes this global football celebration,"" CONMEBOL said in a statement on Thursday.These incidents have cast a shadow over the tournament, which is being regarded as a trial run for the venues that will host matches during the 2026 World Cup, jointly hosted by the United States, Canada, and Mexico.Although Charlotte is not a designated host city for the 2026 World Cup, Miami is set to host seven games, including a quarter-final and the third-place match.","Argentina face Colombia in the Copa America final on Sunday. Victory for Argentina would see them win three consecutive major tournaments. Colombia are unbeaten in 28 games, a national record. Former Colombia midfielder Carlos Valderrama believes a surprise could be on the cards.","https://static.toiimg.com/thumb/msid-111703162,imgsize-64906,width-400,resizemode-4/111703162.jpg"
Carlos Alcaraz wants 'perfect' Sunday for Spain at Wimbledon and Euros,https://timesofindia.indiatimes.com/sports/tennis/wimbledon/carlos-alcaraz-wants-perfect-sunday-for-spain-at-wimbledon-and-euros/articleshow/111703580.cms,"NEW DELHI: Carlos Alcaraz is determined to contribute to a flawless sporting Sunday for his homeland, Spain. His goal is to secure victory in the Wimbledon final against Novak Djokovic prior to Spain's clash with England in the Euro 2024 championship match.Having triumphed 6-7 (1/7), 6-3, 6-4, 6-4 against fifth seed Daniil Medvedev in the semi-final on Friday, Alcaraz finds himself just one win away from clinching his second consecutive Wimbledon title.The young Spaniard, an avid supporter of Real Madrid, extended an invitation to the club's renowned midfielder Luka Modric to witness the Wimbledon semi-final from the players' box.Throughout the Euros, Alcaraz has maintained communication with the Spanish team.His aspiration is to commence a momentous day for Spain by emerging victorious and hoisting the prestigious All England Club trophy, mere hours before his nation's footballers take on England in the Euro 2024 final in Berlin.""Being a Spaniard, yeah, it would be a perfect Sunday,"" he said.""It's going to be a really fun day for Spanish people watching my final, watching the Euros final.""Obviously these last days I've spoke with a few (Spain) players. We send best of luck in every match. Obviously we send the best of luck on Sunday.""Alcaraz, a beloved player at Wimbledon, made a playful remark during his post-match interview after defeating Medvedev. His lighthearted comment about the possibility of an all-Spanish championship Sunday could have potentially irked the All England Club spectators.""It will be a good day for Spanish people as well,"" Alcaraz said when asked to look ahead to the weekend.Alcaraz's comment about the upcoming day elicited playful jeers from the audience, but he responded with a grin, saying: ""I didn't say Spain is going to win but I say it will be a fun, fun day.""The highly anticipated match between Alcaraz and Novak Djokovic is expected to conclude before the start of the Euro final between Spain and England. The young Spanish tennis star remarked: ""I have to think of my work. Hopefully let's see if the final is going to be at a good hour to watch the Euros final.""Alcaraz also discussed his growing friendship with Luka Modric, the Croatian midfielder who has achieved remarkable success with Real Madrid, winning six Champions League titles and four La Liga championships.""Yeah, Luka is a really nice person. We've met a couple of times,"" Alcaraz said, expressing his admiration for the accomplished footballer.""We spoke a little bit. He wanted to come. There's always going to be spot for him. Amazing guy, amazing athlete that I admire a lot. It's great to have him in the box supporting.""Alcaraz, the young tennis sensation, is on the cusp of securing his fourth Grand Slam victory. However, he remains mindful of the formidable challenge that lies ahead in the form of Novak Djokovic, who is in pursuit of making history.Djokovic, the seasoned Serbian player, has the opportunity to match Roger Federer's impressive feat of eight Wimbledon men's singles titles. Moreover, a victory at this tournament would propel him to an unprecedented 25th Grand Slam title, surpassing the current record held in both men's and women's singles.""Everybody knows Djokovic. He has played multiple Grand Slam finals and won a lot of them. Last year it was a really difficult match. He put me in real trouble,"" he said.""But, yeah, I know how it's going to feel playing against Djokovic. I know what I have to do. I'm sure he knows what he has to do to beat me.""It's going to be a really interesting one. But I'm ready to take that challenge and I'm ready to do it well.""",Carlos Alcaraz is just one win away from clinching his second consecutive Wimbledon title. The young Spaniard extended an invitation to the club's renowned midfielder Luka Modric to witness the Wimbledon semi-final from the players' box.,"https://static.toiimg.com/thumb/msid-111703565,imgsize-69028,width-400,resizemode-4/111703565.jpg"
