Article Title,Article Link,Article Text,Article Summary,Article Image
"1st ODI: Ton-up Smriti Mandhana, spinners fashion India's 143-run win over South Africa",https://timesofindia.indiatimes.com/sports/cricket/news/1st-odi-ton-up-smriti-mandhana-spinners-fashion-indias-143-run-win-over-south-africa/articleshow/111041265.cms,"NEW DELHI: Smriti Mandhana 's determined century and a disciplined bowling performance, spearheaded by spinners Deepti Sharma and Asha Sobhana , led India to a commanding 143-run victory over South Africa in the first women's ODI in Bengaluru on Sunday.India now lead the three-match series 1-0, with the second game scheduled for June 19.Mandhana's sixth ODI century (117 off 127 balls, including 12 fours and a six) was the cornerstone of India's competitive total of 265 for eight on a sluggish Chinnaswamy pitch.Indian bowlers then showcased their excellence by dismissing the South African team for just 122 runs. Debutant leg-spinner Asha took the spotlight with a miserly spell of 4/21, complemented by off-spinner Deepti, who took 2/10.Pacer Renuka Singh provided India with an ideal start, dismissing the in-form South African captain Laura Wolvaardt in the first over.Wolvaardt was bowled out by an exceptional nip-backer from Renuka that clipped the top of her off-stump.The Indian bowlers quickly claimed the wickets of Tazmine Brits and Anneke Bosch, reducing the visitors to 33 for three.Experienced batter Marizane Kapp (24 off 39 balls), who hit Renuka for consecutive four and six, tried to revive the innings with Sune Luus, who contributed a solid 33.However, their partnership of 39 runs for the fourth wicket consumed 68 balls, making the required run rate climb above seven, and it never came down.Asha ended this partnership when she had Kapp caught at covers by Harmanpreet Kaur .At 74 for five, South Africa faced a steep uphill battle.Earlier in the match, Mandhana's innings was pivotal to India’s success, thrilling the home crowd with a well-paced century.Mandhana formed two crucial partnerships, first with Deepti (37 off 48 balls, three fours) and then with Pooja Vastrakar (31 not out), rescuing India from a precarious 99 for five.Mandhana and Deepti shared an 81-run stand from 92 balls for the sixth wicket. Pooja, who had to leave the field later due to a knee niggle, assisted Mandhana with a 58-run partnership off 54 balls for the seventh wicket.Mandhana, known for her flair, chose a more cautious approach due to the team’s situation and the slow pitch, which top-order players like Shafali Verma (7), Harmanpreet Kaur (10), and Jemimah Rodrigues (17) struggled to adapt to, leading to their dismissals.When India's fifth wicket fell, Mandhana was on 33 and recognized the need to preserve her wicket.She mostly accumulated runs through smart placements but didn’t hesitate to go for boundaries when opportunities arose.An impressive pull shot off debutant pacer Anne Dercksen and a stylish advance down the track to hit off-spinner Nondumiso Shangase over mid-on highlighted Mandhana’s elegance.Deepti played a key role in easing the pressure on Mandhana with a confident innings.Deepti picked her bowlers well and found the gaps to accumulate runs. She particularly targeted Shangase, sweeping for all her three boundaries.However, a low-bouncing delivery from pacer Ayabonga Khaka led to Deepti dragging a wide ball onto her stumps.Mandhana continued her solid batting and reached 99 off 115 balls from 93 with a beautifully timed six off pacer Masabata Klaas over mid-on.She then took a single off Klaas to notch her century in 116 balls.Mandhana fell shortly after reaching her hundred to a delivery from Klaas, but by then, she had guided India to a formidable total.","India beat South Africa by 143 runs in the first women's ODI in Bengaluru. Smriti Mandhana scored 117 off 127 balls, including 12 fours and a six. India bowled out South Africa for just 122 runs on a slow Chinnaswamy pitch.","https://static.toiimg.com/thumb/msid-111041308,imgsize-77228,width-400,resizemode-4/111041308.jpg"
T20 World Cup 2024: Shaheen Afridi becomes fourth bowler to pick 2 wickets in the first over,https://timesofindia.indiatimes.com/sports/cricket/icc-mens-t20-world-cup/t20-world-cup-2024-shaheen-afridi-becomes-fourth-bowler-to-pick-2-wickets-in-the-first-over/articleshow/111041183.cms,"T20 World Cup 2024: Two wickets in the first over

Ruben Trumpelmann vs OMN

vs OMN Fazalhaq Farooqi vs UGA

vs UGA Arshdeep Singh vs USA

vs USA Shaheen Afridi vs IRE

NEW DELHI: The T20 World Cup 2024 has been nothing short of spectacular, with bowlers across teams making headlines from the very first over of their respective matches. The tournament has seen some sensational performances that have set the tone for what's to come.In the exhilarating atmosphere of the T20 World Cup 2024, four bowlers etched their names into the annals of cricket history with stellar performances, claiming two wickets in the very first over of their respective matches.This rare feat was accomplished by four exceptional bowlers, each hailing from different cricketing nations, leaving an indelible mark on the tournament's history.It started off with Namibia's Ruben Trumpelmann who showcased his skill against Oman by taking two crucial wickets in the opening over. His precision and swing left the opponents reeling, setting up a fantastic start for his team. This performance was not just about taking wickets but also about sending a strong message to future opponents.Afghanistan's left-arm pacer Fazalhaq Farooqi, facing Uganda, mirrored Trumpelmann's feat with an equally impressive display of pace and movement. Farooqi's ability to exploit the conditions and dismantle the top order of Uganda was a sight to behold. His early breakthroughs were instrumental in setting up a dominant position for his team.Young Indian pace sensation Arshdeep Singh took the challenge against the USA, showcasing his talent by claiming two top-order wickets in the first over. Arshdeep's knack for understanding the batsman's mindset and exploiting their weaknesses was evident, proving his mettle on the international stage.Pakistani speedster Shaheen Afridi, known for his lethal pace and accuracy, did not disappoint against Ireland. Afridi's opening over was a masterclass in seam bowling, leaving the Irish batsmen dumbfounded.These remarkable performances in the T20 World Cup 2024 have not only provided thrilling starts to the matches but have also highlighted the critical role bowlers play in the shortest format of the game.These moments of brilliance from Trumpelmann, Farooqi, Arshdeep, and Afridi underscored the excitement and drama of the T20 World Cup, reminding fans why cricket is a game of glorious uncertainties.","Four bowlers took two wickets in the first over of the T20 World Cup 2024. Ruben Trumpelmann, Fazalhaq Farooqi, Arshdeep Singh and Shaheen Afridi are the four bowlers to make the headlines. These performances have highlighted the critical role bowlers play in cricket.","https://static.toiimg.com/thumb/msid-111041174,imgsize-32230,width-400,resizemode-4/111041174.jpg"
'You can't chase 120 vs India...': Virender Sehwag hands reality check to Pakistan,https://timesofindia.indiatimes.com/sports/cricket/icc-mens-t20-world-cup/you-cant-chase-120-vs-india-virender-sehwag-hands-reality-check-to-pakistan/articleshow/111041067.cms,"T20 World Cup 2024:

|

NEW DELHI: Pakistan suffered an embarrassing first-round exit from the Twenty20 World Cup after the USA-Ireland match was abandoned because of rain. This was 2009 champions earliest-ever elimination from a T20 World Cup .Pakistan's campaign began with a stunning loss against the debutant USA team, a match that left fans and experts in disbelief. The team's struggles continued as they succumbed to a defeat against arch-rivals India.Pakistan drew criticism from all quarters for their early ouster from the tournament and former India opener Virender Sehwag highlighted their inability to win against the first-timers and chase down 120 against India.""How can you blame rain? Even if you had won, you didn't deserve to go ahead. You would've lost in Super Eight stage. You wouldn't have had easier opponents there. You need to realise that you are losing to first-timers, you don't deserve to go ahead. You can't chase 120 runs against India, score 113 with wickets remaining... how can you blame the rain?"" Sehwag told Cricbuzz.The ICC often keeps India and Pakistan in the same group during World Cups. This decision is influenced by various factors, including the massive television audience that tunes in to watch these high-stakes matches.By ensuring that these two cricket powerhouses face off against each other, the ICC aims to maximize viewership and generate substantial revenue from commercials. But Sehwag reckons that ICC need to rethink their strategy.""In 2007, neither India nor Pakistan qualified for the second round. We were in different groups back then. Now, ICC will rethink on keeping India and Pakistan in a group and ensure they don't keep a team that beats them!"" Sehwag said.",Pakistan suffered an embarrassing first-round exit from the Twenty20 World Cup after the USA-Ireland match was abandoned because of rain. Former India opener Virender Sehwag highlighted their inability to win against the first-timers and chase down 120 against India. ICC often keeps India and Pakistan in the same group during World Cups.,"https://static.toiimg.com/thumb/msid-111041095,imgsize-54932,width-400,resizemode-4/111041095.jpg"
Christian Eriksen on target but Danes held 1-1 by Slovenia in Euro 2024,https://timesofindia.indiatimes.com/sports/football/top-stories/christian-eriksen-on-target-but-danes-held-1-1-by-slovenia-in-euro-2024/articleshow/111042798.cms,"Christian Eriksen found the back of the net for Denmark in a 1-1 stalemate against Slovenia at Euro 2024 in Stuttgart on Sunday, nearly three years after his near-fatal incident during his team's first match at the previous tournament.The Manchester United midfielder put his team in front on 17 minutes in a stadium predominantly filled with Denmark fans, but Erik Janza 's late deflected shot secured a point for Slovenia in their first Euro match since 2000.Denmark's next Group C encounter is against England in Frankfurt on Thursday, while Slovenia will face Serbia in Munich.According to AFP, Denmark's remarkable run to the semi-finals of Euro 2020, which was postponed due to the pandemic, was fueled by the emotional response to Eriksen's on-pitch collapse in Copenhagen, where he required resuscitation after suffering a cardiac arrest.Following the implantation of a cardioverter defibrillator, Eriksen eventually made his comeback, returning to international football nine months later and participating in the 2022 World Cup.In the lead-up to Denmark's Euro 2024 opener, Eriksen expressed that the traumatic event is no longer a constant thought, instead focusing on helping his nation make another deep run in the tournament.Slovenia midfielderTimi Max Elsnik acknowledged that there would be few surprises between the two sides, as they had finished just behind Denmark on head-to-head record in their qualifying group.Highly-rated Slovenia striker Benjamin Sesko nearly caught Kasper Schmeichel off guard with a powerful long-range effort, but moments later, Denmark struck first.A quick throw-in was flicked on by Jonas Wind into Eriksen's path, who fired a low shot into the far corner to give the Danes the lead.Despite Sesko being closely marked by the Danish defense, Andraz Sporar failed to capitalize on a gap in the backline, miscontrolling a bouncing ball when he appeared to be through on goal.Sesko nearly gifted Denmark a second goal when he inadvertently cleared the ball against his teammate, with Jan Oblak watching anxiously as the ball narrowly missed the target.Eriksen missed a chance to extend the lead just before half-time, while Slovenia defender Jaka Bijol nearly headed into his own net following a Denmark set-piece early in the second half.Oblak made a courageous stop to deny Rasmus Hojlund from doubling the advantage, blocking the United forward's close-range effort to keep his team in the game.As Slovenia pushed for an equalizer, Adam Gnezda Cerin glanced a cross wide, and Sporar stabbed wide while attempting to meet a free-kick.Sesko was incredibly unfortunate to see his powerful drive rebound off the post, but Slovenia soon found their equalizer.Denmark failed to properly clear a corner, and Janza's fierce half-volley from just outside the penalty area deflected off Morten Hjulmand, leaving Schmeichel helpless.Sporar had an opportunity to secure victory for Slovenia after outpacing Jannik Vestergaard, but he shot into the side-netting as Schmeichel appeared to get the slightest of touches.",Christian Eriksen scores for Denmark in 1-1 draw against Slovenia at Euro 2024 in Stuttgart. Manchester United midfielder suffered near-fatal cardiac arrest during Denmark's first match at the previous tournament. Erik Janza's late deflected shot secured a point for Slovenia in their first Euro match since 2000.,"https://static.toiimg.com/thumb/msid-111042793,imgsize-42762,width-400,resizemode-4/111042793.jpg"
Kylian Mbappe rules out representing France at Paris Olympics,https://timesofindia.indiatimes.com/sports/football/top-stories/kylian-mbappe-rules-out-representing-france-at-paris-olympics/articleshow/111042280.cms,"NEW DELHI: Kylian Mbappe , the captain of the French national team, has confirmed that he will not be participating in the upcoming Paris Olympics .""For the Olympics my club has a position which is very clear so that means I think I will not participate in the Olympics. That is how it is,"" Mbappe was quoted as saying by AFP on Sunday.The announcement comes as Mbappe prepares to lead France in their opening Euro 2024 match against Austria on Monday.The 25-year-old striker recently signed with Real Madrid and will join the European champions for the upcoming season after leaving Paris Saint-Germain ( PSG ) on a free transfer.The men's Olympic football tournament is scheduled to begin on July 24 and conclude with the final on August 9. However, this timeline conflicts with the start of the Spanish football season , which is set to commence a week later.Additionally, Real Madrid is scheduled to face Atalanta in the UEFA Super Cup in Warsaw on August 14, further complicating Mbappe's potential participation in the Olympics.""Joining a new team in September would not be the best way to begin my adventure,"" admitted Mbappe, who had previously stated a wish to be able to play for Thierry Henry's French Olympic team.""I wish the best to the France team. I will of course watch all their games as a spectator rather than an actor, and I hope they bring back the gold medal.""Lionel Messi also announced his decision to skip the upcoming Olympic Games this week. Despite having the opportunity to secure a second gold medal for Argentina, the renowned footballer chose not to participate in the event.",Kylian Mbappe has confirmed that he will not be participating in the upcoming Paris Olympics. The 25-year-old striker recently signed with Real Madrid and will join the European champions for the upcoming season after leaving Paris Saint-Germain on a free transfer. The men's Olympic football tournament is scheduled to begin on July 24.,"https://static.toiimg.com/thumb/msid-111042266,imgsize-42988,width-400,resizemode-4/111042266.jpg"
Late Wout Weghorst goal gives Dutch 2-1 win over Poland in Euro 2024,https://timesofindia.indiatimes.com/sports/football/top-stories/late-wout-weghorst-goal-gives-dutch-2-1-win-over-poland-in-euro-2024/articleshow/111041302.cms,"NEW DELHI: Wout Weghorst , a substitute striker, scored the winning goal with his first touch, giving the Netherlands a well-deserved 2-1 comeback victory against Poland in their Group D opener at the European Championship in Hamburg on Sunday.The goal came in the 83rd minute when Weghorst slid in to convert Nathan Ake 's perfectly placed pass into the area, sending the Dutch fans at the Volksparkstadion into a frenzy.""So important to get the early win and for me personally it's a dream scenario,"" the 31-year-old said of his 12th goal for the Netherlands.""I saw it coming and I felt the goal coming. Our aim now is to leave with the trophy,"" Weghorst was quoted as saying by Reuters.Poland took a surprise lead in the 16th minute when Adam Buksa, filling in for the injured Robert Lewandowski, rose above three defenders to flick home a corner from stand-in captain Piotr Zielinski.The Dutch equalized in the 29th minute through Cody Gakpo's low shot from outside the area, which took a deflection off defender Bartosz Salamon before beating Wojciech Szczesny.The Dutch squandered numerous chances throughout the match, with Tijjani Reijnders, Memphis Depay, Gakpo, and Virgil van Dijk all failing to convert opportunities in the first half.In the second half, Denzel Dumfries saw his header saved by Szczesny, and Xavi Simons shot wide on a break before Weghorst's decisive goal.Dutch coach Ronald Koeman will be relieved to have started the tournament with a win, especially with challenging matches against Austria and France still to come in Group D.For Polish coach Michal Probierz, the result was disappointing despite his team's strong defensive performance, and it ended his eight-match unbeaten run with the national side.",Netherlands beat Poland 2-1 in their Group D opener at the European Championship. Substitute striker Wout Weghorst scored the winning goal with his first touch. Adam Buksa gave Poland the lead in the 16th minute. Cody Gakpo equalized in the 29th minute through a deflection.,"https://static.toiimg.com/thumb/msid-111041284,imgsize-43508,width-400,resizemode-4/111041284.jpg"
Hamburg police fire shots at axe-wielding person at Euro 2024 fan parade,https://timesofindia.indiatimes.com/sports/football/top-stories/hamburg-police-fire-shots-at-axe-wielding-person-at-euro-2024-fan-parade/articleshow/111039212.cms,"NEW DELHI: German police fired shots at an individual who threatened them with a pickaxe and an incendiary device during a Euro 2024 football fan parade in central Hamburg.The information was shared on a police social media post on platform X.Following the incident, a major police operation has been initiated. The attacker is currently receiving medical treatment for injuries.The confrontation took place in Hamburg's St Pauli district as Poland and the Netherlands are set to compete at the Volksparkstadion at 3 p.m. (1300 GMT).Fan marches were planned before the games, with a parade for Dutch fans occurring at 12:30 p.m. (1030 GMT), around the same time as the incident.Germany is the host of the month-long Euro 2024 tournament, which started on Friday night.",Police fire shots at an individual who threatened them with a pickaxe and an incendiary device during a Euro 2024 football fan parade in central Hamburg. The attacker is currently receiving medical treatment for injuries. Poland and the Netherlands are set to compete at the Volksparkstadion at 3 p.m. (1300 GMT),"https://static.toiimg.com/thumb/msid-111039238,imgsize-126314,width-400,resizemode-4/111039238.jpg"
Italy see off Albania 2-1 after disastrous start in Euro 2024,https://timesofindia.indiatimes.com/sports/football/top-stories/italy-see-off-albania-2-1-after-disastrous-start-in-euro-2024/articleshow/111027477.cms,"NEW DELHI: Italy managed to overcome the shock of conceding the fastest goal in European Championship history, defeating Albania 2-1 in Dortmund on Saturday. Alessandro Bastoni and Nicolo Barella secured the victory for the defending champions in their opening match.Albania's fans created an electric atmosphere at the Dortmund BVB Stadion when Nedim Bajrami scored from a tight angle just 23 seconds into the game, taking advantage of a careless throw-in by Federico Dimarco.According to Reuters, the goal broke the previous record set by Russia's Dmitri Kirichenko, who scored after 67 seconds against Greece in 2004.Despite the early setback, Italy remained composed and equalized in the 11th minute through Bastoni's header from a short corner delivered by Lorenzo Pellegrini.Barella, who recently returned from injury, put the Azzurri ahead five minutes later with a powerful strike from outside the box. Davide Frattesi nearly extended Italy's lead in the 34th minute, but Albanian goalkeeper Thomas Strakosha tipped his chipped shot onto the post.Italy's young team, assembled by coach Luciano Spalletti, dominated possession with quick and precise passing, although they struggled to create many clear-cut chances.Central defender Riccardo Calafiori put in an impressive performance in only his third international appearance, filling in for more experienced teammates who were out with injuries.Spalletti took charge of the national team in September following Roberto Mancini 's controversial decision to coach Saudi Arabia, despite having led Italy to victory at Euro 2020.The tournament in Germany serves as an important stepping stone for Italy's aspirations to return to the World Cup after failing to qualify in 2018 and 2022.Italy's credentials will face a sterner test on Thursday when they take on Spain, who comfortably defeated Croatia 3-0 in Berlin earlier on Saturday.Meanwhile, Albania will face Croatia on Wednesday in Group B.",Italy beat Albania 2-1 in their opening game of the European Championship. Nedim Bajrami scored the fastest goal in European Championship history. Alessandro Bastoni and Nicolo Barella secured the victory for the Azzurri. Italy will face Spain in their second match on Thursday.,"https://static.toiimg.com/thumb/msid-111027474,imgsize-96696,width-400,resizemode-4/111027474.jpg"
Albania's Nedim Bajrami scores fastest ever Euros goal after 23 seconds,https://timesofindia.indiatimes.com/sports/football/top-stories/albanias-nedim-bajrami-scores-fastest-ever-euros-goal-after-23-seconds/articleshow/111027182.cms,"NEW DELHI: Albania 's Nedim Bajrami scored the fastest goal in European Championship history, finding the net after a mere 23 seconds in their Group B opener against Italy in Dortmund on Saturday.According to AFP, Bajrami's strike shattered the previous record of 67 seconds, set by Russia's Dmitri Kirichenko against Greece in 2004.The Sassuolo player capitalised on a misplaced throw-in by Italy's Federico Dimarco , blasting the ball high into the net from inside the box.Despite the early setback, Italy quickly regrouped and equalized through Alessandro Bastoni in the 11th minute. Just five minutes later, Nicolo Barella put the defending champions ahead, showcasing their resilience and quality.The list of fastest goals in the tournament's history also includes Luke Shaw's strike for England against Italy in the Euro 2020 final at Wembley three years ago.Shaw's goal, scored after one minute and 56 seconds, remains the sixth-fastest in the competition's history, although Italy ultimately triumphed in that final on penalties.",Albania's Nedim Bajrami scores fastest goal in European Championship history. Striker scores after 23 seconds in Group B opener against Italy. Previous record of 67 seconds was set by Russia's Dmitri Kirichenko against Greece in 2004.,"https://static.toiimg.com/thumb/msid-111027175,imgsize-48956,width-400,resizemode-4/111027175.jpg"
