Article Title,Article Link,Article Text,Article Summary,Article Image
Ashwin reveals how an angry MS Dhoni put Sreesanth in his place,https://timesofindia.indiatimes.com/sports/cricket/news/ashwin-reveals-how-an-angry-ms-dhoni-put-sreesanth-in-his-place/articleshow/111691772.cms,"NEW DELHI: Ravichandran Ashwin 's autobiography, 'I Have The Streets - A Kutty Cricket Story,' is a captivating read that spans his journey from his early years to India's momentous World Cup victory in 2011.The 184-page book is filled with amusing anecdotes and occasional insights into Ashwin's innovative mindset, always eager to explore unconventional approaches.The book is co-authored by Sidharth Monga and published by Penguin Random House .One of the most gripping stories in the book revolves around an incident in Port Elizabeth (now known as Gqeberha) in 2010, during a limited overs match against South Africa.An infuriated Mahendra Singh Dhoni instructed Ashwin to tell team manager Ranjib Biswal to book S Sreesanth on the next available flight back home.The reason behind this decision was Sreesanth's repeated disregard for the skipper's calls to sit in the dug-out with other reserves for a massage in the dressing room.The book also delves into Ashwin's ' Mankading ' debut as a teenager and WV Raman 's efforts in shaping him into a formidable off-spinner.While the autobiography steers clear of sob stories and excessive dramatization, it offers readers an engaging and insightful look into the life and career of one of India's most talented cricketers.""I take water. MS drinks. Two overs later, I take more. He drinks more. Then again. I have carried more water for MS than anyone else. When I go in for the drink break, MS asks, ‘Where is Sree?' PTI quoted Ashwin's narration.""It is possibly the most neutral way of asking a question. It is also the MS way. You just can't make out why he is asking. I don't know what to tell him because I don't know what it might lead to. MS insists on finding out.""I tell him Sree is upstairs in the dressing room. He tells me to tell Sree he has to come down and sit with the other reserves.""""Anyway, on the way back from the drinks break, I am wondering how, while keeping wicket in an international match, MS even noticed that Sree was not sitting downstairs. I go back and tell M. Vijay, who is in his cooling glasses with his feet up on another chair, ‘Hey, Monk, MS asked Sree to come down.""Monk tells me, ‘Hey, you go and tell him. Don't expect me to do that.'""......I go into the changing room and I tell him, ‘Sree, MS wants you to come down.' ‘Why? You can't carry water?' responds Sreesanth.""I tell him I didn't say anything. He said he wants you to come down. He said the reserves should be together for the game. Sree says, ‘Okay, you go. I will come.'""I return to my drink duties. The next time I have to go with a helmet. This time I can sense MS is angry, and I have never seen him lose his cool. ‘Where is Sree? What is he doing?' MS asks sternly.""""I tell him he is getting a massage. MS doesn't say anything. In the next over, he calls me to return the helmet. He is calm now. While giving me the helmet, he says, ‘Do one thing. Go to Ranjib sir. Tell him Sree is not interested in being here. Ask him to book his ticket for tomorrow so he can go back to India.""""I am stunned. I'm not sure what to say. I am just staring at his face. MS goes, ‘What happened? You don't understand English either now?'Ashwin humorously described the effectiveness of the solution, stating that 'it worked like magic'.""Sree quickly gets up and gets dressed. Not only that, but now he assumes the drinks duties. The next time MS needs a drink, Sree makes sure he charges out. Instead of taking the drink from him, MS motions for me to come over. ‘Did you tell Ranjib sir or not?' he asks me.""MS and Sree sort it out later, but during that period I am caught in a situation in which I would ideally be laughing but am too scared to do so,"" wrote the second Indian bowler to take 500 wickets in Tests.Ashwin, known for his strong belief in adhering to the rules and maintaining fairness in the sport, shared a memory from his childhood. He recalled an incident during a school cricket match when his father, Ravichandran, instructed him to dismiss the non-striker for gaining an unfair advantage by leaving the crease prematurely.""At twelve, I am bowling during a tense climax for Rao's Cricket Clinic, our PSBB school coach Chandrasekhar Rao's team, against DAV Gopalapuram at the RKM Cricket Ground, when I see Appa gesture from behind the striker that the non-striker is stealing ground even before I let the ball go.""He wants me to Mankad him. I do it. No one thinks it's weird, and there are no protests. The coach just doesn't speak to Appa for a week.""The book also highlights the deep respect for former India opener WV Raman, who is highly esteemed in Indian cricket for his technical expertise.""Raman and I are made for each other. For the life of me, I can't keep repeating the same thing. And Raman the coach comes up with something every day to help me keep discovering spin bowling to its fullest,"" he wrote elaborating how Raman improved his technique by straightening his run-up from an angular one, which helped correct his alignment and enhanced his overall performance.","Ashwin's autobiography, 'I Have The Streets - A Kutty Cricket Story,' is a captivating read. The 184-page book is filled with amusing anecdotes and occasional insights into Ashwin's innovative mindset. Ashwin is known for his strong belief in adhering to rules and maintaining fairness in the sport.","https://static.toiimg.com/thumb/msid-111691702,imgsize-53348,width-400,resizemode-4/111691702.jpg"
Anderson Vs Kohli: Anderson vs Kohli and Sachin: A Battle to Remember,https://timesofindia.indiatimes.com/city/chennai/anderson-vs-kohli-and-sachin-a-battle-to-remember/articleshow/111701362.cms,"Chennai: “Let me know if you want to become a part of our support-staff.” As the curtain fell on the career of one of the greatest of all time, the unique job offer from James Anderson made six years ago came to mind.It was the summer of 2018 and Anderson was suddenly hit by a force that hadn’t really bothered him till then. Virat Kohli had discovered a way to deal with the legendary English paceman and Anderson, then 35, was caught off-guard.After the immense struggles of 2014, when Anderson had got Kohli four times for virtually nothing, the Indian master had come to England with a plan.Kohli threw the age-old formula of playing late against English swing bowlers out of the window and decided to take guard outside the crease against Anderson and his pace partner Stuart Broad. The then Indian captain decided that he would play the Anderson delivery before it breaks for the swing, turning the duel into one of the most riveting contests that you can ever witness.In the first Test in Birmingham on a mighty difficult track, Kohli got a magnificent century in the first innings by taking on Anderson. Yes, he offered a couple of difficult chances which weren’t grabbed, but that’s par for the course. It was an innings of incredible quality and when Anderson was bombarded with questions on Kohli by the Indian journalists, the English pacer looked slightly annoyed. When TOI asked him whether he would look to bowl slightly short to counter Kohli’s new method of taking guard outside the crease, the unique job offer (with a hint of irritation) mentioned above came about.After the complete one-sided nature of the 2014 series when Anderson ruled over Kohli, the Englishman couldn’t get the Indian great out once in the 2018 series. England won the series 4-1, Anderson had his moments in the sun, but this became one of the most iconic battles ever. The English pacer, who bowled in international cricket for the last time in Lord’s on Friday, had to wait for three more years to get Kohli’s scalp twice in 2021, but by then the honours had been shared.Anderson had Kohli seven times in 25 Tests that they played against each other, but the Englishman has a far better record against Sachin Tendulkar . The king of swing got the Little Master nine times in the 14 games that they played, yet Anderson feels “Sachin is the batter I have ever bowled to”.The statement seems slightly contradictory because of the success-rate, but it probably boils down to the fact that Anderson couldn’t make Tendulkar change his game. The man with 51 Test hundreds remained the same player, going about his business in the classical way of playing it late, as he won and lost in equal measure against the best swing bowler of the 21st century.Sachin and Anderson had some fascinating battles over the years, but the one that probably stands out is one of their latter duels at Eden Gardens in 2012. The series was 1-1 at that stage and on a murky Kolkata day, Tendulkar batted brilliantly in the first two sessions, dealing with the swing of Anderson in his beautiful, old-fashioned way. It was in the third session that Anderson made one to swing as late as possible that kissed the outside edge of Sachin’s bat and the catch was completed by the keeper. Our hearts broke, the match swung, the series turned, but over time we were left to cherish those memories that still makes cricket a beautiful game.","James Anderson bowled in international cricket for the last time in Lord’s on Friday. Anderson had Kohli seven times in 25 Tests that they played against each other, but the Englishman has a far better record against Sachin Tendulkar.","https://static.toiimg.com/thumb/msid-111701360,imgsize-21404,width-400,height-225,resizemode-72/111701360.jpg"
Euro 2024: Why Germany's labour law is prohibiting Lamine Yamal to play for 90 minutes,https://timesofindia.indiatimes.com/sports/football/uefa-euro-2024/euro-2024-why-germanys-labour-law-is-prohibiting-lamine-yamal-to-play-for-90-minutes/articleshow/111666779.cms,"Top Picks For You Lamine Yamal: The youngest player to score a goal in Euro finals

NEW DELHI: Lamine Yamal , that 16-year-old Barcelona star, has taken the Football world by fire. It seems that whatever he does becomes a record or breaks the one. The moment he took the field for Spain against Croatia, Yamal became the youngest player ever to play in the European Championship, aged 16 years and 338 days.Moments later he set another record by providing an assist to Dani Carvajal in Spain's 3-0 win against Croatia, becoming the youngest player ever to assist in Euro, although he didn't score in the match.But eventually, he would score.In the semi-final, France took the early lead against Spain with Randal Kolo Muani's goal in the eighth minute, thanks to a cross by Kylian Embappe. Spain was lagging when Yamal skillfully trespassed the French defence to score the equalizer. Yamal scored in the 21st minute of the match and added to his name the record of the youngest-ever player to score in Euros.Aged 16 years and 362 days, he broke the previous record of Switzerland player Johan Vonlanthen, who also scored against France, in 2004, at the age of 18 years and 141 days. Spain eventually defeated France 2-1 to enter the final. Spanish coach Luis de la Fuente praised Yamal's goal and described it as ""a touch of genius"".Despite all these achievements, coach Fuente has been finding it hard to play him for the full 90 minutes in Euros. Why? Because it is illegal in Germany, the host nation ofEuro 2024 .As per the labour law of Germany, minors are not allowed to work beyond 8 pm. Although there's some relaxation for athletes but even for them the deadline is 11 pm. While Spain's quarterfinal against Germany kicked off at 6 pm, many of their matches so far, including the semi-final against France, began at 9 pm German time. Given the 90 minutes of regulation time along with the injury time in each half, 15 minutes of break, and the post-match interviews, it would have pushed the Yamal to work beyond 11 pm.Due to German labour law, the Spanish coach was forced to sub-off Yamal in group stage matches at the 86th minute, 71st minute, and 19th minute in matches against Croatia, Italy, and Albania, respectively. If Yamal works (plays) beyond 11 PM then the Spanish FA will be fined 30,000 euros.Yamal featured for the entire duration of the match in the round of 16 match against Georgia where Spain emerged victorious with a scoreline of 4-1. However, this potentially puts the Royal Spanish Football Federation (RFEF) in a position where they could face a penalty amounting to approximately $32,500. The uncertainty lies in whether the German authorities impose the fine on the RFEF or not.Interestingly, the Euro 2024 final on Monday is also scheduled to kick off at 9 pm German time, as three-time champions Spain is set to take on Harry Kane-led England. He will be, almost certainly, part of the starting XI but whether he will be subbed off or not is the question that looms large.The young Spanish winger is set to celebrate his 17th birthday just one day before the Euro 2024 final. Spain has the option to substitute him for the second half of the match. However, if they choose not to make this substitution, they can face significant legal consequences under German law.The decision to keep Yamal on the field for the entire game would result in a substantial financial penalty for the Spanish team. However, if Spain manages to secure the victory, the coaching staff and management will consider the money well spent.","Lamine Yamal, 16, is the youngest player ever to play in the European Championship. Yamal scored in the 21st minute of the match and added to his name the record of the youngest-ever player to score in Euros. The Barcelona winger is set to celebrate his 17th birthday just one day before the Euro 2024 final.","https://static.toiimg.com/thumb/msid-111666779,imgsize-45468,width-400,resizemode-4/111666779.jpg"
Wanindu Hasaranga quits Sri Lanka T20 captaincy ahead of India series,https://timesofindia.indiatimes.com/sports/cricket/news/wanindu-hasaranga-quits-sri-lanka-t20-captaincy-ahead-of-india-series/articleshow/111665029.cms,"NEW DELHI: Sri Lankan all-rounder Wanindu Hasaranga has stepped down from his role as the captain of the national T20I team ahead of the upcoming three-match series against India.This decision comes in the wake of Sri Lanka 's disappointing performance in the T20 World Cup , where they failed to progress beyond the group stage.Hasaranga, who has been a vital cog in Sri Lanka's limited-overs setup, cited the best interests of Sri Lanka Cricket as the primary reason for his resignation.The 25-year-old acknowledged that relinquishing the captaincy duties would allow him to focus solely on his performances as a player, thereby contributing more effectively to the team's cause.""Hasaranga said it is in the best interest of Sri Lanka Cricket that he decided to relinquish the captaincy duties and remain in the side as a player,"" a release from Sri Lanka Cricket (SLC) noted.In a statement released by Sri Lanka Cricket (SLC), Hasaranga expressed his unwavering commitment to the national team, stating, ""Sri Lanka will always have my utmost best efforts as a player, and I will support and stand by my team and leadership as always.""SLC, while accepting Hasaranga's resignation, acknowledged his importance as a key player in their international cricketing plans.""Sri Lanka Cricket, while accepting his resignation, wishes to state that Hasaranga will remain an important player for us in our international cricketing plans,"" it further added.Hasaranga's tenure as the T20I captain was relatively short-lived, having assumed the role in July 2022. However, his impact on the team's performances was significant, with his all-round abilities often proving to be a game-changer. His leadership skills were put to the test during the T20 World Cup, where Sri Lanka's campaign fell short of expectations.As Sri Lanka prepare to host India for a limited-overs series, comprising three T20Is and three ODIs, the focus will shift to identifying Hasaranga's successor as the T20I captain.","Wanindu Hasaranga steps down as captain of the Sri Lanka T20I team. Decision comes in the wake of Sri Lanka's disappointing performance in the T20 World Cup. Sri Lanka will host India in a three-match series, comprising three T20Is and three ODIs.","https://static.toiimg.com/thumb/msid-111665238,imgsize-35866,width-400,resizemode-4/111665238.jpg"
How West Indies' guard of honour plans for James Anderson failed,https://timesofindia.indiatimes.com/sports/cricket/news/how-west-indies-guard-of-honour-plans-for-james-anderson-failed/articleshow/111675334.cms,"The West Indies ' intention to pay tribute to England's legendary bowler James Anderson with a guard of honour on day two of the first Test at Lord's was derailed by an unexpected moment of jubilation.Anderson, who has taken a record-breaking 703 Test wickets as a fast bowler and his playing his 188th Test, stepped out to bat on Thursday in what is his last match in the England jersey.It is customary for the fielding team to form a guard of honour when a prominent opposition player is batting for the last time in a Test match. However, just before the 41-year-old Anderson walked out to a standing ovation from the packed crowd at Lord's, Mikyle Louis executed a brilliant run out to dismiss Shoaib Bashir, triggering exuberant celebrations among the West Indies players.As a result, when Anderson emerged from the pavilion, only former West Indies skipper Jason Holder was present to greet him with a handshake.At stumps on the second day, the West Indies trailed by 171 runs with only four wickets remaining, making it almost certain that this was Anderson's final innings with the bat for England.""We spoke about it before he came out to bat, that we were going to give him a guard of honour,"" West Indies fast bowler Jayden Seales was quoted by AFP.""Obviously the run out took us all the way down to Swiss Cottage (the neighbouring district in northwest London to St John's Wood, in which Lord's is located), so it was pretty hard to do the guard of honour for the great man. Luckily, Jason caught up with him.""However, as it turned out, Anderson had to return to the dressing room without even facing a ball as debutant Jamie Smith (70) was dismissed as the last England wicket to fall.""I think the biggest missed opportunity was not seeing Jimmy face one off their left-arm spinner,"" said Smith.""That's the one regret about my innings. I'm a bit disappointed I couldn't hit one more six to allow him his moment. It's been an honour to play alongside him in my first game. Everyone will miss him when he goes. If we're in a position where he has to bat in the second innings, I'd be a bit worried, so hopefully he can get wickets with the ball instead.""Anderson, England captain Ben Stokes and newcomer Gus Atkinson each claimed two wickets as the West Indies crumbled to 79 for 6 by the end of play on Thursday. This followed their dismal first-innings total of 121 in the opening match of the three-Test series.","West Indies were due to pay tribute to legendary bowler James Anderson with guard of honour on day two of first Test at Lord's. However, Mikyle Louis executed a brilliant run out to dismiss Shoaib Bashir, triggering exuberant celebrations among the West Indies players. Anderson has taken a record-breaking 703 Test wickets as a fast bowler.","https://static.toiimg.com/thumb/msid-111675576,imgsize-64938,width-400,resizemode-4/111675576.jpg"
"WCL 2024: World Championship of Legends Semi-Finals Qualified Teams, venue, date & time",https://timesofindia.indiatimes.com/sports/cricket/news/wcl-2024-world-championship-of-legends-semi-finals-qualified-teams-venue-date-time/articleshow/111654584.cms,"Which four teams have qualified for the

World Championship of Legends 2024

semi-finals?

Qualified Teams

:

Australia Champions

Pakistan Champions

West Indies Champions

India Champions

When and where is the World Championship of Legends 2024 semi-final taking place?

Semi-Final Matches:

First Semi-Final: Pakistan vs West Indies

Second Semi-Final: Australia vs India

NEW DELHI: The inaugural World Championship of Legends (WCL) 2024 is approaching its riveting denouement as the tournament progresses to the knockout stage, poised to commence later this week. The field will be whittled down from six teams to four.The participating teams, comprising India Champions , Pakistan Champions , Australia Champions , England Champions, West Indies Champions and South Africa Champions have been embroiled in intense competition, exhibiting the prowess of former cricket luminaries.Following the culmination of the single round-robin phase, where each team clashed against the others, the top four teams in the WCL standings will proceed to the semi-finals . The triumphant of these pivotal matches will cement their places in the historic first-ever World Championship of Legends final.As the tournament reaches its final four, let's take a meticulous look at the teams that have qualified for the WCL 2024 semi-finals, as well as the schedule and other pertinent information.Venue : County Cricket Ground, NorthamptonDate: July 12, 2024Time: 12:30 PM Local Time (5 PM IST)Venue: County Cricket Ground, NorthamptonDate: July 12, 2024Time: 4:30 PM Local Time (9 PM IST)","The inaugural World Championship of Legends (WCL) 2024 is approaching its riveting denouement. The tournament progresses to the knockout stage, poised to commence later this week. The field will be whittled down from six teams to four. The top four teams in the WCL standings will proceed to the semi-finals.","https://static.toiimg.com/thumb/msid-111654526,imgsize-46968,width-400,resizemode-4/111654526.jpg"
BCCI's decision not to go to Pakistan for Champions Trophy: Omar Abdullah,https://timesofindia.indiatimes.com/sports/cricket/news/bccis-decision-not-to-go-to-pakistan-for-champions-trophy-omar-abdullah/articleshow/111657316.cms,"NEW DELHI: According to Omar Abdullah , the leader of the Jammu and Kashmir National Conference, the Board of Control for Cricket in India ( BCCI ) decided not to send the Indian cricket team to Pakistan for the ICC Champions Trophy .The 2025 ICC Champions Trophy will take place in Pakistan in February and March next year. A BCCI source informed ANI on Thursday morning that ""India will not travel to Pakistan for the Champions Trophy 2025.""The BCCI source added that the International Cricket Council (ICC) would be notified by the Indian board to move its matches to Dubai or Sri Lanka.Abdullah feels that Pakistan must also do its part to foster improved ties with India; he does not think that India bears the entire burden of doing so.""What is new in this? Both countries have not played bilateral series for many years, it is BCCI's own decision not to go for the tournament. I have always said that it is not only our country's responsibility to establish better relations between these two countries, if better relations are to be made then it is Pakistan's responsibility too,"" Abdullah told reporters, as per ANI.""The kind of attacks that are happening should not happen, the kind of atmosphere that is there should not be there, Pakistan will also have to play its role in this so that the relations between the two countries improve,"" he added.Because of the strained relations between the two countries, India has not participated in any cricket competitions in Pakistan since the 2008 Asia Cup .The last bilateral series between the two countries took place in India from December 2012 to January 2013. Only at ICC competitions and the Asia Cup have the two countries faced off since then.India's cricket board had suggested to Pakistan that all of their matches be held in one city. According to a report by ESPNcricinfo, Lahore has been selected as the venue for all of India's matches. But the idea of visiting Pakistan does not appeal to the Indian board.",The 2025 ICC Champions Trophy will take place in Pakistan in February and March next year. India has not participated in any cricket competitions in Pakistan since the 2008 Asia Cup. The last bilateral series between the two countries took place in India from December 2012 to January 2013.,"https://static.toiimg.com/thumb/msid-111657303,imgsize-27420,width-400,resizemode-4/111657303.jpg"
