Article Title,Article Link,Article Text,Article Summary,Article Image
Mauricio Pochettino leaves Chelsea after just one season in charge,https://timesofindia.indiatimes.com/sports/football/epl/top-stories/mauricio-pochettino-leaves-chelsea-after-just-one-season-in-charge/articleshow/110312564.cms,"(With AFP inputs)

NEW DELHI: Mauricio Pochettino 's tenure as Chelsea manager has come to an end after a single season, with the club announcing the decision as mutual.Despite a strong finish to the campaign, the Blues fell short of their objectives, securing a sixth-place finish in the Premier League but failing to qualify for the Champions League or claim any silverware.The club released a statement on Tuesday confirming the news, expressing gratitude for Pochettino's efforts during his brief stint at the helm. While the team's performance improved in the latter stages of the season, it was not enough to meet the high expectations set by the club's hierarchy and fanbase.""Chelsea FC can confirm that the club and Mauricio Pochettino have mutually agreed to part ways,"" Chelsea said in a statement.Chelsea's American ownership group, led by Todd Boehly , co-owner of the LA Dodgers, and Clearlake Capital , a private equity firm, has invested over £1 billion ($1.3 billion) in new talent since taking control just two years ago.Pochettino attributed the team's inconsistent performance to a combination of factors, including a lack of experience among the players and a significant number of injuries.Despite these challenges, Chelsea demonstrated their potential by reaching the finals of both the League Cup and the FA Cup, narrowly losing 1-0 to Liverpool and Manchester City, respectively.The team's strong finish to the season, with five straight victories, secured their place in European competition for the upcoming year.They will qualify for the Europa League if Manchester United lose to City in the FA Cup final and the Conference League if the Red Devils shock the English champions.""Thank you to the Chelsea ownership group and sporting directors for the opportunity to be part of this football club's history,"" said Pochettino.""The club is now well positioned to keep moving forward in the Premier League and Europe in the years to come.""Chelsea sporting directors Laurence Stewart and Paul Winstanley said: ""On behalf of everyone at Chelsea, we would like to express our gratitude to Mauricio for his service this season.""He will be welcome back to Stamford Bridge any time and we wish him all the very best in his future coaching career.""",Mauricio Pochettino's tenure as Chelsea manager has come to an end after a single season. The club announced the decision as mutual. Chelsea finished sixth in the Premier League but failed to qualify for the Champions League or claim any silverware. The team reached the finals of both the League Cup and the FA Cup.,"https://static.toiimg.com/thumb/msid-110312559,imgsize-30170,width-400,resizemode-4/110312559.jpg"
"Salah hints at Liverpool stay, targets trophies next season",https://timesofindia.indiatimes.com/sports/football/epl/top-stories/salah-hints-at-liverpool-stay-targets-trophies-next-season/articleshow/110310539.cms,"(With AFP inputs)

Mohamed Salah , the prolific Liverpool forward, has unequivocally declared that he and his teammates ""will fight like hell"" to secure silverware in the forthcoming season.The Egyptian maestro's resolute statement serves as a tantalizing hint that he will, at the very least, honor the ultimate year of his current contract at the iconic Anfield stadium.Speculation has been rife about Salah's future, with persistent rumors linking him to a potential move to the lucrative Saudi Pro League. Reports suggest that Liverpool had purportedly rebuffed an eye-watering £150m bid from Al-Ittihad for the 31-year-old dynamo back in September.""We know that trophies are what count and we will do everything possible to make that happen next season,"" Salah posted on social media.""Our fans deserve it and we will fight like hell.""Liverpool secured the League Cup trophy during Jurgen Klopp 's concluding campaign as manager. However, they fell short in their pursuit of the Premier League, FA Cup, and Europa League titles.With Klopp's exit following an eight-year tenure at the helm of Liverpool, uncertainties have arisen regarding the future of several key players who flourished under his guidance.Virgil van Dijk and Trent Alexander-Arnold are also entering the final year of their contracts.On Monday, Liverpool officially announced Arne Slot , the former Feyenoord manager, as Klopp's successor.","Mohamed Salah says Liverpool will ""fight like hell"" to win trophies next season. The Egyptian forward is entering the final year of his contract at Anfield. Speculation has been rife about Salah's future, with persistent rumors linking him to a potential move to the lucrative Saudi Pro League.","https://static.toiimg.com/thumb/msid-110310534,imgsize-41630,width-400,resizemode-4/110310534.jpg"
Cristiano Ronaldo poised for Euro record as Portugal name squad,https://timesofindia.indiatimes.com/sports/football/top-stories/cristiano-ronaldo-poised-for-euro-record-as-portugal-name-squad/articleshow/110308846.cms,"Squad:

Goalkeepers: Diogo Costa (Porto), Rui Patricio Roma/ITA), Jose Sa (Wolves/ENG)

Defenders: Joao Cancelo (Barcelona/ESP), Nelson Semedo (Wolves/ENG), Diogo Dalot (Manchester United/ENG), Nuno Mendes (Paris Saint-Germain/FRA), Ruben Dias (Manchester City/ENG), Antonio Silva (Benfica), Goncalo Inacio (Sporting), Pepe (Porto), Danilo Pereira (Paris Saint-Germain/FRA)

Midfielders: Joao Palhinha (Fulham/ENG), Ruben Neves (Al-Hilal/KSA), Joao Neves (Benfica), Vitinha (Paris Saint-Germain/FRA), Otavio Monteiro (Al Nassr/KSA), Bruno Fernandes (Manchester United/ENG), Bernardo Silva (Manchester City/ENG)

Forwards: Cristiano Ronaldo (Al Nassr/KSA), Rafael Leao (AC Milan/ITA), Joao Felix (FC Barcelona/ESP), Goncalo Ramos (Paris SG/FRA), Diogo Jota (Liverpool/ENG), Pedro Neto (Wolves/ENG), Francisco Conceicao (Porto)

(With AFP inputs)

Cristiano Ronaldo is set to make history by setting a new Euro record after being named in Portugal 's 26-man squad for Euro 2024 , announced on Tuesday by coach Roberto Martinez .The 39-year-old, five-time Ballon d'Or winner will participate in his 11th major international tournament.His first appearance was at Euro 2004, and he will be making a record sixth appearance at the men's continental championship.Ronaldo secured a winner's medal at Euro 2016 in France, despite leaving the final injured after 25 minutes.Currently playing for Al Nassr in Saudi Arabia, Ronaldo holds the men's world record for both caps (206) and international goals (128).He was instrumental in Portugal's flawless qualifying campaign, where they won all 10 matches, scoring 36 goals and conceding just two. Ronaldo contributed significantly with 10 goals in nine qualifying appearances.Praising ""a player who has scored 42 goals in 41 matches for his club"", Martinez said he felt that the striker continued to offer ""a quality in front of goal that we really appreciate and need"".Despite his advancing years, Ronaldo will not be the oldest player in Portugal's Euro 2024 squad. His former Real Madrid teammate,Pepe , who is now 41 and plays for Porto, has also been included due to his ""important role in the dressing room,"" according to Martinez.Portugal, placed in Group F, will face the Czech Republic, Turkey, and Georgia from June 14 to July 14 in Germany. Before the tournament, the Selecao will play warm-up matches against Finland, Croatia, and Ireland.In attack, Martinez has selected a formidable lineup alongside Ronaldo, including strikers Rafael Leao, Joao Felix , and Goncalo Ramos, as well as wingers Pedro Neto and Francisco Conceicao.The creative midfield will feature Bernardo Silva, fresh off winning the English Premier League title with Manchester City, and Bruno Fernandes of Manchester United.","Cristiano Ronaldo is set to make history by setting a new Euro record after being named in Portugal's 26-man squad for Euro 2024. The 39-year-old, five-time Ballon d'Or winner will participate in his 11th major international tournament. His first appearance was at Euro 2004, and he will be making a record sixth appearance at the men's continental championship.","https://static.toiimg.com/thumb/msid-110308820,imgsize-23448,width-400,resizemode-4/110308820.jpg"
Marcus Rashford left out of England's provisional Euro 2024 squad,https://timesofindia.indiatimes.com/sports/football/top-stories/marcus-rashford-left-out-of-englands-provisional-euro-2024-squad/articleshow/110308036.cms,"Squad:

Goalkeepers: Dean Henderson, Jordan Pickford, Aaron Ramsdale, James Trafford

Defenders:

Jarrad Branthwaite, Lewis Dunk, Joe Gomez, Marc Guehi, Ezri Konsa, Harry Maguire, Jarell Quansah, Luke Shaw, John Stones, Kieran Trippier, Kyle Walker

Midfielders: Trent Alexander-Arnold, Conor Gallagher, Curtis Jones, Kobbie Mainoo, Declan Rice, Adam Wharton

Forwards: Jude Bellingham, Jarrod Bowen, Eberechi Eze, Phil Foden, Jack Grealish, Anthony Gordon, Harry Kane, James Maddison, Cole Palmer, Bukayo Saka, Ivan Toney, Ollie Watkins

(With Reuters inputs)

Forward Marcus Rashford was the most notable exclusion as England manager Gareth Southgate named his provisional Euro 2024 squad on Tuesday, with experienced midfielder Jordan Henderson also left out.The provisional squad of 33 includes several uncapped players: Liverpool duo Curtis Jones and Jarell Quansah, Everton defender Jarrad Branthwaite, and Crystal Palace's Adam Wharton.Southgate will reduce the squad to 26 by the June 7 deadline.Rashford's and Henderson's omissions were particularly surprising given Southgate's previous loyalty to them and their significant roles in past tournaments. Rashford, 26, has earned 60 caps and scored 17 goals, including three at the 2022 World Cup in Qatar, but he has struggled with form this season, netting only seven Premier League goals for Manchester United .Chelsea forward Raheem Sterling was also left out, whereas his teammate Cole Palmer made the provisional list following an excellent season. Despite a long injury spell, Manchester United's Luke Shaw is included in the provisional squad.","England manager Gareth Southgate names provisional Euro 2024 squad. Marcus Rashford, Jordan Henderson, Raheem Sterling and Luke Shaw all left out. Southgate will reduce the squad to 26 by the June 7 deadline. Liverpool duo Curtis Jones and Jarell Quansah, Everton defender Jarrad Branthwaite, and Crystal Palace's Adam Wharton make the provisional squad.","https://static.toiimg.com/thumb/msid-110308031,imgsize-44542,width-400,resizemode-4/110308031.jpg"
Scotland vs Israel Women's Euro qualifiers to be played behind closed doors,https://timesofindia.indiatimes.com/sports/football/epl/top-stories/scotland-vs-israel-womens-euro-qualifiers-to-be-played-behind-closed-doors/articleshow/110307200.cms,"(With AFP inputs)

Scotland's Women's Euro 2025 qualifiers against Israel will be held in empty stadiums due to intelligence indicating ""planned disruptions,"" Scottish football officials announced on Tuesday.The matches are scheduled for Hampden Park in Glasgow on May 31, with the ""away"" fixture set to take place in Hungary on June 4.This decision is made in the context of the most violent Gaza war to date.The conflict began following Hamas's attack on October 7, prompting a significant Israeli retaliation that has resulted in a spiraling civilian death toll and extensive destruction throughout Gaza.""Due to updated intelligence and following extensive security consultations with all key parties, the Scottish FA regrets to confirm that the forthcoming qualifier between Scotland and Israel at Hampden Park on May 31 will now be played behind closed doors,"" said a statement from the Scottish Football Association .It added: ""The stadium operations team were alerted to the potential for planned disruptions to the match and as a consequence we have no option but to play the match without supporters in attendance.""","Scotland's Women's Euro 2025 qualifiers against Israel will be held in empty stadiums due to intelligence indicating ""planned disruptions,"" Scottish football officials announced on Tuesday. The matches are scheduled for Hampden Park in Glasgow on May 31, with the ""away"" fixture set to take place in Hungary on June 4.","https://static.toiimg.com/thumb/msid-110307189,imgsize-58446,width-400,resizemode-4/110307189.jpg"
Former Germany defender Karl-Heinz Schnellinger dies at 85,https://timesofindia.indiatimes.com/sports/football/top-stories/former-germany-defender-karl-heinz-schnellinger-dies-at-85/articleshow/110305744.cms,"(With inputs from Reuters)

NEW DELHI: Former German defender Karl-Heinz Schnellinger , who represented his country at four World Cups, passed away in Italy on Monday evening at the age of 85, according to his former club Cologne .The announcement was made on Tuesday.Schnellinger, who had stints with AC Milan and AS Roma, was widely regarded as one of the world's top defenders during his playing career.Deutsche Welle, a German broadcaster, reported that he was in hospital at the time of his death.Schnellinger scored a stoppage-time equaliser for West Germany in their 4-3 semi-final loss to Italy in the 1970 World Cup, a match dubbed the ""Game of the Century"" due to a record five goals scored during extra time.It would be Schnellinger's fourth and last World Cup after 1958, 1962 and 1966. It was also his only goal in 47 international matches.At a time when international transfers were rare, Schnellinger spent most of his career in Italy, where he was known as ""Carlo il Biondo"" (the blond Karl). He won the Serie A title with Milan in 1968 before lifting the European Cup in 1969.",Karl-Heinz Schnellinger passes away in Italy at the age of 85. Former German defender represented his country at four World Cups. He had stints with AC Milan and AS Roma during his playing career. He scored a stoppage-time equaliser for West Germany in the 1970 World Cup.,"https://static.toiimg.com/thumb/msid-110305859,imgsize-165130,width-400,resizemode-4/110305859.jpg"
Germany's Toni Kroos to retire from football after Euro 2024,https://timesofindia.indiatimes.com/sports/football/top-stories/germanys-toni-kroos-to-retire-from-football-after-euro-2024/articleshow/110305411.cms,"(With inputs from AFP)

NEW DELHI: German midfielder Toni Kroos will retire after the 2024 European Championship, his club Real Madrid said Tuesday.Madrid said the 34-year-old German international 'has decided to bring an end to his time as a professional footballer following Euro 2024 .'""My career as an active footballer will end this summer after the Euro championship,"" 34-year-old Kroos, who won the 2014 World Cup with Germany, said on Instagram.Before the European Championship, Kroos has a chance to win the Champions League with Real for a fifth time when they face Borussia Dortmund at Wembley on June 1.He also won the Champions League with Bayern Munich before joining the Spanish giants.Kroos joined Real in 2014 and quickly formed a formidable midfield partnership with Luka Modric.In a statement on their website, Real said Kroos ""will go down in Real Madrid history as one of our club and international football's greatest legends"".Kroos has also won the Liga title four times.","Toni Kroos will retire after the 2024 European Championship, his club Real Madrid say. The 34-year-old German international won the 2014 World Cup with Germany. Kroos has a chance to win the Champions League with Real for a fifth time.","https://static.toiimg.com/thumb/msid-110305384,imgsize-37972,width-400,resizemode-4/110305384.jpg"
Novak Djokovic celebrates 37th birthday with refreshing win at Geneva Open,https://timesofindia.indiatimes.com/sports/tennis/top-stories/novak-djokovic-celebrates-37th-birthday-with-refreshing-win-at-geneva-open/articleshow/110342646.cms,"(Inputs from AFP)

NEW DELHI: Novak Djokovic marked his 37th birthday with a rejuvenating victory at the Geneva Open , paving his way to the quarter-finals and gearing up for his French Open title defence.The world number one triumphed over Germany's Yannick Hanfmann with a commanding 6-3, 6-3 win at the Parc des Eaux-Vives grounds.Seeking to regain his form, Djokovic opted for a wildcard entry into the Geneva tournament ahead of the French Open, aiming to address recent performance concerns.In a heartwarming moment, the crowd serenaded Djokovic with ""Happy Birthday"" as a birthday cake adorned with candles made its way onto the court post-match.Djokovic shared the celebratory moment with the crowd, taking a playful bite of the cake before offering slices to the ball boys and girls, spreading cheer and camaraderie on his special day.","Novak Djokovic beats Germany's Yannick Hanfmann in straight sets. The world number one is gearing up for his French Open title defence. The crowd serenaded him with ""Happy Birthday"" as a birthday cake adorned with candles made its way onto the court post-match.","https://static.toiimg.com/thumb/msid-110342657,imgsize-30842,width-400,resizemode-4/110342657.jpg"
Former finalist Dominic Thiem out of French Open qualifiers,https://timesofindia.indiatimes.com/sports/tennis/french-open/former-finalist-dominic-thiem-out-of-french-open-qualifiers/articleshow/110338353.cms,"(With AFP inputs)

NEW DELHI: Dominic Thiem , a two-time finalist at Roland Garros , suffered a disappointing defeat in the second round of qualifying on Wednesday. The Austrian player lost 6-2, 7-5 to Otto Virtanen of Finland.Since reaching the final in 2020, Thiem has struggled to advance beyond the first round of the main draw. His rankings have plummeted from World No.3 to 131 due to persistent wrist issues.Thiem's career highlight came in 2020 when he triumphed over Alexander Zverev in the US Open final, which was impacted by the Covid-19 pandemic. However, since that crowning achievement, his career has been on a downward trajectory.The 30-year-old has already declared his intention to retire from professional tennis at the conclusion of the 2024 season. Meanwhile, the main draw of the French Open is set to commence on Sunday.","Dominic Thiem loses 6-2, 7-5 to Otto Virtanen of Finland. Thiem has struggled to advance beyond the first round of the main draw. The 30-year-old has already declared his intention to retire from professional tennis at the conclusion of the 2024 season.","https://static.toiimg.com/thumb/msid-110338324,imgsize-25334,width-400,resizemode-4/110338324.jpg"
Novak Djokovic eager to regain form ahead of French Open defence,https://timesofindia.indiatimes.com/sports/tennis/top-stories/novak-djokovic-eager-to-regain-form-ahead-of-french-open-defence/articleshow/110330351.cms,"(With Reuters inputs)

NEW DELHI: After recovering from an unusual injury this month, world number one Novak Djokovic is looking to gain some experience before defending his championship at Roland Garros this week at the Geneva Open.Djokovic hasn't won a title in 2024 and has had a difficult season.The 24-time Grand Slam champion lost to Casper Ruud in the Monte Carlo semifinals, which started a less than ideal preparation for the French Open .Two days after being struck in the head by a fan's water bottle while signing autographs, he decided not to play in the Madrid Open and instead lost in the Italian Open's third round.The Serbian told reporters on Tuesday that ""the head is good,"" despite saying he felt off after his 6-2 6-3 loss to Alejandro Tabilo . Everything is good. After more than a week of training, I feel great.""I've dedicated quite a bit of time with my new fitness coach to build the endurance, to build physical strength and capabilities that I need in order to play a best-of-five Grand Slam on the physically most demanding surface, which is clay.""So, hopefully, I'm going to get more than one match here in Geneva, that's the goal and then let's see what happens in Paris.""On Wednesday, Djokovic will play his opening match in Geneva against Yannick Hanfmann of Germany, who earlier in the event defeated three-time Grand Slam champion Andy Murray .""The reason why I chose to come and play is because I feel like, at this moment, there is no better practice for me than match play,"" Djokovic said.""I feel like I need more matches, even if it's one match, two matches, three, four hopefully. It's good for me, because that's the way for me to try to find that kind of form that I need for Roland Garros.""",World number one Novak Djokovic is looking to gain some experience before defending his championship at Roland Garros this week. The 24-time Grand Slam champion lost to Casper Ruud in the Monte Carlo semifinals. He decided not to play in the Madrid Open and instead lost in the Italian Open's third round.,"https://static.toiimg.com/thumb/msid-110330316,imgsize-47550,width-400,resizemode-4/110330316.jpg"
Novak Djokovic backs Rafael Nadal for French Open title,https://timesofindia.indiatimes.com/sports/tennis/french-open/novak-djokovic-backs-rafael-nadal-for-french-open-title/articleshow/110312740.cms,"(With AFP inputs)

NEW DELHI: Rafael Nadal , the 14-time French Open champion, has been struggling with fitness issues as he approaches the end of his illustrious career. However, Novak Djokovic , the world number one, believes that Nadal remains the favorite to win the upcoming French Open.Djokovic, who is currently preparing for the tournament at the Geneva Open , acknowledged that Nadal faces increasing competition from younger players.Nevertheless, he emphasized that as long as the Spaniard is in the draw, he cannot be discounted.The Serbian star's comments highlight the immense respect and admiration he has for Nadal's achievements and abilities on the clay courts of Roland Garros .""This year is more open,"" French Open defending champion Djokovic told reporters at the Parc des Eaux-Vives grounds in Geneva.""Casper Ruud is surely one of the five players who are candidates to win. You have Alexander Zverev, Andrey Rublev, Stefanos Tsitsipas -- all the players who won a major tournament on this surface this year.""But when you talk about Roland-Garros and Nadal is there, he is always the biggest favourite for me.""After everything he has done on the courts at Roland-Garros, it's normal, respectfully, to put him as the biggest favourite.""Obviously it's a little different with his level of play. But it's Roland-Garros, and it's Nadal.""After that, maybe me, if I feel good, if I play well. At Roland-Garros, and all the Grand Slams, I am a bit of a different player.""Djokovic, on the cusp of his 37th birthday on Wednesday, made a last-minute decision to participate in the Geneva tournament by accepting a wild card entry.His aim is to reverse a concerning decline in his performance as he prepares to defend his title at the French Open, which commences next week.The Swiss clay court event, featuring a compact draw of 28 players, acts as the ultimate preparation for the prestigious Grand Slam tournament.Djokovic, who holds an impressive record of 24 Grand Slam titles, is facing an unusual situation this year. He will enter the French Open without having secured a single title in the season, a first since 2018. However, a victory in Geneva could change that narrative.While time has caught up with 37-year-old Nadal, Djokovic said he was hungry to keep playing at the top.""I'm searching for my highest possible level,"" he said.""It's not an obligation. It's truly my desire, my feeling, my passion, my love for tennis. That's the most important. I'm seeking to stay connected with that feeling.""Djokovic said he knew Geneva well as he has cousins in the Swiss city, though he has never played at the Geneva Tennis Club before.""At this moment, there is no better practice for me than match play. So I feel like I need more matches,"" he said.""That's the way for me to try to find the kind of form that I need for Roland-Garros.""Djokovic was at the Stade de Geneve on Monday to witness Young Boys winning a 17th Swiss football championship with a 1-0 victory over hosts Servette -- a team the Serb has a long-standing fondness for.Djokovic said one of his cousins was set to marry a Servette player -- French midfielder Timothe Cognat, according to Swiss media.Djokovic's best friend, and best man at his wedding, was defender Neven Markovic, who played for Servette from 2013 to 2015.""That's why I'm supporting the club,"" Djokovic said, jovially adding that Markovic could perhaps best be categorised as a ""very physical player"".""I'm not a football expert -- but he's a crazy guy,"" he said.",Novak Djokovic believes Rafael Nadal is the favorite to win the French Open. The world number one is currently preparing for the tournament at the Geneva Open. Nadal has been struggling with fitness issues as he approaches the end of his career.,"https://static.toiimg.com/thumb/msid-110312726,imgsize-42820,width-400,resizemode-4/110312726.jpg"
