Article Title,Article Link,Article Text,Article Summary,Article Image
Euro 2024: Belgium secure 2-0 victory over Romania in Group E clash,https://timesofindia.indiatimes.com/sports/football/uefa-euro-2024/euro-2024-belgium-secure-2-0-victory-over-romania-in-group-e-clash/articleshow/111200599.cms,"NEW DELHI: Belgium secured a 2-0 victory over Romania in a thrilling Euro 2024 Group E match on Saturday, thanks to goals from Youri Tielemans and Kevin De Bruyne . The win resulted in all four teams in the group—Belgium, Romania, Slovakia , and Ukraine—being level on three points after two rounds. This unprecedented situation sets the stage for a decisive final round.The match took place in Cologne, in an electric atmosphere, with fans on the edge of their seats throughout. Belgium's Tielemans scored just 73 seconds into the game, setting the tone for an attacking performance. Late in the game, De Bruyne added a second goal, which could prove crucial in determining group standings.""We were very relieved we won the game, it was very important to get three points,"" Belgium coach Domenico Tedesco was quoted as saying by Reuters after the game.Ukraine defeated Slovakia 2-1 on Friday, leaving all group teams with three points each. The final matches of the group stage will see Belgium face Ukraine and Slovakia take on Romania.A team could advance or be eliminated with just four points, with goal difference potentially playing a key role. Romania and Belgium currently hold a slight edge with a plus-one goal difference, Slovakia sits at zero, while Ukraine is at minus two.Belgium, ranked third in the world by FIFA, appeared transformed from their sluggish opening game defeat to Slovakia. From the match's beginning, Belgium displayed energy and intent. Romelu Lukaku played a key role, assisting Tielemans, who executed a precise low shot to open the scoring.Romania almost equalized four minutes later with a header by Radu Dragusin, but Koen Casteels made an excellent save. Belgium dominated the first half, with several chances from Dodi Lukebakio, Amadou Onana, and De Bruyne, whose performances continually tested Romania's defense.The Romanian fans were unwavering in their support, creating an incredible atmosphere despite Belgium’s relentless attacks. Jeremy Doku's cross nearly connected with Lukaku, and De Bruyne even had another shot narrowly miss the goalpost.Lukaku seemed to have doubled Belgium's lead an hour into the match, but VAR disallowed it for offside. This was the second time in the tournament Lukaku had goals ruled out by VAR, following a similar instance against Slovakia.The end-to-end match saw another twist as Romania's Dennis Man went clean through, only to shoot directly at Casteels. Belgium’s second goal came in an unexpected manner. Goalkeeper Casteels launched a goal kick that bypassed everyone, allowing the quick-thinking De Bruyne to score, sealing the win.The victory keeps Belgium's hopes alive for advancing beyond the group stage. Romania, despite the loss, remains in contention to reach the knockout rounds for only the second time in their history. Romania has not qualified for the last six World Cups since their golden era in the 1990s.",Belgium defeated Romania 2-0 in Euro 2024 Group E match on Saturday. Goals from Youri Tielemans and Kevin De Bruyne secured the win. All four teams in the group are level on three points after two rounds. Romania and Belgium hold a slight edge with a plus-one goal difference.,"https://static.toiimg.com/thumb/msid-111200704,imgsize-49870,width-400,resizemode-4/111200704.jpg"
Euro 2024: Patrik Schick's goal secures 1-1 draw for Czech Republic against Georgia,https://timesofindia.indiatimes.com/sports/football/top-stories/euro-2024-patrik-schicks-goal-secures-1-1-draw-for-czech-republic-against-georgia/articleshow/111194149.cms,"NEW DELHI: Patrik Schick 's chest-fired goal secured a 1-1 draw for the Czech Republic against Georgia in an engaging Euro 2024 Group F match on Saturday.Both teams find themselves in a challenging position, each with a point, awaiting the outcome of the Portugal-Turkey game. Georgia struck first with Georges Mikautadze's penalty, but Schick equalized in a match filled with action and drama in Hamburg.Georgia, debutants in the competition, showcased their progress under coach Willy Sagnol , who highlighted his players' disappointment at their opening defeat as a sign of their growth. The Georgian team put in a spirited performance to earn their first Euros point, guided by goalkeeper Giorgi Mamardashvili's exceptional saves.Sagnol said his players' disappointment at their opening defeat showed how far his team has come, and they gave everything in Hamburg to earn their first Euros point.Mamardashvili played a pivotal role, making crucial saves early on, denying efforts from Adam Hlozek and Schick. Georgia's offensive efforts were rewarded just before halftime when Mikautadze converted a penalty, secured after a VAR review flagged a handball by Czech defender Robin Hranac.The game's momentum swung back in favor of the Czechs in the second half. Schick, who had already demonstrated his scoring prowess at Euro 2020, equalized with an improvised finish, chesting home a rebound off the post from Ondrej Lingr's header. This goal marked Schick as the Czech Republic's top scorer in Euros history, surpassing Milan Baros with six goals, but a calf injury forced him to leave the pitch midway through the second half.The Czech team, led by coach Ivan Hasek, had started strong, creating numerous chances. They were initially frustrated when VAR disallowed Hlozek's goal due to a handball, following a save by Mamardashvili that deflected back onto Hlozek’s face and arm. Czech right-back Vladimir Coufal received a booking for a foul on Georgia's standout player Khvicha Kvaratskhelia, who along with Mikautadze, had required medical attention before the match but both started.“He attempted to counter and was met with Coufal's challenge, resulting in a yellow card for the Czech defender,” observed reviewers of the game.Georgia also saw their penalty appeals for an incident involving Zuriko Davitashvili and Ladislav Krejci dismissed. Despite these setbacks, Georgia captained by Guram Kashia, managed to test the Czech defense, with Stanec making a brilliant first-half stoppage-time save before conceding the penalty kick.Czech fans experienced further tension as Krejci came close to scoring from another header, narrowly missing the target. The Czechs’ persistence nearly paid off, but they failed to capitalize on several opportunities.In an end-to-end encounter, Georgia showed impressive resolve. “Georgia's fans were in the majority…they began to roar every time Napoli winger Kvaratskhelia got the ball in opposition territory,” noted observers.The match concluded with a dramatic moment when Georgia had a golden opportunity to clinch victory. Substitute Saba Lobjanidze found himself in a prime position but fired over the bar amid a three-on-one break, leaving the match tied.This draw leaves both teams with a challenging road ahead in Euro 2024 Group F. With strong performances from both sides, they will be looking to build on this match in their subsequent fixtures. As the group progresses, the outcome of the upcoming Portugal-Turkey game may further shape their paths."," Patrik Schick's chest-fired goal secured a 1-1 draw for the Czech Republic against Georgia in an engaging Euro 2024 Group F match. Georgia struck first with Georges Mikautadze's penalty, but Schick equalized in a match filled with action and drama in Hamburg.","https://static.toiimg.com/thumb/msid-111194143,imgsize-65930,width-400,resizemode-4/111194143.jpg"
"UEFA EURO 2024 Belgium vs Romania: When and where to watch in India, USA and UK",https://timesofindia.indiatimes.com/sports/football/uefa-euro-2024/uefa-euro-2024-belgium-vs-romania-when-and-where-to-watch-in-india-usa-and-uk/articleshow/111190148.cms,"Belgium vs Romania match details

When will Belgium vs Romania start?

When and where

to watch Belgium vs Romania in India?

When and where to watch Belgium vs Romania in the UK?

When and where to watch Belgium vs Romania in the USA?

NEW DELHI: Belgium faces Romania on Saturday, hoping to bounce back after a surprising 1-0 defeat to Slovakia in their Euro 2024 opener, which ended their 14-game unbeaten streak. Romania, meanwhile, sits atop Group E after a convincing 3-0 win over Ukraine. The match kicks off at 9 p.m. local time (1900 GMT) in Cologne.A victory for Romania will secure their advancement to the round of 16, and even a draw could be sufficient, given that no team with four points has ever failed to progress in the Euros. Belgium's unexpected loss is reminiscent of their early exit from the 2022 World Cup, despite their high ranking.Romelu Lukaku, who led the Euro qualifiers with 14 goals, had a frustrating game against Slovakia with two goals disallowed by VAR. Romania's Nicolae Stanciu was a standout in their win over Ukraine, scoring a spectacular long-range goal and nearly scoring directly from a corner.In terms of team news, Romania reports no injury concerns. Belgium, however, may see the return of Axel Witsel, Jan Vertonghen, and Arthur Theate, who missed the Slovakia match due to injury doubts.By the numbers, Lukaku is Belgium's all-time leading scorer with 85 goals, and his 14 goals in qualifying set a new European Championship record. Romania's 3-0 win against Ukraine was their largest margin of victory at the Euros.The loss to Slovakia marked Belgium's first defeat under coach Domenico Tedesco, who has won 10 of his 15 games in charge since taking over after the last World Cup.The UEFA European Championship 2024 Group F match between Portugal and Turkey is set for June 22, Saturday.The UEFA Euro 2024 match will take place in Dortmund , Germany, with the kickoff scheduled for 12:30 AM IST. In India and the Indian subcontinent, the matches will be broadcast on Sony Sports Network, which holds the event’s broadcast rights.Coverage will be provided on Sony Sports Ten 2 SD & HD in English. For Hindi-speaking viewers, matches will air on Sony Sports Ten 3 SD & HD.Fans looking for regional language options can watch on Sony Sports Ten 4 SD & HD in Tamil & Telugu, or Sony Sports Ten 5 SD & HD in Bengali & Malayalam.Additionally, all matches of UEFA Euro 2024 can be streamed live on the SonyLIV app and website.The Group F match between Georgia and the Czech Republic will be available for viewing on BBC TV Sports. UK viewers can also live stream the game via the ITV app and website. The match coverage starts at 8 pm BST on Saturday.Fans can tune in to BBC TV Sports for all the action. The game will be accessible to UK viewers through multiple platforms.UK viewers can live stream the game on the ITV app and website starting at 8 pm BST on Saturday.The Belgium vs Romania match will be broadcast in the USA on Fox Sports. Viewers can also stream the match live via the Fubo TV App and website. The match is scheduled to begin at 7 pm GMT.In the USA, the Belgium vs Romania match will be broadcast on Fox Sports.Viewers can also stream the match live via the Fubo TV App and website.The match is scheduled to begin at 7 pm GMT in the USA and corresponding times in other time zones.","Belgium face Romania in their Euro 2024 Group E opener on Saturday. The match kicks off at 9 p.m. local time (1900 GMT) in Cologne. In the USA, the Belgium vs Romania match will be broadcast on Fox Sports. In India and the Indian subcontinent, the matches will be aired on Sony Sports Network.","https://static.toiimg.com/thumb/msid-111190422,imgsize-76306,width-400,resizemode-4/111190422.jpg"
"UEFA EURO 2024 Portugal vs Turkey: When and where to watch in India, USA and UK",https://timesofindia.indiatimes.com/sports/football/uefa-euro-2024/uefa-euro-2024-portugal-vs-turkey-when-and-where-to-watch-in-india-usa-and-uk/articleshow/111188270.cms,"Portugal vs Turkey

match details

When will Portugal vs Turkey start?

When and where to watch Portugal vs Turkey in India?

When and where to watch Portugal vs Turkey in the UK?

When and where to watch Portugal vs Turkey in the USA?

NEW DELHI: Cristiano Ronaldo and the Portuguese national team are set to face Turkey in their second Group F encounter at the European Championship. Both teams emerged victorious in their initial matches, with Portugal edging out the Czech Republic 2-1 and Turkey triumphing over Georgia 3-1.The highly anticipated clash is scheduled to commence at 6 p.m. local time (1600 GMT) in the city of Dortmund .Ronaldo, who found himself relegated to the bench during the 2022 World Cup, has now solidified his position as a guaranteed starter under the guidance of newly appointed coach Roberto Martinez. Although the Portuguese superstar played the entire game against the Czechs, he was unable to find the back of the net.Portugal encountered difficulties when pitted against a defensively minded Czech side in Leipzig. However, they are expected to find more space to operate against a Turkey team that favors an attacking approach. One player to keep an eye on is Turkey's rising star, 19-year-old Arda Guler, who showcased his immense talent by scoring a spectacular goal against Georgia.However, there are concerns regarding his fitness level ahead of this crucial match. Turkey will undoubtedly benefit from the fervent support of their fans at Dortmund's Westfalenstadion, the venue where they played their opening game.A victory for either team in this encounter will guarantee their position at the top of the group, provided that Georgia and the Czech Republic settle for a draw in their earlier match. Portugal has reported a fully fit squad, with Joao Palhinha vying for a spot in the midfield. On the other hand, Turkey's İrfan Can Kahveci remains a doubtful starter due to an injury.Ronaldo, the all-time leading scorer in European Championships with 14 goals, aims to extend his record and make his 27th appearance in the tournament.Meanwhile, Portugal is determined to maintain their winning streak against Turkey. Turkey, for their part, managed to break a streak of opening-match losses at the Euros by securing a victory against Georgia.The UEFA European Championship 2024 Group F match between Portugal and Turkey is set for June 22, Saturday.The UEFA Euro 2024 match will take place in Dortmund, Germany, with the kickoff scheduled for 9:30 PM IST. In India and the Indian subcontinent, the matches will be broadcast on Sony Sports Network, which holds the event’s broadcast rights.Coverage will be provided on Sony Sports Ten 2 SD & HD in English. For Hindi-speaking viewers, matches will air on Sony Sports Ten 3 SD & HD.Fans looking for regional language options can watch on Sony Sports Ten 4 SD & HD in Tamil & Telugu, or Sony Sports Ten 5 SD & HD in Bengali & Malayalam.Additionally, all matches of UEFA Euro 2024 can be streamed live on the SonyLIV app and website.The Group F match between Georgia and the Czech Republic will be available for viewing on BBC TV Sports. UK viewers can also live stream the game via the ITV app and website. The match coverage starts at 5 pm BST on Saturday.Fans can tune in to BBC TV Sports for all the action. The game will be accessible to UK viewers through multiple platforms.UK viewers can live stream the game on the ITV app and website starting at 5 pm BST on Saturday.The Portugal vs Turkey match will be broadcast in the USA on Fox Sports. Viewers can also stream the match live via the Fubo TV App and website. The match is scheduled to begin at 4 pm GMT.In the USA, the Portugal vs Turkey match will be broadcast on Fox Sports.Viewers can also stream the match live via the Fubo TV App and website.The match is scheduled to begin at 4 pm GMT in the USA and corresponding times in other time zones.","Portugal face Turkey in their second Group F encounter at the European Championship. Cristiano Ronaldo and the Portuguese national team are set to face Turkey. The match is scheduled to commence at 6 p.m. local time (1600 GMT) in the city of Dortmund. In India and the Indian subcontinent, the matches will be broadcast on Sony Sports Network.","https://static.toiimg.com/thumb/msid-111189826,imgsize-52586,width-400,resizemode-4/111189826.jpg"
"UEFA EURO 2024 Georgia vs Czech Republic: When and where to watch in India, USA and UK",https://timesofindia.indiatimes.com/sports/football/uefa-euro-2024/uefa-euro-2024-georgia-vs-czech-republic-when-and-where-to-watch-in-india-usa-and-uk/articleshow/111188175.cms,"Georgia vs Czech Republic

match details

When will

Georgia vs Czech Republic

start?

When and where to watch Georgia vs Czech Republic

in India?

When and where to watch Georgia vs Czech Republic

in the

?

When and where to watch Georgia vs Czech Republic

in the

USA?

NEW DELHI: Georgia and the Czech Republic face off in an upcoming Euro 2024 match, both seeking a crucial victory after opening losses. Georgia was defeated by Turkey 3-1, while Portugal narrowly edged out the Czechs 2-1 with a late goal. A win for either team would boost their chances of advancing to the knockout rounds, but even the losing side could still have hope.Georgia's earlier match saw them lose 3-1 to Turkey. At the same time, the Czech Republic suffered a narrow 2-1 defeat to Portugal, thanks to a late goal from Francisco Conceicao. Both teams now look to this match as a pivotal opportunity to improve their standings.A win would significantly enhance the prospects for either side. However, even the team that loses might still progress, as some third-place teams could qualify. A draw, though, would complicate matters, leaving both teams needing upset victories against stronger opponents in their final matches. Georgia would have to overcome Portugal, and the Czech Republic would need to beat Turkey.In team news, Georgia's midfielder Otar Kiteishvili has been following an individual training program, separate from the main squad, after being an unused substitute in the loss to Turkey.Thus, for both teams, this match is a critical juncture in their Euro 2024 journey.On the other hand, Czech Republic's coach Ivan Hasek has downplayed fitness concerns surrounding captain and midfielder Tomas Soucek, indicating that he has been participating fully in training and is expected to start in the upcoming match.Turning to the statistics, Czech striker Patrik Schick is poised to make his 40th appearance for his national team, with his next goal marking his 20th overall. Notably, five of his international goals were scored during the last European Championship.As the teams prepare to clash in Hamburg , both Georgia and the Czech Republic are determined to secure a crucial victory in their Euro 2024 campaign.The UEFA European Championship 2024 Group F match between Georgia and Czech Republic is set for June 22, Saturday.The UEFA Euro 2024 match will take place in Hamburg, Germany, with the kickoff scheduled for 6:30 PM IST. In India and the Indian subcontinent, the matches will be broadcast on Sony Sports Network, which holds the event’s broadcast rights.Coverage will be provided on Sony Sports Ten 2 SD & HD in English. For Hindi-speaking viewers, matches will air on Sony Sports Ten 3 SD & HD.Fans looking for regional language options can watch on Sony Sports Ten 4 SD & HD in Tamil & Telugu, or Sony Sports Ten 5 SD & HD in Bengali & Malayalam.Additionally, all matches of UEFA Euro 2024 can be streamed live on the SonyLIV app and website.The Group F match between Georgia and the Czech Republic will be available for viewing on BBC TV Sports. UK viewers can also live stream the game via the ITV app and website. The match coverage starts at 2 pm BST on Saturday.Fans can tune in to BBC TV Sports for all the action. The game will be accessible to UK viewers through multiple platforms.UK viewers can live stream the game on the ITV app and website starting at 2 pm BST on Saturday.The Georgia vs Czech Republic match will be broadcast in the USA on Fox Sports. Viewers can also stream the match live via the Fubo TV App and website. The match is scheduled to begin at 4 pm GMT.In the USA, the Georgia vs Czech Republic match will be broadcast on Fox Sports.Viewers can also stream the match live via the Fubo TV App and website.The match is scheduled to begin at 1 pm GMT in the USA and corresponding times in other time zones.","The UEFA European Championship 2024 Group F match between Georgia and Czech Republic is set for June 22, Saturday. The UEFA Euro 2024 match will take place in Hamburg, Germany, with the kickoff scheduled for 6:30 PM IST. In India and the Indian subcontinent, the matches will be broadcast on Sony Sports Network. The match is scheduled to begin at 1 pm GMT in the USA and corresponding times in other time zones.","https://static.toiimg.com/thumb/msid-111188128,imgsize-103042,width-400,resizemode-4/111188128.jpg"
