Article Title,Article Link,Article Text,Article Summary,Article Image
James Anderson's adoring faithful pay homage to England great one last time,https://timesofindia.indiatimes.com/sports/cricket/news/james-andersons-adoring-faithful-pay-homage-to-england-great-one-last-time/articleshow/111696498.cms,"NEW DELHI: Thousands of cricket fans gathered at Lord's to witness James Anderson ’s final day of Test cricket, where England finished off the West Indies with an innings-thrashing.The 41-year-old Anderson concluded his international career spanning two decades on an emotional note. After just 12 overs on the last day, England secured a comprehensive win, with Anderson having taken his 704th and final Test wicket earlier in the match.Spectators crowded in front of the Pavilion long after the match ended, eager for one last glimpse of the England great.An entire generation of England fans has grown up seeing Anderson play Test cricket, and they were not disappointed as he appeared on the England dressing-room balcony, downing a pint of Guinness with cheers from the crowd nearly as loud as those following his wickets.Rather than give a speech, Anderson waved goodbye one last time at Lord’s, the same ground where he made his Test debut in 2003. His final wicket in Test cricket was that of Joshua Da Silva, marking the end of a stellar career where his bowling action remained largely unchanged.Anderson finishes as the leading wicket-taking fast bowler in Test history, with only Shane Warne (708 wickets) and Muttiah Muralitharan (800) ahead of him in the all-time list.""It's been quite emotional... the reaction from the crowd was pretty special,"" said Anderson. ""I'm really proud because playing for 20-odd years is an incredible effort, especially for a fast bowler, and I'm just happy that I've made it this far.""England and Wales Cricket Board chairman Richard Thompson acclaimed Anderson as ""quite simply the best Test pace bowler there has ever been"". The statement supports Anderson's impressive record of 188 Test appearances, second only to India's Sachin Tendulkar , who played 200 games.Anderson's career benefitted from England’s central contracts system, sparing him from the dual strain of Test and county cricket to the extent faced by previous generations. Comparing eras, England fast-bowling legend Fred Trueman, who was the first to take 300 Test wickets, averaged 21.57 runs per wicket in his 67 Tests while also bowling extensively for Yorkshire. By contrast, Anderson averaged 26.45 with a significantly lighter county workload at Lancashire.While many argue about the greatest fast bowlers, it’s unquestionable that Anderson’s remarkable skills in generating late movement have earned him a place among the best. His career also coincided with outstanding fast bowlers from other nations, including West Indies' Malcolm Marshall, who took 376 wickets in 81 Tests at an average of 20.94.On the final day, Anderson had the chance to take the last wicket of the match, as his longtime bowling partner Stuart Broad did against Australia the previous year. However, Anderson dropped a return catch offered by Gudakesh Motie. The match eventually concluded with debutant Gus Atkinson taking the final wicket and delivering impressive figures of 12-106, surpassing Anderson's career-best haul of 11-71.""Gus actually apologised to him for taking that last wicket and Jimmy just told him to 'eff off',"" said England captain Ben Stokes .""He's someone who loves to see other people do well. I'm sure he'd have loved to have that fairytale ending that Broady got last year but, for him, seeing a young lad come in and take 12 wickets on debut, he'd have really enjoyed that as well. He's a great player, a great person and a great man.""","James Anderson takes 704th and final Test wicket in England's innings-thrashing of West Indies at Lord's. The 41-year-old ends his international career with 188 Test appearances, second only to India's Sachin Tendulkar who played 200 games.","https://static.toiimg.com/thumb/msid-111696634,imgsize-83938,width-400,resizemode-4/111696634.jpg"
"It's such a nice way to finish and walk off the field, says Stuart Broad on James Anderson’s retirement",https://timesofindia.indiatimes.com/sports/cricket/news/its-such-a-nice-way-to-finish-and-walk-off-the-field-says-stuart-broad-on-james-andersons-retirement/articleshow/111696658.cms,"NEW DELHI: Former England fast bowler Stuart Broad expressed his thoughts on James Anderson 's retirement from international cricket. He believed that Anderson's decision to retire following a triumphant victory was an ideal way to conclude his illustrious career.Broad emphasized that walking off the field with a winning sensation was a fitting end for Anderson.England secured a commanding victory against the West Indies at Lord's, winning by an innings and 114 runs. This win allowed them to establish a 1-0 lead in the three-match series.Gus Atkinson , making his debut, showcased exceptional performance by claiming an impressive 12 wickets throughout the match.""I thought the moment the final wicket fell, Jimmy Anderson was the first to Gus Atkinson, giving him a big hug with a smile on his face. It's felt like a passing-over, hasn't it, in terms of the success of Gus Atkinson.""""Watching him this week, how I felt is he still looks as good as ever and it's such a nice way to finish and walk off the field, knowing you can still do it. It was wonderful to see him still do what he's done for 188 Test matches and walk off with a victory.""""Regardless of the wickets and the amount he's played, to Jimmy, it's always been about those moments in the changing room of winning a Test match with the group of people you're with. For him, looking back now as a former Test cricketer, the games he's won have been outstanding. To win his last Test match is incredible,"" IANS quoted Broad as saying after the match.Former West Indies fast-bowler Ian Bishop lauded Anderson’s long career and stated, ""There are so many things we've already talked about like his longevity and his fitness.""He's gone where no fast bowler has gone before in terms of wickets.” ""But from a skill perspective, the ability to swing the ball and be consistent with his length, the art of evolving over 20 years. I think he's shifted the thinking in the game. He has shifted paradigms and dimensions for fast bowlers. This a sense of immortality here for James Anderson,"" he said.Anderson, having concluded his illustrious Test career, secured his position as the third-highest wicket-taker in the format, amassing an impressive tally of 704 scalps at a commendable average of 26.45 across 188 appearances.As he transitions into his new role as England's bowling mentor for the upcoming Test home summer, his long-time teammate Broad believes that Anderson's wealth of experience and expertise will prove invaluable in guiding and nurturing the team's bowling unit during practice sessions.""A lot of the time, it's not the information you're sharing, it's when you're doing it and picking that time. If you go to a bowler who has just bowled eight overs for 70 and try to do something technical, that's not the right time - let them calm down.""""He's got Brendon McCullum, who's the absolute best in the business at knowing the right time to share information and check in on how things are going. Jimmy doesn't strike me as the sort of fast-bowling coach who will have a meeting after meeting, he'll drip-feed information in the nets,"" he said.Asked on how England's bowling unit adapts without Anderson in Tests, Broad remarked, ""What the bowling group does, is it's so important to share information consistently. If you take Jimmy Anderson out of that attack, they'll need to be talking and need to be sharing, and not go insular and be careful. Gus Atkinson is going to go (to Trent Bridge) full of confidence. I think we will see, this summer, him take the new ball.""","Former England fast bowler Stuart Broad expressed his thoughts on James Anderson's retirement from international cricket. He believed that Anderson's decision to retire following a triumphant victory was an ideal way to conclude his illustrious career. England secured a commanding victory against the West Indies at Lord's, winning by an innings and 114 runs.","https://static.toiimg.com/thumb/msid-111696633,imgsize-39384,width-400,resizemode-4/111696633.jpg"
Pakistan Cricket Board retain Muhammad Yousuf and Asad Shafiq in revamped selection panel,https://timesofindia.indiatimes.com/sports/cricket/news/pakistan-cricket-board-retain-muhammad-yousuf-and-asad-shafiq-in-revamped-selection-panel/articleshow/111695541.cms,"NEW DELHI: The Pakistan Cricket Board ( PCB ) has retained former players Muhammad Yousuf and Asad Shafiq in the revamped selection committee for the upcoming home Test series against Bangladesh next month.The decision comes after the recent reorganization within the PCB’s selection panel.Yousuf and Shafiq were part of the previous selection committee that picked the T20 World Cup squad.After the team's failure to advance beyond the first round in the tournament, PCB removed members Wahab Riaz and Abdul Razzaq but decided to keep Yousuf and Shafiq.Yousuf also served as the batting coach, while Riaz acted as the senior team manager during tours to Ireland, England and the World Cup.The new selection committee will include the captains and head coaches of the red and white-ball teams. All the members, including Yousuf and Shafiq, will hold voting rights and decision-making authority.The board has also included non-voting members in the committee, such as assistant team coach Azhar Mahmood and four PCB board members/employees. These include the advisor to PCB Chairman Bilal Afzal, Manager of Analytics and Team Strategy Hassan Cheema, Director of High-Performance Nadeem Khan, and Director of International Cricket Usman Wahla.The restructured committee is tasked with selecting the squad for the two-Test series against Bangladesh, part of the World Test Championship (WTC) 2023-25 cycle.The matches are scheduled to take place in Rawalpindi from August 21-25 and in Karachi from August 30-September 3.",Pakistan Cricket Board ( PCB ) has retained former players Muhammad Yousuf and Asad Shafiq in the revamped selection committee. The decision comes after the recent reorganization within the PCB’s selection panel. The new selection committee will include the captains and head coaches of the red and white-ball teams.,"https://static.toiimg.com/thumb/msid-111695692,imgsize-22136,width-400,resizemode-4/111695692.jpg"
Skipper Kraigg Brathwaite decodes West Indies' defeat against England at Lord's,https://timesofindia.indiatimes.com/sports/cricket/news/skipper-kraigg-brathwaite-decodes-west-indies-defeat-against-england-at-lords/articleshow/111695579.cms,"NEW DELHI: Kraigg Brathwaite , the captain of the West Indies cricket team, expressed his thoughts following their defeat against England in the opening Test match at Lord's . The Caribbeans suffered a substantial loss, with England winning by an innings and 114 runs on Friday.In the post-match interview, Brathwaite conveyed his dissatisfaction with the team's performance throughout the game.""Disappointed,"" he said, reflecting on their efforts.The skipper highlighted that the West Indies were trailing from the very beginning of the match.Furthermore, Brathwaite identified areas where his team could have improved, particularly in their bowling. He emphasized the need for greater discipline with the ball, suggesting that this aspect of their game fell short of expectations.""Obviously disappointed with ourselves. With the bat, batting first, scoring just 100 odd, we were pretty much behind the game. With the bat we didn't come to the party this game at all in both innings. With the ball still could be better and more disciplined but still a positive in that for the moment. I do believe it but the guys have to believe it as well. They have a lot of ability and talent and it's just about coming here and showcasing. This is the world stage, pitted against a good team. I believe in the guys. They just got to stay mentally strong after a defeat. It is a bit of pressure yes, but got be strong mentally,"" ANI quoted Brathwaite as saying.In the opening Test match between England and West Indies at Lord's, James Anderson claimed the first wicket of the day, dismissing Joshua Da Silva and effectively ending West Indies' resistance.However, it was debutant Gus Atkinson who stole the show, securing a place on the Lord's honours board with an impressive ten-wicket haul, symbolizing a passing of the torch from the veteran to the newcomer.England had previously established a substantial first-innings lead, with five batsmen surpassing the half-century mark in a total of 371. Atkinson's seven-wicket haul had been instrumental in dismissing West Indies for a mere 121 on the first day of the Test.Armed with a 250-run advantage, England's seamers made quick work of the West Indies batting lineup on the second day, reducing them to six wickets down by the close of play.While Atkinson continued to impress, it was Anderson who set the tone with ""a peach that seamed back into castle Brathwaite"" as England ultimately triumphed over West Indies by an innings and 114 runs on Friday.",Kraigg Brathwaite disappointed with West Indies' performance against England. England won by an innings and 114 runs in the opening Test match at Lord's. West Indies captain identified areas where his team could have improved. Gus Atkinson stole the show with a ten-wicket haul for England.,"https://static.toiimg.com/thumb/msid-111695574,imgsize-40600,width-400,resizemode-4/111695574.jpg"
'Playing for England is the best job in the world': James Anderson signs off in style,https://timesofindia.indiatimes.com/sports/cricket/news/playing-for-england-is-the-best-job-in-the-world-james-anderson-signs-off-in-style/articleshow/111695061.cms,"NEW DELHI: Legendary English fast bowler James Anderson bid farewell to his illustrious Test career with a resounding victory over the West Indies at Lord's.At the age of 41, Anderson's final appearance on the international stage saw him showcase his trademark discipline and control, claiming 3 wickets for 32 runs in 16 overs as England secured an innings and 114-run triumph within three days.The England selectors had already agreed with Anderson that this first Test of the three-match series would mark his farewell to national duty, paving the way for the team's rebuilding process ahead of the 2025/26 Ashes series in Australia.Anderson's retirement brings an end to a remarkable career that spanned 188 Tests, during which he amassed an astonishing 704 wickets, second only to the legendary spinners Shane Warne (708) and Muttiah Muralitharan (800) in the all-time list. Only Sachin Tendulkar (200 matches) has played more Tests than Anderson.Reflecting on his career, Anderson expressed immense pride and gratitude, stating, ""It's been quite an amazing week. I've been overwhelmed with the reaction of the crowd and everyone around the ground, and the lads as well. I'm just proud of what I've achieved.""He acknowledged the emotional farewell, adding, ""Obviously this morning was quite emotional with the two teams lined up, and the reaction from the crowd was pretty special. I'm still trying to hold them (tears) back now but I think I am just really proud. Playing for 20-odd years is an incredible effort, especially for a fast bowler, so I'm just happy that I've made it this far, happy that I've been lucky enough to stay injury-free pretty much throughout my career. Playing for England is the best job in the world and I've been privileged to do it for a long time.""England captain Ben Stokes paid tribute to Anderson, hailing him as ""an incredible inspiration to so many people"" and describing his achievements as ""absolutely phenomenal.""While Anderson's career came to a close, a new star emerged in the form of debutant fast bowler Gus Atkinson , who was named player of the match for his sensational haul of 12 wickets for 106 runs. Atkinson acknowledged Anderson's influence, stating, ""Growing up, Jimmy was someone I would come to Lord's and watch. It was amazing.""West Indies captain Kraigg Brathwaite summed up the sentiment of many opposition batsmen, quipping, ""He is a legend of the game. I won't miss him at all!"" – a testament to Anderson's relentless prowess and the challenges he posed to batters throughout his illustrious career.","England bowler James Anderson retires from international cricket at the age of 41. His career spanned 188 Tests, during which he amassed 704 wickets. He is second only to spinners Shane Warne and Muttiah Muralitharan in all-time list.","https://static.toiimg.com/thumb/msid-111695193,imgsize-38298,width-400,resizemode-4/111695193.jpg"
"Women's Asia Cup: India-Pakistan league clash on July 19, free entry for fans",https://timesofindia.indiatimes.com/sports/cricket/news/womens-asia-cup-india-pakistan-league-clash-on-july-19-free-entry-for-fans/articleshow/111693667.cms,"NEW DELHI: The Indian women's cricket team will face arch-rivals Pakistan on July 19 on the opening day of the Women's T20 Asia Cup at Dambulla.Hosts Sri Lanka will play Bangladesh in their first game on the following day, Sri Lanka Cricket announced on Friday.The tournament features eight teams -- India, Pakistan, Bangladesh, Sri Lanka, Thailand, UAE, Nepal, and Malaysia.India are in Group A with Pakistan, UAE, and Nepal. Group B comprises Bangladesh, Sri Lanka, Malaysia, and Thailand.The tournament will have 15 games, including two semifinals and the final.All the matches will be broadcast live on international platforms. The stadium will be open to the public for free entry to witness the games.""All the games will be broadcast live across international platforms, and the stadium will be kept open for the public to enter for free in order to witness the games,"" the media release stated.The Executive Committee of SLC and the Asian Cricket Council (ACC) have jointly appointed Ravin Wickramaratne as the Tournament Director.""Sri Lanka Cricket, with the support of the Asian Cricket Council, is planning to conduct a highly successful tournament, as a successful outcome of this tournament will help advance women's cricket on the world stage,"" said Wickramaratne, who is also the vice-president of Sri Lanka Cricket.","India to face arch-rivals Pakistan on opening day of Women's T20 Asia Cup. Hosts Sri Lanka will play Bangladesh in their first game on the following day. The tournament features eight teams -- India, Pakistan, Bangladesh, Sri Lanka, Thailand, UAE, Nepal, and Malaysia.","https://static.toiimg.com/thumb/msid-111693846,imgsize-133260,width-400,resizemode-4/111693846.jpg"
"'You are England cricket,’ says Nasser Hussain in emotional farewell message for Anderson",https://timesofindia.indiatimes.com/sports/cricket/news/you-are-england-cricket-says-nasser-hussain-in-emotional-farewell-message-for-anderson/articleshow/111693799.cms,"LONDON: James Anderson , a dedicated and long-serving member of the England cricket team, has announced his retirement from international cricket. Throughout his remarkable 21-year career, Anderson earned the moniker ""king of swing"" for his exceptional skills with the ball.On Friday, the 41-year-old's illustrious tenure as one of the greatest fast bowlers in the sport's history concluded in an emotional farewell.England secured a commanding victory over West Indies by an innings and 114 runs in Anderson's final appearance for the national team.“Dear Jimmy, on behalf of England Cricket. 21 years is hard to sum up. You were there at our greatest and there at our lowest. So it’s time to thank you for your skill, for your spirit, for your genius, for your guts, for your resilience, for your records, for your feats, for your friendship, for leaving everything out there time and time again. And in that now and forever you are England cricket,” IANS quoted former captain Nasser Hussain as saying in an emotional video posted by England Cricket on X.Anderson, a cricketing icon, embarked on his remarkable journey in 2003 at the age of 20, making his debut against Zimbabwe. Throughout his illustrious career, he achieved the unprecedented feat of becoming the first fast bowler to claim 700 Test wickets, ultimately amassing an impressive tally of 704 scalps.In what was intended to be Anderson's swansong match, the limelight unexpectedly shifted to the debutantGus Atkinson . The young talent showcased his exceptional skills with the ball, claiming an astonishing 12 wickets across both innings, leaving everyone in awe of his performance.Following the match, Atkinson and the team's captain, Ben Stokes , shared their sentiments regarding the departure of the legendary Anderson. Their words reflected the immense respect and admiration they held for the veteran fast bowler, acknowledging his unparalleled contributions to the sport.“An incredible inspiration for so many people. A lot of young people have looked up to him and wanted to emulate his career which is going to be very hard to do...very lucky to keep him in the dressing room. To have someone like Jimmy speaking to them and offloading his learnings is great for us going forward. Sometimes you can be a bit lost for words,” said Ben Stokes in the post-game interview.“It's been an incredible week. I just want to say thanks to Jimmy. Playing here in his last Test has been incredible, and to do so well has been incredible [too]. Growing up, Jimmy was someone I'd come here to Lord's to watch. I was at mid-off looking over at Jimmy running in thinking, 'I've seen this so many times on the TV'. It was amazing,” added debutant and player of the match Gus Atkinson.",James Anderson has announced his retirement from international cricket. The 41-year-old bowler made his debut for England in 2003 at the age of 20. He became the first fast bowler to claim 700 Test wickets. England secured a commanding victory over West Indies by an innings and 114 runs.,"https://static.toiimg.com/thumb/msid-111693844,imgsize-22306,width-400,resizemode-4/111693844.jpg"
