Article Title,Article Link,Article Text,Article Summary,Article Image
Spain romp past Croatia in opener as Lamine Yamal makes Euros history,https://timesofindia.indiatimes.com/sports/football/top-stories/spain-romp-past-croatia-in-opener-as-lamine-yamal-makes-euros-history/articleshow/111026772.cms,"NEW DELHI: Spain kicked off their Euro 2024 campaign with a stellar 3-0 win against Croatia in Berlin on Saturday with Alvaro Morata , Fabian Ruiz and Dani Carvajal netting the goals for the 2008 and 2012 champions.Lamine Yamal also made history in the game, becoming the youngest player in the competition’s history.Over the years, Spain has faced criticism for their lack of scoring in important tournaments. However, their performance at the Olympiastadion demonstrated a strong and cohesive attack. Croatia, on the other hand, fell short against Spain's dominant play.Morata opened the scoring in the 29th minute, marking his seventh goal in the Euros. The goal placed him alongside Alan Shearer and Antoine Griezmann on the all-time list.Ruiz quickly followed up with a second goal, showcasing his individual skill with a stunning strike.Yamal, making his mark on history, assisted Dani Carvajal with a clever play just before half-time, effectively securing Spain's lead. Croatia’s Bruno Petkovic missed a penalty late in the game.In a rematch of last year's Nations League final, which Spain won on penalties after a 0-0 draw, La Roja showed they might have what it takes to claim a fourth European Championship title.Croatia, World Cup semi-finalists, now face a challenging path to the knockout stage, with upcoming matches against Albania and defending champions Italy in Group B. Midfield maestro Luka Modric was substituted midway through the second half by coach Zlatko Dalic.Spain’s coach Luis de la Fuente’s lineup featured young wingers Nico Williams and Yamal.At just 16 years and 338 days old, Yamal broke the record for the youngest player at a Euros, previously held by Poland's Kacper Kozlowski, who played at Euro 2020 at 17 years and 246 days old.Croatian fans were passionate, displaying a large banner during their national anthem that read, ""When we get going, heaven and earth will burn.""Despite the Croatian support, Spain took control from the start, dominating possession with their signature style.Spain showed off their adaptability under De la Fuente with their first goal. A superb through ball from Ruiz inside his half found Morata, who confidently finished past Croatia's goalkeeper Dominik Livakovic.Ruiz further cemented Spain’s dominance just minutes later. He navigated through two Croatian defenders and shot through Josip Sutalo’s legs into the corner of the net.Croatia responded almost immediately, with Spain's goalkeeper Unai Simon making a quick save on Marcelo Brozovic’s shot. Lovro Majer’s rebound attempt hit the side-netting, missing a chance to narrow the gap.Croatia continued to create opportunities. Josko Gvardiol’s cross nearly connected with Ante Budimir in the center but missed both him and the far post.Real Madrid's Dani Carvajal sealed the game in first-half injury time.Yamal, after collecting the ball post-corner, delivered a perfect cross for Carvajal to finish on the volley.Croatia pushed forward early in the second half but left themselves vulnerable at the back. Yamal was close to breaking another record for the youngest Euros scorer but was thwarted by a fine save from Livakovic.Marc Cucurella, controversially selected by De la Fuente, made a crucial block to stop Josip Stanisic from scoring and keeping Spain’s clean sheet intact.Substitute Petkovic nearly scored a consolation goal after his penalty was saved by Simon, but it was ruled out by VAR due to encroachment by Ivan Perisic.Spain's impressive start to Euro 2024 included not only a solid victory but also a clean sheet, highlighting their strengths in both attack and defense.","Spain beat Croatia 3-0 in Euro 2024 opener in Berlin. Alvaro Morata, Fabian Ruiz and Dani Carvajal scored the goals. Lamine Yamal became the youngest player in the competition's history. Croatia's Bruno Petkovic missed a penalty late in the game.","https://static.toiimg.com/thumb/msid-111026782,imgsize-77230,width-400,resizemode-4/111026782.jpg"
"Brighton make Fabian Hurzeler, 31, youngest Premier League manager",https://timesofindia.indiatimes.com/sports/football/epl/top-stories/brighton-make-fabian-hurzeler-31-youngest-premier-league-manager/articleshow/111026551.cms,"NEW DELHI: Fabian Hurzeler has become the youngest full-time manager in the English Premier League .Brighton confirmed their appointment of the 31-year-old as their new head coach on Saturday.Hurzeler, who led St Pauli to win Germany's Bundesliga second division last season, has committed to a contract with the south coast team lasting until 2027.The Texas-born manager will lead a Brighton squad featuring several players older than him, such as James Milner, 38, Danny Welbeck, 33, and Lewis Dunk, 32.Brighton chairman Tony Bloom highlighted Hurzeler's impressive record, explaining that his success at St Pauli made him a ""standout candidate"" to replace Roberto De Zerbi, who left the club last season.Hurzeler's tenure will begin when he secures a work permit, aligning with Brighton's pre-season activities starting in July.""From the start of the process to appoint our new head coach, Fabian was always a standout candidate and one who had caught our attention with his exceptional work at St Pauli over the past 18 months,"" said Bloom in a club statement.""He has a style of play that aligns with how we want a Brighton and Hove Albion team to play and I'm confident it is one our supporters will appreciate and enjoy.""Fabian also has an excellent coaching pedigree and has worked with the German federation at various age group levels. We are really excited to start working with Fabian to prepare for the upcoming season.""Hurzeler, who took his first coaching role in 2016, said: ""I am absolutely thrilled to be the new head coach of Brighton and Hove Albion.He added: ""The club has a unique history and bold vision for the future, so I am truly excited to be part of the project.""St Pauli sporting director Andreas Bornemann, while sad to see Hurzeler leave, said the club respected his ""desire"" to work in the Premier League.""Fabian has done an excellent job both as assistant and head coach of St. Pauli,"" said Bornemann.""We knew that he could also be of interest to other clubs. We would have liked to continue down this path with him...We wish Fabian all the best and plenty of success for the future.""Ryan Mason was the youngest coach to lead a Premier League team as Tottenham’s interim boss in 2021 at age 29. However, Hurzeler is now the youngest full-time manager in the league's history since its inception in 1992.Under Roberto De Zerbi, who took over Brighton in September 2022, the team achieved its highest top-flight finish by placing sixth in the 2022/23 season.De Zerbi also led Brighton to their first European competition, reaching the Europa League last 16 before losing to Roma 4-1 on aggregate.",Fabian Hurzeler has become the youngest full-time manager in the English Premier League. The 31-year-old led St Pauli to win Germany's Bundesliga second division last season. He has committed to a contract with the south coast team lasting until 2027. The Texas-born manager will lead a squad featuring several players older than him.,"https://static.toiimg.com/thumb/msid-111026740,imgsize-59078,width-400,resizemode-4/111026740.jpg"
Switzerland outclass Hungary with 3-1 win in their Euro 2024 opener,https://timesofindia.indiatimes.com/sports/football/top-stories/switzerland-outclass-hungary-with-3-1-win-in-their-euro-2024-opener/articleshow/111025017.cms,"NEW DELHI: Switzerland kicked off their Euro 2024 campaign with an impressive 3-1 victory against a vulnerable Hungary side in Cologne on Saturday.Kwadwo Duah and Michel Aebischer scored their first international goals, while Breel Embolo found the net on his comeback from injury.According to Reuters, Duah, in only his second appearance for the national team, gave the Swiss the lead with a composed finish in the 12th minute, assisted by Aebischer. The latter then doubled the advantage just before halftime with a stunning curling effort from outside the box.Hungary managed to pull one back in the 66th minute when Barnabas Varga stooped low to head Dominik Szoboszlai's curling cross into the bottom corner.This sparked a desperate attempt to get back into the game, but the Swiss remained resolute and sealed the win when substitute Embolo took advantage of a mistake in stoppage time.Switzerland, aiming to reach the knockout stages in their sixth consecutive major tournament, displayed a polished performance. They were composed and well-organised in defence, and swift in attack, with Granit Xhaka orchestrating the play and Dan Ndoye causing constant problems for the Hungarian backline.Coach Murat Yakin's decision to recall Aebischer and Duah to the Switzerland side proved to be a masterstroke, as Aebischer played a pivotal role in several first-half attacks that exposed the weaknesses in the Hungarian defense.Hungary's start to their third consecutive Euros was underwhelming, especially considering their impressive run of 14 matches unbeaten that had only recently come to an end. They had the first opportunity of the game in the ninth minute when Attila Fiola squared the ball to Roland Sallai, who blasted his shot over the bar.The Hungarians, who reached the round of 16 in 2016 and were eliminated in the group stage of Euro 2020, improved in the second half and briefly rallied after scoring.However, the Swiss maintained their composure, with Xhaka and Ndoye creating good chances late on before Embolo calmly lifted the ball over the keeper to secure the third goal.",Switzerland beat Hungary 3-1 in their opening Euro 2024 qualifier in Cologne. Kwadwo Duah and Michel Aebischer scored their first international goals. Substitute Breel Embolo also found the net on his comeback from injury.,"https://static.toiimg.com/thumb/msid-111024987,imgsize-51776,width-400,resizemode-4/111024987.jpg"
French Open champion Carlos Alcaraz eager to take clay form into grass season,https://timesofindia.indiatimes.com/sports/tennis/top-stories/french-open-champion-carlos-alcaraz-eager-to-take-clay-form-into-grass-season/articleshow/111043166.cms,"Carlos Alcaraz , the reigning French Open champion , is determined to continue his winning streak on grass courts following his remarkable victory at Roland Garros .At just 21 years old, Alcaraz achieved a significant milestone by becoming the youngest male player to secure major titles on all three surfaces: grass, hard courts, and clay. His triumph came after a grueling five-set battle against Alexander Zverev in the French Open final last Sunday.With his focus now shifting to the grass-court season, Alcaraz aims to replicate his impressive performance from the previous year. In 2022, he claimed the title at Queen's Club before going on to clinch his first Wimbledon championship .The young Spaniard is determined to defend both titles and further establish himself as a dominant force on the grass courts.Adding to the excitement surrounding Alcaraz's recent success, it has been announced that he will team up with his compatriot and tennis legend, Rafael Nadal , at the upcoming Olympics in Paris next month.Nadal, who has an astounding record of 14 French Open titles, will join forces with Alcaraz to represent Spain in the prestigious event. This partnership is expected to be a formidable force and will undoubtedly attract significant attention from tennis enthusiasts worldwide.""I had a few days off, I went to Ibiza with a group of friends. I had fun, I enjoyed my time,"" Alcaraz was quoted as saying by AFP at Queen's on Sunday.""Obviously Roland Garros was a fantastic two weeks for me, a dream come true to lift the trophy but right now my mind must be here on the grass.""To be ready as soon as I can to play good tennis here at Queen's and obviously to get ready for Wimbledon.""Right now my focus is on the grass season, the two tournaments and after that my mind will be to be ready on clay again and playing my best tennis at the Olympic Games.""Alcaraz expressed his excitement about the opportunity to partner with Nadal, a Spanish tennis legend, in the doubles event at the upcoming Olympics said: ""I feel really, really happy to play doubles in the Olympics and with an idol like Rafa.""I mean, I didn't expect to play doubles at the Olympic Games with Rafa. It is a unique moment for me but of course I am very happy about it. Let's see how it's going to be but it's going to be a great time.""Honestly, I feel he is going to teach me how to deal with everything. I am the young guy who needs to grow up as a player, to grow up as a person as well.""He added: ""Of course it's going to be my first Olympic Games. Everything is new for me, so I hope to learn a lot from him.""Alcaraz starts his campaign against Argentina's Francisco Cerundolo at Queen's Club on Tuesday.","Carlos Alcaraz is the reigning French Open champion. The 21-year-old Spaniard is also the youngest male player to win a major on all three surfaces: grass, hard courts, and clay. He will team up with compatriot Rafael Nadal at the upcoming Olympics in Paris.","https://static.toiimg.com/thumb/msid-111043155,imgsize-32886,width-400,resizemode-4/111043155.jpg"
Sumit Nagal finishes runner-up at Perugia Challenger,https://timesofindia.indiatimes.com/sports/tennis/top-stories/sumit-nagal-finishes-runner-up-at-perugia-challenger/articleshow/111043014.cms,"NEW DELHI: Sumit Nagal , India's top-ranked tennis player, suffered a disappointing defeat against Italy's Luciano Darderi in the final of the Perugia Challenger on Sunday.According to PTI, the match, which lasted just over an hour, saw Nagal struggle to find his rhythm, ultimately succumbing to a 1-6, 2-6 loss.Despite his recent success, including a career-high ranking of 77 and a third final appearance this year, the 26-year-old was unable to match the performance of his Italian opponent, who is currently ranked 41 in the world.Nagal had previously secured his place in the final with a hard-fought victory over Spain's Bernabe Zapata Miralles , a former world No. 37, winning 7-6 (7-2), 1-6, 6-2.Earlier this year, Nagal had claimed the title at the Chennai Challenger, which followed his historic second-round appearance at the Australian Open .However, his performance in the Perugia Challenger final fell short of expectations, as he failed to secure his third title of the season.","Sumit Nagal loses 1-6, 2-6 to Italy's Luciano Darderi in the final of the Perugia Challenger on Sunday. The 26-year-old Indian is India's top-ranked tennis player, currently ranked No. 2. Nagal had previously claimed the title at the Chennai Challenger.","https://static.toiimg.com/thumb/msid-111043049,imgsize-71072,width-400,resizemode-4/111043049.jpg"
'I am not 100 percent sure': Andy Murray on his participation in fifth Olympics,https://timesofindia.indiatimes.com/sports/tennis/top-stories/i-am-not-100-percent-sure-andy-murray-on-his-participation-in-fifth-olympics/articleshow/111042779.cms,"NEW DELHI: Andy Murray expressed uncertainty on Sunday about participating in the Paris Olympics , just hours after being selected for his fifth Games.Despite his singles ranking of 97, Murray received an International Tennis Federation ( ITF ) spot due to his status as a former Grand Slam champion and Olympic gold medalist.Joe Salisbury and Neal Skupski will compete in men's doubles for Team GB . Murray and Dan Evans have been nominated for an extra slot in the doubles, with the ITF deciding their participation on June 25.According to AFP, the 37-year-old Murray mentioned that his decision to compete in the Games depends on whether he'll be playing in both doubles and singles events.""I am not 100 percent sure,"" Murray stated at Queen's Club in a Team GB tracksuit. ""It depends a little bit physically how I am doing. How the next few weeks go as well. Yeah, my plan just now is to play, but it is not straightforward.""""I'll find out in the next 10 days or so on the doubles and what's going to happen there. Hopefully me and Evo get the chance to play.""Murray secured Olympic gold in both London 2012 and Rio 2016. He is one of four British male singles players selected, alongside Jack Draper, Cameron Norrie, and Dan Evans.The selection day was significant for Jack Draper, who shortly afterward won his first ATP tour title by beating Matteo Berrettini 3-6, 7-6 (7/5), 6-4 in the Stuttgart Open final.Team GB was also informed that 2021 US Open champion Emma Raducanu could qualify for an ITF spot. However, Raducanu declined the offer due to the upcoming changes in playing surfaces and her recent recovery from a long-term injury.Katie Boulter, who defeated Raducanu in the Nottingham Open semi-finals on Sunday, is the only female player in the British team.","Andy Murray expresses uncertainty on Sunday about participating in the Paris Olympics. Murray received an ITF spot due to his status as a former Grand Slam champion and Olympic gold medalist. Murray is one of four British male singles players selected, alongside Jack Draper, Cameron Norrie, and Dan Evans.","https://static.toiimg.com/thumb/msid-111042799,imgsize-33170,width-400,resizemode-4/111042799.jpg"
Raducanu beaten by Boulter in all British semi at Nottingham,https://timesofindia.indiatimes.com/sports/tennis/top-stories/raducanu-beaten-by-boulter-in-all-british-semi-at-nottingham/articleshow/111041830.cms,"NEW DELHI: In a thrilling semi-final clash at the WTA Nottingham Open on Sunday, Katie Boulter emerged victorious over former US Open champion Emma Raducanu , AFP reported.The match, which was suspended on Saturday due to poor lighting conditions, resumed with Raducanu having clinched the first set in an epic tie-break.However, Boulter, the British number one, displayed remarkable resilience and determination to stage a comeback. She won the second set 6-3 and then sealed the match with a 6-4 victory in the deciding set.The grueling encounter lasted over three hours, showcasing the immense talent and competitive spirit of both players.Despite the disappointment of the loss, Raducanu can take solace in her performance, considering her recent return from a seven-week hiatus due to wrist and ankle injuries.This semi-final appearance marks her best result since her historic triumph at the 2021 US Open, where she defied the odds as a qualifier to claim the title.Following the match, Boulter expressed her admiration for Raducanu, stating, ""What a match, what an incredible player.""""She is only going to get better and better, she makes it so tough to close it out,"" added Boulter, 30 in the world rankings, after again reaching the final of her home event.Karolina Pliskova, a former runner-up at both the US Open and Wimbledon , advanced to the Nottingham final on Sunday after overcoming Diane Parry of France.The Czech player, who won the tournament in 2016 and has maintained an unbeaten record at the event, prevailed 6-7 (9/11), 6-1, 6-4 in a closely contested semi-final match.By reaching the final, the 32-year-old Pliskova has secured her first appearance in a grass-court championship match since her loss to Ashleigh Barty of Australia in the 2021 Wimbledon final.",Katie Boulter beats former US Open champion Emma Raducanu in three-set thriller. Karolina Pliskova defeats Diane Parry of France to reach final of WTA Nottingham Open. Czech won the tournament in 2016 and has maintained an unbeaten record at event.,"https://static.toiimg.com/thumb/msid-111041827,imgsize-47174,width-400,resizemode-4/111041827.jpg"
"Britain's Jack Draper claims maiden ATP title, eyes Wimbledon seeding",https://timesofindia.indiatimes.com/sports/tennis/top-stories/britains-jack-draper-claims-maiden-atp-title-eyes-wimbledon-seeding/articleshow/111041447.cms,"NEW DELHI: Jack Draper , a rising British tennis star, achieved a significant milestone on Sunday by securing his maiden ATP title . The 22-year-old left-hander staged an impressive comeback victory against the formidable Italian, Matteo Berrettini , in the Stuttgart grass-court final .According to AFP, Draper's triumph not only marks his first career title but also enhances his prospects of earning a seeded position at the upcoming Wimbledon tournament.Despite facing a challenging match against the two-time champion and former Wimbledon runner-up, Draper displayed remarkable resilience. After losing the first set 3-6, he fought back valiantly to clinch the second set in a tense tie-break, 7-6(7/5).Riding on the momentum, Draper maintained his composure in the decisive set, ultimately prevailing 6-4 to seal the victory.""It's incredible. It was a really, really tough match. But I'm really happy to win my first title. It means so much to me,"" expressed an elated Draper, who was participating in only his third career final.This momentous win propels Draper to the top of the British rankings , as he is set to become the new British number one starting Monday.Moreover, his success on the grass courts of Stuttgart strengthens his case for a seeded position at Wimbledon, which is slated to commence on July 1.With his rising form and newfound confidence, Draper has undoubtedly emerged as a player to watch in the upcoming grass-court season.","Jack Draper, a rising British tennis star, achieved a significant milestone by securing his maiden ATP title. The 22-year-old left-hander staged an impressive comeback victory against the formidable Italian, Matteo Berrettini. Draper's triumph not only marks his first career title but also enhances his prospects of earning a seeded position at the upcoming Wimbledon tournament.","https://static.toiimg.com/thumb/msid-111041444,imgsize-48022,width-400,resizemode-4/111041444.jpg"
Andy Murray named for fifth Olympics,https://timesofindia.indiatimes.com/sports/tennis/top-stories/andy-murray-named-for-fifth-olympics/articleshow/111038709.cms,"NEW DELHI: Andy Murray , the former Grand Slam winner and Olympic gold medalist, has been selected as one of the four British singles players for the upcoming Paris Olympics , marking his fifth appearance at the Summer Games, AFP reported.Despite his current singles ranking of 97, Murray was granted an ITF place to compete at the French Open at Roland Garros.Team GB had the opportunity to include 2021 US Open champion Emma Raducanu for an ITF place, but she declined due to the numerous surface changes in the coming weeks and her recent return from an extended injury break.Joining Murray in representing Team GB in the men's singles competition are Jack Draper, Cameron Norrie, and Dan Evans, while Katie Boulter will be the sole female participant for Britain.In the men's doubles, Joe Salisbury and Neal Skupski will represent Team GB, and the duo of Murray and Evans have been nominated for an additional spot in that event, which will be determined by the ITF, the governing body of world tennis who oversee the tournament, on June 25.",Andy Murray has been selected as one of the four British singles players for the upcoming Paris Olympics. Murray was granted an ITF place to compete at the French Open at Roland Garros. Team GB had the opportunity to include 2021 US Open champion Emma Raducanu.,"https://static.toiimg.com/thumb/msid-111038714,imgsize-30082,width-400,resizemode-4/111038714.jpg"
Sumit Nagal advances to Perugia Challenger final with hard-fought victory,https://timesofindia.indiatimes.com/sports/tennis/top-stories/sumit-nagal-advances-to-perugia-challenger-final-with-hard-fought-victory/articleshow/111026549.cms,"NEW DELHI: Sumit Nagal , India's top-ranked player, advanced to the final of the Perugia Challenger after a hard-fought 7-6 (7-2), 1-6, 6-2 victory over Spain's Bernabe Zapata Miralles , a former World No. 37, on Saturday.According to PTI, Nagal will face either Italy's Luciano Darderi or Germany's Daniel Altmaier in the final.The 26-year-old, currently ranked a career-high 77 in the world, faced a tough challenge in the first set but managed to prevail in the tie-breaker.Miralles bounced back in the second set, winning it 6-1 and landing 77 percent of his first serve points. However, Nagal responded strongly in the decider with his return of serves, securing his first win over the Spaniard in three meetings.Nagal's victory marked his ninth consecutive win since the start of the Heilbronn Challenger in Germany, which he won earlier this month. He remains in contention for a second straight Challenger title, which would help him move closer to the top-50 ranking.Earlier this year, Nagal won the Chennai Challenger, following a historic second-round appearance at the Australian Open.In the doubles final, India's N Sriram Balaji and his German partner Andre Begemann were defeated by top-seeded Guido Andreozzi of Argentina and Miguel Angel Reyes-Varela of Mexico, with a score of 4-6, 5-7.","Sumit Nagal beats Bernabe Zapata Miralles 7-6 (7-2), 1-6, 6-2. India's top- ranked player will face Luciano Darderi or Daniel Altmaier in the final. Nagal's victory marked his ninth consecutive win since the start of the Heilbronn Challenger in Germany.","https://static.toiimg.com/thumb/msid-111026552,imgsize-36796,width-400,resizemode-4/111026552.jpg"
