Article Title,Article Link,Article Text,Article Summary,Article Image
"Intel to layoff over 15,000 employees: Read the memo shared by company’s CEO",https://timesofindia.indiatimes.com/technology/tech-news/intel-to-layoff-over-15000-employees-read-the-memo-shared-by-companys-ceo/articleshow/112211785.cms,"Here’s the full text of the memo shared by Intel CEO

Team,

We have moved our All Company Meeting to today, following our earnings call, as we are announcing significant actions to reduce our costs. We plan to deliver $10 billion in

cost savings

in 2025, and this includes reducing our head count by roughly 15,000 roles, or 15% of our workforce. The majority of these actions will be completed by the end of this year.

This is painful news for me to share. I know it will be even more difficult for you to read. This is an incredibly hard day for Intel as we are making some of the most consequential changes in our company’s history. When we meet in a few hours, I’ll talk about why we’re doing this and what you can expect in the coming weeks. In advance of that, I wanted to preview some of what’s on my mind.

Simply put, we must align our cost structure with our new operating model and fundamentally change the way we operate. Our revenues have not grown as expected – and we’ve yet to fully benefit from powerful trends, like AI. Our costs are too high, our margins are too low. We need bolder actions to address both – particularly given our financial results and outlook for the second half of 2024, which is tougher than previously expected.

These decisions have challenged me to my core, and this is the hardest thing I’ve done in my career. My pledge to you is that we will prioritize a culture of honesty, transparency and respect in the weeks and months to come.

Next week, we’ll announce a companywide enhanced retirement offering for eligible employees and broadly offer an application program for voluntary departures. I believe that how we implement these changes is just as important as the changes themselves, and we will adhere to Intel values throughout this process.

Why Now?

Since introducing our new operating model, we have taken a clean-sheet view of the business and assessed ourselves against benchmarks for high-performing foundries, fabless product companies and corporate functions. This work made it clear our cost structure is not competitive.

For example, our annual revenue in 2020 was about $24 billion higher than it was last year, yet our current workforce is actually 10% larger now than it was then. There are a lot of reasons for this, but it’s not a sustainable path forward.

Beyond our costs, we need to change the way we operate – something many of you shared as part of our Employee Experience Survey. There’s too much complexity, so we need to both automate and simplify processes. It takes too long for decisions to be made, so we need to eliminate bureaucracy. And there’s too much inefficiency in the system, so we need to expedite workflows.

Key Priorities

The actions we are taking will make Intel a leaner, simpler and more agile company. Let me highlight our areas of focus:

Reducing Operational Costs: We will drive companywide operational and cost efficiencies, including the cost savings and head count reductions mentioned above.

Simplifying Our Portfolio: We will complete actions this month to simplify our businesses. Each business unit is conducting a portfolio review and identifying underperforming products. We are also integrating key software assets into our business units so we accelerate our shift to systems-based solutions. And we will narrow our incubation focus on fewer, more impactful projects.

Eliminating Complexity: We will reduce layers, eliminate overlapping areas of responsibility, stop non-essential work, and foster a culture of greater ownership and accountability. For example, we will consolidate Customer Success into the Sales, Marketing and Communications Group to streamline our go-to-market motions.

Reducing Capital and Other Costs: With the completion of our historic five-nodes-in-four-years roadmap clearly in sight, we will review all active projects and equipment so we begin to shift our focus toward capital efficiency and more normalized spending levels. This will reduce our 2024 capital expenditures by more than 20%, and we plan to reduce our non-variable cost of goods sold by roughly $1 billion in 2025.

Suspending Our Dividend: We will suspend our stock dividend beginning next quarter to prioritize investments in the business and drive more sustained profitability.

Maintaining Growth Investments: Our IDM2.0 strategy is unchanged. Having fought hard to reestablish our innovation engine, we will maintain the key investments in our process technology and core product leadership.

The Future

I have no illusions that the path in front of us will be easy. You shouldn’t either. This is a tough day for all of us and there will be more tough days ahead. But as difficult as all of this is, we are making the changes necessary to build on our progress and usher in a new era of growth.

When we began this journey, we set our sights high, knowing that Intel is a place where big ideas are born and the power of what’s possible triumphs over the status quo. After all, our mission is to create world-changing technologies that improve the lives of every person on the planet. And at our best, we have exemplified these ideals more than any company in the world.

To live up to this mission, we must continue to drive our IDM 2.0 strategy, which remains the same: re-establish process technology leadership; invest in at-scale, globally resilient supply chain by expanding manufacturing capacity in the U.S. and EU; become a world-class, leading-edge foundry for internal and external customers; rebuild product portfolio leadership; and deliver AI Everywhere.

Over the past few years, we have rebuilt a sustainable innovation engine that is largely in place and on track. It’s now time to focus on building the sustainable financial engine needed to drive our performance. We must improve our execution, adapt to new market realities and operate as a more agile company. That’s the spirit of the actions we are taking – knowing that the choices we make today, as difficult as they are, will strengthen our ability to serve our customers and grow our business for years to come.

As we take these next steps in our journey, let’s not forget that there has never been a greater need for what we do. The world will increasingly run on silicon – and the world needs a healthy and vibrant Intel. That’s why the work we are doing is so consequential. Not only are we remaking a great company, but we are also creating technology and manufacturing capabilities that will reshape the world for decades to come. And this is something we should never lose sight of as we push forward in pursuit of our goals.

We’ll talk more in a few hours. Please come with your questions so we can have an open and honest discussion about what comes next.

Intel has announced to reduce its head count by more than 15% of its workforce, some 15,000 people, to reduce costs. “Our costs are too high, our margins are too low,” the company’s CEO Pat Gelsinger said in an internal memo sent to Intel employees on Thursday. In the letter, Gelsinger also said that the software giant will also announce a companywide enhanced retirement offering for eligible employees and broadly offer an application program for voluntary departures next week.","CEO: We plan to deliver $10 billion in cost savings by 2025. This includes reducing our head count by roughly 15,000 roles, or 15% of our workforce. The majority of these actions will be completed by the end of this year.","https://static.toiimg.com/thumb/msid-112211779,imgsize-17172,width-400,resizemode-4/112211779.jpg"
iQoo Z9s series to launch in India on August 21: What to expect,https://timesofindia.indiatimes.com/technology/mobiles-tabs/iqoo-z9s-series-to-launch-in-india-on-august-21-what-to-expect/articleshow/112213404.cms,"

iQoo Z9s series what to expect

iQoo Z9 Lite launched in India recently



iQoo is all set to launch its Z9s smartphone series in India on August 21. The company took to microblogging site X (formerly twitter ) to announce the launch date.“Introducing the #iQOOZ9sPro with the Z series' first-ever premium marble texture! Launching on August 21st @amazonIN. Inspired by nature and crafted for luxury. It’s not just a phone—it’s a statement of style and performance,” read the company’s post.As per the teaser, the upcoming smartphone series is claimed to be the ‘segment’s fastest curved screen phone’.The series may offer two phones – iQoo Z9s and iQoo Z9s Pro .The upcoming iQoo smartphone series is tipped to come in 12GB RAM and 256GB internal storage variant. The smartphone may feature a 50MP rear camera with f/1.8 aperture and OIS. white and orange are the rumoured colour variants of the phones, but it is likely that the series may offer other colour models as well.Chinese smartphone maker iQoo launched its Z9 Lite smartphone in India last week. The smartphone comes with a starting price tag of Rs 10,499. iQoo Z9 Lite 5G sports a 6.56-inch HD+ display and is powered by an octa-core MediaTek Dimensity 6300 chipset paired with up to 6GB of RAM. The smartphone offers 128GB internal storage. Users can further expand the storage by adding a microSD card of up to 1TB.iQoo Z9 Lite 5G runs Android 14 operating system topped with FunTouch OS. The smartphone also comes with IP64 rating which makes it resistant to dust and water. The smartphone is backed by a 5000 mAh battery with 15W fast charging support.","iQoo is all set to launch its Z9s smartphone series in India on August 21. The company took to microblogging site X (formerly twitter ) to announce the launch date. iQoo Z9 Lite was launched in India last week with a starting price tag of Rs 10,499.","https://static.toiimg.com/thumb/msid-112213393,imgsize-35422,width-400,resizemode-4/112213393.jpg"
"'ATM, UPI service affected': Ransomware attack on service provider hits 300 small banks across India",https://timesofindia.indiatimes.com/technology/tech-news/atm-upi-service-affected-ransomware-attack-on-service-provider-hits-300-small-banks-across-india/articleshow/112175656.cms,"All online transactions, such as RTGS and UPI payments, affected

'Breach discovered two days ago'

NEW DELHI: A ransomware attack has forced the temporary shutdown of payment systems across nearly 300 small Indian local banks, according to reports. The customers of these banks have not been able to access payments services like withdrawing cash at ATMs or using United Payments Interface (UPI).The ransomware attack affected C-Edge Technologies , a provider of banking technology systems to small banks across the country, reports said.Other banking services are functioning normally, the officials told PTI.In a statement released late in the evening, the national payments corporation of India (NPCI) said, ""C-Edge Technologies….has been possibly impacted by a ransomware attack impacting a few of their systems,"" leading to the temporary isolation of C-Edge from accessing NPCI-operated retail payment systems.Dileep Sanghani, chairman of the national cooperative union of India, told news agency PTI that nearly 300 banks in India, including 17 district cooperative banks in Gujarat, which rely on C-Edge, have been facing issues for the past two to three days.""All online transactions, such as RTGS and UPI payments, are affected. Money is deducted from the sender's account but does not get credited in the receiver's account,"" Sanghani said.""Customers of banks serviced by C-Edge will not be able to access payment systems during the period of isolation,"" the NPCI told news agency Reuters.The statement also mentioned that restoration work is being carried out rapidly in collaboration with C-Edge Technologies, and a mandatory security review is underway.C-Edge, a joint venture between SBI and TCS, serves cooperative banks and regional rural banks, which have been affected by the breach. Officials stated that other banking services remained unaffected. To protect the broader payments system, necessary precautions, including isolating the C-Edge system, had to be implemented following the discovery of the breach two days ago.An industry official told news agency PTI that a ransomware had been detected and isolated within the system, prompting a third-party audit.The official told news agency PTI that the affected banks represent less than 1 percent of the total payment system volume in the country.Despite the incident, no financial losses have been reported, news agency PTI said.","Customers of these banks have not been able to access payments services like withdrawing cash at ATMs or using United Payments Interface (UPI) The ransomware attack affected C-Edge Technologies, a provider of banking technology systems to small banks across the country.","https://static.toiimg.com/thumb/msid-112175695,imgsize-1564323,width-400,resizemode-4/112175695.jpg"
"Anand Mahindra on Indian badminton star Lakshya Sen's match at Paris Olympic: If I was his opponent, I would …",https://timesofindia.indiatimes.com/technology/tech-news/anand-mahindra-on-indian-badminton-star-lakshya-sens-match-at-paris-olympic-if-i-was-his-opponent-i-would-/articleshow/112193934.cms,"What Anand Mahindra said

Indian badminton sensation Lakshya Sen has left the sporting world in awe with his remarkable performance at the Paris Olympics 2024. In a thrilling match against Indonesia’s world number 4 Jonatan Christie , Lakshya not only secured a convincing 21-18, 21-12 victory but also showcased an extraordinary shot that went viral on social media .Mahindra Group chairman Anand Mahindra has once again showcased his sharp wit, this time taking a playful jab at Lakshya Sen's audacious behind-the-back shot.The shot in question? A jaw-dropping “behind-the-back” stroke that left spectators and opponents alike stunned. Industrialist Anand Mahindra, witnessing this display of skill, humorously suggested that Christie’s only recourse might be to “cry foul and file a suit” against Lakshya. According to Mahindra, the young shuttler seemed like an “unnatural opponent who possessed three arms.”The post resonated with fans, garnering thousands of likes and retweets. Here are some of the user reactions .“I was fortunate enough to watch this live. This is new India. Unconventional, aggressive, energetic and resourceful.”“Absolutely. A secret weapon of the best players! The Trump Card.”“Amazing. I can’t stand on my feet for 10 mins straight, and how do these athlete fly on toes.”“Flick that will be remembered for ages !”","Indian badminton sensation Lakshya Sen has left the sporting world in awe with his remarkable performance at the Paris Olympics 2024. In a thrilling match against Indonesia’s world number 4 Jonatan Christie, Lakshya secured a convincing 21-18, 21-12 victory. The shot in question? A jaw-dropping “behind- the-back” stroke that left spectators and opponents alike stunned.","https://static.toiimg.com/thumb/msid-112193926,imgsize-20236,width-400,resizemode-4/112193926.jpg"
Google to Tesla CEO Elon Musk: We want to set this record straight ...,https://timesofindia.indiatimes.com/technology/tech-news/google-to-tesla-ceo-elon-musk-we-want-to-set-the-record-straight-/articleshow/112155142.cms,"Tesla CEO Elon Musk accused Google of interfering with US elections and banning Donald Trump on Search. Google responded, clarifying that a bug in its autocomplete feature affected searches for political figures, including past presidents. The company stated that the issue has been resolved and emphasized that autocomplete helps users find results quickly without censoring specific terms.","Tesla CEO Elon Musk accused Google of interfering with US elections and banning Donald Trump on Search. Google responded, clarifying that a bug in its autocomplete feature affected searches for political figures, including past presidents. The company stated that the issue has been resolved.","https://static.toiimg.com/thumb/msid-112155469,imgsize-23312,width-400,resizemode-4/112155469.jpg"
"Apple iPhone 15 Plus is available for just Rs 16,730 on Amazon; check exchange deal and bank offer",https://timesofindia.indiatimes.com/technology/mobiles-tabs/apple-iphone-15-plus-is-available-for-just-rs-16730-on-amazon-check-exchange-deal-and-bank-offer/articleshow/112199291.cms,"Apple iPhone 15 Plus (Black, 128GB) Amazon deal

iPhone 15 Plus specifications

Display: The iPhone 15 Plus boasts a 6.7-inch Super Retina XDR display with ProMotion technology, allowing for a refresh rate of up to 120Hz. This provides a smoother and more responsive visual experience.

Processor: It is powered by the latest A16 Bionic chip, which ensures high performance and efficiency for demanding tasks.

Camera: The rear camera system features a new 48MP main sensor, offering significant improvements in photo and video quality, especially in low light. The Ultra Wide and Telephoto cameras have also seen enhancements, expanding shooting options.

Battery and additional features: The iPhone 15 Plus includes a long-lasting battery, a new under-display fingerprint sensor, and a USB-C port for added convenience.

Also read

The iPhone 15 Plus (Black, 128GB), released in 2023, is now offered at an exceptional price on Amazon. For those seeking a high-quality smartphone at a great value, the current Apple iPhone 15 Plus offer on Amazon is a chance you won't want to overlook.Initially priced at Rs 89,600, the iPhone 15 Plus is now available on Amazon with a 9% price reduction, bringing the cost down to Rs 81,900.However, the savings extend beyond this discount. Amazon is also offering a generous exchange discount of up to Rs 58,700 for customers who trade in their old phone in good condition.In addition, holders of an Amazon Pay ICICI Bank credit card can benefit from an extra discount of up to Rs 6,470. When combining these discounts and offers, the final effective price of the Apple iPhone 15 Plus can drop to an exceptionally low Rs 16,730. This comprehensive set of promotions provides an excellent opportunity for buyers seeking significant savings on this premium smartphone.","Initially priced at Rs 89,600, the iPhone 15 Plus is now available on Amazon with a 9% price reduction, bringing the cost down to Rs 81,900. Amazon is also offering a generous exchange discount of up to Rs 58,700 for customers who trade in their old phone in good condition. Holders of an Amazon Pay ICICI Bank credit card can benefit from an extra discount ofup to Rs 6,470.","https://static.toiimg.com/thumb/msid-112200931,imgsize-11076,width-400,resizemode-4/112200931.jpg"
Turkey's Olympic shooter Yusuf Dikec breaks the internet with effortless swag; he’s the hottest meme on X,https://timesofindia.indiatimes.com/technology/social/turkeys-olympic-shooter-yusuf-dikec-breaks-the-internet-with-effortless-swag-hes-the-hottest-meme-on-x/articleshow/112192946.cms,"Yusuf Dikec’s viral moment

Comparisons and memes



Yusuf Dikec memes and reactions on X

Olympic 2024 results

Also read

Turkish air pistol shooter Yusuf Dikec has become a viral sensation on social media after winning the silver medal at the 2024 Paris Olympics. A photograph of the 51-year-old athlete taking aim with one hand in his pocket and minimal gear has captivated the internet. This unexpected image of casual confidence has made Dikec the hottest meme on X, garnering widespread attention and admiration.On X, a post featuring the now-iconic photograph of Dikec has amassed an astonishing 62 million views.The post humorously noted, “Turkey sent a 51 yr old guy with no specialised lenses, eye cover or ear protection and got the silver medal,” capturing the essence of Dikec's unconventional approach.Dikec's appearance and performance starkly contrasted with other athletes in the air pistol mixed team competition, who sported specialised gear, including goggles, lenses to prevent blur, and noise-cancelling ear protectors. In contrast, Dikec competed with prescription glasses and normal earplugs, exuding an aura of casual coolness as he competed with one hand in his pocket. This unique display of confidence and skill has led to a flood of memes and jokes on X and other social media platforms.Social media users have had a field day with Dikec's image. Some of the best memes include comparisons to a secret spy or hitman, humorously suggesting that he intentionally didn't win gold to avoid suspicion. Here are some notable posts:In the 10-metre air pistol mixed team event, Zorana Arunovic and Damir Mikec of Serbia won the gold, narrowly defeating Sevval Ilayda Tarhan and Yusuf Dikec of Turkey with a score of 16-14 at the Chateauroux Shooting Centre. India’s Manu Bhaker and Sarabjot Singh claimed the bronze, beating the South Korean pair Oh Ye-jin and Lee Won-ho 16-10.",Turkish air pistol shooter Yusuf Dikec has become a viral sensation on social media after winning the silver medal at the 2024 Paris Olympics. A photograph of the 51-year-old athlete taking aim with one hand in his pocket and minimal gear has captivated the internet. This unexpected image of casual confidence has made him the hottest meme on X.,"https://static.toiimg.com/thumb/msid-112193019,imgsize-34162,width-400,resizemode-4/112193019.jpg"
30% of Gen-AI projects will be 'dumped' by the end of 2025 due to these reasons: Gartner,https://timesofindia.indiatimes.com/technology/tech-news/30-of-gen-ai-projects-will-be-dumped-by-the-end-of-2025-due-to-these-reasons-gartner/articleshow/112170259.cms,"What early adopters say

Calculating business impact

At least 30% of generative artificial intelligence ( GenAI ) projects will be abandoned after proof of concept by the end of 2025, due to poor data quality, inadequate risk controls, escalating costs or unclear business value, according to research company Gartner , Inc.Speaking at the Gartner Data & Analytics Summit in Sydney this week, Rita Sallam, distinguished VP analyst at Gartner said, “After last year's hype, executives are impatient to see returns on GenAI investments, yet organizations are struggling to prove and realize value.As the scope of initiatives widen, the financial burden of developing and deploying GenAI models is increasingly felt.”A major challenge for organizations arises in justifying the substantial investment in GenAI for productivity enhancement, which can be difficult to directly translate into financial benefit, according to Gartner. Many organizations are leveraging GenAI to transform their business models and create new business opportunities. However, these deployment approaches come with significant costs, ranging from $5 million to $20 million.“Unfortunately, there is no one size fits all with GenAI, and costs aren’t as predictable as other technologies,” said Sallam. “What you spend, the use cases you invest in and the deployment approaches you take, all determine the costs. Whether you’re a market disruptor and want to infuse AI everywhere, or you have a more conservative focus on productivity gains or extending existing processes, each has different levels of cost, risk, variability and strategic impact.”Regardless of AI ambition, Gartner research indicates GenAI requires a higher tolerance for indirect, future financial investment criteria versus immediate return on investment (ROI). Historically, many CFOs have not been comfortable with investing today for indirect value in the future. This reluctance can skew investment allocation to tactical versus strategic outcomes.Earlier adopters across industries and business processes are reporting a range of business improvements that vary by use case, job type and skill level of the worker. According to a recent Gartner survey, respondents reported 15.8% revenue increase, 15.2% cost savings and 22.6% productivity improvement on average. The survey of 822 business leaders was conducted between September and November 2023.“This data serves as a valuable reference point for assessing the business value derived from GenAI business model innovation,” said Sallam. “But it’s important to acknowledge the challenges in estimating that value, as benefits are very company, use case, role and workforce specific. Often, the impact may not be immediately evident and may materialize over time. However, this delay doesn’t diminish the potential benefits.”By analyzing the business value and the total costs of GenAI business model innovation, organizations can establish the direct ROI and future value impact, according to Gartner. This serves as a crucial tool for making informed investment decisions about GenAI business model innovation.“If the business outcomes meet or exceed expectations, it presents an opportunity to expand investments by scaling GenAI innovation and usage across a broader user base, or implementing it in additional business divisions,” said Sallam. “However, if they fall short, it may be necessary to explore alternative innovation scenarios. These insights help organizations strategically allocate resources and determine the most effective path forward.”","At least 30% of generative artificial intelligence projects will be abandoned after proof of concept by the end of 2025, according to research company Gartner. Many organizations are leveraging GenAI to transform their business models and create new business opportunities. But these deployment approaches come with significant costs, ranging from $5 million to $20 million.","https://static.toiimg.com/thumb/msid-112170248,imgsize-2847222,width-400,resizemode-4/112170248.jpg"
