Article Title,Article Link,Article Text,Article Summary,Article Image
"This is how Amazon plans to rival Temu, Shein",https://timesofindia.indiatimes.com/technology/tech-news/this-is-how-amazon-plans-to-rival-temu-shein/articleshow/114507660.cms,"Amazon plans to combat competition from Temu and Shein by launching a low-price online sales platform with strict price caps for merchants. The new storefront aims to attract budget-conscious shoppers by offering significantly lower-priced items, potentially shipping directly from China to reduce costs.","Amazon plans to combat competition from Temu and Shein by launching a low-price online sales platform with strict price caps for merchants. The new storefront aims to attract budget-conscious shoppers by offering significantly lower-priced items, potentially shipping directly from China to reduce costs.","https://static.toiimg.com/thumb/msid-114507655,imgsize-39394,width-400,resizemode-4/114507655.jpg"
Swiggy introduces Seal program: Here’s what it means for users and restaurant partners,https://timesofindia.indiatimes.com/technology/tech-news/swiggy-introduces-seal-program-heres-what-it-means-for-users-and-restaurant-partners/articleshow/114506108.cms,"Representational image

What is Swiggy Seal

What the company said

Online food delivering platform Swiggy has introduced a new initiative which will help in maintaining hygiene and protecting the food quality . The company has introduced the Swiggy Seal initiative across lakhs of restaurant partners on its platform. The company claims that the initiative offers restaurant partners comprehensive insights and actionable support to ensure the delivery of hygienic, well-cooked food in high-quality packaging.Through this initiative, Swiggy will share detailed, verified customer review-based feedback with restaurant partners, focusing on key areas like contamination prevention, optimal cooking, and packaging quality. These insights will empower restaurants to identify areas of improvement and implement effective hygiene practices.Additionally, Swiggy will provide support through dedicated account managers and systematic reports to assist restaurants in meeting hygiene benchmarks. Educational webinars on hygiene best practices will be a platform setup to empower restaurant partners to maintain high standards.Swiggy has teamed up with FSSAI-accredited agencies like Eurofins, Equinox, and others to offer restaurants access to professional hygiene audits at exclusive rates.Deepak Maloo, Head of Customer Experience & Restaurant Experience at Swiggy Food said, “As Swiggy completes a decade in food delivery , we continue to believe that access to clean hygienic food is as important as food that tastes great. With the launch of the Swiggy Seal, we aim to support our restaurant partners with actionable insights to help them enhance hygiene standards. The Swiggy Seal empowers customers with the confidence to order what they want, backed by genuine customer reviews , while also supporting restaurant partners to step up through collaboration with experts.”Swiggy has introduced the Swiggy Seal badge in Pune and will roll it out to other cities soon. This badge, featured on restaurant menu pages to highlight those with a proven track record of serving hygienic, high-quality meals in quality packaging.","Swiggy has introduced the Swiggy Seal initiative across lakhs of restaurant partners. The company claims that the initiative offers restaurant partners comprehensive insights and actionable support to ensure the delivery of hygienic, well-cooked food in high-quality packaging.","https://static.toiimg.com/thumb/msid-114506084,imgsize-41702,width-400,resizemode-4/114506084.jpg"
This country has banned use of WhatsApp and Google Drive in government departments,https://timesofindia.indiatimes.com/technology/tech-news/this-country-has-banned-use-of-whatsapp-and-google-drive-in-government-departments/articleshow/114505621.cms,"Representative Image



What the IT guidelines say



Reactions to the new policy

Hong Kong is reportedly barring its government employees from using popular apps like WhatsApp, WeChat and Google Drive on their work computers. According to news agency AP, the ban comes amidst potential security risks. The Hong Kong government, as per the report, has issued IT security guidelines which have many civil servants complaining about added inconvenience.For those unaware, data breaches at various Hong Kong government departments earlier this year compromised the personal information of at least tens of thousands of people, sparking concerns.Issued by Hong Kong’s Digital Policy Office, the guidelines bar government workers from using apps like WhatsApp, WeChat and Google Drive on their official laptops/PCs. However, they will still be allowed to use the services from personal devices at work. The report says that government workers can get exceptions to the ban with approval from a manager.The report quotes Sun Dong, Secretary for Innovation, Technology and Industry, who said that the ban is needed as hacking is becoming a more serious problem. He said the governments of the United States and China have also adopted stringent measures for their internal computer systems.On the contrary, Anthony Lai, director of VX Research Limited, a Hong Kong and Britain-based cybersecurity firm said the government's approach is appropriate due to low cybersecurity awareness among some staff and a lack of comprehensive internal monitoring systems. The AP report further quotes an anonymous civil servant who said her office often uses cloud storage services to exchange large files with vendors outside the government.","Hong Kong is reportedly barring its government employees from using popular apps like WhatsApp, WeChat and Google Drive on their work computers. The ban comes amidst potential security risks. Data breaches at various Hong Kong government departments earlier this year compromised the personal information of at least tens of thousands of people.","https://static.toiimg.com/thumb/msid-114505605,imgsize-2087979,width-400,resizemode-4/114505605.jpg"
Supreme Court has this 'huge setback' for Byju's,https://timesofindia.indiatimes.com/technology/tech-news/supreme-court-has-this-huge-setback-for-byjus/articleshow/114505348.cms,"What is the case all about

Edtech giant Byju’s has ‘bad news’. In a significant ruling, the Supreme Court has overturned a previous decision that halted insolvency proceedings against Byju's . The court criticised the National Company Law Appellate Tribunal ( NCLAT ) for exceeding its authority and disrupting the established insolvency process.According to a report by news agency PTI, the Supreme Court emphasised that the NCLAT should not merely “rubber-stamp” withdrawal applications, but instead adhere to the proper procedures outlined in law.“The NCLAT cannot be considered a post office that merely puts a stamp on the withdrawal application submitted by the parties to the corporate insolvency resolution process (CIRP),” said the bench of Chief Justice D Y Chandrachud, and Justices J B Pardiwala and Manoj Misra.It added that the withdrawal plea should have been moved by the IRP (insolvency resolution professional) not by the corporate debtor or other parties.“As noted above, inherent powers cannot be used to subvert legal provisions, which exhaustively provide for a procedure to permit the NCLAT to circumvent this detailed procedure by invoking its inherent powers,” it said.The court also rejected Byju's settlement with the Board of Control for Cricket in India ( BCCI ), ordering the cricket board to deposit the settlement amount with a committee of creditors.Byju's faced insolvency proceedings after defaulting on asponsorship agreement worth Rs 158 crore with the BCCI. In August, the NCLAT halted these proceedings and approved a settlement between Byju's and the BCCI.The NCLT had initiated insolvency proceedings against Byju's in July after the BCCI filed a petition alleging default on the sponsorship payment. However, Byju's challenged the order, arguing that the company was solvent and willing to pay its dues.NCLAT then decided a timeline over payment of dues. The tribunal, however, warned that any default in the payment schedule would lead to the immediate revival of the insolvency proceedings.","Byju's faced insolvency proceedings after defaulting on asponsorship agreement worth Rs 158 crore with the BCCI. In August, the NCLAT halted these proceedings and approved a settlement between Byju's and the cricket board.","https://static.toiimg.com/thumb/msid-114505257,imgsize-15942,width-400,resizemode-4/114505257.jpg"
"Arijit Singh multi-city tour across India in November: Check concert dates, cities, ticket prices, and booking details",https://timesofindia.indiatimes.com/technology/tech-news/arijit-singh-multi-city-tour-across-india-in-november-check-concert-dates-cities-ticket-prices-and-how-to-book-tickets-online/articleshow/114500785.cms,"Arijit Singh tour dates and schedule

City

Date

Bengaluru

November 30, 2024

Hyderabad

December 7, 2024

Delhi

February 2, 2025

Mumbai

March 23, 2025

Chennai

April 27, 2025



Arijit Singh concert tickets price and other details

Category

Ticket Price Range (Rs)

General

2,000 - 15,000

VIP

20,000 - 50,000

Premium

60,000 - 80,000



Arijit Singh Live in Concert: How to book tickets online

Visit the official website: Insider Arijit Singh Tour.

Choose your city and click ‘Buy Now’.

You’ll be directed to a page with event details like date, venue, and ticket prices. Click ‘Buy Now’ again.

Select your preferred seat.

Specify the number of tickets you want.

Confirm your cart details and complete the payment to secure your booking.

Arijit Singh India concert: What to expect

Also read

Arijit Singh, one of Bollywood's most iconic playback singers, is gearing up for a highly anticipated five-city concert tour across India. Starting in November 2024, the tour promises an extraordinary live experience for fans, featuring a mix of his popular tracks and fresh renditions. Singh, renowned for his soulful voice, is set to create an unforgettable atmosphere in each city, blending diverse musical styles and captivating stage designs.The concert tour will span five cities, beginning in Bengaluru and concluding in Chennai, with performances spread across several months:This multi-city tour is presented by HSBC and curated by Insider.in in collaboration with FeverLive and Hyperlink Brand Solutions.The tickets for the Bengaluru and Hyderabad concerts went on sale on October 21, 2024, with a variety of pricing options, ensuring accessibility for all fans:Tickets for the concerts in Delhi, Mumbai, and Chennai will be available soon. HSBC credit and debit cardholders benefit from a 48-hour pre-sale starting on October 21, offering a 10% discount on select tickets.Fans can expect a remarkable sensory experience, as Arijit Singh will perform a carefully curated setlist featuring his biggest hits and unique renditions. In an official statement, Singh expressed his excitement about returning to the stage, promising fresh versions of his tracks and surprises for the audience. He emphasised that almost every song in the setlist has been specially reworked to offer something new.In addition to Singh’s soulful performances, the tour will feature cutting-edge stage designs and exceptional audio quality. The innovative stage setup, which includes a ramp extending into the audience, ensures that every attendee, regardless of their seating, will enjoy a great view.","Arijit Singh is gearing up for a highly anticipated five-city concert tour across India. The tour promises an extraordinary live experience for fans, featuring a mix of his popular tracks and fresh renditions. Singh, renowned for his soulful voice, is set to create an unforgettable atmosphere in each city.","https://static.toiimg.com/thumb/msid-114504098,imgsize-49184,width-400,resizemode-4/114504098.jpg"
"Paytm can now onboard new users UPI, read NPCI's order",https://timesofindia.indiatimes.com/technology/tech-news/paytm-can-now-onboard-new-users-upi-read-npcis-order/articleshow/114504207.cms,"Stop Loss: Rs 550 Paytm recently broke out of a round bottom pattern, signaling a major trend shift on the daily chart. The stock closed above a key resistance level, confirming this new trend. The increased volume during the breakout reflects heightened market interest. The RSI is rising, aligning with the positive price movement. Additionally, the stock is trading above both the Base Line and Conversion Line, indicating an uptrend.(Kunal Kamble, Sr. Technical Research Analyst, Bonanza Portfolio)

Read the order here



Dear Vijay,

Subject: Permitting

One97 Communications

Private Limited (OCL) to onboard new users on their UPI application

We acknowledge the receipt of your letter dated 1 Aug 2024 regarding your request to grant approval for onboarding new UPI users on Paytm app, which was stopped as per RBI directions dated 31"" January 2024 and 16* February 2024.

Upon examination of your request, we hereby accord our approval and permit One97 Communications Private Limited (OCL) to onboard new users on their UPI application

Approval is subject to the following:

Adhere to and abide by all NPCI procedural guidelines and circulars issued from time to time (including guidelines and circulars issued specifically on Risk management, Brand guidelines for App and QR, Multi-bank guidelines, TPAP Market share and Customer data)

Adhere to the requirements outlined in the tri-partite agreement with NPCI and PSP Banks.

Adhere to all laws and regulatory guidelines as applicable and issued from time to time including Payments and Settlement act 2007, Information Technology Act, 2000, Digital Personal Data Protection Act, 2023 and circular on Storage of Payment System.



Your’s truly,

Dilip Asbe

Managing director and CEO, NPCI","Paytm recently broke out of a round bottom pattern, signaling a major trend shift on the daily chart. The stock closed above a key resistance level, confirming this new trend. The increased volume during the breakout reflects heightened market interest. The RSI is rising, aligning with the positive price movement.","https://static.toiimg.com/thumb/msid-114504177,imgsize-1057400,width-400,resizemode-4/114504177.jpg"
Fired EY employees slam company's 'culture of multitasking' after training course controversy,https://timesofindia.indiatimes.com/technology/tech-news/fired-ey-employees-slam-companys-culture-of-multitasking-after-training-course-controversy/articleshow/114502783.cms,"Former EY employees are speaking out against their terminations for watching multiple training courses simultaneously, highlighting what they describe as contradictions in the company's work culture .""We all work with three monitors,"" one dismissed employee told the Financial Times , noting that EY's own marketing emails had encouraged staff to ""join as many sessions as our schedule allowed"" during the company's Ignite Learning Week in May.Several terminated staff members pointed to what they saw as double standards in EY's workplace practices. One former employee revealed to the Financial Times that they knew of ""a partner who will do two client calls and switch their camera on and off depending on who he is talking to,"" questioning why such behaviour wasn't considered equally unethical.Another ex-employee criticised EY's demanding work environment, telling the Financial Times: ""If you are forced to bill 45 hours a week and do many more hours of internal work, how can it not breed a culture of multitasking ?""On Reddit, reactions to the firings were equally critical, with one user commenting they had ""dodged a bullet"" by not working at the firm. Other social media users criticised the company's strict stance on the training violations in light of what they called ""past ethical mishaps.""The terminated employees maintain they received no prior warning that attending multiple courses simultaneously was prohibited. The courses, which included topics such as ""How strong is your digital brand in the marketplace?"" and ""Conversing with AI, one prompt at a time,"" were part of requiredprofessional education credits.EY has defended its actions, describing the terminations as ""appropriate disciplinary action "" for violations of the company's global code of conduct and US learning policy. The firm has since updated its guidance for training events, explicitly requiring staff to ""be present for all content and class interactions.""The dismissed employees were not provided severance packages, according to reports.","Former EY employees were fired for watching multiple training courses simultaneously. They say they received no prior warning that attending multiple courses simultaneously was prohibited. EY has defended its actions, describing the terminations as ""appropriate disciplinary action"" The firm has since updated its guidance for training events.","https://static.toiimg.com/thumb/msid-114502765,imgsize-198622,width-400,resizemode-4/114502765.jpg"
"Bengaluru woman loses over Rs 87,000 in airport lounge scam: Here’s what happened",https://timesofindia.indiatimes.com/technology/tech-news/bengaluru-woman-loses-over-rs-87000-in-airport-lounge-scam-heres-what-happened/articleshow/114493546.cms,"Here are some safety tips to remember:



Never download apps from unknown sources.

Be wary of requests for facial recognition or unusual verification methods.

Do not share sensitive information like credit card details or OTPs with strangers.

If unsure about lounge access procedures, contact the airport authorities directly.

A woman traveling through Kempegowda International Airport in Bengaluru became the victim of an elaborate scam, losing over Rs 87,000 in a fraud scheme linked to lounge access.The woman, identified as Bhargavi Mani, shared her ordeal in a now-viral video, raising awareness about the deceptive tactics employed by scammers. Mani explained that she couldn't find her physical credit card, so she tried to enter the airport lounge by presenting a photo of the card to the staff.Instead of traditional verification methods, the lounge staff reportedly directed Ms.Mani to download a specific app and complete a facial scan for ""security purposes."" Trusting the staff, Mani downloaded the app, later identified as ""Lounge Pass."" However, she opted not to use the lounge and decided to grab coffee at Starbucks instead.Later, Mani noticed she was unable to receive phone calls, initially attributing it to network issues. However, the situation turned alarming when she realised strangers were answering her calls. Upon investigation, Ms. Mani discovered unauthorised transactions totalling over Rs 87,000 had been made on her credit card, transferred to a PhonePe account.She suspects the downloaded app was a malware program that allowed the scammers to access her phone, redirect her calls, and intercept one-time passwords (OTPs) used for online transactions. Mani has since reported the incident to the cybercrime department, alerted her bank, and blocked her credit card to prevent further losses.","Bhargavi Mani lost over Rs 87,000 in a fraud scheme linked to lounge access. Mani tried to enter the airport lounge by presenting a photo of her credit card. Instead of traditional verification methods, lounge staff reportedly directed Ms.Mani to download a specific app and complete a facial scan.","https://static.toiimg.com/thumb/msid-114493461,imgsize-31020,width-400,resizemode-4/114493461.jpg"
"India vs. New Zealand Women's ODI series: When, where to watch live streaming, full schedule, and timings",https://timesofindia.indiatimes.com/technology/tech-news/india-vs-new-zealand-womens-odi-series-when-where-to-watch-live-streaming-full-schedule-and-timings/articleshow/114493588.cms,"India vs. New Zealand Women’s ODI series: Key players and team updates



India Vs. New Zealand Women's 1st ODI series match details



Date: Thursday, October 24

Time: 1:30 PM IST

Venue: Narendra Modi Cricket Stadium, Ahmedabad

India vs. New Zealand Women's 1st ODI series : Where to watch live streaming



India vs. New Zealand Women's ODI series full schedule



Match

Date

Venue

Time (IST)

1st IND vs NZ ODI

October 24

Narendra Modi Stadium, Ahmedabad

1:30 PM

2nd IND vs NZ ODI

October 27

Narendra Modi Stadium, Ahmedabad

1:30 PM

3rd IND vs NZ ODI

October 29

Narendra Modi Stadium, Ahmedabad

1:30 PM



India's captaincy under scrutiny



India Women and New Zealand Women are gearing up for a three-match ODI series in India, just two days after the conclusion of the 2024 Women’s T20 World Cup. New Zealand enters the series with high spirits, having claimed their first-ever T20 World Cup title, while India is looking for redemption after a disappointing group-stage exit in the same tournament.This ODI series will serve as a crucial warm-up for the upcoming Women’s ODI World Cup, which India is set to host in 2025.The White Ferns, fresh off their championship victory, will be full of confidence, especially after their dominant win over India in their T20 World Cup opener. On the other hand, India will aim to turn the tables and regain momentum ahead of the major tournament next year.New Zealand has included wicketkeeper Polly Inglis, who has received her maiden call-up for the series. Additionally, batter Lauren Down is making her return to the squad following her maternity break in July, adding further strength to the team. On the Indian side, wicketkeeper Richa Ghosh will miss the series as she prepares for her class 12 board exams. Leg spinner Asha Sobhana is unavailable due to injury, and all rounder Pooja Vastrakar has been rested for the series.The India vs New Zealand Women's ODI series will be broadcast live on Sports 18, with live streaming available on the JioCinema app and website.Harmanpreet Kaur's leadership will be under the spotlight following India’s underwhelming performance in the T20 World Cup. Speculations regarding her future as captain have been circulating, with some suggesting that the Board of Control for Cricket in India (BCCI) is considering a change in leadership. However, this ODI series presents a crucial opportunity for Harmanpreet to reassert her command and guide India to a strong performance against the World Cup champions.","India Women and New Zealand Women are gearing up for a three-match ODI series in India. New Zealand enters the series with high spirits, having claimed their first-ever T20 World Cup title. India is looking for redemption after a disappointing group-stage exit in the same tournament. The series will serve as a crucial warm-up for the upcoming Women’s ODI World Cup, which India is set to host in 2025.","https://static.toiimg.com/thumb/msid-114494097,imgsize-67278,width-400,resizemode-4/114494097.jpg"
"Zomato increases platform fee by over 60% during the festive season, read the company's message to customers on the fee hike",https://timesofindia.indiatimes.com/technology/tech-news/zomato-increases-platform-fee-by-over-60-during-the-festive-season-read-the-companys-message-to-customers-on-the-fee-hike/articleshow/114493578.cms,"Representative image

What the message to Zomato customers says

Gurgaon-based food delivery giant Zomato has announced a temporary increase in its platform fee for users during the festive season. The fee has been hiked from Rs 6 to Rs 10 per order, which makes it an increase of over 60%. The information about the increase in the platform fee is popping up in the Zomato app when customers place an order.In a notification to users, Zomato explained that the fee increase is necessary to cover operational costs and maintain services during the peak festive period.“This fee helps us pay our bills to keep Zomato running. To maintain services during the festive season, it has increased slightly,” says the notification on the Zomato app.Zomato introduced the platform fee in 2023 and the company has gradually raised it over time.Rival Swiggy too followed Zomato and introduced a platform fee in 2023. Swiggy too charges a platform fee of Rs 6.50 per order. Platform fees are additional charges levied on each food order, separate from GST, restaurant charges, and delivery fees.Industry experts estimate that food delivery platforms in India handle between 2 and 2.5 million orders daily. An increase in the platform fee can significantly boost the companies' revenue.","Zomato has announced a temporary increase in its platform fee for users. The fee has been hiked from Rs 6 to Rs 10 per order, which makes it an increase of over 60%. The information about the increase in the platform fee is popping up in the Zomato app when customers place an order.","https://static.toiimg.com/thumb/msid-114493538,imgsize-904293,width-400,resizemode-4/114493538.jpg"
