Article Title,Article Link,Article Text,Article Summary,Article Image
"Google Pixel 8a launched at Rs 52,999: Price, specs, design and other details of the latest addition to 'most-affordable' Pixel phone series",https://timesofindia.indiatimes.com/technology/mobiles-tabs/google-pixel-8a-launched-at-rs-52999-price-specs-design-and-other-details-of-the-latest-addition-to-most-affordable-pixel-phone-series/articleshow/109925780.cms,"Launch and Bank offers on Google Pixel 8a

Google Pixel 8a specs

Google Pixel 8a colours and design

Google Pixel 8a camera

Three biggest AI-powered features in Google Pixel 8a camera include:

Google has launched its latest Pixel a series smartphone -- Google Pixel 8a in India. Google Pixel 8a is the latest addition to the company's A-series lineup. Pixel 'a' series is the company's affordable Pixel series. Google Pixel 8a succeeds Pixel 7a, launched in May 2023.This is the first time that Google has launched a Pixel device without a launch event.Google Pixel 'a' series devices usually launch at the company' annual developers event Google I/O. The 2024 edition of Google I/O is scheduled for May 14-16.Google Pixel 8a pre-orders start today (May 9), sales begin May 14Indian consumers can pre-order the Pixel 8a starting tonight (May 9) at 9:30 PM IST on Flipkart. Sales will officially kick off on May 14th at 6:30 AM IST. The phone starts at Rs 52,999 for the 128GB version and Rs 59,999 for the 256GB variant.* Bank offer of Rs 4,000 and 12 months no-cost EMI, available on select bank cards* Exchange bonus of Rs 9,000 on select smartphone models* Pre-order offer: Purchase Pixel Buds A-Series at Rs 999 with purchase of Pixel 8a anytime during the pre-order period.Google Pixel 8a is powered by the powerful Google Tensor G3 chip. The all-new Pixel 8a comes with Actua display, which is claimed to be 40% brighter than the Google Pixel 7a's display, ensuring excellent visibility even in bright sunlight. The phone supports 120Hz refresh rate for smoother scrolling. The Pixel 8a runs on Google Tensor G3 chip and has Titan M2 security chip for enhanced security. The phone will receive seven years of software support, including security updates and Android OS upgrades.The Pixel 8a comes in four colour options: the limited-edition Aloe and Bay, alongside classic favorites Obsidian and Porcelain. Featuring a refined design with rounded edges, a matte back, and a polished aluminum frame, the phone exudes a premium look. Google claims that Pixe 8a is the toughest A-Series phone yet.The Pixel 8a boasts of a dual rear camera system with a 64-megapixel main lens and a 13-megapixel ultrawide lens. There's 13-megapixel front-facing camera for selfies and group video calls. The Pixel 8a is packed with AI-powered tools powered by the Tensor G3 chip claiming to make your photos and videos even better.Best Take: Ensures you get the perfect group shot by choosing the best expressions for everyone.Magic Eraser: Easily removes unwanted objects or distractions from your photos with a few taps.Audio Magic Eraser: Eliminates background noise like wind or crowds, resulting in clear and crisp audio in your videos.","Google has launched its latest Pixel a series smartphone -- Google Pixel 8a in India. The phone starts at Rs 52,999 for the 128GB version and Rs 59,000 for the 256GB variant. Google claims that Pixe 8a is the toughest A-Series phone yet. It boasts of a dual rear camera system with a 64-megapixel main lens and a 13- megapixel ultrawide lens.","https://static.toiimg.com/thumb/msid-109925812,imgsize-48994,width-400,resizemode-4/109925812.jpg"
Samsung Galaxy Watch 7 may get an AI-powered health update,https://timesofindia.indiatimes.com/technology/wearables/samsung-galaxy-watch-7-may-get-an-ai-powered-health-update/articleshow/109969985.cms,"AI to convert PPG signals into ECG signals

Samsung is reportedly working on a feature that will use artificial intelligence ( AI ) to detect AFiB (Atrial Fibrillation). The South Korean tech giant has reportedly filed a patent for the same. It is likely that the feature may come with the next generation Galaxy Watch.AFiB is an irregular and often rapid heart rate that can lead to blood clots, strokes and other heart conditions.Over the years, health features have become dominant features on smart wearables, especially smartwatches. Apple introduced its ECG app in 2019 with Apple Watch Series 4 to alert users of irregular heart beats or AFiB. Samsung also allows users to record and monitor ECG (electrocardiogram) data to track heart’s rhythm and health.So then why the need for a new method?Because Samsung seems to believe that the current methods of monitoring are not necessarily accurate.The new patent filed by Samsung suggests that it aims to detect AfiB with the help of generative AI . With the help of AI, photoplethysmograph (PPG) signals will be converted into ECG signals. A PPG signal has several components including volumetric changes in arterial blood which is associated with cardiac activity. It measures the amount of light absorbed and reflected by human tissues.Meanwhile, Samsung is planning to launch a new premium smartwatch. In the financial report for Q1, 2024, the company revealed that it will launch a new premium smartwatch model which will join the Galaxy Watch 7 series.“For smartwatches, the MX Business will strive to meet demand for upgrades through the launch of new premium models,” mentions the company.Although the report didn't specify the exact release date or offer further details, it mentions that the desired upgrades requested by users will be incorporated into the higher-end models.Recent online rumours suggest that Samsung may launch three models of the upcoming Galaxy Watch 7 series. The company is expected to launch the high-end Galaxy Watch Ultra and a more affordable Galaxy Watch FE and Galaxy Watch 7.",Samsung is reportedly working on a feature that will use artificial intelligence ( AI ) to detect AFiB (Atrial Fibrillation) The South Korean tech giant has reportedly filed a patent for the same. It is likely that the feature may come with the next generation Galaxy Watch.,"https://static.toiimg.com/thumb/msid-109969986,imgsize-15722,width-400,resizemode-4/109969986.jpg"
Google Wallet comes to India: Things it can and can not do,https://timesofindia.indiatimes.com/technology/tech-news/google-wallet-comes-to-india-things-it-can-and-can-not-do/articleshow/109966735.cms,"Google Wallet in India

: What does it offer?

Save movie or event tickets on Android phones

Access boarding passes for flights

Redeem loyalty or gift cards

Use the wallet to ride public transport (in select cities)

Use your Android phone as your corporate badge

Digitize physical documents

Automatically view tickets from Gmail

Google has officially launched the Wallet app in India. Google Wallet is already available in global markets like the US.In India, Google is bringing Wallet without the payments support which means you can not use the app for paying online using your debit/credit cards or via UPI. For payments, Google already offers Google Pay in the country which is the second most used UPI app after PhonePe.Announcing the new Wallet app for India, Google said “While the Google Pay app remains your destination for all things payments, Google Wallet now brings a new level of convenience to the Android experience in India.''Do note that the app is available only on the Google Play Store. Apple iOS users will not be able to use the app on their iPhones. Google did not reveal whether and when it plans to bring an iOS app for Google Wallet.This clubbed with the fact that Google Pay remains that main platform for digital payments may not work in the app’s favor (at least for now).Now the question which arises is without payment support, what does the Google Wallet offer? Why should an Android user install another app on their phone?Google has highlighted features that will work with the Wallet app. Features offered by Google Wallet include:","Google has officially launched the Wallet app in India. Google Wallet is already available in global markets like the US. In India, Google is bringing Wallet without the payments support. This means you can not use the app for paying online using your debit/credit cards or via UPI.","https://static.toiimg.com/thumb/msid-109966793,imgsize-7194,width-400,resizemode-4/109966793.jpg"
"Google Pixel 8 available at just Rs 29,799 on Flipkart; here's how to grab the deal",https://timesofindia.indiatimes.com/technology/google-pixel-8-available-at-just-rs-29799-on-flipkart-heres-how-to-grab-the-deal/articleshow/109951760.cms,"Google Pixel 8 Flipkart bank offer and exchange deal

Google Pixel 8 specifications

Display

The Google Pixel 8 features a 6.20-inch touchscreen display with a high refresh rate of 120 Hz.

The display offers a resolution of 1080 x 2400 pixels (FHD+), ensuring sharp and vibrant visuals.

Processor and Performance

Powered by a nona-core Google Tensor G3 processor, the Google Pixel 8 delivers powerful performance.

Equipped with 8GB of RAM, enabling smooth multitasking and responsive usage.

Operating System and Battery

Runs on the latest Android 14 operating system.

Fueled by a 4575mAh non-removable battery that supports wireless charging and proprietary fast charging technology.

Camera Capabilities

The rear camera setup on the Google Pixel 8 features a dual-camera configuration, including a 50-megapixel primary camera and a 12-megapixel camera with autofocus capabilities.

For selfies, it boasts an 11-megapixel front camera, ensuring clear and detailed self-portraits.

Storage and Dimensions

Available in storage variants of 128GB and 256GB for ample space to store apps, photos, and videos.

Dimensions measure 150.50 x 70.80 x 8.90mm (height x width x thickness), with a weight of 187.00 grams.

Connectivity and Sensors

Connectivity options include Wi-Fi 802.11 a/b/g/n/ac/ax, GPS, and USB Type-C, with active 4G support on both SIM cards.

Equipped with a range of sensors, such as accelerometer, ambient light sensor, compass/magnetometer, gyroscope, proximity sensor, and in-display fingerprint sensor.

Security Features

Supports face unlock for quick and secure access to the device, enhancing user privacy and convenience.

Also read

The Google Pixel 8 , a flagship phone by Google, is priced at Rs 75,999 in India. However, customers can benefit from significant discounts through bank offers and exchange deals on Flipkart, making the purchase more budget-friendly. The Pixel 8 model with 8GB RAM and 128GB storage in Mint colour is currently available for just Rs 29,799 on Flipkart.The Pixel 8 model with 8GB RAM and 128GB storage is listed on Flipkart at Rs 75,999.With a flat 17% discount, the price of the phone is reduced to Rs 62,999. To enhance the offer, customers can avail an exchange discount of up to Rs 25,700 by trading in an old Google Pixel 7 in flawless condition. Furthermore, buyers can benefit from an additional instant discount of up to Rs 7,500 using an SBI credit card.When combining both offers, the effective price of the Pixel phone becomes Rs 29,799.","The Google Pixel 8 features a 6.20-inch touchscreen display with a high refresh rate of 120 Hz. It is powered by a nona-core Google Tensor G3 processor, enabling smooth multitasking and responsive usage. The rear camera setup features a dual-camera configuration, including a 50-megapixel primary camera and a 12- megapixel camera.","https://static.toiimg.com/thumb/msid-109958628,imgsize-30396,width-400,resizemode-4/109958628.jpg"
