Article Title,Article Link,Article Text,Article Summary,Article Image
NPCI may extend this UPI deadline and why it’s good news for Google and PhonePe,https://timesofindia.indiatimes.com/technology/tech-news/npci-may-extend-this-upi-deadline-and-why-its-good-news-for-google-and-phonepe/articleshow/109983902.cms,"Challenges in introducing incentives for UPI service providers

The National Payments Corporation of India ( NPCI ) is set to extend the deadline for implementing a 30% market share cap on companies processing payments through the Unified Payment Interface ( UPI ) by one to two years, sources familiar with the matter told Reuters.This decision is expected to benefit Google Pay and Walmart-backed PhonePe , which currently dominate the UPI payments market.UPI, India's most popular digital payment method in the country, processes over 11 billion transactions per month. PhonePe holds a 48.3% market share, followed by Google Pay at 37.4%, while their closest competitor, Paytm , has seen its share drop to 8% due to regulatory challenges.The NPCI initially planned to enforce the market share cap in January 2021 but postponed the deadline to January 1, 2025. According to sources, a final decision on the extension will be communicated closer to the deadline.The decision to extend the deadline is likely to be criticised by other players in the ecosystem, who have been urging the NPCI to follow through on its commitment. Some companies have proposed solutions, such as incentives that benefit smaller players.The NPCI and the Reserve Bank of India ( RBI ) also face challenges in introducing more incentives for UPI service providers. Unlike credit card issuers like Mastercard and Visa, which charge merchants a fee for consumer transactions, UPI essentially functions at no cost to merchants.According to the report, NPCI had hoped that Meta's instant messaging app WhatsApp, which also offers the option for UPI payments, would help break the duopoly. However, the app had only acquired 0.2% market share by April this year.The RBI held a meeting on Wednesday, per the sources, with key players in the UPI ecosystem to discuss strategies for scaling UPI infrastructure, expanding the product portfolio, addressing challenges, and brainstorming solutions to tackle these issues.An NPCI spokesperson declined to comment on all market share questions, and sources say the regulator may make changes to its plan by the end of the year.","The National Payments Corporation of India ( NPCI) is set to extend the deadline for implementing a 30% market share cap on companies processing payments through the Unified Payment Interface ( UPI ) by one to two years. This decision is expected to benefit Google Pay and PhonePe, which currently dominate the UPI payments market.","https://static.toiimg.com/thumb/msid-109983829,imgsize-1152217,width-400,resizemode-4/109983829.jpg"
Paytm to take on Ola and Uber with this new service,https://timesofindia.indiatimes.com/technology/tech-news/paytm-to-take-on-ola-and-uber-with-this-new-service/articleshow/109984606.cms,"Auto-rikshaw booking on Paytm is in testing phase

Fintech platform Paytm , owned by One 97 Communications Ltd has reportedly forayed into ride-hailing service with its new auto-rickshaw booking feature via its app through Open Network for Digital Commerce ( ONDC ).The new service aims to challenge both Ola and Uber , the two companies that currently rule the market.A person close to the development of this feature told Moneycontrol that “There is a lot of software testing and integration that goes into each rollout.There is no reason why Paytm will not also get into cab bookings like Ola and Uber as well at a later stage”.As per the report, the feature is currently in the testing phase and has gone live only for select Paytm users.The Auto-rikshaw booking feature is powered by Namma Yatri to onboard auto-rikshaw drivers on the platform and the services are currently live in Bengaluru, Chennai and the National Capital Region.The feature has been placed under the dedicated Shopping section and select users are seeing the auto rikshaw booking banner within the app. Tapping on the banner redirects users to the auto-booking interface where users can enter pickup and drop locations to book their ride.It is also important to note that the entire ONDC platform on Paytm is backed by PAI Platforms earlier known as Paym Commerce which is backed by Paytm founder and chief Vijay Shekhar Sharma.Other than the auto rikshaw booking, Paytm also facilitates several other services via ONDC, including food delivery, grocery, fashion and electronics.In other news, PaiPai, an ONDC app by PAI Platforms, accidentally got listed on Google Play Store earlier this month, however, it has now been removed.","Auto-rikshaw booking on Paytm is in testing phase and has gone live only for select users. The new service aims to challenge both Ola and Uber, the two companies that currently rule the market. The services are currently live in Bengaluru, Chennai and the National Capital Region.","https://static.toiimg.com/thumb/msid-109984606,imgsize-6574,width-400,resizemode-4/109984606.jpg"
"Dell introduces colour-coded attendance system, VPN tracking: What Red, Blue mean and more",https://timesofindia.indiatimes.com/technology/tech-news/dell-introduces-colour-coded-attendance-system-vpn-tracking-what-red-blue-mean-and-more/articleshow/109983564.cms,"Colour-coded attendance tracking: What does the colours mean

Employees fear more job losses

Dell has announced a new policy that will monitor how often its employees who split their time between the office and home actually show up to work. The company plans to use electronic badge scans , VPN log-ins, and a colour-coded system to keep tabs on employee presence in the office. However, the change, which starts on May 13, as per the Register, has upset many workers who think the rules are too strict and might lead to more people losing their jobs.Under the new policy, employees will be graded based on their presence in the office for at least 39 days per quarter, or approximately three days per week.Dell's human resources software will provide weekly updates on employees' on-site presence, accompanied by colour-coded ratings. A blue flag indicates ""consistent onsite presence,"" green signifies ""regular onsite presence,"" yellow denotes ""some onsite presence,"" and red indicates ""limited onsite presence.""A Dell spokesperson told the Times of India, ""As we've shared, team members globally in hybrid roles will be onsite at a Dell Technologies office at least 39 days per quarter (on average 3 days a week). In today's global technology revolution, we believe in-person connections paired with a flexible approach are critical to driving innovation and value differentiation.""However, the policy has been met with significant backlash from employees.One source familiar with the matter told the The Register, ""In the latest Jeff Clarke return-to-grade-school initiative, HR will be keeping an attendance report card on employees, grading them at four levels based on how well they meet the goal of being in the office 39 days a quarter. Employees who do not meet the attendance requirement will have their status escalated up the ladder to Jeff Clarke [the Chief Operating Officer], who apparently believes that being a hall monitor trumps growing revenue.""Another source described the situation as a ""shit show,"" with managers offering inconsistent guidance on the consequences of receiving red flags for limited on-site presence.This new rule follows Dell's statement in February that employees who work from home most of the time might have a harder time getting promoted and are more likely to be fired if the company needs to cut jobs.Some workers think this is a sneaky way to get rid of people, especially women, who are more likely to want to work from home. The company has laid off at least 13,000 people since the start of 2023, with some anticipating further layoffs over the summer.According to sources, approximately half of Dell's U.S. employees and two-thirds of its international workers are classified as remote. One source said, “Dell is tracking badge-ins and VPN connections to ensure employees are onsite when they claim they are (to deter 'coffee badging' or scanning your badge then going immediately home),"" another source told, noting that the company is doing this to quantity how many of the staff are choosing to remain remote after the mandate.The strict tracking of office attendance is a big change from how Dell used to handle remote work before the pandemic. One employee said, ""Even before the pandemic, they never really pushed people to be in the office. They used to say, 'Work happens wherever you make it happen.' The office was often empty a lot of the time, like after lunch or before holidays.""","Dell has announced a new policy that will monitor how often its employees who split their time between the office and home actually show up to work. The company plans to use electronic badge scans, VPN log-ins, and a colour-coded system to keep tabs on employee presence in the office. However, the change, which starts on May 13, has upset many workers who think the rules are too strict.","https://static.toiimg.com/thumb/msid-109983545,imgsize-1359259,width-400,resizemode-4/109983545.jpg"
Samsung Galaxy Watch 7 may get an AI-powered health update,https://timesofindia.indiatimes.com/technology/wearables/samsung-galaxy-watch-7-may-get-an-ai-powered-health-update/articleshow/109969985.cms,"AI to convert PPG signals into ECG signals

Samsung is reportedly working on a feature that will use artificial intelligence ( AI ) to detect AFiB (Atrial Fibrillation). The South Korean tech giant has reportedly filed a patent for the same. It is likely that the feature may come with the next generation Galaxy Watch.AFiB is an irregular and often rapid heart rate that can lead to blood clots, strokes and other heart conditions.Over the years, health features have become dominant features on smart wearables, especially smartwatches. Apple introduced its ECG app in 2019 with Apple Watch Series 4 to alert users of irregular heart beats or AFiB. Samsung also allows users to record and monitor ECG (electrocardiogram) data to track heart’s rhythm and health.So then why the need for a new method?Because Samsung seems to believe that the current methods of monitoring are not necessarily accurate.The new patent filed by Samsung suggests that it aims to detect AfiB with the help of generative AI . With the help of AI, photoplethysmograph (PPG) signals will be converted into ECG signals. A PPG signal has several components including volumetric changes in arterial blood which is associated with cardiac activity. It measures the amount of light absorbed and reflected by human tissues.Meanwhile, Samsung is planning to launch a new premium smartwatch. In the financial report for Q1, 2024, the company revealed that it will launch a new premium smartwatch model which will join the Galaxy Watch 7 series.“For smartwatches, the MX Business will strive to meet demand for upgrades through the launch of new premium models,” mentions the company.Although the report didn't specify the exact release date or offer further details, it mentions that the desired upgrades requested by users will be incorporated into the higher-end models.Recent online rumours suggest that Samsung may launch three models of the upcoming Galaxy Watch 7 series. The company is expected to launch the high-end Galaxy Watch Ultra and a more affordable Galaxy Watch FE and Galaxy Watch 7.",Samsung is reportedly working on a feature that will use artificial intelligence ( AI ) to detect AFiB (Atrial Fibrillation) The South Korean tech giant has reportedly filed a patent for the same. It is likely that the feature may come with the next generation Galaxy Watch.,"https://static.toiimg.com/thumb/msid-109969986,imgsize-15722,width-400,resizemode-4/109969986.jpg"
"Google Pixel 8 available at just Rs 29,799 on Flipkart; here's how to grab the deal",https://timesofindia.indiatimes.com/technology/google-pixel-8-available-at-just-rs-29799-on-flipkart-heres-how-to-grab-the-deal/articleshow/109951760.cms,"Google Pixel 8 Flipkart bank offer and exchange deal

Google Pixel 8 specifications

Display

The Google Pixel 8 features a 6.20-inch touchscreen display with a high refresh rate of 120 Hz.

The display offers a resolution of 1080 x 2400 pixels (FHD+), ensuring sharp and vibrant visuals.

Processor and Performance

Powered by a nona-core Google Tensor G3 processor, the Google Pixel 8 delivers powerful performance.

Equipped with 8GB of RAM, enabling smooth multitasking and responsive usage.

Operating System and Battery

Runs on the latest Android 14 operating system.

Fueled by a 4575mAh non-removable battery that supports wireless charging and proprietary fast charging technology.

Camera Capabilities

The rear camera setup on the Google Pixel 8 features a dual-camera configuration, including a 50-megapixel primary camera and a 12-megapixel camera with autofocus capabilities.

For selfies, it boasts an 11-megapixel front camera, ensuring clear and detailed self-portraits.

Storage and Dimensions

Available in storage variants of 128GB and 256GB for ample space to store apps, photos, and videos.

Dimensions measure 150.50 x 70.80 x 8.90mm (height x width x thickness), with a weight of 187.00 grams.

Connectivity and Sensors

Connectivity options include Wi-Fi 802.11 a/b/g/n/ac/ax, GPS, and USB Type-C, with active 4G support on both SIM cards.

Equipped with a range of sensors, such as accelerometer, ambient light sensor, compass/magnetometer, gyroscope, proximity sensor, and in-display fingerprint sensor.

Security Features

Supports face unlock for quick and secure access to the device, enhancing user privacy and convenience.

Also read

The Google Pixel 8 , a flagship phone by Google, is priced at Rs 75,999 in India. However, customers can benefit from significant discounts through bank offers and exchange deals on Flipkart, making the purchase more budget-friendly. The Pixel 8 model with 8GB RAM and 128GB storage in Mint colour is currently available for just Rs 29,799 on Flipkart.The Pixel 8 model with 8GB RAM and 128GB storage is listed on Flipkart at Rs 75,999.With a flat 17% discount, the price of the phone is reduced to Rs 62,999. To enhance the offer, customers can avail an exchange discount of up to Rs 25,700 by trading in an old Google Pixel 7 in flawless condition. Furthermore, buyers can benefit from an additional instant discount of up to Rs 7,500 using an SBI credit card.When combining both offers, the effective price of the Pixel phone becomes Rs 29,799.","The Google Pixel 8 features a 6.20-inch touchscreen display with a high refresh rate of 120 Hz. It is powered by a nona-core Google Tensor G3 processor, enabling smooth multitasking and responsive usage. The rear camera setup features a dual-camera configuration, including a 50-megapixel primary camera and a 12- megapixel camera.","https://static.toiimg.com/thumb/msid-109958628,imgsize-30396,width-400,resizemode-4/109958628.jpg"
