Article Title,Article Link,Article Text,Article Summary,Article Image
Apple co-founder Steve Jobs talked about AI 40 years ago: Here’s a video,https://timesofindia.indiatimes.com/technology/tech-news/apple-co-founder-steve-jobs-talked-about-ai-40-years-ago-heres-a-video/articleshow/114403621.cms,"This is what is he talks about AI

And so we’re finding the way we’ve built computers in the past isn’t working for the kinds of things we want to do in the future. And we’re examining new architectures, these fancy words like non–von Neumann machines, etcetera. And what we’re doing is we’re starting to look to the human brain. How is the human brain architected? And we’re finding that computers are very good at doing very simple things extremely accurately. And the human mind is very good at doing very complex things adequately. And there’s a ton of people now starting to look to the brain as a model of an architecture to build a computer.

The main differentiation that exists now between the two machines, and I’m going to use the word “machine” to describe the brain for a moment, is that man is self-conscious, obviously. We are conscious that we’re conscious: “I am thinking.” And to our knowledge, no computer or any even of the high primates has yet to say, “I am thinking.”

And so a tremendous amount of work is going on in the artificial intelligence community to try to understand what self-consciousness is, to try to understand if a computer can ever be self-conscious. But I think the biggest thing that motivates a lot of us is, unlike what we just heard, we don’t know. We honestly don’t know whether we are more than just a machine.

And we are building better and better computers. We’re running up against roadblocks. A lot of people are spending the best parts of their lives right now to try to understand the architecture of the brain and how we can make better and better machines to emulate it. And I actually think, by the end of our lifetimes, we’re going to know the answer to this question. And that’s what’s driving a lot of us.

While artificial intelligence as a technology may have picked up steam after the launch of ChatGPT two years ago, the concept is far from new. Apple founder Steve Jobs , a visionary in the tech world, predicted the potential of AI as far back as 40 years ago, envisioning machines that may answer questions and think like humans.On the Steve Jobs Archive , there’s footage from 1983 in which Jobs is talking to people at the International Design Conference in Aspen.The old video shows what Jobs thought about computers at that time, how books may be replaced by computers one day and the amount of work that is being done to understand the architecture of the brain to help machines emulate it.You can watch the video and a bunch of others using this link",Apple founder Steve Jobs predicted the potential of AI as far back as 40 years ago. Jobs: We don't know whether we are more than just a machine. A lot of people are spending the best parts of their lives right now to try to understand the architecture of the brain.,"https://static.toiimg.com/thumb/msid-114403376,imgsize-12858,width-400,resizemode-4/114403376.jpg"
"LTIMindtree wins its largest deal in history: We are now ..., says COO",https://timesofindia.indiatimes.com/technology/tech-news/ltimindtree-win-its-largest-deal-in-history-we-are-now-says-coo/articleshow/114404534.cms,"The strategic shift in approach

Positive but remains cautious

LTIMindtree, India's sixth-largest technology services company, is reportedly focusing on larger clients and leveraging artificial intelligence ( AI ) to secure significant market share. A company executive told Economic Times that LTIMindtree recently won its largest deal ever, a result of its AI-centric approach.Nachiket Deshpande, the company's chief operating officer, stated that AI is being integrated into all services.This strategic shift has led to a surge in large deals, including the record-breaking manufacturing contract . “We are now embedding AI into each of our service, reimagining with AI… Bulk of our large deals that we announced this quarter came because of that differentiated AI offering. This is one of our largest deals in the history of the company, that we signed with a manufacturing client,” said Deshpande in an interaction with ET.In the second quarter of fiscal year 2025, LTIMindtree secured several multi-year projects, including a $200 million deal from a U.S.-based manufacturer. Despite a slight decline in quarterly revenue , the company's large deal pipeline remains robust at over $5 billion.Deshpande explained that the AI-focused approach has enabled LTIMindtree to consolidate multiple vendors into a single provider. Additionally, the company is carefully evaluating smaller clients and may reduce its involvement if strategic improvements are not achieved.While cost reduction remains a significant driver of growth, Deshpande emphasized the company's focus on winning larger market share with existing clients.LTIMindtree, formed in 2022 from the merger of L&T Infotech and Mindtree, reported a 3.2% quarter-over-quarter revenue growth in the second quarter. Despite this positive trend, the company remains cautious about the outlook due to seasonal factors and potential macroeconomic challenges.The company's margin target of 17-18% may be delayed due to factors such as wage hikes and geopolitical tensions. Deshpande acknowledged these challenges but expressed confidence in the company's long-term growth prospects.","LTIMindtree is reportedly focusing on larger clients and leveraging artificial intelligence ( AI ) to secure significant market share. The company recently won its largest deal ever, a result of its AI-centric approach. Despite a slight decline in quarterly revenue, the company's large deal pipeline remains robust at over $5 billion.","https://static.toiimg.com/thumb/msid-114404533,imgsize-11388,width-400,resizemode-4/114404533.jpg"
"Facebook-parent Meta’s chief scientist Yann LeCun: ‘India has an important role to play, not just in…’",https://timesofindia.indiatimes.com/technology/tech-news/facebook-parent-metas-chief-scientist-yann-lecun-india-has-an-important-role-to-play-not-just-in/articleshow/114513279.cms,"Meta chief AI scientist Yann LeCun

AI is ‘going to amplify human intelligence’: Yann LeCun

Meta AI Studio arrives in India

Yann LeCun , vice president and Meta 's chief AI scientist, often referred to as one of the Godfathers of AI, discussed India’s role in the future of artificial intelligence (AI). Speaking at Meta’s first Build with AI Summit in Bengaluru, he said “India has an important role to play, not just in AI technology development for local products but also for the international market.” LeCun is on his third visit to India.He first came to Bengaluru in 2011, followed by his second visit to the country in early 2020 before the pandemic.Talking about the impact of AI on humanity, he said “AI is not going to dominate us or take over humanity, it’s going to amplify human intelligence.” LeCun said that he believes using AI assistants is like having a team of intelligent people at one’s disposal. “AI assistance might eventually be smarter than us, but we shouldn’t feel threatened by that and should feel empowered,” he said.“Open source is not just important today, it is going to become even more important in the future, where AI is going to become a common infrastructure that all of us across the world will share,” LeCun stated.At the event, the company has announced the launch of Meta AI Studio in India. Other than the US, India is one of the first countries to get access to it. The Meta AI Studio allows users to create Llama-powered AI avatars as per their liking. For example, Instagram creators can set up an AI as an extension of themselves that can quickly answer common DM questions and story replies with AI Studio.","Yann LeCun is often referred to as one of the Godfathers of AI. Speaking at Meta’s first Build with AI Summit in Bengaluru, he said ‘India has an important role to play, not just in AI technology development for local products but also for the international market’","https://static.toiimg.com/thumb/msid-114513259,imgsize-1681395,width-400,resizemode-4/114513259.jpg"
"LinkedIn fixes bug that reduced the follower count of users, read what the company has to say",https://timesofindia.indiatimes.com/technology/tech-news/linkedin-fixes-bug-that-reduced-the-follower-count-of-users-read-what-the-company-has-to-say/articleshow/114513199.cms,"Take a look at the post here



Why this issue may have affected users



LinkedIn has resolved an issue that recently caused follower counts to drop for several users. The platform experienced widespread reports of users losing hundreds of followers within a short period, sparking speculation about a purge of fake accounts . Users took to the platform to express their concern, with some speculating about a crackdown on fake or inactive accounts.While LinkedIn did not explain the cause of the problem, the Microsoft-owned professional networking platform shared a post on X to confirm that the issue had been fixed.In the X post, LinkedIn wrote: “We heard some members may have seen a change in their connection and follower count . Our team quickly looked into this. We’re happy to report this has now been resolved.”According to a report by TechCrunch, the drop in LinkedIn follower counts sparked concern among users who rely on the platform for professional networking and marketing. This concern was amplified by LinkedIn's initial silence on the matter, as the company did not immediately acknowledge the issue on its social media channels.While speculation pointed to a purge of fake accounts, the lack of official communication fueled uncertainty and anxiety among users who depend on their LinkedIn profiles for professional visibility and business development, the report suggests.For example, the Elon Musk-owned social media platform has repeatedly run purges to remove spammers, bots, and inactive accounts from its platform. Similar purges were also carried out by other social networks as well.","LinkedIn has resolved an issue that recently caused follower counts to drop for several users. The platform experienced widespread reports of users losing hundreds of followers within a short period. Users took to the platform to express their concern, with some speculating about a crackdown on fake or inactive accounts.","https://static.toiimg.com/thumb/msid-114513181,imgsize-32992,width-400,resizemode-4/114513181.jpg"
Apple may be slowing down production of its ‘most expensive product’: This is likely the reason,https://timesofindia.indiatimes.com/technology/tech-news/apple-may-be-slowing-down-production-of-its-most-expensive-product-this-is-likely-the-reason/articleshow/114512829.cms,"Apple has scaled back production of its Vision Pro mixed reality headset after meeting user demand. Reports indicate that production may cease by year-end, with manufacturing partner Luxshare winding down assembly. Apple is also prioritising a more affordable version of the headset expected by 2025, according to recent insights from CEO Tim Cook.","Production of the Vision Pro mixed reality headset may cease by year-end. Apple is also prioritising a more affordable version of the headset expected by 2025, according to recent insights from CEO Tim Cook. Reports indicate that manufacturing partner Luxshare is winding down assembly.","https://static.toiimg.com/thumb/msid-114512800,imgsize-1158858,width-400,resizemode-4/114512800.jpg"
UK minister on removing 50% of Chinese cameras from sensitive sites: “Work is pressing ahead…”,https://timesofindia.indiatimes.com/technology/tech-news/uk-minister-on-removing-50-of-chinese-cameras-from-sensitive-sites-work-is-pressing-ahead/articleshow/114512152.cms,"Representative image

What the UK minister said



“The vast majority of sensitive sites did not deploy such equipment and, of the small proportion that did, over 50% of sites have now had that equipment replaced. Work is pressing ahead to remove the remaining devices with approximately 70% of sites expected to have their surveillance equipment removed by the autumn.

The potential

national security

risks apply to specific on-board systems and therefore these risks are not exclusive to Chinese-made vehicles, or indeed only electric vehicles. The

cybersecurity

regulation sets out requirements to mitigate potential threats in vehicle construction, to monitor emerging threats and to respond to cyber-attacks.”

The UK government has removed over half of the Chinese camera maker Hikvision ’s surveillance cameras from sensitive government sites. According to a report by the UK Defence Journal, this move addresses concerns about potential security risks associated with Chinese-made technology. In a letter, a UK minister confirmed that efforts are underway to complete the removal process by April 2025.This initiative follows growing concerns about the use of Chinese technology in government buildings, particularly surveillance equipment and electric vehicles The minister notes that while a small number of sensitive sites initially deployed Hikvision equipment, over 50% have now replaced it. The remaining sites are expected to have the devices removed by autumn 2024, with complete removal targeted for April 2025. He also noted that the Cabinet Office is overseeing progress to ensure departments meet this deadline.In the letter to Lord Alton of Liverpool, UK minister Lord Coaker wrote:Apart from surveillance concerns, the UK government is also addressing potential security risks associated with connected and electric vehicles, particularly those manufactured in China. However, these risks are not exclusive to Chinese-made or electric vehicles, Coaker highlightedThe primary concern lies with specific on-board systems found in various types of connected vehicles. To mitigate these risks, the government is collaborating with national technical authorities like the National Protective Security Authority (NPSA) and the National Cyber Security Centre (NCSC) to understand and address cyber vulnerabilities.Furthermore, the UK is involved in international efforts to enhance vehicle cybersecurity. The Department for Transport also co-chairs a UN group responsible for developing international regulations on vehicle cybersecurity and software updates.",The UK government has removed over half of the Chinese camera maker Hikvision ’s surveillance cameras from sensitive government sites. A UK minister confirmed that efforts are underway to complete the removal process by April 2025. This initiative follows growing concerns about the use of Chinese technology in government buildings.,"https://static.toiimg.com/thumb/msid-114512138,imgsize-15290,width-400,resizemode-4/114512138.jpg"
"Apple CEO Tim Cook says company will ""continue to....China""",https://timesofindia.indiatimes.com/technology/tech-news/apple-ceo-tim-cook-says-company-will-continue-to-china/articleshow/114512102.cms,"Apple CEO Tim Cook recently met with China's minister Jin Zhuanglong to discuss Apple’s expansion and online data security in China. Cook emphasized Apple's commitment to the Chinese market, noting plans to increase investments and improve the supply chain.","Apple CEO Tim Cook recently met with China's minister Jin Zhuanglong to discuss Apple’s expansion and online data security in China. Cook emphasized Apple's commitment to the Chinese market, noting plans to increase investments and improve the supply chain.","https://static.toiimg.com/thumb/msid-114512092,imgsize-18014,width-400,resizemode-4/114512092.jpg"
"TSMC suspends supply to this customer after discovering its Huawei 'connection', here’s what the company said",https://timesofindia.indiatimes.com/technology/tech-news/tsmc-suspends-supply-to-this-customer-after-discovering-its-huawei-connection-heres-what-the-company-said/articleshow/114511257.cms,"Representative Image

What the company said



“TSMC is a law-abiding company, and we are committed to complying with all applicable rules and regulations, including applicable

export controls

. We proactively communicated with the US Commerce Department regarding the matter in the report. We are not aware of TSMC being the subject of any investigation at this time.”

Why Huawei getting TSMC chips is a concern for US



Taiwan Semiconductor Manufacturing Co ( TSMC ) has reportedly halted shipments to a customer. According to a report by the news agency Reuters, the chip manufacturer made this decision after discovering that chips it produced for them ended up in Huawei Technologies products, potentially violating US sanctions . The chipmaker has already notified both US and Taiwanese authorities and is conducting an investigation for the same, the report suggested citing an official (who remained anonymous) familiar with the situation.However, the report didn’t reveal whether the alleged TSMC client knowingly supplied the chips to Huawei or where it's based.Earlier this month, TSMC notified US officials of a potential violation of export restrictions after TechInsights, a tech research firm, discovered one of TSMC's chips inside a Huawei product..TSMC, a major supplier of chips to Apple and other tech giants, is prohibited from directly supplying Huawei due to US sanctions that are aimed at curbing the Chinese tech giant's access to advanced technology.In an emailed statement to Bloomberg, TSMC said:TSMC's discovery of its chips in Huawei's AI servers raises concerns about how the Chinese tech giant obtained the advancedsemiconductors despite US sanctions. Huawei, blacklisted since 2020, is barred from doing business with TSMC without a US license.While Huawei has relied on SMIC, a local partner, for chip production, questions remain about SMIC's capabilities. TSMC claims it has not supplied Huawei since 2020, but the presence of its chips in Huawei's latest products suggests potential loopholes in the sanctions.Earlier this year, another Reuters report suggested that some Chinese entities have found ways to access advanced US chips and AI technology by using cloud services offered by companies like Amazon, despite the sanctions.","Taiwan Semiconductor Manufacturing Co ( TSMC ) has reportedly halted shipments to a customer. According to a report by the news agency Reuters, the chip manufacturer made this decision after discovering that chips it produced for them ended up in Huawei Technologies products. The chipmaker has already notified both US and Taiwanese authorities and is conducting an investigation.","https://static.toiimg.com/thumb/msid-114511254,imgsize-48490,width-400,resizemode-4/114511254.jpg"
Nvidia fixes design flaw with its upcoming AI 'superchip’: What CEO Jensen Huang has to say,https://timesofindia.indiatimes.com/technology/tech-news/nvidia-fixes-design-flaw-with-its-upcoming-ai-superchip-what-ceo-jensen-huang-has-to-say/articleshow/114510720.cms,"It was 100% Nvidia's fault: Huang

Nvidia launched Blackwell AI chips earlier this year and said that these GPUs – dubbed ‘superchip’ – will be available by 2024-end. However, reports suggested that a design flaw in the units impacted its production. Company CEO Jensen Huang has now said that the flaw has been fixed.According to a report by news agency Reuters, Huang said that its longtime Taiwanese manufacturing partner TSMC helped the company fix the design flaw with its latest Blackwell AI.The flaw reportedly affected customers such as Facebook-parent Meta , Google and Microsoft .Huang said that Blackwell “had a design flaw”.“It was functional, but the design flaw caused the yield to be low. It was 100% Nvidia's fault. In order to make a Blackwell computer work, seven different types of chips were designed from scratch and had to be ramped into production at the same time,” he said.“What TSMC did, was to help us recover from that yield difficulty and resume the manufacturing of Blackwell at an incredible place,” the CEO added.Dismissing reports of tensions between Nvidia and TSMC caused by the delay in production, Huang said that those reports are “fake news”.According to Nvidia, Blackwell chips take two squares of silicon the size of the company's previous offering and bind them together into a single component that is 30 times speedier at tasks like serving up answers from chatbots.Huang is also visiting India in the coming days and recently, a report suggested that Nvidia is planning to develop an India-centric chip that will help services like Kawach system as well as help startups and businesses.",N Nvidia launched Blackwell AI chips earlier this year and said that these GPUs – dubbed ‘superchip’ – will be available by 2024-end. Reports suggested that a design flaw in the units impacted its production. Company CEO Jensen Huang has now said that the flaw has been fixed.,"https://static.toiimg.com/thumb/msid-114510672,imgsize-1112219,width-400,resizemode-4/114510672.jpg"
Apple software chief on how iPhone's generative-AI image tools are different from others,https://timesofindia.indiatimes.com/technology/tech-news/apple-software-chief-on-how-iphones-generative-ai-image-tools-are-different-from-others/articleshow/114510188.cms,"Craig Federighi from Apple explains their cautious approach to AI features, prioritizing privacy and responsibility. New tools include a Clean Up photos feature similar to Google’s Magic Eraser and enhancements to Siri, developed incrementally. Apple aims to maintain the accuracy of photographic content rather than delving into generative AI, ensuring reliability and trust.","New tools include a Clean Up photos feature similar to Google’s Magic Eraser and enhancements to Siri, developed incrementally. Apple aims to maintain the accuracy of photographic content rather than delving into generative AI, ensuring reliability and trust.","https://static.toiimg.com/thumb/msid-114510192,imgsize-1355060,width-400,resizemode-4/114510192.jpg"
ChatGPT maker OpenAI rival Anthropic announces AI model that can control your PC,https://timesofindia.indiatimes.com/technology/tech-news/chatgpt-maker-openai-rival-anthropic-announces-ai-model-that-can-control-your-pc/articleshow/114509803.cms,"Anthropic's new Claude 3.5 Sonnet model interacts with any desktop app via a 'Computer Use' API, enabling it to mimic human actions like keystrokes and mouse movements. Available in open beta, the AI automates tasks and uses standard tools, aiding developers in testing, QA, and research.","Anthropic's new Claude 3.5 Sonnet model interacts with any desktop app via a 'Computer Use' API, enabling it to mimic human actions like keystrokes and mouse movements. Available in open beta, the AI automates tasks and uses standard tools.","https://static.toiimg.com/thumb/msid-114509788,imgsize-22390,width-400,resizemode-4/114509788.jpg"
"Qualcomm CEO Cristiano Amon: ‘Over the next five years, we are going to…’",https://timesofindia.indiatimes.com/technology/tech-news/qualcomm-ceo-cristiano-amon-over-the-next-five-years-we-are-going-to/articleshow/114509234.cms,"Qualcomm announces Snapdragon 8 Elite

Qualcomm CEO Cristiano Amon said that over the next five years, everyone will own an artificial intelligence (AI)-powered smartphone. In an interview with Bloomberg Television recently, Amon said “Over the next five years, we are probably going to have — all of us — an AI smartphone,” adding that the challenge will be waiting for new use cases, similar to what happened during the transition to smartphones.As per International Data Corporation (IDC) forecast, GenAI ( Generative AI ) smartphones are expected to grow 363.6% year over year in 2024 to 234.2 million units.IDC projects that 912 million GenAI smartphones will be shipped by 2028, leading to a compound annual growth rate (CAGR) of 78.4% from 2024 to 2028.Nabila Popal, senior research director, IDC said “The rapid incorporation of GenAI in smartphones is unprecedented in mobile history with market penetration expected to exceed 60% within the first three years,” said.Qualcomm announced two Snapdragon platforms: its most powerful mobile platform – Snapdragon 8 Elite for Android mobiles and Snapdragon Cockpit and Snapdragon Ride for automobiles – at the Snapdragon Summit 2024 event in Hawaii.Qualcomm says that Snapdragon Ride supports a full spectrum of automated driving capabilities, from basic driver-assistance features to high-level autonomous systems with 360-degree sensing and precise localisation.The platform also offers scalable and customisable system-on-chip (SoC) solutions and vision products, allowing automakers and suppliers to tailor solutions to their specific needs, including parking assistance, and driver monitoring.The chip also gets the Qualcomm AI Engine to accelerate on-device machine learning and computer vision for optimal performance and efficiency.CEO Cristiano Amon said “We went from phones to cars to the PC and now industrial. “We did it all organically. We feel we have a very competitive road map.”","Qualcomm announced two Snapdragon platforms: its most powerful mobile platform – Snapdragon 8 Elite for Android mobiles and Snapdragon Cockpit and Snapdragon Ride for automobiles. CEO Cristiano Amon said “Over the next five years, we are probably going to have — all of us — an AI smartphone,” adding that the challenge will be waiting for new use cases.","https://static.toiimg.com/thumb/msid-114509227,imgsize-39132,width-400,resizemode-4/114509227.jpg"
