Article Title,Article Link,Article Text,Article Summary,Article Image
Trump heading to Jersey Shore to rally 'mega crowd' in weekend break from hush money trial,https://timesofindia.indiatimes.com/world/us/trump-heading-to-jersey-shore-to-rally-mega-crowd-in-weekend-break-from-hush-money-trial/articleshow/110044326.cms,"WILDWOOD: After a long week in court, Donald Trump is heading to the Jersey Shore . And he's being greeted by thousands of his friends.Trump, the presumptive Republican presidential nominee , drew what his team called a "" mega crowd "" of ""tens of thousands"" to a Saturday evening rally in the southern New Jersey resort town of Wildwood. It was being held 150 miles (241 kilometers) south of the New York City courthouse where he has been forced to spend most weekdays sitting silently through his felony hush money trial .The beachfront gathering, described by Rep. Jeff Van Drew, R-N.J., as the largest political gathering in state history, was designed to serve as a show of force at a critical moment for Trump, who is facing dozens of felony charges in four separate criminal cases with the election less than six months away. There is a real possibility that Trump could be a convicted felon by Election Day.Hours before he was scheduled to take the stage, thousands of Trump loyalists donning ""Never Surrender"" T-shirts and red ""Make America Great Again"" hats crowded onto the sand between the boardwalk and carnival rides to greet the former Republican president.""The everyday American people are 100% behind him,"" said Doreen O'Neill, a 62-year-old nurse from Philadelphia.""They have to cheat and smear him and humiliate him in that courtroom every single day,"" O'Neill said. ""This country is going to go insane if they steal the election again.""Trump's extraordinary legal woes, which include three other unrelated criminal cases, have emerged as a central issue in the campaign.Trump has repeatedly accused the Biden administration and Democratic officials in New York of using the legal system to block his return to the White House. Prosecutors allege the former president broke the law to conceal an affair with a porn actor that would have hurt his first presidential bid.And while Trump will almost certainly seize on his legal woes Saturday, a judge's gag order - and the threat of jail - will limit Trump's ability to comment publicly on witnesses, jurors and some others connected to the New York trial, which is expected to consume much of the month. The judge in the case already has fined Trump $9,000 for violating the order and warned that jail could follow if he doesn't comply.Trump's responsibilities as a defendant have limited his ability to win over voters on the campaign trail.He spent last week's off-day from court in the general election battlegrounds of Wisconsin and Michigan. And he was campaigning with tens of thousands of voters Saturday in New Jersey, a reliably Democratic state. Parts of New Jersey have deep-red enclaves and the southern shoreline in particular draws tourists and summer homeowners from neighboring Pennsylvania, a key swing state.President Joe Biden , meanwhile, opened his weekend with a series of fundraising events on the West Coast.He avoided Trump's legal challenges - as he has done consistently - while addressing donors in Seattle. Instead, the Democratic president focused on Trump's recent interview with Time magazine in which the Republican former president said states should be left to determine whether to prosecute women for abortions or to monitor their pregnancies.Saturday's visit to the New Jersey Shore resort wasn't Trump's first.While president, Trump held a rally there in January 2020 to thank Van Drew, the New Jersey congressman who had just left the Democratic Party for the GOP as a rebuke for the former president's first impeachment.Trump drew a crowd at the time that lined the streets, filled bars and supported numerous vendors in what is usually a sleepy city in the winter. This time, the summer season is around the corner for the resort known for its wide beaches and boardwalk games and shops.Wildwood is in New Jersey's 2nd District, which Van Drew has represented for three terms and covers all or part of six counties in southern New Jersey. It went for Trump in 2016 and again in 2020 after earlier backing Barack Obama.Trump is set to return to the courtroom next week, when key prosecution witness Michael Cohen, Trump's fixer-turned-foe, is expected to take the witness stand. Last week, he was visibly angry at times as he was forced to sit through testimony from former porn actor Stormy Daniels, who described a sexual encounter with the former president in shocking detail.Trump is charged with 34 counts of falsifying internal Trump Organization business records. The charges stem from paperwork such as invoices and checks that were deemed legal expenses in company records. Prosecutors say those payments largely were reimbursements to Cohen, Trump's attorney, who paid Daniels $130,000 to keep quiet.The prosecution could rest its case by the end of the week. It's unclear if Trump himself will take the stand when the defense presents its case.Back on the Jersey Shore, 65-year-old Pat Day said she felt some urgency to see Trump in person on Saturday.""We want to see Trump before they take him out,"" said Day, who was visiting from the Florida Keys. ""I'm worried. They're going to do everything they can so he doesn't get elected again.""","Trump is facing dozens of felony charges in four separate criminal cases with the election less than six months away. A judge's gag order - and the threat of jail - will limit Trump's ability to comment publicly on witnesses, jurors and some others connected to the New York trial.","https://static.toiimg.com/thumb/msid-110044390,imgsize-1245297,width-400,resizemode-4/110044390.jpg"
Biden says Gaza ceasefire possible 'tomorrow' if Hamas frees hostages,https://timesofindia.indiatimes.com/world/us/biden-says-gaza-ceasefire-possible-tomorrow-if-hamas-frees-hostages/articleshow/110042787.cms,"(With inputs from agencies)

NEW DELHI: US President Joe Biden has expressed optimism about the possibility of a ceasefire in the Israel-Hamas conflict, suggesting it could occur as early as ""tomorrow"" if the militant group releases its hostages. Speaking at a fundraiser outside Seattle, hosted at the residence of a former Microsoft executive, Biden addressed the issue after avoiding the topic at three similar events the previous day.""If Hamas would release the hostages, there would be a ceasefire tomorrow,"" Biden emphasized to the audience of about 100 people.He further underscored Israel's position, saying, ""Israel said it's up to Hamas, if they wanted to do it, we could end it tomorrow. And the ceasefire would begin tomorrow.""The president's remarks follow a warning issued to Israel earlier in the week, in which he threatened to halt the supply of weaponry if Israeli forces were to attack the city of Rafah in southern Gaza . Biden expressed concern over civilian casualties resulting from the use of US-supplied munitions.""We're not gonna supply the weapons and the artillery shells that have been used,"" Biden reiterated in a televised interview with CNN.Despite repeated rounds of indirect negotiations, Hamas and Israel have yet to reach a ceasefire agreement. The conflict intensified following an attack by Hamas militants on southern Israel, resulting in the abduction of approximately 250 individuals to the Gaza Strip on October 7. Israeli officials report that 128 hostages remain in Palestinian territory, with at least 36 confirmed deceased.The violence has taken a heavy toll, with an AFP tally based on official Israeli figures estimating over 1,170 deaths, primarily civilians, resulting from the Hamas attack. In response, Israel's military campaign in Gaza has led to the deaths of at least 34,971 people, predominantly women and children, according to the Hamas-run territory's health ministry.","US President Joe Biden has expressed optimism about the possibility of a ceasefire in the Israel-Hamas conflict. He suggested it could occur as early as ""tomorrow"" if the militant group releases its hostages. The president's remarks follow a warning issued to Israel earlier in the week, in which he threatened to halt the supply of weaponry.","https://static.toiimg.com/thumb/msid-110042789,imgsize-98974,width-400,resizemode-4/110042789.jpg"
US Supreme Court justice dismisses lavish gifts reports as lies,https://timesofindia.indiatimes.com/world/us/us-supreme-court-justice-dismisses-lavish-gifts-reports-as-lies/articleshow/110042684.cms,"WASHINGTON: US Supreme Court Justice Clarence Thomas , who has found himself under scrutiny over his judicial decisions and accepting lavish gifts from a billionaire Republican, is dismissing the criticism as ""nastiness"" and ""lies,"" according to US media.""There's certainly been a lot of negativity in our lives, my wife and I, over the last few years, but we choose not to focus on it,"" the New York Times quoted Thomas as saying Friday at a judicial conference in the southern US state of Alabama.Staunch conservative Thomas, the longest-serving justice on the court, has been embroiled in controversy since it emerged last year that he had gone on a trip paid for by Republican donor and real estate tycoon Harlan Crow.The justice has also faced calls to recuse himself from cases related to the 2020 election because of his wife's involvement with efforts to block Joe Biden's victory.""What you are going to find, especially in Washington, is that people are going to pride themselves on being awful,"" Thomas said, according to the Washington Post. ""It's a hideous place.""Thomas stressed that he and his wife try to ignore their critics and focus on the positive.""You don't get to prevent people from doing horrible things or saying horrible things,"" the justice was quoted as saying by the Times. ""But one, you have to understand and accept the fact that they don't, they can't change you unless you permit that.""According to a ProPublica investigation published last year, 75-year-old Thomas went on one trip to Indonesia paid for by Crow that alone was likely worth $500,000.He also joined Crow -- whose friendship with the justice the New York Times in 2011 called ""unusual and ethically sensitive"" -- for trips to an exclusive all-male wilderness resort in California and to properties in Texas and New York state over the past two decades.Crow told ProPublica that his gifts to Thomas were ""no different from the hospitality we have extended to our many other dear friends,"" and that the two had never discussed pending cases.Thomas, who was nominated for the court in 1991 after a confirmation process in which he was accused of sexual harassment by a former aide, joined the majority of judges who ruled to overturn the national right to abortion last year.He went further than his colleagues, saying the conservative-dominated court should also examine its rulings on contraception and same-sex marriage.",US Supreme Court Justice Clarence Thomas has found himself under scrutiny over his judicial decisions. Thomas has been embroiled in controversy since it emerged last year that he had gone on a trip paid for by Republican donor and real estate tycoon Harlan Crow. The justice has also faced calls to recuse himself from cases related to the 2020 election.,"https://static.toiimg.com/thumb/msid-110042685,imgsize-704350,width-400,resizemode-4/110042685.jpg"
Trump says not considering Haley as running mate,https://timesofindia.indiatimes.com/world/us/trump-says-not-considering-haley-as-running-mate/articleshow/110042532.cms,"Donald Trump said on Saturday that former Republican presidential candidate Nikki Haley was not being considered to be his running mate in the Nov election, dismissing a report by news site Axios. ""Nikki Haley is not under consideration for the VP slot, but I wish her well!"" Trump said on Truth Social.Citing people familiar with the situation, Axios had reported that Trump could pick Haley if he were convinced she could help him win the presidency, avoid a potential prison sentence and cover tens of millions in legal bills if he loses.Haley, the former South Carolina governor and a former US ambassador to the UN, ended her long-shot challenge to Republican presidential frontrunner Trump in March.Comment was not immediately available from Haley. While she has acknowledged that Trump would be the Republican nominee , Haley hasn't endorsed him. Trump is in no hurry to pick a running mate, say his advisers. He won't be formally nominated until the Republican convention in Milwaukee, Wisconsin, in July.","Haley ended her long-shot challenge to Republican presidential frontrunner Trump in March. She has acknowledged that Trump would be the Republican nominee but hasn't endorsed him. Trump is in no hurry to pick a running mate, say his advisers. He won't be formally nominated until the Republican convention in Milwaukee, Wisconsin, in July.","https://static.toiimg.com/thumb/msid-110042535,imgsize-1245297,width-400,resizemode-4/110042535.jpg"
Home setup: Michigan woman found living in grocery store sign for a year,https://timesofindia.indiatimes.com/world/us/home-setup-michigan-woman-found-living-in-grocery-store-sign-for-a-year/articleshow/110040027.cms,"NEW DELHI: A 34-year-old homeless woman was recently discovered residing inside a sign atop a Family Fare grocery store in Midland , Michigan The woman had been living in the sign for an entire year, complete with a desk, coffee maker, computer, and printer, according to Fox News.The unusual living arrangement came to light on April 23 when contractors at the store noticed an extension cord running up to the roof, where there was an electrical outlet.Officer Brennon Warren of the Midland Police Department described the situation as one that ""makes you scratch your head."" He elaborated, ""There was some flooring that was laid down. A mini desk, her clothing. A Keurig coffee maker. A printer and a computer — things you'd have in your home.""Warren expressed uncertainty about how the woman accessed the sign, which measures 5 feet wide and 8 feet high and is accessible from the store's roof through a door. He said, ""I honestly don't know how she was getting up there. She didn't indicate, either,"" noting the absence of a ladder.The police provided the woman with information about local services and she apologized before leaving the scene. Her subsequent whereabouts remain unknown. “We provided her with some information about services in the area. She apologized and continued on her way. Where she went from there, I don't know,” said officer Warren.As per the woman's statement to the police, she had been residing in the Family Fare grocery market sign while employed elsewhere.No charges have been filed against the woman, who agreed to vacate the sign. SpartanNash, the parent company of Family Fare, commended their employees for handling the situation with ""compassion and professionalism"" in a statement. They acknowledged the widespread issue of affordable housing , emphasizing the need for community partnership in finding solutions.","A 34-year-old homeless woman was recently discovered residing inside a sign atop a Family Fare grocery store in Midland, Michigan. The woman had been living in the sign for an entire year, complete with a desk, coffee maker, computer, and printer.","https://static.toiimg.com/thumb/msid-110040284,imgsize-734309,width-400,resizemode-4/110040284.jpg"
"US firm buys 747s, could turn them into ‘Doomsday’ planes'",https://timesofindia.indiatimes.com/world/us/us-firm-buys-747s-could-turn-them-into-doomsday-planes/articleshow/110038349.cms,"Sierra Nevada Corporation has acquired five Boeing 747 aircraft from Korean Air to transform them into the next generation of US Air Force 's strategic command and control planes, known colloquially as ""Doomsday"" planes. These aircraft, previously ferrying passengers across Asia, are set to become airborne nuclear command centers.The ""Doomsday"" planes, officially designated as E-4B ""Nightwatch,"" are designed to serve as command-and-control centers for the US military in scenarios such as nuclear wars, where ground facilities are compromised.The aircraft are equipped to host essential figures including the US president and the secretary of defense, allowing them to manage US forces globally from the air, a CNN report said.The transformation of these planes includes fortifying them against the effects of electromagnetic pulses, a type of energy burst from nuclear explosions that can severely damage electrical systems. According to the US Department of Homeland Security, such pulses threaten critical infrastructure on a large scale.Sierra Nevada, based in Colorado, confirmed the acquisition of the jets but declined to provide detailed comments. However, this purchase follows closely on the heels of a significant contract awarded to Sierra Nevada by the Air Force on April 26. Valued at $13 billion, this contract tasks the company with developing and producing the Survivable Airborne Operations Center by 2036, as outlined by a Defense Department announcement.""The development of this critical national security weapon system ensures the Department’s Nuclear Command, Control, and Communications capability is operationally relevant and secure for decades to come,"" said Air Force spokeswoman Ann Stefanek.The aircraft involved in this upgrade are the newer 747-800 models, which will replace the older 747-200 airframes that have been in service since the 1980s. The shift not only promises enhanced capabilities but also greater resilience for America's airborne military command structures.Korean Air's decision to sell these aircraft is part of its strategy to renew its fleet, with the transaction expected to be finalized by September 30, 2025. The airline had nine 747-800 passenger jets as of October last year.As part of its expansion and to accommodate this new project, Sierra Nevada has recently opened a large aircraft maintenance facility in Dayton, Ohio, and is in the process of building a second hangar of similar size.This move to modernize and secure the United States' airborne command capabilities marks a critical step in national defense, ensuring readiness and operational effectiveness in the face of evolving global threats.","Sierra Nevada Corporation has acquired five Boeing 747 aircraft from Korean Air to transform them into the next generation of US Air Force's strategic command and control planes. The ""Doomsday"" planes, officially designated as E-4B ""Nightwatch,"" are designed to serve as command-and-control centers for the US military.","https://static.toiimg.com/thumb/msid-110038395,imgsize-530398,width-400,resizemode-4/110038395.jpg"
From ghosts to 'orange turd': Highlights of Stormy Daniels' testimony against Trump,https://timesofindia.indiatimes.com/world/us/from-ghosts-to-orange-turd-highlights-of-stormy-daniels-testimony-against-trump/articleshow/110037726.cms,"NEW DELHI: In a public spectacle in New York City, adult film actress Stormy Daniels took the stand in Donald Trump 's criminal trial , delivering testimony that veered into unexpected and bizarre territories. Daniels, a pivotal figure due to her alleged past with Trump, faced a barrage of questions that not only dealt with the core accusations but also strayed into the realms of the paranormal and the absurd.Trump, charged with 34 felony counts related to falsifying business records to conceal hush money payments, vehemently denies the allegations , including any encounter with Daniels. As she recounted her version of events, the courtroom was gripped by her detailed narrative, so much so that Trump’s legal team twice moved for a mistrial, citing the prejudicial nature of her testimony. Both motions were denied by Judge Juan Merchan.As per a Newsweek report, during her testimony, Daniels discussed an array of topics that seemed to stretch the bounds of relevance. The defense attempted to undermine her credibility by questioning her about her paranormal show, Spooky Babes, where she explores ghostly activities. Daniels admitted to profiting from her claims of communicating with the dead, attributing some mysterious happenings at her home to a possum rather than supernatural causes.The cross-examination took another odd turn when Daniels’ “Making America Horny Again” strip club tour was brought up. This tour, playing on Trump's famous slogan, was highlighted by the defense to suggest Daniels had monetized her alleged encounter with Trump. Daniels distanced herself from the tour's name, indicating she had no control over its branding across various venues, despite acknowledging some promotional posts on her social media.Further, Daniels' use of colorful language came under scrutiny when she was confronted about a social media post referring to the flushing of an ""orange turd."" Daniels clarified that the post was hyperbolic and, although not explicitly naming Trump, she conceded under pressure that it was indeed him she was referring to.The trial, with Daniels’ testimony, has not only illuminated the legal challenges Trump faces but also showcased the unusual and sensational elements that can emerge in such high-profile cases.","Adult film actress Stormy Daniels took the stand in Donald Trump's criminal trial. The defense attempted to undermine her credibility by questioning her about her paranormal show, Spooky Babes. Daniels admitted to profiting from her claims of communicating with the dead, attributing some mysterious happenings at her home to a possum.","https://static.toiimg.com/thumb/msid-110037735,imgsize-682615,width-400,resizemode-4/110037735.jpg"
"Dozens arrested at Penn, MIT in latest US crackdowns on Gaza protests",https://timesofindia.indiatimes.com/world/us/dozens-arrested-at-penn-mit-in-latest-us-crackdowns-on-gaza-protests/articleshow/110037281.cms,"NEW DELHI: In a significant sweep across American universities, police have arrested dozens of pro-Palestinian protesters as encampments at the University of Pennsylvania , the Massachusetts Institute of Technology , and the University of Arizona were dismantled. These moves come amid a broader wave of protests that have escalated tensions on campuses nationwide.At the University of Pennsylvania, early morning operations by Philadelphia and campus police led to the dismantling of a protest camp that had been in place for over two weeks.According to university officials, 33 individuals were initially arrested, including faculty and students, with charges related to trespassing. Among the items recovered from the encampment were heavy gauge chains and bolts, which police suggested could be used as weapons.The protests, which have also spread to campuses in Europe, are part of a larger call by students for universities to sever ties with Israel and companies supporting its military efforts. This movement gains context from the ongoing conflict in Gaza, described by organizers as a genocide—a characterization that Israel vehemently denies and which the United Nations has recognized as having a “plausible risk.”In a pre-dawn operation at MIT, police encircled the protesters’ camp and, after giving a short notice, arrested ten students who chose to remain. The removal was swift, amid chants of pro-Palestinian slogans from a dispersing crowd.The scenario was even more intense at the University of Arizona, where police used tear gas against protesters the day before the school's commencement. This intervention followed incidents of property damage and assaults reported by the university, including spiked police vehicles and thrown projectiles.Responses to the protests have varied across institutions. At the University of Wisconsin-Madison, protesters agreed to dismantle their camp in exchange for dialogues with university decision-makers. Conversely, at New Mexico State University and George Washington University, responses involved arrests and continued confrontations.The recent actions have sparked a debate on the balance between safety, free expression, and the academic mission of universities, especially as commencement ceremonies approach. These developments also underscore the complex and polarized nature of global geopolitical conflicts as they manifest on university campuses.",Police arrest dozens of pro-Palestinian protesters as encampments at the University of Pennsylvania and the Massachusetts Institute of Technology are dismantled. These moves come amid a broader wave of protests that have escalated tensions on campuses nationwide. The protests are part of a larger call by students for universities to sever ties with Israel and companies supporting its military efforts.,"https://static.toiimg.com/thumb/msid-110037435,imgsize-1164211,width-400,resizemode-4/110037435.jpg"
