Article Title,Article Link,Article Text,Article Summary,Article Image
"Bangladeshi Hindus Stage Massive Protest, Demand Justice Amid Violence",https://timesofindia.indiatimes.com/world/south-asia/amid-attacks-bangladeshi-hindus-stage-biggest-street-protest-yet/articleshow/112436160.cms,"Large Crowd Forms at India-Bangladesh Border Amid Political Crisis and Escalating Tensions

DHAKA : The head of Bangladesh’s interim govt , “chief adviser” Prof Muhammad Yunus , condemned on Saturday the attacks on minority communities , calling them “heinous”. “Are they not people of this country? You have been able to save the country, can’t you save some families,” he asked as the Hindu community held its biggest street demonstration yet, seeking safety and security and calling for justice.“You must say—no one can harm them. They are my brothers; we fought together, and we will stay together,” Prof Yunus said during a session with students at Begum Rokeya University. He urged students to protect all Hindu, Christian, and Buddhist families from harm.Thousands of protesters demonstrated in major cities like Dhaka, Chattogram, Barisal, Tangail and Kurigram saying that Hindus have a right to live in Bangladesh.They blocked the Shahbagh intersection in Dhaka for the second consecutive day on Saturday to protest against attacks on homes, shops, and temples in various parts of the country following the ousting of the Sheikh Hasina-led govt.“August 2024: Save Bangladeshi Hindus. We Want Justice and Safety,” read a placard held by a young woman. Others chanted slogans like “Save the Hindus”, “Why are my temples and homes being looted? We want answers”, “Hindu persecution in independent Bangladesh, it will not continue”, “Religion is for individuals, the state is for everyone”, and “Ensure the safety of Hindus”.The Hindu minorities demonstrating in Shahbag demanded security for the Hindus and their homes, temples and businesses, the arrest of those who perpetrated violence against them, and compensation for vandalism, loot and torture.Members of minority communities in Bangladesh faced at least 205 incidents of attacks in 52 districts since the ousting of the Sheikh Hasina-led govt on Aug 5, according to two Hindu organisations — Bangladesh Hindu Buddhist Christian Unity Council and the Bangladesh Puja Udjapan Parishad — in the country. Thousands of Bangladeshi Hindus have been trying to flee to neighbouring India to escape the violence.","Thousands of protesters demonstrated in major cities like Dhaka, Chattogram, Barisal, Tangail and Kurigram. They blocked the Shahbagh intersection in Dhaka for the second consecutive day on Saturday to protest against attacks on homes, shops, and temples.","https://static.toiimg.com/thumb/msid-112436146,imgsize-105652,width-400,resizemode-4/112436146.jpg"
Royal Family: 'Meghan Markle allegedly screaming after CBS interview': Duchess of Sussex faces fresh controversy over 'meltdown' in tense TV appearance with Prince Harry,https://timesofindia.indiatimes.com/world/uk/meghan-markle-allegedly-screaming-after-cbs-interview-duchess-of-sussex-faces-fresh-controversy-over-tense-tv-appearance-with-prince-harry/articleshow/112397519.cms,"Meghan Markle is at the center of fresh controversy after a royal expert claimed she suffered a ""meltdown"" following a recent television interview with Prince Harry . The couple's joint appearance, their first since the explosive Oprah Winfrey interview, has been branded a ""car crash"" amid allegations of behind-the-scenes tension and anger, as reported by The Mirror.During a recent appearance on GB News, Royal author Angela Levin shared her take on Prince Harry and Meghan Markle's latest interview, claiming that the Duchess of Sussex was ""screaming"" and ""very annoyed"" after the cameras stopped rolling, the Mirror reported.During the CBS Sunday Morning interview, the couple intended to discuss online harm and their philanthropic endeavors. However, the conversation took an unexpected turn when Meghan was questioned about her previously disclosed suicidal thoughts, which she reportedly did not expect. Royal author Angela Levin claims that Markle was visibly upset by the line of questioning, revealing a tense atmosphere that persisted off-camera.""After the interview was over, she was apparently screaming at the producers, very, very annoyed at what they had asked her,"" Levin said on Dan Wootton's show. ""You mustn't do that with Meghan because she's in control. But you could see she couldn't contain her anger, her fury,” she added.Observers and body language experts noted a palpable sense of discomfort between the couple during the interview, according to body language expert Judi James. Harry appeared either bored or distracted, and Meghan’s icy stares seemed to convey dissatisfaction whenever he spoke. Broadcaster Dan Wootton remarked, “It certainly wasn’t a good 43rd birthday for the Duchess of Sussex, was it?”Levin further emphasized the strain in their dynamic, saying, ""Just the same as in and out of the interview, she couldn't stand Harry speaking. She would look at him with such harsh eyes and such a terrible expression on her face because she didn't want him to talk, I imagine. He is really lost at the moment... I think that he's in a very, very bad way.""The interview, which was meant to mark a fresh start in their public engagement, has instead raised questions about the couple’s relationship dynamics and their handling of media scrutiny. Branding it a “car crash,” Wootton commented on the failed attempt at damage control, noting the couple's awkward chemistry despite their united front.","Royal author Angela Levin claims that Meghan Markle was ""screaming"" and ""very annoyed"" after the CBS Sunday Morning interview. The couple's joint appearance has been branded a ""car crash"" amid allegations of behind-the-scenes tension and anger.","https://static.toiimg.com/thumb/msid-112397567,imgsize-659767,width-400,resizemode-4/112397567.jpg"
US elections: Kamala Harris and Donald Trump to face off in prime-time debate on September 10,https://timesofindia.indiatimes.com/world/us/us-elections-kamala-harris-and-donald-trump-to-face-off-in-prime-time-debate-on-september-10/articleshow/112389058.cms,"Vice President Kamala Harris and former President Donald Trump are set to meet in a highly anticipated prime-time debate on September 10, as announced by ABC News on Thursday. This 90-minute showdown, expected to be held in Philadelphia, marks a pivotal moment in an unpredictable presidential campaign that has already seen significant twists and turns.The debate will be moderated by ABC anchors David Muir and Linsey Davis. Although the exact format and ground rules are still being finalized, it is likely that the event will proceed without a live audience, according to sources familiar with the plans.Notably, Trump had proposed three debates with major networks - September 4 with Fox News, September 10 with NBC, and September 25 with ABC. However, Harris has agreed to participate only in the September 10 debate with NBC. Harris has not yet provided reasons for declining the other proposed dates.This announcement follows Trump's initial agreement to debate President Joe Biden on the same date, an arrangement made months ago. However, after Biden's unexpected withdrawal from the race, Trump questioned the validity of that commitment with Harris, leading to uncertainty over whether the debate would take place.Recent events, including Biden's exit and an assassination attempt on Trump, have drawn renewed attention to the presidential race, which had initially been shaping up as a repeat of the 2020 election. The upcoming ABC debate is expected to serve as a critical moment in the campaign's final stretch leading up to the election.Trump has also indicated his willingness to engage in additional debates with Harris, proposing events hosted by NBC News and Fox News. However, the Harris campaign has not yet agreed to these additional debates. NBC News is reportedly in discussions with both campaigns about a potential debate on September 25, but Harris has not committed to participating. Similarly, no agreement has been reached for a debate hosted by Fox News.","The debate will be moderated by ABC anchors David Muir and Linsey Davis. Although the exact format and ground rules are still being finalized, it is likely that the event will proceed without a live audience. Trump had proposed three debates with major networks - September 4 with Fox News, September 10 with NBC, and September 25 with ABC. However, Harris has agreed to participate only in the September 10 debate with NBC.","https://static.toiimg.com/thumb/msid-112389088,imgsize-120096,width-400,resizemode-4/112389088.jpg"
Trump talks about 'Iron Dome' in interview with Musk: What does it mean?,https://timesofindia.indiatimes.com/world/us/trump-talks-about-iron-dome-in-interview-with-musk-what-does-it-mean/articleshow/112481456.cms,"What is Iron Dome?

When and Why Iron Dome was constructed?

When was Iron Dome used first?

How effective is Iron Dome?

NEW DELHI: Former US president Donald Trump on Monday during his interview with tech giant Elon Musk praised Israel 's defence military system Iron Dome which can destroy short-range weapons.""Why shouldn't we have an Iron Dome? Israel has one,"" said Trump.The system which is nothing less than a shield that protects and counters rockets or mortars that are fired at Israel.It is no secret that Israel admits that the Iron Dome missile defence system has helped protect the country against rockets fired by the Hamas group from Gaza.The Israeli military states that without the Iron Dome the casualties would have been far higher during the ongoing war.Designed to protect against incoming short-range weapons Iron Dome operates in all weather conditions. The system uses radar to track rockets while differentiating between the places that are densely populated or not. The radar-guided system then launches the interceptor missiles to destroy the threats mid-air accordingly. The system is placed across Israel, and every launcher is capable of firing 20 interceptor missiles in one go.Developed after a 2006 conflict between Israel and Hezbollah, who then launched thousands of rockets into Israel causing huge damage to the country and killing dozens of citizens.In response to this later Israel developed the most successful missile system with the support of the US. The system was developed by Israeli firms Rafael Advances Defense System and Israel Aerospace Industries.The system was first put into use in 2011 combat, the system counter-attacked a missile fired from the Gaza strip by Hamas. After a successful run in 2011 US announced to buy and test some Iron Dome batteries.Israel's military says the Iron Dome defence system has a success rate of up to 90 per cent. Hamas claimed it launched 5,000 rockets on the first day of its attack, but Israel estimates the number was closer to 2,500. The rockets were fired quickly to try to overwhelm Iron Dome, and some were also launched from Lebanon by Hezbollah.Since October 7, more than 8,000 rockets have been fired at Israel, according to the Israeli Defense Forces. While Iron Dome has intercepted many rockets, some have gotten through, hitting populated areas and causing deaths and injuries.",Former US president Donald Trump praised Israel's defence military system Iron Dome which can destroy short-range weapons. The system uses radar to track rockets while differentiating between the places that are densely populated. The radar-guided system then launches the interceptor missiles to destroy the threats mid-air.,"https://static.toiimg.com/thumb/msid-112481739,imgsize-1464823,width-400,resizemode-4/112481739.jpg"
"Musk-Trump interview key points: Former US president reveals assassination attempt details, calls Biden's exit a 'coup'",https://timesofindia.indiatimes.com/world/us/musk-trump-interview-key-points-former-us-president-reveals-assassination-attempt-details-calls-bidens-exit-a-coup/articleshow/112481093.cms,"Key highlights from the interview-

Assassination attempt recounted

Criticism of Kamala Harris and Joe Biden

Immigration policy

pledge

Technical glitches and delays

In a much-anticipated return to social media , former President Donald Trump shared harrowing details of an assassination attempt and pledged the largest deportation in US history during a live interview with Elon Musk on X, the platform formerly known as Twitter. The conversation was marred by technical issues, frustrating many of Trump's supporters as the start was delayed by over 40 minutes.Trump recounted the near-fatal experience at a Pennsylvania rally, revealing how a bullet narrowly missed him.""If I had not turned my head, I would not be talking to you right now — as much as I like you,"" Trump told Musk. He attributed his survival to quick reflexes and divine intervention, emphasizing the severity of the situation by stating, ""For those people that don't believe in God, I think we all have to start thinking about that.""Musk responded by praising Trump’s bravery, saying, ""You can't fake bravery under such circumstances — the courage is instinctual or it is not."" Trump reflected on the aftermath of the incident, recalling how he wanted to reassure his supporters by standing up and showing he was unharmed. ""I wanted to get up and let them know I was okay — and they went wild,"" he said.Trump attacked President Joe Biden saying he ""failed miserably"" in the presidential debate with him. He also called Biden's exit a ""coup"" by Democrats.Trump also seized the opportunity to criticize Vice President Kamala Harris and labeled her as ""fake"", blaming her for the influx of illegal migrants. ""The number of illegals Kamala has welcomed into our communities is much bigger than we think,"" Trump asserted, accusing her of allowing criminals to enter the country.He also attacked Biden’s handling of the Ukraine crisis, claiming that Russia would not have invaded Ukraine if he were still president. Trump suggested that his strong relationship with Russian President Vladimir Putin could have prevented the conflict, saying, ""I got along with Putin very well, and he respected me.""Reiterating his hardline stance on immigration, Trump promised the largest deportation in U.S. history if re-elected. He claimed that the number of illegal migrants has surged to an estimated “50-60 million people” from regions including Africa, Asia, and the Middle East. ""They are coming in from everywhere,"" Trump said, criticizing the current administration’s handling of the situation.The interview faced significant technical difficulties, with over 878,000 users connected but unable to hear the conversation for more than 40 minutes after the scheduled start time. Musk attributed the delay to a ""massive attack"" that overwhelmed the platform's systems, adding to the frustration of Trump's supporters.","Former President Donald Trump gave a live interview to Elon Musk on X, the platform formerly known as Twitter. The conversation was marred by technical issues, frustrating many of Trump's supporters as the start was delayed by over 40 minutes. Trump recounted the near-fatal experience at a Pennsylvania rally, revealing how a bullet narrowly missed him.","https://static.toiimg.com/thumb/msid-112481135,imgsize-113066,width-400,resizemode-4/112481135.jpg"
'Simply false': US denies role in Bangladesh PM Sheikh Hasina's ouster,https://timesofindia.indiatimes.com/world/us/simply-false-us-denies-role-in-bangladesh-pm-sheikh-hasinas-ouster/articleshow/112481038.cms,"The White House has denied any involvement in the recent ousting of Bangladesh Prime Minister Sheikh Hasina , who stepped down and fled the country. Officials dismissed allegations of US interference on Monday, calling them ""simply false.""""We have had no involvement at all. Any reports or rumors that the United States government was involved in these events is simply false,"" White House spokesperson Jean-Pierre said during a press briefing when asked about the alleged US involvement.A report in the Economic Times on Sunday, stated, that Sheikh Hasina accused US of orchestrating her removal to gain control of Bangladesh's Saint Martin Island in the Bay of Bengal. According to the newspaper, Hasina allegedly communicated this claim through her close associates.Hasina's son, Sajeeb Wazed, countered these claims on X on Sunday, stating that his mother never made such allegations.""We believe that the Bangladeshi people should determine the future of the Bangladeshi government and that's where we stand,"" the White House added.An interim government in Bangladesh, led by Nobel Peace laureate Muhammad Yunus , was sworn in last Thursday with the objective of overseeing elections in the nation.Recent demonstrations and violence in Bangladesh stemmed from student protests against government job quotas favoring certain groups.These protests escalated into a broader campaign to remove Sheikh Hasina from power.Hasina had secured a fourth consecutive term in January in an election that was boycotted by the opposition and deemed not free and fair by the US State Department.Following her resignation, Hasina traveled to New Delhi, concluding her 15-year run as Bangladesh's prime minister.","The White House has denied any involvement in the recent ousting of Bangladesh Prime Minister Sheikh Hasina. Officials dismissed allegations of US interference on Monday, calling them ""simply false"" An interim government in Bangladesh, led by Nobel Peace laureate Muhammad Yunus, was sworn in last Thursday.","https://static.toiimg.com/thumb/msid-112481024,imgsize-727484,width-400,resizemode-4/112481024.jpg"
"4.4 magnitude earthquake shakes LA to San Diego: Buildings sway, items fall, but no major damage",https://timesofindia.indiatimes.com/world/us/4-4-magnitude-earthquake-shakes-la-to-san-diego-buildings-sway-items-fall-but-no-major-damage/articleshow/112479943.cms,"A 4.4 magnitude earthquake struck Southern California , creating a noticeable impact from Los Angeles to San Diego . The tremor, centered near Highland Park, shook buildings, rattled dishes, and set off car alarms, but no major injuries or damage have been reported.The quake hit at approximately 7.5 miles (12.1 kilometers) beneath the surface, with its epicenter about 6.5 miles (10.5 kilometers) northeast of LA's City Hall, according to the US Geological Survey ( USGS ).The temblor caused a pipe to burst at Pasadena's historic 1927 City Hall, resulting in water spilling from an upper floor. TV news helicopters captured the scene, showing the extent of the leak.In other areas, the quake interrupted an ESPN interview, and Disneyland in Anaheim felt the ground sway. Social media was abuzz with photos of shampoo bottles and other items strewn across the floor of a Target store in Los Angeles.Pasadena public information officer Lisa Derderian confirmed the water leak at City Hall was earthquake-related. About 200 employees safely evacuated, and one person was rescued from an elevator. There was no immediate assessment of the city's 1927 Central Library, which was closed for a seismic retrofit.Los Angeles firefighters, from all 106 stations, surveyed the city and reported no significant damage. ""The quake serves as a reminder of living in earthquake country,"" said Los Angeles County Supervisor Kathryn Barger. ""It's essential to be prepared.""The National Weather Service confirmed that no tsunami was expected, and the USGS later downgraded the quake's initial magnitude estimate from 4.6.Richard Egan, who experienced the quake while having lunch near Long Beach Airport, described it as an average event. ""It got really quiet,"" he said, ""and we waited for a bigger quake to follow.""The earthquake struck on the first day of the new school year for 540,000 students in the Los Angeles Unified School District. Superintendent Alberto M. Carvalho reported no injuries or significant damage to school facilities.This quake follows a 5.2 magnitude tremor that occurred less than a week ago, which also caused no major injuries or damage.","The quake hit at approximately 7.5 miles (12.1 kilometers) beneath the surface. The temblor caused a pipe to burst at Pasadena's historic 1927 City Hall. The quake interrupted an ESPN interview, and Disneyland in Anaheim felt the ground sway.","https://static.toiimg.com/thumb/msid-112480543,imgsize-30676,width-400,resizemode-4/112480543.jpg"
Donald Trump's interview with Elon Musk on X hit by DDoS attack,https://timesofindia.indiatimes.com/world/us/us-elections-technical-glitches-disrupt-trump-musk-livestream-on-x/articleshow/112479944.cms,"The highly anticipated online conversation between Republican presidential nominee Donald Trump and billionaire Elon Musk encountered technical difficulties just as it was about to begin on X (formerly Twitter).The platform is reportedly facing a massive Distributed Denial-of-Service (DDoS) attack, causing significant disruptions during a highly anticipated live conversation between Republican Presidential contender and the tech tycoon.Elon Musk, who owns X, acknowledged the attack and provided an update on the situation. ""There appears to be a massive DDoS attack on X. Working on shutting it down,"" Musk posted. He also noted that if the situation could not be resolved quickly, the event would proceed with a smaller audience, with the full conversation being posted online later.Scheduled to take place on the social media platform X, the event had generated significant buzz due to the high-profile nature of both figures involved. However, as the livestream was set to start, users began reporting widespread issues with accessing the event, with many unable to connect or experiencing severe lag.Neither Trump nor Musk immediately commented on the issues, leaving their supporters and critics alike in suspense.The event had been promoted as an unscripted discussion with no limitations on topics, heightening the anticipation and the subsequent disappointment over the technical problems.Ahead of his anticipated conversation with Donald Trump, Elon Musk posted on X that the platform was conducting “some system scaling tests” to accommodate the expected high volume of participants. However, the tests failed to prevent issues, leaving many Trump supporters frustrated.“Not available????? I planned my whole day around this,” conservative commentator Glenn Beck wrote on X. Billionaire hedge fund manager Bill Ackman also voiced his displeasure, saying, “Please let Elon know we can’t join.”The interview's potential to stir controversy drew a cautionary response from Europe. Thierry Breton, the European Commissioner for the Internal Market, warned Musk of the risk of “amplification of harmful content” from broadcasting the Trump interview. In a letter posted on X, Breton urged Musk to ensure that X complies with the EU’s Digital Services Act, which addresses misinformation and other issues.In response, Trump campaign spokesman Steven Cheung criticized the EU’s involvement, declaring, “The EU is an enemy of free speech and has no authority of any kind to dictate how we campaign.”Musk, who endorsed Trump two days after the former president was injured in an attempted assassination at a Pennsylvania rally last month, has shifted politically in recent years. Previously identifying as a Democrat, Musk has become increasingly aligned with right-leaning viewpoints on X, using the platform to influence political discourse globally.Musk’s controversial actions include reinstating banned accounts such as those of Alex Jones and Trump. Trump’s account was reinstated in November 2022 after Musk purchased the platform, though Trump had not actively used it until Monday. The former president preferred his Truth Social site, which he launched during his Twitter ban.Hours before the interview, Trump posted a video on his X account featuring highlights from his presidency and a campaign message asserting, “They’re not coming after me, they’re coming after you, and I just happen to be standing in their way, and I will never be moving.”Trump’s X account boasts 88 million followers, significantly more than his Truth Social following of 7.5 million. Musk’s account, which will host the interview, has over 193 million followers.The Trump campaign did not immediately respond to inquiries about cross-posting the interview on other platforms. Trump's recent X activity was limited to a photo of his mug shot from an Atlanta jail, related to charges involving attempts to overturn his election loss in Georgia.","The highly anticipated online conversation between Donald Trump and billionaire Elon Musk encountered technical difficulties just as it was about to begin on X (formerly Twitter) The platform is reportedly facing a massive Distributed Denial-of-Service (DDoS) attack, causing significant disruptions during the event.","https://static.toiimg.com/thumb/msid-112480355,imgsize-2029813,width-400,resizemode-4/112480355.jpg"
