Article Title,Article Link,Article Text,Article Summary,Article Image
Vladimir Putin: 'Leading Russia a sacred duty': Putin takes oath for record fifth presidential term,https://timesofindia.indiatimes.com/world/rest-of-world/russian-president-vladidmir-purin-officially-begins-his-fifth-term/articleshow/109914444.cms,"NEW DELHI: Vladimir Putin took oath for a new term of five years as the president of Russia in a lavish Kremlin inauguration ceremony on Tuesday. Meanwhile, his critics said that he has eliminated his political rivals, initiated a devastating conflict in Ukraine, and consolidated all power under his control.He began his fifth term in a ceremony that was boycotted by the United States and many Western countries due to Russia's war on Ukraine.Putin, who has been in office for nearly 25 years since 1999 and is the longest-serving Kremlin leader since Josef Stalin, will remain in power at least until 2030, with the option to run for another six years as per the constitution of Russia.During the inauguration ceremony, Putin told officials that leading Russia is a ""sacred duty"", and that Russia will emerge ""stronger"" after ""difficult"" period.""We will pass through this difficult period with dignity and become even stronger,"" Putin said, adding: ""We are a united and great nation, and together we will overcome all obstacles, realise everything we have planned, and together, we will win.""In a short speech, Putin also said that Russia was open to developing relations with other countries he described as ""the world's majority"".""Russia's state system must be resistant to any threats and challenges,"" he said.Russia has transformed from a nation recovering from economic collapse to a pariah state that poses a threat to global security under Putin's leadership. Following the 2022 invasion of Ukraine, which has become Europe's largest conflict since World War II, Russia has faced severe sanctions from the West and is turning to other regimes like China, Iran, and North Korea for support.The main concern now is what the 71-year-old Putin will do over the next six years, both domestically and internationally. Russian forces are making progress in Ukraine, employing scorched-earth tactics as Kyiv struggles with shortages of men and ammunition. Both sides are suffering heavy losses.Ukraine has brought the battle to Russian soil through drone and missile attacks, particularly in border regions. In a speech in February, Putin pledged to achieve Moscow 's objectives in Ukraine and do what is necessary to ""defend our sovereignty and security of our citizens.""At home, Putin's popularity is closely linked to improving the living standards of ordinary Russians. He began his term in 2018 by promising to propel Russia into the top five global economies, declaring that it should be ""modern and dynamic.""However, Russia's economy has shifted to a war footing, and authorities are spending record amounts on defense. Analysts suggest that now that Putin has secured another six years in power, the government could take unpopular measures such as raising taxes to fund the war and pressuring more men to join the military.(With inputs from agencies)","Vladimir Putin took oath for a new term of five years as the president of Russia in a lavish Kremlin inauguration ceremony on Tuesday. Putin, who has been in office for nearly 25 years since 1999 and is the longest-serving Kremlin leader since Josef Stalin, will remain in power until 2030.","https://static.toiimg.com/thumb/msid-109914489,imgsize-735913,width-400,resizemode-4/109914489.jpg"
"California rebrands, ditches ‘Dream Big’ slogan to avoid making political statement",https://timesofindia.indiatimes.com/world/us/california-rebrands-ditches-dream-big-slogan-to-avoid-making-political-statement/articleshow/109931043.cms,"Perhaps you remember the commercials: images of the glittering blue Pacific, the majestic peaks of Yosemite, storybook vineyards and ancient redwoods stretching toward the sky.For more than 10 years, tourism advertisements have painted California as a place for dreamers, a place for adventure and testing your limits by surfing, rock-climbing and skiing. The state tourism agency, Visit California , led the campaign, which invited people from around the world to "" Dream Big "" and travel to the Golden State.Not anymore.This spring, Visit California replaced ""Dream Big"" with a new campaign and a new brand for the state, as the "" Ultimate Playground ."" The scenes in the ads are much the same as before -- with the addition of the Rady Shell, San Diego's outdoor concert venue that opened in 2021 -- but there's no longer any mention of dreams.Caroline Beteta, the CEO of Visit California, said there were a number of reasons for the switch, including that branding phrases like ""Dream Big"" tend to lose power over time and that the concept of dreaming had been popping up elsewhere, in corporate advertising.Another major driver of the ""Ultimate Playground"" campaign was a more polarized political climate across the United States, which has created antipathy toward California in some parts of the country.Beteta said that the agency's consumer research confirmed that Americans increasingly see the world through a political lens, and that framing California as a place to dream about was striking some viewers as a political statement. ""Ultimate Playground"" seemed to be a safer and less charged message.The new campaign is meant to tap into pent-up demand for excitement and travel after pandemic restrictions. Visit California's research found that 43% of consumers said vacations were the only time they could really let go and play.California's tourism sector was doing well even before the new campaign. Spending by tourists rose to a record-high $150.4 billion in 2023, Gov. Gavin Newsom said over the weekend -- surpassing 2019 and suggesting that the pandemic slump has ended. The surge generated billions of dollars in tax revenue for the state and helped create 64,900 new jobs last year.","Visit California replaced ""Dream Big"" with a new campaign and a new brand for the state. The new campaign is meant to tap into pent-up demand for excitement and travel after pandemic restrictions. The agency's consumer research confirmed that Americans increasingly see the world through a political lens.","https://static.toiimg.com/thumb/msid-109931066,imgsize-948620,width-400,resizemode-4/109931066.jpg"
Judge denies mistrial request from Trump lawyer over Stormy Daniels testimony,https://timesofindia.indiatimes.com/world/us/judge-denies-mistrial-request-from-trump-lawyer-over-stormy-daniels-testimony/articleshow/109927195.cms,"(With inputs from agencies)

NEW DELHI: Judge Juan Merchan denied a motion for a mistrial in the hush money case against Donald Trump on Tuesday. The former president's defense lawyer had argued that the testimony provided by adult film actress Stormy Daniels was excessively prejudicial and warranted a mistrial.""How can we come back from this in a way that's fair to President Trump?"" Blanche said.Justice Merchan acknowledged that certain aspects of Daniels' testimony could have been omitted. He stated, ""I think the witness was a little bit difficult to control,"" but added, ""I don't think we're at the point where a mistrial is warranted.""The motion was filed following several hours of captivating testimony from Daniels, who recounted to the jury the alleged sexual encounter with Trump and the $130,000 payment she received in exchange for her silence during his 2016 presidential campaign. Daniels expressed her eagerness to collect the payment, fearing that if Trump won the election, he might not follow through with the agreement.",Judge Juan Merchan denied a motion for a mistrial in the hush money case against Donald Trump. The former president's defense lawyer had argued that the testimony provided by adult film actress Stormy Daniels was excessively prejudicial. Justice Merchan acknowledged that certain aspects of Daniels' testimony could have been omitted.,"https://static.toiimg.com/thumb/msid-109927201,imgsize-27638,width-400,resizemode-4/109927201.jpg"
Boy Scouts of America changing name to more inclusive Scouting America after years of woes,https://timesofindia.indiatimes.com/world/us/boy-scouts-of-america-changing-name-to-more-inclusive-scouting-america-after-years-of-woes/articleshow/109925804.cms,"IRVING: The Boy Scouts of America is changing its name for the first time in its 114-year history and will become Scouting America . It's a significant shift as the organization emerges from bankruptcy following a flood of sexual abuse claims and seeks to focus on inclusion .The organization steeped in tradition has made seismic changes after decades of turmoil, from finally allowing gay youth to welcoming girls throughout its ranks.With an eye on increasing flagging membership numbers, the Irving, Texas-based organization announced the name change Tuesday at its annual meeting in Florida.“In the next 100 years we want any youth in America to feel very, very welcome to come into our programs,” Roger Krone, who took over last fall as president and chief executive officer, said in an interview before the announcement.The organization began allowing gay youth in 2013 and ended a blanket ban on gay adult leaders in 2015. In 2017, it made the historic announcement that girls would be accepted as Cub Scouts as of 2018 and into the flagship Boy Scout program — renamed Scouts BSA — in 2019.There were nearly 1,000 young women in the inaugural class of female Eagle Scouts in 2021, including Selby Chipman. The all-girls troop she was a founding member of in her hometown of Oak Ridge, North Carolina, has grown from five girls to nearly 50, and she thinks the name change will encourage even more girls to realize they can join.“Girls were like: ‘You can join Boy Scouts of America?’” said Chipman, now a 20-year-old college student and assistant scoutmaster of her troop.Within days of the announcement that girls would be allowed, Bob Brady went to work. A father of two girls and a proud Eagle Scout himself, the New Jersey attorney eagerly formed an all-girls troop. At their first weekend gathering with other troops, the boys were happy to have the girls involved but some adult leaders seemed concerned, he recalled. Their worries seemed to melt away as soon as the girls led a traditional cheer around the campfire.“You could see a change in the attitude of some of the doubters who weren’t sure and they realized, wait, these kids are exactly the same, they just happen to have ponytails,” said Brady. His daughters are among the 13 girls in his troop and 6,000 girls nationwide who have achieved the vaunted Eagle Scout rank.Like other organizations, the scouts lost members during the pandemic, when participation was difficult. After a highpoint over the last decade of over 2 million members in 2018, the organization currently services just over 1 million youths, including more than 176,000 girls and young women. Membership peaked in 1972 at almost 5 million.The move by the Boy Scouts to accept girls throughout their ranks strained a bond with the Girl Scouts of the USA, which sued, saying it created marketplace confusion and damaged their recruitment efforts. They reached a settlement agreement after a judge rejected those claims, saying both groups are free to use words like “scouts” and “scouting.”While camping remains an integral activity for the Boy Scouts, the organization offers something for everyone today, from high adventures to merit badges for robotics and digital technology, Krone said: “About anything kids want to do today, they can do in a structured way within the scouting program.""The Boy Scouts’ $2.4 billion bankruptcy reorganization plan took effect last year, allowing the organization to keep operating while compensating the more than 80,000 men who say they were sexually abused as children while scouting.Angelique Minett, the first woman chairperson of Scouts BSA, gets excited about the future of scouting when she sees the about 20-person youth council from across the United States help guide the program by raising issues important to them, like sustainability, and things that they'd like to see changed, like the fit on some of the uniforms.“When we think scouts we think knots and camping, but those are a means to an end,"" Minett said. “We are actually teaching kids a much bigger thing. We are teaching them how to have grit, and we’re teaching them life skills and we’re teaching them how to be good leaders.”The organization won't officially become Scouting America until Feb. 8, 2025, the organization's 115th birthday. But Krone said he expects people will start immediately using the name.“It sends this really strong message to everyone in America that they can come to this program, they can bring their authentic self, they can be who they are and they will be welcomed here,” Krone said.","The organization began allowing gay youth in 2013 and ended a blanket ban on gay adult leaders in 2015. In 2017, it made the historic announcement that girls would be accepted as Cub Scouts as of 2018 and into the flagship Boy Scout program — renamed Scouts BSA — in 2019.","https://static.toiimg.com/thumb/msid-109925829,imgsize-1690951,width-400,resizemode-4/109925829.jpg"
'Met me in satin pants': Stormy Daniels testifies in Trump's hush money case,https://timesofindia.indiatimes.com/world/us/met-me-in-satin-pants-stormy-daniels-testifies-in-trump-case/articleshow/109925606.cms,"NEW DELHI: Stormy Daniels , a pornstar, testified in the criminal trial of former US President Donald Trump on Tuesday.She described meeting Trump at a celebrity golf tournament in 2006, where he was wearing satin pajamas when she arrived at his hotel suite, according to a Reuters report.During her testimony, Daniels recounted meeting Trump briefly at a meet and greet with adult actresses and golfers.She initially declined an invitation to join him for dinner but later changed her mind. When she arrived at his suite, Trump greeted her in satin pajamas, to which she quipped, ""Does Hugh Hefner know you stole his pajamas?"" Trump politely obliged when she asked him to change.Daniels, whose real name is Stephanie Clifford , is central to the case, which revolves around a $130,000 hush money payment made by Trump's former lawyer, Michael Cohen , to keep her quiet about an alleged sexual encounter with Trump.Justice Juan Merchan announced prior to her appearance on the stand that Daniels would be permitted to provide a straightforward account of the incident. Susan Necheles, a lawyer representing Trump, raised an objection, contending that the testimony was not directly relevant to a trial primarily focused on financial documents.In response, Prosecutor Susan Hoffinger asserted that Daniels' testimony was necessary to provide a comprehensive narrative and establish her reliability as a witness. She said, “In terms of the sexual act, it will be just very basic. It’s not going to involve descriptions of genitalia or anything of that nature.”Trump, who is running for president again in the upcoming election, has pleaded not guilty to 34 felony counts of falsifying business records. Prosecutors allege that he falsely labeled reimbursement payments to Cohen in 2017 as legal expenses to cover up an illegal scheme to influence the 2016 election by buying the silence of people with potentially damaging information.The former president also received a gag order restricting him from speaking about witnesses, jurors, and others involved in the case if his statements are meant to influence the proceedings. He has been fined $10,000 for violating the order and could face jail time if he continues his attacks.This case is one of four criminal prosecutions Trump currently faces, but it is the only one certain to go to trial before the election. The other cases involve charges of trying to overturn his 2020 presidential defeat and mishandling classified documents after leaving office. Trump has pleaded not guilty to all three.","Stormy Daniels, a pornstar, testified in the criminal trial of former US President Donald Trump on Tuesday. She described meeting Trump at a celebrity golf tournament in 2006, where he was wearing satin pajamas when she arrived at his hotel suite. Trump has pleaded not guilty to 34 felony counts of falsifying business records.","https://static.toiimg.com/thumb/msid-109925707,imgsize-1239504,width-400,resizemode-4/109925707.jpg"
Stormy Daniels called to witness stand at Donald Trump's hush money trial,https://timesofindia.indiatimes.com/world/us/stormy-daniels-called-to-witness-stand-at-donald-trumps-hush-money-trial/articleshow/109924809.cms,"THIS Japanese diet practice can help in weight loss (Try it)

Lifestyle","summarize: THIS Japanese diet practice can help in weight loss. (Try it) Read more about how to lose weight in Japan on CNN.com's special special edition, ""Weight Loss in Japan,"" on Friday, September 14.","https://static.toiimg.com/thumb/msid-109924825,imgsize-1239504,width-400,resizemode-4/109924825.jpg"
Stormy Daniels is expected to appear at Trump's hush money trial on Tuesday,https://timesofindia.indiatimes.com/world/us/stormy-daniels-is-expected-to-appear-at-trumps-hush-money-trial-on-tuesday/articleshow/109922795.cms,Former President Donald Trump is facing a hush money trial with potential jail time for violating gag orders. The trial involves payments made to porn actor Stormy Daniels to keep quiet about an alleged affair with Trump during his 2016 presidential campaign. Trump has been fined multiple times for violating the gag order and criticized the jury selection process.,Former President Donald Trump is facing a hush money trial with potential jail time for violating gag orders. The trial involves payments made to porn actor Stormy Daniels to keep quiet about an alleged affair with Trump. Trump has been fined multiple times for violating the gag order and criticized the jury selection process.,"https://static.toiimg.com/thumb/msid-109922902,imgsize-1239504,width-400,resizemode-4/109922902.jpg"
New Russian space weapon raises alarm in US,https://timesofindia.indiatimes.com/world/us/new-russian-space-weapon-raises-alarm-in-us/articleshow/109919862.cms,"NEW DELHI: US officials have expressed grave concerns about Russia 's development of a new nuclear anti-satellite (ASAT) weapon, which could potentially transform Low-Earth Orbit (LEO) into a perilous battleground. The discussions about this emerging threat were highlighted by Mallory Stewart, the US assistant secretary of state for arms control, and John Plumb, the assistant secretary of defense for space policy, underscoring the serious implications of such developments.The ASAT weapon in question, allegedly already tested by Russia in high radiation orbits under the guise of electronic testing, diverges from typical scientific satellite protocols. This weapon is designed to disrupt a wide array of satellite operations spanning civilian, commercial, and military sectors by detonating in LEO, which extends approximately 100 to 1200 miles above the Earth, a report in Asia Times said.While there is no immediate deployment, the indiscriminate nature of such a weapon could severely damage satellites and impair critical global services including communication, weather forecasting, and security operations. The US officials emphasized the widespread implications of deploying such technology, noting its potential to make LEO unusable for any satellite operations.The concept of using nuclear weapons in ASAT roles isn't new and harks back to Cold War anxieties. Historical precedents like the US's Project 437 during the Kennedy administration, which was later abandoned due to its potential to damage both enemy and US satellites and infrastructure indiscriminately, illustrate the complexities and risks associated with such weapons.Recent simulations, such as those conducted by Chinese military scientists, have explored the effects of a nuclear detonation at altitude on satellite functionality. These studies show that while a high-altitude nuclear explosion would not create a traditional explosive cloud due to the absence of air, it would generate a belt of high-energy particles trapped by Earth’s magnetic field, posing a significant risk to spacecraft.In response to the decisive role satellite constellations like Elon Musk’s Starlink have played in modern warfare, evidenced by their utility in the ongoing Ukraine conflict, both Russia and China have hinted at developing ASAT capabilities to counter these systems. Reports suggest that these nations view the neutralization of such satellite networks as crucial to diminishing their adversaries' operational effectiveness.US and allied commercial satellites, including those like Starlink which have been pivotal in supporting Ukraine, have been identified by Russian officials as potential targets in the event of escalating hostilities. This stance highlights the broader strategy of using space capabilities as a means of asserting dominance and the potential shift towards militarization of space, despite international treaties like the 1967 Outer Space Treaty, which seeks to bar such activities.The development and potential deployment of nuclear ASAT weapons pose not only a technological or tactical challenge but also a diplomatic and strategic one, threatening the fabric of international space law and the peaceful use of outer space.",US officials have expressed grave concerns about Russia's development of a new nuclear anti-satellite weapon. The weapon could potentially transform Low-Earth Orbit (LEO) into a perilous battleground. The indiscriminate nature of such a weapon could severely damage satellites and impair critical global services.,"https://static.toiimg.com/thumb/msid-109920045,imgsize-22460,width-400,resizemode-4/109920045.jpg"
"'Suicidal': Can China take on US, Japan navies with Fujian?",https://timesofindia.indiatimes.com/world/us/suicidal-can-china-take-on-us-japan-navies-with-fujian/articleshow/109919659.cms,"NEW DELHI: The launch of China's newest aircraft carrier, the Fujian , has ignited discussions on the balance of naval power in Asia, with security analysts emphasizing the potential implications for regional dynamics, particularly affecting the Philippines . This development comes at a time of heightened military activities in the contentious South China Sea .Rommel Banlaoi, director of the Philippine Institute for Peace, Violence and Terrorism Research, described the Fujian's deployment as a dual-edged sword. ""The sailing of China’s third aircraft carrier signals to all parties in the South China Sea that Beijing is prepared for battle,” Banlaoi told the South China Morning Post, suggesting that while the carrier could pose a threat, it might also contribute to regional stability under certain conditions.The Fujian, a Type 003 class vessel boasting 80,000 tonnes, marks a significant upgrade from China's other carriers, featuring electromagnetic catapults capable of launching more frequent sorties. This technological advancement comes as China aims to expand its blue-water navy to six aircraft carriers by 2035, positioning itself as a formidable naval power behind only the United States.The regional tension is further complicated by recent aggressive maneuvers, including an incident where the Chinese coastguard used water cannons against Philippine vessels near Scarborough Shoal. This action underlines the ongoing disputes and the volatile situation in the area, the SCMP report said.Despite this, Banlaoi emphasized the need for diplomatic engagement to de-escalate tensions. ""The situation in the waterways is becoming more worrisome now because all parties are increasing their military activities. And that is not good for regional peace and stability. What we need now is to de-escalate the current tensions in the South China Sea and conduct more diplomacy,” he said.While the Philippines and its allies, notably the United States and Japan, strengthen their military cooperation through exercises and strategic bases, analysts remain cautious. Jose Antonio Custodio noted the overwhelming power of combined US and Japanese naval forces and dismissed the idea of a direct challenge by China as ""suicidal."" He metaphorically described the regional military alignment as “the Japanese anvil for an American hammer” aimed at containing Chinese maritime ambitions.The strategic posturing in the South China Sea continues to draw international attention, with potential implications for regional security and the balance of power in Asia.","The launch of China's newest aircraft carrier, the Fujian, has ignited discussions on the balance of naval power in Asia. Security analysts emphasize the potential implications for regional dynamics, particularly affecting the Philippines. This development comes at a time of heightened military activities in the contentious South China Sea.","https://static.toiimg.com/thumb/msid-109919634,imgsize-688939,width-400,resizemode-4/109919634.jpg"
