Article Title,Article Link,Article Text,Article Summary,Article Image
Stormy Daniels says Trump should be jailed after conviction,https://timesofindia.indiatimes.com/world/us/stormy-daniels-says-trump-should-be-jailed-after-conviction/articleshow/110649410.cms,"'Intimidating'

'Vicious' atmosphere

LONDON: Stormy Daniels , the adult film actor, broke her silence after former US president Donald Trump 's conviction to say he should be jailed, in an interview published in British tabloid The Mirror at the weekend.""I think he should be sentenced to jail and some community service working for the less fortunate, or being the volunteer punching bag at a women's shelter,"" Daniels said in the interview, published late on Saturday.A jury of 12 New Yorkers on Thursday found Trump guilty on 34 counts of business fraud for trying to cover up hush money payments to Daniels on the eve of the 2016 presidential election .Daniels, whose real name is Stephanie Clifford, was paid $130,000 to keep silent and prevent scandal from breaking ahead of the election, in which Trump narrowly defeated Hillary Clinton After years of exchanging insults with Trump on social media, Daniels now says she finally has been ""vindicated"", although she was ""shocked"" at how quickly the jury made a decision -- one that made Trump the first ever former US president to be convicted of a crime.Daniels also accused the White House hopeful of being ""completely and utterly out of touch with reality"" and compared him to a child at one point in the interview.The former adult film actor and director helped bring Trump down in court with her gripping testimony, which included graphic descriptions of what she says was a casual sexual encounter in 2006.""Being in court was so intimidating with the jurors looking at you,"" she said in the Mirror interview, adding that she was glad it was proved that she had been ""telling the truth the entire time"".""It's not over for me. It's never going to be over for me. Trump may be guilty, but I still have to live with the legacy.""The 45-year-old had remained uncharacteristically quiet in the days following the Thursday conviction.Daniels's husband Barrett Blade had previously told CNN that she was ""still processing"" the trial. He suggested that she could be threatened by Trump 's supporters.""You know, all the MAGA idiots are going to be coming after her,"" Blade said, referring to Trump's Make America Great Again movement.Daniels also said she would never escape death threats from Trump's supporters, the Mirror reported.""It's so vicious and threatening... from the standpoint of just the fear of what somebody might do,"" Daniels's lawyer Clark Brewster said of the atmosphere around the trial in an interview with a local ABC News channel.Daniels is a self-made woman who rose from a difficult childhood and through the challenging world of adult movies to become a successful businesswoman.But in a recent documentary, she revealed that behind her outwardly tough, humorous persona on social media, she has been hurt by the constant insults from Trump and his supporters.""Back in 2018 that was stuff like 'liar', 'slut', 'gold digger',"" she said in the film, ""Stormy"".""This time around, it is very different. It is direct threats, it is, 'I'm going to come to your house and slit your throat', 'your daughter should be euthanised'.""The trial and its revelations have added to tensions in the already bitterly divided country.On Friday, Trump launched into a stream of insults and non-factual claims, lashing out that the trial and the judge who presided over it.His campaign on Friday said that it had raised nearly $53 million in online donations after the conviction, boasting that the verdict had boosted his support ""like never before"".Trump is due for sentencing on July 11 but is expected to appeal the verdict. He potentially faces a prison sentence but is much more likely to receive probation.","Stormy Daniels says former US president Donald Trump should be jailed. Daniels says she has been ""vindicated"" by her testimony against Trump. Trump was found guilty on 34 counts of business fraud on Thursday. Daniels was paid $130,000 to keep silent about an alleged affair with Trump in 2006.","https://static.toiimg.com/thumb/msid-110649443,imgsize-1141630,width-400,resizemode-4/110649443.jpg"
Rupert Murdoch ties the knot for the 5th time in ceremony at his California vineyard,https://timesofindia.indiatimes.com/world/us/rupert-murdoch-ties-the-knot-for-the-5th-time-in-ceremony-at-his-california-vineyard/articleshow/110649274.cms,"NEW YORK: Media magnate Rupert Murdoch , 93, has married for the fifth time, his corporation, News Corp , confirmed Sunday.Murdoch and Elena Zhukova , a 67-year-old Russian-born retired molecular biologist , wed Saturday in a ceremony at his vineyard estate in Bel Air , California. Photographs of the newly married couple were released by News Corp. The couple announced their engagement in March.Murdoch was most recently married to model and actor Jerry Hall. They were wed in 2016 and divorced in 2022.Zhukova is the ex-wife of Alexander Zhukov, a billionaire energy investor and Russian politician. Their daughter, Dasha, was previously married to Russian billionaire Roman Abramovich, who used to own the Premier League soccer club Chelsea.Last fall, Murdoch stepped down as leader of both Fox News’ parent company and his News Corp media holdings. His son, Lachlan , took his place in a media empire that spans continents and helped to shape modern American politics.In 1952, Murdoch inherited a newspaper in his native Australia from his father. Over decades, he built a news and entertainment enterprise that became prominent in the United States and Britain, including ownership of such notable newspapers as The Times of London and The Wall Street Journal.Fox News Channel, the 24-hour network founded in 1996, has profoundly influenced television, becoming a popular news source among many conservative U.S. audiences and politicians.","Murdoch and Elena Zhukova, a 67-year-old Russian-born retired molecular biologist, wed Saturday in a ceremony at his vineyard estate in Bel Air, California. The couple announced their engagement in March. Murdoch was most recently married to model and actor Jerry Hall.","https://static.toiimg.com/thumb/msid-110649294,imgsize-1199154,width-400,resizemode-4/110649294.jpg"
Deadly shooting leaves one dead and 24 injured in Ohio,https://timesofindia.indiatimes.com/world/us/deadly-shooting-leaves-one-dead-and-24-injured-in-ohio/articleshow/110645376.cms,"Image, courtesy of News 5 Cleveland, shows officers of the Akron Police Department investigating a shooting that happened overnight in Akron, Ohio (AP photo)

A shooting incident occurred on a street in Akron , Ohio , in the early hours of Sunday morning, resulting in the death of one and injuries to 24 others.

Police received reports of gunshots just after midnight, and multiple victims were reported to have been struck by the gunfire. Shortly after, local hospitals informed emergency dispatchers that people were arriving at their emergency departments with gunshot wounds.

According to Capt. Michael Miller, an Akron police public information officer, the total number of victims was 25, including the deceased. Miller provided an update on Sunday afternoon, stating that at least two of the wounded victims remained in critical condition, while the injuries sustained by the others were not considered life-threatening.

As of now, no arrests have been made in connection with the shooting. The police have stated that the investigation is still in its early stages and have appealed to anyone with information to contact the detectives working on the case. Witnesses at the scene told WEWS-TV that ""hundreds of people were enjoying themselves with everyone in white T-shirts and 'women on top of vehicles dancing'"" before the gunfire erupted.

The station also reported that officers discovered numerous bullet casings and one firearm at the scene.

(With inputs from AP)

","A shooting incident occurred on a street in Akron, Ohio, in the early hours of Sunday morning. Police received reports of gunshots just after midnight, and multiple victims were reported to have been struck by the gunfire. Witnesses at the scene said ""hundreds of people were enjoying themselves with everyone in white T-shirts and 'women on top of vehicles dancing'"" before the gunfire erupted.","https://static.toiimg.com/thumb/msid-110645438,imgsize-1295744,width-400,resizemode-4/110645438.jpg"
Oil producers led by Saudis extended supply cuts amid slack prices,https://timesofindia.indiatimes.com/world/us/oil-producers-led-by-saudis-extended-supply-cuts-amid-slack-prices/articleshow/110644871.cms,"FRANKFURT: Saudi Arabia and allied oil producing countries on Sunday extended output cuts through next year, a move aimed at supporting slack prices that haven't risen even amid turmoil in the middle east and the start of the summer travel season.The Opec+ alliance, made up of members of the producers cartel and allied countries including Russia, extended three different sets of cuts totaling 5.8 million barrels a day.International benchmark Brent has loitered in the $81-$83 per barrel range for the past month. Even the war in Gaza and attacks on shipping in the Red Sea by Houthi rebels in Yemen have not pushed prices up toward the $100 per barrel level last seen in September 2022. Reasons include higher interest rates, concerns about demand due to slower than desired economic growth in Europe and China, and rising non-Opec supply including from US shale producers,Yet the Saudis need higher oil prices to fund ambitious plans by Crown Prince Mohammed bin Salman to diversify the country's economy away from fossil fuel exports. Higher oil prices would also help Russia maintain economic growth and stability as it spends heavily on its war against Ukraine.Analysts say the cuts could push oil prices higher in coming months, but much depends on demand for oil going forward. The summer usually sees a spike in demand through the July-September quarter, but uncertainty about demand grows after that.US motorists have benefitted from weaker oil prices. Gasoline prices have been quiescent recently, averaging $3.56 per gallon last week, a penny less than a year ago. That is down from a record national average high of $5 per gallon in June 2022. US prices can vary by region and Western states have been paying more, with gas hitting an average $5.05 per gallon in California.US gas prices rise along with crude because the price of oil makes up half the cost of a gallon of gasoline. The price swings are much smaller in Europe because there taxes make up a bigger proportion of the price of fuel.The cuts that are being extended break down as follows: 2 billion barrels a day agreed among all 23 Opec+ members were extended through the end of 2025, according to an Opec statement.Then, voluntary reductions of 1.65 million barrels a day by a smaller group of members was extended until end 2025 as well, according to a report on the official Saudi Press Agency.And another 2.2 million barrels a day in voluntary cuts, due to expire at the end of this month, were extended until September but would then be gradually reduced month by month until they are eliminated by September 2025.","International benchmark Brent has loitered in the $81-$83 per barrel range for the past month. Even the war in Gaza and attacks on shipping in the Red Sea by Houthi rebels in Yemen have not pushed prices up. Reasons include higher interest rates, concerns about demand due to slower than desired economic growth in Europe and China.","https://static.toiimg.com/thumb/msid-110644865,imgsize-1012568,width-400,resizemode-4/110644865.jpg"
"Pakistan HC acquits Imran, Qureshi in state secrets leak case",https://timesofindia.indiatimes.com/world/pakistan/pakistan-hc-acquits-imran-qureshi-in-state-secrets-leak-case/articleshow/110676116.cms,"ISLAMABAD: A Pakistani high court acquitted Monday former PM Imran Khan and ex-foreign minister Shah Mehmood Qureshi , who were serving 10-year sentences after being convicted of leaking state secrets, known as the cipher case. An Islamabad HC division bench, comprising justices Aamer Farooq and Miangul Hassan Aurangzeb, delivered a short verdict, accepting their appeals against the convictions.“The state had badly failed in proving its case and even its prosecutors had abandoned the case. Hats off to the honourable judges. It was a case of first impression. Imran and Qureshi did not do any anti-state activity,” remarked Imran’s counsel Salman Safdar following the verdict.Despite the acquittal, Khan will remain imprisoned to serve his sentence in the “iddat” case, related to his alleged unlawful marriage to Bushra Bibi, his third wife. Both are serving seven-year jail terms after a trial court ruled that their 2018 marriage broke the law by not completing the waiting period mandated by Islam, called “Iddat”, after Bibi divorced her previous husband.Qureshi remains on physical remand until June 5, accused of inciting violence on May 9 last year when Pakistan Tehreek-i-Insaf (PTI) supporters stormed military and civilian govt assets following Imran’s arrest.The 71-year-old former cricket star has faced a series of political and legal challenges since being ousted as PM in April 2022 after losing a confidence vote in parliament. A special court, constituted under Official Secrets Act, 1923, had convicted the two PTI politicians for sharing classified communication between Washington and Islamabad, which Khan claimed was part of a US conspiracy to overthrow his govt in 2022 after he visited Moscow just before Russia's invasion of Ukraine. Washington and Pakistan’s military dismissed the allegation.Khan’s conviction in the cipher case was one of three charges against him leading up to the Feb 8 elections this year, which he alleged were orchestrated to prevent his return to office. Last year, the same court overturned his conviction in a corruption case involving the unlawful sale of state gifts during his term from 2018 to 2022. The gifts included diamond jewellery and seven watches, six of them Rolexes — the most expensive being $304,000.","Former PM Imran Khan and ex-foreign minister Shah Mehmood Qureshi were serving 10-year sentences after being convicted of leaking state secrets. An Islamabad HC division bench, comprising justices Aamer Farooq and Miangul Hassan Aurangzeb, delivered a short verdict, accepting their appeals against the convictions.","https://static.toiimg.com/thumb/msid-110676153,imgsize-766298,width-400,resizemode-4/110676153.jpg"
"Pakistan: Relief for former PM Imran Khan in cypher case, but will still stay in jail",https://timesofindia.indiatimes.com/world/pakistan/pakistan-relief-for-former-pm-imran-khan-in-cypher-case-but-will-still-stay-in-jail/articleshow/110668943.cms,"NEW DELHI: In another major relief, Islamabad High Court on Monday cleared Pakistan 's former Prime Minister Imran Khan of charges related to leaking state secrets, according to his lawyer and party officials.The court also acquitted former foreign minister Shah Mahmood Qureshi in the cipher case .However, Khan will remain in prison for now due to another conviction .He was sentenced to 10 years in prison by a lower court on charges of making public a classified cable sent to Islamabad by Pakistan's ambassador in Washington in 2022.Shah Mehmood Qureshi, who was Khan's foreign minister during his tenure from 2018-2022, was also acquitted of the charges. He will also remain in jail as he is also facing the May 9 cases, as per Dawn.Expressing relief, a spokesperson for Khan's Pakistan Tehreek-e-Insaf party, Naeem Panjutha, announced the overturning of the sentence on X social media platform. Despite this legal victory, Khan remains in custody due to a separate conviction linked to his marriage to his third wife, Bushra Khan, which was deemed to contravene Islamic traditions.The cipher case revolves around a diplomatic document that, according to the Federal Investigation Agency's (FIA) charge sheet, was allegedly not returned by the former Prime Minister Imran Khan. Khan has persistently claimed that the document contained a threat from the US aimed at destabilizing his government.(With inputs from agencies)",Imran Khan cleared of charges related to leaking state secrets. Court also acquitted former foreign minister Shah Mahmood Qureshi in the cipher case. Khan will remain in prison for now due to another conviction. He was sentenced to 10 years in prison by a lower court on charges of making public a classified cable.,"https://static.toiimg.com/thumb/msid-110669821,imgsize-29534,width-400,resizemode-4/110669821.jpg"
Blast in Pakistan's Hyderabad claims 12 lives,https://timesofindia.indiatimes.com/world/pakistan/blast-in-pakistans-hyderabad-claims-12-lives/articleshow/110657051.cms,"ISLAMABAD : The death toll following a blast at a liquid petroleum gas cylinder filling shop in Hyderabad's Preetabad area climbed to 12 on Monday, as two more injured people succumbed to their injuries, reported ARY News.

The explosion occurred in the LPG cylinder filling shop on the ground floor of Zacha Bacha Hospital, along Mir Nabi Bux Town Road in UC-8 of Neerunkot.

The Karachi Civil Hospital is now treating 11 injured people, seven of them are gravely injured.

At least 60 people, predominantly youngsters, suffered major burn injuries and were transported to Karachi after receiving emergency care at Liaquat University Hospital (LUH), according to ARY News.

Sindh Chief Minister Syed Murad Ali along with ministers visited Burns Ward and talked about the health of injured persons.

Further details are awaited.

","Explosion occurred in the LPG cylinder filling shop on the ground floor of Zacha Bacha Hospital, along Mir Nabi Bux Town Road in UC-8 of Neerunkot. Karachi Civil Hospital is now treating 11 injured people, seven of them are gravely injured.","https://static.toiimg.com/thumb/msid-110657271,imgsize-20428,width-400,resizemode-4/110657271.jpg"
Pakistan finds it hard to control forest fires as heatwave sweeps nation,https://timesofindia.indiatimes.com/world/pakistan/pakistan-finds-it-hard-to-control-forest-fires-as-heatwave-sweeps-nation/articleshow/110651572.cms,"ISLAMABAD : The authorities in Pakistan are finding it tough to control the forest fire as a severe heatwave has gripped the nation. Authorities on Sunday doused another forest fire that erupted on Margalla Hills part located in Khyber Pakhtunkhwa, according to Geo News.The fire erupted a day after a massive blaze was brought under control in two separate locations in the Margalla Hills.Quoting Deputy Commissioner Islamabad Irfan Memon, Geo News reported that Capital Development Authority (CDA) teams were present on the incident site to bring the fire under control.He added that 36 firefighters participated in the firefighting operation as well.Bushfires have occurred in the Margalla range regularly during the summer. Recently, a fire broke out occasionally in the Islamabad hills. Officials have yet to ascertain whether the fires are caused by high heat or arson.However, three people were arrested on suspicion of igniting the forest fires , according to the capital's administration on Friday.Separately, a fire broke out in the forest, area of Rawalpindi's Baghar Sharif, spreading over an area of 15 to 20 acres, according to Geo News.The rescue officials stated that the risk of fire spreading was growing due to the rough and steep terrain and that they were fighting the fire wherever it was accessible.The district administration immediately launched an emergency operation and called for more personnel and machinery to contain the blaze.As of now, several parts of Pakistan have recorded temperatures as high as 52.2 degrees Celsius (126 degrees Fahrenheit) in the previous week, with South Asia experiencing a hotter summer this year, which scientists say has been exacerbated by human-caused climate change.",The fire erupted a day after a massive blaze was brought under control in two separate locations in the Margalla Hills. Officials have yet to ascertain whether the fires are caused by high heat or arson. Three people were arrested on suspicion of igniting the forest fires.,"https://static.toiimg.com/thumb/msid-110651914,imgsize-28202,width-400,resizemode-4/110651914.jpg"
Pakistan's law minister bats for judges from minority communities to join higher judiciary,https://timesofindia.indiatimes.com/world/pakistan/pakistans-law-minister-bats-for-judges-from-minority-communities-to-join-higher-judiciary/articleshow/110641230.cms,"LAHORE: Pakistan's law minister Azam Nazir Tarar has advocated for judges from minority communities to join Pakistan's higher judiciary. Speaking at the Justice A R Cornelius Conference held here on Saturday, Tarar emphasised the importance of religious freedom and minority rights in Pakistan and expressed his aspiration for judges from minority communities to join the country's higher judiciary , the Express Tribune newspaper reported on Sunday.

The minister highlighted that Pakistan's Constitution guarantees complete religious freedom. At the same time, he lamented the decline in religious tolerance post-Afghan war.

Tarar talked about the ongoing efforts to establish a Minority Rights Commission and proposed reserving quotas for minority law officers and legal advisors.

Supreme Court Justice Mansoor Ali Shah echoed Tarar's sentiments and advocated for the appointment of minority judges to the higher judiciary.

According to data released by the Pakistan Bureau of Statistics in 2021, there are 96.47 per cent Muslims in the country, followed by 2.14 per cent Hindus, 1.27 per cent Christians, 0.09 per cent Ahmadi Muslims and 0.02 per cent others.",Pakistan's law minister Azam Nazir Tarar has advocated for judges from minority communities to join Pakistan's higher judiciary. Tarar talked about the ongoing efforts to establish a Minority Rights Commission and proposed reserving quotas for minority law officers and legal advisors.Supreme Court Justice Mansoor Ali Shah echoed Tarar's sentiments.,"https://static.toiimg.com/thumb/msid-110641259,imgsize-17270,width-400,resizemode-4/110641259.jpg"
Pakistan: People encounter massive load-shedding suffer as severe heatwave grips nation,https://timesofindia.indiatimes.com/world/pakistan/pakistan-people-encounter-massive-load-shedding-suffer-as-severe-heatwave-grips-nation/articleshow/110617725.cms,"KARACHI: The general public of Pakistan 's Karachi currently suffer from severe effects of heatwave. Amid the ongoing summer season, the people of Karachi suffer from massive load-shedding and severe power cuts , which have been a problem for the general public's survival in the scorching heat.As the heatwave worsens in Karachi, people still have a slim chance and hope of comfort, as some individuals from the business community in the city have come together with initiatives like water camps to help the people.Muhammad Iqbal a daily wage worker working at one such water camp said, ""This has been an initiative of the people to quench the thirst of the people. We are only requesting the government to stop load shedding and organize such camps. So that the people can survive in the heat.""When asked about how the children have been falling ill due to the scorching heat of the summer ""Only the government can do something in this case, we are trying to do our best to help the people. The government must make some committees and do surveys to actually assess the bad situation and then take serious action over the matter, as the condition grows worse by the day"".Nasir Khan a rickshaw puller stated ""Our locality has been suffering a lot, it has been almost 20 days since we have received water supply in our area. Even the electricity is not supplied for more than 16 hours a day, so we have no possibility of relief in that matter also. I believe that the government is not taking the matter so seriously. The government has closed state-run schools, but private school students are still going to school in high temperatures. And these kids are not able to come back home and get relief because there are 16-hour-long powercuts, and this has been the real situation of the people of Karachi.""Muneeb, another citizen of Karachi, stated that ""although the scorching heat is a disaster of nature, the government is also not that helpful. I think this is the worst possible scenario for us, as the electricity department is not having any mercy on the general public. People have been paying bills of thousands and lakhs of rupees but I don't know why, there is still no electricity in our houses. We have been suffering for over 12 hours of load shedding in this high heat, while they sit in the air-conditioned offices.""""They will not be able to tolerate any heat if the roles are reversed. And I believe that there is a lot of water but the entire problem is because of rampant corruption and other misconducts. The Tanker Mafia has been stealing the water which should be given to the people and selling it to rich people, whereas we are left here to suffer in the heat,"" Muneeb added.","The general public of Pakistan's Karachi currently suffer from severe effects of heatwave. Amid the ongoing summer season, the people of Karachi suffer from massive load-shedding and severe power cuts. Some individuals from the business community in the city have come together with initiatives like water camps to help the people.","https://static.toiimg.com/thumb/msid-110617839,imgsize-826432,width-400,resizemode-4/110617839.jpg"
