Article Title,Article Link,Article Text,Article Summary,Article Image
'Serial abuser': Sean 'Diddy' Combs denied bail in sex trafficking case,https://timesofindia.indiatimes.com/world/us/serial-abuser-sean-diddy-combs-denied-bail-in-sex-trafficking-charges/articleshow/113439768.cms,"Rapper Sean 'Diddy' Combs was denied bail on Tuesday in Manhattan federal court in connection with a racketeering conspiracy and sex trafficking indictment. He is accused of allegedly leading a criminal operation that forced women into drug-fueled sex shows over a span of ten years.Magistrate judge Robyn Tarnofsky ordered Combs to remain in custody, agreeing with prosecutors who argued that he poses “an extreme danger to the community.” Prosecutors described Combs as “a serial abuser and a serial obstructor.”The 54-year-old music mogul appeared in court without handcuffs, dressed in a black t-shirt and dark gray sweatpants.Prosecutors cited several instances where Combs allegedly attempted to obstruct justice, including a March 5, 2016, incident in which he reportedly tried to bribe a hotel security officer to cover up an assault on his then-girlfriend, Cassie Ventura They also claimed that Combs forced women into “Freak Offs” with male prostitutes, allegedly recording these sessions.Assistant US attorney Adam Johnson also accused Combs of attempting to destroy surveillance footage that surfaced earlier this year, showing him assaulting Ventura. Johnson argued that Combs “has an ongoing ability to keep witnesses… in his pocket and at his disposal.”Combs pleaded not guilty to charges, including racketeering conspiracy and sex trafficking by force, fraud, or coercion.Recently, Combs allegedly sent 58 text messages to former Diddy-Dirty Money singer Kalenna Harper after she was named in a lawsuit. Harper later stated she had not seen Combs abuse anyone.Federal authorities arrested Sean 'Diddy' Combs on September 16 in Manhattan. During his arrest, Law enforcement discovered bags containing a pink powder in his hotel room that matched samples previously testing positive for ecstasy. Johnson said they are awaiting lab results to confirm the substance. Other drugs were also allegedly found at the scene.If convicted of the sex-trafficking charge, Combs faces a mandatory minimum sentence of 15 years in prison, with the possibility of life imprisonment.",Rapper Sean 'Diddy' Combs was denied bail on Tuesday in Manhattan federal court in connection with a racketeering conspiracy and sex trafficking indictment. He is accused of allegedly leading a criminal operation that forced women into drug-fueled sex shows over a span of ten years. Prosecutors described Combs as “a serial abuser and a serial obstructor”,"https://static.toiimg.com/thumb/msid-113440182,imgsize-782243,width-400,resizemode-4/113440182.jpg"
"Melania Trump spotted in New York, Eric had to walk for stepmother's enhanced security",https://timesofindia.indiatimes.com/world/us/melania-trump-spotted-in-new-york-eric-had-to-walk-for-stepmothers-enhanced-security/articleshow/113437145.cms,"Melania Trump was seen with doubled security in New York after a second assassination attempt on Donald Trump. According to a New York Post report, Melania's departure from Trump Tower coincided with the arrival of her stepson Eric Trump. But as the 56th Street was completely closed for Melania's security, Eric had to get out of his car at the 56th and 5th Avenue and walk around 40 feet to the side entrance.","Melania's departure from Trump Tower coincided with the arrival of her stepson Eric Trump. But as the 56th Street was completely closed for Melania's security, Eric had to get out of his car and walk around 40 feet to the side entrance.","https://static.toiimg.com/thumb/msid-113437148,imgsize-1013944,width-400,resizemode-4/113437148.jpg"
'Glad he's safe': Vice President Harris reaches out to Trump after Florida shooting incident,https://timesofindia.indiatimes.com/world/us/glad-hes-safe-vice-president-harris-reaches-out-to-trump-after-florida-shooting-incident/articleshow/113437098.cms,"US Vice President Kamala Harris spoke with former President Donald Trump over the phone on Tuesday, expressing her relief that he was unharmed following a reported shooting near his Florida golf course.The conversation, described as ""cordial and brief,"" by White House, came after gunfire was reported near Trump's West Palm Beach golf club on Sunday.Trump’s campaign confirmed his safety following the incident, while the FBI launched an investigation, calling it an ""attempted assassination.""A White House official released a statement saying, ""Vice President Harris called former President Trump this afternoon to directly express her gratitude that he is safe.The conversation was brief and cordial.""The suspect, Ryan Wesley Routh, faces charges of possessing a firearm as a convicted felon and possessing a firearm with an obliterated serial number, according to a CNN report. Routh remains in custody, with a detention hearing scheduled for September 23 and arraignment on September 30.This marks the second assassination attempt targeting Trump during his current presidential campaign. He was previously targeted during a rally in Butler, Pennsylvania.Earlier on Sunday, Vice President Harris expressed her relief on social media, writing, ""I have been briefed on reports of gunshots fired near former President Trump’s property in Florida, and I am glad he is safe. Violence has no place in America.""President Joe Biden also commented on the incident, stating he was ""relieved"" that Trump was unharmed. He praised the Secret Service for their vigilance and confirmed that a suspect was in custody, adding that the investigation was ongoing.""I commend the Secret Service and their law enforcement partners for their efforts to keep the former President and those around him safe,"" Biden said. ""There is no place for political violence in our country.""Biden emphasized that he has directed federal law enforcement to provide every resource necessary to ensure Trump’s continued safety.","US Vice President Kamala Harris spoke with former President Donald Trump over the phone on Tuesday, expressing her relief that he was unharmed. The conversation, described as ""cordial and brief,"" came after gunfire was reported near Trump's West Palm Beach golf club on Sunday. This marks the second assassination attempt targeting Trump during his current presidential campaign.","https://static.toiimg.com/thumb/msid-113437124,imgsize-989944,width-400,resizemode-4/113437124.jpg"
"Sean Diddy: 1,000 bottles of baby oil seized from Diddy's 'freak off' den. Internet calls it disgusting",https://timesofindia.indiatimes.com/world/us/1000-bottles-of-baby-oil-seized-from-diddys-freak-off-den-internet-calls-it-disgusting/articleshow/113436876.cms,"New York City hotel charged Diddy extra because couch had oil stains

The federal indictment that was unsealed after Sean Diddy was arrested in New York on charges of sex trafficking claimed that earlier this year when there was a raid at Diddy's home, about 1,000 bottles of baby oil were found. The bombshell indictment alleged that Sean Diddy Combs forced women into sick ""freak off"" sex sessions with male prostitutes that were often recorded while Diddy masturbated.The baby oil was used in those days-long freak offs which have been described by the court papers as ""elaborate and produced sex performances that Combs arranged, directed...and often electronically recorded.""The Freak Offs could last for days and Combs and the victims would often receive IV fluids in the aftermath “to recover from the physical exertion and drug use,” the feds alleged. His employees used to facilitate these sessions by arranging travel, booking hotel rooms -- stocked with supplies of drugs, baby oil, lubricants and extra linen.Combs also had his security staff carry weapons, and when the feds raided his homes in Miami and Los Angeles, they found three AR-15s with “defaced serial numbers,” other guns, ammunition, and a drum magazine, the indictment said.Rival 50 Cent trolled Sean Diddy over the staggering number of bail oil bottles as he wrote, ""Here I am keeping good company with Here I am keeping good company with @DrewBarrymoreTV and I don’t have 1,000 bottles of lube at the house.""Social media erupted after the disgusting details of Diddy's freak off sessions have been published.Prosecutors say that since 2009, Combs assaulted several women. One incident in 2016, at a hotel in Los Angeles, allegedly involved Combs ""kicking, dragging, and throwing a vase"" at a woman. According to the indictment, this was caught on camera, and prosecutors claim Combs tried to bribe a hotel staff member to keep quiet. After his arrest, Diddy's lawyer, Marc Agnifilo, told PEOPLE they were unhappy with the charges and called the case an ""unjust prosecution."" ""We are disappointed with the decision to pursue what we believe is an unjust prosecution of Mr. Combs by the US Attorney's Office,"" he said.A New York Post report said a New York City hotel once had to charge Diddy extra because he ""destroyed and stained"" couch and sheets. ""It was like they had a party. The couch had oil stains,"" Post quoted a source as saying. “In the room there was stains on the couches with body oils and the hotel needed to charge him for extra cleaning.”","The federal indictment that was unsealed after Sean Diddy was arrested in New York on charges of sex trafficking claimed that earlier this year when there was a raid at Diddy's home, about 1,000 bottles of baby oil were found. The bombshell indictment alleged that Sean. Diddy Combs forced women into sick ""freak off"" sex sessions with male prostitutes that were. often recorded while Diddy masturbated.","https://static.toiimg.com/thumb/msid-113436879,imgsize-31238,width-400,resizemode-4/113436879.jpg"
Donald Trump Jr: 'Kimberly Guilfoyle probably didn't know about Bettina...': Donald Trump Jr's love life on radar,https://timesofindia.indiatimes.com/world/us/kimberly-guilfoyle-probably-didnt-know-about-bettina-donald-trump-jrs-love-life-on-radar/articleshow/113436585.cms,"Who is Bettina Anderson?

Who is

Kimberly Guilfoyle

?

Ever since the photo of a lip-lock between Donald Trump Jr and Bettina Anderson emerged, speculations are rife that Don Jr may not walk the isle with his long time fiancee Kimberley Guilfoyle who publicly calls former president Donald Trump her father-in-law. Insiders, as quoted by Daily Mail, said either Kimberly did not know about Bettina or didn't want to know.""She's no fool but it's easy to deceive yourself when you are so committed to someone and believe he's committed to you,"" an insider was quoted.37-year-old Bettina Anderson is a Florida socialite -- the daughter of Inger and the late Harry Loy Anderson Jr. Her closeness with Don Jr is an open secret in Florida town and they are often spotted together -- comfortable and cosy. Photos of them kissing several times during the meal at The Honor Bar triggered speculations that they do not want their relationship to be secret anymore.People believe Donald Trump Jr is wayward and not accountable for what he does to anyone -- at least not to Kimberley, but probably his father.Bettina is a model, a bachelor of arts in art history, criticism and conservation from Columbia University.55-year-old Kimberly Guilfoyle is nine years older than Donald Trump Jr. A former prosecutor, Guilfoyle was married twice -- once to Gavin Newsom, the present California Democratic governor. Guilfoyle and Donald Trump Jr have been dating since 2018 and since then Guilfoyle has been an integral part of Donald Trump's campaigning. Guilfoyle also worked as the Fox News host.But Don Jr's alliance with Bettina Anderson may not end his engagement to Guilfoyle. According to insiders, she is now the odd woman out but since she is very much into the campaign, the engagement may not end now.",Kimberly Guilfoyle and Donald Trump Jr have been dating since 2018. Bettina Anderson is a Florida socialite -- the daughter of Inger and the late Harry Loy Anderson Jr. Her closeness with Don Jr is an open secret in Florida town and they are often spotted together.,"https://static.toiimg.com/thumb/msid-113436627,imgsize-1343799,width-400,resizemode-4/113436627.jpg"
Donald Trump: Polls show Kamala Harris edging ahead of Trump with 61 percent chances of winning,https://timesofindia.indiatimes.com/world/us/polls-show-kamala-harris-edging-ahead-of-trump-with-61-percent-chances-of-winning/articleshow/113435087.cms,"WASHINGTON: Kamala Harris has widened her lead over Donald Trump in all but one of dozen different polls tracked by the polling aggregator 538 after their presidential debate . Her lead in nationwide popular vote now ranges between 2 points to 7 points, with most of them beyond the typical 3.5 point margin of error. Only one poll by AtlasIntel puts Trump ahead by four.While Trump could lose the national popular vote and still clinch the Presidency by winning the electoral college determined by votes in individual states, the bad news for the Trump campaign is 538 now gives him only a 39 percent chance of winning the electoral college, while boosting Harris's odds to 61 per cent.In 1000 simulations run by the aggregator, Harris won 609 times while Trump won 387 times, with no winner four times.The polls were conducted before the second purported assassination attempt on Trump, which some of the MAGA media is lamenting is not being taken seriously by the mainstream media. 538 is owned by ABC News, which Trump accuses of being in cahoots with the Kamala Harris and tilting last week's debate to favor her.However, Nate Silver , who originally founded 538 before it was bought by ABC News, gives Trump the opposite numbers. His model, on blog Silver Bulletin, had the reverse odds for the election, putting Trump at 60 percent and Harris at 38 percent.Such simulated numbers are dodgy considering Hillary Clinton was given more than 90 percent chances of winning on the eve of the 2016 election.Both sides are accusing each other of manipulating polls to claim victory in the event of a close election, with many analysts concerned about the possibility of gridlock and violence on November 5. Typically election results become apparent by late night on election day, particularly if one side wins convincingly. But close race where getting to 270 electoral college votes needed to win boils down to one or two states is expected to cause tensions because some states -- notably Pennsylvania -- could take a long time to count mail-in ballots.Every state, and sometimes even counties, have different election rules and laws. Pennsylvania does not begin to sort out mail-in ballots till the morning of the election, while some states allow sorting (not opening) before election day to expedite counting. A large percentage of Pennsylvania's ballots come from in and around Democrat-leaning Philadelphia and Pittsburgh, and they take a long time to count, usually giving Republicans early leads in the state before Democrats close the gap. Some analysts suggest a candidate could potentially declare a win on the basis of early leads to muddy the waters and not allow the process of counting and certification.Already, there are surveys showing nearly half of Republicans saying they won’t accept the results of the presidential election if their candidate loses, and some of them say they would “take action to overturn” the results. About a quarter of Democrats said they wouldn’t accept the results if their candidate loses, but fewer Democrats than Republicans said they would “take action to overturn” the results.A poll by the nonpartisan World Justice Project did not ask people what specific “action” they would take to overturn the election results, only that that 46% of Republicans and 27% of Democrats wouldn't accept results, and 14% of Republicans compared to 11% of Democrats said they would ""take action.""","Kamala Harris has widened her lead over Donald Trump in all but one of dozen different polls tracked by the polling aggregator 538. Her lead in nationwide popular vote now ranges between 2 points to 7 points, with most of them beyond the typical 3.5 point margin of error. Trump could lose the national popular vote and still clinch the Presidency by winning the electoral college determined by votes in individual states.","https://static.toiimg.com/thumb/msid-113435170,imgsize-939520,width-400,resizemode-4/113435170.jpg"
Billie Eilish Endorses Harris Walz: Billie Eilish and her brother endorse Kamala Harris: 'Vote like you life depends on it',https://timesofindia.indiatimes.com/world/us/billie-eilish-and-her-brother-endorse-kamala-harris-vote-like-you-life-depends-on-it/articleshow/113435078.cms,"Trump thought Nicky Jam is a hot woman

After Taylor Swift , pop star Billie Eilish and her brother Finneas endorsed vice president and Democrat presidential candidate Kamala Harris . Urging people to register on the National Voter Registration Day , Billie and her brother said they would be voting for Harris and Walz because they are fighting to protect the reproductive freedom, the planet and the democracy.""Today is National Voter Registration Day and we are asking you to please join us in going to iwillvote,com to check your status and vote early like we do,"" Finneas said.""We are voting for Kamala Harris and Tim Walz because they are fighting to protect our reproductive freedom, our planet and our democracy,"" Billie segued.""We can't let extremists control our lives, our freedom and our future. The only way to stop them and the dangerous Project 2025 agenda is to vote and elect Kamala Harris,"" her brother said.""Vote like your life depends on it because it does,"" Billie said.This is a major endorsement coming Kamala Harris' way after Taylor Swift. Donald Trump recently said he hates Taylor Swift after Swift posted her elaborate message supporting Kamala Harris, Tim Walz -- signing off as the childless cat lady, in a swipe at Republican VP candidate JD Vance.Reggaeton star Nicky Jam endorsed Donald Trump but Donald Trump though he was a woman and introduced him as a hot woman at a Las Vegas rally over the weekend. ""Latin music superstar Nicky Jam. Do you know Nicky? She’s hot,"" Trump said.""People that come from where I come from, they don’t meet the president. So, I’m lucky,"" Jam said. ""We need you. We need you back, right? We need you to be the president.""","Pop star Billie Eilish and her brother Finneas endorsed Kamala Harris. They urged people to register on the National Voter Registration Day. Donald Trump recently said he hates Taylor Swift after Swift posted her elaborate message supporting Harris, Tim Walz -- signing off as the childless cat lady.","https://static.toiimg.com/thumb/msid-113435124,imgsize-526051,width-400,resizemode-4/113435124.jpg"
"Two Hindu girls 'abducted' in Pakistan's Sindh province, community demands protection",https://timesofindia.indiatimes.com/world/pakistan/two-hindu-girls-abducted-in-pakistans-sindh-province-community-demands-protection/articleshow/113435455.cms,"KARACHI: Two Hindu girls have been abducted from their homes in Pakistan's southern Sindh province in recent days, community leaders said and demanded safeguards to stop ""frequent kidnappings"" and "" forced conversions "". Shiva Kachi, a Hindu community leader from Hyderabad, said, ""We are getting information about such incidents nearly every week now from different parts of the province and no one seems to care.There is so much fear in the Hindu community now.""Kachi heads the Pakistan Darewar Ittehad , an organisation which is fighting for the recovery of Hindu girls kidnapped, allegedly forcibly converted to Islam and married off to Muslim men who are much older in many instances.In the recent days there have been two incidents in Khairpur and Mirpurkhas of two girls being abducted from their homes by armed men, he said.In the first instance, a 16-year-old girl was kidnapped from her home in Khairpur while a class 7th student was abducted from Digri town near Mirpurkhas.Kachi said in the first case, a Muslim youth claimed she eloped with him and married him after converting to Islam.He said the Pakistan government and provincial authorities needed to place safeguards to ensure the safety of the Hindu community.Ramesh Kumar, a social activist from Hyderabad city, claims once the girls are abducted, even the police don't cooperate and refuse to file FIRs on behalf of the affected families who are mostly uneducated and poor.""There is a nexus between some clerics, policemen and influential Muslims and the Hindu community suffers,"" he claimed.Hindus are not the only minority who claim they are discriminated against and face injustice. On Tuesday, an Ahmadi family (Ahmadiyyas are declared non-Muslims in Pakistan) saw their under-construction house vandalised in Karachi's Shah Faisal colony.""Everything was okay. We've been constructing the house for the last few months but yesterday someone spread the rumour that Ahmadis were building a worship place and today a mob came and badly damaged the under-construction building,"" Shahid Ahmed said.In many instances, the 500,000-strong Ahmadiyya community in Pakistan don't reveal themselves openly for fear of repercussions.Kumar also referred to the incident of firing in a Hindu temple, Rama Par, in Hyderabad city and said so far the police were delaying arresting all those responsible for entering the temple and opening fire during a religious ceremony.Scores of Hindus held a protest on Monday in Hyderabad demanding the arrest of those responsible for the alleged assault on the temple in which five people were injured.""Police have filed complaints against 11 people but made just two arrests,"" he said.A religious ceremony was taking place at the temple when a scuffle broke out between two groups of the Hindu community and this led to the involvement of outsiders who came and opened fire in the temple while the ceremony had not finished.","Two Hindu girls have been abducted from their homes in Pakistan's southern Sindh province in recent days. Hindu community leaders have demanded safeguards to stop ""frequent kidnappings"" and "" forced conversions"" On Tuesday, an Ahmadi family saw their under-construction house vandalised in Karachi's Shah Faisal colony.","https://static.toiimg.com/thumb/msid-113435465,imgsize-1058787,width-400,resizemode-4/113435465.jpg"
Militants in Pakistan used PUBG features to attack police station,https://timesofindia.indiatimes.com/world/pakistan/militants-in-pakistan-used-pubg-features-to-attack-police-station/articleshow/113390618.cms,"Militants in Swat , Pakistan, utilized features from the popular video game PlayerUnknown's Battlegrounds ( PUBG ) to plan and execute an attack on a local police station, reported Dawn.Militants targeted the Banr police station in Swat on August 28, resulting in the death of one police officer and injuries to two others. In response, district police initiated an investigation, analyzing CCTV footage from various surveillance cameras to identify the militants responsible for the attack.The militants used PUBG's chat room as a means of communication to evade electronic surveillance, making it difficult for authorities to monitor their activities.Zahidullah, the district police officer of Swat, revealed that while investigators initially focused on a motorcycle seen in CCTV footage near the police station prior to the explosion, their efforts to identify the nature of the attack were complicated. He said police found one person using a mobile phone and they believed that it would help them to hunt down the militants. However, militants never called each other but utilised features of PUBG to avoid being traced, he added.“The militants would play PUBG to practice and motivate their group members for battle against the state and would use the chat room for communication,” Dawn quoted Zahidullah as saying.The investigation ultimately revealed that the attackers had employed an improvised explosive device (IED) constructed from a power bank, rather than a hand grenade, as initially suspected.CCTV footage led to the identification of one suspect, which subsequently resulted in the arrest of additional suspects who disclosed their affiliation with a local militant group, Murad alias Rehmatullah, associated with the banned Tehreek-i-Taliban Pakistan .The arrested suspects admitted to maintaining communication with their group and family members in Afghanistan through PUBG chat rooms, frequently changing mobile phones and SIM cards to avoid detection.","Militants targeted a police station in Swat, Pakistan, on August 28, killing one officer. The militants used PUBG's chat room as a means of communication to evade electronic surveillance. The arrested suspects admitted to maintaining communication with their group and family members in Afghanistan through chat rooms.","https://static.toiimg.com/thumb/msid-113391564,imgsize-11152,width-400,resizemode-4/113391564.jpg"
