Article Title,Article Link,Article Text,Article Summary,Article Image
'Won't vote for you because you're an Indian': US author to Vivek Ramaswamy,https://timesofindia.indiatimes.com/world/us/wont-vote-for-you-because-youre-an-indian-us-author-to-vivek-ramaswamy/articleshow/109995856.cms,"NEW DELHI: US author and commentator Ann Coulter said that she would not have voted for the Republican candidate Vivek Ramaswamy in the Presidential elections because he was an ""Indian"".Speaking to the Indian-American, who was running for President, Coulter said on his podcast 'Truth' , “I agreed with many, many things you said.. in fact probably more than most other candidates when you were running for president..but I still would not have voted for you because you’re an Indian”.Responding to this, Ramaswamy later said on X, ""I disagree with her but respect she had the guts to speak her mind. It was a riveting hour.""Calling Ramaswamy ""bright and articulate"", the US author said, ""I guess I can call you articulate since you're not an American black - can't say that about them, it's derogatory"".The bit attracted reactions from people with one X user calling Coulter ""Indophobic"", while the other a ""bigot"".""It would be interesting to hear her rationale for being a bigot"", a user wrote.However, some users came in support of Coulter with one saying, Vivek, you made it clear that you want America to be more accessible to Indian immigrants at a time when immigration restriction is a popular issue. Ann is correct to point that you have a vested ethnic interest in facilitating the great replacement.""Earlier this year, Ramaswamy quit the US presidential race backing Donald Trump after his underdog campaign in the Republican Party's initial nominating contest in Iowa failed to gain significant traction.""I called Donald Trump to tell him I congratulate him on his victory. Now, going forward, he will have my full endorsement for the presidency. And I think we’re going to do the right thing for this country. And so I’m going to ask you, to follow me in taking our America First movement to the next level,” Ramaswamy had said.","US author and commentator Ann Coulter said that she would not have voted for the Republican candidate Vivek Ramaswamy in the Presidential elections because he was an ""Indian"" The bit attracted reactions from people with one X user calling Coulter ""Indophobic"", while the other a ""bigot""","https://static.toiimg.com/thumb/msid-109996658,imgsize-594724,width-400,resizemode-4/109996658.jpg"
New Russian space weapon raises alarm in US,https://timesofindia.indiatimes.com/world/us/new-russian-space-weapon-raises-alarm-in-us/articleshow/109919862.cms,"NEW DELHI: US officials have expressed grave concerns about Russia 's development of a new nuclear anti-satellite (ASAT) weapon, which could potentially transform Low-Earth Orbit (LEO) into a perilous battleground. The discussions about this emerging threat were highlighted by Mallory Stewart, the US assistant secretary of state for arms control, and John Plumb, the assistant secretary of defense for space policy, underscoring the serious implications of such developments.The ASAT weapon in question, allegedly already tested by Russia in high radiation orbits under the guise of electronic testing, diverges from typical scientific satellite protocols. This weapon is designed to disrupt a wide array of satellite operations spanning civilian, commercial, and military sectors by detonating in LEO, which extends approximately 100 to 1200 miles above the Earth, a report in Asia Times said.While there is no immediate deployment, the indiscriminate nature of such a weapon could severely damage satellites and impair critical global services including communication, weather forecasting, and security operations. The US officials emphasized the widespread implications of deploying such technology, noting its potential to make LEO unusable for any satellite operations.The concept of using nuclear weapons in ASAT roles isn't new and harks back to Cold War anxieties. Historical precedents like the US's Project 437 during the Kennedy administration, which was later abandoned due to its potential to damage both enemy and US satellites and infrastructure indiscriminately, illustrate the complexities and risks associated with such weapons.Recent simulations, such as those conducted by Chinese military scientists, have explored the effects of a nuclear detonation at altitude on satellite functionality. These studies show that while a high-altitude nuclear explosion would not create a traditional explosive cloud due to the absence of air, it would generate a belt of high-energy particles trapped by Earth’s magnetic field, posing a significant risk to spacecraft.In response to the decisive role satellite constellations like Elon Musk’s Starlink have played in modern warfare, evidenced by their utility in the ongoing Ukraine conflict, both Russia and China have hinted at developing ASAT capabilities to counter these systems. Reports suggest that these nations view the neutralization of such satellite networks as crucial to diminishing their adversaries' operational effectiveness.US and allied commercial satellites, including those like Starlink which have been pivotal in supporting Ukraine, have been identified by Russian officials as potential targets in the event of escalating hostilities. This stance highlights the broader strategy of using space capabilities as a means of asserting dominance and the potential shift towards militarization of space, despite international treaties like the 1967 Outer Space Treaty, which seeks to bar such activities.The development and potential deployment of nuclear ASAT weapons pose not only a technological or tactical challenge but also a diplomatic and strategic one, threatening the fabric of international space law and the peaceful use of outer space.",US officials have expressed grave concerns about Russia's development of a new nuclear anti-satellite weapon. The weapon could potentially transform Low-Earth Orbit (LEO) into a perilous battleground. The indiscriminate nature of such a weapon could severely damage satellites and impair critical global services.,"https://static.toiimg.com/thumb/msid-109920045,imgsize-22460,width-400,resizemode-4/109920045.jpg"
7 killed in Pakistan's Gwadar as terrorist open fire at sleeping workers,https://timesofindia.indiatimes.com/world/pakistan/7-killed-in-pakistans-gwadar-as-terrorist-open-fire-at-sleeping-workers/articleshow/109969129.cms,"(With ANI inputs)

NEW DELHI: At least seven workers were killed and one was injured in a terrorist attack in Pakistan 's Gwardar in Punjab province on Wednesday night.The terrorist targeted workers sleeping at residential quarters near Fish Harbour Jetty in Gwadar's Sarband . According to police, the workers were from Sahiwal in Punjab.The bodies of the deceased and the injured were taken to a hospital and cops have initiated a probe to arrest the perpetrators.On May 1, at least seven policemen sustained injuries as terrorists launched an assault on a police checkpost in Punjab's Taunsa Sharif district, news agency ANI reported citing ARY News.This incident marks the second assault on the checkpoint within two months in the district.According to police officials, terrorists attacked the Jhangi checkpost, situated in Wahova, Dera Ghazi Khan. Six officers sustained injuries, Samaa TV reported.According to ARY News, seven injured policemen were transferred to Taunsa Sharif THQ hospital for medical assistance. The Punjab Police spokesperson confirmed an attempted terrorist attack on the Jhangi checkpoint.He said that around 20 terrorists armed with grenades, rocket launchers, and laser-light guns attacked the checkpost. The spokesperson stated that the terrorists launched their assault from various directions under the cover of darkness, but retreated as they ran out of ammunition, as per ARY News report.He further said that terrorists wanted to capture the police checkpost and take the policemen as captives. Upon receiving intelligence about the terrorist assault, law enforcement agencies arrived at the scene and secured the area.After the attack, the vicinity was sealed off, and a thorough search operation was launched to capture the terrorists.Last month, a deadly suicide attack claimed the lives of five Chinese nationals after which a Beijing-based company halted civil works and let go of hundreds of workers at a hydropower project in Pakistan.The incident had occurred at the Dasu hydropower project in the Khyber Pakhtunkhwa province, where a vehicle laden with explosives targeted a bus carrying personnel, killing six people.",At least seven workers were killed and one was injured in a terrorist attack in Pakistan's Gwardar in Punjab province on Wednesday night. The terrorist targeted workers sleeping at residential quarters near Fish Harbour Jetty in Gwadar's Sarband. The bodies of the deceased and the injured were taken to a hospital and cops have initiated a probe to arrest the perpetrators.,"https://static.toiimg.com/thumb/msid-109969254,imgsize-11600,width-400,resizemode-4/109969254.jpg"
Powerful storms kill 3 as tornadoes tear through central and southeastern US,https://timesofindia.indiatimes.com/world/us/powerful-storms-kill-3-as-tornadoes-tear-through-central-and-southeastern-us/articleshow/109967474.cms,"COLUMBIA: Severe storms tore through the central and southeast U.S. late Tuesday and Wednesday, spawning damaging tornadoes , producing massive hail, and killing two people in Tennessee and one person in North Carolina. A storm that rumbled across northeastern Tennessee brought high winds that knocked down powerlines and trees. Claiborne County Sheriff Bob Brooks said a 22-year-old man was in a car struck by one of the trees.Wednesday afternoon, a tornado emergency - the weather service's highest alert level - was issued for an area south of Nashville including the towns of Spring Hill, Chapel Hill and Eagleville.The National Weather Service had previously reported a likely tornado on the ground in nearby Columbia, about 45 miles (72 kilometers) south of Nashville. People in Columbia were injured and homes were damaged, according to Lynn Thompson, assistant director of Maury County 911. Thompson told The Associated Press that he could not provide any further details: ""We're getting overloaded right now.""Rita Thompson, Marketing & Communications director with Maury Regional Health, said the hospital had received five patients. One died, another was in serious condition and three had injuries that were not life-threatening.The Federal Aviation Administration issued a temporary ground stop at Nashville International Airport because of the weather, media outlets reported. Northeast of Nashville, a flash flood emergency was issued for Sumner and Robertson counties including the cities of Hendersonville and Gallatin. The National Weather Service said water rescues were ongoing in those areas and described the flooding from heavy thunderstorms as life-threatening.""Do not attempt to travel unless you are fleeing an area subject to flooding or under an evacuation order,"" the weather agency alert said.In North Carolina, a state of emergency was declared for Gaston County Wednesday evening following a large storm. First responders were working to clear roads of downed power lines and broken trees and were helping residents, officials said. The New Hope Fire Department responded to a tree down on a car. One person in the car was killed and another was taken to a hospital, officials said.More than 135,000 customers had lost power in the state as of Wednesday evening, according to PowerOutage.us.Tornadoes were first reported after dark Tuesday in parts of Michigan, Indiana and Ohio, according to the National Weather Service. The storms came a day after a deadly twister ripped through an Oklahoma town.The National Weather Service confirmed tornadoes touched down Tuesday in western Ohio: five in Warren County and one each in Darke, Mercer and Auglaize counties. The weather service said crews are still surveying areas in other counties to determine if tornadoes struck there, as well.Crews on Wednesday were able to survey the damage caused by the strong storms that contained hail and heavy rains and knocked out power to thousands of utility customers.In Michigan, weather service meteorologist Nathan Jeruzal said the tornadoes there touched down one each in Kalamazoo, Cass and Branch counties - all in the southwestern part of the state. Gov. Gretchen Whitmer declared a state of emergency for four counties.Kalamazoo County's Portage area was hard hit as a FedEx facility was ripped apart and more than a dozen mobile homes were destroyed. About 50 people temporarily were trapped inside the damaged facility because of downed power lines.More than a dozen homes were destroyed in a mobile home park in adjacent Pavilion Township and 16 people were injured, said Kalamazoo County Sheriff Richard Fuller.Samantha Smith clutched a box Wednesday afternoon as she stepped from her mother's partially wrecked home in Pavilion Township, about 137 miles (220 kilometers) west of Detroit. Inside the box were her grandmother's ashes. Being able to recover the most cherished of items offered Smith a rare moment of relief amid the storm's devastation.Her parents and brother were injured during the storm but survived.""I have thanked God probably a billion times since this happened yesterday,"" she said. ""My kids are healthy and good. We just gotta make back up what we lost.""Travis Wycoff ventured out Tuesday night after seeing on radar that a tornado had touched down in the Portage area, and he said he helped an elderly couple out of their partially collapsed home and freed a service dog from a home.""There were a lot of people running through the streets trying to find people and their pets,"" Wycoff said. ""It was just a lot of chaos.""In southern Indiana, the National Weather Service confirmed a tornado touched down early Wednesday, damaging homes in a subdivision north of the city of Sellersburg, located about 12 miles (19 kilometers) north of Louisville, Kentucky.The Clark County Emergency Management Agency said the storm damaged 24 structures.Candice Holmes, a resident of the Lewis & Clark subdivision north of Sellersburg, said she, her husband and son sought shelter in their bathroom when they heard the approaching storm and ""the wind just picked up all at once.""""It was definitely a scary moment. ... And I'm glad we're alive,"" Holmes told WDRB-TV.","Tornadoes touch down in Michigan, Indiana and Ohio. Two people killed in Tennessee, one in North Carolina. Flash flood emergency issued for Sumner and Robertson counties. Federal Aviation Administration issues temporary ground stop at Nashville International Airport because of the weather.","https://static.toiimg.com/thumb/msid-109967816,imgsize-30930,width-400,resizemode-4/109967816.jpg"
"China Taiwan Crisis: China planes, ships detected around Taiwan as US destroyer passes Strait",https://timesofindia.indiatimes.com/world/rest-of-world/china-planes-ships-detected-around-taiwan-as-us-destroyer-passes-strait/articleshow/109966800.cms,"Taipei's defence ministry said Thursday it had detected 23 Chinese warplanes and five navy warships around the island, a day after a US warship sailed through the sensitive Taiwan Strait.The military presence around Taiwan comes less than two weeks before its inauguration of incoming president Lai Ching-te, who Beijing regards as a ""dangerous separatist"".China, which claims self-ruled Taiwan as part of its territory, frequently sends warplanes and naval ships around the island.The 180-kilometre (110-mile) Taiwan Strait separates Taiwan from China and is an important transport artery for cargo ships.Taipei's defence ministry said 23 Chinese warplanes and five navy vessels were detected around Taiwan in the 24 hours leading up to 6 am Thursday (2200 GMT).""8 of the aircraft crossed the median line,"" the ministry said, referring to a line bisecting the Taiwan Strait that is unrecognised by Beijing.The Chinese military presence coincided with a US warship -- the USS Halsey -- sailing through the narrow body of water on Wednesday.The destroyer ""conducted a routine Taiwan Strait transit on May 8 through waters where high-seas freedoms of navigation and overflight apply in accordance with international law,"" the US 7th fleet said Wednesday.It added that the Halsey's transit ""demonstrates the United States' commitment to upholding freedom of navigation for all nations as a principle"".""No member of the international community should be intimidated or coerced into giving up their rights and freedoms,"" it said.In a statement late Wednesday, Chinese naval colonel Li Xi, spokesman for the Eastern Theatre Command, called the US warship sail-through ""public hype"".He added that the Eastern Theatre command had also organised naval and air forces ""to monitor the passage of the US ship through the entire process"".""Troops in the theatre remain on high alert at all times and resolutely safeguard national sovereignty and security,"" the statement said.Before Taiwan's January elections, China had warned Lai would bring ""war and decline"" to the island -- making the lead-up to his May 20 inauguration a closely watched period as tensions soar between the two sides.China has said it will not renounce the use of force to bring Taiwan under its control.Lai, like outgoing President Tsai Ing-wen, does not recognise China's claim on the island.",Taipei's defence ministry says 23 Chinese warplanes and five navy vessels were detected around Taiwan in the 24 hours leading up to 6 am Thursday (2200 GMT) The Chinese military presence coincided with a US warship -- the USS Halsey -- sailing through the narrow body of water on Wednesday.,"https://static.toiimg.com/thumb/msid-109966800,imgsize-367661,width-400,resizemode-4/109966800.jpg"
Report: Trump may face a $100 million-plus tax bill if he loses IRS audit fight over Chicago tower,https://timesofindia.indiatimes.com/world/us/report-trump-may-face-a-100-million-plus-tax-bill-if-he-loses-irs-audit-fight-over-chicago-tower/articleshow/110045400.cms,"WASHINGTON: Former US president Donald Trump may face an IRS bill in excess of $100 million after a government audit indicates he double-dipped on tax losses tied to a Chicago skyscraper, according to a report by The New York Times and ProPublica that drew on a yearslong audit and public filings. The report's findings could put renewed focus on Trump's business career as the presumptive Republican nominee tries to regain the White House after losing in 2020.Trump used his cachet as a real estate developer and TV star to build a political movement, yet he has refused to release his tax filings as past presidential candidates have. The tax filings that the public does know about have come from past reporting by the Times and a public release of records by Democrats on the House Ways and Means Committee in 2022.Trump's presidential campaign provided a statement in son Eric Trump's name saying the IRS inquiry ""was settled years ago, only to be brought back to life once my father ran for office. We are confident in our position.""The tax records cited by the report indicate that Trump twice deducted losses on the Trump International Hotel and Tower, which opened in 2009 near the banks of the Chicago River that cuts through that city's downtown.The report said Trump initially reported losses of $658 million in his 2008 filings under the premise that the property fit the IRS definition of being ""worthless"" because condominium sales were disappointing and retail space went unfilled amid a deep US recession.But in 2010, the published report said, Trump transferred the ownership of the property to a different holding company that he also controlled, using the move to save money on taxes by reporting an additional $168 million in losses over the next decade on the same property.The report did not have any updates on the status of the IRS inquiry since December 2022, but said Trump could owe more than $100 million, including penalties, if he were to lose the audit battle.Trump, meanwhile, is appealing a New York judge's ruling from February after a civil trial that Trump, his company and top executives lied about his wealth on financial statements, conning bankers and insurers who did business with him. In early April, Trump posted a $175 million bond, halting collection of the more than $454 million he owes from the judgment and preventing the state from seizing his assets to satisfy the debt while he appeals.Democrat President Joe Biden has said that Trump largely owes his fortune to an inheritance from his father, rather than through his own financial acumen. Biden has gone after Trump for not wanting to pay taxes, while his administration has increased IRS funding in order to increase audits of the ultra-wealthy and improve compliance with the federal tax code.The Trump campaign opposes the additional funding that Biden and Democrats provided to the IRS. At campaign rallies, Trump has said the United States would be destroyed as a country unless his 2017 tax cuts that are largely set to expire after 2025 are extended.",Report: Former US president Donald Trump may face an IRS bill in excess of $100 million. Report indicates he double-dipped on tax losses tied to a Chicago skyscraper. Trump used his cachet as a real estate developer and TV star to build a political movement.,"https://static.toiimg.com/thumb/msid-110045498,imgsize-1540454,width-400,resizemode-4/110045498.jpg"
Jill Biden tells Arizona college graduates to tune out people who tell them what they 'can't' do,https://timesofindia.indiatimes.com/world/us/jill-biden-tells-arizona-college-graduates-to-tune-out-people-who-tell-them-what-they-cant-do/articleshow/110044885.cms,"Jill Biden on Saturday told Arizona community college graduates to tune out the people who like to tell them what they can't do.The first lady shared with graduates of Mesa Community College how her high school guidance counselor told her she wasn't college material and shouldn't waste her time going. She didn't listen and got her college degree.Then she got three more, including two master's degrees and, at age 55, a doctorate in educational leadership.She went to school at night while raising three children and working full-time.The first lady has been a teacher for more than 30 years, and since 2009 has taught English and writing at Northern Virginia Community College .She encouraged the graduates to ""drown out"" the voices that say ""can't"" and to remember the challenges they overcame to get to wear a cand gown on Saturday.""You've met life's challenges before. And you know that on the other side of 'can't' lies the beauty and joy and surprise of life, the adventure that changes us for the better,"" she said, according to excerpts of her prepared remarks shared with The Associated Press. ""And you are ready for it.""Biden said the graduates should remember that they are strong and resilient, and shouldn't be afraid to face the unknown.""Expect anything and everything. Take the risks that scare you. Don't hesitate when you see the chance for joy. Share your stories, too. Be kinder. Love harder. Dream bigger. Find your adventure and keep your courage to say 'yes.,'"" she said.To the Class of 2024, she said, ""Let the world feel your thunder!"" The college mascot is the thunderbird and ""feel the thunder"" is the school slogan.""And the next time that someone tells you that you 'can't,' you're going to say, 'Oh yeah?...Watch me,'"" Biden said.","The first lady shared with graduates of Mesa Community College how her high school guidance counselor told her she wasn't college material. She didn't listen and got her college degree. Then she got three more, including two master's degrees and, at age 55, a doctorate.","https://static.toiimg.com/thumb/msid-110045078,imgsize-1014053,width-400,resizemode-4/110045078.jpg"
