Article Title,Article Link,Article Text,Article Summary,Article Image
"Who is Gisele Pelicot? Drugged and raped for a decade, woman becomes symbol of courage and resilience",https://timesofindia.indiatimes.com/world/europe/who-is-gisele-pelicot-drugged-and-raped-for-a-decade-woman-becomes-symbol-of-courage-and-resilience/articleshow/113383469.cms,"Who is Gisele Pelicot?

Gisele Pelicot case explained

What is going on in court?

Hundreds of people, mostly women, came out in the street in support of Gisele Pelicot, a woman who was allegedly drugged by her ex-husband (who was her husband at that time) for a decade and he recruited dozens of strangers to rape her which has shocked the nation.The feminist associations have called for some 30 gatherings on Saturday in cities ranging from Marseille to Paris, where on the Place de la Republique banners read “Support to Gisele” or “Shame Must Change Camp” or “Victims We believe you”.Pelicot has become France ’s symbol of the fight against sexual violence , AP New reported.A 72-year-old woman caught the attention of headlines when she filed a case against her ex-husband Dominique Pelicot of repeatedly raping her and enlisting strangers to abuse his heavily sedated wife in the couple’s home over the course of a decade.Since the beginning of the case Pelicot has to go through a rough path. She chose to go for a public trial to alert the public to sexual abuse and drug-induced blackouts.During this trial, she had to face 51 of her alleged rapists which is due to run until December. People are praised for her courage and composure.She also allowed journalists to use her full name in their articles or the other platforms and even gave a nod to the court to exhibit explicit videos recorded by her husband showing men engaging in sexual intercourse with her naked, inert body.Her bold and courageous behaviour is praised by the entire France nation and even foreign countries.In an open letter translated into English and published in the French newspaper Le Monde, journalist and author Helene Devynck thanked Pelicot for her bravery, echoing the feelings of many other French people.“You entered our lives like you entered the Avignon court, through the front door,” wrote Devynck, a figure of the French #MeToo movement. “It’s not just you, Gisele, that they’ve treated like a thing. They were telling us, all of us women, how insignificant we are. Your strength restores ours. Thank you for this immense gift.”According to the police, the abuse began in 2011 when the couple lived near Paris and continued after their move to Mazan. Dominique routinely drugged his wife and invited strangers to join him in assaulting her, often filming the encounters. Pelicot has no memory of the attacks but will see many of them played in court as dozens of defendants go on trial in Avignon, France, between now and December. The revelation of his abuse has destroyed a formerly tight-knit family, and the reason behind his actions remains unclear.Pelicot came to know about this horrifying act through the police who gave her the information.Dominique’s crimes came to light in 2020 when he was caught filming women up their skirts in a supermarket. Upon investigation, authorities uncovered the scale of the abuse. He and 50 other men are now on trial for aggravated rape, with the proceedings expected to last four months. The victims of these attacks included various individuals, from a fire brigade officer to a journalist, and while most participated only once, some returned multiple times.Pelicot will face the man with whom she shared her life for over 50 years and the father of their three children on Monday. Her lawyer has said she is planning on attending his testimony.Her ex-husband, Dominique Pelicot, for health reasons, has been exempted from attending the trial since last week. He is expected to testify on Monday or Tuesday, his lawyer, Béatrice Zavarro, has said.Dominique has previously confessed to the crimes to investigators, but his court hearing will be crucial for the panel of judges to decide on the fate of the 50 other men accused of rape, reported AP news agency.Some defendants have claimed they believed a husband's consent for sexual intercourse was sufficient, while others said they were tricked by Dominique Pelicot into believing his wife was consenting.One lawyer representing six defendants has shocked the nation by arguing that ""there is rape and rape, and without intention, there is no rape.""","Gisele Pelicot, 72, has been accused of repeatedly raping her ex-husband Dominique. She has no memory of the attacks but will see many of them played in court as dozens of defendants go on trial in Avignon, France, between now and December. The revelation of his abuse has destroyed a formerly tight-knit family.","https://static.toiimg.com/thumb/msid-113386054,imgsize-54468,width-400,resizemode-4/113386054.jpg"
"Second assassination attempt on Trump triggers outrage, suspicion on all sides",https://timesofindia.indiatimes.com/world/us/second-assassination-attempt-on-trump-triggers-outrage-suspicion-on-all-sides/articleshow/113400158.cms,"WASHINGTON: US authorities said they foiled a potential assassination attempt on former prez Donald Trump on Sunday, arresting a man with a gun who was lying in ambush at a Florida resort where the MAGA supremo was golfing.The man, later identified as Ryan Wesley Routh , 58, fled after a Secret Service agent who was securing the course one hole ahead of Trump spotted a rifle barrel sticking out of a fence and fired at him.He ran on foot, jumped into his vehicle parked nearby and drove off before he was arrested after a pursuit.Authorities said he was unarmed when he was arrested, and they found an AK-47 like rifle with a scope, a Go-pro camera, and a backpack with ceramic tiles in the bushes where he was hiding. The man did not fire at Trump, who was about 500 yards away golfing with a friend.Soon after the incident, Trump assured his followers that he was safe and well. “There were gunshots in my vicinity, but before rumors start spiraling out of control, I wanted you to hear this first: I AM SAFE AND WELL! Nothing will slow me down. I will NEVER SURRENDER!” he posted on his platform ""Truth Social.""He later thanked the Secret Service and law enforcement for keeping him safe on what he called “an interesting day."" One lawmaker who spoke to Trump after the incident said he had joked about not being able to complete his round of gold.In an oblique reference to an earlier assassination attempt on him in Pennsylvania, Trump later wrote, ""When you’re “hot” the lowlifes really shoot at you... and they try hitting from every angle! Never let the bastards get you down.""In separate statements, President Joe Biden and vice-president Kamala Harris expressed relief that Trump was unharmed and said the was no place for political violence in the country, as activists on both sides accused the other of engendering the atmosphere conducive to such violence.Social media posts matching Routh's name showed him strongly supporting Ukraine in its war with Russia, and urging the US Congress to allow Americans to fight in the conflict.He had also been in the public eye a few times after encounters with the media and law enforcement. In an NYT interview in 2023, he said he was trying to recruit Afghan solders who fled the Taliban to fight in Ukraine. He had also been arrested in 2002 in Greensboro, North Carolina, after barricading himself inside a building with an automatic weapon.Tracked down by a tabloid, his estranged son Oran Routh told the Daily Mail that his father was a ""great dad"" and a ""nice guy"" and he hates Trump -- like “all reasonable people.”Although Trump praised the Secret Service and law enforcement for acting quickly to protect him, questions raged about how a potential assassin managed to get so close to the former president again.“There continues to be a lack of answers for the horrific assassination attempt in Pennsylvania and we expect there to be a clear explanation of what happened in Florida,” Republican lawmaker Elise Stefanik said in a statement.""Two assassination attempts in 60 days on a former President & the Republican nominee is unacceptable. The Secret Service must come to Congress tomorrow, tell us what resources are needed to expand the protective perimeter, & lets allocate it in a bipartisan vote the same day,"" California Democrat Ro Khanna tweeted.The Trump campaign responded by promoting the Republican candidate's message of unity and peace, while simultaneously directing supporters to a fundraising page.On the other hand, Democrats focused on gun control issues, questioning how a potential assassin with a criminal record was able to acquire an AK-47.","Man with a gun was lying in ambush at a Florida resort where the MAGA supremo was golfing. The man, later identified as Ryan Wesley Routh, fled after a Secret Service agent spotted a rifle barrel sticking out of a fence. He ran on foot, jumped into his vehicle parked nearby and drove off before he was arrested after a pursuit.","https://static.toiimg.com/thumb/msid-113400202,imgsize-907432,width-400,resizemode-4/113400202.jpg"
'I hope to ... ': Trump wants to meet woman who foiled assassination attempt,https://timesofindia.indiatimes.com/world/us/i-hope-to-trump-wants-to-meet-woman-who-foiled-assassination-attempt/articleshow/113442388.cms,"Former President Donald Trump expressed his desire to meet the woman who alerted authorities to the vehicle driven by a man accused of attempting to assassinate him. This incident occurred on Sunday at his golf course in Florida .Speaking to supporters at a town hall in Flint, Michigan , Trump recounted the events leading up to the foiled attack. He described how the suspect fled the golf course and was later spotted by a woman driving nearby.“She saw a man running on a busy street and thought he looked suspicious. She decided to follow him,” Trump explained.According to Trump, the woman parked her car behind the suspect's vehicle and took photos of the license plate before sending them to the sheriff's office. Her quick actions led to the suspect's arrest by Martin County sheriff's deputies on Interstate 95.Trump praised the woman’s vigilance, asking, “In a thousand of these incidents, would even one person have acted like this? She did. I want to meet her, and I hope to make that happen.”Meanwhile, Vice President Kamala Harris is campaigning in Pennsylvania, condemning political violence as “unacceptable.” She emphasised the importance of civil dialogue, saying, “Violence has no place.”The shooting incident marks the second close call for Trump in recent months. He recounted hearing gunfire at his golf course and praised the Secret Service for swiftly evacuating him. Trump has since suggested that the rhetoric from Harris and President Biden is endangering his safety.""They use highly inflammatory language. I could use it too—and much better than they can—but I choose not to,"" he said.",Former President Donald Trump expressed his desire to meet the woman who alerted authorities to the vehicle driven by a man accused of attempting to assassinate him. This incident occurred on Sunday at his golf course in Florida. Trump has since suggested that the rhetoric from Kamala Harris and President Biden is endangering his safety.,"https://static.toiimg.com/thumb/msid-113442354,imgsize-1050866,width-400,resizemode-4/113442354.jpg"
Deadly pager blasts in Lebanon: What US said about its involvement,https://timesofindia.indiatimes.com/world/us/deadly-pager-blasts-in-lebanon-what-us-said-about-its-involvement/articleshow/113440935.cms,"The United States has firmly denied any involvement or prior knowledge of the series of pager explosions that struck Lebanon on Tuesday. During a press briefing, US state department spokesperson Matthew Miller said that the US is currently gathering information about the incident but was not aware of it in advance and had no role in it.""We are gathering information on this incident.I can tell you that the US was not involved in it. The US was not aware of this incident in advance. At this point, we're gathering information,"" Miller said.Miller's comments followed confirmation from Lebanon’s Health Minister, Firass Abiad, who reported that the explosions, which occurred across the country, have resulted in at least eight fatalities and injuries to approximately 2,750 individuals. Abiad also mentioned that about 200 people are in critical condition, with victims receiving treatment in over 150 hospitals.When asked about the details of the information the US has collected, Miller explained that the US is gathering facts similarly to journalists but did not provide a public update. He also refrained from speculating on the involvement of any parties, including Israel. Miller stressed that the US aims to see a diplomatic resolution to the ongoing conflict between Israel and Hezbollah and preferred not to comment on the potential implications of the incident at this stage.In response to questions about Iran's possible role, Miller declined to speculate, urging that any information should be confirmed before drawing conclusions. He reiterated that the US would advise Iran against exploiting the incident to heighten regional tensions.""I never want to comment or speculate about the impact of any one incident, especially in the early stages of the incident. I am not going to do so here, that has been our policy to try to avoid doing. Our overall policy remains consistent, which is we do want to see a diplomatic resolution to the conflict between Israel and Hezbollah. We want to see one that allows the tens of thousands of Israelis who have been displaced from their homes and tens of thousands of Lebanese who have been displaced from their homes to return home. That's what we are continuing to pursue,"" he said.Hezbollah has reported that the explosions, which they attribute to malfunctioning pagers used by their personnel, resulted in the deaths of two fighters and a civilian. The group described the incident as their ""biggest security breach"" in nearly a year. Meanwhile, unverified reports from Arab media suggest that the explosions may be linked to an Israeli cyber attack, although no official statement has been issued by the Israeli military.Israel’s Security Cabinet has updated its war objectives, now including the safe return of northern residents displaced by Hezbollah attacks as a key goal. This comes amid Israel's ongoing conflict with Hamas. The Gaza health ministry reported on Tuesday that 41,252 Palestinians have been killed and 95,497 injured as a result of Israel's military offensive on Gaza since October 7.","The U.S. state department has denied any involvement or prior knowledge of the series of pager explosions that struck Lebanon on Tuesday. The explosions, which occurred across the country, have resulted in at least eight fatalities and injuries to approximately 2,750 individuals. Lebanon’s Health Minister, Firass Abiad, reported that about 200 people are in critical condition, with victims receiving treatment in over 150 hospitals.","https://static.toiimg.com/thumb/msid-113440976,imgsize-1315548,width-400,resizemode-4/113440976.jpg"
Is it safe for Trump to continue playing Golf after 2nd assassination attempt? What secret service said,https://timesofindia.indiatimes.com/world/us/is-it-safe-for-trump-to-continue-playing-golf-after-2nd-assassination-attempt-what-secret-service-said/articleshow/113440658.cms,"Former US president Donald Trump has been advised by the Secret Service to ramp up his security details if he wanted to continue golfing. During a meeting at Mar-a-Lago on Monday, Secret Service chief Ronald Rowe informed Trump that it was challenging to effectively secure large, open areas.This after the former president had asked whether it was safe for him to continue golfing regularly, according to The New York Times, which cited three sources familiar with the discussion.According to the secret service chief, the golf course at Joint Base Andrews in Maryland is easier to secure because it is a military course.Earlier on Sunday, Trump was quickly escorted off a golf course after Secret Service agents fired at a man seen aiming a rifle from the treeline at Trump International Golf Club in West Palm Beach , Florida. The suspect, 58-year-old Ryan Routh, was arrested and appeared in court on Monday, facing two gun-related charges.This incident follows rising tensions between the Trump campaign and the Secret Service, which have been brewing for the past two months, particularly after the first attempt on Trump's life in July.""Former President Trump is receiving the highest level of protection that the US Secret Service can provide, and we will continue to evaluate and adjust our specific protective measures and methodology based on each location and situation,"" Secret Service spokesperson Melissa McKenzie said on Tuesday.Trump on Tuesday told Fox News ""we've long requested more people"" and that additional Secret Service protection was forthcoming.""I think we are getting it now. Somebody told me that they will be providing more people now,"" Trump told interviewer Sean Hannity by telephone.Since the incident, both Democrats and Republicans have accused each other of using overheated rhetoric that is inspiring political violence .","Former US president Donald Trump has been advised by the Secret Service to ramp up his security details if he wanted to continue golfing. Secret Service chief Ronald Rowe informed Trump that it was challenging to effectively secure large, open areas. Trump on Tuesday told Fox News ""we've long requested more people"" and that additional Secret Service protection was forthcoming.","https://static.toiimg.com/thumb/msid-113441413,imgsize-827557,width-400,resizemode-4/113441413.jpg"
"Republicans block Senate's IVF Bill, despite Trumps Support; Biden calls it 'outrageous'",https://timesofindia.indiatimes.com/world/us/republicans-block-senates-ivf-bill-despite-trumps-support-biden-calls-it-outrageous/articleshow/113440564.cms,"The US Senate on Tuesday failed to advance legislation aimed at establishing a nationwide right to in vitro fertilisation (IVF) after Republicans blocked it for the second time this year. The 51-44 vote fell short of the 60 votes required, with only two Republican senators, Susan Collins of Maine and Lisa Murkowski of Alaska, voting in favour of the bill.Vice President Kamala Harris condemned the Republicans' actions, saying they made it clear once again that they would not protect access to the fertility treatments many couples need to fulfil their dream of having a child. President Biden echoed these concerns, calling the refusal to safeguard access to fertility treatments ""outrageous and unacceptable.""Democrats, led by Illinois Senator Tammy Duckworth, criticised Republicans for what they described as hypocrisy, arguing that while many GOP members claim to support IVF, they refuse to back legislation that guarantees its availability. ""They say they support IVF—here you go, vote on this,"" Duckworth said, drawing on her own experience with fertility treatments.The push for this legislation gained momentum following a controversial ruling by the Alabama Supreme Court, which classified frozen embryos as children. In response, several IVF clinics in Alabama suspended their services until the state legislature intervened. Democrats sought to highlight the risks to reproductive rights, particularly after the Supreme Court's overturning of Roe v. Wade in 2022.Republicans defended their position, arguing that the federal government should not dictate state policies and dismissed the bill as a political stunt. South Dakota Senator John Thune insisted that Republicans do support IVF, yet raised concerns about federal overreach.Last month, Donald Trump told NBC News that under his administration, IVF treatments would be covered by insurance companies. “We’re going to be mandating that the insurance company pay,” he said. His proposal took advisers by surprise, with one campaign insider describing it as ""unexpected.""","Only two Republican senators voted in favour of the bill. The push for this legislation gained momentum following a controversial ruling by the Alabama Supreme Court, which classified frozen embryos as children. Democrats sought to highlight the risks to reproductive rights, particularly after the Supreme Court's overturning of Roe v. Wade in 2022.","https://static.toiimg.com/thumb/msid-113440625,imgsize-1376057,width-400,resizemode-4/113440625.jpg"
'She's like Ghislaine Maxwell': Who is Diddy's chief of staff Kristina Khorram implicated in sex trafficking case?,https://timesofindia.indiatimes.com/world/us/shes-like-ghislaine-maxwell-who-is-diddys-chief-of-staff-kristina-khorram-implicated-in-sex-trafficking-case/articleshow/113440339.cms,"Sean “Diddy” Combs' Chief of Staff, Kristina Khorram , has come under intense scrutiny following federal charges against the hip-hop mogul. Once celebrated as Diddy 's ""right hand,"" Khorram is now facing comparisons to Ghislaine Maxwell , the infamous associate of convicted sex offender Jeffrey Epstein.The federal indictment unsealed this week accuses Combs, 54, of serious crimes including sex trafficking , racketeering, and transporting individuals for prostitution.Authorities have also hinted at the involvement of “high-ranking supervisors” within Combs’ organization, though specific names have not been disclosed. Khorram, who has not been charged with any crime, is noted as a potential key figure in the ongoing investigation.An insider close to the federal probe told the New York Post that Khorram, as Combs' Chief of Staff, would have been deeply involved in the management and execution of any illicit activities. ""If anybody is the gatekeeper, Kristina would know everything,"" the source told NYPost.Khorram’s role in the scandal is further highlighted by a lawsuit filed earlier this year by rapper Lil Rod, born Rodney Jones. In the suit, Khorram is likened to Ghislaine Maxwell, suggesting she played a role akin to Maxwell’s in Epstein’s criminal network. Lil Rod’s complaint alleges that Khorram orchestrated the procurement of sex workers for Combs and maintained a system where employees were allegedly required to carry drugs for the rapper’s use.The lawsuit also claims that Khorram was instrumental in managing the operations described as ""Freak Offs,"" where sex workers were provided with drugs and other supplies for illicit activities. Federal agents reportedly seized narcotics and over 1,000 bottles of baby oil and lubricant during raids on Diddy’s properties earlier this year.Khorram, who has worked closely with Combs since 2013 and became Chief of Staff in 2020, has yet to respond publicly to the allegations. Despite this, Diddy’s defense team has dismissed Lil Rod's claims as baseless, describing the lawsuit as a ""shameless attempt to create media hype.""As the legal proceedings unfold, the focus remains on the potential implications for Khorram and her role in the broader investigation. Federal authorities are continuing to gather evidence, including recordings and text messages, which may provide further insight into the alleged criminal activities.In the meantime, Diddy remains in custody after a $50 million bail request was denied. His legal team has vowed to challenge the accusations and prove the claims are unfounded.","Kristina Khorram, Diddy's Chief of Staff, has come under scrutiny following federal charges against the hip-hop mogul. The federal indictment unsealed this week accuses Combs of serious crimes including sex trafficking, racketeering, and transporting individuals for prostitution. Authorities have also hinted at the involvement of “high-ranking supervisors” within Combs’ organization, though specific names have not been disclosed. Khorran, who has not been charged with any crime, is noted as a potential key figure in the ongoing investigation.","https://static.toiimg.com/thumb/msid-113440365,imgsize-993869,width-400,resizemode-4/113440365.jpg"
