Article Title,Article Link,Article Text,Article Summary,Article Image
"TV host, political commentator Lou Dobbs dies at 78; Trump condoles death of 'friend ... incredible journalist'",https://timesofindia.indiatimes.com/world/us/tv-host-and-political-commentator-lou-dobbs-dies-at-76-who-was-he-all-you-need-to-know-trump-condoles-death-of-friend-incredible-journalist/articleshow/111845323.cms,"Who was Lou Dobbs



Dobbs began his career at CNN in 1980, serving as a reporter and network vice president.

He hosted the business program Moneyline, which premiered in 1980 and was later renamed Lou Dobbs Tonight in 2003.

He resigned from CNN in 1999 but rejoined the network in 2001 before resigning again in 2009.

From 2011 to 2021, Dobbs hosted Lou Dobbs Tonight on the Fox Business Network, where he became known for his staunch support of former President Donald Trump and his anti-immigration views. The show was canceled in February 2021 following a $2.7 billion defamation lawsuit filed against Fox News by Smartmatic, a voting machine vendor, over statements made by Dobbs and other Fox hosts about the 2020 presidential election.

In recent years, Dobbs hosted a show on the streaming platform Lindell TV, owned by MyPillow CEO Mike Lindell, a prominent supporter of Trump's false claims of election fraud.

Dobbs was born in Texas in 1945 and graduated from Harvard University with a degree in economics.

He briefly attended the University of Idaho and Idaho State University before being persuaded by his high school staff to apply to Harvard.

NEW DELHI: Lou Dobbs, a prominent conservative political commentator and former longtime host of Lou Dobbs Tonight on CNN and Fox Business Network , has passed away at the age of 78. The cause of death was not immediately disclosed.Former president Donald Trump condoled his death: ""The Great Lou Dobbs has just passed away — A friend, and truly incredible Journalist, Reporter, and Talent.He understood the World, and what was 'happening', better than others. Lou was unique in so many ways, and loved our Country. Our warmest condolences to his wonderful wife, Debi, and family. He will be greatly missed!""","Dobbs began his career at CNN in 1980, serving as a reporter and network vice president. He hosted the business program Moneyline, which premiered in 1980 and was later renamed Lou Dobbs Tonight in 2003. He resigned from CNN in 1999 but rejoined the network in 2001 before resigning again in 2009.","https://static.toiimg.com/thumb/msid-111845325,imgsize-1188272,width-400,resizemode-4/111845325.jpg"
US court blocks Biden's student debt relief plan: What it means for borrowers,https://timesofindia.indiatimes.com/world/us/us-court-blocks-bidens-student-debt-relief-plan-what-it-means-for-borrowers/articleshow/111845254.cms,"What it means for borrowers



NEW DELHI: A US federal appeals court on Thursday blocked the implementation of the Joe Biden administration 's student debt relief plan , which would have lowered monthly payments for millions of borrowers .The Saving on a Valuable Education (SAVE) plan, which aimed to provide more generous income-driven repayment terms and loan forgiveness, has now been halted by the 8th US Circuit Court of Appeals.The SAVE plan would have lowered monthly payments for eligible borrowers and allowed those with original principal balances of $12,000 or less to have their debt forgiven after 10 years of payments. However, the appeals court granted a request by seven Republican-led states to put the plan on hold, siding with their argument that the administration had overstepped its authority.This ruling means that the millions of borrowers who had already enrolled in the SAVE plan will no longer be able to benefit from its more favorable terms.Instead, they will likely revert to previous income-driven repayment plans, which typically require higher monthly payments and longer repayment periods before any forgiveness is granted.The legal battle over the student debt relief plan has created significant uncertainty and confusion for borrowers.Conflicting injunctions from different federal courts have left the student loan repayment system in disarray, with potential disruptions and complications for those seeking lower payments or debt relief.Advocacy groups have warned of the widespread impact of these court orders, which could make it more difficult for borrowers to access the relief they were counting on. The Biden administration has also cautioned that a reversal of the SAVE plan could lead to significant challenges, including delays and complications for millions of borrowers.With the 8th Circuit's ruling, the future of the student debt relief plan is now uncertain.The involvement of the Supreme Court seems probable, as the highest court in the land may need to weigh in on the legality of the administration's actions. Until then, borrowers will have to navigate the legal uncertainty and potentially face higher monthly payments and fewer options for debt relief.",A US federal appeals court on Thursday blocked the implementation of the Joe Biden administration's student debt relief plan. The Saving on a Valuable Education (SAVE) plan aimed to provide more generous income-driven repayment terms and loan forgiveness. The SAVE plan would have lowered monthly payments for eligible borrowers.,"https://static.toiimg.com/thumb/msid-111845265,imgsize-1556648,width-400,resizemode-4/111845265.jpg"
"20-years-old rally shooter had photos of Trump, Biden and other US officials on his phone: Sources",https://timesofindia.indiatimes.com/world/us/20-years-old-rally-shooter-had-photos-of-trump-biden-and-other-us-officials-on-his-phone-sources/articleshow/111844964.cms,"The 20-year-old Pennsylvanian who attempted to assassinate former US President Donald Trump had images of the ex-president, President Joe Biden , and other officials, including Attorney General Merrick Garland and FBI Director Chris Wray, on his phone, according to two individuals knowledgeable about the case.People who spoke to The Associated Press anonymously to discuss ongoing investigation details said that investigators examining Thomas Matthew Crooks ' devices also discovered that the shooter searched for the dates of the Democratic National Convention and Trump's appearances.Three people familiar with the investigation said he also looked up ""major depressive disorder."" However, one of the individuals said that investigators have not yet confirmed whether he was actually diagnosed with the disorder. Research has demonstrated that the overwhelming majority of individuals with mental illnesses are not violent, and experts assert that most violent individuals do not have mental illnesses.During a media briefing on Sunday, Kevin Rojek, the special agent leading the Pittsburgh field office, said: ""We have no indication of any mental health issues.""Authorities are working to uncover the motives behind Crooks' decision to fire shots at the campaign event on Saturday, in what appears to be an attempt on the life of the Republican presidential candidate. The shooting resulted in the death of one attendee and severe injuries to two others. Trump sustained an ear injury but avoided serious harm, later making an appearance at the Republican National Convention in Milwaukee, sporting a bandage covering the wound.The FBI has indicated that they are treating the investigation as a potential act of domestic terrorism. However, the absence of a definitive ideological motive by the individual killed by the Secret Service has given rise to various conspiracy theories surrounding the incident.","Thomas Matthew Crooks, 20, shot dead one person and injured two others at a campaign event in Pennsylvania on Saturday. Crooks had images of former US President Joe Biden and other officials on his phone, according to two individuals knowledgeable about the case. The shooter also searched for the dates of the Democratic National Convention and Trump's appearances.","https://static.toiimg.com/thumb/msid-111845152,imgsize-508203,width-400,resizemode-4/111845152.jpg"
"What happens if Joe Biden decides to drop out of the 2024 US presidential race, and who could replace him?",https://timesofindia.indiatimes.com/world/us/what-happens-if-joe-biden-decides-to-drop-out-of-the-2024-us-presidential-race-and-who-could-replace-him/articleshow/111844760.cms,"

What happens when Biden drops out

Notification and Confirmation: President Biden would formally notify the Democratic National Committee (DNC) and other relevant party officials of his decision to withdraw from the race. The DNC would confirm the withdrawal and begin the process of selecting a new candidate.

President Biden would formally notify the Democratic National Committee (DNC) and other relevant party officials of his decision to withdraw from the race. The DNC would confirm the withdrawal and begin the process of selecting a new candidate. T emporary Leadership: The DNC would appoint an interim chair or acting chair to manage the party's operations and the selection process until a new candidate is chosen.

The DNC would appoint an interim chair or acting chair to manage the party's operations and the selection process until a new candidate is chosen. Caucuses and Committees: The various Democratic caucuses and committees, such as the Congressional Black Caucus, the Congressional Hispanic Caucus, and the Progressive Caucus, would likely convene to discuss and endorse a new candidate. These groups would also engage in discussions with potential candidates to gauge their support and willingness to run.

The various Democratic caucuses and committees, such as the Congressional Black Caucus, the Congressional Hispanic Caucus, and the Progressive Caucus, would likely convene to discuss and endorse a new candidate. These groups would also engage in discussions with potential candidates to gauge their support and willingness to run. Candidate Selection: The DNC would hold a series of meetings and discussions with party leaders, elected officials, and other stakeholders to determine the best candidate to replace Biden. The process would involve data analysis, polling, and direct conversations with potential candidates to assess their viability and appeal to the party's base.

The DNC would hold a series of meetings and discussions with party leaders, elected officials, and other stakeholders to determine the best candidate to replace Biden. The process would involve data analysis, polling, and direct conversations with potential candidates to assess their viability and appeal to the party's base. Primary and Caucus Schedule: The DNC would adjust the primary and caucus schedule to accommodate the new candidate. This might involve rescheduling some events or modifying the order of the primaries to ensure a smooth transition.

Many hurdles



Modifying Nomination Procedures: The Democratic Party's rules outline procedures for replacing a candidate who steps aside before the formal nomination. This would likely involve the party modifying its rules regarding candidate substitution through a vote.

The Democratic Party's rules outline procedures for replacing a candidate who steps aside before the formal nomination. This would likely involve the party modifying its rules regarding candidate substitution through a vote. Navigating Legal Challenges: After the convention, state laws could present obstacles to replacing Biden on specific ballots. The party would need to carefully navigate these legal challenges at the state level.

After the convention, state laws could present obstacles to replacing Biden on specific ballots. The party would need to carefully navigate these legal challenges at the state level. Timing Considerations: The Democratic National Committee is currently expediting the process to officially nominate Biden as the party's presidential candidate by the first week of August, through a virtual roll call vote. This is being done to meet ballot deadlines in Ohio, despite objections from some Democrats who want more time for deliberation.

The Democratic National Committee is currently expediting the process to officially nominate Biden as the party's presidential candidate by the first week of August, through a virtual roll call vote. This is being done to meet ballot deadlines in Ohio, despite objections from some Democrats who want more time for deliberation. Potential Replacement Candidates: If Biden were to drop out, the party would need to quickly identify and rally behind an alternative candidate, navigating the complex process and potential legal challenges.

Who could replace Biden?

Kamala Harris : As the current Vice President, Kamala Harris would likely be at the top of the list to replace Biden. However, she has faced criticism for her perceived lack of distinctiveness within the Biden administration and concerning polling approval ratings. Harris has been a loyal ally to Biden and fiercely defended his debate performance, but she would still need to rally delegates at a contested convention.

As the current Vice President, Kamala Harris would likely be at the top of the list to replace Biden. However, she has faced criticism for her perceived lack of distinctiveness within the Biden administration and concerning polling approval ratings. Harris has been a loyal ally to Biden and fiercely defended his debate performance, but she would still need to rally delegates at a contested convention. Gavin Newsom: The California Governor has been floated as a possible replacement and is known for his support of Democrats nationally. Newsom has political ambition and frequently appears as a surrogate praising Biden, but he is currently working to get Biden elected.

The California Governor has been floated as a possible replacement and is known for his support of Democrats nationally. Newsom has political ambition and frequently appears as a surrogate praising Biden, but he is currently working to get Biden elected. Gretchen Whitmer: The Michigan Governor is an increasingly popular Midwest Democrat who has campaigned for Biden in the past. Whitmer led a successful campaign in 2022 that left Michigan Democrats in control of the state legislature and governorship, allowing her to enact progressive policies.

The Michigan Governor is an increasingly popular Midwest Democrat who has campaigned for Biden in the past. Whitmer led a successful campaign in 2022 that left Michigan Democrats in control of the state legislature and governorship, allowing her to enact progressive policies. J.B. Pritzker: The Illinois Governor emerges as a wealthy and progressive candidate with strong stances on key issues like abortion rights, gun control, and marijuana legalization. Pritzker has been floated as a possible replacement, but is currently working as a Biden surrogate.

The Illinois Governor emerges as a wealthy and progressive candidate with strong stances on key issues like abortion rights, gun control, and marijuana legalization. Pritzker has been floated as a possible replacement, but is currently working as a Biden surrogate. Other Potential Candidates: Other names that have been mentioned include Pennsylvania Governor Josh Shapiro, California Representative Ro Khanna, and Senators Bernie Sanders, Elizabeth Warren, Amy Klobuchar, and Transportation Secretary Pete Buttigieg.

NEW DELHI: With the number of prominent Democratic leaders urging Joe Biden to drop out of the 2024 US presidential race growing by the day, political analysts believe that the 81-year-old might give in to party pressure and give up his bid for re-election.So, what happens if Joe Biden decides to drop out of the 2024 US presidential race? There are several potential scenarios that could unfold:Biden's withdrawal will likely trigger a complex process, with the party potentially needing to adjust its nomination procedures and navigate legal challenges at the state level.The Democratic Party will need to modify its nomination procedures, address legal hurdles at the state level, and quickly coalesce around a replacement candidate, all while navigating internal divisions and a tight timeline.If Joe Biden were to drop out of the 2024 US presidential race, there are several potential candidates who could replace him as the Democratic nominee:","President Biden would formally notify the Democratic National Committee (DNC) and other relevant party officials of his decision to withdraw. The DNC would confirm the withdrawal and begin the process of selecting a new candidate. The process would involve data analysis, polling, and direct conversations with potential candidates to assess their viability and appeal to the party's base. After the convention, state laws could present obstacles to replacing Biden on specific ballots.","https://static.toiimg.com/thumb/msid-111844748,imgsize-677869,width-400,resizemode-4/111844748.jpg"
Joe Biden expected to meet Israeli Prime Minister Benjamin Netanyahu next week: White House,https://timesofindia.indiatimes.com/world/us/joe-biden-expected-to-meet-israeli-prime-minister-benjamin-netanyahu-next-week-white-house/articleshow/111844531.cms,"The White House announced on Thursday that US President Joe Biden is anticipated to meet with Israeli Prime Minister Benjamin Netanyahu during his visit to Washington next week, contingent upon his recovery from Covid. National security council spokesman John Kirby informed reporters during a briefing that ""We have every expectation that the two leaders will have a chance to see each other while prime minister Netanyahu is in town.""Netanyahu is scheduled to speak before the US Congress on Wednesday, and Israeli media had previously reported a meeting with Biden on Monday.However, Kirby said, ""I can't tell you at this point what that exactly is going to look like."" He emphasised the importance of prioritising the president's health and recovery from Covid, which may impact the discussion with the prime minister.The war in Gaza will be a primary topic of discussion during the meeting, with Biden urging for a peace agreement with Hamas.Biden was experiencing mild symptoms after testing positive for Covid on Wednesday, according to Kirby, which has taken him off the campaign trail amidst growing calls from Democrats to withdraw his reelection bid.Kirby assured that neither the political turmoil nor Biden's illness had impacted his responsibilities. ""While he's certainly focused on getting better, as anyone who has Covid would want to do, he's being kept up to speed as appropriate by his leadership team and certainly that includes on the national security front,"" he said.","US President Joe Biden is expected to meet with Israeli Prime Minister Benjamin Netanyahu during his visit to Washington next week. The meeting is contingent upon Biden's recovery from Covid. Netanyahu is scheduled to speak before the US Congress on Wednesday, and Israeli media had previously reported a meeting with Biden on Monday.","https://static.toiimg.com/thumb/msid-111844610,imgsize-829871,width-400,resizemode-4/111844610.jpg"
"Tishomingo Crash: After crash that killed 6 teens, NTSB chief says people underestimate marijuana's impact on drivers",https://timesofindia.indiatimes.com/world/us/after-crash-that-killed-6-teens-ntsb-chief-says-people-underestimate-marijuanas-impact-on-drivers/articleshow/111844037.cms,"DETROIT: A horrific crash that killed six high school girls in Oklahoma two years ago has the head of the US National Transportation Safety Board urging parents to warn teenagers about the risk of driving after using marijuana.Chairwoman Jennifer Homendy made the appeal to parents Thursday as her agency released the final report on the March 22, 2022 collision between a tiny Chevrolet Spark hatchback and a gravel-hauling semi in the small town of Tishomingo.The board, after an investigation by its staff, determined that the crash was caused by the 16-year-old driver slowing for an intersection, then accelerating through a stop sign because she likely was impaired by recent marijuana use and was distracted by having five teen passengers in the car, the NTSB report said.In an interview, Homendy also said the cannabis problem isn't limited to teens. As more states have legalized recreational marijuana, teens and adults tend to underestimate the risks of driving under its influence.""There's a perception that in states where it's legal that it's safe and legal to drive impaired on marijuana,"" she said.In its report on the crash, the NTSB cited studies showing that marijuana decreases motor coordination, slows reaction time and impairs judgment of time and distance, all critical functions for driving.Currently it's legal for people 21 and older to use marijuana recreationally in 24 states plus Washington, DC, according to the Insurance Institute for Highway Safety. Oklahoma doesn't allow recreational use, but like most states, it's legal for medical purposes. Driving while impaired by marijuana is illegal in all states and Washington, DC.The NTSB, which investigates transportation-related crashes but has no regulatory power, put out a safety alert Thursday urging parents to talk to young drivers about how marijuana can impair driving, and how they can make responsible choices to avoid driving while impaired or riding with impaired drivers.Homendy said states that have legalized marijuana are behind in making sure people know that it's illegal to drive under its influence. Over half of Americans live in a state where recreational cannabis use is legal, she said.""Unfortunately, I think state laws that are legalizing recreational and medicinal use of marijuana have really come before thoughts or action on what are they going to do about traffic safety ,"" Homendy said. ""They are far ahead on legalizing it, but very behind when it comes to traffic safety.""States, she said, need to collect more data on how legalizing marijuana has affected traffic safety, and they need to start enforcing laws against driving while impaired by cannabis.""Enforcement has got to be there in order to deter,"" she said.One study on crashes in Washington state, which has legalized recreational marijuana use, showed that more drivers involved in fatal crashes tested positive for marijuana after it became legal, the NTSB said.In Tishomingo, about 100 miles (160 kilometers) southeast of Oklahoma City, six high school girls got into the car designed to carry four for a lunch break, the NTSB report said.At an intersection, the driver slowed to 1 mile per hour (1.6 kilometers per hour), but accelerated and didn't come to a complete stop for a sign. Instead, she sped up and turned left in front of the gravel truck. The truck driver braked and steered to avoid the Spark, but hit the driver's side at just under 50 mph (80 kilometers per hour). All six teens died of multiple blunt force injuries.Tests on blood taken from the driver's body found a THC concentration of 95.9 nanograms per milliliter, the NTSB said. If such a level of THC, the main chemical component of marijuana, were found in a living person, it would indicate ""a high likelihood that the person had used cannabis very recently, and therefore was likely still experiencing acute impairing cannabis effects,"" the report said.But the NTSB cautioned that body-cavity blood samples can sometimes be contaminated by other body fluids or by THC from other tissues, including the lungs, that may contain high concentrations.In addition, the Oklahoma Highway Patrol found vaping mouthpieces and cannabis buds in the car at the scene of the crash, the report said.The NTSB recommended in the report that the Oklahoma State Department of Education develop a drug and alcohol abuse curriculum for local school districts that tells students about the risk of cannabis-impaired driving . At present, only Massachusetts and Rhode Island have such course requirements, the NTSB said.The agency also wants the Governors Highway Safety Association, a group of state highway safety officers, the National Conference of State Legislatures and the National Association of State Boards of Education to inform members about the Tishomingo crash and the need for cannabis information in school and driver education coursework.The safety association said in a statement that cannabis-impaired driving is a growing safety concern, and state highway safety offices are focused on eliminating all impaired driving.""We have to start communicating well ahead of time, to kids, that driving, having ingested or smoked or inhaled marijuana is impairing, and it's a risk to them and a risk to others,"" Homendy said.","Six high school girls were killed in a crash in Tishomingo, Oklahoma, two years ago. The NTSB says the 16-year-old driver likely was impaired by recent marijuana use. The agency is urging parents to talk to young drivers about how marijuana can impair driving.","https://static.toiimg.com/thumb/msid-111844072,imgsize-1422716,width-400,resizemode-4/111844072.jpg"
