Article Title,Article Link,Article Text,Article Summary,Article Image
Standing Tall: How Tall is Lara Trump?,https://timesofindia.indiatimes.com/world/us/standing-tall-how-tall-is-lara-trump/articleshow/111803115.cms,"Lara Trump, an established figure in American politics and the wife of Eric Trump , was recently given notice, with Google Trends showing a sharp rise in searches related not just to her political achievements but also to her astounding height . According to reports stated by the New York Times , Lara Trump is approximately 5 feet 11 inches tall and often draws attention at political events and public appearances .Lara Trump, an established figure in American politics and the wife of Eric Trump, was recently given notice not just for her political achievements but also for her astounding height. According to reports stated by the New York Times, Lara Trump is approximately 5 feet 11 inches tall and often draws attention at political events and public appearances.The New York Times stated about Lara's height: Her rapid rise from a former tabloid television producer to an important figure in the party is remarkable. At a recent Republican National Committee (RNC) rally in Milwaukee, a supporter stated, ""You like Lara, right? In accordance with Google Trends, Lara is just the head of the Republican Party .In addition to her height, Lara Trump has been extremely dedicated to the Republican Party. She frequently makes headlines for her opinions and political activities. This week, as Republicans prepare to nominate Donald Trump, Lara's role as co chair is on full display. She hosted the event and was prominently positioned behind her father in law during his emotional reaction to an assassination attempt. According to Google Trends, she delivered a 20 minute speech on Tuesday, longer than elected officials including Kristi Noem, Glenn Youngkin, and even Marjorie Taylor Greene did.Addressing critics, Lara said, ""I know what you hear out there about Donald Trump, but when I look at Donald Trump, I see a wonderful father, father in law, and, of course, grandfather to my two young children, Luke and Carolina, according to Google Trends.""Lara Trump's height and influence in politics make her an extraordinary figure in the Republican Party. Her rapid rise and significant public presence continue to draw attention and emphasise her relevance in today's political arena, according to Google Trends.","Lara Trump is an established figure in American politics and the wife of Eric Trump. Her rapid rise from a former tabloid television producer to an important figure in the party is remarkable. In accordance with Google Trends, Lara is just the head of the Republican Party.","https://static.toiimg.com/thumb/msid-111804246,imgsize-46714,width-400,resizemode-4/111804246.jpg"
'There was blood pouring everywhere': Donald Trump narrates experience of escaping assassination attempt,https://timesofindia.indiatimes.com/world/us/there-was-blood-pouring-everywhere-donald-trump-narrates-experience-of-escaping-assassination-attempt/articleshow/111850285.cms,"RNC LIVE: Trump gives speech at Republican National Convention Day 4

Donald Trump , the Republican presidential candidate, on Thursday recounted his personal experience of the assassination attempt on his life during a rally at Pennsylvania rally.While delivering his speech at the closing night of the Republican National Convention in Milwaukee, Trump called for unity among Americans.Trump vividly described the moment when the assassin's bullet nearly struck him, missing by a mere quarter of an inch.He shared the details of the incident, stating, ""I heard a loud whizzing sound and felt something hit me really, really hard on my right ear. I said to myself, 'Wow, what was that? It can only be a bullet. If I had not moved my head at that very last instant, the bullet would have perfectly hit its mark. I immediately knew it was very serious, that we were under attack, and in one movement proceeded to drop to the ground.""Trump said that the attack was swiftly ended by a Secret Service sniper, who took out the assassin with a single shot from a greater distance.“There was blood pouring everywhere, yet, in a certain way I felt very safe because I had God on my side,"" Trump said. “I'm not supposed to be here tonight.""The crowd responded with chants of ""Yes you are,"" to which Trump replied, ""I stand before you in this arena only by the grace of Almighty God. And watching the reports over the last few days, many people say it was a 'providential moment.' Probably was.""In the face of the assassination attempt, Trump described how he raised his fist in the air and began shouting ""fight, fight, fight,"" demonstrating his resilience and determination to continue his presidential campaign.Trump's speech served as the culmination of a four-day Republican rally that attracted thousands of conservative activists and elected officials to Wisconsin, a crucial swing state.With both candidates currently facing low popularity, Trump seized the opportunity presented by his near-death experience to adopt a new tone that he believes will generate more momentum in an election that seems to be shifting in his favor.Meanwhile, 81-year-old Democrat Biden faces mounting pressure from key congressional allies, donors, and even former President Barack Obama , who are concerned about his ability to secure reelection following his poor debate performance.","Donald Trump recounted his personal experience of the assassination attempt on his life during a rally at Pennsylvania rally. Trump vividly described the moment when the assassin's bullet nearly struck him, missing by a mere quarter of an inch.“There was blood pouring everywhere, yet, in a certain way I felt very safe because I had God on my side,"" Trump said.","https://static.toiimg.com/thumb/msid-111850503,imgsize-1701805,width-400,resizemode-4/111850503.jpg"
'Self-serving politician': Tulsi Gabbard slams Kamala Harris over her remarks on JD Vance,https://timesofindia.indiatimes.com/world/us/self-serving-politician-tulsi-gabbard-slams-kamala-harris-over-her-remarks-on-jd-vance/articleshow/111849823.cms,"Former US Congresswoman Tulsi Gabbard has strongly criticized US Vice President Kamala Harris for her comments against JD Vance , Donald Trump 's running mate and Gabbard accused Harris of being a self-serving politician who is unfit for office.In response to Harris's warning that Vance would only be loyal to Trump and not the country, Gabbard highlighted Vance's military service.She pointed out that Vance enlisted in the Marine Corps after the 9/11 attacks and was deployed to Iraq in 2005, the same year Gabbard herself served there. Gabbard questioned whether Harris had ever been willing to put her own life on the line for the country.In a video posted on X, Gabbard stated, ""Shortly after President Trump announced that J.D. Vance is gonna be his running mate in this election, Kamala Harris issued this scathing warning to the American people, saying, make no mistake, JD Vance will be loyal only to Trump, not to our country. The audacity that she has to say this is off the charts. She's talking about JD Vance, someone who enlisted in the Marine Corps after the terrorist attack on 9/11.""Gabbard further criticized Harris, saying, ""Kamala Harris is driven by her own political ambition. She's a self-serving politician who should not be in office.""Gabbard's comments came after Harris said that Vance would act as a ""rubber stamp"" for Trump's ""extreme"" agenda. Harris compared Vance to former US Vice President Mike Pence, suggesting that Vance would have supported Trump's efforts to overturn the 2020 election results.Meanwhile, Vance officially accepted his vice presidential nomination on Wednesday. In his acceptance speech, he introduced himself as a ""working-class boy"" who had risen from poverty to the vice presidential nomination. Vance pledged to serve all Americans and portrayed Trump as the country's last hope to restore what has been lost.","Former US Congresswoman Tulsi Gabbard has strongly criticized US Vice President Kamala Harris for her comments against JD Vance. Harris said that Vance would act as a ""rubber stamp"" for Trump's ""extreme"" agenda. Vance enlisted in the Marine Corps after the 9/11 attacks and was deployed to Iraq in 2005.","https://static.toiimg.com/thumb/msid-111849868,imgsize-1379567,width-400,resizemode-4/111849868.jpg"
Trump: Thousands gather at banquet hall to celebrate life of former fire chief killed at Trump rally,https://timesofindia.indiatimes.com/world/us/thousands-gather-at-banquet-hall-to-celebrate-life-of-former-fire-chief-killed-at-trump-rally/articleshow/111849536.cms,"FREEPORT: Thousands of mourners filed into a Pennsylvania banquet hall Thursday to remember the former fire chief who was fatally shot during the attempted assassination of former President Donald Trump , who sent a note of condolence hailing him as a hero.The crowd paying their respects to Corey Comperatore and his family appeared to be a mix of friends, neighbors and strangers who wanted to show their appreciation for the man who officials said spent his final moments shielding his wife and daughter from gunfire at the campaign rally .Fire trucks and police vehicles filled the parking lot outside the building. Sharpshooters were positioned on top of the event hall and on nearby buildings as dozens of people waited in line to enter. Among the mourners were firefighters in dress uniforms.Comperatore, 50, worked as a project and tooling engineer, was an Army reservist and spent many years as a volunteer firefighter after serving as chief, according to his obituary.Trump suffered an ear injury but was not seriously hurt and has been participating this week in the Republican National Convention in Milwaukee.Mourners filled Laube Hall, a space with white brick walls, white linens, white curtains and exposed wooden beams that's normally used for weddings and other celebratory occasions.Guests walked past a large, framed photo of Comperatore holding a fish, while a slideshow of photos from his life was projected on a screen - his wedding, a recent 50th birthday party, time with his daughters, firefighting, fishing on a lake and palling around with his beloved Dobermans.The gathering included firefighters from other nearby communities and people involved in local and state Republican politics.Rich Tallis, a Penn Hills volunteer firefighter who attended the visitation, did not know Comperatore personally but felt a need to honor his memory.""Any first responder, it's a brotherhood - police, EMS fire, military. We're technically all one,"" he said. ""When one goes, we all go.""Tables inside the hall were lined with flowers - some sent by fire departments in New York and West Virginia, an auto racing circuit and the mayor of a nearby community. Others came from people in faraway places such as Connecticut and Florida who knew of Comperatore only because of his death.The messages on the cards accompanying the arrangements praised his selflessness and dedication to his family. One said his name would be ""written in the history books.""Mourners took turns pausing in front of Comperatore's open casket, which was adorned with flower arrangements and ribbons with words such as ""dad"" and ""husband.""In a corner was a framed copy of a note to Comperatore's wife signed by Trump and former first lady Melania Trump. ""Corey will forever be remembered as a True American Hero,"" they wrote.Retired New York City Fire Department Lt. Joe Torrillo said outside the visitation that he came because Comperatore was a firefighter who lost his life the same way he lived his life - like a hero.""And, you know, a lot of people maybe wouldn't or couldn't have done what he did,"" Torrillo said.Jon Ruffley, who lives outside Pittsburgh and attended part of the Trump rally Saturday, went to the visitation with his wife and young child. He said he hoped his presence sent a supportive message to the family that ""we stick together as Americans regardless of, you know, what someone's political affiliations are.""""I think it's really important that we raise our kids in a way where we can see that political violence is unacceptable, that we stand for having important discourses about things in, in our society,"" he said.A box truck parked on a route to the banquet hall displayed video screens showing slides, including a photograph of Trump raising his fist after Saturday's shooting. It had the slogan ""never surrender"" and a message expressing prayers for Trump and Comperatore.The visitation, which was broken into a pair of two-hour blocks, was the second of two public events memorializing and celebrating Comperatore's life. Hundreds of people gathered Wednesday at a vigil for him at an auto racing track.A private funeral is scheduled for Friday. Trump is not going to the funeral because of Secret Service concerns, according to a source familiar who was not authorised to speak publicly.A statement issued Thursday by Comperatore's family described him as a ""beloved father and husband, and a friend to so many throughout the Butler region.""""Our family is finding comfort and peace through the heartfelt messages of encouragement from people around the world, through the support of our church and community, and most of all through the strength of God,"" the statement said.Dan Ritter, who gave a eulogy at Wednesday's vigil, said he bought Comperatore's childhood home in 1993, sparking a friendship that grew with their shared values of family, Christian faith and politics.""Corey loved his family and was always spending time with them,"" Ritter said. ""This past Saturday was supposed to be one of those days for him. He did what a good father would do. He protected those he loved. He's a true hero for us all.""Comperatore's pastor, Jonathan Fehl of Cabot Methodist Church in Cabot, said the family ""has been humbled by the way this community has rallied around them"" and by the support they have received from people around the world.The vigil concluded with people in the crowd lighting candles and raising cellphones, glow sticks and lighters as Comperatore's favorite song - ""I Can Only Imagine,"" by Christian rock band MercyMe - played.Two other people were wounded at the rally: David Dutch, 57, of New Kensington, and James Copenhaver, 74, of Moon Township. As of Wednesday night, both had been upgraded to serious but stable condition, according to a spokesperson with Allegheny Health Network.Joseph Feldman, an attorney for Copenhaver, said Wednesday that he had spoken with his client by phone.""He seems to be in good spirits, but he also understands the gravity of the situation,"" Feldman said. ""And he's deeply saddened about what has occurred, and he's deeply sympathetic"" to the other victims and their families.Feldman said Copenhaver suffered ""life-altering injuries,"" declining to go into detail. He said Copenhaver's priority is to ""keep up with the medical treatment he's receiving and hopefully be released at some point.""In a statement, Dutch's family thanked the ""greater western Pennsylvania community and countless others across the country and world"" for the incredible outpouring of prayers and well wishes.","Mourners filled Laube Hall, a space with white brick walls, white linens, white curtains and exposed wooden beams. Sharpshooters were positioned on top of the event hall and on nearby buildings as dozens of people waited in line to enter.","https://static.toiimg.com/thumb/msid-111849570,imgsize-1095146,width-400,resizemode-4/111849570.jpg"
US announces $203 million in new aid to war-torn Sudan amid major humanitarian crisis,https://timesofindia.indiatimes.com/world/us/us-announces-203-million-in-new-aid-to-war-torn-sudan-amid-major-humanitarian-crisis/articleshow/111849558.cms,"UNITED NATIONS: The US ambassador to the United Nations announced nearly $203 million in additional humanitarian assistance to Sudan on Thursday but warned that the money is not a ""panacea"" and urged other countries to fulfill their financial pledges to address what she called ""the world's worst humanitarian crisis.""World leaders pledged more than $2.1 billion in humanitarian aid for Sudan at a donors conference in Paris in April, but US envoy Linda Thomas-Greenfield said only about a quarter of the promised funds have been received three months later.The northeastern African country descended into chaos in April 2023 when simmering tensions between the country's military and a notorious paramilitary group, the Rapid Support Forces , exploded into open fighting in the capital of Khartoum.The devastating conflict has spread, especially to western Darfur, and has killed more than 14,000 people and wounded 33,000 others, according to the United Nations. It has also created the world's largest displacement crisis, with more than 11 million people forced to flee their homes.Thomas-Greenfield said Thursday's contribution raises total US humanitarian assistance to Sudan to $1.6 billion since September 2023, making the United States Sudan's largest single donor.""We hope this new round of aid serves as a call to action for others to follow,"" she said.The ambassador said the additional $203 million will go toward food supplies, shelters, schools and health services, as well as cash assistance to refugees to help pay their rents. The funds also will help neighboring countries, where over 2 million Sudanese refugees have fled, she said.The US mission to the UN said Thomas-Greenfield briefed UN diplomats on the hunger crisis in Sudan, where a record 25 million people face acute food insecurity and 755,000 people face famine in the coming months, according toa recent report by the UN global network monitoring the threat of famine.Human rights experts working for the United Nations said both sides have used food and starvation as a weapon of war.Thomas-Greenfield recalled her visit to a hospital in Chad run by the medical charity Doctors Without Borders: ""Children were so weak they lacked the energy to even cry.""Global humanitarian aid organization Mercy Corps recently estimated that nine in 10 children suffer from life-threatening malnutrition in central Darfur, where the World Food Program has delivered aid in recent months after facing challenges negotiating access with armed groups.Thomas-Greenfield said the US will continue diplomatic efforts to hold perpetrators of the violence accountable and reach a peace agreement between the warring parties.Last week, representatives of the two sides arrived in Geneva for separate talks with the UN secretary-general's personal envoy, Ramtane Lamamra, about protecting civilians through possible local cease-fires.UN spokesman Stephane Dujarric said late Thursday that Lamamra and his team have continued engaging separately with each of the delegations throughout this week on humanitarian assistance and protection of civilians. He said the talks are expected to conclude Friday.They marked the second attempt at deescalation after talks in Saudi Arabia's port city of Jeddah broke down at the end of last year.",The US ambassador to the United Nations announced nearly $203 million in additional humanitarian assistance. World leaders pledged more than $2.1 billion in humanitarian aid for Sudan at a donors conference in April. US envoy Linda Thomas-Greenfield said only about a quarter of the promised funds have been received.,"https://static.toiimg.com/thumb/msid-111849641,imgsize-932120,width-400,resizemode-4/111849641.jpg"
'Meat & potatoes guy who cooks Indian food',https://timesofindia.indiatimes.com/world/us/meat-potatoes-guy-who-cooks-indian-food/articleshow/111849007.cms,"Usha Vance introduced herself to America on Wednesday night during a prime-time speech at the RNC. She leaned into the story of her romance with V-P nominee JD Vance, highlighting their different backgrounds. ""When JD met me, he approached our differences with curiosity and enthusiasm,"" she said. ""He wanted to know everything about me, where I came from, what my life had been like."" She praised Vance for embracing her background and customs.""Although he's a meat and potatoes kind of guy, he adapted to my vegetarian diet and learned to cook food for my mother, Indian food.""","Usha Vance introduced herself to America on Wednesday night during a prime-time speech at the RNC. She leaned into the story of her romance with V-P nominee JD Vance. ""When JD met me, he approached our differences with curiosity and enthusiasm,"" she said.","https://static.toiimg.com/thumb/msid-111849042,imgsize-61221,width-400,resizemode-4/111849042.jpg"
"FBI officials say gunman's phone had details about both Trump, Biden",https://timesofindia.indiatimes.com/world/us/fbi-officials-say-gunmans-phone-had-details-about-both-trump-biden/articleshow/111848999.cms,"A sniper spotted gunman

'20 min before shooting'

FBI officials told members of Congress on Wednesday that the gunman who tried to kill ex-Prez Donald Trump used his cellphone and other devices to search images of Trump and Prez Joe Biden , along with an array of public figures.The 20-year-old gunman, Thomas Matthew Crooks , also looked up dates of Trump's appearances and the Democratic National Convention, according to people on two conference calls held to answer lawmakers' questions.The disclosures, made during private briefings to lawmakers by the FBI and the head of the embattled Secret Service , offered the most complete portrait so far of a would-be assassin with no criminal history, or even clearly discernible political beliefs. Still, no clear motive for the attack has emerged.The FBI has been scouring Crooks' possessions, including two phones and at least one laptop, for clues about his motive. So far, they have found no indication that Crooks, who was a registered Republican, had strong partisan political views one way or another, bureau officials told lawmakers. Nor have they uncovered any evidence of co-conspirators or connections to foreign actors. The officials told lawmakers that there was some indication that the gunman, who led a quiet life and worked at a nursing home near his house, might have been struggling with depression. Officials said he had looked up ""major depressive disorder"".Among the other prominent figures the gunman searched for using one of his phones: FBI Director Christopher Wray; attorney general Merrick Garland; and a member of the British royal family, according to two sources. Wray, who was also on the calls, cautioned that the probe was still in early stages.Kimberly Cheatle, the director of the Secret Service, acknowledged during one of the calls that her agency made serious ""mistakes"", and provided new information about Crooks' movements during the shooting. During the briefing with senators, officials ran through a timeline of events, noting that law enforcement officers had identified the gunman as suspicious about an hour before the shooting but then lost track of him. About 20 minutes before the shooting, a sniper spotted him again, the sources said. Some senators left their call angry with the Secret Service after learning that officers did not intervene before he opened fire.","The 20-year-old gunman, Thomas Matthew Crooks, also looked up dates of Trump's appearances and the Democratic National Convention, according to people on two conference calls held to answer lawmakers' questions. The FBI has been scouring Crooks' possessions, including two phones and at least one laptop, for clues about his motive.","https://static.toiimg.com/thumb/msid-47529300,imgsize-110164,width-400,resizemode-4/47529300.jpg"
