Article Title,Article Link,Article Text,Article Summary,Article Image
Kamala Harris: Laura Loomer now attacks Kamala Harris on religion. 'Has anyone asked her?',https://timesofindia.indiatimes.com/world/us/laura-loomer-now-asks-what-kamala-harris-religion-is-has-anyone-asked-her/articleshow/113771461.cms,"Far right activist and provocateur Laura Loomer again sharpened her attack on vice president Kamala Harris as she asked what Kamala Harris' religion is. ""Has anyone asked her?"" Laura posted on X as Kamala Harris recently confirmed that she would skip the AI Smith dinner scheduled for October 17. Donald Trump, however, said he will attend the dinner. Kamala Harris' team said she would be willing to attend the fundraiser as president if she's elected but on Oct 17, she will be busy campaigning.Kamala Harris' absence will make her the second major-party candidate to decline an invitation in over six decades and the first since Walter Mondale did not attend the event in 1984.Laura Loomer raised a storm after she attacked Kamala Harris' ethnicity and said if she wins the presidential election, the White House will smell of curry -- a jibe at Kamala Harris' Indian ethnicity. The attack did not get approval from the Republican party and Donald Trump distanced himself from Laura Loomer's vile comment. Several Republican veterans opposed Laura Loomer and said Loomer does not represent the GOP.Loomer herself said her allegiance is not to the GOP but only to Donald Trump. The former president called Laura Loomer a private citizen, a supporter who does not work for him or for his campaign but Loomer's closeness with Trump certainly raised eyebrows.As far as Kamala Harris' religion is concerned, Harris earlier said that as a child she was introduced to both Hinduism and Christianity and now she's married to Jewish Doug Emhoff.“She has a unique and interesting religious identity. ... She’s been part of both mainline American Baptist churches and Hindu fellowships, and she’s married to a Jewish man,” said Nathan Finn, senior fellow on religious liberty with the Southern Baptist Convention’s Ethics & Religious Liberty Commission.A Texas-based evangelist Lance Wallnau recently accused Kamala Harris of practicing witchcraft. ""She can look presidential. That’s the seduction of what I would say is witchcraft. That’s the manipulation of imagery that creates an impression contrary to the truth, but it seduces you into seeing it. So that spirit, that occult spirit, I believe is operating on her and through her,"" he said.","Far right activist Laura Loomer again sharpened her attack on vice president Kamala Harris. ""Has anyone asked her?"" Laura posted on X as KamalaHarris recently confirmed that she would skip the AI Smith dinner scheduled for October 17. Donald Trump, however, said he will attend the dinner.","https://static.toiimg.com/thumb/msid-113771451,imgsize-1663282,width-400,resizemode-4/113771451.jpg"
Hurricane Helene leaves North Carolina mountain towns in ruins; Art of Living centre impacted,https://timesofindia.indiatimes.com/world/us/hurricane-helene-leaves-north-carolina-mountain-towns-in-ruins-art-of-living-centre-impacted/articleshow/113770734.cms,"Hurricane Helene ’s violent onslaught left families in North Carolina 's mountain regions, including Boone , isolated. Access routes were cut off by landslides and flooding , making it impossible for rescue teams to reach the area.Boone, known for its scenic beauty, also houses the Art of Living retreat center, a tranquil sanctuary set amidst 380 acres of forest high in the Blue Ridge Mountains.The retreat center too wasn’t spared from Helene’s destructive path.""The property faced power outages, damage to the meditation hall, broken windows, fallen trees on power lines, and roof damage, but the team worked tirelessly to ensure minimal disruption. The kitchen team, operating with only a small generator, continued to serve three meals a day to all 150 guests at the Retreat Center,"" Venkat Srinivasan, PhD, director of operations at Art of Living retreat center said in a statement.In response to the wider community's needs, Art of Living volunteers stepped up, providing essentials such as water and food to local residents affected by the storm. ""As 100 more guests arrive for weeklong retreats, the center continues to serve as a healing sanctuary for all,"" Srinivasan added in the statement.Images and videos from Boone show downtown submerged under several feet of water, with residents trapped in their homes, battling the overwhelming force of nature.Helene made landfall late Thursday as a Category 4 hurricane in Florida’s Big Bend region. From there, it swiftly tore through Georgia, the Carolinas, and Tennessee, leaving a trail of destruction.Trees were uprooted, homes splintered, and rivers and creeks swelled beyond their banks, threatening infrastructure like dams.At least 52 fatalities have been reported till now across five states—23 in South Carolina, 11 in Florida, and additional deaths in Georgia, North Carolina, and Virginia. Authorities warn that these numbers may climb as rescue efforts continue and the full extent of the storm’s damage is revealed.In Western North Carolina, major roadways such as Interstate 40 have been shut down due to landslides and flooding, further isolating communities like Asheville, which saw large portions of the city submerged.Preliminary damage estimates suggest that Helene’s wrath could cost between $15 billion to $26 billion in property damage. Experts also warn that climate change has contributed to the rapid intensification of storms like Helene, as warmer waters fuel their growth, transforming them into powerful, destructive cyclones in a matter of hours.","Hurricane Helene's violent onslaught left families in North Carolina's mountain regions isolated. Access routes were cut off by landslides and flooding, making it impossible for rescue teams to reach the area. Art of Living retreat center, a tranquil sanctuary set amidst 380 acres of forest high in the Blue Ridge Mountains, was not spared.","https://static.toiimg.com/thumb/msid-113771241,imgsize-1416063,width-400,resizemode-4/113771241.jpg"
Derrick Anderson: This Republican politician 'borrows' wife and children for photoshoot,https://timesofindia.indiatimes.com/world/us/this-republican-politician-borrows-wife-and-children-for-photoshoot/articleshow/113769984.cms,"Republican Derrick Anderson who is running in a close race for Virginia's seventh congressional district was seen with his 'family' in a photoshoot. It was weird because the woman he was seen with was not his wife and the children were not his -- everything was borrowed from his longtime friend. Anderson is engaged but not yet married and childless and lives with his dog.New York Times reached out to Anderson for his fake photoshoot and a spokesperson criticized the focus of the footage and said that every other candidate in America are seen in similar photos. The spokesperson said nowhere it was claimed that they were Anderson's wife or children. Anderson was with his ""female supporters and children"", the spokesperson said explaining that nothing was fake.""The footage has not yet been used in any ad. It can be found on Mr. Anderson’s official YouTube page and is also posted on a website paid for by the National Republican Campaign Committee, where the organization provides resources for independent outside groups that are not allowed to communicate directly with campaigns but can use the information posted there to guide their paid media strategy,"" NYT reported.The report said that Republican candidates are looking to gain support among the women amid the abortion row and many Republican leaders' general stance on women. GOP's vice presidential candidate JD Vance drew flak for his past ""childless cat ladies"" comment which seemingly antagonized many women.Social media users trolled Anderson for ""borrowing"" a family. ""You have a beautiful family. Where did you rent them?"" one asked. ""Dude, this deception just tanked your campaign. Be honest, That's all the people want,"" another offered a piece of advice.""Childless Dog Man had to borrow a friend's family for his advertising to fit into JD Vance's narrative..."" one wrote.""Run on your values not the GOPs lies. If you’re a moral candidate you will be supported. Don’t fall into Vance’s childless cat lady claims. Sad very sad and shame on you,"" another wrote.""Dear @JDVance: You said that people without children “don’t really have a direct stake” in our country. Do you think that applies to GOP candidate Derrick Anderson, who doesn’t have children but is trying to mislead voters by renting a family in his pictures? Asking for a friend,"" one user charged JD Vance to answer.",Derrick Anderson is running in a close race for Virginia's seventh congressional district. The woman he was seen with was not his wife and the children were not his -- everything was borrowed from his longtime friend. Anderson is engaged but not yet married and childless and lives with his dog.,"https://static.toiimg.com/thumb/msid-113770027,imgsize-851536,width-400,resizemode-4/113770027.jpg"
"Maya Harris: Kamala Harris' sister says she will call her 'Madam President' when she's elected, 'Until then...'",https://timesofindia.indiatimes.com/world/us/kamala-harris-sister-says-she-will-call-her-madam-president-when-shes-elected-until-then-/articleshow/113767203.cms,"Is Maya Harris surprised that her sister is contesting for US President?

Kamala Harris' sister Maya Harris said when Kamala Harris is elected the president of the United States, she will call her Madam President and until then she is big sister Kamala who will always have her back and vice versa. In an interview to the People, Maya Harris said the campaign against Donald Trump is an uphill journey and Kamala Harris campaign is the underdog though the race is very tight.57-year-old Maya, a lawyer and a public policy advisor, said she is very proud to be part of Kamala Harris' presidential campaign and the feeling is extraordinary, electric.""I am just so proud to be able to be out there in these states encouraging people to knock on every door, call every voter, text their friends and family members between now and Election Day, to really have those personal conversations that help people learn who Kamala is, what she's fighting for, why they believe in her,"" Maya told People magazine.In the interview, as Maya recounted their childhood days and how they were brought up by a hardworking mother who used to take the two sisters to her lab on weekends and gave them some work so that they just did not idle their time away, Maya said Kamala has always been fearless, relentless, tough and courageous. ""She's never backed down from a challenge.""""She has always demonstrated leadership qualities from a very young age. She always stood up and has used her voice for good. But at the end of the day, these roles that she's had or that she has sought are about impact.""Their mother Shyamala Gopalan Harris, a breast cancer researcher, immigrated to the United States from India. ""We watched our mother work long hours. She took us to her lab on the weekends. She gave us jobs to do while we were there, filing papers and cleaning beakers and pipettes so that we weren't idle and that we found some way to contribute.""","Maya Harris said she is very proud to be part of Kamala Harris' presidential campaign. She said the campaign against Donald Trump is an uphill journey. Maya said Kamala has always been fearless, relentless, tough and courageous. Their mother Shyamala Gopalan Harris, a breast cancer researcher, immigrated to the United States from India.","https://static.toiimg.com/thumb/msid-113767208,imgsize-826536,width-400,resizemode-4/113767208.jpg"
RFK Jr and Olivia Nuzzi had 'incredible' FaceTime sex: Report,https://timesofindia.indiatimes.com/world/us/rfk-jr-and-olivia-nuzzi-had-incredible-facetime-sex-report/articleshow/113766497.cms,"Here's what happened between Kennedy Jr and Olivia Nuzzi

Olivia Nuzzi's ex-fiance called Kennedy Jr

Olivia Nuzzi , the 31-year-old reporter who has been placed on leave because of her relationship with Donald Trump ally RFK Jr , was creeped out by the 70-year-old politician initially, but then the two had incredible FaceTime sex, a new report by Page Six claimed. The relationship has become the most sensational thing this election season as there have been claims, rebuttals etc surrounding this affair.New York magazine reporter Olivia Nuzzi acknowledged her sexting relationship with Kennedy Jr. Without naming the politician, she said she grew closer to a former subject of her interview. Nuzzi interviewed Kennedy Jr last year for a profile. Following that, they apparently started messaging each other.Kennedy Jr denied any involvement and said he met Nuzzi only once for that interview.Kennedy's camp claimed that Nuzzi was the aggressor who used to send nudes to the politician. Kennedy Jr blocked her but Nuzzi tricked him into unblocking her.Nuzzi's camp said Kennedy Jr during the interview grabbed Nuzzi's arm which she found disgusting.The new revelation that they had FaceTime sex is part of the charges-counter charges that the two camps are lobbing at each other. Sources told Page Six that Nuzzi was first disgusted by Kennedy Jr after he made a clumsy pass at her. But then Kennedy Jr ""love bombed"" her which went well and Nuzzi was ""madly in love"" with him. There were long calls, endless texts and virtual sex which ruined Nuzzi's relationship with her fiance Ryan Lizza, who was a journalist with Politico.Ryan Lizza, according a report, called Kennedy Jr after he uncovered his fiancee' digital relationship with the former presidential candidate. The call was a heated one, Vanity Fair reported. Following the call, Lizza ended his relationship with Nuzzi, the report said. After the scandal became public, Ryan Lizza issued a statement that he won't cover Kennedy Jr because of his connection to the entire row through Nuzzi.","New York magazine reporter Olivia Nuzzi acknowledged her sexting relationship with Kennedy Jr. The relationship has become the most sensational thing this election season as there have been claims, rebuttals etc surrounding this affair. Kennedy Jr denied any involvement and said he met Nuzza only once for that interview.","https://static.toiimg.com/thumb/msid-113766465,imgsize-1626510,width-400,resizemode-4/113766465.jpg"
North Carolina lieutenant governor gets second-degree burns during a campaign event,https://timesofindia.indiatimes.com/world/us/north-carolina-lieutenant-governor-gets-second-degree-burns-during-a-campaign-event/articleshow/113761011.cms,"Mark Robinson (Picture credit: AP)

North Carolina 's lieutenant governor, Mark Robinson on Friday sustained second-degree burns and received medical treatment at Northern Regional Hospital after being injured during a campaign event at the Mayberry Truck Show in Mount Airy.The incident occurred when Robinson, 56, leaned against a hot truck and reportedly burned his hand while attending the truck show as part of his gubernatorial campaign .Mike Lonergan, the campaign's communications director, confirmed the incident and assured the public that the governor is currently in good spirits .""He is in good spirits, appreciates the outpouring of well wishes, and is excited to return to the campaign trail as scheduled first thing tomorrow morning,"" said Lonergan."" Lieutenant Governor Mark Robinson is currently being treated for burns following an incident at a campaign event in Mount Airy,"" Matt Hurley , a campaign staffer for Robinson posted on X.Despite the injury, Robinson plans to resume his campaign activities on Saturday, with four scheduled stops.Robinson has served as lieutenant governor since 2021 and is running for governor against Democratic nominee Josh Stein , the current attorney general. Governor Roy Cooper is barred from running again due to term limits.The campaign has faced recent challenges, with some Republicans distancing themselves from Robinson after a CNN report accused him of posting offensive comments online. Robinson has denied these allegations and hired a law firm to investigate the matter.","North Carolina's lieutenant governor Mark Robinson sustained second-degree burns and received medical treatment at Northern Regional Hospital. Incident occurred when Robinson, 56, leaned against a hot truck and reportedly burned his hand. Robinson plans to resume his campaign activities on Saturday, with four scheduled stops.","https://static.toiimg.com/thumb/msid-113763833,imgsize-674544,width-400,resizemode-4/113763833.jpg"
US presidential elections: Kamala Harris vows to fix broken immigration system,https://timesofindia.indiatimes.com/world/us/us-presidential-elections-kamala-harris-vows-to-fix-broken-immigration-system/articleshow/113760462.cms,"As Kamala Harris paid her first visit to the southern borders after becoming the presidential candidate, the Democrat vowed to the broken immigration system of the States.""As your president, I will protect our nation’s sovereignty, secure our border, and work to fix our broken system of immigration. And I will partner with Democrats, Republicans, and Independents to do it,"" she said in a post on X.""As Attorney General of California, I prosecuted transnational criminal organizations that trafficked guns, drugs, and human beings.I know the importance of safety and security, especially at our border. Today, I visited the US-Mexico border and spoke with Customs and Border Protection officials about our progress to secure our border and disrupt the flow of illegal fentanyl into our nation,"" she said as she shared the pictures of the visit.Harris, drawing from her experience as a former attorney general of a border state, emphasized her comprehension of the significance of border security and law enforcement. She highlighted her role in prosecuting transnational criminal organizations involved in the illegal trade of firearms, narcotics, and human trafficking.""On behalf of all communities across our nation that want to see these problems solved I say: We cannot accept Donald Trump's failure to lead. We should not permit scapegoating instead of solutions. Or rhetoric instead of results,"" she said.Criticising this, Trump said, ""She let our cities fail violent gangs. She let our American sons and daughters be raped and murdered at the hands of vicious monsters. She let American communities be conquered. You go out to Aurora in Colorado, where they're taking over with AK-47s. They're taking over real estate. Kamala turned cherished small towns into blighted refugee camps.""","Kamala Harris visited the US-Mexico border and spoke with Customs and Border Protection officials. She highlighted her role in prosecuting transnational criminal organizations involved in the illegal trade of firearms, narcotics, and human trafficking. Trump said, ""She let our cities fail violent gangs. She let our American sons and daughters be raped and murdered""","https://static.toiimg.com/thumb/msid-113760857,imgsize-1199589,width-400,resizemode-4/113760857.jpg"
Georgia homeowner sues coun​ty after demolition of his property without court hearing,https://timesofindia.indiatimes.com/world/us/georgia-homeowner-sues-county-after-demolition-of-his-property-without-court-hearing/articleshow/113759852.cms,"Eric Arnold and his Georgia house (Picture credit: Andrew Wimer X handle)

A Georgia homeowner has taken legal action against Macon-Bibb County officials, accusing them of demolishing his property without a court hearing .Eric Arnold bought the house in Macon, Georgia, in February 2022 for $15,000, which he planned to renovate for himself and his children. Arnold was renovating the property when a dumpster appeared on the site, and his house was labeled an “imminent threat to the community.” The house was demolished in November 2023.Arnold’s lawyers argue that he was unaware of any demolition plans and found no public record of Code Enforcement against the property when he purchased it.They claim Arnold had paid his taxes and obtained the necessary permits to save the home.Arnold expressed his frustration, saying, as quoted by the New York Post, “I did everything I was supposed to do. I thought I was okay. I wasn’t okay. They still knocked my house down.”Attorney Christie Herbert claimed that the county fast-tracked the demolition despite Arnold’s requests to remove the house from the list. “While he still had work to do, the yard was neat, the exterior was clean, the house was locked up, and, most importantly, it was in a vastly improved state of repair compared to when he purchased it,” Herbert said, as quoted by the New York Post.“Eric’s lawsuit isn’t just about one man’s house; it’s about protecting the constitutional rights of all property owners in Macon-Bibb County,” Herbert said during a press conference.Arnold has sought compensation for the house’s purchase and renovation costs.Macon-Bibb County officials said that they are aware of the demolition on Sunnyvale Drive. A letter was issued several years ago, designating the property as a Nuisance Per Se and blighted, with a notice that it would be torn down if not repaired, officials added.According to officials, the property was marked as blighted before Arnold’s purchase, and they hadn’t been informed of any construction permits or repairs in the past 20 months.","Eric Arnold bought the house in Macon, Georgia, in February 2022 for $15,000, which he planned to renovate for himself and his children. Arnold was renovating the property when a dumpster appeared on the site, and his house was labeled an “imminent threat to the community. The house was demolished in November 2023.","https://static.toiimg.com/thumb/msid-113760959,imgsize-1011099,width-400,resizemode-4/113760959.jpg"
