Article Title,Article Link,Article Text,Article Summary,Article Image
"Uncrewed aerial system launched from Yemen's Houthi area, no injuries reported, CENTCOM says",https://timesofindia.indiatimes.com/world/middle-east/uncrewed-aerial-system-launched-from-yemens-houthi-area-no-injuries-reported-centcom-says/articleshow/110047467.cms,"An uncrewed aerial system was launched from a Houthi-controlled area of Yemen into the Gulf of Aden on Friday, with no injuries or damage reported by US, coalition, or commercial ships, US Central Command ( CENTCOM ) said on Saturday.CENTCOM later said it had destroyed three aerial systems launched from a Houthi-controlled area of Yemen into the Red Sea.","An uncrewed aerial system was launched from a Houthi-controlled area of Yemen into the Gulf of Aden on Friday. No injuries or damage reported by US, coalition, or commercial ships, US Central Command ( CENTCOM ) said on Saturday. CENTCOM later said it had destroyed three aerial systems launched into the Red Sea.","https://static.toiimg.com/thumb/msid-110047497,imgsize-5736,width-400,resizemode-4/110047497.jpg"
"Amid renewed assault, Russia 'capture' five villages in northeast Ukraine",https://timesofindia.indiatimes.com/world/europe/amid-renewed-assault-russia-capture-five-villages-in-northeast-ukraine/articleshow/110046450.cms,"NEW DELHI: Russia has claimed the capture of five villages in Ukraine 's northeastern Kharkiv region , escalating tensions in the ongoing conflict . President Volodymyr Zelenskyy has urgently appealed for military aid as Ukrainian troops engage in counterattacks to thwart Russian advances.Moscow's defense ministry announced the ""liberation"" of five villages in Kharkiv near the Russian border, along with the seizure of one village in the Donetsk region.This offensive follows Russia's reported incursion into the Kharkiv region, marking small advancements into a border zone from which it had been repelled nearly two years ago.President Zelenskyy, in a televised address, emphasized the imperative of disrupting Russian offensive plans, labeling it as the country's top priority. Heavy fighting has been reported in the border area, prompting the evacuation of 1,775 individuals. Tragically, two men were killed and two others wounded by guided aerial bomb attacks in the town of Vovchansk.Despite assurances from Kharkiv regional governor Oleg Synegubov that there is currently no imminent ground operation threat to the city of Kharkiv, residents from border areas have fled in fear. Evacuees, many of whom are elderly, have sought refuge at reception centers near Kharkiv, receiving essential assistance.The situation remains precarious, with aid workers highlighting the challenges of evacuating residents amid ongoing troop movements and heightened danger. Zelenskyy reiterated the urgent need for international support, stressing the importance of timely arms deliveries to bolster Ukrainian defenses.Meanwhile, Ukrainian forces have intensified attacks inside Russia and Russia-held territories, targeting energy infrastructure. In a retaliatory strike, a missile hit a restaurant in the Russian-held city of Donetsk, claiming three lives and injuring several others.Analysts speculate that Russia's ground operation aims to establish a buffer zone near its Belgorod region or divert Ukrainian resources from the Donetsk region. Despite Washington's announcement of a $400 million military aid package for Ukraine and assurances of its capability to repel fresh Russian campaigns, the situation on the ground remains volatile.","Moscow's defense ministry announced the ""liberation"" of five villages in Kharkiv near the Russian border. Heavy fighting has been reported in the border area, prompting the evacuation of 1,775 individuals. Tragically, two men were killed and two others wounded by guided aerial bomb attacks in the town of Vovchansk.","https://static.toiimg.com/thumb/msid-110046456,imgsize-32326,width-400,resizemode-4/110046456.jpg"
"US 'alarmed,' 50,000 protest Georgia's foreign agent bill",https://timesofindia.indiatimes.com/world/us/us-alarmed-50000-protest-georgias-foreign-agent-bill/articleshow/110044131.cms,"TBILISI: About 50,000 opponents of a ""foreign agents"" bill marched peacefully in heavy rain through the Georgian capital on Saturday, after the United States said the country had to choose between the ""Kremlin-style"" law and the people's Euro-Atlantic aspirations .""We are deeply alarmed about democratic backsliding in Georgia ,"" White House national security adviser Jake Sullivan wrote on X.""Georgian Parliamentarians face a critical choice - whether to support the Georgian people's EuroAtlantic aspirations or pass a Kremlin-style foreign agents' law that runs counter to democratic values,"" he said. ""We stand with the Georgian people.""The bill, which would require organisations receiving more than 20% of their funding from abroad to register as ""agents of foreign influence"", has touched off a rolling political crisis in Georgia, where thousands have taken to the streets to demand the bill be withdrawn.The crowd on Saturday waved Georgian, European Union and some Ukrainian flags and in a break with the past, included more older protesters as well as the many young people who have thronged the streets over the past month.""The government should hear the free people of Georgia,"" said one protester in her 30s who gave her name as Nino, waved a large Georgian flag and led one of three columns that converged on the city centre, which blocked much of the city's roads and filled the cobblestoned heart of Tbilisi's old town.""We want to enter the European Union with our proud nation and our dignity,"" she said.Anuki, a 22-year-old student of acting, said it was her generation's responsibility ""to make sure that our future and the future of generations after us are safe, that they have freedom of speech, and they are free, basically.""""And we don't want to be part of Russia,"" she added. ""We never wanted to be part of Russia. And it has always been and always will be our goal to be part of Europe.""Parliament, which is controlled by the ruling Georgian Dream party and its allies, will begin committee hearings on the bill's third and final reading on Monday. Opposition groups had called for a fresh wave of protests from Saturday.The crisis has pitted the Georgian Dream ruling party against a coalition of opposition parties, civil society, celebrities and the country's figurehead president, with mass demonstrations shutting down much of central Tbilisi almost nightly for more than a month.Georgian opponents of the bill have dubbed it ""the Russian law"", comparing it to legislation used to target critics of President Vladimir Putin's Kremlin.The European Union, which granted Georgia candidate status in December, has said that the bill will pose a serious obstacle to further integration if passed.Georgian Dream says the bill will promote transparency and Georgian national sovereignty.Bidzina Ivanishvili, the founder of Georgian Dream, has said the law is necessary to stop the West trying to use Georgians as ""cannon fodder"" in a confrontation with Russia.Sullivan said that Georgian Dream appeared to be deliberately trying to break with the West, even as both the ruling party and Georgian public opinion has traditionally been in favour of the country's joining the EU and the U.S.-led NATO military alliance.Sullivan wrote: ""Georgian Dream's recent rhetoric, proposed legislative changes, and actions go against the aspirations of the Georgian people and are designed to isolate Georgians from the United States and Europe.""","U.S. says Georgia must choose between ""Kremlin-style"" law and Euro-Atlantic aspirations. Bill would require organisations receiving more than 20% of their funding from abroad to register as ""agents of foreign influence"" Opposition groups had called for a fresh wave of protests from Saturday.","https://static.toiimg.com/thumb/msid-110044243,imgsize-1081467,width-400,resizemode-4/110044243.jpg"
Joe Biden wants to remind 2024 voters of a record and an agenda. Often it's Donald Trump's,https://timesofindia.indiatimes.com/world/us/joe-biden-wants-to-remind-2024-voters-of-a-record-and-an-agenda-often-its-donald-trumps/articleshow/110043097.cms,"SEATTLE: President Joe Biden is running for reelection on a record and an agenda -- often Donald Trump ’s.In a hotel ballroom in Seattle, at fancy homes in California and at stops in Illinois and Wisconsin over the past week, Biden has been betting that reminding voters about Trump's presidency and highlighting his Republican opponent's latest campaign statements will work to the Democrat's advantage.At a Seattle fundraiser Friday night, Biden brought up Trump's recent interview with Time magazine in which Trump said states should be left to determine whether to prosecute women for abortions or to monitor their pregnancies.“I really urge you to read it,” Biden said.Biden, who headlined another Seattle fundraiser Saturday before returning to the East Coast, has plenty of other Trump material to draw from, too.The president highlights how Trump has promised, if elected, to be “a dictator on Day 1”, how he has suggested the United States would not necessarily defend allies from aggression and how he has pledged to “totally obliterate the deep state” in the federal bureaucracy, which he blames for blocking his first-term agenda.“And he said a whole lot more,” Biden said during a Chicago appearance. “But the bad news is he means what he says. He means what he says. Unless you think I’m kidding, just think back to the 6th of January. This guy means what he says,” referring to the riot at the U.S. Capitol on Jan. 6, 2021.Biden wants the 2024 to be a referendum on Trump's record and plans, but he also wants voters to look favorably on his own policies and actions.Biden and his allies think the country needs reminding about Trump's tenure and his outlandish and often concerning statements, particularly because the Republican is no longer ubiquitous on X, formerly Twitter, nor is he in front of television cameras as often as he once was.“Chaos is nothing new for Trump,” Biden said in Chicago. “His presidency was chaos. Trump is trying to make the -- the country forget about the dark and unsettling things that he did when he was president. Well, we’re going to not let them forget.”Biden frequently highlights Trump's efforts to overturn the results of the 2020 election and how he stood by when supporters violently stormed the Capitol as Congress met to certify his loss to Biden. He also points to Trump separating children from their families at the U.S.-Mexico border, tax cuts the Republican pushed through that benefited corporations and the wealthy and his repeated efforts to overturn the Affordable Care Act.Biden's barbs have been getting sharper of late.He opened his Seattle fundraiser on Friday night by telling donors, “Thank you for the warm welcome. Please keep it down, because Donald Trump is sleeping. Sleepy Don.” That was a riff off of news reports that the former president has dozed off during his criminal trial in a New York courtroom. Trump has pleaded not guilty to charges in a hush money scheme to illegally influence the 2016 presidential election.Biden also talks about Trump’s admiration for Russian President Vladimir Putin and his self-described “love letters” with Kim Jong Un, the authoritarian leader of North Korea.Biden frequently jabs at Trump for wondering aloud during the COVID-19 pandemic whether disinfectants could be injected or ingested to fight the virus. “That bleach he didn’t inject in his body; he just put it in his hair,” Biden says to laughter every time. “But, look, he’s got more hair than I do.”Trump's campaign said in a statement that “their records speak for themselves. President Trump created the most secure border in history and peace in the world. President Trump was the first president in modern history not to enter the U.S. in any new wars. Joe Biden’s weakness has led to wars in Ukraine and the Middle East, an immigrant invasion of our border, anti-Semitic protests on our college campuses, and crime and chaos in every American city.”Trump doesn't hesitate to criticize Biden and his policies. Trump is spending much of his time lately sitting in court. But before and after the proceedings, he often stands in front of cameras outside the courtroom and goes after Biden.At a recent Wisconsin rally, Trump mentioned Biden within the first 2½ minutes of his speech and referenced the president or his administration more than 60 times during his remarks.Trump's criticism often takes a dark turn. Last weekend, he told donors at his Florida resort that Biden was running a “Gestapo administration.""The Gestapo was the secret police force of the Third Reich that squelched political opposition generally and, specifically, targeted Jewish people for arrest during the Holocaust. Trump’s unfounded comparison to Nazi-era tactics is part of his effort to deny and deflect the charges against him, most notably his effort to overturn Biden’s 2020 victory.Biden's strategy is a gamble. Voters are divided in their views of both men's presidencies.An April poll from The Associated Press-NORC Center for Public Affairs Research found that nearly half thought Trump’s presidency hurt the country on voting rights and election security, relations with foreign countries, abortion laws and climate change. But more than half of U.S. adults thought Biden’s presidency hurt the country on cost of living and immigration.For all his criticism of Trump, Biden does get around to talking about his agenda and accomplishments. He tells supporters about his work to boost the economy and to bring the country out of the pandemic. He discusses his support for abortion rights even as he highlights how Trump has taken credit for the overturning of Roe v. Wade in part because of his Supreme Court nominations.“Folks, the choice is clear,” Biden told supporters recently in the nation's capital. “Donald Trump’s vision of America is one of revenge and retribution.”“I’ve never been more optimistic about America’s chances,” he went on. “Not because I’m president, because of the state of the moment. The world needs us.”","President Joe Biden is running for reelection on a record and an agenda -- often Donald Trump ’s. Biden has been betting that reminding voters about Trump's presidency will work to the Democrat's advantage. The president highlights how Trump has promised, if elected, to be “a dictator on Day 1”","https://static.toiimg.com/thumb/msid-110043110,imgsize-210718,width-400,resizemode-4/110043110.jpg"
Trump may face a $100 million-plus tax bill if he loses IRS audit fight over Chicago tower: Report,https://timesofindia.indiatimes.com/world/us/trump-may-face-a-100-million-plus-tax-bill-if-he-loses-irs-audit-fight-over-chicago-tower-report/articleshow/110042759.cms,"WASHINGTON: Former US president Donald Trump may face an IRS bill in excess of $100 million after a government audit indicates he double-dipped on tax losses tied to a Chicago skyscraper, according to a report by The New York Times and ProPublica that drew on a yearslong audit and public filings.The report's findings could put renewed focus on Trump's business career as the presumptive Republican nominee tries to regain the White House after losing in 2020.Trump used his cachet as a real estate developer and TV star to build a political movement, yet he has refused to release his tax filings as past presidential candidates have. The tax filings that the public does know about have come from past reporting by the Times and a public release of records by Democrats on the House Ways and Means Committee in 2022.Trump's presidential campaign provided a statement in son Eric Trump's name saying the IRS inquiry “was settled years ago, only to be brought back to life once my father ran for office. We are confident in our position.”The tax records cited by the report indicate that Trump twice deducted losses on the Trump International Hotel and Tower, which opened in 2009 near the banks of the Chicago River that cuts through that city's downtown.The report said Trump initially reported losses of $658 million in his 2008 filings under the premise that the property fit the IRS definition of being “worthless” because condominium sales were disappointing and retail space went unfilled amid a deep US recession.But in 2010, the published report said, Trump transferred the ownership of the property to a different holding company that he also controlled, using the move to save money on taxes by reporting an additional $168 million in losses over the next decade on the same property.The report did not have any updates on the status of the IRS inquiry since December 2022, but said Trump could owe more than $100 million, including penalties, if he were to lose the audit battle.Trump, meanwhile, is appealing a New York judge's ruling from February after a civil trial that Trump, his company and top executives lied about his wealth on financial statements, conning bankers and insurers who did business with him. In early April, Trump posted a $175 million bond, halting collection of the more than $454 million he owes from the judgment and preventing the state from seizing his assets to satisfy the debt while he appeals.Democrat President Joe Biden has said that Trump largely owes his fortune to an inheritance from his father, rather than through his own financial acumen. Biden has gone after Trump for not wanting to pay taxes, while his administration has increased IRS funding in order to increase audits of the ultra-wealthy and improve compliance with the federal tax code.The Trump campaign opposes the additional funding that Biden and Democrats provided to the IRS. At campaign rallies, Trump has said the United States would be destroyed as a country unless his 2017 tax cuts that are largely set to expire after 2025 are extended.",Former US president Donald Trump may face an IRS bill in excess of $100 million. A government audit indicates he double-dipped on tax losses tied to a Chicago skyscraper. Trump used his cachet as a real estate developer and TV star to build a political movement.,"https://static.toiimg.com/thumb/msid-110042825,imgsize-31870,width-400,resizemode-4/110042825.jpg"
Climate catastrophe in Brazil spawns conspiracy theories,https://timesofindia.indiatimes.com/world/europe/climate-catastrophe-in-brazil-spawns-conspiracy-theories/articleshow/110042699.cms,"The climate catastrophe that has struck southern Brazil , killing more than a hundred people, has also spawned a spate of bizarre and baseless conspiracy theories. Several of these have gone viral on social media.""What's happening in Rio Grande do Sul is definitely not natural,"" one woman said on X. ""Let's open our eyes!"" She blamed something called HAARP -- the High-frequency Active Auroral Research Program -- a US project that studies the ionosphere using huge antennas in Alaska.Other people have posted images of airplanes crisscrossing the skies over Brazil's hard-hit state of Rio Grande do Sul, saying the trails of condensation left by jets contain toxic chemicals as part of a secret and nefarious governmental programme , orchestrating ""planned tragedies"" for murky motives.",The climate catastrophe that has struck southern Brazil has also spawned a spate of bizarre and baseless conspiracy theories. Several of these have gone viral on social media. One woman blamed something called HAARP -- the High-frequency Active Auroral Research Program -- a US project that studies the ionosphere.,"https://static.toiimg.com/thumb/msid-47529300,imgsize-110164,width-400,resizemode-4/47529300.jpg"
Hamas says another Israeli hostage held in Gaza is dead,https://timesofindia.indiatimes.com/world/middle-east/hamas-says-another-israeli-hostage-held-in-gaza-is-dead/articleshow/110042691.cms,"JERUSALEM: Palestinian Islamist group Hamas said on Saturday that another one of the hostages abducted during its Oct. 7 attack on Israel has died.Hamas released a video saying that Nadav Popplewell , who was taken hostage from the southern Israeli community of Kibbutz Nirim, died after being wounded in an Israeli strike in Gaza .The Israeli military did not offer immediate comment on the latest video.It has referred to previous videos of hostages released by Hamas as psychological terror. It has also denied some of the previous accusations by Hamas that hostages were killed by Israeli fire.Earlier on Saturday Hamas released an undated video of the 51-year-old captive in front of a white wall, with a bruise on his right eye, and speaking his name.Hours later, in the second video, it said Popplewell died of wounds sustained a month ago in an Israeli air strike.Hamas said Popplewell, whom it said was also a British citizen, was being detained with a woman hostage when the place they were being held was targeted by an Israeli missile.""He died because he didn't receive intensive medical care at medical facilities because of the enemy's destruction of hospitals in Gaza,"" the Hamas armed wing spokesman, Abu Ubaida, said in a statement.Of 252 people abducted on Oct. 7, 128 remain in Gaza, according to Israeli tallies. At least 36 of them have been declared dead by an Israeli forensic committee.Israel says securing the release of the hostages is the aim of its offensive in Gaza, along with eliminating Hamas, which has ruled the enclave since 2007.Popplewell, according to the hostages support group, was captured with his mother from her home in Kibbutz Nirim. His brother was killed during the attack. His mother was freed during a brief truce in November.","Hamas says Nadav Popplewell died after being wounded in an Israeli strike in Gaza. Israeli military did not offer immediate comment on the latest video. It has referred to previous videos of hostages released by Hamas as psychological terror. Of 252 people abducted on Oct. 7, 128 remain in Gaza, according to Israeli tallies.","https://static.toiimg.com/thumb/msid-110042696,imgsize-872447,width-400,resizemode-4/110042696.jpg"
"Justin Bieber and Hailey Bieber are expecting a baby, renew their vows",https://timesofindia.indiatimes.com/world/us/justin-bieber-and-hailey-bieber-are-expecting-a-baby-renew-their-vows/articleshow/109989742.cms,"NEW YORK: Cue up his 2010 megahit “Baby.” Justin Bieber and Hailey Bieber (nee Baldwin) are expecting their first child together — and have renewed their vows.A representative for Hailey Bieber confirmed to The Associated Press on Thursday that the model is just over six months pregnant The couple announced the news on their respective Instagram pages with corresponding posts.Both begin with a short, romantic video clip of the couple kissing. Hailey Bieber is draped in white lace; baby bump prominent in the sheer, form-fitting fabric. It is followed up with a photo shoot of Justin Bieber photographing his wife. In each caption, they've tagged one another.In a press release, fashion house Yves Saint Laurent says the video and photoshoot are from the Biebers' vow renewal ceremony on Thursday in Hawaii.In 2018, the Biebers confirmed their long-rumored marriage on Instagram, when the musician posted a picture of the pair holding hands and captioned it, “My wife is awesome.” Hailey changed her username from “Baldwin” to “Bieber” at the same time. They were engaged in the Bahamas earlier that year, after about a month of dating.In addition to modeling, Hailey Bieber is the founder of a skincare line, Rhode. Justin Bieber, who rose to fame as a teenager, is a Grammy winner with eight No. 1 songs under his belt, including “Sorry,” “Love Yourself,” “What Do You Mean?” and “Despacito,” featuring Luis Fonsi and Daddy Yankee. His last album, “Justice,” was released in 2021.","A representative for Hailey Bieber confirmed to The Associated Press on Thursday that the model is just over six months pregnant. The couple announced the news on their respective Instagram pages with corresponding posts. In 2018, the Biebers confirmed their long-rumored marriage on Instagram, when the musician posted a picture of the pair holding hands.","https://static.toiimg.com/thumb/msid-109989823,imgsize-531726,width-400,resizemode-4/109989823.jpg"
