Article Title,Article Link,Article Text,Article Summary,Article Image
Switchblade 600: How US plans to counter and check China with suicide drones,https://timesofindia.indiatimes.com/world/us/switchblade-600-how-us-plans-to-counter-and-check-china-with-suicide-drones/articleshow/110037138.cms,"The US is advancing its military capabilities by integrating suicide drones into its Replicator initiative , aiming to bolster its autonomous systems to address China's growing military influence in the Indo-Pacific region . This month, the Pentagon confirmed the inclusion of AeroVironment ’s Switchblade 600 drone as part of the first tranche of technologies under the Replicator project.Announced by Deputy Defense Secretary Kathleen Hicks in August 2023, the initiative seeks to deploy thousands of unmanned aerial and surface vehicles within two years, a report in Asia Times said.The Switchblade 600 has demonstrated its effectiveness in Ukraine, targeting armored vehicles over distances exceeding 38 kilometers. Its success is pivotal as the Pentagon looks to quickly ramp up operational capabilities through leveraging commercial technology, supported by a significant budget allocation. This year alone, the initiative has secured about US$500 million, with a request for an equal amount for the next fiscal year.Beyond aerial drones, the initiative is expanding into maritime territories with the Production-Ready Inexpensive Maritime Expeditionary (PRIME) program. This effort aims to diversify the maritime drone vendor base and includes developing low-cost, highly autonomous unmanned boats capable of challenging tasks in strategic areas like the Taiwan Strait.Despite its ambitious scope, the Replicator program faces hurdles such as bureaucratic delays, cultural resistance within the military, and the rapid advancements of competing drone technologies by China. The initiative’s success is crucial as it seeks not only to enhance U.S. military readiness but also to maintain a strategic edge in the face of evolving global threats.","The Pentagon confirmed the inclusion of AeroVironment ’s Switchblade 600 drone as part of the first tranche of technologies under the Replicator project. The initiative seeks to deploy thousands of unmanned aerial and surface vehicles within two years. This year alone, the initiative has secured about US$500 million.","https://static.toiimg.com/thumb/msid-110037274,imgsize-496822,width-400,resizemode-4/110037274.jpg"
CIA chief emerges as the real US powerbroker in Middle East,https://timesofindia.indiatimes.com/world/us/cia-chief-william-burns-emerges-as-the-real-us-powerbroker-in-middle-east/articleshow/110036650.cms,"One key American official is quietly keeping Washington’s lines of communication open across the Middle East as the US and Israel endure their worst falling-out in decades over the war in Gaza.Central Intelligence Agency Director William Burns , a veteran diplomat and Arabic speaker, was in Cairo alongside Qatari and Egyptian mediators this week as US President Joe Biden set off a political firestorm by halting the shipment of about 3,500 bombs to Israel.The White House is increasingly concerned about massive civilian casualties if Israel launches a ground offensive on Rafah, the southern Gaza city where 1.4 million Palestinians are sheltering from the war.Biden’s priority is winning a deal to release more of the hostages Hamas took in its deadly Oct. 7 attack on Israel. And it’s fallen to the US intelligence chief to balance Biden’s carrots-and-sticks approach as Washington struggles to keep the seven-month-old war from escalating further.Burns is “a man of results and I think one of the best US diplomats I have ever met,” said Amr Moussa, a former Egyptian foreign minister.His involvement, according to Moussa, is a recognition by the US that “the rage” in the Middle East provoked by the Gaza war and Washington’s support for Israel has put the US’s reputation and credibility on the line, particularly with traditional Arab allies such as Egypt, Jordan and Saudi Arabia. They believe the White House should have put more pressure on Israeli Prime Minister Benjamin Netanyahu to end the conflict.Burns “has assiduously developed personal relationships with leaders across the region for decades,” said William Usher, a former senior Middle East analyst at the CIA. “We are at a critical stage. All sides have incentives to back out of a deal and in moments like this, public posturing can often backfire.”Burns played an integral role in helping craft the week-long cease-fire late last year that led to the release of dozens of prisoners on both sides. For a moment earlier this week, it almost seemed as if Burns and his counterparts had pulled it off again after Hamas, designated a terrorist group by the US and European Union, said it had accepted a Qatari and Egyptian proposal to halt hostilities.But the talks quickly stalled again as it became clear Israel would not accept Hamas’s proposal for a truce effectively to be permanent.While Burns appears to be the most prominent US official on the Middle East file at the moment, given the importance of the ceasefire-for-hostages deal that might end the violence, he’s hardly the only official in what has at times seemed like a full-court press from the Biden administration.National Security Adviser Jake Sullivan, White House Middle East envoy Brett McGurk, Defense Secretary Lloyd Austin, and the presidential coordinator on global infrastructure Amos Hochstein — who has experience negotiating with Lebanon, where Iran-backed Hezbollah militants are based — have all made extended trips to and within the region.US Secretary of State Antony Blinken, who’s made seven marathon trips to the region, has helped persuade the Israelis to open border crossings for aid, coordinate humanitarian pauses in the fighting and implement procedures to ensure aid workers don’t get killed in the crossfire, according to US officials.But Blinken’s extended tours in the region and public warnings have sometimes seemed to have little impact on the most right-wing government in Israeli history. The country’s air and ground assault on Gaza has killed more than 35,000 people in the Palestinian territory, according to the Hamas-run health ministry there. Hamas fighters killed 1,200 people and abducted 250 when they rampaged through southern Israel on Oct. 7, starting the war.“Arab public opinion has no faith in Biden’s statements and sees Blinken’s shuttle diplomacy over nearly eight months as futile,” said Mohammed Tal, former editor-in-chief of Al-Dustour, one of the main newspapers in Jordan, where Burns served as ambassador between 1998 and 2001. Burns’s involvement “has actually given some hope to people in the region — he does enjoy a certain level of credibility.”The CIA director’s role as an intelligence chief allows him to keep a lower profile and deal directly with Israel’s external intelligence agency Mossad. A veteran State Department official with years of relationships in the Middle East, Burns also has a direct line to the White House. That gets him high-level access in Middle East capitals, where officials often prefer to deal with top spies.“He’s got a pretty deep Rolodex,” National Security Council spokesman John Kirby said Friday. “He’s got relationships all over the world and those relationships are proving important here as he tries to get those hostages home.”The hostage-release assignment is only becoming more difficult as Israel insists on targeting thousands of fighters in Hamas battalions in Rafah. At the same time, Biden is ratcheting up pressure on Israel by saying he might halt even more weapons shipments. Israeli officials have reacted to Biden’s decision with fury. They argue that disrupting weapons shipments to Israel have sent the wrong message to Hamas at a time when the negotiations were at a critical stage.Burns has also proved adept at using the respect he’s garnered in the region to deliver messages to Israel designed to be both warnings and reassurances of support. He demonstrated that tact last month as Israel was weighing the severity of its response to an attack that saw Iran launch hundreds of drones and missiles, almost all of which were repelled.Burns told the George W Bush Presidential Center in Dallas that the response was Israel’s choice, though he suggested an overwhelming retaliation was unnecessary given how Israeli armed forces had already “clearly demonstrated their superiority.”“It’s a reminder of the quality of the Israeli military,” he said. “It’s a reminder of the fact that the Israelis have friends, starting with the United States.”","Central Intelligence Agency Director William Burns was in Cairo alongside Qatari and Egyptian mediators this week. The White House is increasingly concerned about massive civilian casualties if Israel launches a ground offensive on Rafah, the southern Gaza city where 1.4 million Palestinians are sheltering from the war.","https://static.toiimg.com/thumb/msid-110036664,imgsize-177198,width-400,resizemode-4/110036664.jpg"
Pakistan’s political flux threatens economy: IMF,https://timesofindia.indiatimes.com/world/pakistan/pakistans-political-flux-threatens-economy-imf/articleshow/110042224.cms,"ISLAMABAD:

International Monetary Fund ( IMF ) has warned that Pakistan’s high political uncertainty and resurgence of social tensions could undermine economic stabilisation policies in the cash-strapped country.“Downside risks remain exceptionally high. While the new government has indicated its intention to continue the SBAs (standby arrangement) policies, political uncertainty remains significant,” the IMF said in a staff report on Friday.Pakistan had narrowly averted a sovereign debt default last summer.The economy has now stabilised after the completion of the last IMF programme, with inflation coming down to 17% in April from a record 38% in May last year.IMF officials are expected to visit Pakistan this month to discuss a new loan programme. The Shehbaz Sharif-led coalition govt likely to seek at least $6 billion and request additional financing.According to the global lender, while Pakistan did “broadly achieve its narrow objectives, the challenges ahead remained uncomfortably high and would require sustained efforts to address them”.The report said that Pakistan’s fiscal and external vulnerabilities remain very high, including debt sustainability and refinancing risks. “Pakistan’s capacity to repay the IMF hinges on strong policy implementation,” the report stated. The report’s language implies that the IMF remains concerned about the sustainability of its loans.",Pakistan had narrowly averted a sovereign debt default last summer. IMF officials are expected to visit Pakistan this month to discuss a new loan programme. The Shehbaz Sharif-led coalition govt likely to seek at least $6 billion and request additional financing.,"https://static.toiimg.com/thumb/msid-110042230,imgsize-1346219,width-400,resizemode-4/110042230.jpg"
Pakistan International Airlines faces backlash as flight forgets to load child's body on board,https://timesofindia.indiatimes.com/world/pakistan/pakistan-international-airlines-faces-backlash-as-flight-forgets-to-load-childs-body-on-board/articleshow/110039084.cms,"NEW DELHI: The staff of a Pakistan International Airlines (PIA) flight from Islamabad to Skardu forgot to load the body of a six-year-old boy on board. The boy's parents , unaware of the oversight, traveled to Skardu only to discover their son's remains were left behind in IslamabadMujtaba, a resident of Katshi village in Kharmang district, battled a serious illness—a tumor—that required medical treatment outside his hometown.Diagnosed in Skardu, he was referred to Rawalpindi for further care at Benazir Bhutto Hospital. Unfortunately, Mujtaba passed away on Thursday, leaving his parents to organize his journey back home.The news sparked outrage, shocking the parents, who fainted at the airport. The relatives of the deceased, who were waiting to receive the body, also gathered at the airport 's lounge and protested for three hours against the PIA management's negligence .Parents and relatives of the deceased chanted slogans against the PIA administration, alleging that the poor family had paid a higher price to transport the body through the PIA flight, which in turn committed serious negligence.They appealed to the government to take action against those responsible for the negligence.Officials of PIA, Civil Aviation Authority and other departments on duty at Skardu airport admitted their mistake and assured the parents of bringing back the body on Saturday.The PIA officials said the company that handles cargo at the airport is responsible for not loading the body and added that action would be taken against it for negligence.In 2022, the ailing national flag carrier stood as the country's third-highest public sector loss-making entity, requiring Pakistani Rs 11.5 billion per month solely for servicing its debts, The Express Tribune newspaper reported.According to the PIA's financial report, the airline suffered a loss of Rs 75 billion through nine months of 2023.","Mujtaba, a resident of Katshi village in Kharmang district, battled a serious illness. He was referred to Rawalpindi for further care at Benazir Bhutto Hospital. Mujtaba passed away on Thursday, leaving his parents to organize his journey back home.","https://static.toiimg.com/thumb/msid-110039174,imgsize-604065,width-400,resizemode-4/110039174.jpg"
Pakistan Tehreek-e-Insaf issues show-cause notice to party leader Sher Afzal Marwat,https://timesofindia.indiatimes.com/world/pakistan/pakistan-tehreek-e-insaf-issues-show-cause-notice-to-party-leader-sher-afzal-marwat/articleshow/110038088.cms,"ISLAMABAD: Pakistan Tehreek-e-Insaf ( PTI ) has issued show-cause notice to party leader Sher Afzal Marwat for violation of its code of conduct and policy, Pakistan-based Geo News reported.The notice, issued by the PTI's central secretariat, stated that Marwat has issued ""irresponsible statements"" that harmed the PTI's reputation and interests despite being given clear instructions by party founder Imran Khan .According to the notice, Sher Afzal Marwat has damaged his relations with fellow PTI members and stakeholders through his actions and words.The PTI's central secretariat has asked Marwat to explain himself in writing within three days of the show-cause notice. He has been asked to explain why disciplinary action should not be taken against him, Geo News reported.The show-cause notice against the PTI leader reads, ""If your reply is unsatisfactory or you do not respond, further action will be taken as per party policy and rules.""Marwat has been grabbing headlines due to his blunt and controversial remarks and has been at loggerheads with several PTI leaders, including Taimur Khan Jhagra, Omar Ayub and Shibli Faraz, Geo News reported.Earlier on May 9, Omar Ayub said that PTI expelled Marwat from it's core and political committees on the orders issued by Imran Khan. He said that Marwat was warned time and again against violating the PTI's policies.Ayub said, ""The PTI founder said Marwat tried to damage his personal relations with the kingdom [of Saudi Arabia] as he has excellent ties with Crown Prince Mohammed Bin Salman.""Earlier, PTI has nominated Sheikh Waqas Akram for Marwat's post of National Assembly's Public Accounts Committee (PAC) chairman, as per the Geo News report.On May 8, it was reported that PTI founder Imran Khan, who is being held in Adiala Jail, had refused to meet with party leader Sher Afzal Marwat due to his ""irresponsible behaviour,"" ARY News reported.Marwat's remarks about Saudi Arabia's role in toppling the PTI administration and his meeting with Defence Minister Khawaja Asif are what Imran Khan finds offensive, according to ARY News reported citing sources. However, blaming other party leaders, Shibli Faraz and Omar Ayub on Wednesday, PTI's Marwat said that the two hindered his meeting with the PTI founder in jail.""Jail Superintendent told me that the PTI's founder wants to meet me separately,"" Marwat said.""When I come for meeting today, the jail superintendent didn't allow me to meet him,"" he said, as per the ARY News report. He said, ""My meeting with the PTI founder was extremely necessary.""""I am being paid back for my services to the PTI with the complaint of the party's social media team against me,"" Marwat said.","Pakistan Tehreek-e-Insaf ( PTI ) has issued show-cause notice to party leader Sher Afzal Marwat. Marwat has been at loggerheads with several PTI leaders, including Taimur Khan Jhagra, Omar Ayub and Shibli Faraz.","https://static.toiimg.com/thumb/msid-110038337,imgsize-483971,width-400,resizemode-4/110038337.jpg"
Pakistan's maiden lunar orbiter sends first images,https://timesofindia.indiatimes.com/world/pakistan/pakistans-maiden-lunar-orbiter-sends-first-images/articleshow/110029869.cms,"NEW DELHI: Pakistan's maiden lunar orbiter sent the first images of the sun and the moon, days after it was launched as part of China's moon mission, it was announced on Friday.The images were revealed during a ceremony held at the China National Space Agency (CNSA) to celebrate the successful mission, as stated by Maria Tariq, spokesperson of Pakistan's national space agency Suparco.She mentioned that the pictures were officially given to Pakistan's ambassador to China, Khalil Hashmi, during the data handover event in Beijing.At 16:14 (1:14 pm Pakistan time) on May 8, the Pakistani CubeSat, one of the international payloads carried by the Chang'e-6 mission, ""separated from the orbiter near the far moon point of the 12-hour large elliptical orbit around the moon, and then successfully captured the first image.Pakistan's CubeSat project achieved the set goal of ""successfully separating and obtaining telemetry' and achieved complete success,"" the CNSA announcement said.The first image displayed the sun shining brightly; the second image depicted a sparkling half moon, while the third image showed the moon on the left and the sun on the right, as per the images shared online by CNSA.The module was designed by Islamabad's Institute of Space Technology (IST) in collaboration with China's Shanghai University (SJTU) and Suparco.The cube satellite or cubesat is a small satellite known for its compact size and standardized cubic design. They assist in gathering valuable data to drive scientific progress and innovation.Pakistan had the chance to send the lunar orbiter into space when it was provided by the CNSA through the Asia Pacific Space Cooperation Organisation (APSCO) to be included in the Chang'e-6 mission.Meanwhile, the news of the first lunar orbit sending back images has filled the country with pride despite facing tough economic and security challenges. The social media was flooded with posts, most of which shared images and messages brimming with pride.","Pakistan's maiden lunar orbiter sent the first images of the sun and the moon, days after it was launched as part of China's moon mission. The images were revealed during a ceremony held at the China National Space Agency (CNSA) to celebrate the successful mission.","https://static.toiimg.com/thumb/msid-110030830,imgsize-9452,width-400,resizemode-4/110030830.jpg"
IMF doubts Pakistan's ability to repay debts as support team arrives in Islamabad,https://timesofindia.indiatimes.com/world/pakistan/imf-doubts-pakistans-ability-to-repay-debts-as-support-team-arrives-in-islamabad/articleshow/110028404.cms,"NEW DELHI: International Monetary Fund (IMF) has expressed serious concerns about Pakistan's ability to repay its debts, particularly to the global lender itself. The IMF 's assessment came as its support team arrived in Pakistan on Friday to discuss a new bailout package under the Extended Fund Facility (EFF), following Islamabad's request.The IMF staff report, issued earlier this month, stated that ""Pakistan's capacity to repay the fund is subject to significant risks and remains critically dependent on policy implementation and timely external financing."" The report further highlighted the exceptionally high risks that could jeopardize policy implementation and erode repayment capacity and debt sustainability, including delayed adoption of reforms, high public debt and gross financing needs, low gross reserves, the State Bank of Pakistan's net FX derivative position, a decline in inflows, and sociopolitical factors.The report emphasized that restoring external viability is crucial for ensuring Pakistan's capacity to repay the fund, which depends on strong policy implementation, including external asset accumulation and exchange rate flexibility. Geopolitical instability was also mentioned as an additional source of risk, despite some reduction in uncertainty surrounding global financial conditions since the last review.According to the IMF, Pakistan requires gross financing of USD 123 billion over the next five years, with the country expected to seek USD 21 billion in fiscal year 2024-25, USD 23 billion in 2025-26, USD 22 billion in 2026-27, USD 29 billion in 2027-28, and USD 28 billion in 2028-29.Sources familiar with the matter revealed that the IMF support team will discuss the first phase of the next long-term loan programme with Pakistan's financial team, focusing on data collection from various departments and discussions on the upcoming budget for the fiscal year 2025 (FY2025) with the Ministry of Finance officials. The team is expected to stay in Pakistan for over 10 days.Pakistan has decided to seek a rollover of around USD 12 billion in debt from key allies like China in the 2024-25 fiscal year to address the USD 23 billion gap in its external financing. The Finance Ministry insiders stated that USD 5 billion from Saudi Arabia, USD 3 billion from the UAE, and USD 4 billion from China will be rolled over, with estimates of further new financing from China to be included in the next financial year's budget.The country is expected to receive more than USD 1 billion from the IMF under the fresh loan programme, along with new financing from the World Bank and Asian Development Bank. The federal government aims to achieve budget targets before the anticipated arrival of the IMF review mission in Pakistan, with negotiations for a new loan programme expected to commence in mid-May, ahead of the budget presentation in June.Despite narrowly avoiding default last summer and experiencing some economic stabilization, Pakistan continues to face high fiscal shortfalls and stagnating growth, with the external account deficit being controlled through import control mechanisms at the expense of economic growth, which is expected to be around 2 per cent this year compared to negative growth last year.","IMF has expressed serious concerns about Pakistan's ability to repay its debts, particularly to the global lender itself. The IMF's assessment came as its support team arrived in Pakistan on Friday to discuss a new bailout package under the Extended Fund Facility (EFF), following Islamabad's request.","https://static.toiimg.com/thumb/msid-110029684,imgsize-729635,width-400,resizemode-4/110029684.jpg"
Pakistan Peoples Party will not join PM Shehbaz Sharif led federal cabinet: Report,https://timesofindia.indiatimes.com/world/pakistan/pakistan-peoples-party-will-not-join-pm-shehbaz-sharif-led-federal-cabinet-report/articleshow/110028238.cms,"NEW DELHI: Pakistan Peoples Party (PPP), has decided not to join Prime Minister Shehbaz Sharif's federal cabinet , either before or after the presentation of the budget in parliament.As per reports by The Express Tribune, this decision comes despite reports suggesting that the PPP had been invited by the ruling party to join the coalition and was offered ministries in exchange.Sources also mentioned that during a recent meeting between PM Shehbaz Sharif and Bilawal, the topic of joining the federal cabinet was not discussed. Instead, Bilawal emphasized the importance of making wheat purchases mandatory.However, some insiders had previously revealed that the ruling PML-N and PPP were close to finalizing a power-sharing agreement, with Bilawal likely to return as the country's foreign minister for the second time. They claimed that Bilawal, who was initially hesitant to join the cabinet, had agreed to take on the role of foreign minister. The two parties were reportedly working on the details and timing of the PPP's formal induction into the federal cabinet.Earlier this month, the premier and Bilawal met at the PM's House to finalize the names of governors for Punjab, Khyber Pakhtunkhwa, and Balochistan. An official statement indicated that they discussed the overall political situation in the country.Despite the prime minister and other parties in the ruling coalition wanting the PPP to join the cabinet, a PPP leader maintained that the party leadership had not yet decided to change its previous stance on the matter. The leader described the reports suggesting that the PPP would join the cabinet after the budget as ""speculative,"" stating that no such discussion had taken place during the meetings between the two sides.","Pakistan Peoples Party (PPP), has decided not to join Prime Minister Shehbaz Sharif's federal cabinet. This decision comes despite reports suggesting that the PPP had been invited by the ruling party to join the coalition and was offered ministries in exchange. Some insiders had previously revealed that the ruling PML-N and PPP were close to finalizing a power-sharing agreement.","https://static.toiimg.com/thumb/msid-110029251,imgsize-15342,width-400,resizemode-4/110029251.jpg"
