Article Title,Article Link,Article Text,Article Summary,Article Image
Pakistan: JUI-F chief says no proposal to form grand alliance against government,https://timesofindia.indiatimes.com/world/pakistan/pakistan-jui-f-chief-says-no-proposal-to-form-grand-alliance-against-government/articleshow/109851302.cms,"ISLAMABAD: Jamiat Ulema-e-Islam-Fazl (JUIF) chief Maulana Fazlur Rehman on Saturday said that no proposal to form a grand alliance against the government was currently being considered, Pakistan-based The News International reported.Speaking to reporters in Thatta, Rehman said they had started a regular movement against the government created based on Form 47.He said that a million-man march will be held in Peshawar on May 9 after which announcements will be made for other cities as well. He stated that the march in Peshawar will be held in Karachi.Expressing his views about PTI founder Imran Khan , JUI-F chief Fazl said Khan has two sides: one is that he is caught in cases against him about which the courts and his lawyers are aware and the other side is political.He said that it would not be in good taste if he spoke against his opponent, who was in prison but still making remarks about him.JUI-F chief said government delegations were holding talks with the PTI and his party will facilitate purposeful negotiations as the political environment must be improved for the development of the nation.Asked about the performance of the government, Maulana Fazlur Rehman said that if and where the government had started speaking about its performance.Earlier this week, JUI-F chief, Maulana Fazlur Rehman once again dismissed the outcomes of the general elections and called for new polls, citing ""widespread rigging and irregularities,"" as reported by ARY News.During a public gathering in Karachi, Maulana Fazlur Rehman asserted that the assemblies had been ""sold,"" including the Sindh Assembly and the President House. He emphasized the necessity for immediate re-elections to uphold the integrity of the democratic process, according to ARY News report.""The recent elections were fake, and its results are unacceptable,"" he said, calling for fresh elections to ensure the people's voices are heard and their mandate respected.",JUI-F chief Maulana Fazlur Rehman said no proposal to form a grand alliance against the government was currently being considered. He said a million-man march will be held in Peshawar on May 9 after which announcements will be made for other cities.,"https://static.toiimg.com/thumb/msid-109851352,imgsize-881831,width-400,resizemode-4/109851352.jpg"
Imran Khan accuses Pakistan's Chief Justice of being 'biased' against his party,https://timesofindia.indiatimes.com/world/pakistan/imran-khan-accuses-pakistans-chief-justice-of-being-biased-against-his-party/articleshow/109838340.cms,"(With agency inputs)

NEW DELHI: Imran Khan, the founder of Pakistan Tehreek-e-Insaf (PTI), has accused Chief Justice of Pakistan (CJP) Qazi Faez Isa of bias against his party and called upon the courts to hasten the hearings of his case.From Rawalpindi's Adiala Jail, Khan emphasized the need for timely proceedings, labeling the delays in court decisions as unjust.He asserted that all cases against him were false and baseless.Referring to CJP Isa's statement, Khan said,""He stated that there is no pressure on him, but pressure comes to those who refuse to indulge in wrongdoing. You are behaving like [government's] B-team against PTI.""Khan highlighted the unresolved issues regarding PTI's electoral symbol, alleged rigging during general elections and the status of PTI's petitions , behind his allegations of PTI being denied level playing field.He criticized the judiciary for what he perceived as coerced decisions and urged Supreme Court judges to emulate the stance of high court judges in rejecting wrongful decisions.Expressing a willingness to engage in dialogue, Khan conditioned it upon the return of what he claimed was a 'stolen mandate' and the release of imprisoned party workers. He stressed that dialogue typically occurs with adversaries, hinting at a potential negotiation with PTI's perceived adversaries.Former PTI leader Fawad Chaudhry had suggested that if Khan struck a deal with the establishment, he would effectively become Shehbaz Sharif.Chaudhry's remarks surfaced amidst discussions surrounding alleged talks between PTI and the establishment, which were initiated by senior PTI leader Shehryar Afridi. PTI leader Shehryar Afridi said that his party will hold ""dialogue with the chief of army staff (COAS) and the director general of the Inter-Services Intelligence (DG ISI) soon"" instead of speaking to ""rejected people"" who reached parliament through Form 47.Chaudhry expressed skepticism about Khan's likelihood of striking such a deal, asserting that Shehbaz Sharif's current threats originate not from within his party but from external forces.","Imran Khan, the founder of Pakistan Tehreek-e-Insaf (PTI), has accused Chief Justice of Pakistan (CJP) Qazi Faez Isa of bias against his party. Khan emphasized the need for timely proceedings, labeling the delays in court decisions as unjust.","https://static.toiimg.com/thumb/msid-109838484,imgsize-844989,width-400,resizemode-4/109838484.jpg"
Pakistan records 'wettest April' in more than 60 years: Weather agency,https://timesofindia.indiatimes.com/world/pakistan/pakistan-records-wettest-april-in-more-than-60-years-weather-agency/articleshow/109837588.cms,"ISLAMABAD: Pakistan experienced its ""wettest April since 1961"", receiving more than twice as much rain as usual for the month, the country's weather agency said in a report.April rainfall was recorded at 59.3 millimetres, ""excessively above"" the normal average of 22.5 millimetres, Pakistan's metrology department said late Friday in its monthly climate report.There were at least 144 deaths in thunderstorms and house collapses due to heavy rains in what the report said was the ""wettest April since 1961"".Pakistan is increasingly vulnerable to unpredictable weather, as well as often destructive monsoon rains that usually arrive in July.In the summer of 2022, a third of Pakistan was submerged by unprecedented monsoon rains that displaced millions of people and cost the country $30 billion in damage and economic losses, according to a World Bank estimate."" Climate change is a major factor that is influencing the erratic weather patterns in our region,"" Zaheer Ahmad Babar , spokesperson for the Pakistan Meteorological Department, said while commenting on the report.While much of Asia is sweltering dure to heat waves, Pakistan's national monthly temperature for April was 23.67 degrees Celsius (74 degrees Fahrenheit) 0.87 degrees lower than the average of 24.54, the report noted.","April rainfall was recorded at 59.3 millimetres, ""excessively above"" the normal average. At least 144 deaths in thunderstorms and house collapses due to heavy rains. Pakistan is increasingly vulnerable to unpredictable weather, as well as often destructive monsoon rains.","https://static.toiimg.com/thumb/msid-109837653,imgsize-1589126,width-400,resizemode-4/109837653.jpg"
Media bodies flag concern over dire state of 'free media' in Pakistan,https://timesofindia.indiatimes.com/world/pakistan/media-bodies-flag-concern-over-dire-state-of-free-media-in-pakistan/articleshow/109836925.cms,"with input from agency)

NEW DELHI: Media bodies in Pakistan have raised concerns over the worrying state of ' free media ' in the country as the world observed Press Freedom day on Friday.According to several media reports, the press bodies particularly cited restrictions imposed on mainstream media and social media during the election season in Pakistan.Media bodies like, the association of electronic media editors and news directors (AEMEND) have pledged to continue the constitutional and legal struggle for freedom of expression in Pakistan.AEMEND stated that journalists and media outlets in Pakistan are facing significant challenges.State and non-state actors are imposing restrictions on television programs, shutting down broadcasts, pressuring for the termination of journalists, creating unnecessary pressures, and making illegal demands, said the body in a statement cited by media reports.AEMEND said, ""Such tactics are increasing by the day,"" adding, ""Character assassination of journalists, especially women journalists, is part of this campaign, and political party workers are also part of such malicious campaigns.""In its South Asia press freedom report, the International Federation of Journalists (IFJ) said that four journalists were murdered and women journalists in Pakistan faced harassment online and offline.The IFJ further said, ""Pakistan's women journalists faced similar harassment both online and offline; they are in a minority, and their voices are unheard.""Meanwhile, the Freedom Network has released its annual Pakistan freedom of expression and media report 2024 titled as ""Erosion of free speech: The silencing of citizens, political parties, and media.""The report highlighted the factors and developments in Pakistan's socio-political-legal and media industry that affect the freedom of expression by the people and media.On May 3, the Human Rights Commission of Pakistan requested the government to guarantee fair treatment for journalists and ensure their protection, as mentioned in a press release from the organization.HRCP issued a statement requesting the government to guarantee fair and prompt payment for journalists and media personnel, establish safeguards against assaults, prosecute those accountable for their unlawful imprisonment, and safeguard the freedom of speech.The HRCP expressed concerns about the recent threats made against Hamid Mir for supporting freedom of speech. The statement also mentioned that the state and law enforcement agencies have not taken any action to bring the culprits to justice.The HRCP demanded that ""such oppressive and heinous tactics must stop. Freedom of the press, which is considered the fourth pillar of the state, is indispensable for the stability of a healthy democracy.",Media bodies in Pakistan have raised concerns over the worrying state of'free media'in the country. The world observed Press Freedom day on Friday. Media bodies particularly cited restrictions imposed on mainstream media and social media during the election season in Pakistan. State and non-state actors are imposing restrictions on television programs.,"https://static.toiimg.com/thumb/msid-109837317,imgsize-18980,width-400,resizemode-4/109837317.jpg"
Pakistan's former PM Imran Khan decline claims of any deal for his release,https://timesofindia.indiatimes.com/world/pakistan/paks-former-pm-imran-khan-dismiss-striking-any-deal-for-his-release/articleshow/109834479.cms,"NEW DELHI: Pakistan's former PM Imran Khan , currently in Adiala Jail, has dismissed any notion of reaching a deal for his release.The founder of Pakistan Tehreek-e-Insaf (PTI) has further asked the courts to expedite the hearings of his cases.He further said that he is ready for talks but he won't do any deals. ""In the past 18 months, I've maintained readiness for talks, but not for deals ,"" said Khan.Additionally, he further said that he won't hold any talk with PML-N, PPP, and MQM-P. ""We are ready to hold talks with everyone, except three political parties - PML-N, PPP, and MQM-P,"" said Khan.Khan criticized the Pakistan's government of putting pressure by filing fabricated cases against him such as the Toshakhana case.He further highlighted the discrepancies in legal proceedings, stating dismissals of references against Nawaz Sharif and Asif Ali Zardari while alleging government efforts to prolong proceedings in the cipher case.Additionally, PTI Chairman Barrister Gohar Ali Khan while responding to speculations, has clarified that no messages for dialogue have been received, affirming Imran Khan's stance. ""We will publicly confirm if we receive any invitation for talks,"" said Gohar Ali Khan.",The founder of Pakistan Tehreek-e-Insaf (PTI) has further asked the courts to expedite the hearings of his cases. Khan criticized the Pakistan's government of putting pressure by filing fabricated cases against him such as the Toshakhana case.,"https://static.toiimg.com/thumb/msid-109834904,imgsize-19208,width-400,resizemode-4/109834904.jpg"
"Pak, with Chinese help, launches maiden lunar mission",https://timesofindia.indiatimes.com/world/pakistan/pak-with-chinese-help-launches-maiden-lunar-mission/articleshow/109825055.cms,"ISLAMABAD: Pakistan , in collaboration with China, launched its first-ever lunar mission, iCube-Qamar , from the Chinese city of Hainan on Friday, with authorities saying the satellite will orbit the moon as part of Beijing’s Chang’e-6 space mission.The launch of the satellite on board a Chinese Long March5 Y8 rocket was shown live on Pakistani TV stations and Chinese state television.Pakistan Prime Minister Shehbaz Sharif and President Asif Zardari congratulated the nation and its scientists for launching their first lunar orbit mission.Khalil Hashmi, Pakistan’s top envoy in Beijing, who was present at the launch site, confirmed on X that the activity was “successful”. “It (satellite) will be deployed in Moon orbit on May 8,” he added.Authorities said Pakistan’s Institute of Space Technology (IST), in collaboration with China’s Shanghai University and Pakistan national space agency SUPARCO, jointly developed the iCUBE-Q, or CubeSat.CubeSats are miniature satellites typically characterised by their small size and standardised design. They are constructed in cubic shape, often weigh no more than a few kg, and are deployed in space for various purposes.Weighing around 7 kg, the iCUBE-Q orbiter carries two cameras to take images of the lunar surface and has other sensors and apparatus for deep-space communication, altitude control, and other functions.The primary criteria for mission success, officials said, will be achieved with the successful separation of the iCUBE-Q from the Chang’e-6 Orbiter. Following separation, the secondary criteria will involve the satellite receiving a beacon signal that will confirm that the orbiter is working satisfactorily.Finally, the orbiter will take pictures of the Earth, and Moon and try to take pictures of at least two objects together (Earth, Moon, and the orbiter).As part of data collection, authorities said, iCUBE-Q will also collect data on the lunar magnetic field, establish a lunar magnetic field model, and lay the groundwork for future missions and international lunar cooperation.Dr Khurram Khurshid, a senior member associated with Pakistan’s space programme, said the satellite will reach the lunar orbit in five days and will circle the moon for three to six months.He added that different pictures of the surface of the moon will be taken with the orbiter’s help, after which Pakistan will have its own satellite images of the Moon for research.","Pakistan launched its first-ever lunar mission, iCube-Qamar, on Friday. The satellite will orbit the moon as part of Beijing’s Chang’e-6 space mission. The launch of the satellite was shown live on Pakistani TV stations and Chinese state television.","https://static.toiimg.com/thumb/msid-109825220,imgsize-16354,width-400,resizemode-4/109825220.jpg"
All that is left for Pak Army is to 'murder me': Imran Khan writes from prison,https://timesofindia.indiatimes.com/world/pakistan/all-that-is-left-for-pak-army-is-to-murder-me-imran-khan-writes-from-prison/articleshow/109821286.cms,"LONDON/ISLAMABAD: Pakistan's former Prime Minister Imran Khan has lamented the sorry state of affairs in the country where political leaders like him languish in jail and said all that is left for the powerful military leadership was to ""murder"" him.In a column for the UK's ‘Daily Telegraph' newspaper, penned from the Adiala Jail in Rawalpindi where he is being held for disputed corruption charges, the 71-year-old cricketer-turned-politician reiterated his previous assertion that if anything happens to him or his wife, General Asim Munir – the Chief of Army Staff, will be responsible.The founder of the Pakistan Tehreek-e-Insaf (PTI) party said the cash-strapped country was at a “dangerous crossroads”, with the government a “laughing stock”.“The military establishment has done all they could against me. All that is left for them is to now murder me,” writes Khan.“I have stated publicly that if anything happens to me or my wife (Bushra Bibi), Gen. Asim Munir will be responsible. But I am not afraid because my faith is strong. I would prefer death over slavery,” he says.The powerful army, which has ruled Pakistan for more than half of its 75-plus years of existence, has wielded considerable power in matters of security and foreign policy. However, the military has denied meddling in the country's politics.Khan warned that the state was treading the same path it trod in 1971, when it lost East Pakistan, now Bangladesh.“At the same time, it is seeing an upsurge in terrorism and a growing alienation in Balochistan where the issue of enforced disappearances is growing in severity. On Pakistan's borders, India has already admitted to undertaking assassinations inside of Pakistan and the international border with Afghanistan remains volatile,” he notes.Khan notes the military establishment's expectation of “unquestioning support” from the US, in return for the provision of access to airspace and related facilities to the US for military purposes, has been punctured after the publication of the latest US State Department's Country Reports on Human Rights Practices, which highlights the many human rights violations in Pakistan.“With an economy in crisis, spiralling prices and a people politically angry at having their electoral mandate stolen and being economically beleaguered, the state stands isolated,” he writes.Khan hailed the “democratic revenge” of the February 8 general election, during which people came out and “voted overwhelmingly” for candidates supported by his party.“Unfortunately, instead of accepting the people's mandate, the military establishment went into a fit of rage and electoral results were manipulated to bring into power the losers. The same vote tampering was seen in the recent by-elections,” he notes.The PTI founder also praised the six “brave judges” of the Islamabad High Court who have written a letter to the Chief Justice of Pakistan highlighting instances of harassment and blackmail including of their families by intelligence agencies.“This is unprecedented in our history – although, informally, many knew what was happening to the senior judiciary but for such a letter to have come from these judges shows the level of despair, anger and frustration,” he writes.","Pakistan's former Prime Minister Imran Khan has lamented the sorry state of affairs in the country. He said all that is left for the powerful military leadership was to ""murder"" him. Khan said the cash-strapped country was at a ‘dangerous crossroads’","https://static.toiimg.com/thumb/msid-109821521,imgsize-10382,width-400,resizemode-4/109821521.jpg"
"20 people killed, 21 others injured after bus falls into ravine in Gilgit-Baltistan",https://timesofindia.indiatimes.com/world/pakistan/20-people-killed-21-others-injured-after-bus-falls-into-ravine-in-gilgit-baltistan/articleshow/109805453.cms,"GILGIT-BALTISTAN [PoK]: At least 20 people were killed and 21 others injured after a passenger bus veered off a narrow mountain road and fell into a ravine in Diamer district of Pakistan-occupied Kashmir 's Gilgit-Baltistan, Geo News reported, citing police.The accident occurred at the Yashokhal area on the Karakoram Highway in PoK's Diamer on Friday at 5:30 am (local time), according to police.The bus was heading from Rawalpindi to Gilgit. According to police, at least 38 passengers were travelling in the bus.Following the accident, rescue teams were dispatched to the site of the accident. The injured people and the dead bodies were taken to a hospital in Chilas. The deceased people included three women, according to the Health Department director, Geo News reported.Speaking to Geo News, Diamer Deputy Commissioner Fayyaz Ahmed said that the condition of at least five injured passengers is serious, while two have been shifted to Gilgit city. Ahmed said that he is in touch with the families of the victims.The official said, ""The accident took place 20 kilometres away from Chilas city. The bus met with an accident while overspeeding or taking a turn.""Gilgit-Baltistan chief minister Haji Gulbar Khan offered his condolences over the incident. He ordered the administration and rescuers to provide immediate medical aid to the injured. Gilgit-Baltistan government spokesperson announced that an emergency has been imposed in Chilas Hospital.","Bus veered off a narrow mountain road and fell into a ravine in Diamer district of Pakistan-occupied Kashmir's Gilgit-Baltistan. The bus was heading from Rawalpindi to Gilgit. According to police, at least 38 passengers were travelling in the bus.","https://static.toiimg.com/thumb/msid-109805768,imgsize-796664,width-400,resizemode-4/109805768.jpg"
"Security measures tightened for Chinese nationals in Pakistan, to now travel with armoured vehicles",https://timesofindia.indiatimes.com/world/pakistan/security-measures-tightened-for-chinese-nationals-in-pakistan-to-now-travel-with-armoured-vehicles/articleshow/109803946.cms,"(With agency inputs)

NEW DELHI: Movement restrictions have now been placed on Chinese nationals in the Khyber Pakhtunkhwa (KP) region, as per a report by Dawn. The KP government has mandated that Chinese citizens must travel accompanied by armoured vehicles while in the area.This directive was announced by a senior police official during a meeting held on Wednesday. Tahir Ayub Khan, deputy inspector general of police in Hazara range said, ""As we're adopting all possible measures for the safety of Chinese nationals, they shouldn't travel in the province without armoured vehicles in line with the government's directions”.The meeting, convened to address security concerns for the Suki Kinari hydropower project in the Malkandi area of Kaghan Valley, brought together various stakeholders, including security personnel, Chinese engineers, and project managers.Discussions centered on the implementation of stringent security measures to safeguard the lives of individuals involved in critical infrastructure projects, as reported by Dawn.During site inspections of the Suki Kinari and Balakot hydropower projects, DIG Tahir Ayub Khan reiterated the government's commitment to maintaining high-security standards. He highlighted plans to fortify residential colonies housing Chinese engineers and workers with boundary walls of at least eight feet in height, potentially reinforced with barbed wire for additional protection.These enhanced security measures follow a recent incident where a convoy of Chinese engineers working on the Dasu hydropower project in Shangla district was targeted in a suicide attack, resulting in casualties. The attack had raised significant security concerns, prompting authorities to take steps to mitigate risks and ensure the safety of foreign nationals in Pakistan.",Movement restrictions have now been placed on Chinese nationals in the Khyber Pakhtunkhwa (KP) region. The KP government has mandated that Chinese citizens must travel accompanied by armoured vehicles while in the area. These enhanced security measures follow a recent incident where a convoy of Chinese engineers working on the Dasu hydropower project was targeted in a suicide attack.,"https://static.toiimg.com/thumb/msid-109804016,imgsize-1021808,width-400,resizemode-4/109804016.jpg"
