Article Title,Article Link,Article Text,Article Summary,Article Image
What would an ICC arrest mean for Israel's Netanyahu?,https://timesofindia.indiatimes.com/world/middle-east/what-would-an-icc-arrest-mean-for-israels-netanyahu/articleshow/110519943.cms,"The International Criminal Court could soon issue an arrest warrant for Israeli Prime Minister Benjamin Netanyahu along with his defense minister and three Hamas leaders. If it does, what are the potential consequences?The government in Tel Aviv has cast a cautious eye toward The Hague, Netherlands, home of the International Criminal Court (ICC).The court's chief prosecutor, Karim Khan, has requested arrest warrants for Prime Minister Benjamin Netanyahu and Defense Minister Yoav Gallant. They are accused of war crimes and crimes against humanity in the Gaza Strip.Khan also requested arrest warrants for three Hamas leaders Yahya Sinwar, Mohammed Deif and Ismael Haniyeh — on similar charges related to the Islamist militant group's October 7 attacks on Israel What type of criminal case could the ICC bring against Netanyahu? The International Criminal Court only investigates individuals and only becomes active when a person is suspected of being responsible for one of four core crimes: genocide, war crimes, crimes against humanity, or starting a war of aggression.The ICC has in fact been looking into possible war crimes committed by Israel since 2021. At the same time, the court has also been investigating similar accusations leveled against Hamas fighters. Moreover, investigations are currently ongoing in regard to acts of violence committed by Israeli settlers in the West Bank. Recent developments in the war between Israel and Hamas are all being considered in that context.This most recent conflict began when militant Islamist Hamas fighters attacked southern Israel on October 7, 2023, killing some 1,200 people and abducting more than 240 back to Gaza. Hamas is considered a terrorist organization by numerous Western nations, including many EU member states as well as the US.According to the Hamas-controlled Gaza Health Ministry, Israel's military response to the attack has killed more than 34,000 people, though these numbers cannot be independently verified. When does the ICC have jurisdiction over Israeli citizens?As a rule, the ICC may only take action when states cannot or will not pursue charges for the above-mentioned crimes at the national level. The current war makes it even more unlikely than usual that Israeli courts would initiate criminal proceedings against the head of its government, its ministers or army leadership. Furthermore, either a perpetrator's home country must also acknowledge the court. Israel does not or the country in which a crime is alleged to have taken place must.That could well be the case here, as the Palestinian territories are signatories to the Rome Statute of the International Criminal Court. Joining Israel in their rejection of the ICC are the US, China, Russia, India, almost all Arab states, and Iran.When none of the nations tied to the crimes are ICC Treaty signatories, then the task of contracting the ICC to investigate falls to the United Nations Security Council as was the case, for instance, with Libya and Sudan. What consequences could the ICC warrant have for Netanyahu?An arrest warrant is not a conviction. In the first instance it is a sign that the ICC takes accusations leveled against an individual seriously enough to investigate them.According to the ICC website, judges will issue a warrant of arrest if it appears necessary to ensure that the person will actually appear at trial, that he or she will not obstruct or endanger the investigation or the court's proceedings, or to prevent the person from continuing to commit crimes. However, as the ICC has no police force to arrest individuals against whom it has issued warrants, it is highly unlikely that members of the Israeli government will ever appear before judges in The Hague.Still, an arrest warrant would greatly limit the freedom of movement that Netanyahu and his associates enjoy, for each of the ICC treaty's 124 signatories are obliged to arrest individuals with outstanding warrants and to hand them over to the court.That is why Russian President Vladimir Putin has been forced to avoid traveling to most international meetings since the ICC issued a warrant for his arrest over accusations that he is involved in the systematic abduction of Ukrainian children. Putin only travels directly to and from nations that do not recognize the legitimacy of the ICC. How would such an arrest warrant be tied to accusations of genocide leveled at Israel?The ICC's investigation should not be confused with another similar case pending against the state of Israel, namely the charge of genocide leveled against it by several nations. Among others, South Africa has spearheaded a case before the International Court of Justice (ICJ) based on the high number of casualties in Gaza.The ICJ is also based in The Hague, but does not investigate individuals nor does it issue arrest warrants, instead dealing exclusively with legal disputes between states. In late January, the ICJ said it recognized the ""risk of genocide in the Gaza Strip.Still, the ICJ refused to back an emergency motion filed by South Africa demanding Israel immediately cease all military operations in the enclave. As a result of that stance, the genocide case against Israel could potentially drag on for months or even years.","The International Criminal Court could soon issue an arrest warrant for Israeli Prime Minister Benjamin Netanyahu along with his defense minister and three Hamas leaders. The court's chief prosecutor, Karim Khan, has requested arrest warrants for Netanyahu and Defense Minister Yoav Gallant. They are accused of war crimes and crimes against humanity in the Gaza Strip.","https://static.toiimg.com/thumb/msid-110520054,imgsize-41410,width-400,resizemode-4/110520054.jpg"
OpenAI CEO Sam Altman pledges to donate most of his wealth,https://timesofindia.indiatimes.com/world/us/openai-ceo-sam-altman-pledges-to-donate-most-of-his-wealth/articleshow/110518240.cms,"OpenAI CEO Sam Altman has pledged to donate the majority of his wealth to charitable causes. Altman joins a growing list of billionaires who have committed substantial portions of their fortunes to philanthropic endeavors.The announcement comes after a turbulent period for Altman, who Forbes estimates has a net worth of $1 billion, largely due to his investments. In November, he was briefly removed from his position as CEO, causing shockwaves in the rapidly evolving AI industry, but was later reinstated.Altman, who initially established OpenAI as a nonprofit research organization dedicated to developing AI safely for the benefit of humanity, now intends to focus his philanthropic efforts on ""technology that helps create abundance for people."" In a joint letter with his husband, technology investor Oliver Mulherin, dated May 18, Altman expressed gratitude for the hard work and dedication of those who have contributed to the advancement of society, saying, ""There is nothing we can do except feel immense gratitude and commit to pay it forward, and do what we can to build the scaffolding up a little higher.""The Giving Pledge, established in 2010 by Bill Gates , Melinda French Gates, and Warren Buffett , aims to encourage philanthropy among the world's wealthiest individuals to address pressing global issues. The initiative has attracted more than 240 signatories from 30 countries, although some critics argue that there is insufficient oversight to ensure that pledgers fulfill their commitments.Altman has not specified the exact causes he will support, but his track record suggests a focus on areas such as education, scientific research, and global health. His philanthropic philosophy aligns with his professional mission at OpenAI, where he has emphasized the ethical development and deployment of artificial intelligence.Altman's decision is part of a broader trend among tech leaders who are using their financial resources to address global challenges. In addition to Altman and Mulherin, the latest group of Giving Pledge signatories includes Mercuria CEO Marco Dunand and entrepreneur Suzan Craig Dunand, who have established a Swiss foundation to accelerate the transition to net zero carbon emissions; retired value investor Robert D. Goldfarb, who plans to donate 90% of his wealth during his lifetime; investor Jahm Najafi and entrepreneur Cheryl Najafi, who have recently focused their philanthropy on racial equity; and Hemant Taneja, head of a technology investment capital firm, and real estate developer Jessica Schantz Taneja.(With inputs from agencies)","OpenAI CEO Sam Altman has pledged to donate the majority of his wealth to charitable causes. Altman joins a growing list of billionaires who have committed substantial portions of their fortunes to philanthropic endeavors. The Giving Pledge, established in 2010 by Bill Gates, Melinda French Gates, and Warren Buffett, aims to encourage philanthropy among the world's wealthiest individuals.","https://static.toiimg.com/thumb/msid-110518348,imgsize-1175623,width-400,resizemode-4/110518348.jpg"
Israel's Rafah operation not a major offensive: US,https://timesofindia.indiatimes.com/world/middle-east/israels-rafah-operation-not-a-major-offensive-us/articleshow/110516106.cms,"WASHINGTON: The White House on Tuesday provided the most complete definition yet of what it considers a ""major ground operation "" in Rafah that could trigger a change in United States policy toward Israel, and said Israel's actions there have not yet reached that level.""We have not seen them smash into Rafah - we have not seen them go in with large units, large numbers of troops in columns and formations in some sort of coordinated maneuver against multiple targets on the ground. That is a major ground operation. We have not seen that,"" White House national security spokesperson John Kirby told reporters at a briefing.Israel's three-week-old Rafah offensive stirred renewed outrage and prompted an outcry from global leaders after an airstike on Sunday that Gaza officials said killed at least 45 people when a blaze ignited in a tent camp in a western district.The Biden administration has repeatedly warned Israel against launching a large-scale military offensive in Rafah, a city in southern Gaza packed with refugees who followed Israel's previous orders to evacuate there. President Joe Biden himself publicly warned Israel this month that the U.S. would stop supplying it with weapons if Israeli forces conduct a major invasion there without a credible plan to protect civilians.Israel told around one million Palestinian civilians displaced by the almost eight-month-old war to evacuate to Al-Mawasi when it launched its incursion in Rafah in early May. Around that many have fled Rafah since then, the U.N. agency for Palestinian refugees UNRWA reported on Tuesday.Asked about reports that Israeli forces have moved into central Rafah, Kirby said ""my understanding is, and I believe the Israelis have spoken to this, that they are moving along something called the Philadelphia corridor, which is on the outskirts of the town, not in the town proper.""""We have not seen a major ground operation and these tanks are moving along a corridor that they have told us previously that they would use on the outskirts of the town to try to put pressure on Hamas,"" Kirby said.The World Court last week ordered Israel to immediately halt its military assault on Rafah, in a landmark emergency ruling in South Africa's case accusing Israel of genocide.Israel said it had targeted two senior Hamas operatives in a compound and had not intended to cause civilian casualties.""I don't know how anybody could dispute that they were trying to go after Hamas in a targeted precise way,"" Kirby said, adding that the U.S. would wait for the results of Israel's investigation into the incident.The U.S. is by far the biggest supplier of weapons to Israel, and it accelerated deliveries after the Oct. 7 Hamas-led attacks.Rafah was a major entry point for humanitarian relief before Israel stepped up its military offensive on the Gaza side of the border earlier this month and seized control of the crossing from the Palestinian side.More than 36,000 Palestinians have been killed in Israel's offensive, Gaza's health ministry says. Israel launched its air and ground war after Hamas-led militants attacked southern Israeli communities on Oct. 7, killing around 1,200 people and seizing more than 250 hostages, according to Israeli tallies.",The Biden administration has repeatedly warned Israel against launching a large- scale military offensive in Rafah. President Joe Biden himself publicly warned Israel this month that the U.S. would stop supplying it with weapons if Israeli forces conduct a major invasion there.,"https://static.toiimg.com/thumb/msid-110516117,imgsize-660777,width-400,resizemode-4/110516117.jpg"
"Mosques demolished, texts censored: How China is repressing Muslims in Xinjiang",https://timesofindia.indiatimes.com/world/china/mosques-demolished-texts-censored-how-china-is-repressing-muslims-in-xinjiang/articleshow/110495773.cms,"The decline of religious freedom

Surveillance and Repression

Impact on daily life

NEW DELHI: The Chinese government's crackdown on the Islamic faith, particularly among the Uyghur Muslim population in Xinjiang, has garnered significant international attention and condemnation due to human rights abuses and allegations of cultural genocide.In a recent investigation, UK's Sky News has shed light on China's increasing control over Islamic practices within the country. The report underscores the mounting restrictions and surveillance faced by Muslims, particularly in regions with significant Islamic populations.One poignant scene described in the report occurs in a cold, dusty part of central China, where a local Muslim leader stands alone in the courtyard of a small mosque. ""Religion is dying,"" he laments, highlighting the severe constraints imposed by the Chinese government on religious activities.The report details how the Chinese authorities have intensified efforts to monitor and restrict Islamic practices, including demolishing mosques, banning religious attire, and censoring Islamic texts. This crackdown is part of a broader campaign to align religious practices with the state's ideology and to curb any potential dissent.The Chinese authorities have taken numerous steps to curb the practice of Islam:Demolition of mosques: Many mosques have been demolished, particularly those that do not conform to the government's architectural standards or those deemed too conspicuous.Banning religious attire: Traditional Islamic attire, such as headscarves and long beards, has been banned in certain areas. This is part of an effort to assimilate Muslims into the broader Han Chinese culture.Censoring Islamic texts: The government has also censored Islamic texts, removing any content that could be perceived as promoting extremism or dissent. This includes altering the Quran and other religious literature to fit the state’s narrative.The report highlights the extensive surveillance network that monitors Muslim communities. High-tech surveillance systems, including facial recognition cameras, are prevalent in areas like Xinjiang, home to a significant Uyghur Muslim population. These systems track individuals' movements and behaviors, ensuring strict compliance with the government's regulations.The restrictions have permeated all aspects of daily life for Muslims in China. Religious education for children has been heavily regulated, with many religious schools being shut down. Additionally, community leaders and imams are required to attend government-run re-education programs to ensure they propagate state-approved messages, the Sky News report said.The international community has responded with concern over China’s treatment of its Muslim population. Human rights organizations have condemned the actions, calling for greater transparency and respect for religious freedoms. The Chinese government, however, maintains that these measures are necessary to combat extremism and ensure national security.","Chinese authorities have intensified efforts to monitor and restrict Islamic practices, including demolishing mosques and banning religious attire. This crackdown is part of a broader campaign to align religious practices with the state's ideology and to curb any potential dissent. High-tech surveillance systems, including facial recognition cameras, are prevalent in areas like Xinjiang.","https://static.toiimg.com/thumb/msid-110495907,imgsize-1691019,width-400,resizemode-4/110495907.jpg"
"Phones, Islamic books, tourism: Taliban on charm offensive to revive Afghan economy",https://timesofindia.indiatimes.com/world/middle-east/phones-islamic-books-tourism-taliban-on-charm-offensive-to-revive-afghan-economy/articleshow/110493793.cms,"A tale of unexpected prosperity

Yet, amidst this backdrop of hardship, certain sectors and individuals find ways to not only survive but thrive, highlighting a complex interplay of resilience and disparity.

Yunis Safi, a businessman in Kabul, understands the subtle power of appearances in Afghanistan's social and economic spheres. Running a phone shop in the upscale Shar-e-Naw neighborhood, Safi explains, ""In Afghanistan, your phone is your personality."" His store, guarded and stocked with high-end iPhones, serves as a stark contrast to the economic conditions outside its doors.

What they are saying: Safi's customers include not just affluent Afghans but also members of the Taliban, indicating a nuanced shift in the group's stance towards technology and commerce. ""Of course they need smartphones. They use social media, they like making videos,"" Safi told AP, pointing out the demand for advanced features and security in mobile devices among his clientele.

Zoom in

The bigger picture

Beyond individual success stories like Safi's, the overall economic narrative of Afghanistan is one of a country at a crossroads. The telecommunications sector's growth, highlighted by significant investments in network infrastructure, presents a glimmer of hope. According to the communications ministry, 2 million new SIM cards have been issued in the past two years, and subscriber numbers are growing. The government is investing $100 million in the telecom sector and has fully restored hundreds of towers. Out of the 22.7 million active SIM cards in the country of 41 million people, 10 million are for voice calls, and the rest are for mobile internet. The communications ministry's push to expand digital connectivity across the country suggests a strategic pivot towards modernizing even in times of political and social upheaval, an AP report said.

The Taliban has also entered into preliminary agreements with Kazakhstan and Turkmenistan to establish a logistics hub in western Afghanistan, aiming to position the country as a pivotal route for regional exports, including Russian oil to South Asia, according to Afghanistan's commerce minister. Taliban acting commerce minister Nooruddin Azizi, speaking to Reuters after a tripartite meeting in Kabul last week, announced that technical teams would finalize a written plan for the hub within two months, with investment from all three nations expected six months after discussions.

The proposed hub in Herat province is intended to leverage Afghanistan’s geographical advantage as a historical crossroads of the Silk Road, strategically nestled between South and Central Asia and neighboring China and Iran. Azizi emphasized the significance of this initiative, noting, ""Based on our discussions, a logistics centre is going to be established in Herat province, which can connect the north to South Asia.""

From spring offensive to

charm offensive

In Kabul, about 30 men, including a model and a 17-year-old with no prior job experience, form the inaugural class at a Taliban-run institute designed to foster a cadre of tourism and hospitality professionals. This initiative is part of a broader charm offensive by the Taliban to reshape perceptions of Afghanistan, despite stringent educational and societal restrictions on women. Mohammad Saeed, the head of Kabul's Tourism Directorate, notes a modest uptick in foreign visitors, buoyed by a more peaceful environment and improved flight connections with international hubs like Dubai. Despite this progress, the tourism sector grapples with formidable challenges such as onerous visa processes, severed international diplomatic relations, and a lack of robust infrastructure.

and hospitality professionals. This initiative is part of a broader charm offensive by the Taliban to reshape perceptions of Afghanistan, despite stringent educational and societal restrictions on women. Mohammad Saeed, the head of Kabul's Tourism Directorate, notes a modest uptick in foreign visitors, buoyed by a more peaceful environment and improved flight connections with international hubs like Dubai. Despite this progress, the tourism sector grapples with formidable challenges such as onerous visa processes, severed international diplomatic relations, and a lack of robust infrastructure. Amidst these efforts, Afghanistan is positioning itself as an emerging tourism destination, a vision supported by the Taliban's leadership, as expressed by Saeed. The students at the institute are optimistic about their futures, with aspirations like Ahmed Massoud Talash's aim to enhance his social media presence through scenic Instagram posts, and Samir Ahmadzai's ambition to enter the hospitality business. The curriculum includes traditional Afghan handicrafts and basic anthropology, with an informal focus on understanding cultural interactions with foreign tourists—especially women, given the strict local customs. The reopening of the women’s spa at Kabul’s Serena Hotel exclusively for foreign women after a prolonged shutdown signals a tentative readiness for more international guests. However, the pervasive restrictions on Afghan women and complex global perceptions continue to pose significant hurdles to Afghanistan's tourism ambitions.

Between the lines

The survival and success of businesses like Safi's and the bustling exchange markets provide critical insights into Afghanistan's adaptive economic strategies. These stories of resilience and adaptation are pivotal in understanding how Afghans navigate their new realities under the Taliban's rule, leveraging every available opportunity to forge stability in an unstable environment.

What next: Monitoring how Afghanistan's economy adapts to the current challenges will be crucial. The resilience of sectors like telecommunications and informal finance may dictate the pace and nature of economic recovery or further decline. How the Taliban supports or stifles these growth areas could significantly impact the nation's economic trajectory and its people's everyday lives.

(With inputs from agencies)

In Afghanistan , the economic landscape has drastically shifted since the Taliban 's takeover in 2021. The nation, once buoyed by international aid and foreign investment, now reels under severe financial distress . The freezing of billions in assets and the cessation of most foreign aid have plunged the country into an economic crisis.Afghanistan's financial woes deepen as foreign support dwindles. The takeover by the Taliban has led to a significant retraction of international financial support, exacerbating an already precarious situation. The economy , heavily reliant on aid, faces a dire future with limited immediate prospects for recovery.On the streets of Kabul, another facet of the economy thrives in the bustling money exchange market. Here, Abdul Rahman Zirak estimates that ""$10 million changes hands daily,"" with remittances from the Afghan diaspora playing a critical role. This sector's vibrancy during economic turmoil underscores the crucial role of informal financial systems in sustaining livelihoods when formal banking sectors collapse.","Afghanistan is positioning itself as an emerging tourism destination. The telecommunications sector's growth, highlighted by significant investments in network infrastructure, presents a glimmer of hope. The Taliban has entered into preliminary agreements with Kazakhstan and Turkmenistan to establish a logistics hub in western Afghanistan.","https://static.toiimg.com/thumb/msid-110494115,imgsize-1700640,width-400,resizemode-4/110494115.jpg"
