Article Title,Article Link,Article Text,Article Summary,Article Image
"Who is Juraj Cintula, poet and writer who opened fire on Slovak PM Robert Fico",https://timesofindia.indiatimes.com/world/europe/who-is-juraj-cintula-poet-and-writer-who-opened-fire-on-slovak-pm-robert-fico/articleshow/110176873.cms,"NEW DELHI: Slovak Prime Minister Robert Fico, who was shot outside a government building in Handlova, is in stable condition, a hospital official said.The PM was shot in the chest, abdomen, and one limb. Interior Ministry spokesman Matej Neumann confirmed that it was an ""assassination attempt"". This assassination attempt on Fico shook the small country and reverberated across the continent weeks before European elections.Who is the gunman that tried to kill Slovak PM?Juraj Cintula , a 71-year-old poet hailing from the western town of Levice, took to online platforms to express his grievances against Mr. Fico before confronting the Left-wing nationalist with gunfire at close range on Wednesday.A photograph of the poet, shared on X (formerly Twitter), depicted him protesting against the government’s contentious reforms, notably the abolition of the special prosecutor’s office, back in February.The motive for the attack remains unclear, though Interior Minister Matus Sutaj Estok said the assassination attempt was politically motivated and that the ""perpetrator's decision was born closely after the presidential election"".Despite warnings from the European Commission, the anti-corruption office was shuttered in March by Mr. Fico, who faced accusations of presiding over a mafia state during a previous tenure, according to Telegraph.Regarded as one of the EU’s most pro-Russian leaders, Mr. Fico campaigned on a platform advocating an end to weapons aid to Ukraine.In a 2022 post for the Movement Against Violence, Mr. Cintula vehemently condemned Russia’s invasion of Ukraine, dismissing Kremlin assertions of Slavic brotherhood between the two nations: “What Slavic brotherhood?” he wrote. “He is only the aggressor and the attacked.”A friend from Levice, speaking to Markiza TV, disclosed that they engaged in political debates, noting differences in their views on Russia. “I lean more towards Russia. He held contrasting opinions,” the friend remarked Telegraph reported.In 2015, Mr. Cintula established the campaign group Against Violence, striving to obtain official recognition for it in Slovakia. A petition circulated by him underscored the notion that violence often stems from ordinary dissatisfaction with the prevailing state of affairs. “Violence is often a reaction of people, as a form of expression of ordinary dissatisfaction with the state of affairs. Let’s be dissatisfied, but not violent,” a petition circulated by him said.The suspected gunman's son expressed shock to local media, revealing that his father legally owned the firearm.(With inputs from agencies)","PM Robert Fico was shot in the chest, abdomen, and one limb. Interior Ministry spokesman Matej Neumann confirmed that it was an ""assassination attempt"" The motive for the attack remains unclear, though Interior Minister Matus Sutaj Estok said the assassination attempt was politically motivated.","https://static.toiimg.com/thumb/msid-110180119,imgsize-118676,width-400,resizemode-4/110180119.jpg"
'A wake-up call to West': Europe on edge after assassination attempt on Slovakian PM Robert Fico,https://timesofindia.indiatimes.com/world/europe/a-wake-up-call-to-west-europe-on-edge-after-assassination-attempt-on-slovakian-pm-robert-fico/articleshow/110164222.cms,"Who is Robert Fico?

Europe on edge

In a disturbing incident that has sent shockwaves across Europe, Slovak Prime Minister Robert Fico was targeted in an assassination attempt that left him seriously injured. The event unfolded on a seemingly ordinary day in Handlova, Slovakia, when Fico was approached by a gunman as he was engaging with supporters. The assailant fired five times at close range, critically wounding the prime minister.The PM's bodyguards swiftly intervened, tackling the gunman and whisking Fico away in a government vehicle.He was subsequently airlifted to a hospital for emergency medical treatment.""I was very shocked ... fortunately as far as I know the operation went well - and I guess in the end he will survive ... he's not in a life-threatening situation at this moment,"" Slovak Deputy Prime Minister and Environment Minister Tomas Taraba told the BBC's Newshour.The attacker, identified as 71-year-old Slovak poet Juraj Cintula, was arrested at the scene. The motivations behind the attack appear to be politically charged, reflecting deep divisions within Slovakia and broader regional tensions. Cintula reportedly made a ""confession"" in custody, blaming Fico's media policies for his drastic actions.A seasoned figure in Slovakian politics, Fico was born in 1964 and began his political career as a member of the Communist Party before Slovakia became its independent nation. With a law degree and vast experience in legal and governmental roles, Fico has been a dominant force in Slovak politics.Fico's political journey is marked by significant milestones, including his first election to Slovakia's parliament in 1992 and his subsequent rise to become the chairman of the Smer (Direction) party in 1999. His tenure is characterized by a left-populist ideology, though comparisons have been drawn with right-wing leaders like Viktor Orbán of Hungary.After a hiatus, Fico reclaimed the prime ministerial position last year, marking his third term and establishing him as the longest-serving head of government in Slovakia's history. His recent electoral victory was fueled by a platform that controversially aligned more closely with pro-Russian stances and criticized US and Nato policies, especially regarding the situation in Ukraine.This assassination attempt occurs against a backdrop of heightened geopolitical tension. Fico, known for his pro-Putin stance, has been a controversial figure in European politics, especially regarding his opposition to supporting Ukraine against Russian aggressions.Starting his fourth term as prime minister, Fico administration stopped arms shipments to Ukraine, and critics are concerned that he might steer Slovakia — a Nato member with a population of 5.4 million — away from its pro-Western trajectory towards a path similar to that of Hungary under populist Prime Minister Viktor Orbán.Russian President Vladimir Putin , who has shown support for Fico in the past, condemned the attack. Describing the shooting as a ""monstrous"" crime, Putin said in a telegram sent to Slovakia's President Zuzana Caputova: ""I know Robert Fico as a courageous and strong-minded man. I very much hope that these qualities will help him to survive this difficult situation.""The implications of this attack are far-reaching, raising concerns about the stability of not only Slovakia but the entire European region. Fico’s policies and his alignment with Russia have been divisive, and this incident may further inflame political tensions.World leaders, including US President Joe Biden and Ukrainian President Volodymyr Zelenskyy , have condemned the attack. The European Commission President Ursula von der Leyen emphasized that such acts of violence undermine democracy and have no place in society.Colonel Hamish de Bretton-Gordon, a former commanding officer of UK's 1st Royal Tank Regiment, expressed his concerns to Daily Mail, saying, ""There are high stakes in Europe and the threat of a wider war only benefits Putin.""He further warned, ""This is yet another wake-up call to the West. If we ignore this latest threat to Western security the chances of getting drawn into a wider war in Europe are manifestly greater.""(With inputs from agencies)","Slovak Prime Minister Robert Fico was targeted in an assassination attempt that left him seriously injured. Fico, known for his pro-Putin stance, has been a controversial figure in European politics. The motivations behind the attack appear to be politically charged, reflecting deep divisions within Slovakia and broader regional tensions.","https://static.toiimg.com/thumb/msid-110166458,imgsize-1841050,width-400,resizemode-4/110166458.jpg"
Xi Jinping is now Vladimir Putin's 'big brother': How Russia-China ties changed over the years,https://timesofindia.indiatimes.com/world/china/xi-jinping-is-now-putins-big-brother-how-russia-china-ties-changed-over-the-years/articleshow/110162516.cms,"Driving the news

This is Putin's first trip abroad since his March re-election and the second in just over six months to China.

However, this is Putin's 19th visit to China since he became the Russian president.

In February 2022, China and Russia announced a ""no limits"" partnership during Putin's visit to Beijing, occurring just days before he deployed tens of thousands of troops into Ukraine, sparking the most severe land conflict in Europe since World War Two.

Putin's decision to choose China for his first overseas visit after being inaugurated for a new six-year term, extending his leadership until at least 2030, underscores the significance he places on his bond with Xi and his global strategic priorities.

In a discussion with China's Xinhua news agency, Putin commended Chinese President Xi Jinping for fostering a ""strategic partnership"" between Russia and China, which he described as rooted in national interests and profound mutual trust.

Zoom in

This visit is not just a routine diplomatic engagement but a strategic display of defiance against Western pressures.

The frequency and depth of military collaborations, such as joint naval drills near strategic global areas, signal a growing military camaraderie.

However, these maneuvers signal more about the depth of their partnership than actual operational military alliances. The joint naval patrols near American waters and the inclusion of Russia in Chinese-led military drills are significant developments that the West views with increasing concern.

Moreover, the economic interdependence, highlighted by China’s role as a critical supplier to Russia’s defense sector, showcases the depth of their bilateral ties, which are becoming increasingly consequential in the global arena.

Why it matters

The strengthening bond between China and Russia is pivotal as both nations seek to assert their power on the global stage against a backdrop of American dominance.

This alliance is particularly critical for Russia as it continues to face extensive economic sanctions from the West.

China’s support not only bolsters Russia’s economy but also enhances its military capabilities through joint exercises and technology transfers.

As per a report in the Economist, the flow of Chinese technology and other valuable goods to Russian weapons manufacturers has become a significant concern for the United States. According to US secretary of state Antony Blinken China was the ""top supplier"" of various items considered be ""dual use,"" including machine tools, microelectronics, and nitrocellulose, a vital component in artillery shells. These items have both civilian and military applications.

""Russia would struggle to sustain its assault on Ukraine without China's support,"" Blinken said. In a later conversation with Borge Brende, the president of the World Economic Forum, Blinken said that over the past year, Chinese technology had been facilitating Russia's production of weapons and ammunition, such as missiles and tanks, at an unprecedented rate in its modern history, surpassing even the levels seen during the Cold War era, the Economist report added.

What they are saying

""It was the unprecedentedly high level of the strategic partnership between our countries that determined my choice of China as the first state that I would visit after officially taking office as president of the Russian Federation,"" Putin said.

""We will try to establish closer cooperation in the field of industry and high technology, space and peaceful nuclear energy, artificial intelligence, renewable energy sources and other innovative sectors,"" Putin said.

""This is Putin's first trip after his inauguration, and it is therefore intended to show that Sino-Russian relations are moving up another level,"" independent Russian political analyst Konstantin Kalachev told AFP.

""The China-Russia relationship today is hard-earned, and the two sides need to cherish and nurture it,"" Xi told Putin.

""China is willing to ... jointly achieve the development and rejuvenation of our respective countries, and work together to uphold fairness and justice in the world,"" said Xi.

""The United States still thinks in terms of the Cold War and is guided by the logic of bloc confrontation, putting the security of 'narrow groups' above regional security and stability, which creates a security threat for all countries in the region,"" the joint statement said. ""The US must abandon this behaviour.""

The 'big brother' role reversal

The relationship between Russia and China has undergone a significant transformation in recent years, with Moscow becoming increasingly dependent on Beijing as it faces Western sanctions over the war in Ukraine.

Once a partnership of equals, the Russia-China dynamic has become increasingly asymmetrical, with China holding the upper hand. While China accounts for around 33% of Russia's overall trade, Russia makes up only 4% of China's trade, according to data provider CEIC Data.

China has emerged as a critical source of essential goods for Russia, supplying everything from electronics to washing machines to tractors.

However, Russia's arms exports to China have fallen precipitously in recent years, while China has become a significant provider of optics, microelectronics, drone engines, and other materials that enable Russia's weapons production. The energy trade between the two countries has also shifted in China's favor.

""It's a strategic partnership where both sides need each other but it's increasingly asymmetrical in China's favor,"" Alexander Gabuev, director of the Carnegie Russia Eurasia Center in Berlin, told the Wall Street Journal. ""China is not only the more powerful partner, but also the one that has many more options than Russia and the war has exacerbated that.""

Russia, with its oil and gas now shunned in Europe, has had to sell at significant discounts to China.

China’s upper hand is evident in negotiations over new projects like the Power-of-Siberia 2 gas pipeline, where Beijing's reluctance to finalize terms highlights its leverage over Moscow.

Putin, who is sometimes known for his haughty displays of making other leaders wait during their visits to the Kremlin, has adopted a noticeably deferential tone towards Xi Jinping, a LA Times report said.

No wonder, an Economist report described the visit as ""Vladimir Putin will meet his big brother in Beijing.""

What next

China, once the junior partner of Moscow in the global Communist hierarchy, has emerged as by far the most powerful of Russia's friends in the world.

Consequently, in the evolving personal relationship between the two ""presidents for life"", Xi has emerged as the ""big brother"" to Putin.

At the same time, the strengthening ties between China and Russia represent a significant shift in global alliances and power structures. The implications of their collaboration will undoubtedly extend far beyond their own borders, challenging the current international order and testing the diplomatic resilience of the Western powers.

NEW DELHI: Russian President Vladimir Putin arrived in Beijing on Thursday for a two-day state visit to China, underscoring the solidarity between the two allies as Russia continues its new offensive in Ukraine.Upon his arrival at dawn, Putin was greeted by an honor guard from the People's Liberation Army, the military branch of China's ruling Communist Party.His motorcade, flanked by a brigade of military police on motorcycles, proceeded into the city. Putin is scheduled to meet with Chinese President Xi Jinping and other senior officials.(With inputs from agencies)",Putin's decision to choose China for his first overseas visit after being inaugurated for a new six-year term underscores the significance he places on his bond with Xi and his global strategic priorities. The strengthening bond between China and Russia is pivotal as both nations seek to assert their power on the global stage.,"https://static.toiimg.com/thumb/msid-110162715,imgsize-29492,width-400,resizemode-4/110162715.jpg"
Spicy chip death: US teen dies after taking part in 'spicy chip challenge': Autopsy,https://timesofindia.indiatimes.com/world/us/us-teen-dies-after-taking-part-in-spicy-chip-challenge-autopsy/articleshow/110192890.cms,"NEW DELHI: A teenager from the United States died of cardiac arrest after participating in a social media challenge that dared people to consume a very spicy tortilla chip, as confirmed by an autopsy on Thursday.Harris Wolobah, a 14-year-old from Massachusetts, died in September after taking part in the so-called ""one chip challenge"" -- which involved a single chip produced by Paqui, dusted with Carolina Reaper and Naga Viper peppers .The challenge has appeared in various versions over the years, with the peppers changing every time.The local chief medical examiner concluded that Harris died of cardiac arrest after consuming food containing a significant amount of capsaicin, a chili pepper extract, according to the autopsy report viewed by AFP.The autopsy also determined that the teenager had an enlarged heart, which might have played a role in his passing.Days after his death, Paqui removed the product -- packaged in a coffin-shaped box with a red skull and marked ""extreme heat"" -- from store shelves.In California, three young people were admitted to the hospital after participating in the challenge, and seven became ill in Minnesota for the same cause, as reported by the media.(With inputs from agencies)","Harris Wolobah, a 14-year-old from Massachusetts, died in September after taking part in the so-called ""one chip challenge"" The challenge involved a single chip produced by Paqui, dusted with Carolina Reaper and Naga Viper peppers.","https://static.toiimg.com/thumb/msid-110193233,imgsize-1497395,width-400,resizemode-4/110193233.jpg"
US recognises Chabahar's key role in Afghanistan: MEA,https://timesofindia.indiatimes.com/world/us/us-recognises-chabahars-key-role-in-afghanistan-mea/articleshow/110217682.cms,"NEW DELHI: The US has shown an understanding of the importance of the Chabahar Port operations for continued humanitarian supplies to Afghanistan and to provide Afghanistan with economic alternatives , govt said Friday.The US had earlier this week, after India signed a long-term contract with Iran for development of the port, reminded India of potential risks from sanctions.""I would like to reiterate what EAM (Jaishankar) had earlier said that we should not take a narrow view of this issue. The project will benefit the entire region, particularly landlocked Afghanistan and Central Asia. The US has in the recent past appreciated the larger relevance of the Chabahar project, particularly in the context of humanitarian supplies to Afghanistan,"" said foreign ministry spokesman Randhir Jaiswal.The official said India's commitment towards the Chabahar Port is to realise its potential as a connectivity hub for Afghanistan, and Central Asian countries, which are landlocked. The Indian company, India Ports Global Limited, has beenoperating the port since 2018 on an interim lease.""Now, we have concluded a long-term agreement which is essential for port operation. Since then, we have provided humanitarian assistance including 85,000 metric tonnes of wheat, 200 metric tonnes of pulses and 40,000 litres of pesticide Malathion, to Afghanistan through this port,"" he said.","The US has shown an understanding of the importance of the Chabahar Port operations for continued humanitarian supplies to Afghanistan. The US had earlier this week, after India signed a long-term contract with Iran for development of the port, reminded India of potential risks from sanctions.","https://static.toiimg.com/thumb/msid-110217680,imgsize-28252,width-400,resizemode-4/110217680.jpg"
US arrests two Chinese nationals in $73 million crypto scam,https://timesofindia.indiatimes.com/world/us/us-arrests-two-chinese-nationals-in-73-million-crypto-scam/articleshow/110215626.cms,"US: authorities charged two Chinese nationals in a cryptocurrency scam that laundered at least $73 million from defrauded victims, the justice department said on Friday.US officials arrested Yicheng Zhang in Los Angeles on Thursday, according to an indictment unsealed in US district court in California's central district later that day. Daren Li, a dual citizen of China and St Kitts and Nevis, was arrested at the Atlanta airport in April.The US accused the two of being involved in a type of cryptocurrency investment scam known as pig butchering , which has become a global billion-dollar industry.The defendants are alleged to have instructed co-conspirators to open US bank accounts in the name of shell companies .Victims were induced online into depositing money into these accounts - funds that were then laundered through US financial institutions to bank accounts in the Bahamas.""While fraud in the crypto markets takes on many forms and hides in many far-off places, its perpetrators aren't beyond the law's reach,"" US deputy attorney General Lisa Monaco said in a statement.Li and Zhang are both charged with conspiracy to commit money laundering and six counts of international money laundering. If convicted, the defendants face a maximum of 20 years in prison on each count, the Justice Department said.","US officials arrested Yicheng Zhang in Los Angeles on Thursday. Daren Li, a dual citizen of China and St Kitts and Nevis, was arrested at the Atlanta airport in April. The US accused the two of being involved in a type of cryptocurrency investment scam known as pig butchering.","https://static.toiimg.com/thumb/msid-110215805,imgsize-1716667,width-400,resizemode-4/110215805.jpg"
Janet Yellen to push G7 to bring forward interest on Russian assets to aid Ukraine,https://timesofindia.indiatimes.com/world/us/yellen-to-push-g7-to-bring-forward-interest-on-russian-assets-to-aid-ukraine/articleshow/110215424.cms,"WASHINGTON: US treasury secretary Janet Yellen will push fellow G7 finance officials next week to agree to a plan to bring forward the interest earnings on frozen Russian assets to provide more money to Ukraine quickly, a senior US treasury official said on Friday.The official told reporters ahead of Yellen's May 21-25 trip to Frankfurt, Germany, and the Group of Seven finance ministers and central bank governors meeting in Stresa, Italy, that the G7 is ""making progress"" toward consensus on a plan to harness some $300 billion in Russian sovereign assets frozen since Moscow's 2022 invasion of Ukraine.The G7 finance ministers have been tasked with recommending a plan for G7 leaders to adopt at a summit in June in southern Italy. The G7 industrial democracies are the United States, Japan, Germany, France, Britain, Italy and Canada.Yellen had previously pushed for full confiscation of the largely euro-denominated assets, but Europe has balked, opting instead for a more conservative plan to put the earnings -- estimated at around $3.5 billion per year -- into a fund for Ukraine.Since then, the US has proposed a plan to bring forward the interest on the assets to back a bond or a loan that would provide Ukraine perhaps $50 billion in the near term as it battles increasing Russian military pressure in its east and north.The US official said there was a unified goal among the G7 officials to provide more money to Ukraine, and to demonstrate to Russian President Vladimir Putin that he cannot simply ""wait out our coalition.""""What we are involved in is trying to engage in hard, detailed economic diplomacy to make sure we can all get on the same page. And I think we're making progress there,"" the official said, speaking on condition of anonymity.Another G7 official said the US proposal to use revenues from the Russian assets as collateral for a bond is still on the table, and G7 ministers will discuss its feasibility. But any final decision will be up to G7 leaders, that official said.Yellen also intends to discuss joint efforts with G7 counterparts to combat China's excess industrial capacity in strategic industries, including electric vehicles, solar products and semiconductors. This will include the Biden administration's new punitive tariffs on Chinese imports announced on Tuesday.","US treasury secretary Janet Yellen will push fellow G7 finance officials next week to agree to a plan to bring forward the interest earnings on frozen Russian assets. Yellen had previously pushed for full confiscation of the largely euro- denominated assets, but Europe has balked.","https://static.toiimg.com/thumb/msid-110217393,imgsize-871786,width-400,resizemode-4/110217393.jpg"
