Article Title,Article Link,Article Text,Article Summary,Article Image
Who will moderate the first Trump and Harris presidential debate on September 10; see details,https://timesofindia.indiatimes.com/world/us/who-will-moderate-the-first-trump-and-harris-presidential-debate-on-september-10/articleshow/112478087.cms,"Who will moderate the

presidential showdown

Who is David Muir

Who is Linsey Davis

The first one-on-one encounter between Former President Donald Trump and his rival Vice President Kamala Harris will be on September 10 , as announced by ABC News earlier last week, the 90-minute showdown is expected to be held in Philadelphia .In a statement the news agency said: “ABC News will host qualifying presidential candidates to debate on September 10 on ABC.Vice President Harris and former President Trump have both confirmed they will attend the ABC debate.”ABC anchors David Muir and Linsey Davis will moderate the September 10 debate. Although the exact format and ground rules are still being finalised, it is likely that the event will proceed without a live audience.President Trump and former Vice President Joe Biden were scheduled to have their second and final debate on the same day, prior to Trump's decision to withdraw from the race, ABC News said, the USA Today reported.David Muir, the anchor of ""World News Tonight,"" who has been with ABC since 2003, will be moderating the event.Muir is well-known by both Democrats and Republicans, interviewed Biden during D-Day coverage and conducted Trump's first White House interview as president in 2017. Muir also has experience moderating presidential primary debates in 2016 and 2020.Joining Muir will be Linsey Davis, the anchor of ""ABC News Live Prime,"" who has been with the network since 2007. Davis has moderated presidential debates in 2019 and 2020, and has covered both the Democratic National Convention and Republican National Convention, the USA Today reported.Trump had earlier proposed three debates with major networks - September 4 with Fox News , September 10 with NBC, and September 25 with ABC. However, Harris has agreed to participate only in the September 10 debate with NBC, although she has not yet provided reasons for declining the other proposed dates.",David Muir and Linsey Davis will moderate the September 10 debate. The 90-minute showdown is expected to be held in Philadelphia. The exact format and ground rules are still being finalised. It is likely that the event will proceed without a live audience.,"https://static.toiimg.com/thumb/msid-112478431,imgsize-951014,width-400,resizemode-4/112478431.jpg"
"Quake felt from Los Angeles to San Diego, swaying buildings and knocking items off shelves but no big damage",https://timesofindia.indiatimes.com/world/us/quake-felt-from-la-to-san-diego-swaying-buildings-and-knocking-items-off-shelves-but-no-big-damage/articleshow/112476755.cms,"LOS ANGELES: A 4.4 magnitude earthquake was strongly felt Monday afternoon from the Los Angeles area all the way to San Diego , swaying buildings, rattling dishes and setting off car alarms, but no major damage or injuries were immediately reported.Monday's quake was centered near the Los Angeles neighborhood of Highland Park, about 6.5 miles (10.5 kilometers) northeast of Los Angeles' City Hall, and about 7.5 miles (12.1 kilometers) below the surface, the U.S.Geological Survey said.The quake was felt from greater Los Angeles south to San Diego and east to the Palm Springs desert region, according to the USGS community reporting page. A small number of reports were filed from the southern San Joaquin Valley about 100 miles (160) northwest of LA.It shook a medical building, a live interview on ESPN was interrupted, and the ground swayed in Anaheim, where Disneyland is located in Orange County. Dishes rattled in the storied LA neighborhood of Laurel Canyon, home to many celebrities, and photos on social media showed shampoo bottles and other items littering the floor of a Target store in LA.TV news helicopters showed water spilling from an upper floor of Pasadena City Hall, an ornate domed structure dating to 1927 and seismically retrofitted in the 2000s. Pasadena public information officer Lisa Derderian confirmed that the water leak was caused by the quake. About 200 employees safely evacuated from City Hall, and one person was rescued from an elevator, she said.There was no obvious damage to Pasadena's century-old Rose Bowl, but an engineer will do a full assessment, Derderian said. There was no immediate assessment of the city's 1927 Central Library, which was closed in 2021 for a pending seismic retrofit. ""We have not gone inside there to look at it,"" she said.Los Angeles firefighters from all 106 stations surveyed the 470-square-mile (1,217-square-kilometer) city and found no significant damage, spokesperson Margaret Stewart said in a statement.The quake served more as a reminder of what could happen in a state where a huge population lives above active fault lines.""Having lived through the Northridge earthquake (magnitude 6.7 in 1994), today's tremor made me flash back to what we know are lifesaving rules during an earthquake: drop, cover, and hold on,"" said Los Angeles County Supervisor Kathryn Barger. ""It was also a reminder to us all that we live in earthquake country and we need to be prepared.""The National Weather Service said a tsunami was not expected, and the USGS downgraded its initial estimate of 4.6 for the quake's magnitude.Richard Egan was eating lunch with colleagues on the second floor of an office building near the Long Beach Airport, about 20 miles (32.2 kilometers) south of the quake's epicenter, when there was a sudden jolt.""It got really quiet,"" he said, ""and we waited for a bigger quake to follow.""There was rolling for about 45 seconds, he estimated, but with no more shaking, the lunchtime conversation resumed where it left off, said Egan, who has lived through many quakes during his 59 years in Southern California . He rated this one as average.The quake struck on the first day of the new school year for 540,000 students in the Los Angeles Unified School District. Many schools felt the quake, and at least one high school, John Marshall in Los Feliz, alerted parents that they had evacuated the buildings to check for damage but didn't see any immediately.""We have not received reports of any injuries or significant damage to our facilities,"" district Superintendent Alberto M. Carvalho said in a social media post.The quake comes less than a week after a 5.2 magnitude temblor hit southern California and was also widely felt in Los Angeles. That quake caused no injuries or major damage.",The quake was centered near the Los Angeles neighborhood of Highland Park. It was felt from greater Los Angeles south to San Diego and east to the Palm Springs desert region. A small number of reports were filed from the southern San Joaquin Valley about 100 miles (160) northwest of LA.,"https://static.toiimg.com/thumb/msid-112476961,imgsize-64760,width-400,resizemode-4/112476961.jpg"
Senator Chuck Schumer labelled 'scumbag' at Dominican day parade in US; watch,https://timesofindia.indiatimes.com/world/us/senator-chuck-schumer-labelled-scumbag-at-dominican-day-parade-in-us-watch/articleshow/112476681.cms,"Videos circulating online showed the US Senate Majority Leader Chuck Schumer being called a ' scumbag ' by an individual at the Dominican Day Parade in New York City on Sunday.The unidentified man said: ""Hey, Chuck. You know Dominicans actually hate your guts, because you're a scumbag. You know that right?""The critic went on to blame Schumer for the state of New York, calling him a ""loser"" twice.He said; ""You ruined New York. You're a loser. You're a loser buddy.""In a separate incident, the Dominican Day Parade in Manhattan was suddenly halted by authorities due to a chaotic and uncontrollable crowd that overwhelmed the Midtown route.Police officials said that during the disturbance, a teenager slashed a 65-year-old man across the face, The New York Post reported.The parade, which has been a tradition for 42 years, typically attracts around 500,000 spectators and includes 113 participating organizations, such as community groups, carnival bands, and government officials.",Videos circulating online showed the US Senate Majority Leader Chuck Schumer being called a'scumbag'by an individual at the Dominican Day Parade in New York City on Sunday. The parade was suddenly halted by authorities due to a chaotic and uncontrollable crowd that overwhelmed the Midtown route.,"https://static.toiimg.com/thumb/msid-112476714,imgsize-74670,width-400,resizemode-4/112476714.jpg"
"JD Vance reveals the moment he knew Tim Walz was the 'weird' one, says...",https://timesofindia.indiatimes.com/world/us/jd-vance-reveals-the-moment-he-knew-tim-walz-was-the-weird-one-says-/articleshow/112476491.cms,"JD Vance , the Republican vice presidential nominee fired back at Kamala Harris ’s running mate Minnesota Governor Tim Walz over calling GOP ticket ‘weird’, arguing that it's actually the Democratic vice-presidential pick who has shown he's the odd one out.Vance pointed to an awkward moment caught on camera, where the 60-year-old Walz greeted his wife with a “Midwestern handshake” during a rally where Kamala Harris introduced him as her running mate, The New York Post reported.“I remember when I had just been announced as the VP nominee, I gave my big speech and I saw my wife and I gave her a big hug and a kiss because I love my wife. And I think that’s what a normal person does,” Vance told CNN in an interview that aired Sunday.“Tim Walz gave his wife a name, firm midwestern handshake and then tried to sort of awkwardly correct for it,” he added.Donald Trump Jr. shared a clip of the interaction and said: “Totally normal to greet your wife with a firm handshake and a bro hug/back slap. Tim Walz isn't weird at all, guys.”The Ohio Senator said Harris and Walz, her running mate, ""aren't comfortable in their own skin"" and are attempting to persuade the American public that it is the Republicans who are peculiar.Vance believes that the handshake demonstrates Walz's attempt to divert attention from his own awkwardness by persistently labeling him as strange. “I think what it is, is two people, Kamala Harris and Tim Walz, who aren't comfortable in their own skin, because they're uncomfortable with their policy positions for the American people,” Vance told CNN host Dana Bash on “State of the Union”.“And so they're name-calling instead of actually telling the American people how they're going to make their lives better,' he said. 'I think that's weird, Dana. But look, they can call me whatever they want to,” he added.Vance said: They're trying to distract from their own policy failures. I mean look, this is fundamentally schoolyard bully stuff,” adding that, “They can accuse me or whatever they want to accuse me of, the Daily Mail reported.'I accept their attacks but I think that it is a little bit of projection,” he added.In what seems to be an unprecedented move, Walz has labeled the 2024 Republican ticket as weird, with most of the criticism directed at Vance. The Ohio Senator dismissed the attacks, seemingly unfazed by the criticism leveled against him and the Republican ticket on Sunday.Despite their Midwestern origins, both Vance and Walz have emphasized their backgrounds and upbringings as evidence of their understanding of the concerns and values of middle America.When asked by Bash about Trump's response to the 'weird' attacks, the former president said: “Not me, they're talking about JD.”The GOP VP pick chuckled and said: “Certainly they've levied that charge at me more than anyone else. But I think that drives home how they're trying to distract from their own policy failures.”“This is fundamentally schoolyard stuff,” Vance added.","JD Vance, the Republican vice presidential nominee fired back at Kamala Harris’s running mate Minnesota Governor Tim Walz over calling GOP ticket ‘weird’ The Ohio Senator said Harris and Walz, her running mate, ""aren't comfortable in their own skin"" and are attempting to persuade the American public that it is the Republicans who are peculiar.","https://static.toiimg.com/thumb/msid-112476584,imgsize-45956,width-400,resizemode-4/112476584.jpg"
'Trying to kill him': GOP rep. Michael Waltz accuses Biden administration of ‘burying’ Iran’s threats against Trump,https://timesofindia.indiatimes.com/world/us/trying-to-kill-him-gop-rep-michael-waltz-accuses-biden-administration-of-burying-irans-threats-against-trump/articleshow/112475240.cms,"What documents have been leaked

‘Iran's motives for wanting Trump dead’

What US intelligence said

Rep. Michael Waltz (R-Fla.) accused the Biden administration of “burying” Iran ’s threats against GOP presidential candidate Donald Trump in the wake of the recent hacking attack on the Trump campaign and argued that the administration is sending the wrong message to Tehran.“These plots from Iran are ongoing. And when Biden says nothing, Harris says nothing, the DOJ tries to bury it, what message does Iran get? They get that we can keep trying to take Trump out and have no consequences,” Waltz told Fox News’.“They tried to hack his campaign or did hack his campaign this week.They’re trying to kill him. And we know from the intelligence community Iran doesn’t want Trump back,” he added.On Saturday, Trump's campaign confirmed that some of its internal communications had been hacked. This acknowledgment came after Politico began receiving emails from an anonymous source containing documents purportedly from inside Trump’s campaign operation. The Trump campaign attributed the breach to “foreign sources hostile to the United States,” referencing a recent Microsoft report.Earlier, on Friday, Microsoft disclosed that Iranian hackers had “sent a spear phishing email in June to a high-ranking official on a presidential campaign.” While Microsoft did not identify the specific campaign targeted and declined to comment further, the Trump campaign drew a connection between this incident and their own breach.Several news organisations, such as Politico and the Washington Post, claimed to have obtained Trump campaign materials that seemingly originated from the hack, The New York post reported.As per Politico, they received certain documents from “Robert” using an AOL email account. The documents consist of what appeared to be internal communications from a senior Trump campaign official. The report cited two people familiar with documents as saying that they are authentic. Additionally, Politico received a set of materials pertaining to Sen. Marco Rubio (R-Fla.), who was rumored to be a top contender in the vice presidential selection process.Among the information provided to these outlets was a comprehensive 271-page document about JD Vance, the Republican vice presidential nominee. The document appeared to be a compilation of publicly available information, intended to vet Vance and assess his potential vulnerabilities. The dossier was prepared by Brand Woodward, a law firm that provides services to several Trump advisers.Steven Cheung, a spokesperson for the Trump campaign said: “These documents were obtained illegally from foreign sources hostile to the United States, intended to interfere with the 2024 election and sow chaos throughout our democratic process.”Cheung further linked the timing of the breach with a Microsoft report that noted Iranian hackers had compromised an account of a “high-ranking official” on a US presidential campaign in June 2024, coinciding with the close timing of Trump’s selection of a vice-presidential nominee. However, Cheung did not disclose whether the campaign had been in contact with Microsoft or law enforcement about the breach, stating the campaign would not discuss such conversations.According to Waltz, who holds positions on the House Intelligence, Armed Services, and Foreign Affairs Committees and is rumored to be a potential candidate for a significant foreign policy role should Trump secure victory in the 2024 election, “You have multiple assassination plots from the Iranians. This Pakistani national was recruiting females as spotters. He had recruited hit men and had made a down payment. He was even recruiting protesters as a distraction.”“Yet, the Department of Justice, when they unveiled the indictment, didn’t even name Trump as the target. They tried to soft-pedal it and just say, oh, it was a politician. So this wasn’t an isolated incident in Butler, Pa,” he added.It is a widely held belief that Iran seeks retribution against Trump for his role in ordering the killing of Iranian Gen. Qasem Soleimani in 2020. The Trump administration claimed that Soleimani was “developing plans to attack American diplomats and service members in Iraq and throughout the region,” The New York post reported.US officials have long maintained that Soleimani played a role in distributing improvised explosive devices responsible for the deaths and severe injuries of thousands of US soldiers during the Second Iraq War.Moreover, the strike occurred amidst a series of provocative actions taken by Iran in the region, some of which Trump did not retaliate against.Waltz argued that Iran's motives for wanting Trump dead are clear. “He held them accountable. And you overlay that with, how has Biden and Harris treated Iran? Well, Iran knows that they’re sympathizers,” he said.According to US intelligence officials , Iran has directed its propaganda efforts towards Trump. In 2021, a declassified assessment by the director of National Intelligence revealed that Iran targeted Trump during the 2020 election cycle, The New York post reported.The document stated: “We assess that Iran carried out a multi-pronged covert influence campaign intended to undercut former President Trump’s reelection prospects—though without directly promoting his rival,” adding that “We assess that Supreme Leader Khamenei authorized the campaign.”Tehran has officially denied the accusations of interfering in US elections.","On Saturday, Trump's campaign confirmed that some of its internal communications had been hacked. This acknowledgment came after Politico began receiving emails from an anonymous source containing documents purportedly from inside Trump’s campaign operation. The Trump campaign attributed the breach to “foreign sources hostile to the United States,” referencing a recent Microsoft report. It is a widely held belief that Iran seeks retribution against Trump for his role in ordering the killing of Iranian Gen. Qasem Soleimani.","https://static.toiimg.com/thumb/msid-112475922,imgsize-43074,width-400,resizemode-4/112475922.jpg"
Timing of Iran attack on Israel could be this week: White House,https://timesofindia.indiatimes.com/world/us/timing-of-iran-attack-on-israel-could-be-this-week-white-house/articleshow/112475228.cms,"As war clouds hoover over Middle East , US President Joe Biden on Monday dialed up leaders in western capitals to discuss the ongoing tense situation in the region, including Iran 's threat to attack Israel . The US president spoke to leaders of Britain, France, Germany and Italy, White House spokesperson John Kirby said.The National spokesman said, ""we have to be prepared for what could be a significant set of attacks,"" adding that Washington shared Israeli assessments that any attack ""could be this week.""The spokesperson warned that the western capitals should be prepared for ""significant attacks"".The White House also added that the timing of the attack could have an adverse impact on the Gaza ceasefire talks.The US also said its incumbent on the European nations to ""decide what role they would take in the event of an Iranian attack on Israel"".The warning also came as the US deployed a guided missile submarine to the Middle East in the wake of reports that an attack from Iran against Israel was imminent.Following a conversation with his Israeli counterpart, defense secretary Austin also ordered the Abraham Lincoln strike group to expedite its deployment to the region.“Secretary Austin reiterated the United States’ commitment to defend Israel and emphasized the enhancement of US military force posture and capabilities throughout the Middle East due to escalating regionaltensions ,” the Pentagon statement on Sunday read. The US military plans to send extra fighter jets and Navy warships to the Middle East to strengthen Israeli defenses.The recent escalation was triggered by the assassination of Ismail Haniyeh, the political leader of Iran-backed Hamas, in Tehran on July 31. This attack has led to threats of retaliation from Iran against Israel, which is engaged in conflict with Hamas in Gaza. Iran has accused Israel of the killing, although Israel has not claimed responsibility. The situation was further exacerbated by the death of Fuad Shukr, a senior military commander of Hezbollah, in an Israeli strike on Beirut.However, Iran has accused the US of complicity in Haniyeh's assassination due to its support for Israel. Amid these rising tensions, several US and coalition personnel were injured in a drone attack in Syria on Friday, marking the second significant attack on US forces in recent days..","US President Joe Biden dialed up leaders in western capitals to discuss the ongoing tense situation in the region. The US also said its incumbent on the European nations to ""decide what role they would take in the event of an Iranian attack on Israel""","https://static.toiimg.com/thumb/msid-112475218,imgsize-26454,width-400,resizemode-4/112475218.jpg"
Pakistan army arrests former ISI chief over graft and misuse of office,https://timesofindia.indiatimes.com/world/pakistan/pakistan-army-arrests-former-isi-chief-over-graft-and-misuse-of-office/articleshow/112476159.cms,"ISLAMABAD: A former chief of Pakistan’s Inter-Services Intelligence, Lt Gen Faiz Hameed (Retd), has been taken into military custody and field court martial proceedings initiated against him over allegations of corruption and misuse of authority, Inter-Services Public Relations (ISPR), the Pakistan army ’s media wing, said on Monday.This is the first time in the country’s history that a court martial has been initiated against a former ISI chief.Hameed, who served as ISI chief from June 2019 to Oct 2021, was widely believed to be close to jailed former prime minister Imran Khan’s govt.The arrest, according to ISPR, was ordered by the Supreme Court in a petition filed by the owner of a private housing society in Islamabad accusing the former spymaster of torturing him and his family members and robbing them of their properties and valuables. Hameed has also been accused of multiple violations of the Pakistan Army Act after retirement.“Complying with the orders of the Supreme Court of Pakistan, a detailed court of inquiry was undertaken by the Pakistan Army to ascertain the correctness of complaints in the Top City (housing society) case made against Lt Gen Faiz Hameed (Retd),” the military said in a statement.The management of Top City had accused the former ISI chief of orchestrating a raid on its offices and residence of its owner, Moeez Khan. As per the petition, filed in May 2017, Pakistan Rangers and ISI officials had taken away valuables, including gold and diamond ornaments and money, in connection with a purported terrorism case.Consequently, according to ISPR, appropriate disciplinary action has been initiated against Hameed under provisions of the Pakistan Army Act.“In addition, multiple instances of violation of Pakistan Army Act post-retirement have also been established,” the statement said.Hameed came into the global spotlight when he was filmed drinking tea in the lobby of a Kabul hotel shortly after the Taliban took over Afghanistan in 2021, forcing the former ruler, Ashraf Ghani, to flee.His transfer out of his ISI post had become a bone of contention between the former PM and the then army chief, Gen Qamar Javed Bajwa, which ultimately ended in Imran’s ouster from office in April 2022. Hameed had sought early retirement from the army in Nov 2022.Hameed was among the six senior-most army generals who were nominated by General HQ as a potential candidate for the two top military offices, chief of army staff (COAS) and chairman joint chiefs of staff committee (CJCSC). He had served as Peshawar and Bahawalpur corps commander before retirement.",Lt Gen Faiz Hameed (Retd) taken into military custody. Court martial proceedings initiated against him over allegations of corruption and misuse of authority. This is the first time in the country’s history that a court martial has been initiated against a former ISI chief.,"https://static.toiimg.com/thumb/msid-112476162,imgsize-442300,width-400,resizemode-4/112476162.jpg"
