Article Title,Article Link,Article Text,Article Summary,Article Image
Murder trial ordered in Michigan killing that stoked anti-immigrant campaign rhetoric,https://timesofindia.indiatimes.com/world/us/murder-trial-ordered-in-michigan-killing-that-stoked-anti-immigrant-campaign-rhetoric/articleshow/110546171.cms,"GRAND RAPIDS: A man accused of killing his Michigan girlfriend after returning to the US following deportation was ordered Wednesday to stand trial for murder.The case against Brandon Ortiz Vite , a Mexican citizen, became a political flashpoint in April when former President Donald Trump accused the Biden administration of failing to keep him out of the country. Ortiz Vite, 25, was deported in 2020. It's not known whether he returned during the last year of the Trump administration or during the Biden administration.A judge in Grand Rapids, Michigan, has now found enough evidence to send Ortiz Vite to trial for murder and other charges in the death of Ruby Garcia , 25, who was found dead on the side of a highway on March 22.A message seeking comment from defense attorney Naesha Leys was not immediately returned.Before the shooting, she and Ortiz Vite were inside a car on US 131, arguing about their relationship, investigators said. Ortiz Vite is accused of shooting Garcia in the head, removing her body from the car and then driving away.Police said the evidence against him includes his call to 911 two days later, confessing to the crime and declaring that he wanted to turn himself in. He was at a church attending Palm Sunday services when he made the call.","Brandon Ortiz Vite, 25, was deported in 2020. It's not known whether he returned during the last year of the Trump administration or during the Biden administration. Ruby Garcia was found dead on the side of a highway on March 22. Police said the evidence against him includes his call to 911 two days later to confess to the crime.","https://static.toiimg.com/thumb/msid-110546652,imgsize-1188929,width-400,resizemode-4/110546652.jpg"
Proceedings adjourned for the day after initial jury deliberations in Trump's criminal trial,https://timesofindia.indiatimes.com/world/us/judge-adjourns-proceedings-for-the-day-after-initial-jury-deliberations-in-trumps-criminal-trial/articleshow/110544962.cms,"NEW DELHI: The jury in the historic criminal trial of former US President Donald Trump adjourned for the day after initial deliberations on Wednesday, to decide whether to convict the former US President.The 12 jurors, whose identities have been kept confidential for their protection, spent nearly five hours in a separate room before the judge adjourned the proceedings for the day, set to continue on Thursday, according to an AFP report.Prior to being released, the jury requested to review the testimony of two witnesses and to hear the judge's instructions on interpreting the law once more. The spotlight now falls squarely on these 12 New Yorkers, following weeks of testimony from over 20 witnesses. Judge Juan Merchan reminded the jurors, ""You must set aside any personal opinions you have in favor or against the defendant.""The outcome of this trial could have significant implications for the upcoming November election , in which Trump is seeking to regain the presidency.Trump faces accusations of falsifying business records to conceal a $130,000 payment made to adult film star Stormy Daniels , allegedly to prevent her from disclosing an alleged sexual encounter that could have jeopardized his 2016 presidential campaign. Prosecutors argue that the fraud was driven by a scheme to withhold information from voters about his conduct. If found guilty, the political consequences for Trump would be far more significant than the severity of the charges, as he would become a convicted criminal just five months before the presidential election on November 5.The judge instructed Trump to remain in the courthouse while the verdict is pending. In response, Trump stepped outside the courtroom to deliver an angry statement to reporters, calling the situation ""very disgraceful"" and claiming that ""Mother Teresa could not beat these charges.""",Jury deliberations in trial of former US President Donald Trump adjourned for the day on Wednesday. The 12 jurors spent nearly five hours in a separate room before the judge adjourned the proceedings. The outcome of this trial could have significant implications for the upcoming November election.,"https://static.toiimg.com/thumb/msid-110545256,imgsize-863852,width-400,resizemode-4/110545256.jpg"
"Elon Musk could become policy adviser if Trump wins election, WSJ reports",https://timesofindia.indiatimes.com/world/us/elon-musk-could-become-policy-adviser-if-trump-wins-election-wsj-reports/articleshow/110544348.cms,"WASHINGTON: Donald Trump is considering tapping billionaire Elon Musk as a policy adviser if the Republican presidential candidate reclaims the White House in November's election, the Wall Street Journal reported on Wednesday, citing people familiar with the talks.The two have discussed ways for Musk, who runs the social media platform X as well as SpaceX and Tesla, to have ""formal input and influence"" over economic and border security policies, according to the Journal.The WSJ also said Musk informed Trump about his ongoing influence campaign aimed at convincing powerful US business leaders not to support Democratic President Joe Biden , who beat Trump in the 2020 election and is seeking a second term.Those talks, which included billionaire investor Nelson Peltz, also included discussions about funding a ""data-driven project to prevent voter fraud,"" the outlet said, adding no further details were known.Representatives for Trump and Musk did not immediately respond to requests for comment. Representatives for the Biden campaign also did not immediately respond.Trump campaign spokesperson Brian Hughes told the Journal that only Trump will decide ""what role an individual plays in his presidency."" The WSJ said Musk did not respond to its requests for comment.In March, following a meeting with Trump in Florida, Musk - one of world's wealthiest individuals - said he would not donate money to Trump or Biden. Instead, he aims ""to use his clout ... to help defeat Biden by galvanizing the support of influential allies"", said the WSJ, citing a person familiar with his thinking.Musk in recent years has more fully embraced the Republican Party.Musk has said, without evidence, that Biden is intentionally allowing migrants to cross the US-Mexico border. He has also endorsed antisemitic comments on X, though Musk has denied being antisemitic.While he has publicly criticized Biden policies on immigration, electric vehicles and tariffs, Musk has not made any formal endorsement in November's contest and Trump has said he did not know if he has the billionaire's support.Musk's views have hurt his standing among some consumers, according to a CivicScience survey shown exclusively to Reuters.Trump, a prolific user of Twitter, now X, before he was banned from the social media site following the Jan. 6, 2021, attack on the US Capitol, launched his rival Truth Social platform, owned by Trump Media and Technology Group Corp.","Donald Trump is considering tapping billionaire Elon Musk as a policy adviser. Musk runs the social media platform X as well as SpaceX and Tesla. The two have discussed ways for Musk to have ""formal input and influence"" over economic and border security policies.","https://static.toiimg.com/thumb/msid-110544357,imgsize-836738,width-400,resizemode-4/110544357.jpg"
These are top 5 US states from which residents don't want to move away,https://timesofindia.indiatimes.com/world/us/these-are-top-5-us-states-from-which-residents-dont-want-to-move-away/articleshow/110542562.cms,"Top five stickiest states

Bottom five stickiest states

Personal stories reflect complex decisions

Economic and Geographic Factors at Play

The Covid-19 pandemic provided many Americans with an opportunity to reassess their living situations, especially with the rise of remote work . This led to significant state-to-state migration , with individuals seeking lower costs of living and new environments. However, the concept of ""sticky"" states—those retaining a high percentage of their native-born population—offers intriguing insights into American mobility, a report in the Independent said.According to a 2023 study by the Federal Reserve Bank of Dallas, Texas leads the nation with approximately 82% of its native residents choosing to stay. Texas' appeal includes its vibrant cities like Austin, lack of state income tax, and relatively low cost of living.Following Texas are North Carolina (75.5%), Georgia (74.2%), California (73.0%), and Utah (72.9%). These states offer various advantages, from cultural vibrancy to economic opportunities, that retain their populations.Conversely, Wyoming (45.2%) ranks as the least sticky state, followed by North Dakota (48.6%), Alaska (48.7%), Rhode Island (55.2%), and South Dakota (54.2%). These states often face challenges such as harsh climates or less economic diversity, prompting residents to seek opportunities elsewhere.For many, the decision to stay or leave their home state involves multiple factors, including family ties, economic conditions, and cultural identity.Leticia Macias of El Paso, Texas, highlights the cultural uniqueness and economic advantages of her home city, influenced by its border-town identity and vibrant local culture.Justin Morris in North Carolina appreciates the state's affordable living costs , family proximity, and the cultural scene around the Research Triangle, which allows him to pursue his artistic career.Fabian Bean, originally from Alaska, moved to Minnesota for educational and professional opportunities more aligned with his interests in politics and environmentalism.Ashley Marie Sorensen, from South Dakota, chose to settle in Minnesota, drawn by its social investments, such as strong public schools and upcoming paid parental leave policies.States like California, despite being among the stickiest, struggle to attract new residents due to high living costs and stringent property tax policies like Prop 13. This paradox shows that while some states retain their populations, they face challenges in welcoming newcomers.Pia Orrenius, co-author of the Dallas Fed study, emphasizes that retention alone isn't indicative of success. States must balance retaining residents with attracting new ones to maintain vibrancy. California, for instance, needs to become more welcoming to continue thriving.In conclusion, the concept of sticky states sheds light on the complex interplay of economics, culture, and geography in American migration patterns, revealing why some states hold onto their residents while others do not.","Texas leads the nation with approximately 82% of its native residents choosing to stay. Wyoming (45.2%) ranks as the least sticky state. States must balance retaining residents with attracting new ones to maintain vibrancy. California, for instance, needs to become more welcoming to continue thriving.","https://static.toiimg.com/thumb/msid-110542589,imgsize-133746,width-400,resizemode-4/110542589.jpg"
De Niro calls Trump supporters 'gangsters' in heated exchange outside court,https://timesofindia.indiatimes.com/world/us/de-niro-calls-trump-supporters-gangsters-in-heated-exchange-outside-court/articleshow/110542488.cms,"NEW DELHI: Renowned actor Robert De Niro found himself in a heated confrontation with supporters of former President Donald Trump outside a Manhattan courthouse on Tuesday. The incident occurred after a press conference, during which De Niro did not hold back his feelings, shouting at the Trump supporters , ""You are gangsters!""The confrontation took place outside the court where Trump is currently facing trial for alleged hush money payments. De Niro, a vocal critic of Trump, was leaving the press conference when he encountered the group of Trump supporters. The actor's outburst was met with a mix of reactions from the crowd, some of whom engaged in shouting matches with him.De Niro has been an outspoken critic of Trump throughout his presidency and beyond, frequently using public platforms to express his disapproval. This latest incident is a continuation of the actor's ongoing feud with the former president and his supporters.Following the clash, Trump responded to De Niro's comments on his social media platform, Truth Social, calling the actor ""pathetic"" and dismissing his remarks as those of a ""clown.""The altercation highlights the deep-seated divisions that remain in the United States' political landscape, with high-profile figures like De Niro and Trump continuing to be at the center of public and media attention. The trial in Manhattan, which has drawn significant media coverage, is one of several legal battles Trump is facing.As the trial progresses, it is likely that tensions will remain high, with supporters and critics of Trump continuing to clash both inside and outside the courtroom.","Renowned actor Robert De Niro found himself in a heated confrontation with supporters of former President Donald Trump outside a Manhattan courthouse. The incident occurred after a press conference, during which DeNiro did not hold back his feelings. The confrontation took place outside the court where Trump is currently facing trial for alleged hush money payments.","https://static.toiimg.com/thumb/msid-110542480,imgsize-55830,width-400,resizemode-4/110542480.jpg"
"Three American children struck by lightning on beach in Puerto Rico, horrifying video goes viral",https://timesofindia.indiatimes.com/world/us/three-american-children-struck-by-lightning-on-beach-in-puerto-rico-horrifying-video-goes-viral/articleshow/110534703.cms,"NEW DELHI: A tragic incident occurred on a beach in Isabela, a northern coastal town in Puerto Rico , where three American children were struck by lightning on Monday.The children, aged 7, 10, and 12, were rushed to a hospital in the nearby town of Aguadilla, as reported by the Puerto Rican police .According to a police statement, the 12-year-old child was listed in serious condition following the incident, as reported by the Washington Post.Collin Rugg, a user on the social media platform X, shared a video capturing the horrific moment when the lightning struck the children, causing them to fall backwards simultaneously.The subsequent footage shows several children gathered around one of the victims, who appeared unresponsive on the sand, attempting to revive them.Rugg's post on X also mentioned that ""According to WAPA TV, the 12-year-old is in critical condition and the 7-year-old lost feeling in his feet.""The incident has left the community in shock and concern for the well-being of the injured children, as they receive medical attention and support during this difficult time.","Three American children were struck by lightning on a beach in Isabela, Puerto Rico. The children, aged 7, 10, and 12, were rushed to a hospital in the nearby town of Aguadilla. The 12-year-old child was listed in serious condition following the incident.","https://static.toiimg.com/thumb/msid-110535367,imgsize-378613,width-400,resizemode-4/110535367.jpg"
Meet Larry Connor: Billionaire trying to reach Titanic,https://timesofindia.indiatimes.com/world/us/meet-larry-connor-billionaire-trying-to-reach-titanic/articleshow/110534491.cms,"Real-life Daredevil

Deep Dives

Space Mission



NEW DELHI: Race car driver . Property mogul. Private astronaut . Billionaire . Larry Connor 's resume reads like he’s a real-life Tony Stark and he’s trying to add another tick mark to his list of hallowed achievements: become the first person to venture to the Titanic shipwreck after submersible disaster that claimed the lives of four tourists. Connor, a 74-year-old billionaire from Dayton, Ohio recently announced his desire to take a submersible the Atlantic seabed, beyond the OceanGate expedition, to prove that a safe trips to the wreckage of the Titanic is feasible.But, who’s Larry Connor?Connor is the owner of the Connor Group, a real estate investment firm in Dayton, Ohio. Connor graduated from Ohio University in 1972, and went on to purchase Orlando Computer Group, who went on to become the second-largest re-seller of IBM microcomputers in the state of Florida. In 1992, he co-founded Connor, Murphy & Buhrman, that would become the Connor Group when he bought his partners out.In 20 years, the company’s assets increased from $100million to $4 billion. He has also shown a warmer side and during the pandemic donated $1.6 billion of his own money as bonuses to his associates who were earning less than $150,000 per year and also footed their childcare expenses.Connor’s monetary success has allowed him to follow his other passions that have taken him to the depths of the planet and even into orbit. Much like the fictional Tony Stark, Connor also raced formula cars in the 80s, and continued to race at various levels into the 2000s. In 2003, his team won the year’s Petit Le Mans, a sports endurance race held at Road Atlanta, in Braselton, Georgia, USA. His Team C racing outfit also won the Baja 1000, an off-road race held on the Baja California Peninsula.Not just happy with racing, he has also developed a taste for deep dives. He teamed up with Triton Submersible founder Patrick Lahey for an expedition to the Mariana Trench region. The team did three dives: to an undersea mountain in Mariana Trench, one to the third deepest part of the ocean called Sirena Deep and one to Challenger Deep, the deepest known underwater spot on the planet.For the uninitiated, the Challenger is much deeper – approximately 23,000 feet deeper – that the spot where the Titanic lays.Connor was also part of the Axiom Mission 1, in which he played the role of the pilot in the first all-private space mission to the International Space Station. When he went to space, he became the second oldest person to enter orbit after John Glenn (77 when he entered space).The billionaire hasn’t disclosed when he will start his expedition to the ruins of the Titanic.","Larry Connor, a 74-year-old billionaire from Dayton, Ohio recently announced his desire to take a submersible the Atlantic seabed, beyond the OceanGate expedition. The billionaire hasn’t disclosed when he will start his expedition to the ruins of the Titanic. Connor is the owner of the Connor Group, a real estate investment firm in Dayton,Ohio.","https://static.toiimg.com/thumb/msid-110534801,imgsize-30020,width-400,resizemode-4/110534801.jpg"
