Article Title,Article Link,Article Text,Article Summary,Article Image
'Actions will certainly have consequences': S Jaishankar warns Pakistan at UNGA,https://timesofindia.indiatimes.com/world/pakistan/actions-will-certainly-have-consequences-s-jaishankar-warns-pakistan-at-unga/articleshow/113772234.cms,"NEW DELHI: External affairs minister S Jaishankar on Saturday tore into Pakistan at the United Nations and warned that its cross-border terrorism policy can and will never succeed. Citing Pakistan Prime Minister Shehbaz Sharif 's United Nations General Assembly ( UNGA ) speech where he accused New Delhi of ""escalating tensions"" in Kashmir, Jaishankar also warned that Islamabad's ""actions will most certainly have consequences"".Addressing the UNGA, Jaishankar said that the ""issue to be resolved between the two countries is only the vacation of Pakistan-occupied Kashmir by Islamabad and the abandonment of its long-standing attachment to terrorism.""""Some make conscious choices with disastrous consequences. A premier example is our neighbor Pakistan. Unfortunately, the mystics affect others as well, especially the neighbors. When this quality instills such fanaticism among its people, Its GDP can only be measured in terms of radicalisation against exports in the form of terrorism,"" Jaishankar said.""We heard some bizarre assertions from this very forum yesterday. Let me make India's position very clear - Pakistan's policy of cross-border terrorism will never succeed. And it can have no expectation of impunity. On the contrary, actions will certainly have consequences. The issue to be resolved between us is only the vacation of illegally occupied Indian territory by Pakistan and of course, abandonment of Pakistan's long-standing attachment to terrorism,"" he added.This comes a day after Pakistan Prime Minister Shehbaz Sharif remarks, calling India to reverse its ""unilateral and illegal"" actions in Jammu and Kashmir, referring to the 2019 revocation of Article 370, which gave special status to Jammu & Kashmir.""India spurned Pakistan's proposals for a mutual strategic restraint to the regime. Its leadership has often threatened to cross the line of control and take over Azad Kashmir,"" Shehbaz Sharif claimed.Soon after his remarks, the first secretary of India’s permanent mission to the UN Bhavika Mangalanandan also responded sharply in UNGA and, in turn, highligted Pakistan's usage of cross-border terrorism as a key strategy against India, citing numerous incidents, including the attack on the Indian Parliament in 2001 and the 2008 Mumbai terror attacks.""The list is long,"" Mangalanandan said in retort to Islamabad's unfounded assertions. She further said that there can be ""no compact with terrorism"" and that Pakistan's cross-border terrorism against India will ""inevitably invite consequences"". ""We are talking about a nation that for long hosted Osama bin Laden. A country whose fingerprints are on so many terrorist incidents across the world, whose policies attract the dregs of many societies to make it their home,"" Mangalanandan said during India’s right of reply.Mangalanandan in her response called Pakistan a ""country run by the military"" with a ""global reputation for terrorism, narcotics, and transnational crime.""She expressed disbelief that Pakistan, a nation known for these issues, would attack India, the world’s largest democracy, in such a forum.""It is even more extraordinary for a country with a history of rigged elections to talk about political choices in a democracy,"" Mangalanandan said.","India's External affairs minister S Jaishankar tore into Pakistan at the United Nations. Citing Pakistan Prime Minister Shehbaz Sharif's United Nations General Assembly ( UNGA ) speech where he accused New Delhi of ""escalating tensions"" in Kashmir. He also warned that Islamabad's ""actions will most certainly have consequences""","https://static.toiimg.com/thumb/msid-113772135,imgsize-1033306,width-400,resizemode-4/113772135.jpg"
Pakistan: Imran Khan's party yet to get permission for Sunday rally,https://timesofindia.indiatimes.com/world/pakistan/pakistan-imran-khans-party-yet-to-get-permission-for-sunday-rally/articleshow/113766406.cms,"Karachi [Pakistan], September 28 (ANI): The Pakistan Tehreek-e-Insaf has not yet got permission to hold the protest rally in Karachi on Sunday, ARY News reported.Karachi Commissioner will take the decision after taking feedback from deputy commissioners and SSPs of East and South districts about whether or not to let the protesters hold the rally.The Imran Khan-founded party had announced holding a protest rally from Karachi Press Club to Mazar-e-Quaid on Sunday to force the implementation of the Supreme Court 's order on the reserved seatsThe PTI had also given an application to the Commissioner for permission of the protest rally, as reported by ARY News.Speaking at a press conference on Wednesday, PTI's city president Raja Azhar said that the Supreme Court's decision had made it clear that the reserved seats belonged to the PTI, ARY News reported.Ahead of another major protest called by PTI today, the provincial government in Pakistan's Rawalpindi banned all public gatherings and stationed paramilitary forces, Dawn reported.Earlier, PTI had planned to hold a 'jalsa' at the Liaquat Bagh but party founder Imran Khan changed the decision saying that the government would not allow his party to hold the event in the city and designate a venue in the suburbsAccording to Dawn, even though PTI leaders have vowed to reach the venue ""despite all hurdles"", it won't be an easy task. Rawalpindi Police, Rangers and Punjab Constabulary have planned to ""lay a virtual siege"" to the garrison city to stop PTI workers, as per a senior police official confirmed. No traffic would be able to enter or exit the city as roads would be blocked with containers and barbed wires.Meanwhile, the Election Commission of Pakistan (ECP) has submitted two fresh petitions to the apex court, seeking a stay on its July 12 order in the reserved seats case, reported Geo News.In its 70-page detailed judgment issued on September 23, the apex court termed the PTI ""a political party"" and eligible for the seats reserved for women and minorities.",The Pakistan Tehreek-e-Insaf has not yet got permission to hold the protest rally in Karachi on Sunday. Karachi Commissioner will take the decision after taking feedback from deputy commissioners and SSPs of East and South districts. The provincial government in Pakistan's Rawalpindi banned all public gatherings and stationed paramilitary forces.,"https://static.toiimg.com/thumb/msid-113771689,imgsize-1445114,width-400,resizemode-4/113771689.jpg"
"Pakistan helicopter crash: 6 killed in North Waziristan, many injured",https://timesofindia.indiatimes.com/world/pakistan/pakistan-helicopter-crash-7-killed-in-north-waziristan-many-injured/articleshow/113764688.cms,"Representative photo

A tragic helicopter crash in North Waziristan , Khyber Pakhtunkhwa province, has resulted in the deaths of six people and injuries to eight others, as reported by a security official on Saturday. The chartered flight, carrying employees of an oil company , experienced engine failure shortly after takeoff, reported AP.Initially, the death toll was reported as seven, with three Russian nationals—two pilots and a crew member—believed to be on board.However, the official did not confirm whether they were among the deceased. This information was shared under the condition of anonymity due to restrictions on media communications.The crash occurred during an emergency landing attempt, during which the tail rotor struck the ground. Preliminary assessments indicate no signs of sabotage involving the Mi-8 helicopter. The injured individuals have been transported to a military hospital in the town of Thal for treatment.“A technical fault occurred in the helicopter while taking off,” the official stated. An investigation into the circumstances surrounding the accident is currently underway.The crash site is located in Shewa, approximately 200 kilometers (124 miles) southwest of Peshawar, the provincial capital.","The crash occurred during an emergency landing attempt, during which the tail rotor struck the ground. The crash site is located in Shewa, approximately 200 kilometers (124 miles) southwest of Peshawar. Preliminary assessments indicate no signs of sabotage involving the Mi-8 helicopter.","https://static.toiimg.com/thumb/msid-113764982,imgsize-7386,width-400,resizemode-4/113764982.jpg"
Pakistan: Punjab government imposes section 144 ahead of Pakistan Tehreek-e-Insaf's rally,https://timesofindia.indiatimes.com/world/pakistan/pakistan-punjab-government-imposes-section-144-ahead-of-pakistan-tehreek-e-insafs-rally/articleshow/113756091.cms,"(ANI photo)

RAWALPINDI: The Punjab government has imposed Section 144 in Rawalpindi district for two days, ahead of Pakistan Tehreek-e-Insaf 's public gathering at Liaquat Bagh , ARY News reported.The notification imposing Section 144 was issued a day before the PTI's public gathering in Rawalpindi.According to a notification issued here under section 144 of CrPC, the district administration banned all types of gatherings, rallies, protests, and weapon displays.The restriction will remain in effect on September 28 and 29, as per ARY News.Section 144 of the Code of Criminal Procedure is a common legal provision used to restrict public assemblies for a limited period.Meanwhile, section 144 of CrPC has also been imposed in Attock, Jhelum, and Chakwal districts.The PTI called on supporters to gather at Liaquat Bagh.Opposition Leader in National Assembly Omar Ayub posted on X. ""I urge you all to come out in great numbers to Liaquat Bagh at 2pm,"" he said. ""We will have a gathering, it is our legal and constitutional right.""Earlier, PTI moved the deputy commissioner's office to seek permission for the September 28 public rally in Rawalpindi and later withdrew it.Notably, Lahore High Court 's Rawalpindi bench headed by Justice Chaudhry Abdul Aziz, the PTI lawyer, said they are withdrawing the plea seeking permission to hold a rally on Saturday.Justice Chaudhry asked, ""You are withdrawing the plea after filing it?"" and added, ""Tomorrow is your rally in Rawalpindi, right?In response to the judge's question, the PTI lawyer said that the party had moved the plea for holding a public rally in Rawalpindi three days back. However, it is being heard today.The PTI lawyer further said that the deputy commissioner is also 'delaying' the issue. So, the PTI, on its leadership's instruction, has decided to withdraw its plea, according to a Geo News report.","The notification imposing Section 144 was issued a day before the PTI's public gathering in Rawalpindi. The district administration banned all types of gatherings, rallies, protests, and weapon displays. The restriction will remain in effect on September 28 and 29.","https://static.toiimg.com/thumb/msid-113756104,imgsize-1274988,width-400,resizemode-4/113756104.jpg"
"Pakistan again rants against India over Kashmir, ‘threat to seize POK’",https://timesofindia.indiatimes.com/world/pakistan/pakistan-again-rants-against-india-over-kashmir-threat-to-seize-pok/articleshow/113754167.cms,"Shehbaz Sharif

UNITED NATIONS: Pakistan PM Shehbaz Sharif on Friday accused India of “massive expansion of its military capabilities” and issuing threats to cross the LoC for taking over Pakistan-Occupied Kashmir, as he raised the Kashmir issue again in his UNGA address. He demanded that New Delhi reverse the 2019 abrogation of Article 370.Pakistan routinely raises the Kashmir issue at the annual UN debate.India is expected to exercise its right of reply to counter Sharif’s allegations.Sharif said “like the people of Palestine”, the people of Jammu and Kashmir have “struggled for a century for their freedom and right to self-determination”.He said the escalation of Islamophobia was a troubling global development. “The most alarming manifestation of Islamophobia is the Hindu supremacist agenda in India. It aggressively seeks the subjugation of 200 million Muslims and the obliteration of India's Islamic heritage,” he claimed.“Even more worryingly,” he said, India “is engaged in massive expansion of its military capabilities which are essentially deployed against Pakistan”. Its war doctrines envisage a surprise attack and a limited war under the nuclear overhang, he said, adding that India had spurned his country’s proposal for a mutual strategic restraint regime, and its leadership has “often threatened to cross the Line of Control” and take over what Pakistan refers to as “Azad Kashmir”.",Pakistan routinely raises the Kashmir issue at the annual UN debate. India is expected to exercise its right of reply to counter Sharif’s allegations. Shehbaz Sharif said the escalation of Islamophobia was a troubling global development. He demanded that New Delhi reverse the 2019 abrogation of Article 370.,"https://static.toiimg.com/thumb/msid-113754162,imgsize-897854,width-400,resizemode-4/113754162.jpg"
"64 killed, dozens injured in a week as Pakistan's Khyber tribal truce collapses",https://timesofindia.indiatimes.com/world/pakistan/64-killed-dozens-injured-in-a-week-as-pakistans-khyber-tribal-truce-collapses/articleshow/113749587.cms,"Truce collapse

ISLAMABAD: At least 64 people have been killed this week in a fresh outbreak of violence involving the Pashtun Sunni and Shia tribes of Pakistan 's militancy-prone Kurram district along the Afghanistan border in the northwest, where a ceasefire had been signed just over a month ago.Governor Faisal Karim Kundi of Khyber Pakhtunkhwa province said dozens on either side were wounded in the fighting, which continued Friday amid reports of higher casualties than the official figure.Police said the clashes started after the Boshehra Shias of upper Kurram started setting up bunkers on land belonging to the Sunni Ahmadzai community last week. The dispute quickly engulfed other areas and became a full-blown sectarian conflict , they said.In Aug, the warring sides signed a truce after clashes resulted in 50 deaths and injuries to over 200 people.Security officials said the renewed fighting led to closure of roads, triggering a shortage of food, medicines and fuel. Educational institutions have also remained shut for a week.Kurram, a mountainous area that shares a long border with Afghanistan, is home to about 700,000 people, of which more than 42% belong to the Shia community. The district's Parachinar town is one of the few Shia-dominated areas in largely Sunni Pakistan. The region has seen frequent tribal and sectarian clashes in recent years.","At least 64 people killed in fresh outbreak of violence involving Pashtun Sunni and Shia tribes of Pakistan's militancy-prone Kurram district. In Aug, the warring sides signed a truce after clashes resulted in 50 deaths and injuries to over 200 people.","https://static.toiimg.com/thumb/msid-113749588,imgsize-838496,width-400,resizemode-4/113749588.jpg"
Pakistan requests IMF to provide additional $1.5 billion loan to combat climate change,https://timesofindia.indiatimes.com/world/pakistan/pakistan-requests-imf-to-provide-additional-1-5-billion-loan-to-combat-climate-change/articleshow/113742988.cms,"​10 animals that use tools to get work done like humans​

Lifestyle","Summarize: ​10 animals that use tools to get work done like humans. Summarized: 10 animals that used tools to do work like humans, including dogs, cats, birds and even humans. For more, visit CNN.com/summarize.","https://static.toiimg.com/thumb/msid-113747959,imgsize-1028939,width-400,resizemode-4/113747959.jpg"
"At least 1 child killed, 25 cops injured in Pakistan police station blast",https://timesofindia.indiatimes.com/world/pakistan/at-least-1-child-killed-25-cops-injured-in-pakistan-police-station-blast/articleshow/113719201.cms,"At least one child died and 25 injured, mostly cops after an explosion occurred at a police station in Pakistan's Khyber Pakhtunkhwa province on Thursday. The initial report suggests that the blast occurred ""due to a short circuit.""Swabi district emergency officer Awais Babar reported that Rescue 1122 transported 15 injured individuals to the district headquarters hospital, noting a total of 25 casualties, Dawn reported.The rescue operations are ongoing.""Explosives confiscated during multiple operations accidentally detonated due to malfunction, despite plans for controlled disposal at some safe location outside,"" an official said as quoted by PTI.KPK chief minister Ali Amin Gandapur has offered condolences for the death of a child in the explosion and announced financial compensation for the child's family. He also directed divisional and district administrations to initiate rescue operations to ensure timely medical assistance for the injured.","Explosion occurred at a police station in Pakistan's Khyber Pakhtunkhwa province. Initial report suggests that the blast occurred ""due to a short circuit"" Chief minister Ali Amin Gandapur offered condolences for the death of a child in the explosion.","https://static.toiimg.com/thumb/msid-113719918,imgsize-511697,width-400,resizemode-4/113719918.jpg"
Pakistan to issue new travel guidelines for foreign diplomats,https://timesofindia.indiatimes.com/world/pakistan/pakistan-to-issue-new-travel-guidelines-for-foreign-diplomats/articleshow/113713112.cms,"Representative image

ISLAMABAD: Pakistan said on Thursday it was developing new travel guidelines for foreign diplomats to ensure their safety following a recent attack on a convoy of envoys from 12 countries in northwestern Khyber Pakhtunkhwa province.One policeman was killed and four wounded in the roadside bomb attack in Malam Jabba , a tourist resort in Swat district, on Sept 22.No one has claimed responsibility for the attack and the outlawed Tehreek-e-Taliban Pakistan (TTP) had issued a statement saying the group had “nothing to do with the attack” targeting the ambassadors of a dozen nations.“We are developing guidelines to ensure that such incidents do not happen again,” foreign office spokesperson Mumtaz Zahra Baloch said during her weekly media briefing in Islamabad.“We are in the process of discussions and internal deliberations on how to implement these measures, how to rectify what has happened, and how to fix things for the future,” she added.The spokesperson said the trip of foreign diplomats had been organised by Islamabad Chamber of Commerce and Industry (ICCI) without prior consent from the ministry. “We have taken serious note of the lapses made by the concerned individuals, including their failure to inform the ministry of foreign affairs about organising such a visit,” she continued.Pakistani forces maintain a strong presence in the Swat Valley, long a hotbed of Islamist militant insurgency. Militants have stepped up their attacks since late 2022 after breaking a ceasefire with the government.",One policeman was killed and four wounded in the roadside bomb attack in Malam Jabba. No one has claimed responsibility for the attack and the outlawed Tehreek-e-Taliban Pakistan (TTP) had issued a statement saying the group had “nothing to do with the attack”,"https://static.toiimg.com/thumb/msid-113713198,imgsize-705513,width-400,resizemode-4/113713198.jpg"
"Pakistan: Doctor accused of blasphemy was killed in fake encounter by police, says government",https://timesofindia.indiatimes.com/world/pakistan/pakistan-doctor-accused-of-blasphemy-was-killed-in-fake-encounter-by-police-says-government/articleshow/113711998.cms,"The Pakistani government announced that Shah Nawaz, a doctor accused of blasphemy, was killed by police in a staged encounter after surrendering for a fair trial. His body was subsequently burned by an enraged mob. This marks the second extrajudicial killing by police this month, prompting widespread condemnation and demands for justice from Nawaz's family and rights groups.","The Pakistani government announced that Shah Nawaz, a doctor accused of blasphemy, was killed by police in a staged encounter. His body was subsequently burned by an enraged mob. This marks the second extrajudicial killing by police this month, prompting widespread condemnation and demands for justice.","https://static.toiimg.com/thumb/msid-113712015,imgsize-1115935,width-400,resizemode-4/113712015.jpg"
36 killed in days of clashes between warring tribes in northwest Pakistan,https://timesofindia.indiatimes.com/world/pakistan/36-killed-in-days-of-clashes-between-warring-tribes-in-northwest-pakistan/articleshow/113702293.cms,"PESHAWAR: At least 36 people have been killed and 80 others injured in clashes between two warring tribes over a piece of land during the last six days in Pakistan 's restive northwestern Kurram district , bordering Afghanistan, police said on Thursday. According to police, the clashes started over a land dispute despite the efforts of the government and tribal elders to calm down the situation.""So far, 36 people have been killed and 80 others injured in clashes during last six days,"" police said.Locals, however, claimed much higher casualty figures.The fighting spread to areas such as Balishkhel, Sadda, Khar Kallay, Peewar and Maqbal in the district, which borders Afghanistan's Khost, Paktia, Logar and Nangarhar provinces, which are considered strongholds of the ISIS and the Pakistan Taliban.In July, at least 50 people were killed and more than 225 injured in week-long clashes between Boshehra and Maleekhel tribes in the same region.A jirga (tribal council) consisting of tribal elders from both sides met with the Deputy Inspector General of Police and Commissioner Kohat to contain the clashes, without much success.The violent clashes entered their sixth consecutive day on Thursday, with fresh exchanges of heavy gunfire across Upper, Lower, and Central tehsils, resulting in six more fatalities and ten injuries.According to police, both sides continue targeting each other with small and large weapons. The intensity of the fighting has led to the closure of the Parachinar-Peshawar main road and the Pak-Afghan Kharlachi border, disrupting transportation and movement.The road blockade has caused a shortage of essential items, including food, fuel, and medicines, worsening the situation for residents. Both private and public schools in the affected areas, including Parachinar City, have been closed for six days.Deputy Commissioner Javedullah Mehsud said that efforts are ongoing for a ceasefire, with district administration, police, military leadership, and tribal elders working together to bring peace to the region. He said that the Jirga members had been dispatched to different areas to talk with stakeholders.Meanwhile, the Kurram Bar Association has moved a local court over the frequent tribal clashes and lawlessness, which has made the lives of the common people miserable.Kurram, a mountainous area in the northwestern province of Khyber Pakhtunkhwa that shares a long border with Afghanistan, has witnessed deadly conflicts among tribes and religious groups as well as sectarian clashes and militant attacks in the past.The fighting in July turned into sectarian skirmishes and spread to other areas, including Peewar, Tangi, Balishkhel, Khaar Kalay, Maqbal, Kunj Alizai, Para Chamkani, and Karman. It stopped after the two sides agreed on a peace agreement brokered by Jirga leaders.","At least 36 people have been killed and 80 others injured in clashes between two warring tribes over a piece of land. The clashes started over a land dispute despite the efforts of the government and tribal elders to calm down the situation. The fighting spread to areas such as Balishkhel, Sadda, Khar Kallay and Peewar.","https://static.toiimg.com/thumb/msid-113702367,imgsize-428745,width-400,resizemode-4/113702367.jpg"
