Article Title,Article Link,Article Text,Article Summary,Article Image
"Pakistan: Amid worsening human rights situation, another bullet-riddled body found in Balochistan",https://timesofindia.indiatimes.com/world/pakistan/pakistan-amid-worsening-human-rights-situation-another-bullet-riddled-body-found-in-balochistan/articleshow/113380677.cms,"BALOCHISTAN: A body riddled with bullets was found in a forest in Kech district, Balochistan province of Pakistan , The Balochistan Post reported on Monday, citing local police.Authorities reported that the body was found in the Dazan Tump forest.The victim has been identified as Mohsin , son of Baig Muhammad. He was originally from the Mand area but was residing in Gomazi.According to police, the deceased had been shot.The body was taken into police custody before being handed over to the family after the completion of legal formalities.Further details surrounding the circumstances of the death remain unknown, according to Balochistan Post.Notably, such incidents frequently take place in the Balochistan province.Earlier in August, five bullet-riddled bodies were found tied to an electricity poll in the Chaghi town of Pakistan's Balochistan province, Express Tribune reported citing officials.The spot where the bodies were found is close to Pakistan's border with Afghanistan and Iran.The bodies recovered by the police appeared to be killed in brutal execution. The bodies were transported to the district headquarters hospital in Chaghi, where they now awaited identification, they added.The discovery of these bodies has sent shockwaves through the area, particularly the areas close to the Afghan border.Notably, Balochistan is home to several violent groups, which carry out repeated attacks against state oppression, demanding a greater share of the region's resources and concerns over China Pakistan Economic Corridor (CPEC).Earlier on Sunday, another youth was reportedly forcibly disappeared by Pakistsecurity forces in the coastal city of Gwadar amid worsening human rights situation in Balochistan, The Balochistan Post reported.Zubair Baloch, son of Umar, was allegedly detained from the Dasht Dhor Kundag area, the report stated, citing local sources. He was taken to an undisclosed location, and his whereabouts remain unknown.This incident adds to the growing number of enforced disappearances in Balochistan.In a similar incident on Thursday, two lawyers in Quetta were forcibly disappeared by Pakistani forces but were released following protests from the Balochistan Bar Council and other legal bodies.Pakistan has a long history of enforced disappearances and extrajudicial killings , many of which have targeted human rights and minority defenders critical of the government and the military, as well as persons suspected or accused of involvement in the opposition, The Balochistan Post reported.","The victim has been identified as Mohsin, son of Baig Muhammad. He was originally from the Mand area but was residing in Gomazi. Earlier in August, five bullet-riddled bodies were found tied to an electricity poll.","https://static.toiimg.com/thumb/msid-113380970,imgsize-414445,width-400,resizemode-4/113380970.jpg"
"PoJK: PoJK: Residents lament poor medical infrastructure, demand upgradation of facilities",https://timesofindia.indiatimes.com/world/pakistan/pojk-residents-lament-poor-medical-infrastructure-demand-upgradation-of-facilities/articleshow/113365942.cms,"DOSUT: Residents of Dosut , Bantal, Khwaja Seri and surrounding areas in Pakistan-occupied Jammu-Kashmir ( PoJK ) have been suffering due to infrastructural underdevelopment and a lack of basic medical facilities .Currently, the residents of Dosut and its surrounding villages in the Neelum Valley of PoJK, despite numerous complaints to the authorities, have not seen any substantial changes on the ground, local media reported.One resident of Dosut, PoJK, said, ""It is very sad to see that there is only one dispensary and that too is in bad condition, this situation is a result of administrative neglect .""Khawaja Javed, the dispensary in charge, expressed concerns over the critical situation and said no advancement has been made in around 40 years.""Around 40 years have passed, and no advancements have happened to this Basic Health Unit ( BHU ), even though the population of surrounding areas currently exceeds 10,000 people. We currently are overburdened and urge the local administration to grant more funds and personnel for our unit. So that our people don't have to seek other options,"" he said.Another resident lamented the medical condition in the area, and said the region doesn't have a medical unit and they have to travel farther to await medical services.""The clinic that we have here has not even given the tag of BHU by the administration. We urge that such a tag be given to our dispensary. Otherwise, we will unfortunately have to protest, which will create further problems. We are requesting the authorities once again through social media. It is their responsibility to provide these facilities,"" he said.""It's been 49 years, and we still do not have a medical unit. It is very disheartening for us. The nearest. As the next health unit is around 8-10 kilometres away from here and the next one to that is even further,"" he added.In the report, local residents, including the councillor, lamented the inadequate development and facilities in PoJK, which is grappling with significant socio-economic challenges .They said that this persistent lack of development and the perceived indifference of successive governments have fostered a sense of alienation and frustration among its residents.Other than the medical facility, the area also lacks other basic amenities, such as safe drinking water.Now PoJK struggles with a mix of historical issues, administrative difficulties, and socio-economic challenges that impact its current conditions. The region's complex political status and governance problems continue to hinder its development and affect the quality of life for its residents.","Residents of Pakistan-occupied Jammu-Kashmir ( PoJK) have been suffering due to infrastructural underdevelopment and a lack of basic medical facilities. Despite numerous complaints to the authorities, have not seen any substantial changes on the ground, local media reported.","https://static.toiimg.com/thumb/msid-113365987,imgsize-691749,width-400,resizemode-4/113365987.jpg"
"Imran Khan comprares Pakistan's ruling dispensation with Yahya Khan's era, says 'no point' in calling Shehbaz Sharif PM",https://timesofindia.indiatimes.com/world/pakistan/imran-khan-comprares-pakistans-ruling-dispensation-with-yahya-khans-era-says-no-point-in-calling-shehbaz-sharif-pm/articleshow/113365899.cms,"ISLAMABAD: Launching a scathing attack on Pakistan 's ruling coalition and the country's institutions, incarcerated prime minister Imran Khan compared the current situation with the era of military ruler Yahya Khan and alleged that the country's institutions are being ""destroyed.'Condemning the crackdown on PTI , the former premier called the current 'establishment' as ""Yahya Khan part 2"".A social media post on Khan's X account read, ""The country is currently experiencing Yahya Khan's (Martial Law Dictator) rule all over again. (General) Yahya Khan conducted an operation against the country's largest political party. Yahya Khan Part Two is doing the same and destroying the country's institutions.""Further, he launched a scathing attack at the ruling coalition, terming them ""Yahya Khan part two.""""The tout caretaker government of Yahya Khan Part Two gifted Judge Humayun Dilawar with land worth billions of Rupees and illegal NOCs (No Objection Certificate) in return for delivering a guilty verdict that led to my imprisonment. Even the other day, the judge was given instructions for three hours before he gave the verdict against Bushra (Khan),"" he added.Yahya Khan was a Pakistarmy officer, who served as the third president of Pakistan from 1969 to 1971. He also served as the Commander-in-Chief of the Pakistan Army from 1966 to 1971.Notably, it was under his tenure that Bangladesh (East Pakistan then) liberated from Pakistan.Yahya Khan refused to accept the results of the elections in which Sheikh Mujibur Rahman's Awami League emerged as the single-largest party, which led to a massive uprising against West Pakistan, with people also opposing the imposition of Urdu langauge and economci discrimination.A severe crackdown from Pakistan was followed by 1971 Liberation War between India and Pakistan, which concluded with 93,000 Pak soldiers surrendering and the liberation of Bangladesh.Imran Khan, in his post, further alleged that Qazi Faez Isa has been given an extension because he is giving them ""protection from accountability"" for their role in human rights violations and election rigging.Stepping up his attack, Imran Khan said there is ""no point"" in calling Shehbaz Sharif the Prime Minister, as he is merely a ""tout"" and his decisions are subject of approval from the 'establishment.'""There is no point in calling Shehbaz Sharif the Prime Minister. He is merely a tout whose decisions are subject to approval from the establishment. Who knows, this tout may end up being forcibly disappeared tomorrow,"" he stated.Criticising the economic condition of Pakistan, Khan said that Singapore is drawing more investment than Pakistan, and said investments come when rule of law is assured.""Investors have brought in billions of dollars into Singapore, a country with a population smaller than that of Karachi. Whereas Pakistan, which is the fifth most populous country in the world, has the lowest foreign investment in its history, at less than one billion dollars. Investments are only made in countries where rule of law is assured,"" he stated.Meanwhile, Imran Khan continues to be in Adiala Jail in connection with multiple cases.Notably, despite being behind bars, the former premier has been posting messages through his X handle, which have often triggered massive rows. Recently, the Federal Investigation Agency launched a probe into an ""anti-state post"" from Khan.Recently, Pakistan Tehreek-e-Insaf carried out a mega rally demanding Khan's release. The party alleged that the state carried out a crackdown and shots were fired at their leaders.The PTI founder further slammed the ruling coalition over the detention of Khyber Pakhtunkhwa Chief Minister Ali Amin Gandapur, and termed the situation is ""scary.""""Ali Amin Gandapur was held (against his will) by the establishment. But he is not openly naming them to save the country from being mocked further. Who will safeguard the people of Khyber Pakhtunkhwa when the police is forced to focus on protecting themselves? If what the police claim is true, then the situation is extremely scary,"" Khan added.Further taking a jibe in his post, the former Prime Minister also criticised the country's institutions using cricketing terminology.""Whenever Sikandar Sultan Raja (Chief Election Commissioner) bowls, Qazi Faez Isa (Chief Justice of Pakistan) is in the first slip, while Aamer Farooq (Chief Justice of Islamabad High Court) in second slip [cricket analogy].This is a fixed match, the outcome of which has already been decided based on the London Plan, and where all the characters are dishonest,"" Khan stated.","Imran Khan compared the current situation with the era of military ruler Yahya Khan. He called the current 'establishment' as ""Yahya Khan part 2"" Khan also slammed the ruling coalition over the detention of Khyber Pakhtunkhwa Chief Minister.","https://static.toiimg.com/thumb/msid-113365968,imgsize-1093290,width-400,resizemode-4/113365968.jpg"
Jailed former Pakistan PM Imran Khan booked for inciting official to mutiny,https://timesofindia.indiatimes.com/world/pakistan/jailed-former-pakistan-pm-imran-khan-booked-for-inciting-official-to-mutiny/articleshow/113346151.cms,"Former Pakistan prime minister Imran Khan has been booked for inciting government officer to mutiny , and committing 'sedition,' through his social media posts, Dawn reported quoting sources on Saturday.A team from the Federal Investigation Agency ( FIA ), which registered the case against the jailed Pakistan Tehreek-e-Insaf party founder on Friday, recently visited Adiala Jail to question him in relation to a controversial post on his official X account.Minister for Information, Broadcasting, National Heritage, and Culture Attaullah Tarar announced that FIA would investigate the management of the PTI founder's social media accounts. The investigation will focus on allegations that these accounts have been used to incite chaos and anarchy in the country, as well as to undermine national security.“He (the PTI founder) should be ashamed of undermining the national security, inciting people for anarchy and committing the sedition,” the minister said, as reported by APP.He added that there had been a failed attempt to conspire against the sitting chief justice and leaders of other institutions. The posts were aimed at inciting people against two major state institutions, an action he described as highly condemnable.Imran's social media team had posted a video on his X account comparing past and present military leaderships, along with a statement urging people to review a judicial commission report on Pakistan's breakup.“Every Pakistani should study the Hamoodur Rahman Commission Report and get to know who was the true traitor, General Yahya Khan or Sheikh Mujibur Rahman,” said a quote attributed to Imran.The posts also featured images of the current civilian and military leaders, alleging that they had stolen the mandate of Imran’s Pakistan Tehreek-e-Insaf (PTI) in the February general elections.","Imran Khan has been booked for inciting government officer to mutiny, and committing'sedition,' through his social media posts. A team from the Federal Investigation Agency ( FIA ), which registered the case against the Pakistan Tehreek-e-Insaf party founder on Friday, recently visited Adiala Jail to question him.","https://static.toiimg.com/thumb/msid-113346414,imgsize-21574,width-400,resizemode-4/113346414.jpg"
"Imran Khan blames military for CM disappearance, says Pakistan scene is ‘Yahya Khan Part II’",https://timesofindia.indiatimes.com/world/pakistan/imran-khan-blames-military-for-cm-disappearance-says-pakistan-scene-is-yahya-khan-part-ii/articleshow/113334502.cms,"ReplyReply allForward



ISLAMABAD: Pakistan Tehreek-e-Insaf ( PTI ) chief Imran Khan blamed the establishment, a euphemism for the military in Pakistan, for the disappearance of his party’s chief minister of the northwestern Khyber Pakhtunkhwa province, Ali Amin Gandapur , from Islamabad.Speaking to journalists at Rawalpindi prison on Friday, Khan claimed that Gandapur “was disappeared” by elements within the establishment and everyone knows who is responsible for such actions, an indirect reference to Pakistan’s intelligence agencies.He accused the military establishment of undermining the country’s institutions.According to Khan, the Khyber Pakhtunkhwa CM has remained silent over his disappearance out of loyalty and respect for the establishment. Khan warned the current situation in the country is reminiscent of “Yahya Khan Part II”.Imran also spoke on the current state of governance, claiming that Prime Minister Shehbaz Sharif required approval (from the military) for every decision and could soon face a similar fate — disappearance.Gandapur went missing from Islamabad during a crackdown on PTI last Monday, a day after he had delivered a hard-hitting speech at a rally demanding the release of Imran Khan. He later turned up in Peshawar. Gandapur, according to PTI, was invited by the military authorities to discuss law and order matters, but he was allegedly detained without consent. His statement that he would personally secure Khan’s release in the next two weeks triggered a sharp backlash in a country where the powerful military has directly ruled the country for three decades and wielded enormous political influence even when civilian governments were in office.","Imran Khan blames the establishment for the disappearance of his party’s chief minister of the northwestern Khyber Pakhtunkhwa province, Ali Amin Gandapur. Khan warned the current situation in the country is reminiscent of “Yahya Khan Part II”","https://static.toiimg.com/thumb/msid-113334506,imgsize-1028925,width-400,resizemode-4/113334506.jpg"
"Minor Hindu girl abducted, married off and converted to Islam in Pakistan's Sindh",https://timesofindia.indiatimes.com/world/pakistan/minor-hindu-girl-abducted-married-off-and-converted-to-islam-in-pakistans-sindh/articleshow/113308603.cms,"KARACHI: A minor Hindu girl has been abducted and forcibly married off to an elderly man who converted her to Islam in Pakistan's Sindh province , the community members said on Thursday.The matter came to light just a day after another minor Hindu girl, who was kidnapped from Hyderabad, was handed back to her family on the orders of a court Wednesday.Shiva Faqir Kaachi, who heads the Pakistan Darawar Ittehad organisation, said the girl, 16, was abducted from her village in Hunguru Wednesday and forcibly married off to a much older man who converted her to Islam. ""The girl was taken to a seminary and married off. When the parents went to the seminary Thursday to see her, the cleric refused to let them in,"" Kaachi said. ""It has now become a regular occurrence for Hindu families to see their young daughters and sisters forcibly taken away and converted to be married off to Muslim men,"" he said.",A minor Hindu girl has been abducted and forcibly married off to an elderly man. The elderly man converted her to Islam in Pakistan's Sindh province. The matter came to light just a day after another minor girl was kidnapped and handed back to her family.,"https://static.toiimg.com/thumb/msid-113308692,imgsize-393528,width-400,resizemode-4/113308692.jpg"
US sanctions Chinese firms supporting Pakistan's ballistic missile program,https://timesofindia.indiatimes.com/world/pakistan/us-sanctions-chinese-firms-supporting-pakistans-ballistic-missile-program/articleshow/113308230.cms,"NEW DELHI: The sanctions target five entities and one individual under missile sanction laws for proliferating ballistic missiles and controlled missile equipment and technology.""The Department of State is taking action against five entities and one individual that have been involved in the proliferation of ballistic missiles and controlled missile equipment and technology.Specifically, the Department of State is designating the Beijing Research Institute of Automation for Machine Building Industry (RIAMB) pursuant to Executive Order 13382, which targets proliferators of weapons of mass destruction and their means of delivery,"" state department spokesperson Matthew Miller said.This is not the first time the US has taken action against entities involved in supplying Pakistan's ballistic missile program. Previously, four entities, including Belarus-based Minsk Wheel Tractor Plant and three Chinese entities, were designated for their involvement in supplying missile-applicable items to Pakistan's long-range ballistic missile program.In April, Patel warned that anyone considering business deals with Iran should be aware of the potential risk of sanctions, while emphasizing that the government of Pakistan can speak to their own foreign policy pursuits.The US believes that the Chinese firm RIAMB was collaborating with Pakistan's National Development Complex (NDC) to develop and produce long-range ballistic missiles. Additionally, sanctions have been imposed on three PRC-based entities, one PRC individual, and a Pakistani entity under the Arms Export Control Act (AECA) and the Export Control Reform Act (ECRA) for their involvement in ballistic missile proliferationactivities.""These sanctions are being imposed because these entities and individual knowingly transferred equipment and technology controlled under the Missile Technology Control Regime (MTCR) Annex, in support of MTCR Category I missile programs, to a non-MTCR country,"" Miller added.When asked about the reason behind these sanctions, Vedant Patel, the US state department's principal deputy spokesperson, said, ""The sanctions were made because these were entities that were proliferators of weapons of mass destruction and the means of their delivery.""","The sanctions target five entities and one individual under missile sanction laws. The US believes that the Chinese firm RIAMB was collaborating with Pakistan's National Development Complex (NDC) to develop and produce long-range ballistic missiles. Previously, four entities, including Belarus-based Minsk Wheel Tractor Plant and three Chinese entities, were designated.","https://static.toiimg.com/thumb/msid-113308189,imgsize-442739,width-400,resizemode-4/113308189.jpg"
Pakistan stand-off over cops seeking army exit from restive province drags on,https://timesofindia.indiatimes.com/world/pakistan/pakistan-stand-off-over-cops-seeking-army-exit-from-restive-province-drags-on/articleshow/113302897.cms,"ISLAMABAD: The stand-off in northwestern Pakistan involving police units that have gone on strike to demand the withdrawal of military and intelligence agencies from the restive region entered the fourth day Thursday with no sign of the crisis easing.On Sept 9, hundreds of policemen had blocked Indus Highway, which links Peshawar in the northwest with the southern port city of Karachi, in Lakki Marwat district of Khyber Pakhtunkhwa to protest alleged military interference in their regular duties.Police officers from the surrounding districts, including Bannu, Dera Ismail Khan and Tank, joined their protesting colleagues, while political parties, tribal leaders and civil society groups expressed solidarity with them.The protesters, who accuse the ISI and Military Intelligence of exacerbating the situation in the region, have seen many of their colleagues kidnapped or ambushed by Taliban fighters and supporters in Lakki Marwat, Bannu and Dera Ismail Khan over the last few years. In some cases, their houses and families have been targeted.This is the first instance in Pakistan of uniformed personnel on a sit-in and blocking an inter-provincial highway for four consecutive days. The protesters have so far turned down requests by their bosses to hold talks and end the agitation.Officer Rashid Khan said the army should leave the district and let the police department work freely.“We promise to restore peace in the area within three months if military officers stop their interference,"" he said in Lakki Marwat.""Their game of playing good and bad Taliban is not over. We (police force) arrest militants and they (the military) call us to release them,"" another official at the sit-in told TOI.The army has a large presence in the Khyber Pakhtunkhwa province bordering Afghanistan, where it has been battling the Taliban and other outfits for nearly two decades.Police officials in Bajaur tribal district, bordering Afghanistan, have announced they wouldn't work even with anti-polio teams until the administration identified and arrested the killers of a colleague who was shot dead while escorting once such group in Bajaur this week.“There will be a complete boycott of polio duty,” a video circulating on social media showed a man standing among a group of uniformed personnel as saying. ""They (the government and security officials) will give us the killers of Luqman (the police constable killed in the latest attack while performing polio duty) first.""Pakistan has seen a rise in militant attacks in recent weeks, with many of them taking place in Khyber Pakhtunkhwa, where groups like the outlawed Pakistani Taliban, or TTP, have stepped up attacks, targeting security forces convoys and checkpoints, and carrying out targeted killings and kidnappings of security personnel and govt officials.At least 75 police personnel have been killed in ambushes and targeted killings in Khyber Pakhtunkhwa this year, according to official data.","Hundreds of policemen had blocked Indus Highway, which links Peshawar in the northwest with the southern port city of Karachi. Police officers from the surrounding districts, including Bannu, Dera Ismail Khan and Tank, joined their protesting colleagues. The protesters have so far turned down requests by their bosses to hold talks and end the agitation.","https://static.toiimg.com/thumb/msid-113302912,imgsize-980762,width-400,resizemode-4/113302912.jpg"
