Article Title,Article Link,Article Text,Article Summary,Article Image
"Former ISI chief Faiz Hameed arrested, court martial initiated: Pakistan army",https://timesofindia.indiatimes.com/world/pakistan/former-isi-chief-faiz-hameed-arrested-court-martial-initiated-pakistan-army/articleshow/112471091.cms,"'Allegations of serious nature,

would undermine reputation of gov

t, army'

How case unfolded

Former Inter-Services Intelligence (ISI) chief Faiz Hameed was arrested by Pakistan military in connection to a housing scheme scandal and the process for his court martial was initiated, the army said on Monday.It is for the first time in the country's history that court martial has been initiated against a former intelligence chief, according to Dawn .“Complying with the orders of Supreme Court of Pakistan, a detailed court of inquiry, was undertaken by Pakistan Army, to ascertain correctness of complaints in Top City case made against Lt Gen Faiz Hameed (Retd),” a press statement by Pakistan army said further adding that ""the process of Field General Court Martial has been initiated and Lt Gen Faiz Hameed (Retd) has been taken into military custody.”“Consequently, appropriate disciplinary action has been initiated against Lt Gen Faiz Hameed (Retd), under provisions of Pakistan Army Act,” the release further said.Hameed was regarded as close aide to Imran Khan, who appointed him to lead the ISI during his tenure as prime minister. Khan was removed from office in 2022 through a vote of no-confidence, which he claims was orchestrated by the military, though the military denies this allegation.In 2022, Hameed was one of the six senior-most generals whose names were forwarded by general headquarters to Pakistani prime minister Shehbaz Sharif for consideration for the two top military positions. He, however, chose to seek early retirement and submitted his resignation to the high command, as per sources.The Supreme Court, in its order dated November 14 last year, had said that the allegations against Hameed were of ""extremely serious nature"" and ""would undermine the reputation of the federal government, the armed forces, ISI and Pakistan Rangers, therefore, they cannot be left unattended.”This came after the management of Top City, a private housing scheme, made allegations against the former spy-master, accusing him of orchestrating a raid on the offices and residence of its owner, Moeez Khan.The petition was filed on May 12, 2017, and it said that Pakistan Rangers and ISI officials conducted a raid on Top City's office and Moeez’s residence, seizing valuables such as gold and diamond jewelry and money in connection with an alleged terrorism case, Dawn reported.It also alleged the involvement of former ISI officials Irtaza Haroon, Sardar Najaf, Wasim Tabish, Zahid Mehmood Malik, and Mohammad Munir ""in the illegal takeover of the housing society”.In March, a court placed retired naib tehsildar Najaf Hameed, Hameed's brother, under a 14-day judicial remand.Najaf and other co-accused had sought pre-arrest bail in an FIR filed with the Anti-Corruption Establishment (ACE) in Rawalpindi.The FIR alleged that former minister for mineral resources Hafiz Ammar Yasir had acquired properties worth billions of rupees through intermediaries.In April, the military had reportedly established an inquiry committee to investigate allegations of authority misuse involving the former ISI head.","Former Inter-Services Intelligence (ISI) chief Faiz Hameed was arrested by Pakistan military in connection to a housing scheme scandal. The process for his court martial was initiated, the army said on Monday. It is for the first time in the country's history that court martial has been initiated against a former intelligence chief.","https://static.toiimg.com/thumb/msid-112471213,imgsize-19742,width-400,resizemode-4/112471213.jpg"
Beggar or tourist? Travellers to Gulf under strict scrutiny at airports in Pakistan,https://timesofindia.indiatimes.com/world/pakistan/beggar-or-tourist-travellers-to-gulf-under-strict-scrutiny-at-airports-in-pakistan/articleshow/112464484.cms,"'Genuine visitors' at disadvantage as

Gulf

resorts to stricter visa regime

Pakistani authorities have increased scrutiny at international airports over tremendous rise in the number of beggars travelling to middle eastern countries disguised as tourists , Dawn reported.This came after a senior official informed the Senate Standing Committee on Overseas Pakistanis that 90% of beggars detained abroad are of Pakistani origin.Potential beggars were disguising themselves as tourists to travel to Saudi Arabia, the United Arab Emirates, Iraq, Iran, Oman, and Turkey, a senior official from Federal Investigation Agency (FIA) told Dawn.The official informed the news website that, in recent months, immigration staff at airports have removed several passengers from flights in an effort to curb this trend.Earlier this year, the interior ministry had reported that it deported 44,000 passengers based on similar suspicions over the past two and a half years.A senior FIA officer suggested that these countries should also review their visa processing systems, rather than solely urging Pakistani authorities to prevent potential beggars, criminals, and illegal immigrants.Meanwhile, UAE authorities have begun actively rejecting visa applications from Pakistanis who cannot demonstrate sufficient funds in their accounts to be considered ""genuine visitors.""","90% of beggars detained abroad are of Pakistani origin, official says. Pakistan has deported 44,000 passengers based on similar suspicions over the past two and a half years. UAE authorities have begun actively rejecting visa applications from Pakistanis who cannot demonstrate sufficient funds in their accounts.","https://static.toiimg.com/thumb/msid-112464930,imgsize-943279,width-400,resizemode-4/112464930.jpg"
Pakistan calls for religious 'tolerance' on Minorities' Day,https://timesofindia.indiatimes.com/world/pakistan/pakistan-calls-for-religious-tolerance-on-minorities-day/articleshow/112445462.cms,"NEW DELHI: Amid rising attacks on minority groups in Bangladesh, India's neighbour on its right marked Minorities' Day on Sunday with calls to promote ""interfaith harmony"" and ""tolerance"" in the country.Pakistan president Zardari ""urged all segments of society to educate people about their rights and work for promoting interfaith harmony, the spirit of love, tolerance, brotherhood, and unity to make Pakistan a strong country,” Dawn reported.Acknowledging their role in the freedom struggle, Pakistan prime minister Shehbaz Sharif said, “Our minority community played a key role in the Pakistan Movement and, since the creation of Pakistan, has been contributing immensely to nation-building.”In 2009, the government designated August 11 as National Minorities Day to honor the historic speech made by Muhammad Ali Jinnah on that date in 1947.This comes as Bangladesh is witnessing widespread violence against minorities after Sheikh Hasina fled the country and took refuge in India.The Bangladesh Hindu Buddhist Christian Unity Council (BHBCUC) reported that numerous Hindu homes and businesses were vandalized, and several temples were damaged. While there have been no reported fatalities, the attacks have caused dozens of injuries.Bangladesh's interim leader and Nobel laureate Muhammad Yunus on Saturday condemned the attacks calling them ""heinous."" He urged the youth to stand up and safeguard Hindu, Christian, and Buddhist families from harm.Foreign minister S Jaishankar said in Rajya Sabha that the Indian government was continuously engaging in discussions with the Bangladesh interim government.","Pakistan president Zardari ""urged all segments of society to educate people about their rights"" The government designated August 11 as National Minorities Day to honor the historic speech made by Muhammad Ali Jinnah on that date in 1947. This comes as Bangladesh is witnessing widespread violence against minorities.","https://static.toiimg.com/thumb/msid-112445777,imgsize-780078,width-400,resizemode-4/112445777.jpg"
"Pakistan's battle with polio eradication: Infant succumbs in Balochistan, total cases rise to 14 this year",https://timesofindia.indiatimes.com/world/pakistan/pakistans-battle-with-polio-eradication-infant-succumbs-in-balochistan-total-cases-rise-to-14-this-year/articleshow/112441087.cms,"ISLAMABAD: Pakistan continues to grapple with cases of polio with the country along with neighbouring Afghanistan being the only two countries in the world where the poliovirus is still an endemic.On August 10, the 14th polio case of the year was reported from Qilla Saifullah district of Balochistan boosting the number of poliovirus cases in the country to 13 for the year 2024.The country has reported three more cases- two in Balochistan and one in Punjab province.Since 2015, Pakistan has reported a total of 362 polio cases, as per a report in Al Jazeera.However, despite administering more than 300 million doses of oral vaccine annually with the help of at least 350,000 vaccinators and an expenditure of over USD 9.3 bn from 2013 to 2023, the country has been unable to eradicate polio, the Qatar-based publication said.The highly infectious Polio disease has no or mild symptoms and can cause paralysis of the limbs. Polio is transmitted through contaminated water or food, or contact with an infected person. Treatment includes bed rest, pain relievers, rehabilitation and portable ventilators.Dr Hamid Jafari, WHO 's regional director of polio eradication was cited by Al-Jazeera as saying that the challenge exists in southern Khyber Pakhtunkhwa province of Pakistan. ""This is where there's a lot of militancy, insecurity and community hostility and frustration towards the government because of conflict and a lack of services,"" Jafari said.Over 50 districts across Pakistan are detecting the virus, he said.Compounding to the challenges is the fact, says the WHO official that not only is the polio programme being targeted but also security personnel that are guarding the teams ""because they become soft targets when they are in the community.""At least 102 polio field workers, officials and security personnel have been killed, including at least six in campaigns carried out this year, the Al Jazeera report cited.Meanwhile, the latest victim is an 11-month-old infant from Qila, in Balochistan who has succumbed to paralysis caused by the wild poliovirus.The child from Qila who displayed symptoms of paralysis on July 17, is among the five cases detected in the district. Other cases in Balochistan have been reported in Chaman, Quetta, Zhob, Dera Bugti, and Jhal Magsi as per a report in the Balochistan Post.In Balochistan, the situation is compounded by a recent history of inadequate vaccination coverage and persistent misconceptions about the vaccine. Despite numerous vaccination campaigns, efforts have struggled to keep pace with the actual number of infections, the publication stated.","On August 10, the 14th polio case of the year was reported from Qilla Saifullah district of Balochistan boosting the number of poliovirus cases in the country to 13 for the year 2024. Since 2015, Pakistan has reported a total of 362 polio cases, as per a report in Al Jazeera.","https://static.toiimg.com/thumb/msid-112441098,imgsize-1266628,width-400,resizemode-4/112441098.jpg"
"Karachi Street Crime: Karachi sees 44,000 street crime incidents in first seven months of 2024",https://timesofindia.indiatimes.com/world/pakistan/karachi-sees-44000-street-crime-incidents-in-first-seven-months-of-2024/articleshow/112437319.cms,"KARACHI: Karachi has witnessed a surge in street crime incidents, with over 44,000 incidents reported from January to July this year, ARY News reported.In just the first seven months of this year, street crime incidents have seen a spark with the majority of crimes involving motorcycle theft in the metropolis, according to the data released by the local police of Karachi.In the period of seven months, more than 31,000 motorcycles were either stolen or snatched from their owners, making them the most common target in these street crime incidents, as reported by ARY News.Meanwhile, over 11,800 cases of mobile phone snatching were recorded, as per the data.The data further highlighted that around 1,200 cars were snatched from citizens during the same period, adding to the already high levels of insecurity among residents.However, despite the significant number of thefts, recovery rates have remained low.According to the police reports , only 1,500 motorcycles, 220 cars, and 120 mobile phones have been successfully recovered, reported ARY News.Earlier on Friday, two people were killed in Karachi resistingrobberies , in separate incidents.Anis, a friend of the deceased who was present at the scene of the North Nazimabad incident, filed a complaint.The complaint mentioned that the robbers also targeted Ali Hamza, another man who was on a different bike with Anis.According to the FIR, the incident happened on the KDA Chorangi flyover, reported ARY News.The complainant was stopped by two armed individuals on a motorcycle, who then tormented him, stole his wallet and cell phone, and threw away his bike keys. He later heard a gunshot as he bowed down to get the keys, and when he came around, he saw that the robbers had shot his friend and taken off.In another incident, robbers shot and killed labourer Allah Dino in Ayub Goth, at the Superhighway Industrial area, while he was walking home with his child.","Over 44,000 street crime incidents reported from January to July this year. Majority of crimes involving motorcycle theft in the metropolis. Only 1,500 motorcycles, 220 cars, and 120 mobile phones have been recovered. Two people were killed in Karachi resistingrobberies on Friday.","https://static.toiimg.com/thumb/msid-112437350,imgsize-1076742,width-400,resizemode-4/112437350.jpg"
Karachi: Two killed for resisting robberies in Karachi,https://timesofindia.indiatimes.com/world/pakistan/two-killed-for-resisting-robberies-in-karachi/articleshow/112418147.cms,"KARACHI: In separate incidents , two people were killed in Karachi resisting robberies , ARY News reported Friday.Police officials stated that the cases have been registered in the respective police stations of Karachi's Superhighway Industrial area and North Nazimabad area, where the incidents took place.Anis, a friend of the deceased who was present at the scene of the North Nazimabad incident, filed a complaint .The complaint claims that the robbers also targeted Ali Hamza, who was on a different bike with Anis. The FIR text states that the incident happened on the KDA Chorangi flyover, reported ARY News.The complainant was stopped by two armed individuals on a motorcycle, who then tormented him, stole his wallet and cell phone, and threw away his bike keys. He later heard a gunshot as he bowed down to get the keys, and when he came around, he saw that the robbers had shot his friend and taken off.In another incident, robbers shot and killed labourer Allah Dino in Ayub Goth, at the Superhighway Industrial area, while he was walking home with his small kid after buying a new TV.His brother filed the case, claiming that the thieves had intercepted Allah Dino and taken his money and cell phone, and just purchased a television. When Allah Dino refused to back down, one of the robbers shot him in the chest, killing him.The investigation in both cases is underway.","In separate incidents, two people were killed in Karachi resisting robberies. The cases have been registered in the respective police stations of Karachi's Superhighway Industrial area and North Nazimabad area. In one incident, robbers shot and killed labourer Allah Dino, while he was walking home with his small kid.","https://static.toiimg.com/thumb/msid-112418196,imgsize-638577,width-400,resizemode-4/112418196.jpg"
Zero tolerance for 'sin' of spreading anarchy: Pakistan army chief,https://timesofindia.indiatimes.com/world/pakistan/zero-tolerance-for-sin-of-spreading-anarchy-pakistan-army-chief/articleshow/112383985.cms,"ISLAMABAD: Pakistan army chief Gen Asim Munir said Thursday that the act of spreading anarchy in the country was the "" greatest sin "", alluding to the turmoil in Bangladesh that led to ex-PM Sheikh Hasina resigning and fleeing the country.""If anyone tries to spread chaos in Pakistan , by God, we (army) will stand against them,"" Gen Munir said at a national convention.""Whoever doesn't adhere to the Shariah (Islamic law) and the Constitution, we don't consider them Pakistanis.""He also took a jibe at India, wondering aloud where were ""those who used to say that they drowned the two-nation theory in the Bay of Bengal"".""No power in the world can harm Pakistan because it was created to last, and it will exist till eternity,"" the military chief declared.He blamed mostly social media for instances of anarchy in the region, suggesting further curbs could be clamped as online campaigns criticising Pakistan's powerful military gain traction.Gen Munir termed Kashmir an ""incomplete agenda"" involving Pakistan and India.","Pakistan army chief Gen Asim Munir said the act of spreading anarchy in the country was the "" greatest sin"" Gen Munir also took a jibe at India, wondering aloud where were ""those who used to say that they drowned the two-nation theory in the Bay of Bengal""","https://static.toiimg.com/thumb/msid-112384006,imgsize-4666,width-400,resizemode-4/112384006.jpg"
Karachi banker with Iran ties in foiled plot to kill Trump,https://timesofindia.indiatimes.com/world/pakistan/karachi-banker-with-iran-ties-in-foiled-plot-to-kill-trump/articleshow/112355039.cms,"ISLAMABAD: Pakistan announced Wednesday that it was in contact with US authorities and awaiting further details about the alleged involvement of a Pakistani national in a foiled assassination plot targeting former President Donald Trump . “Before giving our formal reaction, we also need to be sure of the antecedents of the individual in question,” Pakistan’s foreign office said.The US Justice Department reported that Asif Raza Merchant, a 46-year-old Pakistani man, has been charged in connection with a plot to assassinate a US politician or govt officials.A criminal complaint revealed that Merchant, a resident of Karachi, allegedly has ties with Tehran. He told investigators he has a wife and children in Iran and a separate family in Pakistan.Local media reports suggest Merchant worked as a branch manager in a Karachi bank in 2010. His responsibilities included managing an asset and liability portfolio of over Rs 1,850 million, encompassing clients from various sectors including petroleum, textiles, leather, paper products, chemicals, and pharmaceuticals, as well as various retail, commercial, and corporate clients.Merchant’s resume detailed his roles in marketing new clients, reviewing and monitoring branch financials, and preparing interim and annual reviews.A complaint against Merchant claimed he sought to recruit people in the US to carry out the plot in retaliation for the killing of Iran’s Revolutionary Guards top commander Qasem Soleimani in a US drone strike in Baghdad in 2020 during Trump’s presidency.","Asif Raza Merchant, a 46-year-old Pakistani man, has been charged in connection with a plot to assassinate a US politician or govt officials. A complaint against Merchant claimed he sought to recruit people in the US to carry out the plot in retaliation for the killing of Iran’s Revolutionary Guards top commander Qasem Soleimani.","https://static.toiimg.com/thumb/msid-112355071,imgsize-464022,width-400,resizemode-4/112355071.jpg"
'Confident that resilient spirit ...': Pakistan expresses solidarity with violence-hit Bangladesh,https://timesofindia.indiatimes.com/world/pakistan/confident-that-resilient-spirit-pakistan-expresses-solidarity-with-violence-hit-bangladesh/articleshow/112339641.cms,"Pakistan on Wednesday expressed solidarity with the people of Bangladesh on Wednesday following the prime minister Sheikh Hasina's departure from the country amidst weeks of civil unrest and protests.The foreign ministry of Pakistan, the country from which Bangladesh gained independence in 1971, said, ""We are confident that the resilient spirit and unity of the Bangladeshi people will lead them towards a harmonious future.""Bangladesh witnessed violence, which claimed at least 150 lives and injured thousands, was triggered by student groups protesting against reserved quotas in government jobs.The unrest began after a high court order to reinstate a 30 percent job quota for descendants of freedom fighters.Following massive protests and violence, Hasina resigned and sought asylum in India. Her resignation sparked celebrations across the country, with crowds storming into her official residence unopposed after her departure, marking the end of her 15-year second stint in power in the nation of 170 million, which has been grappling with economic distress in recent years.Late on Tuesday, Bangladesh's president appointed Yunus as the head of the interim government. According to a statement from his office, the president highlighted the need to finalize the remaining members of the government soon to overcome the current crisis.",Pakistan expresses solidarity with Bangladesh following prime minister's departure. Sheikh Hasina resigned and sought asylum in India after weeks of civil unrest and protests. Protests triggered by a high court order to reinstate a 30 percent job quota for descendants of freedom fighters. President appointed Yunus as head of the interim government.,"https://static.toiimg.com/thumb/msid-112339666,imgsize-1915204,width-400,resizemode-4/112339666.jpg"
