Article Title,Article Link,Article Text,Article Summary,Article Image
Pakistan grapples with flour paucity amid millers' strike,https://timesofindia.indiatimes.com/world/pakistan/pakistan-grapples-with-flour-paucity-amid-millers-strike/articleshow/111679728.cms,"LAHORE: Pakistan 's urban population would probably have to grapple with a shortage of flour as the All-Pakistan Flour Mills Association ( PFMA ) went on strike as a mark of protest on Thursday against the new withholding tax , Pakistan-based daily, Dawn reported.Flour dealers and owners of atta chakkis (small wheat grinding units joined the protest, causing disturbances in the supply flow of flour, Dawn reported.Chairperson of PFMA, Asim Raza said that the measure has made flour mills withholding agents for tax collection. He said the tax is expected to increase flour prices by PakistRupees (PKR) 8 per kg.Raza said that he would continue the strike until the demands are met and the strike would adversely affect the supply chain.""The tax measure is unacceptable and impracticable as flour dealers are refusing to lift their consignments instead of sharing their tax details for withholding tax purposes,"" he said.Raza said that the imposition of a PKR 600 tax on a bag of flour worth PKR 11,000 is inappropriate. He refuted the Punjab Food Minister Bilal Yasin's claim and said that the strike had not been postponed until Ashura (July 17).He added, ""Neither the government nor the FBR has contacted us for talks or to reconsider the strike.""Iftikhar Ahmed Mattoo, chairman of PFMA's Punjab chapter, said, ""We don't wish to trouble the public during Muharram, which is why the industry continued to supply flour to the market until July 10 despite bearing a tax burden of millions of rupees.""Mattoo said that now it was not feasible for them to bear the burden of tax. So, ""extreme measures have to be taken"". He said that flour mills across the city joined their call to ensure the survival of the industry, Dawn reported.The strike reportedly halted wheat supply all across the nation, bringing the flour availability and that of its related products to a grinding halt.Aamir Abdullah, PFMA's chairman for Sindh, confirmed an indefinite strike until the government withdraws the tax measures, noting that the suspension of wheat supply has also affected the bran supply for livestock.","Flour dealers and owners of atta chakkis joined the protest, causing disturbances in the supply flow of flour. Chairman of PFMA, Asim Raza said the measure has made flour mills withholding agents for tax collection. He said the tax is expected to increase flour prices by PakistRupees (PKR) 8 per kg.","https://static.toiimg.com/thumb/msid-111679813,imgsize-797592,width-400,resizemode-4/111679813.jpg"
Pakistan's begging business collects $42 billion annually: Report,https://timesofindia.indiatimes.com/world/pakistan/pakistans-begging-business-collects-42-billion-annually-report/articleshow/111667723.cms,"NEW DELHI: Pakistan's economy is in a precarious state, prompting the government to seek financial assistance from other nations and international organizations. This has led to the term 'begging' becoming a significant part of the country's political discourse, with citizens lamenting the need to constantly seek foreign aid .Prime Minister Shehbaz Sharif acknowledged this issue two years ago, stating, ""Today, when we go to any friendly country or make a phone call, they think that we have come to beg for money.""While the government seeks financial help, begging has become an organized industry within Pakistan, with beggars operating in cities and towns and even being exported to other countries.The government has recently decided to block the passports of more than 2,000 beggars for seven years and also restrict the activities of agents who facilitate this overseas begging business . Pakistani beggars primarily operate in Saudi Arabia, Iran, and Iraq.A parliamentary probe revealed that a significant number of beggars arrested in foreign countries were of Pakistani origin, with many exploiting pilgrim visas to travel to holy sites. The Interior Ministry has offloaded 44,000 individuals in the past two and a half years, while the Ministry of Foreign Affairs has called for increased screening before issuing passports.Within Pakistan, begging is a highly organized and competitive business, with an estimated 38 million beggars in the country. The average daily amount collected by beggars varies across cities, with Karachi having the highest at Rs 2,000. Annually, beggars extract $42 billion, which is more than 12% of Pakistan's GDP. Turf wars between beggars for lucrative spots are common, with some even resorting to violence.The government has struggled to abolish beggary, and police action against beggars has often been met with resistance. In 2011, hundreds of beggars clashed with police officials in Faisalabad, throwing stones and bricks at the police station. One beggar remarked, ""Since when has begging become a crime in Pakistan? We will stop begging the moment our government stops begging from the IMF and other foreign countries.""","Pakistan's economy is in a precarious state, prompting the government to seek financial assistance from other nations and international organizations. Prime Minister Shehbaz Sharif acknowledged this issue two years ago, stating, ""Today, when we go to any friendly country or make a phone call, they think that we have come to beg for money"" begging has become an organized industry within Pakistan, with beggars operating in cities and towns.","https://static.toiimg.com/thumb/msid-111667828,imgsize-44222,width-400,resizemode-4/111667828.jpg"
'Stakes are very high': Can Pakistan army protect Chinese projects from terror attacks?,https://timesofindia.indiatimes.com/world/pakistan/terror-attack-on-chinese-projects-in-pakistan-taliban-ttp-cpec-china-pakistan-economic-projects/articleshow/111658578.cms,"In Pakistan, authorities are intensifying security measures to protect Chinese workers and investments due to a rise in militant attacks targeting Chinese-funded megaprojects. In the southwestern port city, a new security barrier and numerous checkpoints have been established, while Karachi has added hundreds of police officers to a unit dedicated to safeguarding Chinese development projects. Islamabad has formed a new police force specifically for Chinese nationals' protection.","Authorities are intensifying security measures to protect Chinese workers and investments. Karachi has added hundreds of police officers to a unit dedicated to safeguarding Chinese development projects. Islamabad has formed a new police force specifically for Chinese nationals' protection. In the southwestern port city, a new security barrier and numerous checkpoints have been established.","https://static.toiimg.com/thumb/msid-111658694,imgsize-56216,width-400,resizemode-4/111658694.jpg"
Baloch Yakjehti Committee criticises Pakistan for atrocities against people of Balochistan,https://timesofindia.indiatimes.com/world/pakistan/baloch-yakjehti-committee-criticises-pakistan-for-atrocities-against-people-of-balochistan/articleshow/111632036.cms,"QUETTA : The Baloch Yakjehti Committee ( BYC ) has criticised the Pakistadministration and defence forces over their human rights atrocities and genocidal acts inflicted upon the Baloch community.The statement was released by the BYC on the sidelines of the major ""Baloch Raji Muchi"" (Baloch community gathering) scheduled to take place on July 28.In the statement, the BYC said, ""Every intelligent person is aware of the problems faced by the Baloch nation in the present time.The oppression, exploitation, military brutality, forced disappearances, mutilated bodies, murderous roads, deserted educational institutions, and other human rights abuses have reached their limits.""The BYC said that the Baloch Solidarity Committee is running a public resistance movement against the Baloch genocide .In the statement, BYC said, ""Baloch as a nation is facing a regular genocide. Against this Baloch Genocide, the Baloch Solidarity Committee is running a public resistance movement, the purpose of which is to unite the Baloch people, including all the social and political forces of the Baloch society, against the Baloch genocide and as a collective nation against the Baloch genocide. To pave the way for an orderly, prosperous and developed Baloch society by completely ending the Baloch genocide from the Baloch land through a popular resistance movement.""While referring to the upcoming Baloch community gathering led by the Baloch Solidarity Committee, the BYC urged the people to show their optimum participation.The BYC said, ""We understand that the people's movement cannot survive without the support and cooperation of the people, the Baloch Solidarity Committee has received the full support and support of the Baloch people in this movement since the beginning, so this movement against the Baloch genocide today. It exists in a strong and organized manner.""""Today, once again we request the Baloch people to fully support this movement by realizing all their national responsibilities to make ""Baloch Raji Muchi"" a success. Help and support the Baloch Solidarity Committee in every way,"" it added.","The Baloch Yakjehti Committee ( BYC) has criticised the Pakistadministration and defence forces over their human rights atrocities and genocidal acts inflicted upon the Baloch community. The statement was released by the BYC on the sidelines of the major ""Baloch Raji Muchi"" (Baloch community gathering) scheduled to take place on July 28.","https://static.toiimg.com/thumb/msid-111632150,imgsize-1602549,width-400,resizemode-4/111632150.jpg"
"Shehbaz Sharif government authorises ISI to intercept calls, texts ‘for national security'",https://timesofindia.indiatimes.com/world/pakistan/shehbaz-sharif-govt-authorises-isi-to-intercept-calls-texts-for-national-security/articleshow/111615149.cms,"ISLAMABAD: Pakistan's ISI has received a carte blanche from the Shehbaz Sharif govt to intercept phone calls and messages ""in the interest of national security"" amid nationwide outrage over the allegedly unbridled powers the spy agency already enjoys.The authorisation to tap calls and messages was issued Monday by the ministry of information and telecommunication, citing multiple complaints about people mysteriously going missing in the troubled provinces of Baluchistan and Khyber Pakhtunkhwa.""In exercise of the powers conferred under law, the federal government, in the interest of national security and in the apprehension of any offence, is pleased to authorise the officers not below the rank of grade 18, to be nominated from time to time by the ISI, to intercept calls and messages, or to trace calls through any telecommunication system as envisaged under the Pakistan Telecommunication (Re-organisation) Act,"" the order states.The move comes in the wake of criticism by some Pakistani judges, journalists, opposition politicians and supporters of jailed former PM Imran Khan about the Shehbaz administration allowing ISI to breach citizens' rights in the name of national security.In March, six high court judges accused the spy agency of interfering in judicial matters and taking recourse to ""intimidatory"" tactics such as secret surveillance , abduction of targets, installation of cameras in bedrooms, and torture of their family members.Although intrusive surveillance by spy agencies isn't uncommon in Pakistan, not many spoke up against it until purported audio clips, including those of Imran and his wife Bushra Bibi, were leaked in the lead-up to this year's general elections.Last Dec, Imran's wife had filed a petition in Islamabad high court, challenging ""unauthorised"" surveillance and privacy violations.During the course of the hearings, it was revealed that the Pakistan Telecommunications Authority had mandated telecom companies to finance, import, and install a mass surveillance system to access public data.A day earlier, the interior ministry defended the months-long ban on social media platform X on the ground that it was a ""threat to peace and national security"". The ban was clamped on Feb 17 based on ""intelligence reports"".""The hostile elements operating on X have nefarious intentions to create an environment of chaos and instability, with the ultimate goal of destabilising the country and plunging it into some form of anarchy,"" the ministry said.","Pakistan's ISI has received a carte blanche from the Shehbaz Sharif govt to intercept phone calls and messages ""in the interest of national security"" The move comes in the wake of criticism by some Pakistani judges, journalists, opposition politicians and supporters of jailed former PM Imran Khan. Six high court judges accused the spy agency of interfering in judicial matters.","https://static.toiimg.com/thumb/msid-111615142,imgsize-22306,width-400,resizemode-4/111615142.jpg"
"Pakistan grants intel agency ISI permission to monitor all phone calls, messages in country",https://timesofindia.indiatimes.com/world/pakistan/pakistan-grants-intel-agency-isi-permission-to-monitor-all-phone-calls-messages-in-country/articleshow/111609751.cms,"The Pakistan government has granted the Inter-Services Intelligence (ISI) agency the authority to intercept and trace any phone call or message in the country.This unprecedented power, officially sanctioned under Section 54 of the Pakistan Telecommunication Act 1996, marks an expansion of surveillance capabilities for the country's top intelligence agency.The federal cabinet's decision, communicated through SRO 1005(I)2024 dated July 8, 2024, empowers ISI officers of grade 18 or higher to intercept calls and messages as well as trace communications via any telecommunication system.The ministry of IT and telecom issued the notification, emphasizing that the move is in the interest of national security and aimed at preventing offenses.“In exercise of the powers conferred under Section 54… the federal government in the interest of national security and in the apprehension of any offence, is pleased to authorise the officers not below the rank of grade 18 to be nominated from time to time by the Inter-Services Intelligence (ISI) to intercept calls and messages or to trace calls through any telecommunication system as envisaged under Section 54 of the Act,” the notification read.It also states that the government will prioritise and have precedence in the telecommunications system over any licensee to safeguard national defence or security against foreign threats.""The federal government in the interest of national security and in the apprehension of any offence is pleased to authorise the officers [...] to be nominated from time to time by ISI to intercept calls and messages or to trace calls through any communication system,"" the notification further read.As per the sources, the decision appears to be part of the government's broader efforts to tighten control over social media platforms, which the opposition Pakistan Tehreek-e-Insaf (PTI) has effectively used to communicate with its supporters amid shrinking traditional media space.Earlier in May, PM Shehbaz approved a draft to amend the Prevention of Electronic Crimes Act (PECA) 2016, suggesting the establishment of a Digital Rights Protection Authority.Media reports indicate that the government is also installing a national firewall on various internet service providers (ISPs) to control social media content, with filters capable of blocking unwanted material.The Elon Musk-owned platform X has been blocked since February, and the government recently defended this action during a Sindh high court hearing of a petition challenging the ban.Reacting to the latest authorisation to ISI, PTI leader Omar Ayub Khan warned that the government's actions could backfire. ""The government and allies should know that the same actions would be used against their leaders once out of power. They will be roaming around the courts when hit by the measures they are instituting now,"" he said.","The Pakistan government has granted the Inter-Services Intelligence (ISI) agency the authority to intercept and trace any phone call or message in the country. This unprecedented power, officially sanctioned under Section 54 of the Pakistan Telecommunication Act 1996, marks an expansion of surveillance capabilities for the top intelligence agency.","https://static.toiimg.com/thumb/msid-111609768,imgsize-5176,width-400,resizemode-4/111609768.jpg"
Pak PM Sharif urges international community to recognise 'burden of Afghan refugees' in meeting with UNHCR chief,https://timesofindia.indiatimes.com/world/pakistan/pak-pm-sharif-urges-international-community-to-recognise-burden-of-afghan-refugees-in-meeting-with-unhcr-chief/articleshow/111605705.cms,"ISLAMABAD: The head of the UN refugee agency Filippo Grandi on Tuesday met with Pakistan Prime Minister Shehbaz Sharif to discuss the situation of millions of Afghan refugees living in uncertainty since Islamabad announced a repatriation plan of what it called "" undocumented aliens "" last year. During his meeting with Grandi, Commissioner of the UNHCR, Sharif urged the international community to recognise the "" burden of Afghan refugees"" being shouldered by Pakistan and demonstrate ""collective responsibility"" to deal with the issue, the Dawn newspaper reported.The United Nations High Commissioner for Refugees (UNHCR) arrived in Pakistan on Sunday on a three-day visit.""The prime minister stressed that the international community must recognise the burden being shouldered by Pakistan while hosting such a large refugee population, and demonstrate collective responsibility,"" a statement from the PM's Office said.The Pakistan Muslim League-Nawaz (PML-N) leader added that despite numerous challenges, the country had hosted Afghan refugees with exemplary respect and dignity.Sharif sought UNHCR's support in mobilising adequate resources to supplement Pakistan's efforts in this regard, urging the global refugee agency to play its role in coming up with durable solutions to address the situation of Afghan refugees.The prime minister emphasised that the international community needed to be mindful of the socio-economic challenges and security threats that Pakistan was facing, the Dawn reported.""The UN High Commissioner expressed gratitude for Pakistan's generosity and hospitality in hosting millions of Afghan refugees for the past many decades and assured that UNHCR would continue to work closely with Pakistan to fulfil the basic needs of the Afghan refugees,"" the statement added.Pakistan launched the first round of repatriation of what it called ""undocumented aliens"" in November last year.While no official data has been released as to how many of the estimated undocumented Afghans have left their country since November, the newspaper quoting informed sources said that half a million immigrants returned to Afghanistan via Khyber Pakhtunkhwa and Balochistan in the first round.On Monday, Grandi met with Pakistan's Minister for States and Frontier Regions, Amir Muqam, and said that UNHCR would organise a global dialogue, most likely in October, to discuss refugee-related issues, the Dawn said.""Pakistan would be specially invited at this occasion,"" the UNHCR chief said. He expressed the hope that the event will create a new dimension and avenues for the support of refugees across the globe.""Currently, there are 1.45 million registered Afghan citizens card holders and this does not include a great number of unregistered Afghan refugees and other nationals,"" federal minister Muqam said.He added that it was a ""matter of concern"" that there was a decline in support for Afghan refugees and development funds for their hosting areas in Pakistan.""We need exclusive, generous and sustainable interventions,"" he said.Grandi on Monday also called on Deputy Prime Minister Ishaq Dar and appreciated Pakistan's efforts and contributions in hosting Afghan refugees for decades, according to a statement by the foreign ministry.","UNHCR chief Filippo Grandi met with Pakistan Prime Minister Shehbaz Sharif. Sharif urged the international community to recognise the "" burden of Afghan refugees"" Pakistan launched the first round of repatriation of what it called ""undocumented aliens"" in November.","https://static.toiimg.com/thumb/msid-111605649,imgsize-98772,width-400,resizemode-4/111605649.jpg"
Pak SC reserves judgment in opposition party's petition about reserved seats allotment,https://timesofindia.indiatimes.com/world/pakistan/pak-sc-reserves-judgment-in-opposition-partys-petition-about-reserved-seats-allotment/articleshow/111603631.cms,"ISLAMABAD: Pakistan's Supreme Court on Tuesday reserved its judgment in a key petition by the opposition Sunni Ittehad Council (SIC) party about getting its due share in the reserved seats in Parliament and provincial assemblies. The appeal was filed after the Election Commission of Pakistan rejected the SIC's plea for awarding its share in the 70 reserved seats in the National Assembly and another 156 in the four provincial assemblies.The SIC became prominent after Pakistan Tehreek-e-Insaf (PTI) party-supported candidates joined the party after winning the elections as jailed former prime minister Imran Khan's PTI could not contest the polls and was not eligible to claim the seats reserved for women and minorities.The seats were awarded to the winning parties based on proportional representation .The ECP had rejected the SIC plea for reserved seats as it had not contested the elections and got strength when PTI-backed independently elected candidates joined after the elections.Its appeal against the ECP decision in the Peshawar High Court was also turned down. Subsequently, the party challenged it in the Supreme Court.A 13-member bench headed by Chief Justice Faez Isa and comprising justices Syed Mansoor Ali Shah, Munib Akhtar, Yahya Afridi, Aminuddin Khan, Jamal Mandokhail, Muhammad Ali Mazhar, Ayesha Malik, Athar Minallah, Syed Hasan Rizvi, Shahid Waheed, Irfan Saadat Khan and Naeem Akhtar Afghan heard the case.Chief Justice Isa announced at the conclusion of the proceedings that the panel decided to reserve the verdict for mutual consultation.He did not give any date for the announcement of the judgment, which is expected this week.""We will see if a short judgment can be announced,"" the chief justice remarked while reserving the judgment.Earlier, the Supreme Court on May 6 in a major relief to the PTI, suspended the Peshawar High Court's decision about rejecting the SIC plea.Following the ruling, the ECP on May 14 suspended the victory notifications of 77 candidates who belonged to other parties and were declared successful on the reserved seats.The final ruling by the top court in the case would decide the fate of those 77 reserved seats. Though it may not change the current power structure, the changes in the overall number game in the assemblies may impact the law-making process in the country.The problem of the PTI began when just before the general election, it was deprived of its symbol of cricket bat by the ECP for failure to hold the intra-party election according to its Constitution. It forced PTI to field its candidates as independents.PTI candidates joined the SIC to secure a due share in the reserved seats, but the ECP rejected the SIC plea for reserved seats by saying that it had not contested elections and also did not provide a list of candidates for the reserved seats within the stipulated time, which was mandatory.",Pakistan's Supreme Court on Tuesday reserved its judgment in a key petition by the opposition Sunni Ittehad Council (SIC) party. The appeal was filed after the Election Commission of Pakistan rejected the SIC's plea. The SIC became prominent after Pakistan Tehreek-e-Insaf (PTI) party-supported candidates joined the party.,"https://static.toiimg.com/thumb/msid-111603627,imgsize-41256,width-400,resizemode-4/111603627.jpg"
