Article Title,Article Link,Article Text,Article Summary,Article Image
'It was a hard hit’: Trump describes shooting as ‘surreal’ in Musk interview,https://timesofindia.indiatimes.com/world/us/it-was-a-hard-hit-trump-describes-shooting-as-surreal-in-musk-interview/articleshow/112482119.cms,"Musk’s endorsement and technical difficulties

In a live conversation on X with billionaire CEO Elon Musk , former US President Donald Trump recounted his experience of the recent shooting incident at a campaign rally , describing it as a ""hard hit"" and ""surreal."" The discussion, which aired Monday night, was delayed due to a technical glitch and a cyberattack.When asked by Musk about the shooting, Trump described the experience as ""not pleasant,"" recounting the moment he felt the bullet hit his ear.""It was a hard hit. It was very, I guess you would say, surreal, but it wasn't surreal,"" Trump said. He continued, ""I knew immediately that it was a bullet. The only question in my mind when I went down was, 'How many were killed?'""Trump was on stage at a Pennsylvania rally on July 13 when gunshots rang out, prompting Secret Service agents to intervene. Hours after the incident, Trump reported that the bullet had pierced the upper part of his right ear. The FBI has identified the shooter as Thomas Matthew Crooks, 20, from Bethel Park, Pennsylvania.Musk revealed that he endorsed Trump's presidential campaign in part due to Trump's reaction during the rally. ""Trump pumping his fists was just incredibly inspiring,"" Musk said.The live stream of the conversation faced significant disruptions. Initially scheduled for 8 pm ET, the event was delayed to 8:42 pm ET due to a distributed denial-of-service (DDoS) attack that overwhelmed X’s servers. Musk explained that the attack ""saturated hundreds of gigabits of data,"" making the platform nearly inaccessible for users.During the technical difficulties, users on X encountered issues accessing the livestream. Trending hashtags like ""crashed"" and ""#TwitterBlackout"" reflected widespread frustration as users faced error messages and screen outages.Despite the disruptions, the interview provided a stark reflection on the impact of the shooting and the ongoing challenges of digital security in high-profile broadcasts.","Former US President Donald Trump recounted his experience of the recent shooting incident at a campaign rally. The discussion, which aired Monday night, was delayed due to a technical glitch and a cyberattack. Trump described the experience as ""not pleasant,"" recounting the moment he felt the bullet hit his ear.","https://static.toiimg.com/thumb/msid-112482158,imgsize-40196,width-400,resizemode-4/112482158.jpg"
'Was looking in exact direction of shooter': Trump recalls assassination attempt in interview with Musk,https://timesofindia.indiatimes.com/world/us/was-looking-in-exact-direction-of-shooter-trump-recalls-assassination-attempt-in-interview-with-musk/articleshow/112481703.cms,"Former US President Donald Trump vividly recounted his assassination attempt in a recent rally at Pennsylvania 's Bethel Park , describing it as ""not pleasant"" during a conversation with tech giant and world's richest person, Elon Musk The interview, titled ""no limits,"" marked Trump's high-profile return to the social media platform X, formerly known as Twitter.The session was briefly delayed by a DDoS attack , starting more than half an hour late.""I knew immediately it was a bullet, I knew it was near my ear,"" Trump told X CEO Elon Musk, who has endorsed his candidacy. ""I heard people shouting, ‘Bullets, bullets.’""He further described the situation, saying, ""we had bullets flying right over my head after I went down. So I'm glad I went down. The bigger miracle was that I was looking in the exact direction of [Crooks].""Trump also spoke about Corey Comperatore , the man who lost his life in the attack, calling him a “great Trumper” and a terrific person. He added that supporters had raised significant funds for Comperatore’s family.The former US President commended the secret service for the swift actions and the crowd's ability to remain calm.“You didn’t have anybody flee, you didn’t have anyone stampede,” Trump remarked, noting his immediate concern about the lack of security on the rooftop.“That would have been the spot [for a gunman],” he added.Musk, once a critic of Trump, praised the Republican presidential nominee's toughness pointing to his response to last month's shooting as crucial for national security.“There are some real tough characters out there,"" X CEO said. ""And if they don’t think the American president is tough, they will do what they want to do.”The conversation between Trump and Musk, which lasted for over two hours and was largely friendly, offered few new details about Trump's plans for a potential second term.The former president mainly discussed his recent assassination attempt, illegal immigration, and his intentions to reduce government regulations.","Former US President Donald Trump recounted his assassination attempt in a conversation with tech giant and world's richest person, Elon Musk. The interview, titled ""no limits,"" marked Trump's high-profile return to the social media platform X, formerly known as Twitter.","https://static.toiimg.com/thumb/msid-112481728,imgsize-880012,width-400,resizemode-4/112481728.jpg"
"United Nations Security Council: UN chief calls for Africa's permanent seat in UNSC, highlights under representation",https://timesofindia.indiatimes.com/world/rest-of-world/un-chief-calls-for-africas-permanent-seat-in-unsc-highlights-under-representation/articleshow/112481525.cms,"During a recent high-level debate at the United Nations Security Council (UNSC), UN secretary-general Antonio Guterres said that UNSC has failed to keep pace with a changing world.Advocating for a permanent seat for Africa , Guterres said, ""We cannot accept that the world's preeminent peace and security body lacks a permanent voice for a continent of well over a billion people"" according to Al Jazeera.He emphasised that Africa's perspectives on peace and security, both within the continent and globally, are undervalued under the current arrangement.The UNSC currently consists of 15 members, including five permanent members with veto power—China, France, Russia, the United States, and the United Kingdom. The remaining ten seats are non-permanent, distributed regionally, with three allocated to African states.Meanwhile, the UN general assembly President Dennis Francis said, ""The fact that Africa continues to be manifestly underrepresented on the Security Council is simply wrong, offending as it does both the principles of equity and inclusion,"" he said.""It runs counter to the principle of sovereign equality of states and calls for the urgency to reform this institution to reflect the world as it is now, rather than what it was nearly 80 years ago,"" Francis added.The United Nations Security Council (UNSC) demanded in May that African nations take a larger role in addressing global security and development challenges.","UN secretary-general Antonio Guterres said that UNSC has failed to keep pace with a changing world. The UNSC currently consists of 15 members, including five permanent members with veto power. The remaining ten seats are non-permanent, distributed regionally, with three allocated to African states.","https://static.toiimg.com/thumb/msid-112481556,imgsize-723840,width-400,resizemode-4/112481556.jpg"
"Harris campaign targets Musk over Trump's interview on X: ‘Ruined Twitter’, now ‘controlling democracy’",https://timesofindia.indiatimes.com/world/us/harris-campaign-targets-elon-musk-over-trumps-interview-on-x-ruined-twitter-now-controlling-democracy/articleshow/112481094.cms,"The Kamala Harris campaign has unleashed a fiery email accusing Elon Musk of attempting to control American democracy . The email, marked by intense language, criticizes Musk for allowing "" hate speech and disinformation "" on his platform, X, and claims the billionaire is a ""lackey for Team MAGA.""""The richest person in the world is a lackey for Team MAGA,"" the email reads.""Musk already ruined Twitter by allowing hate speech and disinformation to flood the platform. Now, Musk is using his vast fortune and broad reach to try to control our democracy.""Coinciding with the email, the Harris-Walz campaign has sent out a fundraising appeal with the subject line: ""The two worst people you know are live this evening."" Reportedly, the email accuses Musk of pledging millions to re-elect Donald Trump and using his platform to propagate Trump's agenda.""It’s not enough that Musk has pledged to donate millions of dollars to help re-elect Trump. He’s using his purchased platform - one of the largest social media sites in the world - to spread Trump’s unhinged and hateful agenda to millions of users,"" the email asserts, emphasizing the word ""millions"" in italics.In addition to the email campaign, the Harris-Walz team has also leveraged Truth Social, Trump's own platform, to escalate their attacks on the former president during his ongoing interview.","The Kamala Harris campaign has unleashed a fiery email accusing Elon Musk of attempting to control American democracy. The email, marked by intense language, criticizes Musk for allowing "" hate speech and disinformation "" on his platform, X. The Harris-Walz campaign has sent out a fundraising appeal with the subject line: ""The two worst people you know are live this evening""","https://static.toiimg.com/thumb/msid-112481459,imgsize-1198000,width-400,resizemode-4/112481459.jpg"
"Suspected attack by Yemen's Houthi rebels targets ship in southern Red Sea, officials say",https://timesofindia.indiatimes.com/world/middle-east/suspected-attack-by-yemens-houthi-rebels-targets-ship-in-southern-red-sea-officials-say/articleshow/112481193.cms,"DUBAI: A suspected attack by Yemen 's Houthi rebels targeted a ship in the southern reaches of the Red Sea early Tuesday, officials said, the latest in their campaign of assaults over the Israel-Hamas war.The attack comes as Yemen's main sponsor, Iran , weighs a possible retaliatory attack against Israel over the assassination of Hamas official Ismail Haniyeh in late July, which has renewed fears of a wider regional war breaking out across the Mideast.Already, the Houthi assaults have have disrupted the $1 trillion of goods that flow annually through the maritime route crucial to trade between Asia, Europe and the Middle East, while also sparking the most intense combat the US Navy has seen since World War II.The attack happened around 115 kilometers (70 miles) south of the Houthi-held port city of Hodeida, the British military's United Kingdom Maritime Trade Operations center said. The attack saw an explosive detonate near the ship, though ""the vessel and crew are reported safe,"" the UKMTO said.The private security firm Ambrey similarly reported the attack, saying the ship saw ""two 'close-proximity' explosions.""Though the Houthis didn't immediately claim the attack, it sometimes can take hours or even days to acknowledge their assaults. They've also claimed others that apparently haven't happened.The Houthis have targeted more than 70 vessels with missiles and drones in a campaign that has killed four sailors since the start of the war in Gaza in October. They have seized one vessel and sunk two in the time since. Other missiles and drones have been either intercepted by a US-led coalition in the Red Sea or splashed down before reaching their targets.The rebels maintain that their attacks target ships linked to Israel, the United States or the UK as part of a campaign they say seeks to force an end to the war. However, many of the ships attacked have little or no connection to the conflict, including some bound for Iran.The Houthis have launched drones and missiles toward Israel, including an attack on July 19 that killed one person and wounded 10 others in Tel Aviv. Israel responded the next day with airstrikes on the Houthi-held port city of Hodeida that hit fuel depots and electrical stations, killing and wounding a number of people, the rebels say.After the strikes, the Houthis paused their attacks until Aug. 3, when they hit a Liberian-flagged container ship traveling through the Gulf of Aden. A Liberian-flagged oil tanker came under a particularly intense series of attacks beginning Aug. 8 likely carried out by the rebels.As Iran threatens to retaliate over Haniyeh, the US military has told the USS Abraham Lincoln aircraft carrier strike group to sail more quickly to the area. America also has ordered the the USS Georgia guided missile submarine into the Mideast, while the USS Theodore Roosevelt aircraft carrier strike group had been in the Gulf of Oman. Additional F-22 fighter jets have flown into the region, while the USS Wasp, a large amphibious assault ship carrying F-35 fighter jets, is in the Mediterranean Sea.","The attack happened around 115 kilometers (70 miles) south of the Houthi-held port city of Hodeida. The attack saw an explosive detonate near the ship, though ""the vessel and crew are reported safe"" The Houthi assaults have disrupted the $1 trillion of goods that flow annually through the maritime route.","https://static.toiimg.com/thumb/msid-112481325,imgsize-470254,width-400,resizemode-4/112481325.jpg"
Donald Trump: US elections: FBI investigates allegations of stolen Trump campaign documents in cyber attack,https://timesofindia.indiatimes.com/world/us/us-elections-fbi-investigates-allegations-of-stolen-trump-campaign-documents-in-cyber-attack/articleshow/112480631.cms,"The FBI has initiated an investigation into allegations that sensitive documents from the Trump Campaign were stolen in a cyber attack. “We can confirm the FBI is investigating this matter,” said the FBI in a brief statement.This development follows the Trump Campaign's assertion that it was hacked by Iran, AP reported.While the campaign has not provided specific evidence to support its hacking claims, it cites a report from Microsoft about foreign agents' attempts to interfere in the 2024 US election.As per reports, a spear-phishing email was sent in June by an Iranian military unit to a high-ranking official of the presidential campaign from a compromised email account of a former senior advisor.Microsoft’s report indicated that ""foreign malign influence concerning the 2024 US election started off slowly but has steadily increased over the last six months, initially due to Russian operations, and more recently from Iranian activity.""Further analysis in the report stated, ""Iranian cyber-enabled influence operations have been a consistent feature of at least the last three US election cycles. Iran's operations have been notable and distinguishable from Russian campaigns for appearing later in the election season and employing cyberattacks more geared toward election conduct than swaying voters.""Concluding the report, Microsoft noted, ""Recent activity suggests the Iranian regime—along with the Kremlin—may be equally engaged in Election 2024.""Politico reported receiving emails starting July 22 from an unidentified AOL account under the name ""Robert."" The emails contained what appeared to be a research dossier prepared by the campaign on Republican vice presidential nominee, Ohio Senator JD Vance. The dossier was dated February 23, nearly five months before Trump selected Vance as his running mate.Reacting to the report, Trump campaign spokesperson Steven Cheung stated, ""These documents were obtained illegally"" and are ""intended to interfere with the 2024 election and sow chaos throughout our democratic process.""Iran's delegation to the United Nations has denied involvement when questioned about the Trump campaign's claims.Despite this, there have been longstanding suspicions regarding Iran's engagement in hacking operations aimed at its adversaries in the Middle East and other regions. Additionally, Tehran has consistently expressed its intention to seek revenge against Trump for the 2020 drone strike he authorized that resulted in the death of prominent Revolutionary Guard General Qassem Soleimani.","The FBI is investigating allegations that sensitive documents from the Trump Campaign were stolen in a cyber attack. This development follows the Trump campaign's assertion that it was hacked by Iran. While the campaign has not provided specific evidence to support its claims, it cites a report from Microsoft about foreign agents' attempts to interfere in the 2024 US election.","https://static.toiimg.com/thumb/msid-112480688,imgsize-1201107,width-400,resizemode-4/112480688.jpg"
US Elections 2024: US elections 2024: Trump and Kamala’s differing ideologies offer contrasting outlooks for voters,https://timesofindia.indiatimes.com/world/us/us-elections-2024-trump-and-kamalas-differing-ideologies-offer-contrasting-outlooks-for-voters/articleshow/112481148.cms,"Vice President Kamala Harris and former President Donald Trump are presenting voters with sharply contrasting visions as they campaign nationwide. Harris, alongside her running mate Minnesota Governor Tim Walz , is championing a message of optimism, branding their campaign as a team of ""joyful warriors.""In contrast, Trump has adopted a more sombre tone, cautioning about potential national challenges, reported AP.Harris and Walz are actively engaging with voters through a campaign tour of key battleground states , which recently included a high-energy rally in Philadelphia and stops in Wisconsin, Michigan, Arizona, and Nevada. However, planned events in Georgia and North Carolina were cancelled due to Tropical Storm Debby. Harris emphasized the theme of joy, saying, ""Thank you for bringing back the joy,"" and branding the Democratic ticket as ""joyful warriors.""Trump, campaigning with his running mate, Ohio Senator JD Vance, has taken a different approach. At a recent news conference at his Mar-a-Lago club in Florida, Trump warned of ""a lot of bad things coming up,"" predicting potential economic decline and other serious challenges. This marks a stark contrast to the optimistic tone of the Harris-Walz campaign.Polling data from The AP-NORC Center for Public Affairs Research reveals widespread pessimism, with two-thirds of Americans feeling uneasy about the political climate and about 70% believing the country is heading in the wrong direction. Despite this, Trump’s senior adviser, Jason Miller, argues that voters are focused on practical issues, noting, ""That's not making gas or food or housing less expensive.""Vance has echoed Trump’s economic concerns while criticizing the Democratic ticket and defending past remarks. He has underscored Trump’s accomplishments and proposed policies for a second term, while also addressing criticisms of Walz’s military record.Walz is preparing for his first solo events as Harris' running mate, beginning with a speech at the American Federation of State, County, and Municipal Employees convention in Los Angeles. He will also attend fundraisers in Newport Beach, California, and visit additional cities including Denver, Boston, Rhode Island, and Southampton, New York.Trump is scheduled for a live interview on X, the social platform formerly known as Twitter, which he was banned from following the January 6, 2021, Capitol incident. Hosted by Elon Musk, the interview has faced technical issues and has been postponed. Musk, who had previously identified as a Democrat, endorsed Trump’s candidacy after an assassination attempt at a Pennsylvania rally. The FBI is currently investigating allegations of stolen sensitive documents from the Trump campaign in a recent cyber intrusion.As the campaign progresses, voters will continue to hear from both candidates and their running mates. Harris and Walz will persist in promoting their optimistic vision, while Trump and Vance will highlight potential future challenges. The initial phases of the Harris-Walz campaign have attracted large, enthusiastic crowds with a focus on joy, aiming to contrast with Trump’s more cautionary predictions and appeal to an electorate concerned about the nation’s direction.Tim Walz will continue his campaign this week with various fundraisers and speaking engagements, further reinforcing the optimistic message central to the Harris-Walz campaign.In summary, the contrasting messages from Harris and Trump offer voters distinct visions for the future, reflecting the broader debate on the nation’s path forward.","Kamala Harris and Tim Walz are championing a message of optimism, branding their campaign as a team of ""joyful warriors"" Trump has adopted a more sombre tone, cautioning about potential national challenges. Polling data from The AP-NORC Center for Public Affairs Research reveals widespread pessimism.","https://static.toiimg.com/thumb/msid-112481159,imgsize-2068750,width-400,resizemode-4/112481159.jpg"
Know the minimum age to get married countrywise amidst barbaric Iraq law proposal,https://timesofindia.indiatimes.com/world/know-the-minimum-age-to-get-married-countrywise-amidst-barbaric-iraq-law-proposal/articleshow/112441778.cms,"Marriageable age as a right



Countries with highest legal age to get married



Country

Age

Parental Consent

Without Parental Consent

Men

Women

Argentina

21

21

Yes

21

Australia

16-18

16-18

Yes

18

Brazil

18

18

Yes

18

Canada

18 or 19

18 or 19

Yes

18 or 19

China

22

20

Yes

22

France

15

15

Yes

18

Germany

16

16

Yes

18

India

21

18

Yes

21

Italy

16

16

Yes

18

Japan

16

16

Yes

18

Mexico

18

18

Yes

18

Netherlands

18

18

Yes

18

New Zealand

16

16

Yes

16

South Africa

16

16

Yes

18

South Korea

16

16

Yes

18

United Kingdom

18

18

Yes

18

United States

Varies

Varies

Yes (varies by state)

21 (Mississippi, Puerto Rico)



Countries with lowest legal age to get married



Country

Age for men

Age for women

Parental Consent

Without Parental Consent

Afghanistan

15

15

Yes

18

Albania

16

16

Yes

18

Bangladesh

21

18

Yes

21

Belgium

16

16

Yes

18

Brazil

16

16

Yes

18

Chile

16

16

Yes

18

Colombia

18

18

Yes

18

Denmark

16

16

Yes

18

Equatorial Guinea

18

14

Yes

18

France

15

15

Yes

18

Germany

16

16

Yes

18

Greece

16

16

Yes

18

India

21

18

Yes

21

Iran

15

13

Yes

18

Italy

16

16

Yes

18

Japan

16

16

Yes

18

Jordan

16

16

Yes

18

Lebanon

18

18

Yes

18

Mexico

18

18

Yes

18

Morocco

18

18

Yes

18

Netherlands

18

18

Yes

18

Russia

16

16

Yes

18

São Tomé and Príncipe

18

14

Yes

18

South Korea

16

16

Yes

18

Turkey

17

17

Yes

18

United Kingdom

16

16

Yes

18

United States

Varies

Varies

Yes (varies by state)

21 (Mississippi, Puerto Rico)

Yemen

15

15

Yes

18



Also read:|

Recently, the Iraqi government introduced a draft measure in the parliament that would lower the legal age of marriage for women from 18 to just 9. This implies that child marriage would become acceptable once more. This is perceived by activists and demonstrators in Iraq as a serious danger to women's rights since it leaves the young girls, who are only nine years old, open to forced marriage and ""child rape.""The legal age of marriage varies from nation to nation throughout the world.While some, like the United Kingdom, have set the age at 18 for both men and women, underage marriage is still permitted with parental approval. In India, the legal age of marriage is fixed at 18 for men and 21 for women. This year, the bill to raise the age at which women may marry expired. A number of nations allow child marriages. Any age of child can get married with the approval of their parents or father figure. Let's examine a few nations in the world for the highest and lowest marriage age.With few exclusions that vary by nation, most governments permit marriages between people under the age of 18. In 2010, 158 nations declared that the legal minimum age for women to marry without parental approval or consent was 18. Males are legally allowed to marry in 180 countries at the age of 18, while males can marry with parental approval in 105 countries. Many EU nations have strengthened their marriage rules in recent years, outlawing unions between people under the age of 18 or demanding judicial consent. Very similar legislation has also been passed by other emerging nations.","The legal age of marriage varies from nation to nation throughout the world. Marriageable age as a right is set at 18 for both men and women. In India, the legal age is fixed at 21 for men and 18 for women. A number of nations allow child marriages, which are open to ""child rape""","https://static.toiimg.com/thumb/msid-112442428,imgsize-1407150,width-400,resizemode-4/112442428.jpg"
