Article Title,Article Link,Article Text,Article Summary,Article Image
"'911 S5': Chinese national arrested, FBI takes down huge global army of zombie computer devices",https://timesofindia.indiatimes.com/world/us/911-s5-chinese-national-arrested-fbi-takes-down-massive-global-army-of-zombie-computer-devices/articleshow/110548700.cms,"The botnet operated by infecting residential Windows computers with malware, transforming them into ""zombie"" machines that could be controlled remotely.

What was the ""911 S5"" botnet?

The ""911 S5"" botnet was a vast network of malware-infected computers spanning nearly 200 countries. According to FBI Director Christopher Wray, it was ""likely the world's largest"" and facilitated numerous cybercrimes, including identity theft, financial fraud, and access to child exploitation materials.

Who was behind the botnet?

Yunhe Wang, a 35-year-old Chinese national, was identified as the administrator of the botnet. Wang was arrested in Singapore on May 24. He allegedly managed the network through 150 dedicated servers, half of which were leased from US-based service providers.

How did the botnet operate?

The botnet operated by infecting residential Windows computers with malware, transforming them into ""zombie"" machines that could be controlled remotely. Cybercriminals purchased access to these compromised computers, using them to carry out various illegal activities.

What kind of crimes were committed using the botnet?

Criminals used the botnet for a staggering array of crimes. These included identity theft, financial fraud, child exploitation, bomb threats, and cyberattacks. The botnet was also involved in defrauding financial institutions and federal lending programs, including pandemic relief scams. US Attorney General Merrick Garland stated that the criminals were responsible for over $5.9 billion in estimated losses from relief program fraud.

What assets were seized during the operation?

Law enforcement seized approximately $29 million in cryptocurrency, luxury goods valued at $4 million, and about $30 million in real estate. These assets were located in various countries, including Singapore, Thailand, Dubai, and others. Additionally, 22 domains associated with the botnet were also seized.

How did the law enforcement operation unfold?

The operation, named Operation Tunnel Rat, involved executing multiple search warrants and conducting interviews in Singapore and Thailand. The FBI, along with international partners, dismantled the botnet's infrastructure and arrested Wang. Authorities are also looking into the possibility of additional arrests.

How did the public get involved in this operation?

The FBI has set up a web page where individuals can check if their IP address was among those compromised by the botnet. This helps potential victims identify and mitigate any security issues stemming from the infection.

What happens next for Yunhe Wang?

The US is currently awaiting Wang's extradition from Singapore. Brett Leatherman, deputy assistant director with the FBI’s Cyber Division, emphasized the urgency of the extradition, stating, “We want him, you know, as soon as possible.”

An international law enforcement team has made a significant breakthrough in the fight against cybercrime, arresting a Chinese national and dismantling a massive botnet that has been operational for nearly a decade. This botnet, known as "" 911 S5 ,"" was responsible for various illegal activities, including identity theft, child exploitation, and financial fraud . The takedown involved cooperation between authorities in multiple countries, highlighting the global nature of cybercrime and the necessity of international collaboration to combat it.The botnet, managed by Yunhe Wang , infected millions of computers across nearly 200 countries. This network of compromised machines, often referred to as ""zombie"" computers, was used by criminals to carry out a wide array of illicit activities. The US Department of Justice and the FBI have been instrumental in this operation, which has led to significant financial and operational seizures, including millions in cryptocurrency and luxury assets.Here is all you need to know:(With inputs from agencies)","The ""911 S5"" botnet was a vast network of malware-infected computers spanning nearly 200 countries. Yunhe Wang, a 35-year-old Chinese national, was identified as the administrator of the botnet. Wang allegedly managed the network through 150 dedicated servers, half of which were leased from US-based service providers. Law enforcement seized approximately $29 million in cryptocurrency, luxury goods, and about $30 million in real estate.","https://static.toiimg.com/thumb/msid-110548747,imgsize-1251069,width-400,resizemode-4/110548747.jpg"
Watch: Two planes collide mid-air during an air show in Portugal,https://timesofindia.indiatimes.com/world/europe/watch-two-planes-collide-mid-air-during-an-air-show-in-portugal/articleshow/110644533.cms,"NEW DELHI: A pilot was killed while another was injured after two small planes collided mid-air during an air show at Beja Airport in southern Portugal on Sunday, according to the air force. The incident occurred during a performance involving six aircraft.The air show, which brings together dozens of military planes and helicopters, was interrupted following the incident.""The air force regrets to announce that at 4:05 pm (1505 GMT), at the Beja Air Show, two planes were the victim of an accident during an aerial demonstration,"" it said in a short statement.According to witnesses, the accident involved aircraft from the YAK STARS aerobatic patrol, described by the Air Force in the event program as the ""largest civilian aerobatic display team in southern Europe.""","Two small planes collided mid-air during an air show at Beja Airport in southern Portugal. The incident occurred during a performance involving six aircraft. The air show, which brings together dozens of military planes and helicopters, was interrupted following the incident.","https://static.toiimg.com/thumb/msid-110644649,imgsize-169570,width-400,resizemode-4/110644649.jpg"
Stunning archaeological find: Prehistoric discovery in US lake leaves experts in shock and awe,https://timesofindia.indiatimes.com/world/us/stunning-archaeological-find-prehistoric-discovery-in-us-lake-leaves-experts-in-shock-and-awe/articleshow/110569138.cms,"(With inputs from agencies)

NEW DELHI: Wisconsin historians have announced a groundbreaking discovery of at least 11 ancient canoes in Lake Mendota , near Madison. This significant find includes a canoe dating back to 2500 BC. The Wisconsin Historical Society revealed the discovery on May 23, noting that the initial two canoes were found in 2021 and 2022.Dr Amy Rosebrough, State Archaeologist for the Wisconsin Historical Society, explained the importance of this find, saying, ""The Indigenous peoples of Wisconsin and the wider United States fished, traveled, and traded extensively on inland lakes and streams, and until now we have not had a clear look at the canoes used in the Great Lakes region."" She likened the discovery to understanding life in the Midwest without ever seeing a real pickup truck, emphasizing the crucial role canoes played in transportation and trade.Radiocarbon dating revealed that the oldest canoe dates back to 2500 BC, contemporary with the construction of Stonehenge, and much earlier than the founding of Ancient Rome or the birth of Jesus Christ. The youngest canoe dates to 1250 AD.Not all canoes will be removed from the lake due to their fragility. Rosebrough mentioned that divers also found stone tools in the water, suggesting the presence of an ancient village site, which has yet to be located. ""Even without finding the village, the discovery of these canoes and the tools found within the first canoe reminds us that people have lived and worked alongside the lake for thousands of years,"" she added.Efforts are ongoing to explore the lake further, using non-destructive remote sensing techniques to uncover more about this prehistoric site. Rosebrough highlighted the unique archaeological potential of smaller bodies of water like Lake Mendota, which often receive less funding than the Great Lakes but hold distinct historical significance.The Wisconsin Historical Society, in partnership with Native Nations in Wisconsin, aims to uncover and share the rich history of these discoveries at the new Wisconsin History Center, set to open in early 2027.","Wisconsin historians have announced a groundbreaking discovery of at least 11 ancient canoes in Lake Mendota. The oldest canoe dates back to 2500 BC, contemporary with the construction of Stonehenge. The youngest canoe dates to 1250 AD. Not all canoes will be removed from the lake due to their fragility.","https://static.toiimg.com/thumb/msid-110569194,imgsize-1777468,width-400,resizemode-4/110569194.jpg"
Helen Mary Roberts becomes first woman brigadier in Pakistan Army from minority community,https://timesofindia.indiatimes.com/world/pakistan/helen-mary-roberts-becomes-first-woman-brigadier-in-pakistan-army-from-minority-community/articleshow/110649553.cms,"ISLAMABAD : Dr Helen Mary Roberts , serving in the Pakistan Army Medical Corps, has made history by becoming the first woman from Christian and minority community to achieve the rank of brigadier in the Muslim-majority country. Brigadier Helen was among Pakistan Army officers promoted as brigadiers and full colonels by the Selection Board, The News reported on Sunday.Prime Minister Shehbaz Sharif congratulated Helen on her promotion as Brigadier, saying the whole nation was proud of her and thousands of hardworking women like her from minority communities who are serving the country with distinction.""I myself and the nation congratulate Brig Helen Mary Roberts on getting the honour of the first female from minority to be promoted as Brigadier in the Pakistan Army,"" he said.Brigadier Dr. Helen is senior pathologist and has been serving in the Pakistan Army for the last 26 years.During a Christmas celebration at Christ Church in Rawalpindi last year, Pakistan Army chief General Asim Munir had commended the role played by the minority community in the country's development.According to data released by the Pakistan Bureau of Statistics in 2021, there are 96.47 per cent Muslims in the country, followed by 2.14 per cent Hindus, 1.27 per cent Christians, 0.09 per cent Ahmadi Muslims and 0.02 per cent others.",Brigadier Helen Mary Roberts is serving in the Pakistan Army Medical Corps. She is the first woman from Christian and minority community to achieve the rank of brigadier in the Muslim-majority country. Prime Minister Shehbaz Sharif congratulated Helen on her promotion as Brigadier.,"https://static.toiimg.com/thumb/msid-110649593,imgsize-698277,width-400,resizemode-4/110649593.jpg"
Biden: Netanyahu could be prolonging Gaza war for political aims,https://timesofindia.indiatimes.com/world/us/biden-netanyahu-could-be-prolonging-gaza-war-for-political-aims/articleshow/110710343.cms,"US President Joe Biden , in an interview with Time magazine, suggested that Israeli Prime Minister Benjamin Netanyahu might be prolonging the war in Gaza for political reasons. The US president's comments came just before he outlined a proposal for a ceasefire in the region, as Netanyahu grapples with deep political divisions within his country.When asked if he believed Netanyahu was extending the war for his own political gain, Biden responded, ""There is every reason for people to draw that conclusion."" He also expressed uncertainty about whether Israeli forces had committed war crimes in Gaza, rejecting claims that Israel was using starvation as a warfare tactic, but stating, ""I think they've engaged in activity that is inappropriate.""The Israeli government spokesperson, David Mencer, criticized Biden's remarks about Netanyahu, calling them ""outside the diplomatic norms of every right-thinking country."" Last month, the International Criminal Court's prosecutor in The Hague requested arrest warrants for Netanyahu, his defense chief, and three Hamas leaders over alleged war crimes.Israel launched an offensive in Gaza last October, vowing to destroy the Palestinian Islamist militant group Hamas after it attacked inside Israel, resulting in the deaths of around 1,200 people and the capture of more than 250 hostages, according to Israeli tallies. The Israeli assault has claimed the lives of over 36,000 people in Gaza, as reported by local health authorities, who also state that thousands more bodies remain buried under rubble.Despite most Israelis supporting the war, opinion polls indicate that they hold Netanyahu responsible for the security failures during the Hamas attack on Israeli communities near Gaza on October 7. The polls also suggest that if an election were held, Netanyahu would be voted out of office. Weekly mass street protests, attended by tens of thousands, have become commonplace, with demonstrators demanding that the government do more to bring home the hostages seized by Hamas and calling for Netanyahu's resignation.(With inputs from agencies)","US President Joe Biden suggested that Israeli Prime Minister Benjamin Netanyahu might be prolonging the war in Gaza for political reasons. Biden's comments came just before he outlined a proposal for a ceasefire in the region. Israeli government spokesperson, David Mencer, criticized Biden's remarks about Netanyahu, calling them ""outside the diplomatic norms of every right-thinking country""","https://static.toiimg.com/thumb/msid-110710332,imgsize-51288,width-400,resizemode-4/110710332.jpg"
Meet the other Nitish Kumar who loves switching teams,https://timesofindia.indiatimes.com/world/us/meet-the-other-nitish-kumar-who-loves-switching-teams/articleshow/110708535.cms,"After switching alliances for the umpteenth time and flipping to the NDA before the 2024 Lok Sabha Election , Bihar Chief Minister Nitish Kumar , while sharing a dais with PM Narendra Modi, had promised that he won’t switch alliances again. Given how close the 2024 Lok Sabha General Elections Results turned ou t, the BJP will hope that Nitish Kumar doesn’t have another change of heart. Most pollsters suggested that the NDA would be in the 370-400 mark, but it will probably turn out close to 295. That will make the seats held by allies like JD(U) and TDP become extremely crucial. While the Bihar Chief Minister’s desire to switch teams is well-known, there he has a namesake who also exhibits a similar tendency.Born in Scarborough, Ontario in 1994, Nitish Kumar is an all-rounder who played almost all of Canada’s matches in the 2010 Under-19 World Cup qualifiers. He holds the record for being the youngest player to debut for Canada in a first-class match when he played in the ICC Intercontinental Cup Fixture against Kenya in August 2009. He is also the second-youngest ODI player (15 years and 273 days), only bettered by Pakistan’s Hasan Raza. Kumar later swapped colours and started representing the US national team. In this year’s T20 World Cup , he is representing the USA.Incidentally, Nitish Kumar’s middle name is Roenick, a tribute to National Hockey League star Jeremy Roenick. Incidentally, Kumar played for Canada in the 2011 World Cup when here became the tournament’s youngest player. Kumar even captained Canada and last played for the team 2019. He recently made his debut for the US national side and is part of the T20 World Cup squad being held in US soil. He is also expected to face off against India when the two nations meet on June 12.","Bihar Chief Minister Nitish Kumar had promised that he won’t switch alliances again. Kumar later swapped colours and started representing the US national team. In this year’s T20 World Cup, he is representing the USA. He holds the record for being the youngest player to debut for Canada in a first-class match.","https://static.toiimg.com/thumb/msid-110708909,imgsize-58462,width-400,resizemode-4/110708909.jpg"
"CFO of Trump-loving The Epoch Times arrested, charged with money laundering and bank fraud",https://timesofindia.indiatimes.com/world/us/cfo-of-trump-loving-the-epoch-times-arrested-charged-with-money-laundering-and-bank-fraud/articleshow/110689900.cms,"What is the Epoch Times?

A top executive at a right-wing media company has been arrested and charged with laundering at least $67million in stolen money. Weidong Guan , a top executive at The Epoch Times was indicted by a federal grand jury, one count of money laundering and two counts of bank fraud .A report in The New York Times claims that Guan lied to a financial institution through the source of the cash, some of which was pilfered through fake unemployment benefits. According to the Justice Department, the money boosted The Epoch Times’ revenue by 400% in just one year.Guan, it’s Chief Financial Officer, was arrested on Monday and pleaded not guilty. Guan faces 20 years in prison for the money-laundering charge and 30 years for each count of bank fraud.The Epoch Times is associated with Falun Gong , a spiritual movement in China. For years, the outlet solely focussed on criticism of the Chinese Communist Party, but more recently it became a prominent supporter of Donald Trump and his right-wing allies.Prosecutors claim that Guan ran a “sprawling, translational scheme” over four years to buy prepaid debit cards on the internet at a discounting using cryptocurrency and then deposited the cards’ money into both personal and company accounts. Prosecutors said that some of the money, loaded on the debit cards, was illegally obtained. Damian Williams, the US attorney for the Southern District of New York said the charges represented the government’s “commitment to vigorously enforcing the laws against those who facilitate fraud through money laundering and to protecting the integrity of the U.S. financial system”.Guan of Secaucus of New Jersey was in custody and faces a $3 million bail package, including a $250,000 cash deposit. He will have to remain in home detention. Meanwhile, the Epoch Times said that it will fully cooperate with the investigation dealing with the allegations against Guan.The Epoch Times was founded in 2000 in Georgia by current CEO, John Tang, then a Georgia Tech graduate student and a follower of Falun Gong. During the 2016 election, they embraced Donald Trump, and became enthusiastic supporters after Trump’s victory.Along with a newspaper, The Epoch Times runs a digital news site, produces podcasts and also operates the broadcaster New Tang Dynasty Television, better known as NTD.Its critics have accused it of spreading right-wing conspiracy theories and in 2019, Facebook banned the company on advertising on the platform after it was found to be obscuring its ad purchases in violations of transparency requirements. The Epoch Times also claims it’s the fourth-largest newspaper in the US, but since it doesn’t participate in industry audits, there’s no way to verify this claim.The money-laundering scheme started in 2020. The total revenue increased to $71million from $15million. The following year it jumped to $121million. While Guan attributed the financial results to growth in paid subscribers and donations from supporters even telling a member of Congress that the subscriptions accounted for the company’s growth.However, the money actually came from a criminal scheme involving an overseas-based team called Make Money Online. Even when pressed by banks or other trading platforms, Guan claimed they were donations from supporters. Guan also deposited $16.7 million of the proceeds into his personal accounts, income that he didn’t report.","The Epoch Times is associated with Falun Gong, a spiritual movement in China. For years, the outlet solely focussed on criticism of the Chinese Communist Party, but more recently it became a prominent supporter of Donald Trump and his right-wing allies. Weidong Guan, it’s Chief Financial Officer, was arrested on Monday and pleaded not guilty. Guan faces 20 years in prison for the money laundering charge and 30 years for each count of bank fraud.","https://static.toiimg.com/thumb/msid-110690167,imgsize-101952,width-400,resizemode-4/110690167.jpg"
Was missing crypto-scam queen Ruja Ignatova murdered by a Bulgarian drug lord? New investigation tries to shed light on her disappearance,https://timesofindia.indiatimes.com/world/us/was-missing-crypto-scam-queen-ruja-ignatova-murdered-by-a-bulgarian-drug-lord-new-investigation-tries-to-shed-light-on-her-disappearance/articleshow/110672742.cms,"One conspiracy theory that has intrigued enthusiasts around the world for generations is the DB Cooper Escape. For those who don’t know, DB Cooper was the media moniker given to a man who demanded $200,000 in ransom and then opened the aircraft’s door and parachuted into the night over southwestern Washington, US. Despite numerous suspects and a manhunt for years by the FBI, DB Cooper’s body or whereabouts were never ascertained. It was never discovered whether DB Cooper lived or died, or who was the mysterious gentleman who disappeared into the night. The DB Cooper case took place in 1968 but like Cooper, there was another extraordinary criminal who simply disappeared into thin air: Ruja Ignatova .Ruja Ignatova made billions with a fraudulent crypto-currency before she suddenly vanished in 2017. A new BBC investigation tries to find out if she was murdered or just diseappeared. Ruja Ignatova was born in Bulgaria and raised in Germany, ostensibly pursuing a successful career in finance before being charged with financial fraud in Germany in 2012.She later returned with OneCoin , a fraudulent, non-existent crypto currency that was pegged as a Bitcoin killer. Between August 2014 and March 2017, people from across the globe, from Brazil to Yemen, invested in OneCoin. An FBI estimate puts the total amount invested at $4.5 billion.Millions donated before they realised that OneCoin wasn’t a cryptocurrency, doesn’t even have a blockchain and wasn’t a currency that could be used anywhere. FBI says OneCoin claimed to have a “private blockchain”. Actually, it when OneCoin users logged in to check their wallets, they’d simply see random numbers on a screen.In early 2019, she was charged by US authorities for wire fraud, securities fraud and money laundering. She was added to FBI's 10 Most Wanted in June 2022.In 2017, as investigators from Germany and the US closed in, Ignatova took an early morning Ryanair flight from Sofia to Athens and was never seen again. Most of her alleged collaborators were arrested including OneCoin’s co-founder Sebastian Greenwood. He was detained in Thailand in 2018 and extradited to the US. Meanwhile, Ignatova’s younger brother Konstantin Ignatov was arrested in March 2019 in Los Angeles. He pleaded guilty to fraud and money laundering charges. Mark Scott, a former corporate lawyer was convicted in 2019 for laundering $400milion for the group. But Ignatova’s remained elusive.However, a recent BBC investigation claims that that a top mafia figure in Bulgaria, a business associate who was kept her safe might have been responsible for her murder. His name is Hristoforos Nikos Amanatidis, better known as Taki , who has a El Chapo-like image in his native Bulgaria.Over the years, Taki has been accused of numerous crimes including armed robbery, drug smuggling, and murder, but was never prosecuted in Bulgaria.Former Bulgarian Deputy Minister Ivan Hristanov said in 2022: “Taki is the ghost. You'll never see him. You only hear about him. He's talking to you through other people. If you don't listen, you just disappear from earth. The only person who can protect her from all those investigations, including from foreign agencies - it was Taki.”Taki, it’s believed now lives in Dubai, where Ignatova has a luxury penthouse and where her bank accounts received millions from the OneCoin fraud. Sources claim the two were close and Taki was even the godfather to Ignatova’s daughter. Frank Schneider, a former adviser to Ruja Ignatova, claimed his old boss was working with “gangsters”.A few months after talking to BBC, Schneider also disappeared. Meanwhile, document found at the home of murdered Bulgarian officer by Bulgarian journalist Dimitar Stoyanov of BIRD, an investigative website stated that a police informant had overheard Taki’s brother-in-law say that Taki had murdered, dismembered and dumped Ignatov off a yacht in the Ionian sea.Kuro, another associate of Taki was found assassinated in his Cape Town home in May 2023.Stoyanov, who was forced to leave Bulgaria after getting death threats, says property records show that Ignatova’s properties are now used by Taki and his associates in Bulgaria. However, Taki has never been arrested over the claims, Ignatova’s body was never discovered, and investigators don’t believe there’s enough to prosecute him.Only time will tell if Ignatova was murdered, whether she disappeared or it might not, and we might never learn her fate. Just like we never found out about DB Cooper.","Ruja Ignatova made billions with a fraudulent crypto-currency before she suddenly vanished in 2017. A new BBC investigation tries to find out if she was murdered or just diseappeared. A top mafia figure in Bulgaria, a business associate who was kept her safe might have been responsible for her murder.","https://static.toiimg.com/thumb/msid-110673015,imgsize-41786,width-400,resizemode-4/110673015.jpg"
