Article Title,Article Link,Article Text,Article Summary,Article Image
Lahore court remands Imran Khan for 10 days police custody in May 9 riot cases,https://timesofindia.indiatimes.com/world/pakistan/lahore-court-remands-imran-khan-for-10-days-police-custody-in-may-9-riot-cases/articleshow/111771870.cms,"LAHORE: An anti-terrorism court in Lahore has granted police a 10-day physical remand of Pakistan Tehreek-e-Insaf ( PTI ) founder Imran Khan in connection with 12 cases stemming from the May 9 riots , Dawn reported.The unrest erupted nationwide last year after Imran Khan was detained by paramilitary rangers from the Islamabad high court during a corruption case proceeding.During the protests, widespread rioting and vandalism were reported across various locations, including the Lahore corps commander's residence and the general headquarters in Rawalpindi, as captured in social media footage.Lahore police's investigation wing, comprising a 13-member team, visited Adiala Jail on Saturday to question Imran Khan regarding the violence. However, the PTI leader declined to meet with the team, which sought to interrogate him on charges related to inciting public unrest against the state, as reported by Dawn.According to Lahore Investigation DIG Zeeshan Asghar, Imran Khan was arrested as the primary suspect in 12 cases registered at different police stations in Lahore. The charges against him range from provoking the public to attacks on government properties and military installations.Senior police officials specified that the focus of the investigation primarily centred on two cases: the assault on the Lahore corps commander's residence and the Askari Tower.The cases were filed at several police stations, including Sarwar Road, Gulberg, Race Course, Naseerabad, Shadman, and others in Lahore.In today's hearing at anti-terrorism Court-I before Judge Khalid Arshad , the police requested a 30-day physical remand for Imran Khan to facilitate further investigation into the 12 cases. Imran Khan appeared via video call from Adiala Jail, represented by his lawyers, Azhar Siddique and Usman Gul, who objected to the remote proceedings and insisted on his physical presence.After hearing arguments from both sides, Judge Khalid Arshad reserved his verdict briefly and later granted a 10-day physical remand for Imran Khan. This remand applies to cases registered at Sarwar Road, Gulberg, Race Course, Shadman, Model Town, and Mughalpura police stations, totaling five cases at Sarwar Road, three at Gulberg, and one each at the other mentioned stations, Dawn reported.",An anti-terrorism court in Lahore has granted police a 10-day physical remand of Pakistan Tehreek-e-Insaf ( PTI ) founder Imran Khan. The unrest erupted nationwide last year after Imran Khan was detained by paramilitary rangers from the Islamabad high court during a corruption case proceeding.,"https://static.toiimg.com/thumb/msid-111772203,imgsize-1111159,width-400,resizemode-4/111772203.jpg"
"Pakistan govt raises petrol by PKR 9.99, diesel by PKR 6.18 due to global market pressures",https://timesofindia.indiatimes.com/world/pakistan/pakistan-govt-raises-petrol-by-pkr-9-99-diesel-by-pkr-6-18-due-to-global-market-pressures/articleshow/111769476.cms,"ISLAMABAD: The Pakistan government has announced significant increases in petrol and high-speed diesel (HSD) prices, citing fluctuations in international markets as the reason behind the hikes, Dawn reported.According to a notification from the Finance Division, petrol prices surged by PKR 9.99 per litre, reaching PKR 275.6/ltr, while HSD saw a rise of PKR 6.18/ltr, settling at PKR 283.63/ltr for the upcoming fortnight.The adjustment, it clarified, was necessary due to recent price variations in global oil markets.Importantly, the government emphasised that there would be no changes to the current levels of applicable duties and taxes, maintaining them at their existing rates despite the price increases.Sources revealed that international market prices for petrol and HSD had climbed by approximately USD 4.4 and USD 2 per barrel, respectively, over the last two weeks, prompting the adjustments, as reported by Dawn.In anticipation of higher global oil prices, analysts had forecast increases exceeding PKR 7.60 and PKR 3.50 per litre for petrol and HSD, respectively. Import premiums during the period remained unchanged at USD 9.60 and USD 6.50 per barrel for petrol and HSD, respectively, while the Pakistani Rupee depreciated by about 17 paise against the dollar over the same fortnight.The government also disclosed its decision to raise the maximum limit of the petroleum development levy (PDL) to PKR 70 per litre through the Finance Bill. This move aims to bolster revenue collection, targeting PKR 1.28 trillion for the current fiscal year, up from PKR 960 billion in the previous year and surpassing the initial budget target by PKR 91 billion.Taxes on both petrol and HSD currently stand at approximately PKR 77 per litre, alongside a fixed PKR 60 per litre PDL, which notably impacts consumers. Additionally, a PKR 17 per litre customs duty is applied uniformly to both locally produced and imported petrol and HSD.The price hikes in petrol and diesel are expected to impact inflation, with petrol predominantly used in private transport, rickshaws, and two-wheelers, while diesel is crucial for heavy transport vehicles and contributes significantly to the cost of essential commodities such as vegetables, Dawn reported.","Petrol prices surged by PKR 9.99 per litre, reaching PKR 275.6/ltr, while HSD saw a rise of PKR 6.18/ ltr. The adjustment, it clarified, was necessary due to recent price variations in global oil markets. There would be no changes to the current levels of applicable duties and taxes.","https://static.toiimg.com/thumb/msid-111769476,imgsize-627908,width-400,resizemode-4/111769476.jpg"
"Shehbaz government moves to ban PTI, slap 'high treason' cases on Imran, Arif",https://timesofindia.indiatimes.com/world/pakistan/shehbaz-government-moves-to-ban-pti-slap-high-treason-cases-on-imran-arif/articleshow/111768596.cms,"ISLAMABAD: Pakistan's political cloak-and-dagger intensified Monday with the Shehbaz Sharif government moving to ban ex-PM Imran Khan 's Pakistan Tehreek-e-Insaf ( PTI ) and charge him and former President Dr Arif Alvi with high treason , days after the country's apex court declared the opposition party eligible for parliamentary seats reserved for women and non-Muslims.The governing coalition's step is seen as an attempt to block PTI from becoming the single largest party in the National Assembly, although it has yet to be determined what impact the proposed ban would have on last week's 8-5 majority court verdict on reserved seats.At a presser in Islamabad, information minister Atta Tarar claimed that if the country was to progress, this couldn't happen as long as PTI remained part of the democratic polity.""PTI and Pakistan cannot coexist,"" Tarar declared, reeling off a list of reasons to support the statement.""In view of the May 9 riots, when military installations and government assets were stormed by PTI supporters after Imran Khan's brief arrest, the foreign funding case, the cipher episode (alleged leak of state secrets), attempts by PTI leaders to sabotage Pakistan's deal with the IMF as well as the resolution passed in the US on the national polls, there is very credible evidence to have PTI banned.""The minister said the govt had covered its legal bases in deciding to clamp a ban on Imran's party. ""We believe Article 17 of the Constitution gives the govt the right to ban political parties.""Tarar said that besides Imran and Alvi, the govt had decided to slap a treason case on ex-deputy speaker Qasim Suri under Article 6 for dissolving the assemblies in April 2022 despite a no-confidence motion moved against the then government in parliament.“The reference, under Article 6, will be sent to the apex court after being approved by the cabinet,"" he said.Article 6 states, ""Any person who abrogates or subverts or suspends, or holds in abeyance or attempts or conspires to abrogate or subvert or suspend the Constitution by use of force, or show force or by any other unconstitutional means shall be guilty of high treason.""The minister said the Sharif govt would also submit a review petition in the apex court, challenging its verdict on reserved seats.Lawyer-politician Moiz Jaferii said a political party couldn't be banned other than through a reference to the apex court. He termed the govt's move ""ridiculous and desperate posturing by a regime exposed day by day for its lack of legitimacy and popular appeal"".Activist and lawyer Jibran Nasir said the coalition govt's pursuit of a ban on PTI ""not only shows how weak PML-N is but also how desperate and frustrated the establishment has become"".Last week, the govt authorised Pakistan's ISI to intercept phone calls and messages ""in the interest of national security"" amid nationwide outrage over the allegedly unbridled powers the spy agency already enjoys.","The governing coalition's step is seen as an attempt to block PTI from becoming the single largest party in the National Assembly. Information minister Atta Tarar claimed that if the country was to progress, this couldn't happen as long as PTI remained part of the democratic polity.","https://static.toiimg.com/thumb/msid-111768590,imgsize-1118078,width-400,resizemode-4/111768590.jpg"
'Attempt to sabotage IMF deal': Pakistan government to ban Imran Khan's Pakistan Tehreek-e-Insaf,https://timesofindia.indiatimes.com/world/pakistan/pakistan-government-bans-imran-khans-pakistan-tehreek-e-insaf/articleshow/111751354.cms,"NEW DELHI: Pakistan government has decided to ban the Pakistan Tehreek-e-Insaf ( PTI ), alleging that the former ruling party was involved in number of anti-state activities.""The decisions were taken in light of the former ruling party's involvement in the May 9 events and the PTI's former or current leaders' attempts to sabotage Pakistan's deal with the International Monetary Fund (IMF),"" Pakistan's information minister Attaullah Tarar said.""We believe that there is credible evidence that PTI should be banned,"" he added, citing allegations against former PM Imran Khan including leaking state secrets and inciting riots.According to the information minister, the matter of ban on Pakistan's biggest opposition party will be brought to cabinet and possibly to Supreme Court if needed.Tarar also said that the Pakistan Muslim League-Nawaz (PML-N) led government and its allies have decided to file a review appeal against the decision of the Supreme Court granting reserved seats to the PTI in the National Assembly. ""The apex court gave relief to the PTI which had not even asked for it,"" the minister said.Referring to the time when the then-government decided to dissolve the assemblies during the no-confidence motion against Khan in 2022, the minister said the ruling alliance has also decided to move a case against the then-prime minister, then-president Alvi and then National Assembly deputy speaker Qasim Suri.""Whether it was the foreign funding case, the riots of May 9, or the manipulation of the cipher saga, in which the former Pakistani ambassador to the US, Asad Majeed - who authored the cipher - clarified that there was ""no threat"", the PTI continued decrying that the country was in danger.Meanwhile, Khan has been jailed for nearly a year in a series of cases which he claimed were orchestrated to prevent his return to power in February elections.The Supreme Court, however, granted the PTI more seats in parliament in a landmark ruling last week, while Khan's illegal marriage conviction was overturned on Saturday.","Pakistan government has decided to ban the Pakistan Tehreek-e-Insaf ( PTI ), alleging that the former ruling party was involved in number of anti-state activities. The matter of ban on Pakistan's biggest opposition party will be brought to cabinet and possibly to Supreme Court if needed.","https://static.toiimg.com/thumb/msid-111751412,imgsize-1214121,width-400,resizemode-4/111751412.jpg"
"Jailed former PM Imran Khan, wife handed over to anti-graft body on remand in fresh corruption case",https://timesofindia.indiatimes.com/world/pakistan/jailed-former-pm-imran-khan-wife-handed-over-to-anti-graft-body-on-remand-in-fresh-corruption-case/articleshow/111735541.cms,"ISLAMABAD: A court in Pakistan on Sunday handed over jailed former prime minister Imran Khan and his wife Bushra Bibi to the country's anti-corruption officials on an eight-day remand for probe in a fresh case of alleged corruption. The former first couple was arrested by the National Accountability Bureau (NAB) soon after a district and sessions court on Saturday quashed their conviction in their un-Islamic marriage case.The court's short order also stated to release Khan and Bibi immediately unless they were wanted in other cases.The NAB, which filed a new Toshakhana case against the couple, on Sunday presented them before Judge Muhammad Ali Warraich of the accountability court.The judge conducted the hearing inside the Adiala Jail due to security reasons.NAB Deputy Director Mohsin Haroon, who led the team to arrest them, requested their physical remand and the court, after hearing the lawyers, agreed to grant an eight-day remand.The court then ordered to present the two on July 22.The remand period can be extended to a maximum of 40 days at the request of NAB if it is needed to probe the suspects.Khan, objecting to the absence of media, said at the beginning of the hearing: ""If the media is not allowed, I will walk out of the court.""The court subsequently ordered media representatives to be brought inside the jail, and the hearing commenced once they arrived.Khan, 71, then addressed the judge directly, asserting that his wife had no involvement in the Toshakhana case, The Express Tribune reported.""I have read the Quran four times in jail, and it places a great responsibility on judges,"" he stated. ""Bushra Bibi is only imprisoned to cause me distress.""Bibi, 49, was also re-arrested on Saturday in the new NAB reference as she was to be released from Rawalpindi's Adiala Jail.He accused higher authorities of targeting his wife due to his decisions and said: ""My wife is being targeted by the King because I removed him from the ISI position, and my wife did not support him.""He referred to the army chief Gen. Asim Munir without naming him.""Jail me, but leave my wife alone. Judge, you are answerable to Allah, not the ISI. Judge Bashir said a decision was made at gunpoint,"" Khan pleaded.""A former prime minister being told in the middle of the night that he has to appear for a brand new case in the morning,"" he remarked wryly.He harshly criticised the accountability watchdog and alleged that it was operating like robots, doing whatever they are paid to do.He added, ""In the previous case, the jewellery set, which was valued at Rs 18 million, was claimed to be worth Rs 3.25 billion.""""I am only speaking about my wife. Re-arresting her [Bushra Bibi] was a grave mistake,"" the cricketer-turned-politician said.The new Toshakhana case is based on the accusation that the couple during Khan's government purchased gifts from the state depository in violation of rules.This is the third Toshakhana case and Khan's sentence in the two previous Toshakhana cases had been suspended by the Islamabad High Court.Last week, the Supreme Court in a key judgment declared that Khan's Pakistan Tehreek-e-Insaf (PTI) party was eligible for the seats reserved for women and minorities in the National Assembly and four provincial assemblies.The PTI will become the largest party in the National Assembly with 109 seats after the Supreme Court ruling.Two successive victories for Khan were being interpreted as some change of heart on the part of the powerful establishment towards the PTI and its founder, but the subsequent developments belie any such possibility.Khan faces a slew of cases launched against him since his ouster from power in April 2022 after he fell out with the establishment which was believed to be instrumental in bringing him to power.",Imran Khan and his wife Bushra Bibi handed over to anti-corruption officials. They are on an eight-day remand for probe in a fresh case of alleged corruption. NAB filed a new Toshakhana case against the couple on Sunday.,"https://static.toiimg.com/thumb/msid-111735538,imgsize-1214423,width-400,resizemode-4/111735538.jpg"
Tough road ahead for Imran Khan despite back-to-back judicial relief,https://timesofindia.indiatimes.com/world/pakistan/tough-road-ahead-for-imran-khan-despite-back-to-back-judicial-relief/articleshow/111729030.cms,"ISLAMABAD: Despite back-to-back judicial relief to beleaguered Imran Khan , his woes are far from over and Pakistan 's former prime minister remains in jail with his wife Bushra Bibi. A district and session court on Saturday overturned the conviction of 71-year-old Khan and his wife Bushra, 49, in the un-Islamic marriage case related to the violation of the mandatory waiting period for a Muslim woman between two marriages.The relief came a day after the Supreme Court in a key judgment declared that his Pakistan Tehreek-e-Insaf ( PTI ) party was eligible for the seats reserved for women and minorities in the national and four provincial assemblies.The PTI will become the largest party in the National Assembly with 109 seats after the Supreme Court ruling.Two successive victories for Khan were being interpreted as some kind of change of heart on the part of the powerful establishment towards the PTI and its founder, but the subsequent developments belie any such possibility.The court in the Iddat case verdict stated that Khan and his wife should be released ""if not required to be detained in any other case"" and anticipating his release a large number of PTI supporters accompanied by key leaders reached the Adiala Jail Rawalpindi, where they have been kept, to welcome them.But the PTI feared counter-measures by the government and announced that Khan would be arrested in three cases related to May 9 violence. However, it emerged that he and his wife were taken into custody by the National Accountability Bureau (NAB ) in a fresh Toshakhana corruption case .Khan and his wife during his government allegedly obtained gifts from the gift repository at low prices and sold them at higher rates.It is the third Toshakhana case and Khan's sentence in the two previous Toshakhana cases had been suspended by the Islamabad High Court.The new case alleged that the couple got some precious watches and other gifts from the state depository by violating rules.Khan faces a slew of cases launched against him since his ouster from power in April 2022 after he fell out with the establishment which was believed to be instrumental in bringing him to power.Despite dozens of cases against him and several party leaders, he has kept up his rhetoric by attacking the senior Army leadership , and his supporters churning out half-baked stories against the establishment on social media.The Army this month after a key meeting termed the attack on social media as ""digital terrorism"", calling it ""unwarranted criticism by some quarters"".Army commanders stated that the onslaught of politically motivated digital terrorism, unleashed by conspirators, duly abetted by their foreign cohorts against state institutions is meant to induce despondency in the nation and sow discord through the peddling of blatant lies, fake news and propaganda.The forum affirmed that military leadership is cognizant of the full spectrum of the challenges and resolved to shoulder its constitutionally mandated responsibilities with the support of the resilient people of Pakistan.Khan on his side uses the presence of media on the occasion of hearing cases against him in the Adiala Jail to fire salvos at rivals, showing unflinching resolve to fight. He also reiterates not to spare his tormentors.His own X handle is active, apparently operated by someone on his behalf, charging his opponents from the Army and civilians with an unwavering commitment. The same attitude has been displayed by his party leaders who often compete with each other to breathe more fire than others.All this had added to his hardships despite getting relief from the courts regularly.In the latest arrest, the National Accountability Bureau (NAB) is expected to produce Khan and his wife before an accountability judge to seek their physical remand. Under the law, NAB can detain a person for 40 days on remand for investigation.As courts operate within rules, it is not easy for his legal team to secure his release.The circuitous legal battle is getting more entangled due to the official opposition to his release from jail.Recently, political advisor to Prime Minister, Rana Sanaullah, reportedly stated that new cases would be lodged against Khan in the coming days. Talking to the reporters in Lahore on June 15, Planning Minister Ahsan Iqbal stated that Khan's detention for the next five years was necessary to bring economic stability.""People come to us and tell us if Pakistan has to progress then Imran Khan will have to be kept in jail for five years,"" he said.","A district and session court overturned the conviction of 71-year-old Khan and his wife Bushra, 49, in the un-Islamic marriage case. The relief came a day after the Supreme Court in a key judgment declared that his Pakistan Tehreek-e- Insaf ( PTI ) party was eligible for the seats reserved for women and minorities.","https://static.toiimg.com/thumb/msid-111729057,imgsize-543501,width-400,resizemode-4/111729057.jpg"
"Despite acquittal in fake marriage case, Imran to remain in jail",https://timesofindia.indiatimes.com/world/pakistan/despite-acquittal-in-fake-marriage-case-imran-to-remain-in-jail/articleshow/111719348.cms,"ISLAMABAD: A Pakistan district and sessions court acquitted former prime minister Imran Khan and his wife, Bushra Bibi, on Saturday in a case of unlawful marriage . This was the last case keeping Khan in prison but he will not walk free as the authorities immediately issued fresh orders for his arrest in three other cases.In a short order, additional sessions judge Afzal Majoka directed authorities to immediately release Khan and his wife if they are not wanted in any other case.After the decision Khan’s party, Pakistan Tehreek-i-Insaf (PTI), said, “Mr Khan has been arrested in three more cases.” The three cases are linked to violence against the military and other state installations after his brief arrest in May 2023.“An anti-terrorism court in Lahore approved the request to arrest Imran Khan in the May 9 case,” the PTI statement read. The party warned that keeping Khan, 71, in jail after Saturday’s decision would lead to another political crisis.Just days before national polls on Feb 8 the couple were sentenced to seven years in jail in the “iddat” case after the court found them guilty of breaking Islamic law by failing to observe the required interval between Bibi’s divorce from her previous husband and her marriage to Khan. The verdict had coincided with his convictions and sentences in the Toshakhana (state treasure store) and cipher cases. His sentences in two alleged graft cases, however, were suspended, while his sentence in the cipher case, linked to leaking of state secrets, was overturned. Various courts have also freed him in several other cases linked to the events of May 9, 2023 when his first arrest had caused riots across the country, following which the state launched a crackdown against him and his party.Ahead of Khan’s acquittal in a fake marriage case , a pair of applications was filed by Khawar Fareed Maneka, Bushra’s previous husband. One application asked the court to carry out a medical checkup of his ex-wife to ascertain her menstrual cycle while the other called on religious scholars for consultation on further deliberation on the duration of “iddat”.Before ordering Khan and his wife’s release, judge Majoka dismissed both applications. “Both petitions seeking the formation of a medical board and consultations with religious scholars are hereby rejected,” the verdict stated.Khan has been behind bars since August 2023. He blames powerful military generals for his ouster from power in April 2022.","Imran Khan and his wife, Bushra Bibi, acquitted in a case of unlawful marriage. This was the last case keeping Khan in prison but he will not walk free as the authorities immediately issued fresh orders for his arrest in three other cases. Khan has been behind bars since August 2023.","https://static.toiimg.com/thumb/msid-111719330,imgsize-685557,width-400,resizemode-4/111719330.jpg"
