Article Title,Article Link,Article Text,Article Summary,Article Image
'Financial guru forecasts massive stock market correction in US',https://timesofindia.indiatimes.com/world/us/financial-guru-forecasts-massive-stock-market-correction-in-us/articleshow/109919441.cms,"NEW DELHI: Grant Cardone , a seasoned private equity fund manager, has issued a stark warning about an imminent stock market crash that could see values halve, potentially wiping out the retirement and savings of millions of Americans. The Dow Jones' recent gains notwithstanding, Cardone highlighted the alarming trend in the S&P's yield curve, which has been inverted for over 500 days—a historical precursor to significant market downturns including those in 1929, 1974, and 2009.In a recent statement on the social media platform X, Cardone outlined the dire consequences of such a crash, compounded by current inflation rates, which could effectively amplify total losses to feel more like 75%.""WARNING: Stock Market is due for 50 percent correction taking S&P below 2674,"" he cautioned, emphasizing the risk to retirement accounts heavily invested in the stock market at these levels, a Daily Mail report said.Cardone, who has advised companies such as Google and Morgan Stanley, drew parallels between the current market indicators and those that preceded major financial crises in the past. He explained that following the historical crashes, the market declines erased significant value from Americans' 401Ks, affecting their long-term savings and financial security.The financial expert also criticized the Federal Reserve's recent rate hikes, arguing that they have stifled the housing market rather than controlling inflation as intended. ""Fed Chairman Jerome Powell has not controlled inflation. He has failed miserably,"" Cardone said. He suggests that reducing interest rates might rejuvenate the housing market, encouraging more sales and potentially lowering house prices.To safeguard against potential financial turmoil, Cardone recommends transitioning retirement funds from stock market-dependent 401ks to real assets that generate consistent cash flow, such as property investments. He believes this strategy could provide retirees with a more stable and reliable income source.This warning comes as Manhattan sees a drop in rents for the first time since the pandemic, signaling potential shifts in the real estate market that could offer investment opportunities amid economic uncertainties.","Grant Cardone, a seasoned private equity fund manager, has issued a stark warning about an imminent stock market crash that could see values halve. Cardone highlighted the alarming trend in the S&P's yield curve, which has been inverted for over 500 days. He drew parallels between the current market indicators and those that preceded major financial crises in the past.","https://static.toiimg.com/thumb/msid-109919306,imgsize-744589,width-400,resizemode-4/109919306.jpg"
"Pro-Palestinian protesters clash with police, vandalize NYC monuments during Met gala",https://timesofindia.indiatimes.com/world/us/pro-palestinian-protesters-clash-with-police-vandalize-nyc-monuments-during-met-gala/articleshow/109919238.cms,"NEW DELHI: On Monday, over 1,000 protesters advocating for Palestinian rights clashed with police and vandalized public monuments while attempting to reach the Metropolitan Museum of Art in New York City, where the Met Gala was being held. The event coincided with a globally observed ""Day of Rage"" organized by the activist group Within Our Lifetime.As per a New York Post report, the demonstrators, blocked by police from nearing the Met, redirected their protest to Central Park where they defaced the One Hundred Seventh Infantry Memorial.The base of this World War I memorial was spray-painted with the word ""Gaza"" in large black letters. Protesters also burned an American flag at the site and placed stickers and Palestinian flags on the statues, with messages that read “Stop the Genocide. End the apartheid. Free Palestine.”As the night unfolded, another monument in Central Park, the Gen William Tecumseh Sherman statue, was similarly vandalized. ""Free Gaza"" was written in red letters on the statue's base, and a Palestinian flag was affixed to the front.Earlier in the evening, police had arrested about two dozen protesters on Madison Ave and East 83rd Street as they marched from Hunter College toward the Met. Despite the large police presence, the crowd managed to block traffic along Fifth Avenue until being stopped near the East 79th Street Transverse in Central Park. They chanted, “Disclose, divest, we will not stop, we will not rest,” while displaying Palestinian flags and wearing keffiyehs.Confusion ensued as protesters, initially rerouted into Central Park by police, found themselves at a standstill without clear directions on how to proceed. After some time, they exited the park and attempted to approach the Met once more but were halted by a police blockade.In a separate but related event, nearly 1,000 pro-Israel demonstrators gathered at Riverside Park in support of Jewish students facing antisemitism at universities like Columbia University. The rally was held on Yom HaShoah, the day of Holocaust remembrance, emphasizing the need to combat antisemitism and remember past atrocities.Gilad Erdan, the Israeli ambassador to the UN, spoke at the rally, comparing the anti-Israel protests to actions of ""modern-day Nazis"" and criticized what he described as a selective outrage that overlooks other global injustices. Erdan emphasized the urgency of action against antisemitism, especially in academic environments.The day's events highlighted ongoing tensions and divisions regarding the Israeli-Palestinian conflict, manifesting both locally and internationally.","On Monday, over 1,000 protesters advocating for Palestinian rights clashed with police and vandalized public monuments while attempting to reach the Metropolitan Museum of Art in New York City. The event coincided with a globally observed ""Day of Rage"" organized by the activist group Within Our Lifetime.","https://static.toiimg.com/thumb/msid-109919274,imgsize-1340680,width-400,resizemode-4/109919274.jpg"
"Suicide attack that killed 5 Chinese nationals was planned in Afghanistan, says Pakistan",https://timesofindia.indiatimes.com/world/pakistan/suicide-attack-that-killed-5-chinese-nationals-was-planned-in-afghanistan-says-pakistan/articleshow/109917498.cms,"(With inputs from agencies)

NEW DELHI: Pakistan on Tuesday said the attack on a Chinese engineers' convoy in Khyber Pakhtunkhwa in March, which killed five Chinese nationals, was planned in Afghanistan .""The March suicide bombing connects to Afghanistan. The planning of this terror act was done in Afghanistan. Terrorists and their facilitators were also being controlled from Afghanistan and the suicide bomber was also an Afghan [national],"" said Inter-Services Public Relations (ISPR) Director General (DG) Maj-Gen Ahmed.Over the past few months, Pakistan has repeatedly criticised the Taliban regime in Kabul for helping terrorists carry out attacks targeting security personnel, and Chinese nationals working on projects linked to Beijing's crucial Belt and Road Initiative.Speaking at a press conference, military spokesperson Ahmed Sharif strongly condemned the acts of terrorism and assured that necessary actions were being taken to bring the facilitators to justice.Despite Pakistan's efforts for peace in the region and hosting Afghan refugees, TTP terrorists continue to launch attacks from Afghan soil, he said.The DG added that Pakistan had presented concrete evidence to the Afghan interim government, but no positive progress has been made.""There is concrete evidence that TTP terrorists are still using Afghan soil to launch attacks in Pakistan ... In this regard, we have registered 12 protests and the army chief has taken a clear stance that Pakistan has its reservations on hideouts of banned outfits in Afghanistan,"" said Sharif.The DG ISPR emphasized that Pakistan will take all measures to eradicate terror networks and protect its citizens.""Pakistan will leave no stone unturned to eradicate terror networks and provide protection to its citizens at all costs ... the purpose of the armed forces is to establish peace in the country ... to ensure this, we will go to every extent to suppress the terrorists and their patrons and enablers,"" said Sharif.Pakistan recently carried out counter-attacks in Afghanistan's border areas, targeting terrorist safe havens.The DG ISPR mentioned that in 2024, security forces have conducted 13,135 operations against terrorists and their facilitators, resulting in the elimination of 249 terrorists and the arrest of 396 others.Pakistani forces are carrying out more than 100 operations daily against terrorism.","Pakistan says attack on Chinese engineers' convoy in Khyber Pakhtunkhwa in March was planned in Afghanistan. Pakistan has repeatedly criticised the Taliban regime in Kabul for helping terrorists carry out attacks. Pakistan recently carried out counter-attacks in Afghanistan's border areas, targeting terrorist safe havens.","https://static.toiimg.com/thumb/msid-109918562,imgsize-1968512,width-400,resizemode-4/109918562.jpg"
Pakistan SC suspends Peshawar HC order denying reserved seats to Imran-backed party,https://timesofindia.indiatimes.com/world/pakistan/pakistan-sc-suspends-peshawar-hc-order-denying-reserved-seats-to-imran-backed-party/articleshow/109898987.cms,"ISLAMABAD: Pakistan’s Supreme Court suspended on Monday a high court verdict that a political party aligned with candidates backed by incarcerated former prime minister Imran Khan was not eligible for reserved seats for women and minorities in the national and provincial legislatures.Since the Khan-led Pakistan Tehreek-e-Insaf (PTI) was barred by the top court from contesting the Feb 8 elections under its traditional electoral symbol of a cricket bat on technical grounds, the party had subsequently struck an alliance with another party, Sunni Ittehad Council (SIC), in an attempt to secure reserved seats in parliament.Under Pakistan’s election rules, political parties are allotted reserved seats — (there are 60 for women and 10 for minorities in the National Assembly) — in proportion to the number of parliamentary seats they win in the election. This completes the NA’s total strength of 336 seats.In March, the Election Commission of Pakistan (ECP) had ruled that SIC was not eligible for reserved seats and decided to distribute the seats among other parliamentary parties, with the ruling Pakistan Muslim League-Nawaz (PML-N) and the Pakistan Peoples Party (PPP) becoming major beneficiaries. The verdict was rejected by PTI as unconstitutional and the alliance had filed a plea against the electoral watchdog’s decision in the Peshawar HC, but it rejected the appeal.In response, SIC moved the Supreme Court last month urging it to allot the party the reserved seats in the national and provincial assemblies and set aside the Peshawar HC ruling.Accepting SIC’s appeal for a hearing, the apex court clarified that the Peshawar HC order upholding ECP’s decision was suspended to the extent of the remaining reserved seats distributed among other parties.After losing the extra reserved seats, PM Shehbaz Sharif’s coalition government had lost its two-thirds majority in the National Assembly.","Pakistan’s Supreme Court suspended on Monday a high court verdict that a political party was not eligible for reserved seats for women and minorities. Pakistan Tehreek-e-Insaf was barred by the top court from contesting the Feb 8 elections under its traditional electoral symbol of a cricket bat. The party subsequently struck an alliance with another party, Sunni Ittehad Council (SIC), in an attempt to secure reserved seats.","https://static.toiimg.com/thumb/msid-109898982,imgsize-1367700,width-400,resizemode-4/109898982.jpg"
Pakistan farmers announce nationwide protests from May 10 amid wheat crisis,https://timesofindia.indiatimes.com/world/pakistan/pakistan-farmers-announce-nationwide-protests-from-may-10-amid-wheat-crisis/articleshow/109889292.cms,"ISLAMABAD: The Kissan Ittehad Pakistan announced that thousands of farmers would participate in nationwide protests against the ongoing wheat crisis starting from May 10, reported Daily Pakistan.The protest will commence from Multan, the Kissan Ittehad Pakistan stated.The plunging wheat rates in the market, far below the support price of Rs 3,900 per 40 Kg, have stirred discontent, with blame directed towards the decision to import wheat despite a ""bumper crop"" locally.Last month, farmers resorted to protests in Lahore and several other cities, which prompted the government to initiate a crackdown against the demonstrations, reported Daily Pakistan.However, Prime Minister Shehbaz Sharif 's administration seems hesitant to thoroughly investigate the wheat import and take action against those responsible.A cabinet committee has been established to investigate why the previous caretaker government, led by then-PM Anwar-ul-Haq Kakar, imported wheat despite sufficient domestic supply.Meanwhile, Kissan Ittehad Pakistan reiterated its determination and announced the relaunch of nationwide protests against the crisis.The president of the alliance, Khalid Khokhar, said, ""I have reached out to numerous farmers' groups, and we have collectively decided to protest--not for ourselves but to salvage the nation.""While addressing a press conference, Khokhar blamed the caretaker government for causing a loss of over Rs 400 billion to the national treasury by importing USD 1 billion worth of wheat amid a foreign exchange shortage, Daily Pakistan reported.Khokhar further detailed the dire situation of farmers and highlighted the immense losses incurred due to the wheat import and the subsequent repercussions on other agricultural sectors.He criticised the lack of government regulation, particularly regarding urea prices, leading to significant financial burdens on farmers.The Kissan Ittehad Pakistan vowed to lead nationwide protests against the government's wheat policy, commencing from Multan on May 10, with thousands of farmers expected to participate alongside their families and livestock, Daily Pakistan reported.He further emphasised the critical role of agriculture, stressing the need for relief measures to support farmers who are the backbone of the nation's economy.","The Kissan Ittehad Pakistan announced that thousands of farmers would participate in nationwide protests against the ongoing wheat crisis starting from May 10. The plunging wheat rates in the market, far below the support price of Rs 3,900 per 40 Kg, have stirred discontent, with blame directed towards the decision to import wheat.","https://static.toiimg.com/thumb/msid-109889374,imgsize-2039071,width-400,resizemode-4/109889374.jpg"
'Bilawal Bhutto-Zardari likely to be back as Pakistan 's foreign minister',https://timesofindia.indiatimes.com/world/pakistan/bilawal-bhutto-zardari-likely-to-be-back-as-pakistan-s-foreign-minister/articleshow/109866243.cms,"Pakistan 's former foreign minister Bilawal Bhutto-Zardari is likely to make a comeback for another stint as his PPP and PML-N were close to finalising a power- sharing deal. If the insiders are to be believed, Bilawal would join the cabinet of PM Shehbaz Sharif as foreign minister, the Express Tribune newspaper reported on Sunday. Citing sources, it said that PM Shehbaz Sharif wants PPP to join the cabinet before the next budget to be presented in the first week of June.","Bilawal Bhutto-Zardari is likely to make a comeback for another stint as his PPP and PML-N were close to finalising a power- sharing deal. If the insiders are to be believed, Bilawal would join the cabinet of PM Shehbaz Sharif as foreign minister.","https://static.toiimg.com/thumb/msid-109866274,imgsize-1146761,width-400,resizemode-4/109866274.jpg"
"Pakistan: Rallies held against enforced disappearances in Balochistan, protesters demand safe return",https://timesofindia.indiatimes.com/world/pakistan/pakistan-rallies-held-against-enforced-disappearances-in-balochistan-protesters-demand-safe-return/articleshow/109857963.cms,"NEW DELHI: Rally against enforced disappearances of people including Hafiz Tayyab took place in Balochistan's Khuzdar district with protesters demanding action and the safe recovery of missing persons from the region, The Balochistan Post reported.The Baloch Yakjehti Committee (BYC) and relatives of others missing joined the protest initiated by Hafiz Tayyab's family.Participants marched through the city's streets opposing enforced disappearances and demanding the safe return of their loved ones.Hafiz Tayyab was allegedly taken by Pakistani security forces from Jhalawan hospital Khuzdar on May 4, 2013, according to The Balochistan Post. His family emphasized adherence to due process and urged presenting him before the court if credible evidence exists against him.Protesters highlighted the plight of many others in Khuzdar during the rally, with relatives sharing grievances about their disappeared family members. BYC leaders expressed disappointment that their previous calls for the safe return of missing people remained unheard. The protesters urged national and international human rights organizations to intervene and hold the state accountable for protecting its citizens.In South Korea's Busan, the South Korean chapter of the Baloch National Movement (BNM) staged a protest at Biff Square condemning what they term ""state-sponsored"" oppression against the Baloch people. To raise awareness, protesters distributed pamphlets and denounced the Pakistani state for widespread enforced disappearances and unresolved cases of missing people.","Hafiz Tayyab was allegedly taken by Pakistani security forces from Jhalawan hospital Khuzdar on May 4, 2013. His family emphasized adherence to due process and urged presenting him before the court if credible evidence exists against him. The Baloch Yakjehti Committee (BYC) and relatives of others missing joined the protest.","https://static.toiimg.com/thumb/msid-109858068,imgsize-797724,width-400,resizemode-4/109858068.jpg"
"Pakistan wheat scam probe: Evasive response of govt raises concerns, says report",https://timesofindia.indiatimes.com/world/pakistan/pakistan-wheat-scam-probe-evasive-response-of-govt-raises-concerns-says-report/articleshow/109853452.cms,"LAHORE: The Pakistan government's response to the wheat scam investigation appears to be evasive, despite Prime Minister Shehbaz Sharif 's assurance to safeguard farmers ' interests, Dawn reported.While he has pledged unwavering support for farmers, the federal government's reluctance to thoroughly probe the alleged scam and hold accountable those responsible is palpable.Heading the fact-finding committee tasked with unravelling irregularities in the wheat import is Cabinet Secretary Kamran Ali Afzal. However, there seems to be an element of hesitancy within the government to engage fully in the investigation, the report noted.A source within the PML-N revealed Nawaz Sharif 's insistence on robust action against the perpetrators, regardless of their political influence. However, there's a noticeable lack of enthusiasm from the current government to involve bodies such as the NAB or FIA in the investigation, despite suggestions, according to Dawn.Information Minister Attaullah Tarar's dismissal of engaging the NAB or FIA raises eyebrows, especially given the magnitude of the alleged scam, which surpasses PKR 500 million, warranting their involvement according to new laws. The government's cautious approach, attributed to the involvement of the former caretaker government, reflects a reluctance to tread on contentious ground.Reports suggesting substantial wheat imports under Shehbaz Sharif's administration post-elections have added another layer to the controversy, the report noted. Denials from government officials contradict the allegations, further complicating the situation. Blame for the wheat crisis is shifted to the caretaker government, distancing the current administration from any culpability.Adding to the confusion are reports of the summoning of former caretaker officials by the fact-finding committee, which were swiftly denied by its head, Kamran Ali Afzal.Tensions continue to escalate within the PML-N, with Hanif Abbasi confronting former caretaker premier Anwaarul Haq Kakar over the wheat scandal. Kakar's veiled threats hint at underlying political manoeuvring, adding intrigue to the unfolding drama. The PTI seized the opportunity to push for a judicial commission, capitalising on the discord within the opposition camp.Amidst the chaos, Prime Minister Shehbaz Sharif strived to reassure farmers of his unwavering support.His formation of a committee to address farmers' grievances demonstrates a proactive stance, aiming to alleviate concerns regarding wheat procurement, Dawn reported.","The Pakistan government's response to the wheat scam investigation appears to be evasive. Prime Minister Shehbaz Sharif has pledged unwavering support for farmers. However, there's a noticeable lack of enthusiasm from the current government to involve bodies such as NAB or FIA in the investigation.","https://static.toiimg.com/thumb/msid-109853474,imgsize-967212,width-400,resizemode-4/109853474.jpg"
Pakistan: Milk price soars to PKR 210 per litre in Karachi,https://timesofindia.indiatimes.com/world/pakistan/pakistan-milk-price-soars-to-pkr-210-per-litre-in-karachi/articleshow/109851453.cms,"KARACHI: The price of milk at Karachi in fiscally-stressed Pakistan shot up to 10 per litre after the city's commissioner approved a hike, acceding to the demands of the Dairy Farmers Association , ARY News reported.As per the commissioner's directives, the price of milk has surged by PKR 10 per litre, with shops in Karachi now selling milk at PKR 210 per litre.Earlier speculations of a potential PKR 50 per litre increase in milk prices have loomed over the inflation-burdened citizens of Karachi, ARY News reported.Mubasher Qadeer Abbasi , the president of Dairy Farmers Karachi, has indicated that an increase of PKR 50 per litre of milk is expected soon for the people of Karachi. Abbasi cited the high cost of milk production, soaring cattle prices, and government negligence as factors contributing to this imminent rise.Abbasi stressed the urgency for the Karachi Commissioner to promptly issue a notification regarding the new prices aligned with the milk production costs.He further emphasised that if the authorities do not announce the increase in milk prices by May 10, stakeholders will take matters into their own hands and raise prices after consensus.Recently, the Sensitive Price Indicator (SPI) assessed the weekly inflation in Pakistan, revealing a one per cent decrease across combined consumption groups for the week ending May 2.The SPI for this week within these groups is at 316.95 points, a drop from the previous week's 320.14 points, according to ARY News.Compared to the same week last year, there's been a 24.37 per cent increase in the SPI for the combined consumption group this week. The weekly SPI, calculated with the base year 2015-16 = 100, covers 17 urban centres and 51 essential items across all expenditure groups.For the lowest consumption group, up to PKR 17,732, there was a decrease of 1.09 per cent, with the SPI dropping to 306.26 points from last week's 309.64 points, ARY News reported.","The price of milk at Karachi in fiscally-stressed Pakistan shot up to 10 per litre. The city's commissioner approved a hike, acceding to the demands of the Dairy Farmers Association. Dairy Farmers Karachi president indicated that an increase of PKR 50 perlitre of milk is expected soon for the people of Karachi.","https://static.toiimg.com/thumb/msid-109851567,imgsize-622732,width-400,resizemode-4/109851567.jpg"
