Article Title,Article Link,Article Text,Article Summary,Article Image
‘I love Joe Biden. But we need a new nominee’: George Clooney,https://timesofindia.indiatimes.com/world/us/i-love-joe-biden-but-we-need-a-new-nominee-george-clooney/articleshow/111703296.cms,"I’m a lifelong Democrat; I make no apologies for that. I’m proud of what my party represents and what it stands for. As part of my participation in the democratic process and in support of my chosen candidate, I have led some of the biggest fund-raisers in my party’s history. Barack Obama in 2012. Hillary Clinton in 2016.Joe Biden in 2020. Last month I co-hosted the single largest fund-raiser supporting any Democratic candidate ever, for President Biden’s re-election.I say all of this only to express how much I believe in this process and how profound I think this moment is.I love Joe Biden. As a senator. As a vice president and as president. I consider him a friend, and I believe in him. Believe in his character. Believe in his morals. In the last four years, he’s won many of the battles he’s faced. But the one battle he cannot win is the fight against time. None of us can. It’s devastating to say it, but the Joe Biden I was with three weeks ago at the fund-raiser was not the Joe “big F-ing deal” Biden of 2010. He wasn’t even the Joe Biden of 2020. He was the same man we all witnessed at the debate.Was he tired? Yes. A cold? Maybe. But our party leaders need to stop telling us that 51 million people didn’t see what we just saw. We’re all so terrified by the prospect of a second Trump term that we’ve opted to ignore every warning sign. The George Stephanopoulos interview only reinforced what we saw the week before. As Democrats, we collectively hold our breath or turn down the volume whenever we see the president, whom we respect, walk off Air Force One or walk back to a mic to answer an unscripted question.Is it fair to point these things out? It has to be. This is about age. Nothing more. But also nothing that can be reversed. We are not going to win in November with this president. On top of that, we won’t win the House, and we’re going to lose the Senate. This isn’t only my opinion; this is the opinion of every senator and Congress member and governor who I’ve spoken with in private. Every single one, irrespective of what he or she is saying publicly.We love to talk about how the Republican Party has ceded all power, and all of the traits that made it so formidable with Ronald Reagan and George H.W. Bush, to a single person who seeks to hold on to the presidency, and yet most of our members of Congress are opting to wait and see if the dam breaks. But the dam has broken. We can put our heads in the sand and pray for a miracle in November, or we can speak the truth.It is disingenuous, at best, to argue that Democrats have already spoken with their vote and therefore the nomination is settled and done, when we just received new and upsetting information. We all think Republicans should abandon their nominee now that he’s been convicted of 34 felonies. That’s new and upsetting information as well. Top Democrats — Chuck Schumer, Hakeem Jeffries, Nancy Pelosi — and senators, representatives and other candidates who face losing in November need to ask this president to voluntarily step aside.All of the scary stories that we’re being told about what would happen next are simply not true. In all likelihood, the money in the Biden-Harris coffers could go to help elect the presidential ticket and other Democrats. The new nominee wouldn’t be left off ballots in Ohio. We Democrats have a very exciting bench. We don’t anoint leaders or fall sway to a cult of personality; we vote for a president. We can easily foresee a group of several strong Democrats stepping forward to stand and tell us why they’re best qualified to lead this country and take on some of the deeply concerning trends we’re seeing from the revenge tour that Donald Trump calls a presidential campaign.Let’s hear from Wes Moore and Kamala Harris and Gretchen Whitmer and Gavin Newsom and Andy Beshear and J.B. Pritzker and others. Let’s agree that the candidates not attack one another but, in the short time we have, focus on what will make this country soar. Then we could go into the Democratic convention next month and figure it out.Would it be messy? Yes. Democracy is messy. But would it enliven our party and wake up voters who, long before the June debate, had already checked out? It sure would. The short ramp to Election Day would be a benefit for us, not a danger. It would give us the chance to showcase the future without so much opposition research and negative campaigning that comes with these ridiculously long and expensive election seasons. This can be an exciting time for democracy, as we’ve just seen with the 200 or so French candidates who stepped aside and put their personal ambitions on hold to save their democracy from the far right.Joe Biden is a hero; he saved democracy in 2020. We need him to do it again in 2024.",Sally Kohn: I’m a lifelong Democrat; I make no apologies for that. She says the one battle Biden cannot win is the fight against time. Kohn says Democrats are so terrified of a second Trump term that we’ve ignored every warning sign.,"https://static.toiimg.com/thumb/msid-111703308,imgsize-985767,width-400,resizemode-4/111703308.jpg"
Prince Harry's ESPY speech interrupted: Is Joe Biden the reason?,https://timesofindia.indiatimes.com/world/us/prince-harrys-espy-speech-interrupted-is-joe-biden-the-reason/articleshow/111702817.cms,"Prince Harry ’s acceptance speech at The ESPYS was unexpectedly cut short during ABC’s live broadcast. The interruption occurred when President Joe Biden 's news conference started late and overran its scheduled time slot by 30 minutes, causing delays in the three-hour show.The ABC telecast returned from a commercial break in the final minutes but began repeating earlier award presentations.This mishap led to the cutting off of Venus Williams ' farewell and the final credits. ABC has not yet explained the technical issues that caused this.Prince Harry received the Pat Tillman Award for Service, mentioning the criticism ESPN faced from the late Army Ranger’s mother for honoring him.Last week, Mary Tillman, the mother of war hero Pat Tillman, voiced her astonishment upon learning that Prince Harry had been chosen to receive an award named after her son. ""I am shocked as to why they would select such a controversial and divisive individual to receive the award,"" she stated, expressing her disbelief at the decision.In her critique of the network's selection, Mary Tillman proposed that there were numerous other individuals within the veteran community who would have been more suitable recipients of the honor. Notwithstanding Mary's disapproval, Prince Harry expressed his gratitude to Pat Tillman's widow, Marie, and recognized Mary's efforts in preserving and promoting her son's legacy.Harry said, “Her advocacy for Pat's legacy is deeply personal and one that I respect. The bond between a mother and son is eternal and transcends even the greatest losses.”Accompanied by his wife Meghan, who joined in a standing ovation, the Duke of Sussex accepted the award from three service veterans injured during their tours. Harry, who served in the British military for ten years, including two tours in Afghanistan as a helicopter pilot, dedicated the award to the veterans, saying, ""This award belongs to them, not to me.""Prince Harry founded the Invictus Games in 2014, a multi-sport event for wounded or injured servicemen and veterans, which underscores his dedication to supporting military personnel.The ESPYS, hosted by Serena Williams, celebrated a significant year for women's sports. Among the honorees were Simone Biles, A'ja Wilson, Caitlin Clark, Dawn Staley, and JuJu Watkins. Dawn Staley, coach of the national champion South Carolina women’s basketball team, received the Jimmy V Award for Perseverance. Staley dedicated her award to her friend Nicki McCray-Penson, who died of breast cancer, and to her sister, who was diagnosed with leukemia.",Prince Harry received the Pat Tillman Award for Service. President Joe Biden's news conference started late and overran its scheduled time slot by 30 minutes. The ABC telecast returned from a commercial break in the final minutes but began repeating earlier award presentations. The interruption led to the cutting off of Venus Williams'farewell and the final credits.,"https://static.toiimg.com/thumb/msid-111702809,imgsize-789652,width-400,resizemode-4/111702809.jpg"
'I'm not going anywhere': Biden stands ground in Michigan amid calls to drop out of the race,https://timesofindia.indiatimes.com/world/us/im-not-going-anywhere-biden-stands-ground-in-michigan-amid-calls-to-drop-out-of-the-race/articleshow/111702631.cms,"US President Joe Biden held a rally in Detroit on Friday, seeking to revive his struggling reelection campaign. He told the cheering crowd that he wasn't going to leave the race and warned that Donald Trump poses a serious threat.Speaking to an enthusiastic crowd in Detroit, Biden pivoted to warnings about the potential consequences of a second Donald Trump term and declared, ""You made me the nominee, no one else — not the press, not the pundits, not the insiders, not donors.You, the voters. You decided. No one else. And I'm not going anywhere.""As the Detroit crowd chanted ""don't you quit!"" and ""we got your back!"" Biden reaffirmed his commitment to running for reelection and vowed to ""shine a spotlight on Donald Trump"" and what the Republican would do if he returned to the White House. He criticized a far-right policy agenda crafted by conservative think tanks, which Trump has tried to distance himself from, while listing several items on his own wish list for the first 100 days of his second term.At the same school where, four years ago, then-candidate Biden positioned himself as a bridge to the next generation of Democratic leaders, the president made it clear he was not going anywhere.""You made me the nominee, no one else — not the press, not the pundits, not the insiders, not donors,"" Biden said, to cheers. ""You, the voters. You decided. No one else. And I'm not going anywhere.""Despite Biden's efforts to convince lawmakers, donors, and the electorate of his capability to be president at the age of 81, concerns within the party about his candidacy and prospects against Trump in November persist. So far, one Democratic senator and roughly 20 House Democrats have publicly called on Biden to step aside.During the rally, Biden criticized Trump's business failures and singled out Project 2025, a proposed overhaul of the federal government drafted by Trump's allies and former officials, which Trump has tried to distance himself from.Biden's campaign has acknowledged that his route to the White House is narrowing, focusing on the ""blue wall"" states of Michigan, Wisconsin, and Pennsylvania as the clearest pathway to victory. This strategy is reflected in Biden's efforts to rally enthusiasm in Detroit and among its sizable Black population, which could prove decisive for his chances of winning Michigan.","US President Joe Biden held a rally in Detroit on Friday, seeking to revive his struggling reelection campaign. He told the cheering crowd that he wasn't going to leave the race and warned that Donald Trump poses a serious threat. So far, one Democratic senator and roughly 20 House Democrats have publicly called on Biden to step aside.","https://static.toiimg.com/thumb/msid-111702666,imgsize-1804649,width-400,resizemode-4/111702666.jpg"
Elon Musk makes 'sizable' donation to group supporting Trump's 2024 Presidency bid: Report,https://timesofindia.indiatimes.com/world/us/elon-musk-makes-sizable-donation-to-group-supporting-trumps-2024-presidency-bid-report/articleshow/111702531.cms,"8 Curd recipes from different parts of India that deserve a try

Food","summarize: 8 Curd recipes from different parts of India that deserve a try. Curd is a rich, creamy substance that can be found in all parts of the country. It can also be used to make a variety of other types of curds.","https://static.toiimg.com/thumb/msid-111702594,imgsize-754238,width-400,resizemode-4/111702594.jpg"
"'Not going anywhere"": US President Joe Biden assures supporters in Detroit",https://timesofindia.indiatimes.com/world/us/not-going-anywhere-us-president-joe-biden-assures-supporters-in-detroit/articleshow/111702140.cms,"President Joe Biden is attempting to rejuvenate his reelection campaign by by attacking Donald Trump presidency, as concerns grow over his mental acuity following a faltering debate performance.At a rally in Detroit , Biden, 81, reiterated his commitment to the race, while he also faced calls from some politicians and donors to step aside.Addressing supporters in Detroit, Biden declared, ""I am running and we're going to win,"" to applause from a crowd displaying ""Motown is Joetown"" signs and chanting ""Don't you quit.""""I'm the nominee,"" he added as quoted by Reuters.""I'm not going anywhere.""Biden urged Americans to take politics seriously, warning against treating it like ""entertainment or a reality TV show."" He called ""Project 2025""—a conservative policy platform aimed at reducing federal government size if Trump is elected—""deadly serious.""Earlier the same day, Biden made an unscheduled visit to a garage-themed restaurant in a Detroit suburb, where he assured patrons, ""I promise you... I'm okay,"" and emphasized his intention to ""finish the job.""According to campaign spokesperson Michael Tyler, contributions surged to seven times their usual level following Biden's press conference on Thursday night.Biden also received endorsements earlier that day from prominent Democrats. Representative James Clyburn and California Governor Gavin Newsom both voiced their support. United Auto Workers president Shawn Fain praised Biden for standing ""with the working class,"" although he did not name him directly.However, Biden's backing appears to be weakening in some quarters. Two more lawmakers have recently called for him to exit the race. Representative Mike Levin of California issued a statement saying, ""It is time to move forward. With a new leader."" Levin, who faces his own competitive reelection, joins at least 19 lawmakers in asking Biden to withdraw.Despite these defections, Biden retains substantial support from key figures in the Democratic Party and has vowed to contest the Nov. 5 election.""I'm riding with Biden no matter which direction he goes,"" Clyburn announced on NBC's ""Today"" program. Newsom also expressed his support for Biden in a CBS interview excerpt.As he challenges Biden, Donald Trump invited him to take a cognitive test. Writing on Truth Social, Trump said, ""I will go with him, and take one also. For the first time we'll be a team, and do it for the good of the Country.""Biden has been making efforts to secure loyalty from key Democratic groups. He held separate phone calls with Hispanic, Asian, and Democratic lawmakers. While top leaders of the Hispanic group have endorsed Biden, other members remain non-committal.Democratic politicians, donors, and activists are deliberating whether Biden is the most viable candidate to defeat Trump and serve another term.The New York Times reported that some donors told a pro-Biden Super PAC that about $90 million in pledges would be withheld as long as Biden remains in the race.House Democratic Leader Hakeem Jeffries met with Biden on Thursday night to communicate various perspectives from their 213-member caucus. Jeffries did not specify his personal stance on Biden’s candidacy but mentioned in a letter to colleagues, ""I directly expressed the full breadth of insight, heartfelt perspectives and conclusions about the path forward.""Biden's recent press conference received mixed reactions. He mistakenly referred to Vice President Kamala Harris as ""Vice President Trump"" and Ukrainian President Volodymyr Zelenskiy as ""President Putin"" during the NATO summit.Nevertheless, Biden delivered detailed analyses on global issues, showcasing his extensive experience.An NPR/PBS poll released Friday indicated Biden leading Trump 50% to 48%, a slight improvement from before the June 27 debate.Regardless, some analysts warn that Biden is losing ground in crucial swing states. Democratic strategist Doug Sosnik wrote in the New York Times, ""If current trends continue, Mr. Trump could rack up one of the most decisive presidential victories since 2008.""Biden’s campaign faces critical decisions as the 2024 election approaches. The unity of Democratic support and voter sentiment in swing states will be pivotal factors in determining the outcome of the race against Trump.","At a rally in Detroit, Biden, 81, reiterated his commitment to the race, while he also faced calls from some politicians and donors to step aside. Biden urged Americans to take politics seriously, warning against treating it like ""entertainment or a reality TV show"" Donald Trump invited him to take a cognitive test.","https://static.toiimg.com/thumb/msid-111702127,imgsize-798440,width-400,resizemode-4/111702127.jpg"
Rust movie shooting: Alec Baldwin's involuntary manslaughter case dismissed over withheld evidence,https://timesofindia.indiatimes.com/world/us/alec-baldwins-involuntary-manslaughter-case-dismissed-in-middle-of-trial-and-cannot-be-filed-again/articleshow/111699441.cms,"The involuntary manslaughter trial of Alec Baldwin came to an abrupt end on Friday in Santa Fe, New Mexico.Judge Mary Marlowe Sommer dismissed the case after determining that crucial evidence related to the fatal shooting on the set of "" Rust "" had been withheld from Baldwin's defense team by police and prosecutors.""The state's willful withholding of this information was intentional and deliberate.If this conduct does not rise to the level of bad faith, it certainly comes so near to bad faith as to show signs of scorching prejudice,"" said the judge, as quoted by AFP. She concluded that this conduct was highly prejudicial to Baldwin, who immediately burst into tears upon hearing the decision. If found guilty, the Hollywood star could have faced up to 18 months in prison.The dismissal of the case centered around live bullets potentially linked to the death of cinematographer Halyna Hutchins , which were handed to police by a ""Good Samaritan"" earlier this year. The former police officer and family friend of the film's armorer, Hannah Gutierrez, claimed the bullets matched the rounds that killed Hutchins. However, the defense argued that police had ""buried"" this evidence by not filing it under the ""Rust"" case, depriving them of the opportunity to examine it.Despite the prosecution's attempts to salvage the case, Judge Marlowe Sommer remained unconvinced and dismissed the charges with prejudice. Legal experts believe that Baldwin is unlikely to face criminal proceedings again over the shooting due to double jeopardy protections. However, he may still be subject to civil suits. The withheld evidence could also benefit Gutierrez, who is currently serving an 18-month sentence for involuntary manslaughter and has launched an appeal, as well as David Halls, the film's first assistant director who took a plea deal and admitted negligence.","The involuntary manslaughter trial of Alec Baldwin came to an abrupt end on Friday in Santa Fe, New Mexico. Judge Mary Marlowe Sommer dismissed the case after determining that crucial evidence related to the fatal shooting on the set of "" Rust "" had been withheld from Baldwin's defense team by police and prosecutors. If found guilty, the Hollywood star could have faced up to 18 months in prison.","https://static.toiimg.com/thumb/msid-111699390,imgsize-1102279,width-400,resizemode-4/111699390.jpg"
"Meta mulls reinstating Trump's Facebook, Instagram accounts ahead of GOP convention",https://timesofindia.indiatimes.com/world/us/ahead-of-election-meta-to-reinstate-trumps-facebook-instagram-accounts/articleshow/111698856.cms,"Meta on Friday announced it was lifting some restrictions that had applied to former US President Donald Trump 's Facebook and Instagram accounts ahead of the first republican convention, CNN reported. The social media company suspended Trump's accounts indefinitely after he praised those who stormed the US Capitol on January 6, 2021.In early 2023, they reinstated his accounts but announced they would monitor his posts for violations, which could lead to suspensions lasting from one month to two years.Meta has now stated that Trump, currently running against US President Joe Biden, will no longer be subject to this additional monitoring .""In assessing our responsibility to allow political expression, we believe that the American people should be able to hear from the nominees for president on the same basis,"" Meta said in an updated blog post.Some social media experts have consistently faulted Meta and other platforms for their perceived inadequacy in moderating political content, including that from political candidates.Trump was also banned from Twitter in 2021. The platform, now called X, saw billionaire Elon Musk restore Trump's account shortly after acquiring the company in 2022.Trump launched his own social media site, Truth Social, in 2022, in the wake of his suspension from Facebook and Instagram, along with social media platform X, formerly known as Twitter.","Social media platform Meta has lifted some restrictions on former US President Donald Trump's Facebook and Instagram accounts. The social media company suspended Trump's accounts indefinitely after he praised those who stormed the US Capitol on January 6, 2021. In early 2023, they reinstated his accounts but announced they would monitor his posts for violations.","https://static.toiimg.com/thumb/msid-111698871,imgsize-1541568,width-400,resizemode-4/111698871.jpg"
Retired Massachusetts pediatrician pleads not guilty to abusing at least 15 child patients,https://timesofindia.indiatimes.com/world/us/retired-massachusetts-pediatrician-pleads-not-guilty-to-abusing-at-least-15-child-patients/articleshow/111698613.cms,"A retired pediatrician from Massachusetts, Dr Richard Kauff , pleaded not guilty on Friday to charges of sexually abusing at least 15 of his child patients.Appearing in Plymouth Superior Court, Kauff faces 11 counts of child rape with force and nine counts of indecent assault and battery on a child under 14. He had practiced since 1983 and was associated with the South Shore Medical Center until his retirement in 2022.The accusations span a 23-year period, with reports now totaling 18 accusers.The allegations surfaced initially in October 2023 on a local Facebook group, where an anonymous individual claimed they were assaulted during a routine checkup. Subsequently, additional allegations emerged after a second person came forward to Norwell Police. Following charges by Norwell police in Hingham District Court, more than three dozen individuals reported similar misconduct by Kauff.""The allegations against Dr Kauff are truly disturbing,"" Erika O'Donnell, a partner with the law firm Shepard O'Donnell who is representing nine accusers, said in a statement.""Not only did he victimize children, but he did so right in front of their parents - using his position as a trusted physician to deceive victims and their parents,"" she continued. ""At their most vulnerable, he broke their trust and his victims and their families are paying the price.""Erika O'Donnell, representing nine of the accusers, described the allegations as deeply troubling, noting that Kauff allegedly abused children in front of their parents, exploiting his trusted role as a physician to deceive victims and families. She emphasized the severe impact on the victims and their families.Kauff's attorney, Kelli Porges, asserted her client's innocence, stating he is ""100% innocent,"" and declined further comment to The Associated Press. Earlier, she had indicated that plaintiffs' lawyers sought more accusers through social media, suggesting potential civil suits.Kauff was released on $50,000 bail and is scheduled to return to court on September 17.","Richard Kauff, a retired pediatrician from Massachusetts, pleaded not guilty on Friday to charges of sexually abusing at least 15 of his child patients. Kauff faces 11 counts of child rape with force and nine counts of indecent assault and battery on a child under 14. The accusations span a 23-year period, with reports now totaling 18 accusers.","https://static.toiimg.com/thumb/msid-111698625,imgsize-26472,width-400,resizemode-4/111698625.jpg"
