Article Title,Article Link,Article Text,Article Summary,Article Image
"Bus plunges into a ravine in southwest Pakistan, killing at least 20 passengers",https://timesofindia.indiatimes.com/world/pakistan/bus-plunges-into-a-ravine-in-southwest-pakistan-killing-at-least-20-passengers/articleshow/110524062.cms,"QUETTA : A speeding passenger bus crashed off a mountainous highway and fell into a ravine in southwest Pakistan early Wednesday, killing at least 20 passengers, police and government officials said.Local police officer Asghar Ali said the accident happened in Washuk town as the bus was traveling from Turbat , the second largest city in Baluchistan province , to Quetta, the province's capital.Local media pictures showed the wreckage at the bottom of a rocky ravine.Interior Minister Mohsin Naqvi expressed sorrow over the accident.Road accidents are common in Pakistan where traffic rules and safety standards are sparsely followed, even on battered roads in particularly rugged areas.At least 20 people were killed and another 30 were injured earlier this month in a similar incident.","The bus was traveling from Turbat to Quetta, the province's capital. Road accidents are common in Pakistan where traffic rules and safety standards are sparsely followed. At least 20 people were killed and another 30 were injured earlier this month in a similar incident.","https://static.toiimg.com/thumb/msid-110524097,imgsize-652592,width-400,resizemode-4/110524097.jpg"
Nawaz elected PML-N president on day Pakistan commemorates anniversary of nuke test conducted during his term as PM,https://timesofindia.indiatimes.com/world/pakistan/nawaz-elected-pml-n-president-on-day-pak-commemorates-anniv-of-nuke-test-conducted-during-his-term-as-pm/articleshow/110509234.cms,"ISLAMABAD: Pakistan’s three-time former prime minister Nawaz Sharif was re-elected president of the ruling Pakistan Muslim League-Nawaz (PML-N) on Tuesday, six years after he was forced to quit the post after a Supreme Court ruling. His unopposed at the party’s general council meeting came on a day that was declared a public holiday by his younger brother, PM Shehbaz Sharif , to commemorate the 26anniversary of Pakistan’ nuclear tests , conducted during Nawaz Sharif’s second term as PM.Pakistan conducted the tests on May 28, 1998, almost three weeks after India tested its devices, in Chaghi hills of southwestern Balochistan province, making it the seventh nuclear nation in the world and the first Muslim state to have a nuclear arsenal.While Nawaz was at peak of his popularity in May 1998, he could not celebrate the first anniversary of the nuclear tests following his ouster from office in Oct 1998 by General Pervez Musharraf in a military coup.The anniversary is being commemorated for the first time in 26 years, coinciding with his re-election as PML-N president . He took the party’s reins back from Shehbaz, who had stepped down on May 13, paving the way for the 74-year-old party founder, to be elected again.Shehbaz hailed Nawaz, who returned to Pakistan in Oct 2023 after a four-year self-imposed exile in UK, for the nuclear tests, which he said ensured “credible minimum deterrence”. In a post on X, he said: “On this historic day in 1998, then-PM Nawaz Sharif demonstrated bold leadership by rejecting nerve-wracking pressures and inducements to make Pakistan a nuclear-armed nation.” He also paid tribute to ex-prime minister Zulfikar Ali Bhutto, who, he said, was the founder of Pakistan’s nuclear programme, for his “strategic foresight and unwavering commitment to the cause”.Shehbaz was elected PML-N president in March 2018, months after the Supreme Court disqualified Nawaz for life in the Panama Papers case. Weeks later, an apex court bench also barred from heading a political party.","Pakistan conducted the tests on May 28, 1998, almost three weeks after India tested its devices. Nawaz was at peak of his popularity in May 1998, but could not celebrate the first anniversary of the nuclear tests following his ouster from office in Oct 1998 by General Pervez Musharraf.","https://static.toiimg.com/thumb/msid-110509274,imgsize-564091,width-400,resizemode-4/110509274.jpg"
Former Pakistan PM Nawaz Sharif set to be re-elected as PML-N president after six years,https://timesofindia.indiatimes.com/world/pakistan/former-pakistan-pm-nawaz-sharif-set-to-be-re-elected-as-pml-n-president-after-six-years/articleshow/110488540.cms,"LAHORE: Three-time former prime minister Nawaz Sharif is set to be re-elected as the President of the ruling Pakistan Muslim League-Nawaz ( PML-N ) party here on Tuesday, six years after losing the post following a Supreme Court ruling in the Panama Papers case. The Dawn newspaper reported that the General Council meeting is set to take place at a local hotel. It is likely that the 74-year-old veteran politician, who returned to Pakistan in October last year after a four-year self-imposed exile in the UK, will be elected unopposed even though as many as 11 party members have received the nomination papers for the top post, the report said.The PML-N had earlier announced convening the general council meeting on May 11 but it was postponed to coincide with the celebration of 26 years of Pakistan becoming a nuclear power, the report said.PML-N Punjab president Rana Sanaullah, while addressing a press conference, hinted that the elder Sharif would be elected without a contest.Responding to a question if others were contesting against the former premier, Sanaullah said if any party member wanted to contest against him, they should come forward.When asked why the party didn't adopt a democratic process to vote for a new president, Sanaullah said the party was a ""servant of power corridors and it was Nawaz Sharif who made it a party of the public"". He added that after Quaid-i-Azam Muhammad Ali Jinnah, it was Nawaz Sharif who ""made the party vibrant"".Replying to another question on why Nawaz Sharif wasn't active in politics after the February 8 general elections, Sanaullah said the former PM is not angry with anyone and he is active in the party. ""All major decisions of the party and government are taken by him,"" he added.Prime Minister Shehbaz Sharif had earlier this month resigned as the PML-N president citing the ""unjust"" disqualification of the party supremo and his elder brother Nawaz Sharif from the PM Office.Shehbaz, 72, said that it was time for the latter to ""resume his rightful place as the president of the Pakistan Muslim League-Nawaz party.""The February 8 general elections had delivered a fractured mandate and the PML-N did not get a clear majority. It joined hands with the Pakistan Peoples Party (PPP) led by Bilawal Zardari Bhutto and other smaller parties to form the government at the federal level when Nawaz relinquished the post of prime minister in favour of Shehbaz.Much before that, in 2017, Nawaz had stepped down as the country's prime minister after the Supreme Court disqualified him for life from holding public office for not declaring a receivable salary.Following his trial in the Panama Papers case, the apex court, in February 2018, disqualified the PML-N supremo as the party's president.",Nawaz Sharif is set to be re-elected as the President of the ruling PML-N party. The 74-year-old politician returned to Pakistan in October last year after a four-year self-imposed exile in the UK. As many as 11 party members have received nomination papers for the top post.,"https://static.toiimg.com/thumb/msid-110488593,imgsize-26792,width-400,resizemode-4/110488593.jpg"
Pakistan temperatures cross 52º Celsius amid severe heatwave,https://timesofindia.indiatimes.com/world/pakistan/pakistan-temperatures-cross-52-degree-celsius-amid-severe-heatwave/articleshow/110487704.cms,"NEW DELHI: Temperatures soared above 52º Celsius Pakistan's Sindh on Monday, nearing the country's record high amidst a persistent heatwave .Mohenjo Daro in Sindh witnessed temperatures as high as 52.2 C (126 F) in the last 24 hours, as reported by Shahid Abbas, a senior official of the Pakistan Meteorological Department. This reading is the highest of the summer so far and close to the town's and country's record highs of 53.5 C (128.3 F) and 54 C (129.2 F), respectively.""Pakistan is the fifth most vulnerable country to the impact of climate change . We have witnessed above normal rains, floods,"" said Rubina Khursheed Alam, Pakistan PM's coordinator on climate.Scientists have attributed the extreme temperatures across Asia over the past month to human-driven climate change.Sardar Sarfaraz, Chief Meteorologist at the Pakistan Meteorological Department, said that the highest temperature recorded in Pakistan was 54 C (129.2 F) in the city of Turbat, located in the southwestern province of Balochistan, in 2017.This was the second hottest temperature in Asia and the fourth highest in the world. While the heatwave is expected to subside in Mohenjo Daro and surrounding areas, another spell is anticipated to hit other parts of Sindh, including Karachi, Pakistan's largest city.","Temperatures soar above 52º Celsius Pakistan's Sindh on Monday, nearing the country's record high. Mohenjo Daro in Sindh witnessed temperatures as high as 52.2 C (126 F) in the last 24 hours. Scientists have attributed the extreme temperatures across Asia over the past month to human-driven climate change.","https://static.toiimg.com/thumb/msid-110488236,imgsize-786047,width-400,resizemode-4/110488236.jpg"
Mohenjo Daro in Pakistan sees season's high of 52C,https://timesofindia.indiatimes.com/world/pakistan/mohenjo-daro-in-pakistan-sees-seasons-high-of-52c/articleshow/110477463.cms,"MOHENJO DARO : Temperatures rose above 52C in Pakistan 's southern province of Sindh , the highest reading of the summer and close to the country's record high amid an ongoing heatwave , the met office said on Monday.

In Mohenjo Daro, a town in Sindh known for archaeological sites that date back to the Indus Valley Civilization built in 2500 BC, temperatures rose as high as 52.2C over the last 24 hours, a senior official of the Pakistan meteorological department, Shahid Abbas said. The reading is the highest of summer so far, and approached the town's and country's record highs of 53.5C and 54C respectively.

The highest temperature recorded in Pakistan was in 2017 when temperatures rose to 54C in the city of Turbat, located in the southwestern province of Balochistan. This was the second hottest in Asia and fourth highest in the world, said Sardar Sarfaraz, chief meteorologist at the Pakistan meteorological department.

",Temperatures rose above 52C in Pakistan's southern province of Sindh. It is the highest reading of the summer and close to the country's record high. The highest temperature recorded in Pakistan was in 2017 when temperatures rose to 54C in the city of Turbat.,"https://static.toiimg.com/thumb/msid-110477520,imgsize-423477,width-400,resizemode-4/110477520.jpg"
China backs probe into suicide attack as Pakistan asks Afghan Taliban to hand over plotters,https://timesofindia.indiatimes.com/world/pakistan/china-backs-probe-into-suicide-attack-as-pakistan-asks-afghan-taliban-to-hand-over-plotters/articleshow/110474955.cms,"ISLAMABAD: Beijing backed Monday Pakistan ’s investigation into the recent suicide attack that killed five Chinese engineers and their Pakistani driver in Khyber Pakhtunkhwa province on March 26, after Islamabad accused Taliban authorities in Afghanistan of sheltering the “plotters” and demanded that they be handed over.However, China refrained from holding Afghanistan’s interim govt responsible for sheltering the terrorists, as alleged by Islamabad, as it finds itself in a quandary because it shares close ties with Taliban govt in Afghanistan and has extended diplomatic recognition to the interim regime.The Chinese workers died when a suicide bomber rammed an explosive-laden vehicle into their bus. The Chinese were working on Dasu hydropower project, which is about 300km north of Islamabad. The 4,320MW project is being constructed by China Gezhouba with funding from World Bank.“China attaches great importance to the important progress made by the Pakistani side on the investigation of the terrorist attack,” PTI quoted Chinese foreign ministry spokesperson Mao Ning. “China calls on countries in the region to strengthen counter-terrorism cooperation, root out all terrorist organisations, remove their breeding ground, and protect the common security and development interests of all countries.”Earlier, Pakistani military authorities claimed the suicide bomber was an Afghan national. At a press conference in Lahore Sunday, interior minister Mohsin Naqvi said: “The attack was completely operated from Afghanistan and planned to specifically target Chinese personnel in Pakistan.” He blamed the banned Tehreek-e-Taliban Pakistan (TTP) and “hostile foreign intelligence agencies”.Pakistan’s allegation further strains bilateral ties as Islamabad continues to urge Kabul to take action against Pakistani Taliban based in Afghanistan. Islamabad has repeatedly accused Afghan Taliban of allowing TTP terrorists to operate on its soil, a charge Kabul denies.Pakistan is under pressure from China as it has urged Islamabad to punish those involved in the attack on its citizens. Recently, Pakistan’s top economic body ECC approved a $2.58 million compensation package for the families of Chinese workers killed on March 26.Thousands of Chinese nationals are working on the China-Pakistan Economic Corridor (CPEC), a multibillion-dollar energy and infrastructure project under Beijing’s Belt and Road Initiative. Chinese workers have frequently been targeted, mostly by Baloch separatist groups in Baluchistan, who view CPEC as a Pakistani govt ploy to exploit the province’s natural resources.",Beijing backs Pakistan’s investigation into the recent suicide attack that killed five Chinese engineers and their Pakistani driver in Khyber Pakhtunkhwa province. Islamabad accused Taliban authorities in Afghanistan of sheltering the “plotters” and demanded that they be handed over. The Chinese were working on Dasu hydropower project.,"https://static.toiimg.com/thumb/msid-110474977,imgsize-531117,width-400,resizemode-4/110474977.jpg"
Pakistan Revives China Belt and Road Initiative Projects to Boost Economy,https://timesofindia.indiatimes.com/world/pakistan/pakistan-to-revive-china-belt-and-road-initiative-projects/articleshow/110470413.cms,"Pakistan ’s new government is hoping to inject some fresh momentum into projects that fall under China’s Belt and Road Initiative, as it tries to boost the country’s troubled economy.The South Asian nation is looking at joint ventures for renewable energy projects , agriculture collaboration and possibly enticing some Chinese companies to relocate to Pakistan, said Ahsan Iqbal, Pakistan’s federal minister for Planning, Development and Special Initiatives, who also co-heads the committee responsible for the China-Pakistan Economic Corridor , in an interview.“Yeah, I’m very hopeful because I was there in China recently and I had meetings with their senior leadership,” said Iqbal at his office in Islamabad, decorated with a large map showcasing the China-Pakistan Economic Corridor. “So I see great interest on the Chinese side to revive the momentum for CPEC and also to take it into the second phase.”Pakistan was seen as a flagship destination for BRI projects , with CPEC — which includes a port in the southern town of Gwadar and new power plants — the crown jewel. The progress on new projects stalled in the aftermath of the COVID-19 pandemic and amid Pakistan’s on-going economic difficulties that have required the International Monetary Fund’s intervention.Pakistan’s Prime Minister Shehbaz Sharif, who was elected to a second successive term in February, has been looking to revive economic cooperation with China for the past two years. Sharif’s older brother, Nawaz, led the country when Pakistan signed on to the BRI in 2013.Projects worth about $25 billion came online in the first phase, including power plants that ended the nation’s chronic power deficit.A Pakistani committee approved a long-delayed railway upgrade project last week — but scaled it down from $10 billion to $6.8 billion.The project will be done in two phases “so there is not a big burden on Pakistan,” said Iqbal. The railway, in its first phase will run from Karachi, the southern coast city, to Multan, a little over halfway to the capital, Islamabad.The Sharif government has also finished some key BRI projects that were pending for years: a water-supply project in Gwadar, dredging work at the port and an electricity transmission line from Iran.“So all these things really help China see that the new government is again serious and it restored their confidence that now Pakistan is, you know, serious about CPEC initiatives ,” said Iqbal.China has also been a key financial lender, alongside the IMF, with its loans helping Pakistan avoid bankruptcy. The country is struggling with low growth and the fastest rising consumer prices in Asia. Islamabad’s difficulties have seen it fall behind on payments related to Chinese-funded power plants.To mark the tenth anniversary of CPEC last year, China’s Vice Premier He Lifeng unveiled five new corridors including one focused on growth to boost economic activity in Pakistan. The others are related to livelihood, innovation, green energy and regional connectivity. Sharif is likely to visit China soon, said Iqbal.One change in the second phase would likely involve Islamabad taking a step back while urging the private sector to forge partnerships with Chinese firms.The other big focus, albeit a long-shot prospect, is to try and attract Chinese firms thinking of relocating from China amid rising labor costs and heightening geopolitical tensions.“That would be a success because at the moment more than 80 million jobs are being relocated from China to other countries because of the high level cost in China,” said Iqbal. “They have gone to Vietnam and you know, Laos and Cambodia. There is now overcrowding there. So they are certainly looking for new places.”","Pakistan is looking at joint ventures for renewable energy projects, agriculture collaboration and possibly enticing some Chinese companies to relocate to Pakistan. Pakistan’s Prime Minister Shehbaz Sharif, who was elected to a second successive term in February, has been looking to revive economic cooperation with China.","https://static.toiimg.com/thumb/msid-110470548,imgsize-1121007,width-400,resizemode-4/110470548.jpg"
"1,400 girls make a lucky escape from school fire in Pakistan",https://timesofindia.indiatimes.com/world/pakistan/1400-girls-make-a-lucky-escape-from-school-fire-in-pakistan/articleshow/110463677.cms,"(With agency inputs)

NEW DELHI: Nearly 1,400 girl students escaped from a school building engulfed by fire in Pakistan's Khyber Pakhtunkhwa province on Monday. Rescue officials reported that the fire swept through the Government Girls Higher Secondary School in Haripur district's Sirikot village while hundreds of students were inside.Rescue officials said that fire brigade vehicles faced difficulties reaching the site due to the mountainous terrain.Haripur's rescue 1122 spokesperson, Faraz Jalal, confirmed that all students were safely evacuated from the building. The spokesperson noted that the fire caused significant damage to the entire school, which was partially constructed with wood. The rescue department confirmed no loss of life.Chief secretary Khyber Pakhtunkhwa, Nadeem Aslam Chaudhry, said that the fire was caused by a short circuit and an investigation into the incident is underway.Khyber Pakhtunkhwa has a history of attacks on school buildings by militants. On May 8, a private girls' school was destroyed by unidentified militants in Tehsil Shewa of North Waziristan district. The militants reportedly tortured the watchman before blowing up two rooms of the school. Similar attacks occurred in May last year, targeting government schools for girls in Mirali. No casualties were reported in these incidents.Khyber Pakhtunkhwa chief minister, Ali Amin Gandapur, highlighted the timely action by rescue officials in evacuating the students and said that the education department and district administration will submit a report regarding the fire. Gandapur assured that all educational institutions would be reviewed to prevent such incidents in the future. The provincial government will compensate for the losses caused by the fire.","Nearly 1,400 girl students escaped from a school building engulfed by fire in Pakistan's Khyber Pakhtunkhwa province. Rescue officials reported that the fire swept through the Government Girls Higher Secondary School in Haripur district's Sirikot village. The fire was caused by a short circuit and an investigation into the incident is underway.","https://static.toiimg.com/thumb/msid-110465156,imgsize-660982,width-400,resizemode-4/110465156.jpg"
Police arrest 100 Muslims after mob attack on Christians in Pakistan's Punjab province,https://timesofindia.indiatimes.com/world/pakistan/police-arrest-33-muslims-after-mob-attack-on-christians-in-pakistans-punjab-province/articleshow/110463399.cms,"LAHORE: Pakistan police arrested at least 100 Muslim men and charged them for attacking the Christian father and son on in Sargodha district, approximately 200 kilometers from Lahore.The incident occurred on Saturday when an angry mob went on a rampage after locals discovered burnt pages of the Quran outside the two Christian men's house and accused the son of being behind it.The mob set their house and shoemaking factory on fire in the city of Sargodha in Punjab province, said senior police officer Asad Ijaz Malhi.Punjab police said in a statement it beefed up security at churches.A similar incident took place, last year in August, in Jaranwala tehsil, Faisalabad district, where at least 24 churches and over 80 houses belonging to Christians were burnt down by a mob enraged over reports of two Christians desecrating the Quran.Accusations of blasphemy are frequent in Pakistan, and under the nation's blasphemy laws, individuals found guilty of insulting Islam or its religious figures face severe penalties, including death sentences. While no executions have been carried out on such charges, mere allegations often trigger riots and provoke mobs to commit acts of violence, including lynching and murder.(With inputs from agencies)",At least 100 Muslim men arrested for attacking Christian father and son. Angry mob went on rampage after locals discovered burnt pages of the Quran outside the two Christian men's house and accused the son of being behind it. The mob set their house and shoemaking factory on fire in the city of Sargodha in Punjab province.,"https://static.toiimg.com/thumb/msid-110463539,imgsize-30304,width-400,resizemode-4/110463539.jpg"
