Article Title,Article Link,Article Text,Article Summary,Article Image
"Russian assassination plots against those supporting Ukraine uncovered in Europe, official says",https://timesofindia.indiatimes.com/world/europe/russian-assassination-plots-against-those-supporting-ukraine-uncovered-in-europe-official-says/articleshow/111703277.cms,"WASHINGTON: Western intelligence agencies have uncovered Russian plots to carry out assassinations, arson and other sabotage in Europe against companies and people linked to support for Ukraine 's military - one of the most serious being a plan to kill the head of a German arms manufacturer , a Western government official said.The plots have sometimes involved recruiting common criminals in foreign countries to conduct the attacks, said the official, who is familiar with the situation but not authorized to comment and spoke on the condition of anonymity.One major plot recently uncovered had targeted Armin Papperger, CEO of defense company Rheinmetall, the official said.The official declined to offer any details on other plots, which were first reported by CNN. The CNN report said the US informed Germany, whose security services were able to protect Papperger and foil the plot.Rheinmetall is a major supplier of military technology and artillery rounds for Ukraine as it fights off Russian forces. The company last month opened an armored vehicle maintenance and repair facility in western Ukraine and also aims to start production inside the country.White House National Security Council spokesperson Adrienne Watson declined to comment on the alleged plot to kill Papperger but said, ""Russia's intensifying campaign of subversion is something that we are taking extremely seriously and have been intently focused on over the past few months.""""The United States has been discussing this issue with our Nato allies , and we are actively working together to expose and disrupt these activities,"" Watson added. ""We have also been clear that Russia's actions will not deter allies from continuing to support Ukraine.""Neither Rheinmetall nor the German government would comment Friday on the reported plot against Papperger. The Interior Ministry can't comment on ""individual threat situations,"" spokesperson Maximilian Kall said, but he added that more broadly, ""we take the significantly increased threat from Russian aggression very seriously.""""We know that (Russian President Vladimir) Putin's regime wants above all to undermine our support for Ukraine in its defense against the Russian war of aggression, but the German government won't be intimidated,"" Kall said.He noted that German security measures have increased significantly since 2022 and that ""the threats range from espionage and sabotage, through cyberattacks, to state terrorism.""European officials gathered for the Nato summit in Washington this week spoke of dealing with an escalation of ""hybrid"" attacks that they blame on Russia and its allies.That includes what authorities called suspicious recent fires at industrial and commercial sites in Lithuania, Poland, the United Kingdom, Germany and other nations, and charges that Russia-allied Belarus was sending large numbers of migrants from the Middle East and North Africa to the borders of Poland, Latvia and other countries belonging to Nato.When asked at a news conference at the Nato summit Thursday, Nato Secretary-General Jens Stoltenberg said he could not comment on the CNN report. He did note a widespread campaign by Russian security services to conduct ""hostile actions"" against Nato allies, including sabotage, cyberattacks and arson.""These are not standalone instances. These are part of a pattern, part of an ongoing Russian campaign. And the purpose of this campaign is, of course, to intimidate Nato allies from supporting Ukraine,"" Stoltenberg said.In April, German investigators arrested two German-Russian men on suspicion of espionage, one of them accused of agreeing to carry out attacks on potential targets, including US military facilities, in hopes of sabotaging aid for Ukraine.Germany has become the second-biggest supplier of weapons to Ukraine after the United States since Russia started its full-scale invasion of Ukraine more than two years ago.Kremlin spokesperson Dmitry Peskov dismissed the report of a plan to kill Papperger. ""All of this is again presented in the fake style, so such reports cannot be taken seriously,"" he told reporters Friday.US Defense Secretary Lloyd Austin spoke to his Russian counterpart, Andrei Belousov, on Friday, their second call in less than a month, Pentagon deputy press secretary Sabrina Singh announced at a briefing Friday. The call was initiated by the Russian defense minister, Singh said.She did not have further details to share, including whether the two leaders spoke about the accusations that Russia had attempted to assassinate top officials of Western defense firms producing weapons systems that are sent to Ukraine, but said ""maintaining lines of communication is incredibly important right now.""","Western intelligence agencies have uncovered Russian plots to carry out assassinations, arson and other sabotage in Europe. One of the most serious was a plan to kill the head of a German arms manufacturer. The plots have sometimes involved recruiting common criminals in foreign countries to conduct the attacks.","https://static.toiimg.com/thumb/msid-111703317,imgsize-1006367,width-400,resizemode-4/111703317.jpg"
'Cosmic ballet': Nasa unveils stunning images of two galaxies merging in Space,https://timesofindia.indiatimes.com/home/science/cosmic-ballet-nasa-unveils-stunning-images-of-two-galaxies-merging-in-space/articleshow/111702750.cms,"Nasa on Friday unveiled a set of images of two galaxies merging in sort of a "" cosmic ballet "". The galaxies, affectionately named the Penguin and the Egg , are located 326 million light-years away in the constellation Hydra.The release of these images marked the second anniversary of the telescope's first scientific results.The image was taken by the James Webb Space Telescope which was launched in 2021 and began collecting the data since that year.Since becoming operational, Webb has observed galaxies teeming with stars that formed within a few hundred million years of the Big Bang event that marked the beginning of the universe about 13.8 billion years ago.""We see two galaxies, each a collection of billions of stars. The galaxies are in the process of merging. That's a common way that galaxies like our own build up over time, to grow from small galaxies - like those that Webb has found shortly after the Big Bang – into mature galaxies like our own Milky Way,"" Reuters quoted Jane Rigby, Nasa Webb senior project scientist, as saying.The Penguin and Egg galaxies, collectively known as Arp 142, are shown in the images connected by a haze of stars and gas as they slowly merge. The Penguin galaxy, formally called NGC 2936, is a distorted spiral galaxy, while the Egg galaxy, NGC 2937, is a compact elliptical galaxy. Their interaction began between 25 and 75 million years ago, and they are expected to become a single galaxy in hundreds of millions of years.Webb has made significant contributions to the understanding of the universe, detecting the earliest known galaxies and providing insights into exoplanet composition and star-forming regions.""This mission has allowed us to look back to the most distant galaxies ever observed and understand the very early universe in a new way,"" said Mark Clampin, astrophysics division director at NASA headquarters. ""For example, with Webb, we've found that these very early galaxies are more massive and brighter than we expected, posing the question: How did they get so big so quickly?""As the largest and most powerful telescope ever put in space, Webb specialises in capturing infrared light, allowing it to see through dust and gas and examine the composition of exoplanet atmospheres with unprecedented detail. Looking to the future, Clampin added, ""Some of Webb's most exciting investigations will be the things we haven't even thought of yet.""","Nasa unveils images of two galaxies merging in sort of a "" cosmic ballet"" The galaxies, affectionately named the Penguin and the Egg, are located 326 million light-years away in the constellation Hydra. The image was taken by the James Webb Space Telescope which was launched in 2021.","https://static.toiimg.com/thumb/msid-111702951,imgsize-35126,width-400,resizemode-4/111702951.jpg"
Turkey introduces contentious bill targeting stray dogs; sparks outcry from rights groups,https://timesofindia.indiatimes.com/world/middle-east/turkey-introduces-contentious-bill-targeting-stray-dogs-sparks-outcry-from-rights-groups/articleshow/111702653.cms,"(With agency inputs)

Turkey's ruling party , led by President Recep Tayyip Erdogan , introduced a contentious bill in parliament aimed at addressing the country's rising stray dog population. The proposed legislation states that stray dogs would be removed from the streets and placed in shelters where they would undergo neutering and spaying.The proposal, presented by senior legislator from the ruling party Abdullah Guler, also said that dogs at risk of rabies, exhibiting aggressive behavior, and having no possibility of rehabilitation would be euthanized.The proposal also requires municipalities to improve conditions in existing shelters and encourages people to adopt the dogs.The proposal has raised concerns among critics who fear it will lead to dogs being held in overcrowded shelters and potentially result in the killing of many animals. The bill has sparked a debate between animal rights activists and those who advocate for measures to ensure the safety of streets from feral dogs.According to Erdogan , an estimated four million stray dogs are currently roaming on the streets and countryside of Turkey. The initial proposal, which was not submitted to parliament, reportedly called for the strays to be collected, placed in shelters, and euthanized if not adopted within 30 days. This proposal had sparked a public outcry, with animal rights activists arguing that it would lead to the mass killing of unadopted dogs.The Safe Streets and Defense of the Right to Life Association, an organization advocating for the removal of all stray dogs from the streets, released a report noting that 65 people have died in street dog attacks since 2022. The government pledged to address the issue earlier this year after a child in Ankara was severely injured in a dog attack.Animal rights groups argue that the existing legislation, which requires stray dogs to be caught, neutered, spayed, and returned to their original location, has not been properly implemented over the years, leading to the explosion of the feral dog population. They believe that proper implementation of these regulations would be sufficient to control the population.Recently, Britain issued a warning to travelers to Turkey regarding stray dogs, which pointed out that they often form packs and can be aggressive. Visitors were advised to exercise caution and avoid approaching them.",Turkey's ruling party introduced a contentious bill in parliament aimed at addressing the country's rising stray dog population. The proposed legislation states that stray dogs would be removed from the streets and placed in shelters where they would undergo neutering and spaying. The proposal also requires municipalities to improve conditions in existing shelters and encourages people to adopt the dogs.,"https://static.toiimg.com/thumb/msid-111702984,imgsize-1311606,width-400,resizemode-4/111702984.jpg"
Nepal PM Prachanda approves rail deal with China ahead of no-confidence vote: Report,https://timesofindia.indiatimes.com/world/south-asia/nepal-pm-prachanda-approves-rail-deal-with-china-ahead-of-no-confidence-vote-report/articleshow/111703179.cms,"KATHMANDU: A day before Nepal Prime Minister Pushpa Kamal Dahal ' Prachanda ' lost a vote of confidence in Parliament, he gave a nod to an agreement to connect the Himalayan nation with China by rail under Beijing's ambitious Belt and Road Initiative. Quoting government sources, the MyRepublica news portal said this decision carries more operational than political significance and aligns with Nepal's participation in Chinese President Xi Jinping 's multi-billion-dollar pet infrastructure project.""The Cabinet meeting held on Thursday decided to approve the 'Strengthening the Development Cooperation in Building the Trans-Himalayan Multidimensional Connectivity Network' agreement between Nepal and China,"" the report quoted Communication Minister and the government's spokesperson Rekha Sharma as saying.However, a minister downplayed its immediate impact, stating, ""This is an initial decision; details of project implementation and BRI modalities are yet to be finalised.""'Prachanda' lost the vote of confidence in Parliament on Friday after coalition partner Communist Party of Nepal-Unified Marxist Leninist (CPN-UML) withdrew support for him, a development that will lead to the formation of a new government led by ex-prime minister K P Sharma Oli .Prachanda received only 63 votes in the 275-member House of Representatives (HoR) and there were 194 votes against the motion. At least 138 votes are needed to win the vote of trust. A total of 258 HoR members participated in the voting while one member abstained.Prachanda's move, made just before he departed from office, is viewed not only as progress towards implementing BRI projects but also crucial for initiatives like the Kerung-Kathmandu railway and broader infrastructure development along the Nepal-China border, the report said.Earlier, ahead of signing a power-sharing agreement with UML, the Nepali Congress had resolved to ""only accept grants and not loans under the BRI project"". The government was also set to decide on implementing the 2017 BRI agreement with China, which has been pending at the cabinet.The BRI has raised global concerns over China's debt diplomacy of extending huge loans to smaller countries for unsustainable infrastructure projects. The Hambantota port, which was funded by a Chinese loan, was leased to Beijing in a 99-year debt-for-equity swap in 2017 after Sri Lanka failed to pay off the debt.India has protested to China over BRI's USD 60 billion China-Pakistan Economic Corridor flagship project as it is being laid through the Pakistan-occupied Kashmir (PoK).",Cabinet meeting held on Thursday decided to approve the 'Strengthening the Development Cooperation in Building the Trans-Himalayan Multidimensional Connectivity Network' Prachanda's move is viewed not only as progress towards implementing BRI projects but also crucial for initiatives like the Kerung- Kathmandu railway.,"https://static.toiimg.com/thumb/msid-111703212,imgsize-714575,width-400,resizemode-4/111703212.jpg"
These Picassos prompted a gender war at an Australian gallery. Now the curator says she painted them,https://timesofindia.indiatimes.com/world/rest-of-world/these-picassos-prompted-a-gender-war-at-an-australian-gallery-now-the-curator-says-she-painted-them/articleshow/111703332.cms,"WELLINGTON: They were billed as artworks by Pablo Picasso , paintings so valuable that an Australian art museum 's decision to display them in an exhibition restricted to women visitors provoked a gender discrimination lawsuit. The paintings again prompted international headlines when the gallery re-hung them in a women's restroom to sidestep a legal ruling that said men could not be barred from viewing them.But the artworks at the center of the uproar were not really by Picasso or the other famed artists billed as their creators, it emerged this week when the curator of the women-only exhibition admitted she had painted them herself.Kirsha Kaechele wrote on the blog of Tasmania's Museum of Old and New Art (MONA) on Wednesday that she was revealing herself as the works' creator after receiving questions from a reporter and the Picasso Administration in France about their authenticity.But they had been displayed for more than three years before their provenance was questioned, she said, even though she had accidentally hung one of the fake paintings upside down.""I imagined that a Picasso scholar, or maybe just a Picasso fan, or maybe just someone who googles things, would visit the Ladies Lounge and see that the painting was upside down and expose me on social media,"" Kaechele wrote. But no one did.The saga began when Kaechele created a women-only area at MONA in 2020 for visitors to ""revel in the pure company of women"" and as a statement on their exclusion from male-dominated spaces throughout history.The so-called Ladies Lounge offered high tea, massages and champagne served by male butlers, and was open to anyone who identified as a woman. Outlandish and absurd title cards were displayed alongside the fake paintings, antiquities and jewelry that was ""quite obviously new and in some cases plastic,"" she added.The lounge had to display ""the most important artworks in the world,"" Kaechele wrote this week, in order for men ""to feel as excluded as possible.""It worked. MONA - famous in Australia for its strange and subversive exhibitions and events - was ordered by the Tasmanian Civil and Administrative Tribunal in March to stop refusing men entry to the Ladies Lounge after a complaint from a male gallery patron who was upset at being barred from the space during a 2023 visit.""The participation by visitors in the process of being permitted or refused entry is part of the artwork itself,"" tribunal Deputy President Richard Grueber wrote in his decision, which found the exhibition was discriminatory.Grueber ruled that the man had suffered a disadvantage, in part because the artworks in the Ladies Lounge were so valuable. Kaechele had described them to the hearing as ""a carefully curated selection of paintings by the world's leading artists, including two paintings that spectacularly demonstrate Picasso's genius.""The tribunal ordered MONA to cease refusing men entry. In his ruling, Grueber also lambasted a group of women who had attended in support of Kaechele wearing matching business attire and had silently crossed and uncrossed their legs in unison throughout the hearing. One woman ""was pointedly reading feminist texts,"" he wrote, and the group left the tribunal ""in a slow march led by Ms Kaechele to the sounds of a Robert Palmer song.""Their conduct was ""inappropriate, discourteous and disrespectful, and at worst contumelious and contemptuous,"" Grueber added.Rather than admit men to the exhibit, Kaechele -- who is married to the gallery's owner, David Walsh -- installed a working toilet in the space, turning it into a women's restroom in order to exploit a legal loophole to allow the refusal of men to continue.International news outlets covered the development in May, apparently without questioning that a gallery would hang Picasso paintings in a public restroom. However, the Guardian reported Wednesday that it had asked Kaechele about the authenticity of the work, prompting her confession.A spokesperson for MONA told The Associated Press that the gallery would not supply more detail about the letter Kaechele said she had received from the Picasso Administration. When the AP asked MONA to confirm that the statements in Kaechele's blog post, titled ""Art is Not Truth: Pablo Picasso,"" were accurate, the spokesperson, Sara Gates-Matthews, said the post was ""truthfully Kirsha's admission.""The Picasso Administration, which manages the late Spanish artist's estate, did not immediately respond to a request for comment.""I'm flattered that people believed my great-grandmother summered with Picasso at her Swiss chateau where he and my grandmother were lovers when she threw a plate at him for indiscretions (of a kind) that bounced off his head and resulted in the crack you see inching through the gold ceramic plate in the Ladies Lounge,"" Kaechele wrote this week, referring to the title card on one painting.""The real plate would have killed him - it was made of solid gold. Well, it would have dented his forehead because the real plate is actually a coin.""",Paintings by Pablo Picasso were displayed in an exhibition restricted to women. The gallery re-hung them in a women's restroom to sidestep a legal ruling that said men could not be barred from viewing them. The curator of the women-only exhibition admitted she had painted them herself.,"https://static.toiimg.com/thumb/msid-111703342,imgsize-1239209,width-400,resizemode-4/111703342.jpg"
Donors to pro-Biden super PAC are said to withhold Roughly $90 Million,https://timesofindia.indiatimes.com/world/us/donors-to-pro-biden-super-pac-are-said-to-withhold-roughly-90-million/articleshow/111703114.cms,"Some major Democratic donors have told the largest pro-Biden super political action committee, Future Forward , that pledges worth roughly $90 million are now on hold if President Joe Biden remains atop the ticket, according to two people who have been briefed on the conversations.The frozen contributions include multiple eight-figure commitments, according to the two people, who spoke on the condition of anonymity, given the sensitivity of the situation.The decision to withhold such enormous sums of money is one of the most concrete examples of the fallout from Biden's poor debate performance at the end of June.Future Forward declined to comment on any conversations with donors or the amounts of any pledged money being withheld. A Future Forward adviser would say only that the group expected contributors who had paused donations to return once the current uncertainty about the ticket was resolved.Separately, one donor to the group described being approached multiple times by Future Forward since the debate for a contribution but said he and his friends had been ""holding off.""The two people briefed on the frozen pledges declined to say which individual donors were pulling back promised checks, which were estimated to total around or above $90 million. It was not clear how much of the pledged money was earmarked for Future Forward's super PAC versus its nonprofit arm, which has also been running advertising in key battleground states.A separate person close to the group said the super PAC had been shying away from making major strategic decisions until it gets more clarity on who will be atop the ticket, though Chauncey McLean, the president of Future Forward, said that characterization was inaccurate in a statement: ""Our decisions are solely made in service of supporting President Biden based on the resources available to us.""An aide to one major Future Forward donor, billionaire Reid Hoffman, who has given $7 million to the super PAC, said that donors were making a mistake in withholding money.""A funding freeze is a problematic strategy at this point in the election cycle,"" said Rae Steward, who advises Hoffman on his giving. ""If donors are committed to making a statement by withholding capital from Future Forward or the Biden campaign,"" she said, then they should make larger donations to progressive nonprofit groups that are ""agnostic about who is at the top of the ticket.""Steward said that Hoffman had donated $3 million more to the super PAC last month, before the debate.The cash freeze comes as some advisers around Biden are discussing how to persuade the president to exit the race and as his campaign has begun to test Vice President Kamala Harris in head-to-head surveys of voters against former President Donald Trump . The number of congressional Democrats calling for Biden to step aside is growing by the day.The potential shortfall in super PAC cash comes as the campaign itself is bracing for a rough July fundraising period as major donors question Biden's viability to win in November.In a news conference Thursday evening, Biden dug in. ""I believe I'm the best qualified to govern,"" he said. ""And I think I'm the best qualified to win.""Future Forward was anointed by Biden's campaign as its leading super PAC in the early stages of the 2024 race, and it has already announced $250 million in television and digital advertising reservations set to begin at the end of the Democratic National Convention next month.A leaked poll from a group closely linked with Future Forward after the debate showed that the super PAC had tested the strength of potential Biden alternatives, including Harris, Gov. Gavin Newsom of California, Gov. Gretchen Whitmer of Michigan and Pete Buttigieg, the transportation secretary.The poll showed that Biden had a worse overall favorability rating than all the alternatives.The group convened donors just before the debate for a discussion on the state of its fundraising and the race, according to two people who attended the briefing. Officials with the group told donors that between the super PAC and its nonprofit arm, they hoped to raise $700 million or more for the election and had collected $430 million at that point.","Some major Democratic donors have told the largest pro-Biden super political action committee that pledges are now on hold. The frozen contributions include multiple eight-figure commitments, two people say. The decision to withhold such enormous sums of money is one of the most concrete examples of the fallout from Biden's poor debate performance at the end of June.","https://static.toiimg.com/thumb/msid-111703129,imgsize-882610,width-400,resizemode-4/111703129.jpg"
