Article Title,Article Link,Article Text,Article Summary,Article Image
US Supreme Court Justice Samuel Alito rejects Democrats’ calls to step away from Trump cases,https://timesofindia.indiatimes.com/world/us/us-supreme-court-justice-samuel-alito-rejects-democrats-calls-to-step-away-from-trump-cases/articleshow/110548804.cms,"US Supreme Court Justice Samuel Alito told lawmakers he won’t recuse from cases involving Donald Trump and the January 6 Capitol riot after revelations that flags associated with far-right causes flew over his homes in Virginia and New Jersey.Responding to Democratic calls that he disqualify himself, Alito said in two letters that his wife, Martha-Ann Alito , was responsible for flying the flags.“My wife is an independently minded private citizen,” he wrote. “She makes her own decisions, and I honor her right to do so.”The court is set to decide by the end of June whether Trump is immune from criminal charges that he illegally tried to overturn the results of the 2020 election. In a second case that could have implications for the Trump prosecution, the justices are also weighing an appeal by a man charged with being part of the Capitol assault.The New York Times reported that an upside-down American flag was displayed at Alito’s Virginia house in the days before President Joe Biden’s inauguration. More recently, an “Appeal to Heaven” flag flew at Alito’s beach residence in New Jersey, the Times said. Similar flags were carried by January 6 rioters.“My wife is fond of flying flags. I am not,” Alito wrote to Democratic lawmakers including Senator Dick Durbin of Illinois and Representative Hank Johnson of Georgia. “She was solely responsible for having flagpoles put up at our residence and our vacation home and has flown a wide variety of flags over the years.”Alito said his wife flew the upside-down flag during a “very nasty neighborhood dispute” during which a house displayed a sign personally attacking her and a man directed a vile epithet at her. He said he asked Martha-Ann Alito to take down the flag as soon as he saw it, “but for several days, she refused.”He said he presumed his wife was expressing a patriotic and religious message with the “Appeal to Heaven” flag and that neither Alito was aware of any connection to the “Stop the Steal Movement.”Johnson, the top Democrat on the House Judiciary subcommittee that oversees federal courts, said Alito’s response underscored the need for Congress to impose an enforceable code of conduct on the Supreme Court. The code adopted by the Supreme Court in November doesn’t include any enforcement mechanism.“Any unbiased and reasonable person would find laughable Justice Alito’s ‘the dog ate my homework, and I didn’t even know I had homework’ defense,” Johnson said in an emailed statement.Alito, 74, is one of the anchors of the conservative wing that controls the Supreme Court. Two years ago, he wrote the court’s opinion overturing the landmark Roe v. Wade ruling and eliminating the constitutional right to abortion.",US Supreme Court Justice Samuel Alito told lawmakers he won’t recuse from cases involving Donald Trump and the January 6 Capitol riot. The court is set to decide by the end of June whether Trump is immune from criminal charges that he illegally tried to overturn the results of the 2020 election.,"https://static.toiimg.com/thumb/msid-110548799,imgsize-59992,width-400,resizemode-4/110548799.jpg"
"'911 S5': Chinese national arrested, FBI takes down massive global army of zombie computer devices",https://timesofindia.indiatimes.com/world/us/911-s5-chinese-national-arrested-fbi-takes-down-massive-global-army-of-zombie-computer-devices/articleshow/110548700.cms,"The botnet operated by infecting residential Windows computers with malware, transforming them into ""zombie"" machines that could be controlled remotely.

What was the ""911 S5"" botnet?

The ""911 S5"" botnet was a vast network of malware-infected computers spanning nearly 200 countries. According to FBI Director Christopher Wray, it was ""likely the world's largest"" and facilitated numerous cybercrimes, including identity theft, financial fraud, and access to child exploitation materials.

Who was behind the botnet?

Yunhe Wang, a 35-year-old Chinese national, was identified as the administrator of the botnet. Wang was arrested in Singapore on May 24. He allegedly managed the network through 150 dedicated servers, half of which were leased from US-based service providers.

How did the botnet operate?

The botnet operated by infecting residential Windows computers with malware, transforming them into ""zombie"" machines that could be controlled remotely. Cybercriminals purchased access to these compromised computers, using them to carry out various illegal activities.

What kind of crimes were committed using the botnet?

Criminals used the botnet for a staggering array of crimes. These included identity theft, financial fraud, child exploitation, bomb threats, and cyberattacks. The botnet was also involved in defrauding financial institutions and federal lending programs, including pandemic relief scams. US Attorney General Merrick Garland stated that the criminals were responsible for over $5.9 billion in estimated losses from relief program fraud.

What assets were seized during the operation?

Law enforcement seized approximately $29 million in cryptocurrency, luxury goods valued at $4 million, and about $30 million in real estate. These assets were located in various countries, including Singapore, Thailand, Dubai, and others. Additionally, 22 domains associated with the botnet were also seized.

How did the law enforcement operation unfold?

The operation, named Operation Tunnel Rat, involved executing multiple search warrants and conducting interviews in Singapore and Thailand. The FBI, along with international partners, dismantled the botnet's infrastructure and arrested Wang. Authorities are also looking into the possibility of additional arrests.

How did the public get involved in this operation?

The FBI has set up a web page where individuals can check if their IP address was among those compromised by the botnet. This helps potential victims identify and mitigate any security issues stemming from the infection.

What happens next for Yunhe Wang?

The US is currently awaiting Wang's extradition from Singapore. Brett Leatherman, deputy assistant director with the FBI’s Cyber Division, emphasized the urgency of the extradition, stating, “We want him, you know, as soon as possible.”

An international law enforcement team has made a significant breakthrough in the fight against cybercrime, arresting a Chinese national and dismantling a massive botnet that has been operational for nearly a decade. This botnet, known as "" 911 S5 ,"" was responsible for various illegal activities, including identity theft, child exploitation, and financial fraud . The takedown involved cooperation between authorities in multiple countries, highlighting the global nature of cybercrime and the necessity of international collaboration to combat it.The botnet, managed by Yunhe Wang , infected millions of computers across nearly 200 countries. This network of compromised machines, often referred to as ""zombie"" computers, was used by criminals to carry out a wide array of illicit activities. The US Department of Justice and the FBI have been instrumental in this operation, which has led to significant financial and operational seizures, including millions in cryptocurrency and luxury assets.Here is all you need to know:(With inputs from agencies)","The ""911 S5"" botnet was a vast network of malware-infected computers spanning nearly 200 countries. Yunhe Wang, a 35-year-old Chinese national, was identified as the administrator of the botnet. Wang allegedly managed the network through 150 dedicated servers, half of which were leased from US-based service providers. Law enforcement seized approximately $29 million in cryptocurrency, luxury goods, and about $30 million in real estate.","https://static.toiimg.com/thumb/msid-110548747,imgsize-1251069,width-400,resizemode-4/110548747.jpg"
Violence clouds the last day of campaigning for Mexico's election,https://timesofindia.indiatimes.com/world/rest-of-world/violence-clouds-the-last-day-of-campaigning-for-mexicos-election/articleshow/110548139.cms,"MEXICO CITY: Mexico held the last day of campaigning Wednesday before Sunday's nationwide election, but the closing rallies were darkened by attacks on candidates and the country's persistently high homicide rate.Opposition candidate Xochitl Galvez started her last campaign rallies early Wednesday on the outskirts of Mexico City, and she focused her ire on President Andres Manuel Lopez Obrador 's ""hugs not bullets"" policy of not confronting the drug cartels .Galvez is facing the candidate of Lopez Obrador's Morena party , former Mexico City Mayor Claudia Sheinbaum. Sheinbaum, who leads in the race, has promised to continue all of Lopez Obrador's policies.""Are we going to continue with hugs, or are we going to apply the law to criminals?"" Galvez asked a cheering crowd. ""Mexico wants peace, wants tranquility.""Lopez Obrador has withdrawn funding for police forces and directed it to the quasi-military National Guard, which critics say lacks the professional and investigative abilities needed to fight the drug gangs. Galvez promised to return the funding to police forces and guarantee them wages of at least $1,200 per month.Galvez also pledged to reconcile a country that has been highly polarized by the outgoing president's rhetoric, saying ""enough division, enough hatred ... we are all Mexicans.""Sheinbaum held her final rally later Wednesday in Mexico City's vast, colonial-era central square. She delivered a strongly nationalistic speech to a large crowd.""Mexico is respected in the world, it is a reference point,"" Sheinbaum said, claiming that Lopez Obrador's government ""has returned to us the pride of being Mexicans.""""Mexico has changed, and for the better,"" she said.On the violence issue, Sheinbaum vowed to continue Lopez Obrador's policy of offering apprenticeships to encourage youths not to join drug cartels.""We will deepen the strategy of peace and security, and the progress that has been made,"" she said. ""This is not an iron fist"" policy, Sheinbaum said. ""This is justice.""While Lopez Obrador has increased the country's minimum wage and increased government benefit programs, he has been unable to significantly reduce the historically high homicide rate, which currently runs at more than 30,000 killings per year nationwide. That gang-fueled violence has also cast a shadow over the campaigns.A mayoral candidate in the western state of Jalisco was shot multiple times by intruders in his campaign offices late Tuesday. Two members of Gilberto Palomar's campaign staff were also wounded, and all three were hospitalized in serious condition, according to Jalisco state security coordinator Sanchez Beruben.Mexicans will vote Sunday in an election weighing gender, democracy and populism, as they chart the country's path forward in voting shadowed by cartel violence. With two women leading the contest, Mexico will likely elect its first female president. More than 20,000 congressional and local positions are up for grabs, according to the National Electoral Institute.Gunmen killed an alternate mayoral candidate in Morelos state, just south of Mexico City on Tuesday, state prosecutors said.Local media reported attackers on a motorcycle shot Ricardo Arizmendi five times in the head in the city of Cuautla in Morelos. Alternate candidates take office if the winner of a race is incapacitated or resigns.About 27 candidates, mostly running for mayor or town councils, have been killed so far this year. While that is not much higher than in some past elections, what is unprecedented is the mass shootings: candidates used to be killed in targeted attacks, but now criminals have taken to spraying whole campaign events with gunfire.","Mexicans will vote Sunday in an election weighing gender, democracy and populism. About 27 candidates, mostly running for mayor or town councils, have been killed so far this year. With two women leading the contest, Mexico will likely elect its first female president.","https://static.toiimg.com/thumb/msid-110548168,imgsize-1251559,width-400,resizemode-4/110548168.jpg"
"An Iceland volcano starts erupting again, shooting lava into the sky",https://timesofindia.indiatimes.com/world/europe/an-iceland-volcano-starts-erupting-again-shooting-lava-into-the-sky/articleshow/110547846.cms,"GRINDAVIK: A volcano in southwestern Iceland erupted Wednesday for the fifth time since December, spewing red lava that once again threatened the coastal town of Grindavik and led to the evacuation of the popular Blue Lagoon geothermal spa.The eruption began in the early afternoon following a series of earthquakes north of the town of 3,800 people that was largely evacuated in December when the volcano came to life after centuries of dormancy and put on an impressive show of nature's power.Although activity began to calm down by early evening, initial estimates found the eruption was the most vigorous in the area so far, as lava shot 50 meters (165 feet) into the sky from a fissure that grew to 3.5 kilometers (2.1 miles) in length, the Icelandic Meteorological Office said.Barriers built to protect Grindavik deflected the flowing lava that cut off two of the three roads leading to town and was close to reaching the third.""It's a much larger volume that's on the move right now headed for town,"" Grindavik Mayor Fannar Jonasson told national broadcaster RUV. ""The lava has already conquered (a lot).""Workers and anyone still in town were ordered to leave earlier in the day, police said.At one point, a dark plume of ash boiled up over the crater from an explosive interaction of magma hitting groundwater, scientists said.The cloud did not rise high enough to initially pose any threat to aviation, but scientists were closely monitoring the situation, Johanna Malen Skuladottir, of the Met Office, told RUV.Grindavik, which is about 50 kilometers (30 miles) southwest of Iceland's capital, Reykjavik, has been threatened since a swarm of earthquakes in November forced an evacuation in advance of the initial Dec. 18 eruption. A subsequent eruption overwhelmed some defensive walls and consumed several buildings.The area is part of the Svartsengi volcanic system that was dormant for nearly 800 years before reawakening.The volcano erupted again in February and March. The Feb. 8 eruption engulfed a pipeline, cutting off heat and hot water to thousands of people.Iceland, which sits above a volcanic hot spot in the North Atlantic, sees regular eruptions and is experienced at dealing with them. The most disruptive in recent times was the 2010 eruption of the Eyjafjallajokull volcano, which spewed huge clouds of ash into the atmosphere and led to widespread airspace closures over Europe.","Lava shoots 50 meters into the sky from a fissure that grew to 3.5 kilometers (2.1 miles) in length. At one point, a dark plume of ash boiled up over the crater from an explosive interaction of magma and groundwater. Grindavik has been threatened since a swarm of earthquakes in November forced an evacuation in advance of the initial Dec. 18 eruption.","https://static.toiimg.com/thumb/msid-110547861,imgsize-1684126,width-400,resizemode-4/110547861.jpg"
US to boycott UN tribute to Iranian President Ebrahim Raisi killed in helicopter crash,https://timesofindia.indiatimes.com/world/us/us-to-boycott-un-tribute-to-iranian-president-ebrahim-raisi-killed-in-helicopter-crash/articleshow/110547589.cms,"NEW DELHI: The United States will boycott a United Nations tribute on Thursday to Iranian President Ebrahim Raisi , who died earlier this month in a helicopter crash , according to a US official.The 193-member UN General Assembly traditionally meets to honor any sitting head of state at the time of their death. The tribute will include speeches about Raisi.""We won't attend this event in any capacity,"" a US official, speaking on condition of anonymity, told Reuters. The US boycott has not previously been reported.Iran 's mission to the United Nations in New York declined to comment. Raisi, a hardliner considered a potential successor to Supreme Leader Ayatollah Ali Khamenei, died when his helicopter crashed in poor weather near the Azerbaijan border on May 19.""The United Nations should be standing with the people of Iran, not memorializing their decades-long oppressor,"" said the US official. ""Raisi was involved in numerous, horrific human rights abuses, including the extrajudicial killings of thousands of political prisoners in 1988.""""Some of the worst human rights abuses on record, especially against the women and girls of Iran, took place during his tenure,"" the official said.The UN Security Council observed a moment of silence on May 20, at the start of an unrelated meeting, to honor the victims of the helicopter crash that killed Iranian President Ebrahim Raisi. Deputy US Ambassador to the UN, Robert Wood, reluctantly stood with his 14 counterparts during the tribute.The United States expressed its ""official condolences"" for Raisi's death, the State Department said on May 20. White House national security spokesperson John Kirby also said that day: ""No question this was a man who had a lot of blood on his hands.""The Biden administration faced strong criticism from some Republican members of Congress for offering condolences to Iran following Raisi's death.Raisi, 63, was elected president in 2021. During his tenure, he tightened morality laws, oversaw a bloody crackdown on anti-government protests, and pushed hard in nuclear negotiations with world powers.","The 193-member UN General Assembly traditionally meets to honor any sitting head of state at the time of their death. Raisi, a hardliner considered a potential successor to Supreme Leader Ayatollah Ali Khamenei, died when his helicopter crashed in poor weather near the Azerbaijan border.","https://static.toiimg.com/thumb/msid-110547620,imgsize-661121,width-400,resizemode-4/110547620.jpg"
"Power outages could linger for days after storms batter Texas again, leaving 1 dead",https://timesofindia.indiatimes.com/world/us/power-outages-could-linger-for-days-after-storms-batter-texas-again-leaving-1-dead/articleshow/110547156.cms,"HOUSTON: Power outages scattered across storm-weary Texas on Wednesday could linger into the weekend after storms flooded streets in Houston for the second time this month and ripped off roofs in Dallas, leaving a teenager dead and injuring others.The teen was killed Tuesday at a construction site while working on a home that collapsed, and three people at a campground were shocked by a downed power line. The severe weather left more than 1 million homes and businesses without electricity at one point.Electric utility Oncor said power in the Dallas area should be restored by Friday for most customers, but some outages will continue into the weekend. More than 1 million homes and businesses were without electricity across Texas at one point, but by Wednesday afternoon, the lights had come back on for about 70% of those customers.Houston was flooded and damaged just weeks after a storm walloped the area, killing eight people. The 16-year-old worker was killed northeast of the city, in the suburb of Magnolia. He was a construction company employee, the Montgomery County Sheriff's Office said.A 6-year-old boy and two others who were shocked by the downed power line at a campground north of Houston were in critical condition, authorities said.Witnesses saw a 59-year-old man touch the line Tuesday, but investigators were trying to determine how the two others were shocked, Montgomery County Fire Marshal Jimmy Williams said Wednesday.A couple driving during the storm in the Houston suburb of Spring missed a turn and then spotted a pickup truck submerged in a culvert.Ashley Renee Young said her boyfriend, Robert Chance, grabbed a sledgehammer from his toolbox, broke the back window and pulled out the driver, who only suffered minor cuts from broken glass. They then bought the man a shirt from a nearby gas station before driving him home.""I think we have lifelong friends now,"" Young said.The potential for heavy rains, localized flash flooding and severe weather continued Wednesday through Oklahoma and Texas. Thunderstorms were predicted late Wednesday and Thursday across eastern Montana and Wyoming and northeast Colorado before pushing into Nebraska, Kansas, Oklahoma and northern Texas.Tuesday's power outages in the Dallas area prompted officials to extend voting by two hours in the state's runoff elections after dozens of polling places lost electricity amid 80 mph winds (129 kph) that caused extensive damage.Social media posts showed winds pushing an unoccupied American Airlines plane away from a gate at Dallas-Fort Worth International Airport. No one was injured, but the airport said about 500 flights were canceled because of the weather.The National Weather Service said the ""very active and highly impactful"" weather pattern will continue in the central US over the next several days.Destructive storms over the Memorial Day weekend killed 24 people in seven states across the South, the deaths stretching from Texas to Virginia.","More than 1 million homes and businesses were without electricity across Texas at one point. Power in the Dallas area should be restored by Friday for most customers, Oncor says. The potential for heavy rains, localized flash flooding and severe weather continued Wednesday through Oklahoma and Texas. Thunderstorms predicted late Wednesday and Thursday across eastern Montana and Wyoming.","https://static.toiimg.com/thumb/msid-110547219,imgsize-1905065,width-400,resizemode-4/110547219.jpg"
UK parliament dissolved ahead of general election,https://timesofindia.indiatimes.com/world/uk/uk-parliament-dissolved-ahead-of-general-election/articleshow/110546979.cms,"The British parliament was dissolved on Thursday, as the five-week campaign period begun leading up to the general election on July 4.The election is expected to bring the Labour party back to power after 14 years of Conservative rule. As the clock struck one minute past midnight, all 650 seats of members of parliament (MPs) became vacant, marking the official commencement of the electoral process.Prime Minister Rishi Sunak 's election announcement, which took place amidst a heavy downpour, has been seen by many as a shaky start to the campaign, with some interpreting the rain as an ill omen.Sunak's decision to hold the election on July 4, earlier than anticipated, is viewed as an attempt to regain momentum as his party's popularity wanes in opinion polls. Meanwhile, the Labour party, led by former human rights lawyer Keir Starmer, is poised to capitalize on the opportunity to regain power after 14 years in opposition.The ruling Conservative party is not only trailing significantly behind Labour in the polls but also facing a mass exodus of parliamentarians. An unprecedented 129 MPs, including 77 Conservatives, have announced their decision not to seek re-election, reflecting the bleak prospects of victory for the governing party. Some Tory MPs have expressed frustration at being caught off guard by the July election date, with Secretary of State for Northern Ireland Steve Baker opting to continue his vacation in Greece while preparing his campaign remotely.Despite Sunak's efforts to promote the Conservatives as the ""safe"" option during his campaign travels across the country, his campaign has encountered some early setbacks. A visit to the site where the Titanic was built drew comparisons between his leadership and captaining a sinking ship. Sunak's campaign has focused on appealing to older voters and right-wing supporters, with pledges to bring back national service and a substantial tax break for pensioners. However, these efforts have done little to boost the party's favor, with polls indicating a significant lead for Labour.Labour, on the other hand, is aiming to capitalize on the public's fatigue with the Conservatives, who have seen five prime ministers since 2016, along with numerous scandals and economic challenges. The party has sought to position itself as the ""natural party of business,"" garnering the support of 120 industry leaders this week. Under the leadership of Keir Starmer, Labour has shifted towards the center in an attempt to win back voters, including by expelling former leader Jeremy Corbyn and taking steps to address anti-Semitism within the party.However, the past week has also exposed long-standing factional divisions within Labour, with MP Diane Abbott expressing dismay at the party's desire to bar her from candidacy. Starmer has faced criticism from leftist voters who accuse him of backtracking on promises made during his successful leadership campaign. As the campaign progresses, both parties will need to navigate internal challenges while presenting a compelling vision to the electorate.(With AFP inputs)","The British parliament was dissolved on Thursday, as the five-week campaign period begun leading up to the general election on July 4. The election is expected to bring the Labour party back to power after 14 years of Conservative rule. The ruling Conservative party is not only trailing significantly behind Labour in the polls but also facing a mass exodus of parliamentarians.","https://static.toiimg.com/thumb/msid-110547082,imgsize-1966261,width-400,resizemode-4/110547082.jpg"
