Article Title,Article Link,Article Text,Article Summary,Article Image
"Donald Trump's documents trial start delayed indefinitely, judge orders",https://timesofindia.indiatimes.com/world/us/donald-trumps-documents-trial-start-delayed-indefinitely-judge-orders/articleshow/109931196.cms,"(With inputs on agencies)

NEW DELHI: Former US President Donald Trump's trial in Florida, where he faces charges of illegally keeping classified documents after his presidency ended, was indefinitely postponed by US District Judge Aileen Cannon on Tuesday.Originally, Trump's trial in the documents case , brought by Special Counsel Jack Smith, was set to begin on May 20. However, both the prosecution and defense acknowledged that this date would need to be postponed.Judge Cannon, appointed to the bench by Trump in 2020, confirmed the trial would not start on May 20 but did not provide a new date. Instead, she scheduled pre-trial hearings to continue through July 22.Trump has entered a plea of not guilty to 40 federal counts , which accuse him of ""retaining sensitive national security documents at his Mar-a-Lago estate in Florida after leaving office in 2021 and obstructing US government efforts to retrieve them."" As the Republican candidate challenging Democratic President Joe Biden, who defeated him in the previous election, Trump faces significant challenges.Smith encounters substantial obstacles in getting either federal case against Trump to trial before the election. Cannon has yet to make rulings on several critical legal issues in the documents case and has indicated support for Trump's defense on some matters. Trump's lawyers had argued for a trial date after the election, but also suggested August 12 in response to Cannon's order to propose a timeline. Smith, on the other hand, proposed a July start date.Randall Eliason, a law professor at George Washington University and an expert in white-collar criminal cases, commented on the unprecedented situation, stating, ""We're in this absolutely unprecedented situation where a defendant is potentially going to have the power to shut down his own prosecution. That's an argument for getting the case to trial before the election.""In addition to the federal cases, Trump has been on trial in New York state court since April 15, facing charges of unlawfully seeking to conceal hush money paid to porn star Stormy Daniels before the 2016 election. He has also been charged in Georgia state court over his attempts to overturn the 2020 election results.",Former US President Donald Trump's trial in Florida has been indefinitely postponed. He faces charges of illegally keeping classified documents after his presidency ended. Trump has entered a plea of not guilty to 40 federal counts. He has also been charged in Georgia state court over his attempts to overturn 2020 election results.,"https://static.toiimg.com/thumb/msid-109931186,imgsize-1702472,width-400,resizemode-4/109931186.jpg"
Israeli tanks enter Rafah & take over border crossing with Egypt,https://timesofindia.indiatimes.com/world/middle-east/israeli-tanks-enter-rafah-take-over-border-crossing-with-egypt/articleshow/109929891.cms,"Israel's military said Tuesday that it had sent tanks into Rafah and established control over the Gaza Strip side of the border crossing with Egypt in what it called a limited operation. The move halted the flow of aid into the enclave, drawing immediate condemnation from international officials.The military said the incursion was aimed at destroying Hamas fighters and infrastructure in Rafah that were used in an attack that killed four Israeli soldiers over the weekend near the Kerem Shalom border crossing.It did not appear to be the long-promised full ground invasion of Rafah, which Israel's allies have been working to avert by pushing for a truce deal.It came after a dizzying day that saw Israel order people to evacuate parts of the city, then Hamas claims that it had accepted the terms of a ceasefire, followed by an announcement by Israel's military that it was carrying out ""targeted strikes"" in eastern Rafah.PM Benjamin Netanyahu is facing pressure to agree to a ceasefire with Hamas that is backed by the US and Arab nations and that would secure the release of hostages still held in Gaza. Analysts say Israel's actions in Rafah could either ratchet up the pressure on Hamas to make a deal or sabotage the talks.But the Israeli PM sounded defiant Tuesday, saying that Hamas' positive response to the ceasefire proposal the previous day ""was meant to torpedo"" troops' entry into Rafah. ""That didn't happen,"" he said, adding that he had sent a ""working-level"" delegation back to Cairo to continue the talks while ""in tandem, we continue waging the war on Hamas.""The head of a hospital in Rafah said that 27 bodies and 150 wounded people had been brought to his facility since the start of the incursion, and humanitarian agencies said that no aid was passing through the Rafah crossing. UN officials said Israeli troops had now ""choked off"" both the Rafah and Kerem Shalom crossings, the two main routes for getting aid into Gaza, and warned that the humanitarian crisis in the enclave would worsen.Israel's military declined to say how long it planned to stay in Rafah, calling Tuesday's incursion ""a very precise"" counterterrorism operation. Israeli defence minister Yoav Gallant said the operation there would continue until the last Hamas brigade in the city was destroyed ""or until the return of the first hostage to Israel"". Troops found three tunnel shafts in the area near the crossing, and about 20 militants were killed during the operation, the military said in a statement, without offering evidence. Israel has long viewed Gaza's border with Egypt as a main route for smuggling arms into the coastal enclave.","Israel's military said the incursion was aimed at destroying Hamas fighters and infrastructure in Rafah. The move halted the flow of aid into the enclave, drawing immediate condemnation from international officials. It did not appear to be the long-promised full ground invasion of Rafah, which Israel's allies have been working to avert.","https://static.toiimg.com/thumb/msid-109929954,imgsize-1461754,width-400,resizemode-4/109929954.jpg"
US has been holding up several weapons shipments to Israel for 2 weeks: Report,https://timesofindia.indiatimes.com/world/middle-east/us-has-been-holding-up-several-weapons-shipments-to-israel-for-2-weeks-report/articleshow/109930049.cms,"WASHINGTON: US President Joe Biden's administration has been holding up certain Boeing-made arms shipments to Israel, four sources familiar with the matter told Reuters, in what two of them said was an apparent political message to the close US ally.The shipments, which have been delayed for at least two weeks, involved Boeing-made Joint Direct Attack Munitions, which convert dumb bombs into precision-guided ones, as well as Small Diameter Bombs.The sources did not elaborate further.The White House and Pentagon declined comment. The news of a delayed arms shipment was first reported by Axios over the weekend and Politico first reported on the types of arms delayed and the reasoning on Tuesday.Without addressing whether there had been a suspension in arms shipments, the Pentagon said on Monday that there had not been a policy decision to withhold arms from Israel, America's closest Middle East ally.Still, the delays appeared to be the first since Biden's administration offered its full support to Israel following Hamas' Oct. 7 attack, which killed about 1,200 people with about 250 others abducted, of whom 133 are believed to remain in captivity in Gaza, according to Israeli tallies.Israel's campaign to destroy Hamas has led to a seven-month-long military campaign that has killed a total of 34,789 Palestinians, most of them civilians, the Gaza Health Ministry said.The conflict has also left many of Gaza's 2.3 million people on the brink of starvation and sparked protests in the US demanding that universities and Biden withdraw support for Israel -- including the provision of weaponry.A senior Israeli official, speaking to Reuters on condition of anonymity, did not confirm any specific hold-up in arms supplies but appeared to take the reports in stride: ""As the prime minister has already said, if we have to fight with our fingernails, then we'll do what we have to do.""","US President Joe Biden's administration has been holding up certain Boeing-made arms shipments to Israel, sources say. The shipments, which have been delayed for at least two weeks, involved Joint Direct Attack Munitions. The Pentagon said on Monday that there had not been a policy decision to withhold arms from Israel.","https://static.toiimg.com/thumb/msid-109930138,imgsize-1159447,width-400,resizemode-4/109930138.jpg"
Hamas' offer to hand over 33 hostages includes some who are dead,https://timesofindia.indiatimes.com/world/middle-east/hamas-offer-to-hand-over-33-hostages-includes-some-who-are-dead/articleshow/109930212.cms,"WASHINGTON: Hamas informed negotiators Monday that not all of the 33 hostages who would be freed in the first phase of a possible cease-fire deal with Israel are still living and that the remains of those who have died would be among the initial releases, according to two people familiar with the talks.The disclosure came as part of Hamas' counteroffer to Israel's latest proposal, which envisions a first-phase, six-week cease-fire in exchange for the return of some of the hostages taken during the Oct.7 terrorist attacks. It was not clear whether Hamas revealed how many of the 33 are still alive and how many are dead .The first group of hostages meant to be freed in the initial phase of the proposed agreement is supposed to include women, older men, and the sick and wounded who are among the more than 100 believed still to be held captive. The Israelis initially wanted 40 to be released in the first phase but came to understand that Hamas did not hold that many who fit the criteria. Israeli and US officials have long assumed that some of the hostages may be dead.The news that the first group of hostages to be released would include the remains of some taken seven months ago will surely upset families who have been pressing the Israeli government to do more to free their loved ones. The fate of the hostages has become a major issue with the Israeli public as thousands of demonstrators have poured into the streets to pressure Prime Minister Benjamin Netanyahu's government to make a deal. Protesters blocked major roads in Jerusalem and Tel Aviv late Monday after Hamas' counteroffer.Israeli officials said that the Hamas counteroffer was not acceptable, but they have agreed to keep negotiating. Officials from various countries serving as intermediaries will gather again in Cairo this week to go over the counteroffer and see if further progress can be made. Israel has agreed to send a delegation to review the proposal and contemplate further concessions.",The disclosure came as part of Hamas' counteroffer to Israel's latest proposal. It was not clear whether Hamas revealed how many of the 33 are still alive and how many are dead. Israel has agreed to send a delegation to review the proposal and contemplate further concessions.,"https://static.toiimg.com/thumb/msid-109930281,imgsize-1091882,width-400,resizemode-4/109930281.jpg"
"Spankings, satin PJs and Hugh Hefner’s mention: Stormy details Trump meet",https://timesofindia.indiatimes.com/world/us/spankings-satin-pjs-and-hugh-hefners-mention-stormy-details-trump-meet/articleshow/109930687.cms,"NEW YORK: Stormy Daniels testified on Tuesday that Donald Trump greeted her in pajamas in his hotel room in 2006 where she spanked him at his request, telling jurors about the alleged encounter that would ultimately lead to the first criminal trial of a former US president.Wearing a black outfit and black glasses, Daniels, 45, said she grew annoyed by Trump's frequent interruptions and asked him: ""Are you always this arrogant and pompous?""She said Trump dared her to spank him, and she obliged.""That's bullshit,"" Trump appeared to say as he watched from the defendant's table.By midmorning, Daniels had yet to testify about the sexual intercourse she has said took place at that meeting. Her testimony was expected to resume after a break.Trump, 77 and the Republican candidate for president this year, is accused of falsifying business records to cover up a $130,000 payment to Daniels to buy her silence during the 2016 election. He has pleaded not guilty and denies having had sex with Daniels, whose real name is Stephanie Clifford.She said she met Trump at a Lake Tahoe golf tournament at which Trump was a competitor. She said he took note when an associate mentioned Daniels directed films, too.""He said, 'Oh, you direct too - you must be the smart one,'"" Daniels testified.Daniels told jurors that later in the day, Trump's bodyguard approached her and said Trump would like her to join him for dinner.""F no,"" Daniels said when asked how she initially responded.She said she changed her mind after a publicist convinced her the dinner could make a great story.When she arrived at his hotel suite, Trump greeted her wearing only satin pajamas.""I said, 'Does Hugh Hefner know you stole his pajamas?'"" Daniels recalled saying, referring to Playboy impresario Hugh Hefner.Daniels told Trump to change, and he politely obliged, she said. The alleged encounter took place while Trump was married to his current wife, Melania. Trump denies any sexual encounter with Daniels.Trump passed a note to his defense lawyer on Tuesday and sometimes appeared to close his eyes while listening to her testimony.After the break, Justice Juan Merchan told prosecutors to pull back on details of the encounter. ""The degree of detail that we're going into is just unnecessary,"" he said.Merchan had previously ruled that Daniels would be allowed to tell jurors that she had sex with Trump, over the objections of Trump's legal team.Prosecutor Susan Hoffinger said the testimony was needed to complete the story and establish Daniels' credibility.""In terms of the sexual act, it will be just very basic. It's not going to involve descriptions of genitalia or anything of that nature,"" Hoffinger said.Trump, running again for president in the Nov. 5 election, has pleaded not guilty to 34 felony counts of falsifying business records.Prosecutors have shown the former president's signature was on payments at the heart of the case. They say Trump falsely labeled payments to his lawyer Michael Cohen in 2017 as legal expenses, when they actually were reimbursements for the $130,000 hush-money payment, which Cohen had made to Daniels.Prosecutors say that amounts to an illegal scheme to influence the 2016 election by buying the silence of people with potentially damaging information.Trump's lawyers have suggested Daniels was seeking a role on Trump's reality TV show, ""The Apprentice.""Daniels has been at the receiving end of some of Trump's vitriolic attacks on social media.Merchan, who is hearing the case, has said some of those posts violated a gag order restricting Trump from speaking about witnesses, jurors, and others involved in the case if those statements are meant to influence the proceedings.Trump has been fined $10,000 so far for violating a gag order that prevents him from talking about witnesses. Merchan has warned Trump could be jailed if he keeps up his attacks.Trump has called the gag order a violation of his free speech rights and says the trial is an attempt to hobble his attempt to win back the White House from Democratic President Joe Biden.The case is widely seen as less consequential than three other criminal prosecutions Trump faces, but it is the only one certain to go to trial before the election.The other cases charge Trump with trying to overturn his 2020 presidential defeat and mishandling classified documents after leaving office. Trump has pleaded not guilty to all three.","Stormy Daniels testifies that Donald Trump dared her to spank him. Trump denies any sexual encounter with Daniels. Trump is accused of falsifying business records to cover up a $130,000 payment to Daniels. He has pleaded not guilty and denies having had sex with Daniels, whose real name is Stephanie Clifford.","https://static.toiimg.com/thumb/msid-109930718,imgsize-2142795,width-400,resizemode-4/109930718.jpg"
"Maldives urges Indians to 'be a part' of its tourism, says country's economy 'depends' on it",https://timesofindia.indiatimes.com/world/rest-of-world/maldives-urges-indians-to-be-a-part-of-its-tourism-says-countrys-economy-depends-on-it/articleshow/109892161.cms,"(With inputs from agencies)

NEW DELHI: The Maldivian tourism minister , Ibrahim Faisal, has appealed to Indian tourists to continue visiting the archipelago nation, emphasising the historical ties between the two countries.In an interview with PTI Videos, Faisal stated, ""We have a history. Our newly elected government also wants to work together (with India). We always promote peace and a friendly environment.Our people and the government will give a warm welcome to Indian arrivals. As the Tourism Minister, I want to tell Indians to please be a part of Maldives' tourism. Our economy depends on tourism.""The minister's plea comes amidst a significant decline in Indian tourist arrivals following derogatory remarks made by three Maldivian officials against India and Prime Minister Narendra Modi on social media.The backlash led to numerous cancellations and a drop in India's position from the top visitor country to the sixth position after January. According to a report by sun.mv, tourist arrivals from India declined by 42 per cent in the first four months of this year compared to the same period last year.The strained relations between India and the Maldives have been attributed to the new administration led by President Mohamed Muizzu, who is widely seen as a pro-China leader.Since assuming office in November last year, Muizzu has maintained his election promise of evicting Indian military personnel from the Maldives, forcing the withdrawal of 88 Indian military personnel manning three aviation platforms gifted by India. Muizzu has previously accused India of meddling in the affairs of the Maldives and won the presidential elections in September last year with an ""India Out"" campaign.Despite the current challenges, the Maldives remains a key maritime neighbour for India in the Indian Ocean Region and holds a special place in India's initiatives like 'SAGAR' and the 'Neighbourhood First Policy' of the Modi government. The Maldivian tourism minister's appeal highlights the importance of maintaining strong bilateral ties and the significance of Indian tourists for the Maldivian economy.",Maldivian tourism minister Ibrahim Faisal has appealed to Indian tourists to continue visiting the archipelago nation. The minister's plea comes amidst a significant decline in Indian tourist arrivals following derogatory remarks made by three Maldivian officials against India and Prime Minister Narendra Modi.,"https://static.toiimg.com/thumb/msid-109892193,imgsize-1291627,width-400,resizemode-4/109892193.jpg"
"Ex-Kazakh minister 'beats' wife to death in 8-hour attack at restaurant, caught on CCTV",https://timesofindia.indiatimes.com/world/rest-of-world/ex-kazakh-minister-beats-wife-to-death-in-8-hour-attack-at-restaurant-caught-on-cctv/articleshow/109834675.cms,"(With agency inputs)

NEW DELHI: The trial of Kazakhstan’s former economy minister Kuandyk Bishimbayev for the murder of his wife, Saltanat Nukenova, has shocked the nation, with thousands calling for harsher penalties for domestic violence .CCTV footage depicted the minister dragging his wife by her hair, and subsequently punching and kicking her. Following the recorded incident, Nukenova succumbed to brain trauma.The footage, spanning eight hours, also captured Bishimbayev breaking down a door as Nukenova attempted to seek refuge in a bathroom.Nukenova, aged 31, was discovered dead in November within a restaurant owned by one of Bishimbayev’s relatives. Initially denying involvement, Bishimbayev confessed in court on Wednesday to assaulting her and inadvertently causing her demise.Bishimbayev's legal team contested medical evidence suggesting Nukenova died from repeated head trauma . They attempted to portray her as prone to jealousy and violence, despite no evidence from the restaurant's security cameras showing her attacking Bishimbayev.Bishimbayev, 44 years old, once celebrated as a modern, Western-educated figure within the Kazakhstani government under former leader Nursultan Nazarbayev, was incarcerated for bribery in 2018. He was later granted a pardon, less than two years into his sentence.A 2018 study supported by UN Women revealed approximately 400 women in Kazakhstan die annually due to domestic violence, with many cases going unreported.In 2017, Kazakhstan decriminalized certain forms of domestic violence, categorizing them as causing ""minor"" physical damage, punishable by fines or brief imprisonment. This move mirrored Russia's actions that year, provoking outrage among advocates for women’s rights. Kazakhstan has since reversed this legislation, intensifying penalties for offenders and introducing new criminal charges, including harassment of minors.","Kuandyk Bishimbayev is on trial for the murder of his wife, Saltanat Nukenova. CCTV footage depicted the minister dragging his wife by her hair, and subsequently punching and kicking her. Following the recorded incident, Nukanova succumbed to brain trauma.","https://static.toiimg.com/thumb/msid-109835052,imgsize-1248758,width-400,resizemode-4/109835052.jpg"
"No pilots needed: US Air Force set to have over 1,000 AI-flown jets soon",https://timesofindia.indiatimes.com/world/us/no-pilots-needed-us-air-force-set-to-have-over-1000-ai-flown-jets-soon/articleshow/109883372.cms,"NEW DELHI: In the US Air Force, Artificial Intelligence is set to take the driver seat instead of a conventional pilot controlling the Air Force jet. US Air Force Secretary Frank Kendall flew a fighter jet on Friday that was piloted by AI over the deserts in California, as reported by Fox news.Last month, Kendall announced his intention to pilot an AI-controlled F-16 to the US Senate appropriations committee’s defense panel, discussing the future of air warfare relying on autonomously operated drones.On Friday, the senior Air Force leader carried out his plans, achieving what might be one of the most significant advancements in military aviation since the introduction of stealth planes in the early 1990s.According to Fox news, the US Air Force plans to have more than 1,000 AI-flown planes in commission, with the first in operation by 2028Kendall traveled to Edwards Air Force base, which is the same desert facility where Chuck Yeager broke the sound barrier, to observe and participate in AI flight in real time.""It’s a security risk not to have it. At this point, we have to have it,"" the secretary said.The F-16, controlled by artificial intelligence and named Vista, flew Kendall in maneuvers that reached speeds exceeding 550 mph, exerting a pressure on his body equivalent to nearly five times the force of gravity.A human-piloted F-16 was flying alongside Vista and Kendall. The two jets raced within 1,000 feet of each other, performing twists and loops in an attempt to make their opponent surrender.He said that he had seen sufficient evidence to have faith in the AI technology when determining whether to use weapons in a war.Kendall said that human oversight will always be involved in the consideration of weapons.The US Air Force plans to have a fleet of more than 1,000 AI-operated drones, with the first one expected to be operational by 2028.In March, the Pentagon announced its plans to develop new artificial intelligence-guided planes. It offered two contracts to several private companies for them to compete against each other to win.The CCA project, known as the Collaborative Combat Aircraft project, is a component of a program worth $6 billion.The companies that are competing for the contract are Boeing, Lockheed Martin, Northrop Grumman, General Atomics, and Anduril Industries.The Pentagon is interested in pursuing the project because cost-cutting is one of the elements of AI that appeals to them.In August 2023, deputy secretary of fefense Kathleen Hicks said deploying AI-enabled autonomous vehicles would provide ""small, smart, cheap and many' expendable units to the US military, helping overhaul the ""too-slow shift of US military innovation.""","US Air Force Secretary Frank Kendall flew a fighter jet on Friday that was piloted by AI over the deserts in California. The F-16, controlled by artificial intelligence and named Vista, flew Kendall in maneuvers that reached speeds exceeding 550 mph. The US Air Force plans to have a fleet of more than 1,000 AI- operated drones.","https://static.toiimg.com/thumb/msid-109883929,imgsize-64848,width-400,resizemode-4/109883929.jpg"
