Article Title,Article Link,Article Text,Article Summary,Article Image
Imran Khan appears before Pakistan's top court via video link,https://timesofindia.indiatimes.com/world/pakistan/imran-khan-appears-before-pakistans-top-court-via-video-link/articleshow/110178842.cms,"ISLAMABAD: Incarcerated former Pakistan prime minister Imran Khan on Thursday appeared before the Supreme Court via a video link in a case about changes in the anti-corruption laws . The development comes after Chief Justice Qazi Faez Isa on Tuesday while hearing an appeal by the government against annulment of certain changes in the National Accountability Bureau (NAB) laws by the previous government had ordered the authorities to present Khan virtually for his statement.Khan, 71, had challenged the tweaks in the NAB laws and the top court in September last year had accepted his plea which reopened dozens of cases of alleged corruption against some leading politicians, including Nawaz Sharif.A five-member Supreme Court larger bench, headed by Chief Justice Qazi Faez Isa and comprising Justice Amin-ud-Din Khan, Justice Jamal Khan Mandokhail, Justice Athar Minallah and Justice Hasan Azhar Rizvi heard the case.Khan appeared as a petitioner through video link in the case, but the hearing was not live streamed unlike the current practice, which had been in vogue since the top judge started it last year after becoming the chief justice.Consequently, Khan's followers could not see him live for the first time since he was arrested in August last year.However, his party, the Pakistan Tehreek-e-Insaf (PTI) shared a picture of the purported video call, with a laptop screen showing Khan seated in a room wearing a light-blue shirt, and seemingly uninterested as he rested his face on his hand.The party in a statement said that there was no live stream from the apex court as the registrar maintained that it was the prerogative of the bench to decide if or not the hearing is to be broadcasted live.""Judicial process demands fairness and openness, (and) transparency can only be ensured through public view of proceedings. Refusal to stream proceedings advances unfairness and non-transparency and must be condemned. CJ has changed the process unilaterally and has discredited his own decision that brought him fame soon after he took over,"" Khan's party said.Khan has been charged in several cases, including cypher and unlawful marriage, and has remained imprisoned even though he had obtained bail in some other cases.""Earlier today, on the orders of the Supreme Court, arrangements were completed at the Adiala Jail for the appearance of the PTI founder,"" a jail source said.Khan was arrested in August last year and since then has been incarcerated, first in the Attock Jai and now in Adiala Jail and out of sight.His appearance in court comes a day after two courts granted him relief in separate cases, including the Al-Qadir Trust matter. A division of the high court led by Chief Justice Aamer Farooq and Justice Tariq Mahmood Jahangiri granted him bail in the RS 60 billion case, while Judicial Magistrate Suhaib Bilal Ranjha also acquitted him in a case registered against him at the Khanna police station in connection with the Azadi March in 2022.The cases against Khan and other party leaders were registered over violation of Section 144.Despite the relief, his party showed apprehensions about a ban on visitors in the Adiala jail, saying the move aimed to keep Khan away from the apex court proceedings.A three-member bench of the apex court in September 2023 had approved Khan's petition challenging amendments made to the country's accountability laws during the tenure of the previous Pakistan Democratic Movement (PDM)-led government.","Imran Khan appeared before the Supreme Court via a video link in a case about changes in the anti-corruption laws. Khan, 71, had challenged the tweaks in the NAB laws and the top court in September last year had accepted his plea. The hearing was not live streamed unlike the current practice.","https://static.toiimg.com/thumb/msid-110178893,imgsize-24226,width-400,resizemode-4/110178893.jpg"
Pakistan's government completes preparations for Imran Khan's virtual appearance in Supreme Court today,https://timesofindia.indiatimes.com/world/pakistan/pakistans-government-completes-preparations-for-imran-khans-virtual-appearance-in-supreme-court-today/articleshow/110165430.cms,"ISLAMABAD: The Pakistan federal government has finalised the preparations for Pakistan-Tehreek-e-Insaf founder Imran Khan 's appearance before the apex court bench via video call in the National Accountability Bureau (NAB) amendments case, scheduled to be held today (Thursday), reported ARY News, citing sources.This will be the first appearance of the incarcerated former Pakistan premier since his arrest in August last year in the Toshakhana case.The Adiala Jail administration has completed the arrangements for the PTI founder's Supreme Court appearance via video link on the orders of the apex court, the sources said.However, they added that it is up to the former prime minister if he appears before the bench or not, as reported by ARY News.Earlier, the Supreme Court allowed Imran Khan to attend court proceedings in the NAB amendments case via video link.A five-member bench headed by Chief Justice of Pakistan (CJP) Justice Qazi Faez Isa and comprising Justice Amin-Ud-Din Khan, Justice Jamal Mandokhail, Justice Athar Minallah and Justice Hassan Azhar heard the government's pleas, challenging the NAB amendments verdict.Consequently, the five-judge bench retired to discuss among themselves and then ordered the federal and Punjab governments to facilitate Khan's appearance via video link from Adiala jail.The federal government filed the review plea in the NAB amendments case under the Supreme Court Practice and Procedure Law and made the Federation of Pakistan, National Accountability Bureau and PTI founder respondents, ARY News reported.It further pleaded with the apex court to nullify its decision in the case, citing no violation of basic rights under the NAB amendments. ""Legislation is the right of Parliament,"" the plea said.In September last year, the apex court of Pakistan struck down amendments made to National Accountability Bureau laws as it announced its reserved verdict on the PTI founder's plea.In a 2-1 majority verdict, the top court approved Imran Khan's petition challenging amendments made to the country's accountability laws during the tenure of the previous Pakistan Democratic Movement (PDM)-led government.Meanwhile, the Supreme Court also restored graft cases against public office holders that were closed down following the amendments to NAB laws, reported ARY News.",The Pakistan federal government has finalised the preparations for Imran Khan's appearance before the apex court bench via video call. This will be the first appearance of the incarcerated former Pakistan premier since his arrest in August last year. The Adiala Jail administration has completed the arrangements for the PTI founder's Supreme Court appearance via video link.,"https://static.toiimg.com/thumb/msid-110165744,imgsize-556668,width-400,resizemode-4/110165744.jpg"
"'India landed on moon, while we ... ': Pakistani lawmaker highlights lack of amenities in Karachi",https://timesofindia.indiatimes.com/world/pakistan/india-landed-on-moon-while-we-pakistani-lawmaker-highlights-lack-of-amenities-in-karachi/articleshow/110162352.cms,"NEW DELHI: Pakistani lawmaker Syed Mustafa Kamal drew a stark disparity between India's space achievements and the pressing issues faced by Karachi.Kamal, while addressing the Pakistan Parliament on Wednesday, drew attention to India's successful Chandrayaan-3 mission, juxtaposing it with the tragic incidents of children losing their lives due to open gutters in Karachi.""Today, the condition in Karachi is that, while the world is going to the moon, children are dying by falling into gutter in Karachi. On the same screen, there is news that India landed on the moon, and just after two seconds, the news is that a child died in an open gutter in Karachi,"" Kamal said.Highlighting the scarcity of fresh water in Karachi and the staggering number of children deprived of education, Kamal emphasized the urgent need for attention to Karachi's infrastructure and social welfare. The MQM-P leader also said citing a report that there are 70 lakh children in Karachi and over 2.6 crore children in Pakistan, who are not able to go to schools.""Karachi is the revenue engine of Pakistan. The two seaports operational in Pakistan since its inception, are both in Karachi. We (Karachi) are the gateway to the entire Pakistan, Central Asia to Afghanistan...For 15 years, Karachi was not given even a bit of fresh water. Even the water that came, the tanker mafia hoarded it and sold it to the people of Karachi,"" Kamal said.""We have a total of 48,000 schools, but a new report says that out of that 11,000 are 'ghost schools'. 70 lakh children in Sindh don't go to school and a total of 2,62,00,000 children in the country don't go to school...if we just focus on this, the leaders of the country shouldn't even get proper sleep,"" the Pakistani Parliamentarian added.Kamal also criticized the neglect of Karachi's development despite its pivotal role as Pakistan's economic powerhouse. He condemned the failure to provide basic amenities such as fresh water, which has exacerbated the city's challenges.Meanwhile, Pakistan is grappling with economic hardships, including high inflation and mounting debt. The government has sought a new loan program from the International Monetary Fund (IMF) to address these pressing issues. Talks between Pakistan and the IMF are underway, with the IMF urging Islamabad to implement comprehensive reforms in the energy sector and tax system.Last month, Pakistan completed a short-term $3 billion program, that helped stave off sovereign default, however, the government has highlighted the need for a fresh, longer-term program, according to Dawn.","Pakistani lawmaker drew a stark disparity between India's space achievements and the pressing issues faced by Karachi. Syed Mustafa Kamal emphasized the urgent need for attention to Karachi's infrastructure and social welfare. He condemned the failure to provide basic amenities such as fresh water, which has exacerbated the city's challenges.","https://static.toiimg.com/thumb/msid-110162494,imgsize-21880,width-400,resizemode-4/110162494.jpg"
"Pakistanis own 23,000 properties worth $11 billion in Dubai, reveal property leaks",https://timesofindia.indiatimes.com/world/pakistan/pakistanis-own-23000-properties-worth-11-billion-in-dubai-reveal-property-leaks/articleshow/110156743.cms,"ISLAMABAD: Prominent Pakistani politicians, retired generals, bureaucrats, bankers and money launderers have been named in the latest property leaks containing details of individuals who own residential properties in upscale areas of Dubai. The combined value of these properties is around $11 billion.“Dubai Unlocked”, an investigative project by over 70 media outlets around the globe, has revealed ownership of hundreds of properties of prominent global figures, including corrupt politicians,money launderers and drug lords, in Dubai.The data covers records of residential properties from 2020 till 2022.Among an estimated 17,000 Pakistanis listed in the leaksowning 23,000 properties in Dubaiare President Asif Ali Zardari’s three children, two of whom are members of the National Assembly, former PM Nawaz Sharif’s son Hussain Nawaz, home (interior) minister Mohsin Naqvi’s wife, and several national and provincial lawmakers.While Zardari’s elder daughter, Bakhtawar Bhutto-Zardari, is a Dubai resident, his son, Bilawal Bhutto-Zardari, and daughter, Aseefa Bhutto-Zardari, were listed as owners of four properties. Through her lawyers, Aseefa said that all assets owned by her in Dubai have been duly declared to the relevant authorities in Pakistan, including the electoral watchdog.The Pakistani list also features the late former military ruler Pervez Musharraf, former PM Shaukat Aziz, ex-army chief Qamar Javed Bajwa’s son, and more than a dozen retired army generals as well as a police chief, an ambassador and a scientist, all of whom owned properties either directly or through their spouses and children.The Altaf Khanani network, which was sanctioned by the US for involvement in money laundering, has also surfaced in the leaks. Moving illicit funds for organised crime groups, including drug cartels and violent terrorist organisations, the network raked in an estimated turnover of between $14 billion and $16 billion annually. Altaf Khanani, the international face of the organisation, was ultimately convicted and spent nearly six years in a US prison; he was blacklisted by the US on money-laundering charges along with his son, Obaid Khanani, and nephew, Hozaifa Khanani. In Dubai, a country where, reportedly, investing in real estate with bags of cash raises few questions, the Khananis are listed owners of a massive real estate portfolio. Obaid himself is linked to around 30 properties, while the family as a whole were listed owners of 85 properties in early 2020, including around a dozen villas.Notably, several Pakistani families involved in politics and business were absent from the data, despite it being well known that they have bases and family residences in Dubai. This underscores that although the data is solid, it is neither a historical record of property ownership nor a comprehensive representation of all properties purchased by Pakistanis in Dubai . Many owners, according to data, still remain undetected, especially those who purchased property via a third party, or lesser-known company.","Among an estimated 17,000 Pakistanis listed in the leaks are President Asif Ali Zardari’s three children, two of whom are members of the National Assembly. The Altaf Khanani network, which was sanctioned by the US for involvement in money laundering, has also surfaced.","https://static.toiimg.com/thumb/msid-110156737,imgsize-259958,width-400,resizemode-4/110156737.jpg"
Former Pakistan PM Imran Khan gets bail in graft case,https://timesofindia.indiatimes.com/world/pakistan/imran-khan-pakistan-bail-graft-case-land-corruption-case-islamabad-court/articleshow/110151891.cms,"NEW DELHI: Pakistan 's former prime minister Imran Khan was granted bail by Islamabad High Court (IHC) on Wednesday in a land corruption case.The ex-cricketer faced charges of receiving land from a real estate developer while serving as prime minister, allegedly in exchange for unlawful favors.A day prior, a two-member bench, consisting of IHC Chief Justice Aamer Farooq and Justice Tariq Mehmood Jahangiri, had reserved the verdict after concluding arguments from the National Accountability Bureau (NAB) prosecution team and Sardar Latif Khan Khosa, Imran's counsel, Dawn reported.Today, the court announced Imran's bail at Rs 1 million. However, he remains incarcerated as he is serving sentences in the cipher and iddat cases. Notably, his sentences in two distinct Toshakhana cases were suspended by the IHC.During Tuesday's court session, NAB Special Prosecutor Amjad Pervaiz had indicated that the trial of the former premier and his spouse was nearing completion in his closing remarks.Last December, the National Accountability Bureau launched an inquiry against Pakistan Tehreek-e-Insaf (PTI) founder Khan, his wife Bushra Bibi, and others, regarding the alleged acquisition of numerous acres of land under the guise of Al Qadir University Trust. This purportedly resulted in a reported loss of 190 million pounds to the national treasury.In a bail petition filed in November of the same year, Khan asserted that the NAB, allegedly acting as a tool of the previous Pakistan Democratic Movement (PDM) government, was politically targeting him through this case, as per Dawn.The Al-Qadir Trust matter revolves around the settlement of 190 million pounds (approximately Rs 50 billion), transferred to Pakistan by the UK's National Crime Agency following its recovery from a Pakistani real estate magnate. During his tenure as prime minister, Khan opted to allow the businessman to utilize the funds to partially settle a fine of around Rs 450 billion, previously imposed by the Supreme Court, instead of depositing it into the national treasury.","Imran Khan was granted bail by Islamabad High Court (IHC) on Wednesday in a land corruption case. The ex-cricketer faced charges of receiving land from a real estate developer while serving as prime minister. However, he remains incarcerated as he is serving sentences in the cipher and iddat cases.","https://static.toiimg.com/thumb/msid-110151925,imgsize-24226,width-400,resizemode-4/110151925.jpg"
Pakistan boy kills drug addict father for assaulting mother,https://timesofindia.indiatimes.com/world/pakistan/pakistan-boy-kills-drug-addict-father-for-assaulting-mother/articleshow/110145421.cms,"ISLAMABAD: A tragic incident unfolded in Tibba Sultanpur as a 15-year-old boy , driven by rage, took the life of his father , whom he described as a ' drug addict ', for assaulting his mother, ARY News reported.Initially reported as a citizen being gunned down by an 'unknown individual', further investigation revealed the unexpected perpetrator to be the victim's own son, Ali Hassan.The incident, which occurred in the town between Multan and Vehari, stunned the local community.Following diligent scrutiny of CCTV footage, the police swiftly apprehended Ali Hassan, who subsequently confessed to the crime. He recounted how his father, inebriated from alcohol consumption, had subjected his mother to verbal and physical abuse, prompting Ali to take drastic action.The murder weapon was recovered from Ali, and the authorities initiated a thorough investigation into the circumstances surrounding the tragedy.This incident echoes a similar one from April 24, where another family was shattered by violence.In Nankana Sahib, a man named Advocate Sajid was fatally shot, along with his brother, allegedly by his own son, Zain.The confrontation arose after Advocate Sajid reclaimed his car from Zain, leading to a deadly altercation.Law enforcement revealed that the attack occurred as Advocate Sajid and his brother, Waqas, were returning from the court. Zain intercepted them and unleashed gunfire, resulting in the tragic demise of his father and uncle.He then fled the scene with the vehicle, ARY News reported.","Ali Hassan, 15, shot dead his father, who he described as a'drug addict', for assaulting his mother. The incident occurred in Tibba Sultanpur, a town between Multan and Vehari. The murder weapon was recovered from Ali, and the authorities initiated a thorough investigation.","https://static.toiimg.com/thumb/msid-110145509,imgsize-25674,width-400,resizemode-4/110145509.jpg"
"Zardari, Sharif, military generals: Dubai leaks expose billions in property owned by Pakistan's elite",https://timesofindia.indiatimes.com/world/pakistan/zardari-sharif-military-generals-dubai-leaks-expose-billions-in-property-owned-by-pakistans-elite/articleshow/110140243.cms,"NEW DELHI: The Dubai Property Leaks have exposed a significant number of prominent Pakistanis who own high-end properties in Dubai. The leaked data, part of the OCCRP’s Dubai Unlocked project, reveals details of individuals from various sectors like politics, military, banking, and bureaucracy. The leak, which has sent shockwaves through Pakistan , involves over 23,000 properties listed as belonging to Pakistani nationals, as detailed in the ""Dubai Unlocked"" investigation conducted by global media outlets.The investigation, conducted by the Centre for Advanced Defence Studies (C4ADS) and shared with global media outlets, sheds light on hundreds of thousands of properties in Dubai, focusing on ownership details.Among the notable Pakistanis listed in the Property Leaks are President Asif Ali Zardari’s children, Hussain Nawaz Sharif , Interior Minister Mohsin Naqvi’s wife, Sharjeel Memon, Senator Faisal Vawda, and several lawmakers from Sindh and Balochistan assemblies. The list also includes late Gen Pervez Musharraf , former prime minister Shaukat Aziz, retired generals, a police chief, an ambassador, and a scientist, all of whom have owned properties directly or through their spouses and children.Furthermore, the leaks highlight discrepancies in property declarations, such as Interior Minister Mohsin Naqvi’s wife owning a villa in Dubai that was not disclosed in his Senate election nomination papers. The investigation also reveals the involvement of individuals like the Altaf Khanani network, sanctioned for money laundering, and Hamid Mukhtar Shah, a physician involved in criminal activities, as property owners in Dubai.The data reveals properties ranging from studio apartments to lavish six-bedroom villas owned by Pakistan's elite, including political, military, and business figures, across premium locations like Dubai Marina, Emirates Hills, and Palm Jumeirah.The leaked data provides insights into the offshore real estate wealth of Pakistanis, with over 23,000 properties listed as belonging to Pakistani nationals up to the spring of 2022. The data, obtained by C4ADS and shared with media outlets worldwide, does not inherently indicate financial crimes but offers a detailed snapshot of Pakistani investments in Dubai properties during a specific period.The Federal Board of Revenue (FBR) of Pakistan views this revelation as a crucial step toward tackling tax evasion . ""If we have the data you are talking about, as well as the information on residence status, we will make sure those who are eligible to pay tax in Pakistan on rental income or capital value are doing so,"" Malik Amjed Zubair Tiwana, chairman of the FBR, told Dawn. Despite efforts to regulate and recover undeclared assets, responses from Dubai have been limited, due to lack of geopolitical leverage and political stonewalling.The investigation underscores the challenges faced by Pakistan in bringing undeclared assets into the tax net, with Dubai authorities reluctant to share information on Pakistani citizens owning assets in the emirate. The leaked data, a result of multiple leaks and extensive verification by journalists, reveals a complex web of property ownership involving Pakistan’s political, media, military, and business elite.","The Dubai Property Leaks have exposed a significant number of prominent Pakistanis who own high-end properties in Dubai. The leaked data, part of the OCCRP’s Dubai Unlocked project, reveals details of individuals from various sectors like politics, military, banking, and bureaucracy. The leak involves over 23,000 properties listed as belonging to Pakistani nationals.","https://static.toiimg.com/thumb/msid-110140883,imgsize-25348,width-400,resizemode-4/110140883.jpg"
Pak protestors call off march in PoK,https://timesofindia.indiatimes.com/world/pakistan/pak-protestors-call-off-march-in-pok/articleshow/110126325.cms,"ISLAMABAD

: Protesters seeking subsidised wheat flour and reduction in electricity tariffs called off their demonstration in Pakistan-occupied Kashmir (PoK) on Tuesday after days of clashes with police and Rangers, a paramilitary force, in which four people were killed and over 100 injured.The Awami Action Committee (AAC), an alliance of civil rights groups in the region, said the govt has accepted all its demands and called on protesters to return to their homes and businesses.On Monday, Pakistan PM Shehbaz Sharif had approved $82.6-million to help meet most of their demands, which included subsidies on flour and electricity prices.Shaukat Nawaz Mir, the alliance’s head, however, demanded financial compensation for the families of three protesters and a police official who were killed in the violence that lasted for four days. The protesters were killed on Monday evening after the Rangers, en route to Muzaffarabad, opened fire on them when they were attacked, a local govt official said.The recent protests coincided with the visit of an International Monetary Fund (IMF) mission to negotiate a new long-term loan with Pakistan. The global lender has already warned that social unrest triggered by high cost of living could weigh on policy implementation, adding that fiscal slippages could present a challenge for the govt.","Protesters were seeking subsidised wheat flour and reduction in electricity tariffs. Four people were killed and over 100 injured in clashes with police and Rangers, a paramilitary force. Pakistan PM Shehbaz Sharif had approved $82.6-million to help meet most of their demands.","https://static.toiimg.com/thumb/msid-110126353,imgsize-1249773,width-400,resizemode-4/110126353.jpg"
